"Rank","EntryId","EntryName","TimeRemaining","Points","Lineup","X","Player","X.Drafted","FPTS"
455,779074425,"willtex",0,94,"P Ervin Santana P Trevor Bauer OF Charlie Blackmon SS Elvis Andrus OF Shin-soo Choo OF Brett Gardner 1B Joe Mauer 2B Ian Happ 3B Kris Bryant C Yasmani Grandal",NA,"","",NA
456,779143072,"tin8shusd",0,93.75,"P Jacob deGrom P Zack Godley 3B Miguel Sanó C Buster Posey 1B Mitch Moreland 2B Rougned Odor OF Mitch Haniger SS Asdrúbal Cabrera OF Kole Calhoun OF Matt Joyce",NA,"","",NA
457,779166976,"Sumbee (3/4)",0,93.65,"P Jacob deGrom P Trevor Bauer C Gary Sánchez 2B Rougned Odor OF Mark Trumbo OF Jacoby Ellsbury 1B Mark Reynolds 3B Evan Longoria OF Rajai Davis SS Freddy Galvis",NA,"","",NA
457,779180415,"Curt92",0,93.65,"P Alex Wood P John Lackey OF Aaron Judge SS Didi Gregorius OF Joc Pederson OF José Bautista 1B Mitch Moreland 3B Chase Headley 2B Jason Kipnis C Willson Contreras",NA,"","",NA
459,778946213,"Bushman04",0,93.6,"P Alex Wood P Jason Vargas 1B Ryan Zimmerman OF Brett Gardner OF Scott Schebler C Salvador Perez OF Robbie Grossman 2B Javier Báez 3B Matt Davidson SS Tim Beckham",NA,"","",NA
459,779108674,"driv",0,93.6,"P Alex Wood P Jason Vargas OF J.D. Martinez 3B Nicholas Castellanos 1B Miguel Cabrera C Buster Posey 2B Ian Kinsler OF Hunter Pence SS Alexi Amarista OF Austin Slater",NA,"","",NA
461,779084085,"gotch (2/4)",0,93.45,"P Ervin Santana P Marco Estrada 1B Cody Bellinger OF Billy Hamilton OF Andrew McCutchen OF Josh Reddick SS Francisco Lindor C Buster Posey 3B Kris Bryant 2B Josh Harrison",NA,"","",NA
462,778869815,"kgfan1 (1/2)",0,93.2,"P Ervin Santana P Jason Vargas 2B José Altuve 3B Miguel Sanó C Evan Gattis 1B Justin Bour OF Mitch Haniger SS Jorge Polanco OF Avisaíl García OF Byron Buxton",NA,"","",NA
462,779180038,"ematorrespr",0,93.2,"P Ervin Santana P Jason Vargas 3B José Ramírez SS Didi Gregorius OF Andrew Benintendi 2B Ian Happ OF Corey Dickerson 1B Trey Mancini C Tyler Flowers OF Keon Broxton",NA,"","",NA
464,779021323,"jdwills126",0,93.1,"P Ariel Miranda P Matt Garza OF Charlie Blackmon 2B José Altuve OF George Springer 1B Cody Bellinger SS Corey Seager 3B Miguel Sanó C Gary Sánchez OF Khris Davis",NA,"","",NA
465,779047699,"boydman",0,92.95,"P Gerrit Cole P Mike Leake OF George Springer OF Cody Bellinger 1B Freddie Freeman OF Andrew McCutchen SS Trevor Story 2B Whit Merrifield C Buster Posey 3B Kris Bryant",NA,"","",NA
466,779061949,"DERRICK7878 (2/2)",0,92.85,"P Sonny Gray P Jon Gray 3B José Ramírez 2B José Altuve 1B Carlos Santana SS Didi Gregorius OF Domingo Santana OF J.D. Martinez OF Bradley Zimmer C Martín Maldonado",NA,"","",NA
467,779042947,"ROYMUNSON111 (2/2)",0,92.7,"P Trevor Bauer P Ariel Miranda OF Charlie Blackmon OF George Springer 2B Daniel Murphy OF Khris Davis 3B Travis Shaw 1B Eric Thames SS Jean Segura C Buster Posey",NA,"","",NA
468,779064127,"cobenz7974",0,92.65,"P Trevor Bauer P Tanner Roark OF Aaron Judge OF George Springer OF Cody Bellinger 3B Travis Shaw 2B Dustin Pedroia 1B Eric Thames SS Francisco Lindor C Jonathan Lucroy",NA,"","",NA
468,779154207,"ifuseek13 (4/4)",0,92.65,"P Alex Wood P John Lackey OF Charlie Blackmon 3B Nolan Arenado 2B Jonathan Villar SS Trevor Story 1B Mark Reynolds OF Seth Smith OF Carlos González C Russell Martin",NA,"","",NA
470,779038184,"lurchrules18 (2/2)",0,92.6,"P Ervin Santana P Mike Leake OF Aaron Judge C Gary Sánchez 1B Freddie Freeman OF Eric Thames SS Francisco Lindor 2B Ian Happ 3B Kris Bryant OF Mitch Haniger",NA,"","",NA
470,779084626,"BK68 (3/16)",0,92.6,"P Jason Vargas P Zack Godley 1B Paul Goldschmidt OF Raimel Tapia 2B Whit Merrifield OF Lorenzo Cain 3B Eugenio Suárez C Salvador Perez OF Ben Gamel SS Alcides Escobar",NA,"","",NA
472,779067256,"free2playbb20",0,92.55,"P Trevor Bauer P John Lackey OF Charlie Blackmon OF Aaron Judge 3B Nolan Arenado C Gary Sánchez OF Shin-soo Choo 2B Brian Dozier SS Francisco Lindor 1B Miguel Cabrera",NA,"","",NA
473,779024891,"tita300",0,92.4,"P Ervin Santana P Ariel Miranda OF Charlie Blackmon OF George Springer OF Cody Bellinger 2B Jonathan Villar C Buster Posey 3B Kris Bryant SS Orlando Arcia 1B Trey Mancini",NA,"","",NA
473,779040974,"SUNSET76 (11/20)",0,92.4,"P Alex Wood P Trevor Bauer OF Charlie Blackmon OF J.D. Martinez SS Eduardo Escobar 2B Ian Kinsler 1B Mark Reynolds 3B Manny Machado OF Carlos González C James McCann",NA,"","",NA
473,779040986,"SUNSET76 (12/20)",0,92.4,"P Alex Wood P Trevor Bauer OF Charlie Blackmon OF J.D. Martinez SS Eduardo Escobar 2B Ian Kinsler 1B Mark Reynolds 3B Manny Machado OF Carlos González C James McCann",NA,"","",NA
473,779040991,"SUNSET76 (13/20)",0,92.4,"P Alex Wood P Trevor Bauer OF Charlie Blackmon OF J.D. Martinez SS Eduardo Escobar 2B Ian Kinsler 1B Mark Reynolds 3B Manny Machado OF Carlos González C James McCann",NA,"","",NA
473,779040994,"SUNSET76 (14/20)",0,92.4,"P Alex Wood P Trevor Bauer OF Charlie Blackmon OF J.D. Martinez SS Eduardo Escobar 2B Ian Kinsler 1B Mark Reynolds 3B Manny Machado OF Carlos González C James McCann",NA,"","",NA
473,779041010,"SUNSET76 (15/20)",0,92.4,"P Alex Wood P Trevor Bauer OF Charlie Blackmon OF J.D. Martinez SS Eduardo Escobar 2B Ian Kinsler 1B Mark Reynolds 3B Manny Machado OF Carlos González C James McCann",NA,"","",NA
473,779041013,"SUNSET76 (16/20)",0,92.4,"P Alex Wood P Trevor Bauer OF Charlie Blackmon OF J.D. Martinez SS Eduardo Escobar 2B Ian Kinsler 1B Mark Reynolds 3B Manny Machado OF Carlos González C James McCann",NA,"","",NA
473,779041021,"SUNSET76 (17/20)",0,92.4,"P Alex Wood P Trevor Bauer OF Charlie Blackmon OF J.D. Martinez SS Eduardo Escobar 2B Ian Kinsler 1B Mark Reynolds 3B Manny Machado OF Carlos González C James McCann",NA,"","",NA
473,779041025,"SUNSET76 (18/20)",0,92.4,"P Alex Wood P Trevor Bauer OF Charlie Blackmon OF J.D. Martinez SS Eduardo Escobar 2B Ian Kinsler 1B Mark Reynolds 3B Manny Machado OF Carlos González C James McCann",NA,"","",NA
473,779041028,"SUNSET76 (19/20)",0,92.4,"P Alex Wood P Trevor Bauer OF Charlie Blackmon OF J.D. Martinez SS Eduardo Escobar 2B Ian Kinsler 1B Mark Reynolds 3B Manny Machado OF Carlos González C James McCann",NA,"","",NA
483,779067464,"crabboy (1/2)",0,92.25,"P Michael Pineda P Sonny Gray 1B Anthony Rizzo SS Xander Bogaerts 2B Ian Happ 3B Logan Forsythe C Willson Contreras OF Robbie Grossman OF Matt Kemp OF Mallex Smith",NA,"","",NA
484,779088144,"Coubs23",0,92.05,"P Ervin Santana P Gerrit Cole OF Aaron Judge 1B Cody Bellinger SS Xander Bogaerts 2B Jonathan Schoop 3B Jedd Gyorko C Yadier Molina OF Ben Revere OF Chris Marrero",NA,"","",NA
485,779030032,"buchris532 (3/20)",0,92,"P Alex Wood P Mike Leake 1B Logan Morrison OF Michael Brantley OF Lonnie Chisenhall 2B Jonathan Villar SS Orlando Arcia C Manny Piña 3B Evan Longoria OF Mallex Smith",NA,"","",NA
486,779073916,"phatt11959 (4/4)",0,91.75,"P Zack Godley P Tanner Roark OF Charlie Blackmon 1B Joey Votto 2B José Altuve OF Cody Bellinger OF Josh Reddick 3B Manny Machado SS Freddy Galvis C Chris Herrmann",NA,"","",NA
486,779117709,"TurboTim555 (2/2)",0,91.75,"P John Lackey P Doug Fister OF Charlie Blackmon OF Aaron Judge 1B Joey Votto 2B José Altuve SS Corey Seager C Gary Sánchez 3B Travis Shaw OF Andrew Benintendi",NA,"","",NA
488,779137736,"wjhouse (18/20)",0,91.65,"P Zack Godley P John Lackey OF Charlie Blackmon 3B Nolan Arenado C Gary Sánchez 1B Mike Napoli OF Ryan Braun SS Francisco Lindor 2B Rougned Odor OF Mark Trumbo",NA,"","",NA
489,779084627,"BK68 (4/16)",0,91.6,"P Alex Wood P Jason Vargas SS Corey Seager OF Raimel Tapia OF Lorenzo Cain 3B Eugenio Suárez 1B Chase Utley C Mike Zunino OF Jorge Soler 2B Brandon Drury",NA,"","",NA
489,779122957,"rtpa99 (2/2)",0,91.6,"P Gerrit Cole P John Lackey OF Charlie Blackmon 3B Nolan Arenado OF George Springer OF J.D. Martinez C Buster Posey 1B Yonder Alonso SS Orlando Arcia 2B Ian Kinsler",NA,"","",NA
491,779067343,"frankthetank128 (2/3)",0,91.4,"P Jacob deGrom P Ben Lively OF Aaron Judge 3B José Ramírez 2B Daniel Murphy C Gary Sánchez SS Jorge Polanco 1B Matt Davidson OF Kole Calhoun OF Matt Joyce",NA,"","",NA
491,779135028,"dnfracing",0,91.4,"P Zack Godley P Trevor Bauer OF Charlie Blackmon 1B Freddie Freeman OF Ryan Braun SS Francisco Lindor C Buster Posey 3B Kris Bryant OF Corey Dickerson 2B Jason Kipnis",NA,"","",NA
493,779010184,"jerry005",0,91.35,"P Gerrit Cole P Trevor Bauer OF Charlie Blackmon 1B Logan Morrison OF Andrew McCutchen 2B Jonathan Schoop C Stephen Vogt SS Francisco Lindor 3B Evan Longoria OF Keon Broxton",NA,"","",NA
494,779108222,"VaStar",0,91.3,"P Mike Leake P Matt Garza OF Charlie Blackmon OF Aaron Judge 1B Joey Votto OF Cody Bellinger SS Corey Seager 3B Justin Turner C Yadier Molina 2B Ian Happ",NA,"","",NA
495,779034170,"MolsonBrewCrew",0,91.25,"P Ariel Miranda P Edinson Volquez OF Charlie Blackmon 3B Travis Shaw 1B Eric Thames SS Jean Segura C Buster Posey OF José Bautista 2B Ian Happ OF Marcell Ozuna",NA,"","",NA
495,779079929,"SABBATH69",0,91.25,"P Ervin Santana P John Lackey OF Charlie Blackmon 1B Cody Bellinger OF Andrew McCutchen 3B Anthony Rendon 2B Jonathan Villar SS Jean Segura C Buster Posey OF Hunter Pence",NA,"","",NA
497,779006329,"remus444",0,91.15,"P Sonny Gray P Trevor Bauer OF Mookie Betts OF Charlie Blackmon SS Corey Seager 3B Matt Chapman 1B Yonder Alonso 2B Jed Lowrie OF Matt Joyce C Bruce Maxwell",NA,"","",NA
497,779157424,"doorman23 (1/2)",0,91.15,"P Sonny Gray P Trevor Bauer OF George Springer 3B Miguel Sanó SS Didi Gregorius OF Steven Souza Jr. 1B Joey Gallo OF Nomar Mazara 2B Whit Merrifield C Wilson Ramos",NA,"","",NA
499,779107758,"mathofbirds (1/4)",0,91.05,"P Ervin Santana P Gerrit Cole OF Billy Hamilton SS Zack Cozart 2B Jonathan Schoop OF Steven Souza Jr. 3B Kris Bryant OF Melky Cabrera 1B Yuli Gurriel C Welington Castillo",NA,"","",NA
500,779071452,"budaman3195 (2/2)",0,91,"P Ervin Santana P Trevor Bauer 3B Nolan Arenado OF Cody Bellinger 2B Robinson Canó SS Zack Cozart C Buster Posey 1B Mark Reynolds OF Matt Kemp OF Kevin Pillar",NA,"","",NA
500,779097410,"bluminkrzy",0,91,"P Ervin Santana P Trevor Bauer 1B Freddie Freeman 3B Travis Shaw OF Eric Thames SS Zack Cozart OF Brett Gardner 2B Whit Merrifield OF Corey Dickerson C Wilson Ramos",NA,"","",NA
502,779072083,"Vikingjeff14 (3/6)",0,90.75,"P Jacob deGrom P Zack Godley C J.T. Realmuto OF Marcell Ozuna OF Ender Inciarte 1B Matt Carpenter 2B Dee Gordon OF Trey Mancini 3B Manny Machado SS Freddy Galvis",NA,"","",NA
502,779170063,"WarmackAttack (1/2)",0,90.75,"P Ervin Santana P Daniel Norris OF Aaron Judge OF George Springer SS Corey Seager OF Khris Davis 3B Matt Chapman 1B Trey Mancini 2B Javier Báez C Christian Vázquez",NA,"","",NA
502,779178333,"WarmackAttack (2/2)",0,90.75,"P Ervin Santana P Daniel Norris OF Aaron Judge OF George Springer SS Corey Seager OF Khris Davis 3B Matt Chapman 1B Trey Mancini 2B Javier Báez C Christian Vázquez",NA,"","",NA
505,779166395,"goldenguidos",0,90.7,"P Trevor Bauer P Ariel Miranda OF Aaron Judge OF Cody Bellinger SS Corey Seager 3B Miguel Sanó C Gary Sánchez 1B Eric Thames OF Shin-soo Choo 2B Rougned Odor",NA,"","",NA
505,779174592,"namviet",0,90.7,"P Trevor Bauer P Ariel Miranda OF Aaron Judge 1B Cody Bellinger SS Corey Seager OF Scooter Gennett C Gary Sánchez OF Chris Taylor 2B Ian Happ 3B Kris Bryant",NA,"","",NA
507,779066459,"Calvin19691969 (4/10)",0,90.55,"P Trevor Bauer P John Lackey OF Mookie Betts OF Charlie Blackmon 3B Nolan Arenado OF Ryan Braun SS Jean Segura 1B Miguel Cabrera C Buster Posey 2B José Pirela",NA,"","",NA
507,779164191,"ocsdawg (3/4)",0,90.55,"P Gerrit Cole P Doug Fister OF Aaron Judge 2B José Altuve C Gary Sánchez OF Khris Davis OF Ryan Braun SS Andrelton Simmons 1B Ryan Zimmerman 3B Evan Longoria",NA,"","",NA
509,779017697,"Jshep535 (3/4)",0,90.4,"P Ervin Santana P Matt Garza 3B José Ramírez 1B Edwin Encarnacion C Gary Sánchez 2B Dustin Pedroia SS Xander Bogaerts OF Michael Brantley OF Lonnie Chisenhall OF Ian Happ",NA,"","",NA
509,779060770,"rdamer (1/2)",0,90.4,"P Alex Wood P Trevor Bauer 3B Miguel Sanó OF Eric Thames 2B Brian Dozier 1B Joey Gallo SS Eduardo Escobar C Salvador Perez OF Jorge Bonifacio OF Jorge Soler",NA,"","",NA
511,779011779,"keithmathwhizz",0,90.35,"P Gerrit Cole P Trevor Bauer OF Charlie Blackmon SS Corey Seager OF Eric Thames 2B Jonathan Schoop C Buster Posey 3B Kris Bryant OF Corey Dickerson 1B Kendrys Morales",NA,"","",NA
512,779066465,"Calvin19691969 (10/10)",0,90.15,"P Mike Leake P John Lackey OF Charlie Blackmon 3B Nolan Arenado 2B José Altuve OF George Springer SS Corey Seager OF Ryan Braun 1B Miguel Cabrera C Buster Posey",NA,"","",NA
512,779083665,"matt514tx",0,90.15,"P Sonny Gray P Trevor Bauer OF Aaron Judge 1B Logan Morrison OF Khris Davis SS Chris Owings 3B Kris Bryant C Salvador Perez OF Matt Kemp 2B Brandon Phillips",NA,"","",NA
514,779088684,"princesssnowball",0,90,"P Jon Gray P Trevor Bauer 3B Nolan Arenado C Gary Sánchez OF Ryan Braun OF Andrew McCutchen SS Xander Bogaerts OF Andrew Benintendi 2B Rougned Odor 1B Mark Reynolds",NA,"","",NA
515,779004649,"priz365 (1/2)",0,89.85,"P Ervin Santana P Sonny Gray OF Aaron Judge C Gary Sánchez OF Khris Davis 1B Freddie Freeman 3B Maikel Franco 2B Brandon Phillips OF Nick Williams SS Brandon Crawford",NA,"","",NA
515,779017322,"Jshep535 (2/4)",0,89.85,"P Ervin Santana P Sonny Gray 1B Edwin Encarnacion OF Andrew McCutchen 3B Adrián Béltre OF Nomar Mazara 2B Ian Kinsler C Willson Contreras OF Daniel Nava SS Freddy Galvis",NA,"","",NA
517,779184230,"paulca21",0,89.7,"P Trevor Bauer P Ariel Miranda 3B Nolan Arenado 2B José Ramírez OF George Springer C Gary Sánchez OF Josh Reddick OF Andrew Benintendi 1B Marwin González SS Orlando Arcia",NA,"","",NA
518,779011220,"godrod411",0,89.6,"P Gerrit Cole P John Lackey OF Charlie Blackmon 3B Nolan Arenado OF Ryan Braun SS Xander Bogaerts OF J.D. Martinez 1B Miguel Cabrera C Buster Posey 2B Ian Kinsler",NA,"","",NA
519,779055598,"LakeSports",0,89.55,"P Jon Gray P Edinson Volquez 3B Nolan Arenado OF George Springer OF Cody Bellinger 1B Justin Smoak SS Zack Cozart 2B Jonathan Schoop OF J.D. Martinez C Buster Posey",NA,"","",NA
519,779079593,"QuestionMarks (2/2)",0,89.55,"P Ervin Santana P Edinson Volquez OF Charlie Blackmon OF Aaron Judge 3B Nolan Arenado 2B Jonathan Schoop SS Jean Segura 1B José Abreu OF Melky Cabrera C Kevan Smith",NA,"","",NA
521,779128328,"babombers",0,89.4,"P Alex Wood P Trevor Bauer C Gary Sánchez 3B Travis Shaw 1B Brandon Belt SS Orlando Arcia OF Yasiel Puig 2B Eric Sogard OF Carlos González OF Keon Broxton",NA,"","",NA
522,779137733,"wjhouse (15/20)",0,89.25,"P Sonny Gray P Zack Godley 1B Justin Smoak OF Khris Davis SS Andrelton Simmons 2B Jonathan Villar 3B Nicholas Castellanos OF Mark Trumbo C Welington Castillo OF Adam Jones",NA,"","",NA
523,779027880,"MayhemLikeMe27",0,89.2,"P Ervin Santana P Jason Vargas 3B José Ramírez OF J.D. Martinez 1B Lucas Duda OF Eddie Rosario OF Lorenzo Cain C Salvador Perez SS Asdrúbal Cabrera 2B Greg Garcia",NA,"","",NA
523,779111599,"rosoce1244",0,89.2,"P Ervin Santana P Jason Vargas SS Corey Seager 1B Eric Hosmer OF Jay Bruce 3B Kris Bryant 2B Ian Kinsler OF Daniel Nava OF Matt Kemp C Tyler Flowers",NA,"","",NA
525,779143792,"LOVE2FCK",0,89.1,"P Alex Wood P Ervin Santana OF Billy Hamilton OF Nomar Mazara 1B Kennys Vargas OF Derek Fisher SS Asdrúbal Cabrera C Wilson Ramos 3B Maikel Franco 2B José Peraza",NA,"","",NA
526,778900185,"MatthewBee",0,89,"P Jon Gray P Trevor Bauer OF Aaron Judge 1B Cody Bellinger C Gary Sánchez SS Didi Gregorius OF Brett Gardner OF Corey Dickerson 3B Evan Longoria 2B Ben Zobrist",NA,"","",NA
527,779132297,"IRhowie2 (4/4)",0,88.8,"P Alex Wood P Ariel Miranda 3B Miguel Sanó OF Andrew McCutchen SS Franklin Barreto OF Max Kepler OF Ian Happ C Willson Contreras 1B Yuli Gurriel 2B Javier Báez",NA,"","",NA
527,779162384,"WadeMan2424",0,88.8,"P Sonny Gray P Parker Bridwell OF Charlie Blackmon 1B Joey Votto 2B Daniel Murphy 3B Justin Turner SS Didi Gregorius OF Chris Owings C J.T. Realmuto OF Robbie Grossman",NA,"","",NA
529,779072158,"Vikingjeff14 (4/6)",0,88.7,"P Ariel Miranda P Scott Feldman OF Charlie Blackmon 3B Nolan Arenado 2B José Altuve OF George Springer 1B Cody Bellinger SS Corey Seager C Evan Gattis OF Justin Upton",NA,"","",NA
530,779014880,"maygi557 (3/4)",0,88.5,"P Jason Vargas P Trevor Bauer 2B José Altuve OF George Springer 3B Travis Shaw OF Andrew Benintendi OF Jackie Bradley Jr. C Manny Piña 1B Yuli Gurriel SS Freddy Galvis",NA,"","",NA
530,779018457,"maygi557 (4/4)",0,88.5,"P Jason Vargas P Trevor Bauer 2B José Altuve OF George Springer 3B Travis Shaw OF Andrew Benintendi OF Jackie Bradley Jr. C Manny Piña 1B Yuli Gurriel SS Freddy Galvis",NA,"","",NA
532,779006317,"LuMaleck (3/4)",0,88.4,"P Zack Godley P Trevor Bauer OF Bryce Harper 2B Daniel Murphy SS Didi Gregorius OF J.D. Martinez 3B Jake Lamb C J.T. Realmuto OF Marcell Ozuna 1B Mark Reynolds",NA,"","",NA
532,779024106,"YankinFla",0,88.4,"P Trevor Bauer OF Aaron Judge OF Bryce Harper 1B Eric Thames OF Corey Dickerson 2B Ian Kinsler C Salvador Perez 3B Chase Headley SS Troy Tulowitzki P Joe Musgrove",NA,"","",NA
532,779090746,"bamagirl139",0,88.4,"P Zack Godley P Trevor Bauer OF Charlie Blackmon OF Aaron Judge OF Ryan Braun 2B Dustin Pedroia 1B Miguel Cabrera 3B Kris Bryant SS Orlando Arcia C Francisco Cervelli",NA,"","",NA
532,779135504,"feddy18",0,88.4,"P Michael Pineda P Trevor Bauer 1B Logan Morrison C Gary Sánchez OF Khris Davis OF Shin-soo Choo 2B Rougned Odor 3B Kris Bryant SS Alcides Escobar OF Mallex Smith",NA,"","",NA
536,779038382,"coach421",0,88.35,"P Gerrit Cole P Trevor Bauer OF Aaron Judge 1B Cody Bellinger 3B Justin Turner SS Xander Bogaerts OF Chris Taylor 2B Logan Forsythe C Manny Piña OF Clint Frazier",NA,"","",NA
536,779141129,"mgdeal (2/2)",0,88.35,"P Jason Vargas P Sonny Gray OF Andrew McCutchen 1B Eric Thames 2B Jonathan Schoop C Buster Posey OF Giancarlo Stanton 3B Kris Bryant OF Adam Jones SS Tim Beckham",NA,"","",NA
538,779010491,"paulrules2016",0,88,"P Alex Wood P Mike Leake OF Mookie Betts OF Tommy Pham 1B Eric Thames OF Brett Gardner C Buster Posey 2B Ian Happ SS Jorge Polanco 3B Miguel Andújar",NA,"","",NA
538,779140501,"Destined418",0,88,"P Jon Gray P Trevor Bauer OF George Springer SS Corey Seager 3B Travis Shaw OF Andrew McCutchen OF Andrew Benintendi 2B Logan Forsythe C Willson Contreras 1B Yuli Gurriel",NA,"","",NA
538,779183434,"YoDoggs",0,88,"P Jon Gray P Trevor Bauer OF Aaron Judge C Gary Sánchez SS Didi Gregorius OF J.D. Martinez 3B Nicholas Castellanos OF Justin Upton 1B Miguel Cabrera 2B Ian Kinsler",NA,"","",NA
538,779183906,"spotdaddy226",0,88,"P Ervin Santana P Trevor Bauer 1B Edwin Encarnacion OF Khris Davis OF Andrew McCutchen SS Xander Bogaerts OF José Bautista 3B Kris Bryant C Willson Contreras 2B Dee Gordon",NA,"","",NA
542,779043520,"jimiobo43 (5/6)",0,87.9,"P Daniel Norris P Jaime García OF Mookie Betts OF Cody Bellinger 1B Justin Smoak OF Scooter Gennett 2B Robinson Canó SS Xander Bogaerts 3B Adrián Béltre C Salvador Perez",NA,"","",NA
542,779162692,"waxfactor",0,87.9,"P Trevor Bauer P Mike Leake OF Aaron Judge OF George Springer C Gary Sánchez OF Andrew McCutchen SS Didi Gregorius 1B Hanley Ramirez 2B Jonathan Schoop 3B Kris Bryant",NA,"","",NA
544,779000855,"cowpacs",0,87.85,"P Doug Fister OF George Springer OF Cody Bellinger SS Corey Seager 3B Mike Moustakas 2B Dustin Pedroia 1B Ryan Zimmerman OF Brett Gardner C Salvador Perez P Brad Peacock",NA,"","",NA
545,779055787,"corky21502 (1/2)",0,87.6,"P Alex Wood P Doug Fister OF George Springer 2B Daniel Murphy 1B Logan Morrison SS Didi Gregorius OF Steven Souza Jr. OF Justin Upton 3B Chase Headley C Austin Romine",NA,"","",NA
545,779093385,"sinister1985c10 (4/4)",0,87.6,"P Ervin Santana P Mike Leake 1B Paul Goldschmidt OF Nelson Cruz SS Zack Cozart OF Andrew Benintendi OF J.D. Martinez 3B Jake Lamb C Buster Posey 2B Ian Happ",NA,"","",NA
545,779107226,"neilhe (5/8)",0,87.6,"P Alex Wood P Jason Vargas OF J.D. Martinez 1B Wil Myers OF Nomar Mazara 3B Eduardo Escobar C Willson Contreras OF Adam Jones 2B José Pirela SS Addison Russell",NA,"","",NA
548,779047939,"Colbo0505",0,87.4,"P Alex Wood P Trevor Bauer 3B Miguel Sanó OF Ryan Braun 2B Brian Dozier OF Corey Dickerson C Manny Piña 1B Yuli Gurriel SS Freddy Galvis OF Adam Jones",NA,"","",NA
549,779129552,"IRhowie2 (3/4)",0,87.2,"P Sonny Gray P Gerrit Cole 3B Miguel Sanó OF Andrew McCutchen OF Max Kepler OF Ian Happ C Willson Contreras 1B Yuli Gurriel 2B Javier Báez SS Tzu-Wei Lin",NA,"","",NA
550,778997311,"Chauxthyme23",0,87.15,"P Doug Fister P Parker Bridwell OF Mookie Betts OF Aaron Judge 1B Joey Votto 3B Nolan Arenado 2B José Ramírez C Gary Sánchez SS Xander Bogaerts OF Eric Thames",NA,"","",NA
550,779039405,"NelsonP204",0,87.15,"P Sonny Gray P Trevor Bauer 3B Miguel Sanó 1B Logan Morrison OF Ryan Braun OF Andrew McCutchen OF Carlos Gómez 2B Ian Happ SS Eduardo Escobar C Manny Piña",NA,"","",NA
550,779066462,"Calvin19691969 (7/10)",0,87.15,"P Mike Leake P John Lackey OF Mookie Betts 3B Nolan Arenado 2B José Altuve OF George Springer SS Corey Seager OF J.D. Martinez 1B Miguel Cabrera C Buster Posey",NA,"","",NA
550,779066463,"Calvin19691969 (8/10)",0,87.15,"P Mike Leake P John Lackey OF Mookie Betts 3B Nolan Arenado 2B José Altuve OF George Springer SS Corey Seager OF Ryan Braun 1B Miguel Cabrera C Buster Posey",NA,"","",NA
554,778985631,"McGreevy",0,87.05,"P Zack Godley P Parker Bridwell OF Mookie Betts 1B Joey Votto 2B Daniel Murphy C Gary Sánchez 3B Travis Shaw SS Didi Gregorius OF Corey Dickerson OF Manuel Margot",NA,"","",NA
554,779094775,"buchris532 (17/20)",0,87.05,"P Ervin Santana P Gerrit Cole 3B Miguel Sanó OF Ryan Braun C Evan Gattis OF Max Kepler OF Ian Happ SS Orlando Arcia 1B Yuli Gurriel 2B Ben Zobrist",NA,"","",NA
554,779141566,"chillyred (2/3)",0,87.05,"P Alex Wood P Parker Bridwell OF Cody Bellinger 3B Travis Shaw OF Ryan Braun 1B Eric Thames 2B Jonathan Schoop C Stephen Vogt SS Orlando Arcia OF Trey Mancini",NA,"","",NA
557,779090436,"spinalzo (2/2)",0,87,"P Alex Wood P Mike Leake OF Mookie Betts 2B Daniel Murphy SS Xander Bogaerts 1B Marwin González 3B Evan Longoria OF Carlos González OF Jake Marisnick C Ryan Hanigan",NA,"","",NA
557,779136200,"keniff (5/8)",0,87,"P Michael Pineda P Mike Leake OF Aaron Judge OF Tommy Pham 1B Hanley Ramirez 3B Kris Bryant OF Lorenzo Cain SS Orlando Arcia 2B Ian Kinsler C Salvador Perez",NA,"","",NA
557,779185294,"boobie727 (7/7)",0,87,"P Ervin Santana P Trevor Bauer 1B Paul Goldschmidt OF Adam Duvall C Gary Sánchez OF Ryan Braun SS Francisco Lindor 3B Kris Bryant 2B Javier Báez OF Albert Almora Jr.",NA,"","",NA
560,779118745,"TDKINGS",0,86.85,"P Jacob deGrom P Jason Vargas 3B Mike Moustakas 1B Eric Hosmer SS Francisco Lindor OF Justin Upton 2B Whit Merrifield OF Jorge Soler OF Byron Buxton C Jeff Mathis",NA,"","",NA
560,779131916,"brabbitusmc",0,86.85,"P Sonny Gray P Jon Gray OF George Springer SS Didi Gregorius OF Andrew Benintendi OF Raimel Tapia 2B DJ LeMahieu 3B Hernán Pérez 1B Yonder Alonso C Manny Piña",NA,"","",NA
562,779057945,"parisi.64p (1/2)",0,86.75,"P Trevor Bauer P Marco Estrada 1B Paul Goldschmidt 3B José Ramírez 2B Scooter Gennett OF Ryan Braun SS Didi Gregorius OF Nelson Cruz OF Michael Brantley C Yasmani Grandal",NA,"","",NA
562,779088031,"BuffyCheddy",0,86.75,"P Jacob deGrom P Zack Godley OF Marwin González 2B Whit Merrifield OF Marcell Ozuna 3B Kris Bryant SS Orlando Arcia OF Manuel Margot 1B Yuli Gurriel C Kevan Smith",NA,"","",NA
564,779018393,"neilhe (1/8)",0,86.7,"P Gerrit Cole P Tanner Roark OF Charlie Blackmon 1B Edwin Encarnacion OF Ryan Braun SS Didi Gregorius 3B Nicholas Castellanos 2B Rougned Odor OF Corey Dickerson C Willson Contreras",NA,"","",NA
565,779093363,"ecreston",0,86.65,"P Jacob deGrom P Trevor Bauer 3B Adrián Béltre 1B José Abreu C Buster Posey OF José Bautista OF Ian Happ OF Jacoby Ellsbury SS Troy Tulowitzki 2B José Pirela",NA,"","",NA
566,779061532,"ADavis1987",0,86.6,"P Ervin Santana P Mike Leake 1B Paul Goldschmidt 3B José Ramírez SS Andrelton Simmons OF Tommy Pham C Yadier Molina OF Cameron Maybin 2B Dee Gordon OF Jarrod Dyson",NA,"","",NA
566,779149842,"mathofbirds (4/4)",0,86.6,"P Jason Vargas P Zack Godley OF Andrew McCutchen SS Andrelton Simmons OF Eric Thames 1B Marwin González 2B Whit Merrifield OF Cameron Maybin C Salvador Perez 3B Yunel Escobar",NA,"","",NA
568,779137055,"justomatik",0,86.55,"P Sonny Gray P Matt Garza OF Mookie Betts OF Charlie Blackmon OF Aaron Judge 2B Jonathan Villar 1B Alex Avila 3B Chase Headley SS Jordy Mercer C Jonathan Lucroy",NA,"","",NA
569,779004583,"ttmshaunkerr",0,86.45,"P Gerrit Cole P Zack Godley 1B Mike Napoli 3B Travis Shaw OF Shin-soo Choo 2B Brian Dozier OF Max Kepler OF Eddie Rosario SS Orlando Arcia C Jason Castro",NA,"","",NA
570,778987284,"lot49lah",0,86.4,"P Trevor Bauer OF Aaron Judge 1B Joey Votto OF Bryce Harper 3B Travis Shaw SS Elvis Andrus OF Melky Cabrera C Brian McCann 2B Greg Garcia P Joe Musgrove",NA,"","",NA
571,779134267,"mrdung4232 (1/2)",0,86.25,"P Sonny Gray P Zack Godley 3B Travis Shaw OF Ryan Braun 1B Eric Thames 2B Jonathan Schoop OF Andrew Benintendi SS Franklin Barreto OF Jackie Bradley Jr. C Bruce Maxwell",NA,"","",NA
572,779137729,"wjhouse (11/20)",0,86.2,"P Jason Vargas P Jon Gray 2B José Altuve SS Corey Seager OF Ryan Braun OF Shin-soo Choo OF Justin Upton C Buster Posey 3B Eugenio Suárez 1B Albert Pujols",NA,"","",NA
573,779028122,"chrisvance26",0,86,"P Ervin Santana P Trevor Bauer OF Billy Hamilton OF Khris Davis 1B Eric Thames OF J.D. Martinez C Evan Gattis 2B Ian Happ SS Eduardo Escobar 3B Eugenio Suárez",NA,"","",NA
574,779087537,"buchris532 (13/20)",0,85.95,"P Gerrit Cole P Mike Leake OF Aaron Judge 3B Miguel Sanó 1B Anthony Rizzo C Gary Sánchez OF Max Kepler OF Ian Happ SS Eduardo Escobar 2B Ben Zobrist",NA,"","",NA
