"Rank","EntryId","EntryName","TimeRemaining","Points","Lineup","X","Player","X.Drafted","FPTS"
695,779100448,"wcsears18",0,74.75,"P Sonny Gray P Mike Leake OF Aaron Judge OF Bryce Harper 1B Cody Bellinger OF Andrew McCutchen 2B Ian Happ 3B Kris Bryant C Jason Castro SS Troy Tulowitzki",NA,"","",NA
696,779082175,"stebrin",0,74.7,"P Trevor Bauer P Ariel Miranda OF Mookie Betts OF George Springer 3B Miguel Sanó 1B Anthony Rizzo OF Andrew McCutchen SS Elvis Andrus 2B Jonathan Schoop C Brian McCann",NA,"","",NA
696,779108126,"Dope_Smokin_DJs (1/5)",0,74.7,"P Sonny Gray P Edinson Volquez 1B Joey Votto C Gary Sánchez OF Ryan Braun OF Andrew McCutchen SS Xander Bogaerts 2B Jonathan Schoop OF Nomar Mazara 3B Evan Longoria",NA,"","",NA
698,779154453,"jcbu",0,74.55,"P Jason Vargas P Gerrit Cole 3B José Ramírez OF Cody Bellinger 1B Ryan Zimmerman SS Francisco Lindor 2B Ian Kinsler C Salvador Perez OF Bradley Zimmer OF Avisaíl García",NA,"","",NA
699,779088494,"ecalloway89",0,74.45,"P Mike Leake P Edinson Volquez 1B Joey Votto 3B Nolan Arenado OF Adam Duvall 2B José Altuve OF Scooter Gennett C Gary Sánchez SS Francisco Lindor OF Matt Kemp",NA,"","",NA
700,779168937,"dannymarraro",0,74.4,"P Daniel Norris P Tanner Roark OF Charlie Blackmon 1B Joey Votto 2B Daniel Murphy 3B Justin Turner SS Xander Bogaerts OF J.D. Martinez C Salvador Perez OF Ben Gamel",NA,"","",NA
701,779085502,"keniff (1/8)",0,74.35,"P Jason Vargas P Sonny Gray OF Cody Bellinger 3B Travis Shaw OF Andrew Benintendi 2B Whit Merrifield OF Carlos Gómez C Manny Piña 1B Yuli Gurriel SS Tim Beckham",NA,"","",NA
701,779096326,"luckyleo_101 (1/2)",0,74.35,"P Jason Vargas P Sonny Gray OF Aaron Judge C Gary Sánchez 2B Ian Happ 3B Chase Headley OF Ben Zobrist 1B Kendrys Morales SS Addison Russell OF Albert Almora Jr.",NA,"","",NA
701,779098978,"luckyleo_101 (2/2)",0,74.35,"P Jason Vargas P Sonny Gray OF Aaron Judge C Gary Sánchez 2B Ian Happ 3B Chase Headley OF Ben Zobrist 1B Kendrys Morales SS Addison Russell OF Albert Almora Jr.",NA,"","",NA
704,779074375,"bob1016 (1/3)",0,74.2,"P Ervin Santana P Jason Vargas OF J.D. Martinez 3B Adrián Béltre SS Francisco Lindor OF Jay Bruce OF Justin Upton 2B Ian Kinsler C Manny Piña 1B Trey Mancini",NA,"","",NA
704,779074376,"bob1016 (2/3)",0,74.2,"P Ervin Santana P Jason Vargas OF J.D. Martinez 3B Adrián Béltre SS Francisco Lindor OF Jay Bruce OF Justin Upton 2B Ian Kinsler C Manny Piña 1B Trey Mancini",NA,"","",NA
704,779074380,"bob1016 (3/3)",0,74.2,"P Ervin Santana P Jason Vargas OF J.D. Martinez 3B Adrián Béltre SS Francisco Lindor OF Jay Bruce OF Justin Upton 2B Ian Kinsler C Manny Piña 1B Trey Mancini",NA,"","",NA
707,779098948,"Cipherwolf",0,74.05,"P Trevor Bauer P Daniel Norris OF Charlie Blackmon 1B Joey Votto 3B Nolan Arenado OF George Springer SS Zack Cozart OF Steven Souza Jr. 2B José Peraza C Kevan Smith",NA,"","",NA
708,779163944,"Mialiv",0,73.7,"P Sonny Gray P Edinson Volquez OF Aaron Judge OF Bryce Harper 1B Edwin Encarnacion SS Didi Gregorius OF Steven Souza Jr. 3B Kris Bryant C Willson Contreras 2B Dee Gordon",NA,"","",NA
709,779118968,"jhc1532 (2/2)",0,73.65,"P Daniel Norris P Mike Leake OF Mookie Betts 2B José Altuve OF George Springer 3B Miguel Sanó C Gary Sánchez 1B Eric Thames OF Marcell Ozuna SS Asdrúbal Cabrera",NA,"","",NA
710,779024578,"Chris_fdog",0,73.6,"P Michael Pineda P Jason Vargas SS Corey Seager OF Cameron Maybin OF Carlos Gómez OF Ian Happ 3B Kris Bryant 2B Ian Kinsler C Tyler Flowers 1B Albert Pujols",NA,"","",NA
710,779066373,"thebracketman",0,73.6,"P Alex Wood P Jason Vargas OF Justin Upton 1B Yonder Alonso OF Robbie Grossman OF Gregory Polanco 3B Evan Longoria 2B Dee Gordon C Yasmani Grandal SS Freddy Galvis",NA,"","",NA
710,779135102,"crippledframers",0,73.6,"P Alex Wood P Jason Vargas 1B Cody Bellinger OF Eric Thames OF Jay Bruce 3B Evan Longoria OF Adam Jones 2B José Pirela C Tucker Barnhart SS Stephen Drew",NA,"","",NA
713,779073236,"phatt11959 (2/4)",0,73.5,"P Jason Vargas P Trevor Bauer OF Aaron Judge 2B Daniel Murphy OF Ryan Braun OF Andrew McCutchen 1B José Abreu 3B Josh Harrison C Yasmani Grandal SS Erick Aybar",NA,"","",NA
713,779173829,"joseph2524213",0,73.5,"P Michael Pineda OF Aaron Judge 2B Daniel Murphy 3B Kris Bryant OF Corey Dickerson 1B Yonder Alonso SS Orlando Arcia OF Ender Inciarte C Austin Romine P Joe Musgrove",NA,"","",NA
715,779138402,"Drbillb",0,73.4,"P Ervin Santana P Matt Garza C Gary Sánchez OF Khris Davis 3B Travis Shaw OF Ryan Braun OF Andrew McCutchen 1B Ryan Zimmerman 2B Whit Merrifield SS Orlando Arcia",NA,"","",NA
716,779165893,"jswift321",0,73.35,"P Jason Vargas P Sonny Gray 3B José Ramírez OF Andrew McCutchen OF Steven Souza Jr. OF Marwin González C Buster Posey 1B Kendrys Morales 2B Brandon Phillips SS Javier Báez",NA,"","",NA
717,779180165,"cbeckler",0,73.2,"P Jason Vargas P Jon Gray 2B José Altuve 1B Freddie Freeman 3B Justin Turner OF Andrew McCutchen OF Andrew Benintendi C J.T. Realmuto SS Freddy Galvis OF Nick Williams",NA,"","",NA
718,779107559,"neilhe (6/8)",0,73.15,"P Sonny Gray P Trevor Bauer OF Charlie Blackmon 1B Edwin Encarnacion OF J.D. Martinez 3B Nicholas Castellanos C Buster Posey SS Eduardo Escobar 2B Ian Kinsler OF Carlos González",NA,"","",NA
718,779122687,"IRhowie2 (2/4)",0,73.15,"P Sonny Gray P Trevor Bauer 3B Miguel Sanó OF Andrew McCutchen OF Max Kepler OF Ian Happ SS Orlando Arcia C Willson Contreras 1B Yuli Gurriel 2B Javier Báez",NA,"","",NA
720,779123746,"JoeyFootball22 (1/2)",0,73.1,"P Jason Vargas P Mike Leake 1B Paul Goldschmidt OF George Springer OF Billy Hamilton OF Ryan Braun 2B Jonathan Villar 3B Kris Bryant C Willson Contreras SS Freddy Galvis",NA,"","",NA
721,779084976,"baddabing",0,73.05,"P Michael Pineda P Parker Bridwell OF George Springer 2B Daniel Murphy SS Didi Gregorius 3B Anthony Rendon 1B Ryan Zimmerman OF Michael A. Taylor C Evan Gattis OF Ben Gamel",NA,"","",NA
721,779094781,"buchris532 (18/20)",0,73.05,"P Ervin Santana P Gerrit Cole 3B Miguel Sanó OF Domingo Santana 2B Brian Dozier OF Max Kepler 1B Yonder Alonso SS Orlando Arcia C Manny Piña OF Robbie Grossman",NA,"","",NA
721,779109559,"smroscoe",0,73.05,"P Matt Garza OF Mookie Betts OF Bryce Harper OF Adam Duvall 3B José Ramírez 2B José Altuve 1B Cody Bellinger SS Corey Seager C Gary Sánchez P Jayson Aquino",NA,"","",NA
724,779151666,"tweeterbnb",0,73,"P Jon Gray P Trevor Bauer 2B José Altuve C Gary Sánchez OF Khris Davis 1B Mike Napoli 3B Travis Shaw OF Andrew McCutchen OF Melky Cabrera SS Freddy Galvis",NA,"","",NA
725,779084237,"ctfteije",0,72.7,"P Trevor Bauer P Ariel Miranda OF Aaron Judge 3B José Ramírez 2B Scooter Gennett C Gary Sánchez OF Andrew McCutchen OF Andrew Benintendi SS Chris Owings 1B Yuli Gurriel",NA,"","",NA
726,778978961,"freckles420",0,72.35,"P Ervin Santana P Tanner Roark OF Charlie Blackmon 2B Scooter Gennett C Gary Sánchez OF Khris Davis 1B Ryan Zimmerman OF José Bautista 3B Evan Longoria SS Carlos Asuaje",NA,"","",NA
727,779103209,"Dabbonem09",0,72.2,"P Jason Vargas P Jon Gray 2B Daniel Murphy OF Chris Taylor 1B Eric Thames OF Andrew Benintendi C Evan Gattis 3B Kris Bryant OF Corey Dickerson SS Jordy Mercer",NA,"","",NA
728,779174524,"boobie727 (2/7)",0,71.9,"P Trevor Bauer P Mike Leake 1B Paul Goldschmidt OF Adam Duvall SS Corey Seager C Gary Sánchez 2B Robinson Canó OF Ryan Braun 3B Kris Bryant OF Rajai Davis",NA,"","",NA
729,779137721,"wjhouse (3/20)",0,71.65,"P Jacob deGrom P Trevor Bauer 1B Logan Morrison 2B Brian Dozier OF José Bautista OF Mark Trumbo 3B Chase Headley C Welington Castillo SS Freddy Galvis OF Mallex Smith",NA,"","",NA
730,779129157,"mabrandenbur (2/2)",0,71.6,"P Alex Wood P Jason Vargas OF Charlie Blackmon OF Ryan Braun 1B Miguel Cabrera 2B Josh Harrison 3B Manny Machado C James McCann SS Brandon Crawford OF Austin Slater",NA,"","",NA
730,779153349,"Bg715baller",0,71.6,"P Ervin Santana P Mike Leake 3B Miguel Sanó 1B Mike Napoli OF Ryan Braun SS Didi Gregorius 2B Jonathan Villar OF Max Kepler C Buster Posey OF Ian Happ",NA,"","",NA
732,779042870,"georgejester",0,71.4,"P Ervin Santana P Ariel Miranda OF Charlie Blackmon SS Corey Seager 3B Travis Shaw OF Andrew McCutchen 2B DJ LeMahieu OF Ian Happ C Manny Piña 1B Josh Bell",NA,"","",NA
733,779079062,"lionfan914",0,71.35,"P Gerrit Cole P Trevor Bauer OF Charlie Blackmon 2B Scooter Gennett OF Curtis Granderson SS Zack Cozart 1B Lucas Duda OF Yoenis Céspedes 3B Manny Machado C Tucker Barnhart",NA,"","",NA
734,779146382,"ombjac22",0,71.25,"P Michael Pineda P Sonny Gray 2B Daniel Murphy 1B Lucas Duda C Evan Gattis SS Jean Segura OF Ian Happ OF Gregory Polanco 3B Yunel Escobar OF Odúbel Herrera",NA,"","",NA
735,779028104,"Dreadguy",0,71.1,"P Ariel Miranda P Matt Garza OF Mookie Betts OF Charlie Blackmon 1B Joey Votto SS Corey Seager 2B Daniel Murphy 3B Travis Shaw OF Eric Thames C Buster Posey",NA,"","",NA
735,779097450,"Uoflcardinalboy8",0,71.1,"P Alex Wood P Jon Gray OF Charlie Blackmon OF Raimel Tapia 3B Kris Bryant OF Chris Young C Kurt Suzuki 1B Wilmer Flores SS Asdrúbal Cabrera 2B Taylor Motter",NA,"","",NA
737,779184501,"steve000006",0,71,"P Jon Gray P Trevor Bauer OF Mookie Betts OF Charlie Blackmon 1B Paul Goldschmidt OF Andrew Benintendi 3B Todd Frazier C Buster Posey 2B José Peraza SS Tim Beckham",NA,"","",NA
738,778945409,"tigerguy33",0,70.85,"P Sonny Gray P Jon Gray OF Khris Davis OF Andrew McCutchen 1B Eric Thames SS Chris Owings OF Justin Upton C Buster Posey 2B Ian Happ 3B Kris Bryant",NA,"","",NA
739,779135610,"eml9001",0,70.75,"P Jacob deGrom P Alex Wood OF Max Kepler 3B Alex Bregman OF Hunter Pence C Jason Castro 2B José Peraza SS Tim Beckham 1B Albert Pujols OF Peter Bourjos",NA,"","",NA
740,779011263,"70Rickster",0,70.6,"P Alex Wood P Jason Vargas OF Eric Thames OF Manuel Margot OF Ender Inciarte C Manny Piña 2B Josh Harrison 3B Manny Machado SS Asdrúbal Cabrera 1B Albert Pujols",NA,"","",NA
740,779110735,"earlbobby",0,70.6,"P Jon Gray P Mike Leake OF Mookie Betts 3B Nolan Arenado 1B Anthony Rizzo 2B Dustin Pedroia SS Xander Bogaerts C Alex Avila OF Shin-soo Choo OF Seth Smith",NA,"","",NA
740,779139471,"joesellscarz",0,70.6,"P Ervin Santana P Mike Leake 3B Miguel Sanó 2B Robinson Canó OF Ryan Braun SS Xander Bogaerts 1B Joe Mauer OF Max Kepler C Buster Posey OF Eddie Rosario",NA,"","",NA
743,779092655,"WS2016CUBBIES (1/3)",0,70.55,"P Trevor Bauer P John Lackey OF Mookie Betts OF Charlie Blackmon 3B Nolan Arenado 2B Scooter Gennett SS Francisco Lindor OF Justin Upton 1B Miguel Cabrera C Willson Contreras",NA,"","",NA
744,779006400,"thelastchild74",0,70.35,"P Jon Gray 1B Joey Votto 2B José Altuve C Gary Sánchez SS Eric Sogard OF Robbie Grossman OF José Osuna OF Gregory Polanco 3B Alex Bregman P Brad Peacock",NA,"","",NA
745,779092083,"BK68 (9/16)",0,70.25,"P Michael Pineda P Sonny Gray 1B Anthony Rizzo OF Khris Davis 2B Ian Happ 3B Kris Bryant OF Corey Dickerson C Willson Contreras OF Ben Zobrist SS Tyler Wade",NA,"","",NA
746,779004352,"phenomental",0,70.1,"P Marco Estrada P Tanner Roark OF Mookie Betts 2B José Altuve C Gary Sánchez 1B Freddie Freeman SS Xander Bogaerts 3B Anthony Rendon OF Eric Thames OF Marcell Ozuna",NA,"","",NA
747,778978871,"rcollins23",0,69.9,"P Ariel Miranda P Doug Fister OF Mookie Betts OF Charlie Blackmon OF Aaron Judge 1B Cody Bellinger C Gary Sánchez 2B Robinson Canó SS Jean Segura 3B Jake Lamb",NA,"","",NA
748,779137737,"wjhouse (19/20)",0,69.85,"P Marco Estrada OF Charlie Blackmon 3B Nolan Arenado SS Corey Seager 1B Logan Morrison OF Justin Upton C Buster Posey 2B Rougned Odor OF Corey Dickerson P Joe Musgrove",NA,"","",NA
749,779115404,"Abbyplayers",0,69.7,"P Jason Vargas P Doug Fister OF Aaron Judge 2B José Altuve OF Cody Bellinger C Gary Sánchez 3B Travis Shaw SS Zack Cozart 1B Mark Reynolds OF Derek Fisher",NA,"","",NA
750,779096336,"zwalter",0,69.6,"P Ervin Santana P Mike Leake OF Mookie Betts OF Charlie Blackmon 1B Freddie Freeman 2B Jonathan Schoop C Buster Posey 3B Josh Harrison SS Eric Sogard OF Mallex Smith",NA,"","",NA
750,779122655,"rtpa99 (1/2)",0,69.6,"P Gerrit Cole P John Lackey OF Charlie Blackmon 3B Nolan Arenado OF Ryan Braun 2B Jonathan Villar OF J.D. Martinez 1B José Abreu C Buster Posey SS Orlando Arcia",NA,"","",NA
750,779141092,"mgdeal (1/2)",0,69.6,"P Alex Wood P Jason Vargas 1B José Abreu C Buster Posey 2B Ian Happ OF Scott Schebler 3B Josh Harrison OF Ben Zobrist OF Steve Pearce SS Dansby Swanson",NA,"","",NA
753,779154440,"CMAC2525 (1/3)",0,69.5,"P Jacob deGrom P Sonny Gray OF Mookie Betts SS Corey Seager 1B Mark Reynolds OF Matt Kemp 3B Maikel Franco 2B Brandon Drury OF Byron Buxton C Jeff Mathis",NA,"","",NA
753,779154468,"CMAC2525 (2/3)",0,69.5,"P Jacob deGrom P Sonny Gray OF Mookie Betts SS Corey Seager 1B Mark Reynolds OF Matt Kemp 3B Maikel Franco 2B Taylor Motter OF Byron Buxton C Jeff Mathis",NA,"","",NA
755,779018761,"neilhe (2/8)",0,69.15,"P Alex Wood P Daniel Norris 1B Edwin Encarnacion OF J.D. Martinez OF Max Kepler 3B Kris Bryant SS Eduardo Escobar 2B Josh Harrison C Willson Contreras OF Matt Kemp",NA,"","",NA
755,779021265,"codeseve7 (3/3)",0,69.15,"P Sonny Gray P Trevor Bauer OF Charlie Blackmon 3B Miguel Sanó OF Andrew McCutchen OF Justin Upton C Buster Posey 2B Ian Kinsler 1B Josh Bell SS Jorge Polanco",NA,"","",NA
757,779022777,"benwhen",0,69.05,"P Jacob deGrom P Ariel Miranda 2B Scooter Gennett OF Khris Davis SS Didi Gregorius OF Raimel Tapia 3B Kris Bryant C Willson Contreras OF Gorkys Hernández 1B Albert Pujols",NA,"","",NA
758,778965682,"30kkelly",0,68.85,"P Sonny Gray P Jon Gray 1B Cody Bellinger OF Scooter Gennett OF Khris Davis 3B Anthony Rendon OF Justin Upton 2B Whit Merrifield C Jonathan Lucroy SS Stephen Drew",NA,"","",NA
758,779088233,"jgypsy61",0,68.85,"P Ervin Santana P Sonny Gray OF Khris Davis OF Domingo Santana OF Jay Bruce C Yadier Molina 1B Buster Posey 2B Josh Harrison 3B Evan Longoria SS Asdrúbal Cabrera",NA,"","",NA
758,779137922,"HaroldsacH",0,68.85,"P Ervin Santana P Sonny Gray OF Mookie Betts OF Andrew Benintendi 3B Matt Chapman SS Francisco Lindor C Sandy Leon OF Bradley Zimmer 2B Chase Utley 1B Danny Valencia",NA,"","",NA
761,779142908,"KOHearts25",0,68.7,"P Jason Vargas P Doug Fister 1B Paul Goldschmidt 2B José Ramírez OF Ryan Braun 3B Mike Moustakas OF Michael Brantley SS Zack Cozart OF J.D. Martinez C Buster Posey",NA,"","",NA
762,779137735,"wjhouse (17/20)",0,68.6,"P Gerrit Cole P John Lackey OF Charlie Blackmon 3B Nolan Arenado SS Corey Seager C Gary Sánchez OF Billy Hamilton 2B Ian Kinsler 1B Mark Reynolds OF Steve Pearce",NA,"","",NA
763,779083174,"Rummie",0,68.5,"P Michael Pineda OF Charlie Blackmon 1B Freddie Freeman SS Didi Gregorius OF Carlos Gómez C Willson Contreras 2B Jed Lowrie 3B Manny Machado OF Bradley Zimmer P Joe Musgrove",NA,"","",NA
764,779085028,"sinister1985c10 (2/4)",0,68.4,"P Michael Pineda P Trevor Bauer OF Aaron Judge OF Bryce Harper C Gary Sánchez OF Matt Kemp 3B Manny Machado SS Asdrúbal Cabrera 2B José Pirela 1B Matt Davidson",NA,"","",NA
765,779065080,"Vikingjeff14 (2/6)",0,68.25,"P Jason Vargas P Ben Lively OF Mookie Betts 2B Scooter Gennett 1B Edwin Encarnacion 3B Travis Shaw SS Zack Cozart OF J.D. Martinez C Buster Posey OF Hunter Pence",NA,"","",NA
766,779115185,"keniff (4/8)",0,68.2,"P Ervin Santana P Jason Vargas OF Aaron Judge 1B Freddie Freeman 3B Travis Shaw OF Eric Thames OF Scott Schebler 2B Brandon Phillips C Matt Wieters SS JT Riddle",NA,"","",NA
767,779132890,"Nikon187",0,68.15,"P Sonny Gray P Trevor Bauer 1B Edwin Encarnacion 3B Travis Shaw OF Eric Thames OF Andrew Benintendi OF Domingo Santana 2B Paul DeJong C Buster Posey SS Asdrúbal Cabrera",NA,"","",NA
768,779030070,"nmyprime",0,68.05,"P Trevor Bauer P Daniel Norris OF Mookie Betts OF Aaron Judge 3B Justin Turner SS Andrelton Simmons 2B Brian Dozier OF Justin Upton 1B Matt Adams C Salvador Perez",NA,"","",NA
769,779147165,"mathofbirds (3/4)",0,67.9,"P Trevor Bauer P Mike Leake OF Aaron Judge 2B José Ramírez OF Khris Davis OF Andrew McCutchen SS Andrelton Simmons 1B Eric Thames C Buster Posey 3B Kris Bryant",NA,"","",NA
770,779052272,"swoosh1",0,67.7,"P Trevor Bauer P Matt Garza OF Mookie Betts OF Charlie Blackmon 2B Daniel Murphy 3B Miguel Sanó OF Ryan Braun SS Xander Bogaerts 1B Eric Thames C Jonathan Lucroy",NA,"","",NA
771,779024373,"SadatGnosis",0,67.6,"P Alex Wood P Doug Fister OF Aaron Judge 3B José Ramírez OF Cody Bellinger 1B Edwin Encarnacion OF Khris Davis C Manny Piña SS Tim Beckham 2B Taylor Featherston",NA,"","",NA
771,779144222,"chillyred (3/3)",0,67.6,"P Michael Pineda P Doug Fister OF Aaron Judge 2B Daniel Murphy C Gary Sánchez 1B Eric Thames OF Brett Gardner SS Jean Segura OF José Bautista 3B Manny Machado",NA,"","",NA
773,779104514,"scottl76767",0,67.25,"P Michael Pineda P Sonny Gray OF Khris Davis SS Xander Bogaerts OF Andrew Benintendi OF Max Kepler 1B Yonder Alonso 2B Jed Lowrie C Christian Vázquez 3B David Freese",NA,"","",NA
774,779126502,"munson989 (1/2)",0,66.75,"P Ervin Santana P Daniel Norris OF Charlie Blackmon 1B Cody Bellinger 2B Dustin Pedroia OF Andrew Benintendi 3B Jake Lamb SS Francisco Lindor C Salvador Perez OF Avisaíl García",NA,"","",NA
775,779067702,"cfsmith5454",0,66.7,"P Gerrit Cole P Tanner Roark OF Cody Bellinger 2B Daniel Murphy 3B Justin Turner 1B Lucas Duda SS Francisco Lindor OF Jay Bruce OF Yoenis Céspedes C Salvador Perez",NA,"","",NA
776,779122121,"jamesberg",0,66.5,"P Jason Vargas P Trevor Bauer C Gary Sánchez 3B Travis Shaw OF Ryan Braun 1B Eric Thames OF Justin Upton 2B Rougned Odor OF Ian Happ SS Orlando Arcia",NA,"","",NA
777,779163352,"barronx8",0,66.2,"P Michael Pineda P Blake Snell OF George Springer OF Cody Bellinger SS Elvis Andrus C Alex Avila 3B Kris Bryant 2B Ian Kinsler 1B Mark Reynolds OF Yasiel Puig",NA,"","",NA
778,779079494,"JustKickUnited",0,66.1,"P Edinson Volquez P John Lackey OF Aaron Judge 1B Joey Votto OF Bryce Harper SS Corey Seager C Gary Sánchez OF Andrew McCutchen 2B Dustin Pedroia 3B Adrián Béltre",NA,"","",NA
779,779100388,"sincere535",0,65.8,"P Michael Pineda P Ariel Miranda OF Aaron Judge C Gary Sánchez 2B Robinson Canó SS Didi Gregorius 1B Buster Posey 3B Kris Bryant OF Corey Dickerson OF Mikie Mahtook",NA,"","",NA
780,778986002,"andyh6020 (1/2)",0,65.75,"P Jacob deGrom P Alex Wood OF Trey Mancini OF Mitch Haniger 3B Yunel Escobar OF Adam Jones 1B Matt Davidson C James McCann SS Tim Beckham 2B Yolmer Sánchez",NA,"","",NA
780,779061320,"binderjoel (1/2)",0,65.75,"P Gerrit Cole P Ariel Miranda OF Charlie Blackmon 3B José Ramírez 2B Scooter Gennett OF Curtis Granderson OF Eric Thames 1B José Abreu SS Orlando Arcia C Jonathan Lucroy",NA,"","",NA
782,779072883,"tammymisa",0,65.7,"P Sonny Gray P Edinson Volquez OF Aaron Judge 1B Freddie Freeman 3B Anthony Rendon OF Michael A. Taylor 2B Jonathan Schoop C Stephen Vogt SS Francisco Lindor OF Justin Upton",NA,"","",NA
783,779080899,"Lock24",0,65.5,"P Trevor Bauer P Doug Fister OF Mookie Betts OF Charlie Blackmon 2B José Altuve 1B Edwin Encarnacion 3B Travis Shaw OF Lonnie Chisenhall SS Zack Cozart C Buster Posey",NA,"","",NA
784,779094759,"buchris532 (16/20)",0,65.45,"P Michael Pineda P Gerrit Cole 3B Miguel Sanó 1B Logan Morrison OF Ryan Braun 2B Brian Dozier C Manny Piña OF Robbie Grossman OF Mallex Smith SS Adeiny Hechavarria",NA,"","",NA
785,779108168,"Dope_Smokin_DJs (4/5)",0,65.4,"P Jacob deGrom P Daniel Norris OF Steven Souza Jr. 1B Justin Bour 2B Ian Happ SS Eduardo Escobar 3B Eugenio Suárez C Salvador Perez OF Ben Gamel OF Nick Markakis",NA,"","",NA
786,779061902,"DERRICK7878 (1/2)",0,65.25,"P Michael Pineda P Sonny Gray 2B José Altuve OF Domingo Santana OF J.D. Martinez SS Orlando Arcia OF Gregory Polanco 1B Yuli Gurriel C Tucker Barnhart 3B José Reyes",NA,"","",NA
787,779013090,"Sisterk",0,65.2,"P Ervin Santana P Jason Vargas OF Andrew McCutchen 1B Ryan Zimmerman OF Justin Upton 3B Kris Bryant SS Orlando Arcia 2B Ian Kinsler C Salvador Perez OF Adam Jones",NA,"","",NA
788,779124478,"charlesrayallday (1/2)",0,65.15,"P Sonny Gray P Trevor Bauer OF Charlie Blackmon 3B Miguel Sanó 1B Freddie Freeman OF Eric Thames 2B Brian Dozier C Willson Contreras SS Asdrúbal Cabrera OF Carlos González",NA,"","",NA
788,779130509,"charlesrayallday (2/2)",0,65.15,"P Sonny Gray P Trevor Bauer OF Charlie Blackmon 3B Miguel Sanó 1B Freddie Freeman OF Eric Thames 2B Brian Dozier C Willson Contreras SS Asdrúbal Cabrera OF Carlos González",NA,"","",NA
790,779174386,"sd74",0,65.1,"P Jason Vargas P Mike Leake OF Charlie Blackmon OF Aaron Judge 2B José Ramírez 1B Eric Thames SS Jean Segura 3B Josh Harrison C Andrew Knapp OF Avisaíl García",NA,"","",NA
791,779138140,"packerbackerdale",0,64.9,"P Matt Garza P Doug Fister OF Aaron Judge 1B Paul Goldschmidt SS Corey Seager 3B Travis Shaw OF Andrew McCutchen 2B Dustin Pedroia OF Andrew Benintendi C Brian McCann",NA,"","",NA
792,779159862,"CCSV2013",0,64.7,"P Trevor Bauer P Ariel Miranda OF Mookie Betts 1B Justin Smoak OF Billy Hamilton OF Khris Davis 3B Travis Shaw 2B Jonathan Villar C Buster Posey SS Orlando Arcia",NA,"","",NA
793,779068021,"rtrocino",0,64.65,"P Daniel Norris P Mike Leake OF Charlie Blackmon 3B Miguel Sanó 1B Anthony Rizzo OF Khris Davis 2B Dustin Pedroia OF Josh Reddick C Evan Gattis SS Francisco Lindor",NA,"","",NA
794,779092080,"BK68 (8/16)",0,64.6,"P Alex Wood P Jason Vargas SS Corey Seager OF Chris Taylor OF Raimel Tapia 3B Eugenio Suárez OF Jorge Bonifacio 2B Chase Utley 1B Danny Valencia C Jeff Mathis",NA,"","",NA
795,779040967,"SUNSET76 (8/20)",0,64.4,"P Alex Wood P Trevor Bauer 2B Daniel Murphy 3B Anthony Rendon 1B Ryan Zimmerman SS Zack Cozart OF Michael A. Taylor OF Seth Smith OF Brian Goodwin C Jeff Mathis",NA,"","",NA
796,779068264,"rdamer (2/2)",0,64.15,"P Sonny Gray P Trevor Bauer 3B Miguel Sanó OF Eric Thames OF J.D. Martinez 2B Brian Dozier 1B Joey Gallo OF Max Kepler SS Eduardo Escobar C James McCann",NA,"","",NA
797,779180207,"Wormjdh",0,64.05,"P Trevor Bauer P Daniel Norris OF Aaron Judge 1B Logan Morrison C Gary Sánchez OF Khris Davis SS Didi Gregorius OF Steven Souza Jr. 2B Ian Happ 3B Evan Longoria",NA,"","",NA
798,779087512,"buchris532 (12/20)",0,64,"P Ervin Santana P Trevor Bauer OF Mookie Betts OF Eric Thames 1B Hanley Ramirez 2B Jonathan Villar OF Jackie Bradley Jr. 3B Kris Bryant C Willson Contreras SS Addison Russell",NA,"","",NA
799,779137738,"wjhouse (20/20)",0,63.95,"P Trevor Bauer P Ty Blach OF Charlie Blackmon 3B Nolan Arenado 1B Paul Goldschmidt 2B José Altuve C Gary Sánchez OF Ryan Braun OF Steve Pearce SS Jorge Polanco",NA,"","",NA
800,779044947,"evelyn71",0,63.55,"P Jon Gray P Edinson Volquez OF Aaron Judge 3B Nolan Arenado OF Khris Davis 1B Freddie Freeman SS Didi Gregorius 2B Jonathan Schoop C Evan Gattis OF Jay Bruce",NA,"","",NA
801,779019956,"Bobber81",0,63.5,"P Sonny Gray OF Ryan Braun 1B Eric Thames OF Josh Reddick C Evan Gattis SS Orlando Arcia 2B Eric Sogard 3B Alex Bregman OF Carlos Beltrán P Brad Peacock",NA,"","",NA
802,779034916,"damien0407 (1/2)",0,63.4,"P Michael Pineda P Trevor Bauer OF Khris Davis 3B Travis Shaw SS Andrelton Simmons OF Eric Thames C Evan Gattis 1B José Abreu 2B Ian Happ OF Byron Buxton",NA,"","",NA
802,779139333,"mrdung4232 (2/2)",0,63.4,"P Zack Godley P Trevor Bauer OF Mookie Betts 2B José Ramírez 3B Travis Shaw 1B Eric Thames OF Andrew Benintendi OF Melky Cabrera C Willson Contreras SS Freddy Galvis",NA,"","",NA
804,779000079,"maygi557 (2/4)",0,63.15,"P Michael Pineda P Daniel Norris OF Andrew McCutchen 3B Mike Moustakas 1B Eric Hosmer OF Andrew Benintendi OF Marwin González 2B Ian Happ C Manny Piña SS Freddy Galvis",NA,"","",NA
805,779039760,"Caiman",0,63.1,"P Jason Vargas P Mike Leake OF Aaron Judge 1B Edwin Encarnacion C Gary Sánchez OF Jackie Bradley Jr. 2B Ian Happ OF Lorenzo Cain SS Orlando Arcia 3B Eduardo Escobar",NA,"","",NA
806,779153887,"JoeyFootball22 (2/2)",0,62.9,"P Jacob deGrom P John Lackey 1B Cody Bellinger 3B Miguel Sanó SS Zack Cozart OF Domingo Santana OF Jacoby Ellsbury C Salvador Perez OF Nick Markakis 2B Javier Báez",NA,"","",NA
807,778933116,"bill1966",0,62.85,"P Jacob deGrom P Doug Fister OF Aaron Judge 2B Jonathan Schoop 1B Lucas Duda C Buster Posey OF Lorenzo Cain SS Eduardo Escobar OF Scott Schebler 3B Evan Longoria",NA,"","",NA
808,779012842,"LuMaleck (4/4)",0,62.75,"P Jacob deGrom P Alex Wood OF Bradley Zimmer OF Carlos González 2B Brandon Phillips OF Adam Jones 3B Martín Prado 1B Victor Martinez SS José Reyes C Martín Maldonado",NA,"","",NA
809,779162157,"CMAC2525 (3/3)",0,62.5,"P Jacob deGrom P Sonny Gray OF Mookie Betts SS Corey Seager 1B Mark Reynolds 2B Dee Gordon OF Matt Kemp 3B Maikel Franco C Jeff Mathis OF Brett Eibner",NA,"","",NA
810,779150474,"Kell2jeter (2/2)",0,62.45,"P Michael Pineda P Gerrit Cole OF Aaron Judge 3B Nolan Arenado C Gary Sánchez OF Brett Gardner OF Jacoby Ellsbury 1B Trey Mancini SS Tyler Wade 2B Danny Espinosa",NA,"","",NA
811,778912295,"sanfran1980",0,62.4,"P Michael Pineda P Trevor Bauer 3B Justin Turner OF Andrew McCutchen OF Tommy Pham OF J.D. Martinez SS Franklin Barreto 2B Whit Merrifield C Manny Piña 1B Albert Pujols",NA,"","",NA
811,779040969,"SUNSET76 (9/20)",0,62.4,"P Alex Wood P Trevor Bauer OF Mookie Betts SS Zack Cozart 2B Jonathan Villar OF Michael A. Taylor 1B Adam Lind OF Brian Goodwin C Matt Wieters 3B Stephen Drew",NA,"","",NA
813,779064538,"Vikingjeff14 (1/6)",0,62.25,"P Jacob deGrom P Mike Leake 1B Logan Morrison OF Lonnie Chisenhall OF J.D. Martinez OF Brett Gardner 3B Kris Bryant C Willson Contreras SS Troy Tulowitzki 2B Javier Báez",NA,"","",NA
814,779091015,"BudAdd",0,62.15,"P Jason Vargas P Ty Blach 2B Daniel Murphy OF Scooter Gennett 1B Freddie Freeman SS Xander Bogaerts OF Chris Owings 3B Jake Lamb OF Jay Bruce C Yasmani Grandal",NA,"","",NA
815,779056104,"visitingj (3/4)",0,62.1,"P Michael Pineda P Ervin Santana 1B Joey Votto C Yadier Molina OF John Jaso 2B Jason Kipnis OF Joey Rickard SS Freddy Galvis 3B Maikel Franco OF Jason Heyward",NA,"","",NA
