"Rank","EntryId","EntryName","TimeRemaining","Points","Lineup","X","Player","X.Drafted","FPTS"
1,779019653,"BigThunder57",0,173.55,"P Ervin Santana P Edinson Volquez OF Aaron Judge OF George Springer 1B Freddie Freeman 3B Mike Moustakas SS Xander Bogaerts C J.T. Realmuto 2B Rougned Odor OF Mallex Smith",NA,"Trevor Bauer","37.51%",12.65
2,779090146,"ktwo2",0,169,"P Ervin Santana P Trevor Bauer OF Aaron Judge OF George Springer SS Jean Segura 2B Whit Merrifield OF Marcell Ozuna 3B Kris Bryant 1B Yuli Gurriel C Yasmani Grandal",NA,"Charlie Blackmon","23.59%",3
3,779082750,"HuskMusk05",0,166.4,"P Alex Wood P Trevor Bauer OF George Springer SS Zack Cozart 3B Nicholas Castellanos 2B Whit Merrifield C Salvador Perez 1B Yuli Gurriel OF Mallex Smith OF Keon Broxton",NA,"Aaron Judge","22.53%",21
4,779137725,"wjhouse (7/20)",0,159.4,"P Alex Wood P Trevor Bauer OF George Springer SS Didi Gregorius 1B Miguel Cabrera 2B Rougned Odor OF Corey Dickerson 3B Evan Longoria C Jonathan Lucroy OF Kole Calhoun",NA,"Kris Bryant","22.21%",11
5,779162276,"dennis1771",0,152.8,"P Alex Wood P Ariel Miranda 1B Joey Votto 2B Scooter Gennett SS Andrelton Simmons OF Brett Gardner 3B Kris Bryant OF Corey Dickerson OF Keon Broxton C Russell Martin",NA,"George Springer","21.79%",29
6,779137732,"wjhouse (14/20)",0,152.25,"P Sonny Gray P Zack Godley 2B José Altuve 1B Justin Smoak 3B Travis Shaw OF Shin-soo Choo C Buster Posey OF Ender Inciarte SS Freddy Galvis OF Mallex Smith",NA,"Gary Sánchez","21.36%",0
7,779005852,"Bal83 (1/3)",0,151.15,"P Sonny Gray P Trevor Bauer 1B Paul Goldschmidt 2B José Altuve OF George Springer SS Corey Seager 3B Kris Bryant OF Steve Pearce OF Mallex Smith C Russell Martin",NA,"Alex Wood","19.45%",36.75
7,779005886,"Bal83 (2/3)",0,151.15,"P Sonny Gray P Trevor Bauer 1B Paul Goldschmidt 2B José Altuve OF George Springer SS Corey Seager 3B Kris Bryant OF Steve Pearce OF Mallex Smith C Russell Martin",NA,"Buster Posey","16.90%",6
7,779152086,"Bal83 (3/3)",0,151.15,"P Sonny Gray P Trevor Bauer 1B Paul Goldschmidt 2B José Altuve OF George Springer SS Corey Seager 3B Kris Bryant OF Steve Pearce OF Mallex Smith C Russell Martin",NA,"Sonny Gray","16.68%",20.5
10,779170851,"drewpapi938",0,151.1,"P Alex Wood P Ervin Santana 1B Logan Morrison OF Josh Reddick OF Andrew Benintendi 3B Evan Longoria 2B Javier Báez OF Kevin Pillar SS Addison Russell C Russell Martin",NA,"Ervin Santana","16.05%",23.35
11,779050083,"mos2easy",0,150.1,"P Ervin Santana P Zack Godley OF Khris Davis OF Andrew McCutchen SS Jean Segura OF Giancarlo Stanton 3B Kris Bryant 2B Ian Kinsler C Salvador Perez 1B Mark Reynolds",NA,"José Altuve","13.71%",22
12,779086402,"sinister1985c10 (3/4)",0,150.05,"P Alex Wood P Parker Bridwell 1B Joey Votto SS Corey Seager 3B Anthony Rendon 2B Jonathan Schoop OF Giancarlo Stanton OF Corey Dickerson OF Ben Gamel C Tyler Flowers",NA,"Ian Happ","13.60%",12
13,779120996,"anichols7",0,148,"P Ervin Santana P Trevor Bauer OF Charlie Blackmon OF George Springer SS Jean Segura OF Corey Dickerson C Salvador Perez 1B Mark Reynolds 3B Evan Longoria 2B Jed Lowrie",NA,"Eric Thames","12.96%",2
14,779091021,"jrevlett1982",0,147.75,"P Alex Wood OF Aaron Judge 1B Freddie Freeman 3B Travis Shaw OF Eric Thames OF J.D. Martinez SS Jean Segura C Tyler Flowers 2B José Pirela P Jayson Aquino",NA,"Mookie Betts","12.96%",0
15,779006231,"bergsbw20",0,147.5,"P Jason Vargas P Trevor Bauer OF George Springer 1B Edwin Encarnacion SS Francisco Lindor C Buster Posey OF Giancarlo Stanton 2B Ian Happ OF Marcell Ozuna 3B Kris Bryant",NA,"Ryan Braun","12.86%",7
15,779084654,"BK68 (5/16)",0,147.5,"P Alex Wood P Zack Godley OF Raimel Tapia SS Jean Segura 2B Whit Merrifield OF Lorenzo Cain 3B Eugenio Suárez OF Ben Gamel C Mike Zunino 1B Danny Valencia",NA,"Jason Vargas","12.75%",1.85
17,779162693,"mikegt1",0,147.4,"P Sonny Gray P John Lackey OF Aaron Judge OF George Springer 2B Scooter Gennett 3B Justin Turner SS Didi Gregorius OF Ender Inciarte 1B Matt Carpenter C Salvador Perez",NA,"Cody Bellinger","11.69%",2
18,779160935,"bigbov",0,147.35,"P Gerrit Cole P Trevor Bauer OF George Springer OF Nelson Cruz OF Michael Brantley 1B Eric Thames 2B Brian Dozier SS Jean Segura 3B Jake Lamb C Salvador Perez",NA,"Gerrit Cole","11.69%",24.7
19,779009598,"jzyd420",0,146.7,"P Ervin Santana P Jon Gray OF Charlie Blackmon OF Nelson Cruz 2B DJ LeMahieu SS Jean Segura 1B Buster Posey 3B Kris Bryant C Salvador Perez OF Mallex Smith",NA,"Travis Shaw","10.63%",7
20,779151624,"neilhe (7/8)",0,146.6,"P Gerrit Cole P John Lackey OF Aaron Judge OF George Springer 1B Anthony Rizzo OF Ryan Braun SS Didi Gregorius 2B Ian Happ 3B Kris Bryant C Willson Contreras",NA,"Michael Pineda","10.52%",-7.25
21,779009385,"Billy266",0,146.4,"P Ervin Santana P Matt Garza OF Charlie Blackmon 2B José Altuve OF George Springer OF Scooter Gennett 3B Justin Turner C Salvador Perez 1B Yuli Gurriel SS Freddy Galvis",NA,"J.D. Martinez","10.31%",7
22,779027793,"textiger",0,145.25,"P Alex Wood P Sonny Gray OF Carlos Gómez OF Ian Happ 3B Kris Bryant OF Ender Inciarte 1B Mark Reynolds C Jonathan Lucroy SS Freddy Galvis 2B José Pirela",NA,"Andrew McCutchen","10.10%",2
23,779018191,"RaiderNation526",0,145.15,"P Sonny Gray P Trevor Bauer OF Aaron Judge 2B José Altuve OF George Springer 1B Anthony Rizzo 3B Kris Bryant OF Corey Dickerson C Wilson Ramos SS Tyler Wade",NA,"Mike Leake","9.99%",0.25
24,779183602,"boobie727 (6/7)",0,144.9,"P Trevor Bauer P Mike Leake 1B Joey Votto 2B José Altuve OF George Springer C Gary Sánchez OF Ryan Braun SS Xander Bogaerts 3B Kris Bryant OF Rajai Davis",NA,"José Ramírez","9.78%",5
25,779157910,"mikebtate78",0,143.35,"P Gerrit Cole P Trevor Bauer OF George Springer 1B Freddie Freeman 3B Justin Turner OF Nelson Cruz OF Lorenzo Cain C Willson Contreras 2B José Pirela SS Tim Beckham",NA,"Nolan Arenado","9.78%",0
26,779114351,"Dope_Smokin_DJs (5/5)",0,143.15,"P Sonny Gray P Trevor Bauer OF Charlie Blackmon 3B Nolan Arenado OF George Springer SS Jean Segura 1B Matt Carpenter C Willson Contreras 2B José Pirela OF Mallex Smith",NA,"Corey Seager","9.56%",5
27,779092114,"BK68 (12/16)",0,143.1,"P Alex Wood P Ervin Santana 1B Logan Morrison OF Steven Souza Jr. OF Corey Dickerson 3B Evan Longoria SS Troy Tulowitzki 2B Javier Báez OF Mallex Smith C Russell Martin",NA,"Ariel Miranda","9.35%",7.05
28,779126132,"priz365 (2/2)",0,141.5,"P Alex Wood P Michael Pineda OF George Springer 2B Ian Happ 3B Kris Bryant SS Jorge Polanco OF Mallex Smith C Mike Zunino 1B Matt Davidson OF Albert Almora Jr.",NA,"Francisco Lindor","9.35%",17
29,779059435,"dkBixx",0,141.25,"P Alex Wood P Sonny Gray 2B Scooter Gennett C Gary Sánchez 1B Eric Thames 3B Kris Bryant OF Mallex Smith OF Keon Broxton SS Tim Beckham OF Byron Buxton",NA,"Willson Contreras","8.82%",5
30,779020741,"cheaptrickmonster",0,141.15,"P Sonny Gray P Trevor Bauer OF George Springer OF Nelson Cruz 1B Eric Thames OF J.D. Martinez 2B Brian Dozier SS Francisco Lindor 3B Kris Bryant C Salvador Perez",NA,"Rougned Odor","8.82%",24
31,779105383,"allstat1211",0,140.8,"P Alex Wood P Ariel Miranda OF George Springer 1B Eric Thames OF Steven Souza Jr. C Evan Gattis SS Jean Segura 3B Eugenio Suárez 2B Ian Kinsler OF Keon Broxton",NA,"Xander Bogaerts","8.71%",16
32,779161456,"icerocket1377",0,140.75,"P Gerrit Cole P Matt Garza 1B Paul Goldschmidt 2B José Altuve OF George Springer C Gary Sánchez 3B Mike Moustakas SS Xander Bogaerts OF Yoenis Céspedes OF Manuel Margot",NA,"Justin Upton","8.50%",0
33,779110450,"billydvan",0,140.7,"P Ervin Santana P Jon Gray OF George Springer 1B Justin Smoak 3B Justin Turner OF Eric Thames SS Jean Segura 2B Ian Happ C Willson Contreras OF Avisaíl García",NA,"Freddie Freeman","8.40%",6
34,779049133,"Mattyjam559",0,140.4,"P Sonny Gray P John Lackey 1B Joey Votto 3B Nolan Arenado OF George Springer OF Billy Hamilton SS Zack Cozart C Buster Posey 2B Rougned Odor OF Keon Broxton",NA,"Didi Gregorius","8.40%",9
35,779158634,"THAM10",0,139.35,"P Gerrit Cole P Trevor Bauer OF Aaron Judge 1B Freddie Freeman 3B Justin Turner SS Jean Segura OF Max Kepler 2B Rougned Odor OF Corey Dickerson C Tyler Flowers",NA,"Salvador Perez","8.29%",16
36,779079050,"shawnd87 (1/2)",0,139,"P Jon Gray P Trevor Bauer OF Aaron Judge OF George Springer 1B Anthony Rizzo OF Josh Reddick 2B Jonathan Villar 3B Kris Bryant SS Orlando Arcia C Tyler Flowers",NA,"Khris Davis","8.18%",0
36,779079082,"shawnd87 (2/2)",0,139,"P Jon Gray P Trevor Bauer OF Aaron Judge OF George Springer 1B Anthony Rizzo OF Josh Reddick 2B Jonathan Villar 3B Kris Bryant SS Orlando Arcia C Tyler Flowers",NA,"John Lackey","8.08%",9.9
38,779066847,"HAVOC77 (1/3)",0,138.35,"P Gerrit Cole P Trevor Bauer OF Cody Bellinger 1B Edwin Encarnacion OF Ryan Braun SS Jean Segura C Buster Posey OF Giancarlo Stanton 2B Ian Happ 3B Kris Bryant",NA,"Orlando Arcia","7.86%",0
39,779162900,"robbozero",0,138.2,"P Jason Vargas P Jon Gray 1B Anthony Rizzo 3B Mike Moustakas SS Xander Bogaerts 2B Whit Merrifield C J.T. Realmuto OF Ian Happ OF Marcell Ozuna OF Corey Dickerson",NA,"Carlos González","7.86%",6
40,779121219,"thurston92 (3/3)",0,138,"P Ervin Santana P Trevor Bauer 1B Mike Napoli SS Xander Bogaerts 3B Adrián Béltre OF Christian Yelich C J.T. Realmuto OF Carlos Gómez 2B Rougned Odor OF Marcell Ozuna",NA,"Miguel Sanó","7.55%",3
41,779140731,"serialkiller13",0,137.8,"P Zack Godley P Matt Garza OF Aaron Judge OF George Springer OF Cody Bellinger 3B Mike Moustakas SS Didi Gregorius 1B Eric Thames 2B Jonathan Schoop C Buster Posey",NA,"Jean Segura","7.44%",26
42,779019984,"rgliii84 (2/4)",0,137.05,"P Ervin Santana P Gerrit Cole 2B José Ramírez 3B Adrián Béltre SS Francisco Lindor OF Giancarlo Stanton OF Eddie Rosario OF Gregory Polanco 1B Yuli Gurriel C Jason Castro",NA,"Corey Dickerson","7.33%",9
43,779156116,"jawish1963 (1/3)",0,136.85,"P Ervin Santana P Sonny Gray OF Scooter Gennett 3B Miguel Sanó 1B Eric Thames 2B Rougned Odor C Manny Piña OF Robbie Grossman SS Pat Valaika OF Mallex Smith",NA,"Mallex Smith","7.23%",25
44,779077509,"DKWaterboy",0,136.7,"P Trevor Bauer P Matt Garza OF Charlie Blackmon 1B Joey Votto 2B José Ramírez OF George Springer 3B Miguel Sanó SS Francisco Lindor C Buster Posey OF Lorenzo Cain",NA,"Jacob deGrom","7.12%",0
45,779157913,"ocsdawg (2/4)",0,136.45,"P Alex Wood P Gerrit Cole 1B Cody Bellinger OF Marcell Ozuna OF Corey Dickerson 3B Evan Longoria 2B Dee Gordon C Jonathan Lucroy SS Freddy Galvis OF Kole Calhoun",NA,"Joey Votto","7.01%",19
46,779056858,"amypie32",0,136.4,"P Alex Wood P Trevor Bauer SS Zack Cozart OF J.D. Martinez 1B Buster Posey OF Giancarlo Stanton 3B Kris Bryant C Brian McCann OF Derek Fisher 2B José Pirela",NA,"Scooter Gennett","7.01%",15
47,779180360,"shanquist",0,136.05,"P Jason Vargas P Edinson Volquez OF Aaron Judge OF George Springer 3B Mike Moustakas 1B Eric Hosmer SS Xander Bogaerts 2B Whit Merrifield C Salvador Perez OF Jorge Bonifacio",NA,"Zack Cozart","7.01%",8
48,779127672,"KyleWright3",0,135.85,"P Sonny Gray P Jon Gray 3B Nolan Arenado 2B José Altuve OF Michael Brantley 1B Buster Posey OF Giancarlo Stanton OF Corey Dickerson C Salvador Perez SS Tzu-Wei Lin",NA,"Jon Gray","6.91%",17.35
49,779066457,"Calvin19691969 (2/10)",0,135.6,"P Gerrit Cole P John Lackey 3B Nolan Arenado OF George Springer OF Ryan Braun OF J.D. Martinez SS Jean Segura 1B Miguel Cabrera C Buster Posey 2B José Pirela",NA,"Evan Longoria","6.91%",7
49,779125788,"jchand62",0,135.6,"P Alex Wood P Jason Vargas 3B Mike Moustakas 1B Eric Hosmer OF Marcell Ozuna OF Corey Dickerson C Tyler Flowers OF Jorge Bonifacio 2B José Pirela SS Brandon Crawford",NA,"Brian Dozier","6.91%",7
51,779112444,"donman2169",0,135.55,"P Jason Vargas P Gerrit Cole 2B Scooter Gennett 1B Eric Thames SS Zack Cozart 3B Nicholas Castellanos OF Giancarlo Stanton OF Marcell Ozuna C Salvador Perez OF Mikie Mahtook",NA,"Andrew Benintendi","6.59%",4
52,779041032,"SUNSET76 (20/20)",0,135.4,"P Alex Wood P Trevor Bauer 1B Freddie Freeman SS Zack Cozart OF Shin-soo Choo 3B Adrián Béltre OF Nomar Mazara OF Carlos Gómez 2B Rougned Odor C Jeff Mathis",NA,"Ian Kinsler","6.59%",8
52,779144271,"WS2016CUBBIES (3/3)",0,135.4,"P Sonny Gray P John Lackey OF Charlie Blackmon 2B José Altuve OF George Springer 1B Anthony Rizzo OF J.D. Martinez 3B Kris Bryant C Willson Contreras SS Javier Báez",NA,"Manny Piña","6.48%",0
54,779077557,"Nopacker",0,135.1,"P Alex Wood P Jon Gray OF Domingo Santana OF Jackie Bradley Jr. C Buster Posey 2B Rougned Odor OF Ian Happ 3B Kris Bryant 1B Yuli Gurriel SS Javier Báez",NA,"Zack Godley","6.48%",19.75
55,779123135,"droseispro (1/4)",0,135.05,"P Alex Wood P Ty Blach 1B Cody Bellinger 3B Miguel Sanó OF Ryan Braun SS Jean Segura OF Max Kepler 2B Rougned Odor C Yasmani Grandal OF Keon Broxton",NA,"Anthony Rizzo","6.38%",18
56,779075053,"Samson525A",0,135,"P Ervin Santana P Trevor Bauer OF Charlie Blackmon OF Nelson Cruz 1B Justin Bour SS Jean Segura C Buster Posey 3B Kris Bryant OF Scott Schebler 2B Jed Lowrie",NA,"Marcell Ozuna","5.84%",21
57,779082652,"spinalzo (1/2)",0,133.8,"P Alex Wood P Matt Garza OF George Springer OF Cody Bellinger 2B Daniel Murphy SS Xander Bogaerts 1B Marwin González 3B Evan Longoria OF Jake Marisnick C Ryan Hanigan",NA,"Yuli Gurriel","5.74%",6
57,779084662,"BK68 (6/16)",0,133.8,"P Alex Wood P Ariel Miranda 1B Cody Bellinger OF Nelson Cruz OF Raimel Tapia SS Jean Segura 2B Whit Merrifield 3B Eugenio Suárez OF Ben Gamel C Mike Zunino",NA,"Mark Reynolds","5.63%",7
59,779171808,"CMAD77",0,133.6,"P Gerrit Cole P John Lackey 1B Joey Votto 2B José Altuve OF Billy Hamilton SS Didi Gregorius OF Nelson Cruz OF Brett Gardner 3B Kris Bryant C Brian McCann",NA,"Javier Báez","5.42%",10
60,779011170,"JDH285",0,133.4,"P Alex Wood P Trevor Bauer 2B José Altuve OF George Springer OF Khris Davis 1B Yuli Gurriel OF Seth Smith SS Freddy Galvis 3B Maikel Franco C Martín Maldonado",NA,"Freddy Galvis","5.31%",3
60,779050231,"lminters",0,133.4,"P Alex Wood P Scott Feldman OF Aaron Judge 2B José Ramírez 1B Marwin González SS Jean Segura 3B Jake Lamb OF Ian Happ C Welington Castillo OF Avisaíl García",NA,"Miguel Cabrera","5.10%",8
60,779069029,"BIG-LEVI1",0,133.4,"P Alex Wood P Trevor Bauer 3B Miguel Sanó OF Nelson Cruz 1B Eric Thames 2B Rougned Odor OF Marcell Ozuna C Welington Castillo OF Adam Jones SS Javier Báez",NA,"Nelson Cruz","4.99%",19
63,779078870,"BoJack32 (1/2)",0,133.15,"P Sonny Gray P Trevor Bauer 1B Paul Goldschmidt 2B José Altuve SS Corey Seager OF Ryan Braun OF J.D. Martinez 3B Kris Bryant OF Mallex Smith C Russell Martin",NA,"Manny Machado","4.89%",5
63,779078977,"BoJack32 (2/2)",0,133.15,"P Sonny Gray P Trevor Bauer 1B Paul Goldschmidt 2B José Altuve SS Corey Seager OF Ryan Braun OF J.D. Martinez 3B Kris Bryant OF Mallex Smith C Russell Martin",NA,"Edwin Encarnacion","4.78%",0
65,779105341,"skolvikes2814",0,133,"P Ervin Santana P Trevor Bauer OF Mookie Betts 3B Miguel Sanó OF Giancarlo Stanton 2B Rougned Odor OF Manuel Margot SS Eduardo Escobar C Salvador Perez 1B Josh Bell",NA,"Ben Zobrist","4.46%",0
66,779091608,"gotch (3/4)",0,132.45,"P Alex Wood P Gerrit Cole 1B Joey Votto C Evan Gattis OF Ender Inciarte OF Trey Mancini OF Ben Zobrist 3B Maikel Franco SS Tim Beckham 2B Taylor Motter",NA,"Evan Gattis","4.36%",9
67,779025140,"kensheffield",0,132.05,"P Jacob deGrom P Ariel Miranda 1B Anthony Rizzo 3B Justin Turner SS Xander Bogaerts OF Josh Reddick C Salvador Perez 2B Dee Gordon OF Mallex Smith OF Keon Broxton",NA,"Logan Morrison","4.36%",6
68,779066456,"Calvin19691969 (1/10)",0,131.6,"P Gerrit Cole P John Lackey OF Charlie Blackmon 3B Nolan Arenado OF George Springer OF Ryan Braun SS Jean Segura 1B Miguel Cabrera C Buster Posey 2B José Pirela",NA,"Mitch Moreland","4.04%",3
69,779153436,"BigRedMachine1975",0,131.4,"P Scott Feldman 1B Joey Votto 2B José Altuve OF George Springer C Gary Sánchez OF Billy Hamilton SS Zack Cozart 3B Todd Frazier OF Scott Schebler P Joe Musgrove",NA,"Daniel Murphy","4.04%",0
70,779093118,"mabrandenbur (1/2)",0,131.15,"P Sonny Gray P Trevor Bauer OF George Springer OF Cody Bellinger 1B Freddie Freeman OF J.D. Martinez SS Jean Segura 3B Jake Lamb C Willson Contreras 2B José Pirela",NA,"Paul Goldschmidt","4.04%",3
70,779140544,"Nirvana26",0,131.15,"P Sonny Gray P Trevor Bauer OF Aaron Judge OF Khris Davis 3B Adrián Béltre SS Jean Segura 1B José Abreu C Salvador Perez 2B Josh Harrison OF Hunter Pence",NA,"Steven Souza Jr.","4.04%",0
72,779087494,"buchris532 (8/20)",0,130.85,"P Ervin Santana P Sonny Gray OF George Springer 1B Justin Smoak C Evan Gattis OF José Bautista 2B Ian Happ OF Ben Zobrist 3B Alex Bregman SS Addison Russell",NA,"Brett Gardner","3.93%",11
73,779118526,"edwarcd55",0,130.8,"P Alex Wood P Ariel Miranda OF George Springer OF Nelson Cruz OF J.D. Martinez 2B Ian Happ 3B Kris Bryant SS Orlando Arcia 1B Matt Carpenter C Willson Contreras",NA,"Tim Beckham","3.93%",2
74,779096971,"bberyquiet",0,130.75,"P Alex Wood P Tanner Roark OF George Springer 2B Scooter Gennett 3B Miguel Sanó 1B Logan Morrison OF Shin-soo Choo OF Mallex Smith C James McCann SS Brandon Crawford",NA,"Jonathan Schoop","3.83%",3
75,779182825,"HiImPaulo",0,130.35,"P Jon Gray P Tanner Roark OF Aaron Judge 2B José Altuve OF George Springer SS Corey Seager C Gary Sánchez 1B Wil Myers 3B Kris Bryant OF Cory Spangenberg",NA,"Justin Turner","3.83%",7
76,779047759,"kcheros",0,130.2,"P Sonny Gray P Gerrit Cole 1B Joey Votto 2B Scooter Gennett C Gary Sánchez OF Carlos Gómez OF Corey Dickerson 3B Manny Machado OF Keon Broxton SS Addison Russell",NA,"Dustin Pedroia","3.83%",0
77,779085311,"smiths0417",0,130.15,"P Sonny Gray P Trevor Bauer 2B José Altuve C Gary Sánchez OF Andrew McCutchen OF Nelson Cruz 1B Marwin González OF Giancarlo Stanton SS Freddy Galvis 3B Yunel Escobar",NA,"Adrián Béltre","3.83%",11
78,779057710,"edwintoni",0,129.85,"P Ervin Santana P Sonny Gray OF Charlie Blackmon 2B José Altuve OF George Springer OF Corey Dickerson C Yasmani Grandal 1B Victor Martinez SS Addison Russell 3B Stephen Drew",NA,"Shin-soo Choo","3.61%",14
79,778902283,"ajlin5",0,129.15,"P Sonny Gray P Trevor Bauer 3B José Ramírez OF George Springer OF Nelson Cruz SS Jean Segura OF Christian Yelich 2B Whit Merrifield 1B Mitch Moreland C Welington Castillo",NA,"Matt Garza","3.61%",22.05
80,779121115,"Andersonwill1980",0,128.85,"P Ervin Santana P Sonny Gray OF George Springer SS Corey Seager OF Nelson Cruz 1B Lucas Duda OF Jacoby Ellsbury C Manny Piña 2B Jed Lowrie 3B Johan Camargo",NA,"Daniel Norris","3.51%",-3.6
81,779113633,"Brickpro",0,128.8,"P Alex Wood P Ariel Miranda OF George Springer 2B Daniel Murphy OF Scooter Gennett OF Josh Reddick 3B Adrián Béltre 1B Yuli Gurriel SS Freddy Galvis C Martín Maldonado",NA,"Edinson Volquez","3.51%",-1.8
82,779098315,"dreday7 (3/4)",0,128.55,"P Sonny Gray P Ariel Miranda OF George Springer OF Scooter Gennett 1B Anthony Rizzo OF Ryan Braun 2B Dustin Pedroia SS Xander Bogaerts 3B Kris Bryant C Willson Contreras",NA,"Brandon Crawford","3.51%",0
83,779136135,"APashia68",0,128.35,"P Jason Vargas P Sonny Gray SS Corey Seager 1B Anthony Rizzo 2B Paul DeJong C J.T. Realmuto OF Giancarlo Stanton OF Marcell Ozuna 3B Kris Bryant OF Drew Robinson",NA,"Yasmani Grandal","3.29%",7
84,779009097,"Wolf3D",0,128.15,"P Sonny Gray P Trevor Bauer 2B José Altuve OF George Springer OF Domingo Santana 1B Marwin González OF Corey Dickerson SS Orlando Arcia C Willson Contreras 3B Evan Longoria",NA,"Asdrúbal Cabrera","3.29%",0
85,779084625,"BK68 (2/16)",0,127.8,"P Alex Wood P Ariel Miranda 3B Nolan Arenado OF George Springer C Evan Gattis 2B Brian Dozier 1B Mark Reynolds SS Pat Valaika OF Carlos González OF Alexi Amarista",NA,"Jonathan Villar","3.29%",5
86,779178789,"fez0311",0,127.75,"OF Aaron Judge 2B José Altuve OF George Springer OF Cody Bellinger C Gary Sánchez 3B Justin Turner SS Xander Bogaerts 1B Ryan Zimmerman P Joe Musgrove P Jayson Aquino",NA,"Whit Merrifield","3.19%",12
87,779175444,"Asullivan10",0,127.65,"P Alex Wood P John Lackey OF George Springer 1B Anthony Rizzo OF Michael Brantley OF Marwin González 2B Brian Dozier 3B Eduardo Escobar C Manny Piña SS Tzu-Wei Lin",NA,"Doug Fister","3.19%",0.85
88,779050218,"skynyrdus62 (5/5)",0,127.35,"P Gerrit Cole P Trevor Bauer OF George Springer 1B Anthony Rizzo 3B Travis Shaw SS Andrelton Simmons OF Jay Bruce 2B Ian Happ OF Corey Dickerson C Yasmani Grandal",NA,"Keon Broxton","3.19%",16
89,779137722,"wjhouse (4/20)",0,127.25,"P Alex Wood P Sonny Gray OF Shin-soo Choo 2B Brian Dozier C Buster Posey OF José Bautista 3B Chase Headley SS Freddy Galvis OF Mallex Smith 1B Albert Pujols",NA,"José Pirela","3.08%",18
90,779093613,"tsheets08",0,127.15,"P Sonny Gray P Trevor Bauer SS Corey Seager 3B Miguel Sanó 1B Anthony Rizzo OF Nelson Cruz 2B Rougned Odor OF Corey Dickerson C Salvador Perez OF Ben Zobrist",NA,"Max Kepler","3.08%",2
91,779027673,"KingCramp03",0,127.1,"P Alex Wood P Ervin Santana 1B Joey Votto C Yadier Molina 3B Eugenio Suárez OF Trey Mancini OF Jake Marisnick 2B Javier Báez OF Cory Spangenberg SS Tim Anderson",NA,"Eduardo Escobar","2.98%",5
91,779161742,"uncleross5 (1/2)",0,127.1,"P Zack Godley P Jon Gray OF Aaron Judge 1B Paul Goldschmidt C Gary Sánchez OF Ryan Braun OF J.D. Martinez 2B Rougned Odor 3B Maikel Franco SS Erick Aybar",NA,"Jonathan Lucroy","2.98%",2
91,779162163,"uncleross5 (2/2)",0,127.1,"P Zack Godley P Jon Gray OF Aaron Judge 1B Paul Goldschmidt C Gary Sánchez OF Ryan Braun OF J.D. Martinez 2B Rougned Odor 3B Maikel Franco SS Erick Aybar",NA,"Giancarlo Stanton","2.98%",37
94,779150588,"1Kings",0,127.05,"P Ervin Santana P Gerrit Cole OF Aaron Judge SS Corey Seager 3B Justin Turner 2B Chris Taylor 1B Ryan Zimmerman OF Cory Spangenberg C Russell Martin OF Albert Almora Jr.",NA,"Robinson Canó","2.87%",5
95,779040223,"Timmer21774",0,127,"P Ervin Santana P Trevor Bauer OF Aaron Judge 2B José Altuve 3B Travis Shaw OF J.D. Martinez C Buster Posey OF Marcell Ozuna 1B Mark Reynolds SS Adeiny Hechavarria",NA,"Jake Lamb","2.87%",5
96,779185400,"ccon33 (2/2)",0,126.45,"P Alex Wood P Gerrit Cole C Gary Sánchez OF Ryan Braun OF Raimel Tapia 2B Rougned Odor OF Scott Schebler SS Pat Valaika 1B Luke Voit 3B Greg Garcia",NA,"Josh Harrison","2.87%",3
97,779150761,"Sumbee (1/4)",0,126.4,"P Alex Wood P Trevor Bauer 3B Miguel Sanó OF Brett Gardner OF José Bautista 2B Rougned Odor OF Melky Cabrera C Salvador Perez 1B Mark Reynolds SS Alexi Amarista",NA,"Josh Reddick","2.76%",18
98,779146629,"mathofbirds (2/4)",0,126.35,"P Gerrit Cole P Trevor Bauer OF George Springer OF Scooter Gennett 3B Travis Shaw OF Tommy Pham SS Zack Cozart 1B Yonder Alonso 2B Josh Harrison C Willson Contreras",NA,"José Bautista","2.66%",9
99,779121784,"zjazz",0,126.15,"P Sonny Gray P Trevor Bauer OF Aaron Judge 1B Cody Bellinger OF Khris Davis SS Jean Segura C Buster Posey 3B Kris Bryant 2B Dee Gordon OF Jon Jay",NA,"James McCann","2.66%",2
99,779139120,"bleachers",0,126.15,"P Sonny Gray P Trevor Bauer OF Aaron Judge OF Jackie Bradley Jr. 3B Adrián Béltre C Evan Gattis SS Francisco Lindor 1B Mitch Moreland 2B Rougned Odor OF Jacoby Ellsbury",NA,"Matt Kemp","2.66%",3
101,779061050,"vin2x",0,125.7,"P Gerrit Cole P Tanner Roark OF Charlie Blackmon OF Aaron Judge 1B Anthony Rizzo SS Francisco Lindor 2B Rougned Odor 3B Kris Bryant OF Gregory Polanco C Welington Castillo",NA,"Marwin González","2.66%",14
101,779185377,"ccon33 (1/2)",0,125.7,"P Sonny Gray P Edinson Volquez OF Mookie Betts 2B José Altuve OF George Springer SS Xander Bogaerts OF Marwin González 1B Mitch Moreland C Salvador Perez 3B Alex Bregman",NA,"Russell Martin","2.66%",20
103,779021042,"luckyDONK",0,125.5,"P Jason Vargas P Trevor Bauer OF George Springer 1B Anthony Rizzo OF Khris Davis 2B Ian Happ 3B Kris Bryant OF Lorenzo Cain SS Eduardo Escobar C Salvador Perez",NA,"Yonder Alonso","2.55%",4
104,779034983,"cdknisal",0,125.4,"P Alex Wood P Trevor Bauer OF Andrew Benintendi OF Shin-soo Choo SS Jean Segura OF Cameron Maybin 1B Buster Posey 2B Ian Kinsler 3B Manny Machado C James McCann",NA,"Nicholas Castellanos","2.55%",5
104,779060399,"marpflore",0,125.4,"P Alex Wood P Trevor Bauer 3B Miguel Sanó OF Michael Brantley 1B Eric Thames 2B Rougned Odor OF Marcell Ozuna C Yasmani Grandal OF Adam Jones SS Javier Báez",NA,"Trey Mancini","2.44%",6
104,779161596,"baxter9140",0,125.4,"P Alex Wood P Trevor Bauer OF George Springer 1B Freddie Freeman OF Ryan Braun 3B Kris Bryant C Willson Contreras 2B Brandon Phillips OF Keon Broxton SS Tim Beckham",NA,"Mike Moustakas","2.44%",24
107,779056959,"oliphantj15",0,125.25,"P Alex Wood P Sonny Gray 2B José Altuve C Gary Sánchez 1B Mitch Moreland OF Lorenzo Cain OF Daniel Nava SS Freddy Galvis OF Austin Slater 3B Rubén Tejada",NA,"Billy Hamilton","2.44%",8
108,779056102,"BigThad",0,125.1,"P Alex Wood P Ervin Santana OF Domingo Santana 1B Justin Bour 2B Ian Happ OF Robbie Grossman OF Mitch Haniger SS Freddy Galvis C Mike Zunino 3B Derek Dietrich",NA,"Tanner Roark","2.44%",0
109,779067339,"HAVOC77 (2/3)",0,125,"P Jon Gray P Trevor Bauer 3B Nolan Arenado 1B Cody Bellinger C Gary Sánchez SS Xander Bogaerts OF J.D. Martinez OF Giancarlo Stanton 2B Ian Happ OF Marcell Ozuna",NA,"Chase Headley","2.44%",0
110,779122719,"Pack77 (1/2)",0,124.7,"P Trevor Bauer P Ariel Miranda OF Aaron Judge 2B José Altuve OF George Springer 1B Cody Bellinger 3B Travis Shaw OF Tommy Pham C Buster Posey SS Asdrúbal Cabrera",NA,"Jay Bruce","2.44%",0
110,779122724,"Pack77 (2/2)",0,124.7,"P Trevor Bauer P Ariel Miranda OF Aaron Judge 2B José Altuve OF George Springer 1B Cody Bellinger 3B Travis Shaw OF Tommy Pham C Buster Posey SS Asdrúbal Cabrera",NA,"Michael Brantley","2.44%",6
112,779127446,"erichatcher22",0,124.55,"P Sonny Gray P Ariel Miranda OF Aaron Judge 1B Anthony Rizzo OF Andrew McCutchen SS Didi Gregorius 3B Nicholas Castellanos C Evan Gattis 2B Ian Happ OF Marcell Ozuna",NA,"Andrelton Simmons","2.44%",8
