"Rank","EntryId","EntryName","TimeRemaining","Points","Lineup","X","Player","X.Drafted","FPTS"
110,748501444,"papagates (7/18)",0,136.65,"P Max Scherzer P Robbie Ray 1B Eric Thames OF Keon Broxton SS Aledmys Díaz 2B Jedd Gyorko OF Randal Grichuk 3B Travis Shaw OF Domingo Santana C Manny Piña",NA,"Eric Thames","2.72%",19
110,748577130,"OC515",0,136.65,"P Matt Andriese P Jharel Cotton OF Bryce Harper 2B José Altuve C Gary Sánchez OF Brett Gardner 3B José Ramírez SS Freddy Galvis OF Ben Gamel 1B Yonder Alonso",NA,"Justin Turner","2.72%",5
112,748624560,"hettingd",0,136.45,"P Carlos Carrasco P Justin Verlander OF Aaron Judge SS Jean Segura OF Marcell Ozuna 3B Jedd Gyorko OF Aaron Altherr 1B Cody Bellinger 2B César Hernández C Devin Mesoraco",NA,"Joe Mauer","2.72%",10
113,748081698,"ebor1973 (2/3)",0,136.3,"P Carlos Carrasco P Charlie Morton 1B Ryan Zimmerman 3B Anthony Rendon SS Jean Segura 2B Robinson Canó C Matt Wieters OF Eddie Rosario OF Corey Dickerson OF Tommy Pham",NA,"Ender Inciarte","2.72%",7
113,748234403,"plord64",0,136.3,"P Carlos Carrasco P Charlie Morton SS Francisco Lindor OF Andrew Benintendi 2B Robinson Canó 1B Carlos Santana 3B José Ramírez OF Aaron Altherr OF Corey Dickerson C Brian McCann",NA,"Tommy Pham","2.72%",14
113,748609703,"caronnaguy27 (2/2)",0,136.3,"P Carlos Carrasco P Charlie Morton OF Bryce Harper 2B José Altuve C Gary Sánchez SS Francisco Lindor 3B José Ramírez OF Tommy Pham 1B Yonder Alonso OF Matt Joyce",NA,"Mikie Mahtook","2.72%",7
116,748103906,"youdacao (10/18)",0,136,"P Max Scherzer P Alex Meyer 3B Kris Bryant OF Ben Zobrist C Willson Contreras SS Addison Russell OF Max Kepler 2B Brad Miller OF Corey Dickerson 1B Logan Morrison",NA,"Jake Lamb","2.72%",4
116,748354821,"fallfromgrace (1/6)",0,136,"P Max Scherzer P Drew Pomeranz 3B Kris Bryant 1B Carlos Santana 2B Brad Miller OF Kevin Kiermaier C Yasmani Grandal OF Colby Rasmus OF Corey Dickerson SS Tim Beckham",NA,"Keon Broxton","2.72%",42
118,748501454,"papagates (17/18)",0,135.9,"P Max Scherzer P Justin Verlander OF Ryan Braun 1B Eric Thames OF Rajai Davis 3B Travis Shaw OF Domingo Santana C James McCann 2B Jed Lowrie SS Adam Rosales",NA,"Omar Narváez","2.56%",6
119,748063021,"Awesemo (2/10)",0,135.55,"P Carlos Carrasco P Drew Pomeranz OF Mookie Betts SS Addison Russell 3B Evan Longoria 2B Brad Miller C J.T. Realmuto OF Colby Rasmus OF Corey Dickerson 1B Logan Morrison",NA,"René Rivera","2.56%",10
120,748595433,"jwp88",0,135.35,"P Max Scherzer P Carlos Carrasco SS Francisco Lindor 3B Maikel Franco OF Khris Davis OF Avisaíl García OF Aaron Altherr 1B Yonder Alonso 2B Jed Lowrie C Martín Maldonado",NA,"Xander Bogaerts","2.40%",7
121,748073532,"m3deman (1/2)",0,135.3,"P Carlos Carrasco P Charlie Morton OF Bryce Harper 2B Daniel Murphy OF Andrew Benintendi 3B Maikel Franco SS Zack Cozart OF Domingo Santana C Sandy León 1B Yonder Alonso",NA,"Eduardo Escobar","2.24%",5
121,748684882,"bigdavetrucking",0,135.3,"P Max Scherzer P Zack Wheeler C Gary Sánchez OF Aaron Judge OF Jay Bruce OF Michael Conforto 3B José Reyes 2B Neil Walker SS Ronald Torreyes 1B T.J. Rivera",NA,"Yasmani Grandal","2.24%",22
123,748450651,"ehafner (14/18)",0,134.85,"P Max Scherzer OF Mookie Betts SS Xander Bogaerts 3B Jedd Gyorko OF Randal Grichuk 1B Mitch Moreland 2B Kolten Wong C Yadier Molina OF Tommy Pham P Julio Urías",NA,"Rickie Weeks Jr.","2.24%",15
124,748694698,"mjchan89",0,134.5,"P Max Scherzer P Ariel Miranda 2B José Altuve SS Carlos Correa OF George Springer 3B Kyle Seager 1B Carlos Santana OF Carlos Beltrán OF Ben Gamel C René Rivera",NA,"Dustin Pedroia","2.24%",13
125,748522855,"superm123 (14/18)",0,134.3,"P Carlos Carrasco P Charlie Morton 2B José Altuve SS Carlos Correa OF George Springer 3B Evan Longoria OF Josh Reddick OF Corey Dickerson 1B Logan Morrison C Jesús Sucre",NA,"Yan Gomes","2.24%",25
126,748063026,"Awesemo (7/10)",0,134.2,"P Carlos Carrasco P Robbie Ray C Gary Sánchez 3B Evan Longoria OF Khris Davis 2B Brad Miller SS Jorge Polanco OF Colby Rasmus OF Corey Dickerson 1B Logan Morrison",NA,"Matt Carpenter","2.08%",5
126,748398204,"GOULET (1/2)",0,134.2,"P Max Scherzer P Matt Andriese OF Ryan Braun SS Carlos Correa 3B Maikel Franco 1B Tommy Joseph OF Avisaíl García OF Aaron Altherr 2B César Hernández C Geovany Soto",NA,"Bruce Maxwell","2.08%",3
126,748594385,"runninonempty",0,134.2,"P Carlos Carrasco P Robbie Ray OF Mookie Betts SS Francisco Lindor 3B Maikel Franco 1B Edwin Encarnación OF Khris Davis OF Lonnie Chisenhall 2B Jed Lowrie C Yan Gomes",NA,"Manny Piña","2.08%",2
129,748103904,"youdacao (8/18)",0,134,"P Max Scherzer P Alex Meyer 1B Anthony Rizzo 3B Kris Bryant OF Ben Zobrist 2B Javier Báez OF Justin Upton C James McCann OF Mikie Mahtook SS José Iglesias",NA,"Christian Yelich","1.92%",0
129,748632794,"dr00pd0g (2/2)",0,134,"P Max Scherzer P Alex Meyer OF Mookie Betts SS Xander Bogaerts OF Andrew Benintendi 2B Dustin Pedroia 3B Todd Frazier OF Avisaíl García C J.T. Realmuto 1B Mitch Moreland",NA,"Joey Votto","1.92%",11
131,748621702,"Bales (2/3)",0,133.85,"P Max Scherzer SS Carlos Correa OF George Springer OF Khris Davis OF Josh Reddick 3B Ryon Healy C Brian McCann 1B Yonder Alonso 2B Jed Lowrie P Julio Urías",NA,"Randal Grichuk","1.92%",4
132,748189179,"scout326 (9/12)",0,133.4,"P Carlos Carrasco OF Ryan Braun 1B Eric Thames SS Corey Seager 2B Jonathan Villar C Yasmani Grandal 3B Justin Turner OF Cody Bellinger OF Andrew Toles P Julio Urías",NA,"César Hernández","1.76%",14
133,748474723,"BrandonAdams (3/18)",0,133.35,"P Max Scherzer P Carlos Carrasco OF Giancarlo Stanton 1B Edwin Encarnación 2B Brad Miller 3B Mike Moustakas OF Corey Dickerson SS Tim Beckham C Jason Castro OF Matt Joyce",NA,"Joc Pederson","1.76%",3
134,748041756,"thegodfava (1/2)",0,133.3,"P Carlos Carrasco P Charlie Morton OF Ryan Braun 1B Eric Thames OF Andrew Benintendi 3B Maikel Franco 2B Jonathan Villar SS Orlando Arcia C Sandy León OF Michael Saunders",NA,"Chris Carter","1.76%",2
134,748090776,"ShortMyOwnTeam (1/2)",0,133.3,"P Carlos Carrasco P Charlie Morton OF Bryce Harper 1B Ryan Zimmerman 3B Anthony Rendon 2B Starlin Castro OF Aaron Altherr OF Colby Rasmus C Cameron Rupp SS Tim Beckham",NA,"Kevin Kiermaier","1.76%",14
134,748098887,"ShortMyOwnTeam (2/2)",0,133.3,"P Carlos Carrasco P Charlie Morton OF Bryce Harper 1B Ryan Zimmerman 3B Anthony Rendon 2B Starlin Castro OF Aaron Altherr OF Colby Rasmus C Cameron Rupp SS Tim Beckham",NA,"Jeff Mathis","1.76%",0
134,748099199,"fergueven71",0,133.3,"P Carlos Carrasco P Charlie Morton OF Bryce Harper SS Carlos Correa OF Aaron Judge 2B Robinson Canó OF Adam Duvall 1B Logan Morrison 3B Derek Dietrich C Jeff Mathis",NA,"Yadier Molina","1.76%",7
134,748232072,"ineedmoney23 (2/2)",0,133.3,"P Carlos Carrasco P Charlie Morton 2B José Altuve SS Carlos Correa OF George Springer 3B José Ramírez OF Josh Reddick OF Corey Dickerson C Brian McCann 1B Logan Morrison",NA,"Yuli Gurriel","1.60%",2
139,748501451,"papagates (14/18)",0,133.15,"P Justin Verlander P Jerad Eickhoff OF Ryan Braun 1B Eric Thames SS Corey Seager 2B Jonathan Villar OF Keon Broxton OF Joc Pederson C Yasmani Grandal 3B Travis Shaw",NA,"Albert Almora Jr.","1.60%",7
140,748442312,"ChipotleAddict (12/18)",0,132.9,"P Max Scherzer P Justin Verlander 1B Edwin Encarnación 2B Jason Kipnis OF Max Kepler 3B José Ramírez OF Eddie Rosario SS Jorge Polanco OF Lonnie Chisenhall C Yan Gomes",NA,"Cameron Rupp","1.60%",10
141,748450639,"ehafner (2/18)",0,132.4,"P Carlos Carrasco 1B Miguel Cabrera OF Giancarlo Stanton 2B Robinson Canó OF Justin Upton 3B Nicholas Castellanos OF Marcell Ozuna C J.T. Realmuto SS José Iglesias P Julio Urías",NA,"Tommy Joseph","1.60%",22
142,748591959,"KKHS_Maz (2/2)",0,132.35,"P Max Scherzer P Carlos Carrasco C Gary Sánchez OF Khris Davis 3B Ryon Healy SS Zack Cozart OF Corey Dickerson 1B Yonder Alonso 2B Jed Lowrie OF Matt Joyce",NA,"Chris Owings","1.44%",6
143,748416992,"DraftCheat (13/18)",0,132.15,"P Matt Andriese P Charlie Morton 3B Kris Bryant 2B Daniel Murphy SS Francisco Lindor 1B José Abreu OF Andrew Benintendi OF Josh Reddick OF Corey Dickerson C Brian McCann",NA,"Chris Young","1.44%",2
144,748201372,"SaahilSud (13/18)",0,131.9,"P Max Scherzer P CC Sabathia SS Trea Turner C Gary Sánchez 3B Maikel Franco 1B Tommy Joseph OF Odúbel Herrera OF Aaron Altherr OF Corey Dickerson 2B César Hernández",NA,"Didi Gregorius","1.44%",22
145,748612378,"j3lly",0,131.3,"P Ariel Miranda P Héctor Santiago OF Mookie Betts SS Carlos Correa C Gary Sánchez 1B Eric Thames OF Andrew Benintendi OF Adam Duvall 2B Starlin Castro 3B Jake Lamb",NA,"Trevor Plouffe","1.44%",10
146,748683609,"nomoreiloveyous (4/4)",0,131,"P Max Scherzer P Alex Meyer 3B Kris Bryant OF Bryce Harper SS Trea Turner 2B Brad Miller OF Kevin Kiermaier OF Corey Dickerson C Brian McCann 1B Logan Morrison",NA,"Yasmany Tomás","1.28%",7
147,748389550,"heels123",0,130.75,"P Max Scherzer P Charlie Morton 3B Kris Bryant SS Addison Russell OF Adam Duvall OF Gerardo Parra OF Colby Rasmus C Brian McCann 1B Yonder Alonso 2B Jed Lowrie",NA,"Rajai Davis","1.28%",16
148,748383825,"Clanning83",0,130.55,"P Jeff Samardzija P Matt Andriese SS Carlos Correa OF Aaron Judge 1B José Abreu 2B Robinson Canó OF Avisaíl García OF Josh Reddick C Yasmani Grandal 3B Justin Turner",NA,"Chris Heisey","1.28%",3
148,748707348,"cubsfan333 (9/9)",0,130.55,"P Carlos Carrasco P Drew Pomeranz 3B Kris Bryant 2B Javier Báez C Willson Contreras SS Addison Russell OF Albert Almora Jr. 1B Yonder Alonso OF Matt Joyce OF Magneuris Sierra",NA,"Dan Straily","1.28%",20.75
150,748425170,"tinderella (5/5)",0,130.4,"P Carlos Carrasco 3B Kris Bryant 1B Paul Goldschmidt OF A.J. Pollock OF Max Kepler OF David Peralta SS Jorge Polanco 2B Brandon Drury C Jason Castro P Julio Urías",NA,"Odúbel Herrera","1.28%",14
151,748201384,"SaahilSud (15/18)",0,130.3,"P Max Scherzer P Zack Wheeler SS Trea Turner OF Ryan Braun 1B Miguel Cabrera 2B Jonathan Villar OF Domingo Santana C James McCann OF Mikie Mahtook 3B T.J. Rivera",NA,"Matt Kemp","1.28%",12
152,748206547,"golions85 (1/2)",0,130.2,"P Max Scherzer P Matt Andriese OF Bryce Harper 2B Daniel Murphy 3B Maikel Franco 1B Tommy Joseph SS Freddy Galvis C Cameron Rupp OF Michael Saunders OF Ezequiel Carrera",NA,"Dustin Garneau","1.28%",6
153,748028613,"nomoreiloveyous (3/4)",0,130,"P Max Scherzer P Alex Meyer OF Bryce Harper SS Trea Turner C Gary Sánchez 3B Evan Longoria 2B Brad Miller OF Colby Rasmus OF Corey Dickerson 1B Logan Morrison",NA,"Scott Schebler","1.12%",12
153,748201369,"SaahilSud (12/18)",0,130,"P Max Scherzer P Drew Pomeranz SS Trea Turner 2B Robinson Canó 3B Kyle Seager OF Max Kepler 1B Joe Mauer OF Corey Dickerson OF Ben Gamel C Jason Castro",NA,"Tim Adleman","1.12%",17.05
155,748425168,"tinderella (3/5)",0,129.8,"P Charlie Morton 3B Kris Bryant SS Trea Turner OF Ryan Braun 1B Eric Thames 2B Jonathan Villar OF Adam Jones OF Domingo Santana C Manny Piña P Julio Urías",NA,"Aledmys Díaz","1.12%",0
156,748479839,"bringdaruckus312 (1/2)",0,129.75,"P Carlos Carrasco P Matt Andriese C Gary Sánchez OF Aaron Judge OF Brett Gardner 1B Matt Carpenter 2B Starlin Castro 3B Eugenio Suárez SS Zack Cozart OF Ben Gamel",NA,"Brandon Belt","1.12%",2
156,748583731,"Brett_G",0,129.75,"P Max Scherzer P Charlie Morton OF Aaron Judge OF Andrew Benintendi 2B Robinson Canó 3B Maikel Franco OF Cody Bellinger C Brian McCann 1B Logan Morrison SS Tim Beckham",NA,"Justin Bour","1.12%",7
158,748381611,"Awesemo (9/10)",0,129.65,"P Max Scherzer P Robbie Ray SS Francisco Lindor 2B Brad Miller OF Joc Pederson C Yasmani Grandal 3B Justin Turner OF Cody Bellinger OF Corey Dickerson 1B Logan Morrison",NA,"Melky Cabrera","0.96%",0
159,748436865,"reztes757 (2/6)",0,129.45,"P Carlos Carrasco P Justin Verlander 3B Kris Bryant OF Andrew Benintendi OF Max Kepler 1B Kennys Vargas OF Eddie Rosario SS Eduardo Escobar C Jason Castro 2B Alexi Amarista",NA,"DJ LeMahieu","0.96%",0
160,748293609,"seneca84",0,129.4,"P Drew Pomeranz P Matt Andriese SS Trea Turner OF Mookie Betts OF Andrew Benintendi 2B Robinson Canó 3B Kyle Seager OF Josh Reddick C J.T. Realmuto 1B Mitch Moreland",NA,"Brandon Drury","0.96%",12
160,748592493,"Assani (6/6)",0,129.4,"P Carlos Carrasco C Gary Sánchez OF Aaron Judge OF Brett Gardner OF Jacoby Ellsbury 2B Starlin Castro SS Zack Cozart 3B Justin Turner 1B Yonder Alonso P Julio Urías",NA,"CC Sabathia","0.96%",1.5
162,748092782,"fortheoffice (1/10)",0,129.3,"P Justin Verlander P Matt Andriese 3B Kris Bryant OF Bryce Harper C Matt Wieters 2B Brad Miller SS Zack Cozart OF Colby Rasmus OF Corey Dickerson 1B Logan Morrison",NA,"Michael Conforto","0.96%",21
163,748442308,"ChipotleAddict (8/18)",0,129.25,"P Justin Verlander P Jeff Samardzija OF George Springer 3B Evan Longoria OF Carlos Beltrán 2B Brad Miller OF Josh Reddick C Brian McCann 1B Logan Morrison SS Tim Beckham",NA,"Buster Posey","0.96%",16
164,748050096,"Cicima6709 (1/2)",0,129.2,"P Carlos Carrasco P Robbie Ray SS Trea Turner OF Khris Davis OF Rajai Davis 2B Brad Miller 3B Ryon Healy C J.T. Realmuto OF Cody Bellinger 1B Yonder Alonso",NA,"Andrew McCutchen","0.96%",7
164,748717589,"Cicima6709 (2/2)",0,129.2,"P Carlos Carrasco P Robbie Ray SS Trea Turner OF Khris Davis OF Rajai Davis 2B Brad Miller 3B Ryon Healy C J.T. Realmuto OF Cody Bellinger 1B Yonder Alonso",NA,"Conor Gillaspie","0.96%",0
166,748189174,"scout326 (4/12)",0,128.85,"P Max Scherzer OF Ryan Braun 1B Eric Thames 2B Jonathan Villar OF Max Kepler SS Jorge Polanco OF Domingo Santana 3B Eduardo Escobar C Jason Castro P Julio Urías",NA,"Tyler Flowers","0.96%",5
167,748050789,"mcampb05 (1/2)",0,128.8,"P Carlos Carrasco P Jharel Cotton 3B Kris Bryant 2B Ben Zobrist C Willson Contreras OF Albert Almora Jr. OF Kevin Kiermaier OF Colby Rasmus SS Tim Beckham 1B Rickie Weeks Jr.",NA,"Norichika Aoki","0.96%",5
168,748412066,"isupol (3/3)",0,128.7,"P Carlos Carrasco P Jeff Samardzija SS Corey Seager 3B Evan Longoria 2B Brad Miller OF Joc Pederson C Yasmani Grandal OF Cody Bellinger 1B Logan Morrison OF Andrew Toles",NA,"Nick Markakis","0.96%",7
169,748416989,"DraftCheat (10/18)",0,128.15,"P Matt Andriese P Charlie Morton 3B Kris Bryant OF Bryce Harper SS Trea Turner OF Andrew Benintendi 2B Brad Miller OF Avisaíl García C Brian McCann 1B Yonder Alonso",NA,"Ronald Torreyes","0.80%",0
169,748463803,"HoChiMinhCity",0,128.15,"P Matt Andriese P Charlie Morton OF Mookie Betts C Gary Sánchez OF Andrew Benintendi SS Corey Seager OF Brett Gardner 3B Todd Frazier 2B Starlin Castro 1B Mitch Moreland",NA,"Michael Saunders","0.80%",18
169,748523238,"ilikepie123 (1/2)",0,128.15,"P Max Scherzer P Dan Straily 2B José Altuve OF Aaron Judge OF Adam Duvall OF Billy Hamilton 3B Eugenio Suárez SS Zack Cozart 1B Yonder Alonso C Devin Mesoraco",NA,"Derek Dietrich","0.80%",15
172,748501441,"papagates (4/18)",0,127.65,"P Max Scherzer P Robbie Ray 1B Freddie Freeman 2B Jonathan Villar OF Keon Broxton 3B Travis Shaw OF Ender Inciarte SS Orlando Arcia OF Danny Santana C Tyler Flowers",NA,"Jarrod Dyson","0.80%",0
173,748563285,"0000__available",0,127.3,"P Carlos Carrasco P Charlie Morton 3B Kris Bryant OF Aaron Judge 2B Robinson Canó SS Corey Seager OF Khris Davis 1B Mitch Moreland OF Corey Dickerson C René Rivera",NA,"Freddy Galvis","0.80%",9
174,748474730,"BrandonAdams (10/18)",0,127.05,"P Max Scherzer P Jerad Eickhoff 3B Kris Bryant SS Carlos Correa 1B Edwin Encarnación 2B Jason Kipnis OF Josh Reddick OF Corey Dickerson C Yan Gomes OF Matt Joyce",NA,"Jay Bruce","0.80%",7
175,748103913,"youdacao (17/18)",0,127,"P Max Scherzer P Alex Meyer 1B Anthony Rizzo 3B Kris Bryant C Willson Contreras SS Addison Russell 2B Brad Miller OF Colby Rasmus OF Corey Dickerson OF Andrew Toles",NA,"Matt Davidson","0.80%",0
175,748430659,"dahladino (1/5)",0,127,"P Max Scherzer P Drew Pomeranz C Gary Sánchez 3B Evan Longoria OF A.J. Pollock 2B Brad Miller SS Jorge Polanco OF Colby Rasmus OF Corey Dickerson 1B Logan Morrison",NA,"Brandon Phillips","0.80%",2
177,748027755,"dacoltz",0,126.85,"P Max Scherzer 2B José Altuve SS Corey Seager OF Josh Reddick OF Joc Pederson C Yasmani Grandal 3B Justin Turner OF Cody Bellinger 1B Yuli Gurriel P Julio Urías",NA,"Joe Panik","0.64%",0
177,748099140,"fortheoffice (7/10)",0,126.85,"P Max Scherzer 3B Kris Bryant 2B Jason Kipnis OF Gerardo Parra OF Josh Reddick C J.T. Realmuto OF Corey Dickerson 1B Logan Morrison SS José Iglesias P Julio Urías",NA,"Mike Moustakas","0.64%",19
177,748645193,"jerryrgivens",0,126.85,"P Max Scherzer OF Bryce Harper 1B Freddie Freeman 2B Robinson Canó C Buster Posey 3B Eugenio Suárez OF Lonnie Chisenhall OF Tommy Pham SS Adam Rosales P Julio Urías",NA,"Adam Rosales","0.64%",7
180,748599617,"aliabduljabbar",0,126.8,"P Carlos Carrasco P Jharel Cotton OF Bryce Harper SS Trea Turner 2B Daniel Murphy OF Jay Bruce OF Michael Conforto 1B Rickie Weeks Jr. 3B T.J. Rivera C René Rivera",NA,"Abraham Almonte","0.64%",5
181,748591279,"underjones (16/18)",0,126.55,"P Carlos Carrasco P Alex Meyer 3B Kris Bryant 2B Javier Báez C Willson Contreras 1B Freddie Freeman SS Addison Russell OF Matt Kemp OF Ender Inciarte OF Nick Markakis",NA,"Yandy Díaz","0.64%",2
182,748040118,"rikkidee (3/9)",0,126.25,"P Max Scherzer P Jharel Cotton SS Carlos Correa OF George Springer 3B Evan Longoria 2B Brad Miller OF Josh Reddick OF Corey Dickerson C Brian McCann 1B Rickie Weeks Jr.",NA,"Willy García","0.64%",7
183,748194189,"mcnutt24",0,126.15,"P Max Scherzer P Jeff Samardzija 2B José Altuve 3B Evan Longoria OF Khris Davis OF Corey Dickerson 1B Logan Morrison OF Lonnie Chisenhall SS Tim Beckham C James McCann",NA,"Jordy Mercer","0.64%",0
184,748103900,"youdacao (4/18)",0,126,"P Max Scherzer P Alex Meyer 3B Kris Bryant 2B Ben Zobrist C Willson Contreras SS Addison Russell OF Max Kepler OF Eddie Rosario OF Byron Buxton 1B Joe Mauer",NA,"Jesús Sucre","0.64%",3
185,748522847,"superm123 (6/18)",0,125.75,"P Max Scherzer P Charlie Morton 2B José Altuve SS Carlos Correa OF George Springer OF Khris Davis 3B Ryon Healy 1B Yonder Alonso C Bruce Maxwell OF Matt Joyce",NA,"Ivan Nova","0.64%",8.85
186,748385996,"Drolson22 (1/2)",0,125.7,"P Matt Andriese P Zack Wheeler SS Carlos Correa OF Aaron Judge 1B José Abreu OF Andrew Benintendi 2B Robinson Canó OF Khris Davis 3B Nicholas Castellanos C Matt Wieters",NA,"Chris Taylor","0.64%",5
187,748219916,"ksiedes (3/3)",0,125.55,"P Charlie Morton P Héctor Santiago 3B Kris Bryant SS Carlos Correa OF Ben Zobrist OF Giancarlo Stanton 2B Robinson Canó 1B Mark Reynolds OF Gerardo Parra C Cameron Rupp",NA,"Salvador Pérez","0.64%",30
188,748064888,"dualdongi",0,125.5,"P Jeff Samardzija P Dan Straily 3B Kris Bryant 2B José Altuve SS Carlos Correa OF José Bautista OF Max Kepler 1B Kennys Vargas OF Corey Dickerson C Jason Castro",NA,"Orlando Arcia","0.48%",12
189,748442307,"ChipotleAddict (7/18)",0,125.4,"P Justin Verlander P Zack Wheeler 3B Kris Bryant OF Ben Zobrist 2B Javier Báez OF Max Kepler 1B Kennys Vargas OF Eddie Rosario SS Jorge Polanco C Jason Castro",NA,"Ehire Adrianza","0.48%",9
190,748201396,"SaahilSud (16/18)",0,125.35,"P Max Scherzer P Carlos Carrasco SS Francisco Lindor 2B Jason Kipnis 1B Carlos Santana 3B José Ramírez OF Lonnie Chisenhall C James McCann OF Mikie Mahtook OF Andrew Romine",NA,"Mike Pelfrey","0.48%",4.3
190,748666328,"tow2nd2none",0,125.35,"P Max Scherzer P Carlos Carrasco SS Francisco Lindor OF Khris Davis C Matt Wieters 3B Ryon Healy OF Corey Dickerson 1B Yonder Alonso 2B Jed Lowrie OF Matt Joyce",NA,"Byron Buxton","0.48%",15
192,748416983,"DraftCheat (4/18)",0,125.15,"P Matt Andriese P Charlie Morton OF Bryce Harper SS Trea Turner 2B Daniel Murphy OF Ben Zobrist OF Andrew Benintendi 3B Maikel Franco C James McCann 1B Yonder Alonso",NA,"Manny Machado","0.48%",3
193,748592490,"Assani (3/6)",0,124.95,"P Drew Pomeranz P Charlie Morton OF Mookie Betts 2B José Altuve SS Carlos Correa 3B Anthony Rendon OF Andrew Benintendi OF Josh Reddick C Brian McCann 1B Yuli Gurriel",NA,"Seth Smith","0.48%",19
194,748442309,"ChipotleAddict (9/18)",0,124.9,"P Max Scherzer P Justin Verlander OF Adam Duvall 2B Brad Miller 3B Eugenio Suárez SS Zack Cozart OF Kevin Kiermaier OF Corey Dickerson 1B Logan Morrison C Devin Mesoraco",NA,"Adeiny Hechavarria","0.48%",0
195,748575517,"michaeladillard (1/2)",0,124.6,"P Max Scherzer P Héctor Santiago OF Bryce Harper SS Trea Turner OF Khris Davis C Matt Wieters OF Josh Reddick 3B Justin Turner 1B Yonder Alonso 2B Jed Lowrie",NA,"Curtis Granderson","0.48%",0
196,748425167,"tinderella (2/5)",0,124.35,"P Max Scherzer P Carlos Carrasco 1B Matt Carpenter OF Max Kepler 3B Jedd Gyorko OF Randal Grichuk SS Jorge Polanco 2B Kolten Wong OF Tommy Pham C Jason Castro",NA,"Ezequiel Carrera","0.48%",3
196,748551410,"cubsfan333 (2/9)",0,124.35,"P Max Scherzer P Carlos Carrasco 2B José Altuve 3B Todd Frazier OF Cody Bellinger OF Corey Dickerson 1B Logan Morrison SS Tim Beckham OF Matt Joyce C Omar Narváez",NA,"Chris Young","0.48%",-3.85
198,748189176,"scout326 (6/12)",0,124.05,"P Drew Pomeranz 1B Anthony Rizzo 3B Kris Bryant 2B Javier Báez C Willson Contreras OF Odúbel Herrera OF Aaron Altherr SS Freddy Galvis OF Michael Saunders P Julio Urías",NA,"Magneuris Sierra","0.48%",12
199,748555701,"cubsfan333 (3/9)",0,123.35,"P Max Scherzer P Carlos Carrasco OF Giancarlo Stanton 3B Todd Frazier OF Marcell Ozuna C J.T. Realmuto SS Zack Cozart 1B Yonder Alonso 2B Jed Lowrie OF Matt Joyce",NA,"Martín Maldonado","0.48%",7
200,748551524,"gentlaw2 (4/5)",0,123.2,"P Max Scherzer P Matt Andriese OF Mookie Betts SS Francisco Lindor OF Khris Davis 3B Ryon Healy OF Corey Dickerson 1B Logan Morrison C Sandy León 2B Jed Lowrie",NA,"Tim Anderson","0.48%",3
201,748555791,"dwilliamsmma",0,122.65,"P Max Scherzer P Robbie Ray 1B Paul Goldschmidt 3B Maikel Franco OF A.J. Pollock OF Odúbel Herrera OF Aaron Altherr SS Freddy Galvis 2B César Hernández C Jeff Mathis",NA,"Josh Rutledge","0.48%",5
202,748046056,"Rotomania (2/6)",0,122.6,"P Robbie Ray P Charlie Morton 3B Nolan Arenado OF Ian Desmond SS Jean Segura 2B Robinson Canó 1B Mark Reynolds OF Gerardo Parra C Brian McCann OF Ben Gamel",NA,"Adam Jones","0.48%",19
203,748099390,"PetrGibbons (2/2)",0,122.55,"P Carlos Carrasco P Drew Pomeranz 2B José Altuve 1B Miguel Cabrera OF George Springer OF Justin Upton 3B Nicholas Castellanos OF Josh Reddick C James McCann SS Andrew Romine",NA,"Danny Santana","0.48%",0
204,748696426,"bquicksix",0,122.45,"P Carlos Carrasco P Justin Verlander 2B José Altuve OF George Springer OF Max Kepler 1B Kennys Vargas SS Jorge Polanco OF Domingo Santana 3B Eduardo Escobar C Manny Piña",NA,"Alex Bregman","0.48%",12
205,748597294,"stlcardinals84",0,122.35,"P Max Scherzer P Carlos Carrasco 2B Jason Kipnis OF Max Kepler 3B José Ramírez 1B Kennys Vargas OF Eddie Rosario SS Eduardo Escobar OF Lonnie Chisenhall C Jason Castro",NA,"Josh Harrison","0.48%",0
206,748605825,"monds6 (3/6)",0,122.25,"P Zack Wheeler P Charlie Morton 1B Anthony Rizzo 3B Kris Bryant 2B Javier Báez C Willson Contreras SS Addison Russell OF Colby Rasmus OF Corey Dickerson OF Domingo Santana",NA,"John Lackey","0.32%",36.15
207,748189180,"scout326 (10/12)",0,122.2,"P Max Scherzer P Matt Andriese 1B Paul Goldschmidt OF Justin Upton OF A.J. Pollock 3B Jake Lamb OF David Peralta 2B Brandon Drury C James McCann SS José Iglesias",NA,"Wily Peralta","0.32%",4.95
208,748402417,"Msteinberg09",0,122.15,"P Max Scherzer P Dan Straily OF Bryce Harper 2B Daniel Murphy 1B Miguel Cabrera 3B Nicholas Castellanos OF Avisaíl García C James McCann SS José Iglesias OF Andrew Romine",NA,"José Bautista","0.32%",8
209,748357794,"willdamann",0,122.05,"P Carlos Carrasco P Ariel Miranda 2B Daniel Murphy 3B Anthony Rendon OF Giancarlo Stanton SS Jean Segura OF Khris Davis OF Rajai Davis C J.T. Realmuto 1B Yonder Alonso",NA,"Chris Davis","0.32%",7
209,748633353,"fjbourne (1/2)",0,122.05,"P Alex Meyer 1B Anthony Rizzo 3B Kris Bryant SS Carlos Correa OF Ben Zobrist 2B Javier Báez OF George Springer OF Josh Reddick C Brian McCann P Julio Urías",NA,"Trey Mancini","0.32%",0
211,748409547,"cornman10",0,121.75,"P Carlos Carrasco P Matt Andriese SS Trea Turner OF Adam Duvall 3B Evan Longoria OF Billy Hamilton OF Scott Schebler 2B Brad Miller 1B Kennys Vargas C Jesús Sucre",NA,"Alcides Escobar","0.32%",0
211,748574098,"bringdaruckus312 (2/2)",0,121.75,"P Carlos Carrasco P Matt Andriese C Gary Sánchez OF Aaron Judge OF Brett Gardner OF Jacoby Ellsbury 2B Starlin Castro 3B Eugenio Suárez SS Zack Cozart 1B Yonder Alonso",NA,"Yunel Escobar","0.32%",20
213,748398018,"Cigarman21 (2/2)",0,121.55,"P Jeff Samardzija P Matt Andriese OF Mookie Betts SS Xander Bogaerts OF Andrew Benintendi 2B Dustin Pedroia OF Adam Duvall 3B Eugenio Suárez 1B Mitch Moreland C Devin Mesoraco",NA,"Eduardo Núñez","0.32%",0
214,748339865,"windchimesRrude (2/2)",0,121.45,"P Max Scherzer P Tim Adleman 1B Miguel Cabrera C Willson Contreras OF Giancarlo Stanton OF Adam Duvall 3B Kyle Seager 2B Brad Miller OF Avisaíl García SS Jorge Polanco",NA,"Neil Walker","0.32%",14
215,748384191,"boggslite (1/5)",0,121.25,"P Max Scherzer P Jharel Cotton 2B José Altuve SS Carlos Correa OF George Springer OF Carlos Beltrán OF Josh Reddick 1B Cody Bellinger C Jason Castro 3B Conor Gillaspie",NA,"Ryan Goins","0.32%",0
215,748518043,"JPSTAXX",0,121.25,"P Zack Wheeler P Charlie Morton OF Bryce Harper SS Trea Turner 2B Daniel Murphy 1B Ryan Zimmerman C Matt Wieters 3B Jake Lamb OF Corey Dickerson OF Ben Gamel",NA,"Ubaldo Jiménez","0.32%",17.05
215,748620523,"frankiev3922 (4/5)",0,121.25,"P Zack Wheeler P Charlie Morton 3B Kris Bryant SS Carlos Correa OF Ben Zobrist C Willson Contreras OF Albert Almora Jr. 1B Edwin Encarnación 2B José Ramírez OF Lonnie Chisenhall",NA,"Christian Arroyo","0.32%",4
