"Rank","EntryId","EntryName","TimeRemaining","Points","Lineup","X","Player","X.Drafted","FPTS"
218,748103908,"youdacao (12/18)",0,121,"P Max Scherzer P Alex Meyer 3B Kris Bryant OF Ben Zobrist 2B Javier Báez C Willson Contreras SS Addison Russell OF Eddie Rosario 1B Joe Mauer OF Alexi Amarista",NA,"Eric Hosmer","0.32%",11
219,748333120,"cowboytater89",0,120.75,"P Carlos Carrasco P Matt Andriese 1B Eric Thames OF Giancarlo Stanton 2B Dustin Pedroia OF Jacoby Ellsbury 3B Nicholas Castellanos C J.T. Realmuto SS Zack Cozart OF Corey Dickerson",NA,"Brandon Moss","0.32%",7
220,748303693,"cohenspicks",0,120.3,"P Carlos Carrasco P Charlie Morton C Gary Sánchez OF Aaron Judge OF Brett Gardner OF Jacoby Ellsbury 2B Starlin Castro 1B Kennys Vargas 3B Justin Turner SS Jorge Polanco",NA,"José Osuna","0.32%",0
220,748522854,"superm123 (13/18)",0,120.3,"P Carlos Carrasco P Charlie Morton 2B José Altuve SS Carlos Correa OF George Springer 3B Evan Longoria OF Josh Reddick OF Corey Dickerson 1B Yuli Gurriel C Jesús Sucre",NA,"Caleb Joseph","0.16%",3
220,748524175,"CarlosDanger911",0,120.3,"P Carlos Carrasco P Charlie Morton C Gary Sánchez OF Aaron Judge 3B Evan Longoria OF Khris Davis 2B Starlin Castro OF Eddie Rosario SS Jorge Polanco 1B Logan Morrison",NA,"Cliff Pennington","0.16%",10
223,748293091,"weredragon",0,120.2,"P Max Scherzer P Matt Andriese OF Bryce Harper SS Jean Segura 1B Matt Carpenter 3B Eugenio Suárez OF Aaron Altherr OF Cody Bellinger C James McCann 2B Jed Lowrie",NA,"Lorenzo Cain","0.16%",14
224,748634910,"Duncaroo",0,120.05,"P Max Scherzer P Jerad Eickhoff 2B Daniel Murphy 3B Todd Frazier OF Carlos Beltrán SS Didi Gregorius OF Avisaíl García OF Josh Reddick C J.T. Realmuto 1B Justin Bour",NA,"Geovany Soto","0.16%",0
225,748383106,"petteytheft89 (5/6)",0,119.75,"P Justin Verlander P Robbie Ray C Gary Sánchez SS Jean Segura 3B Kyle Seager OF Jacoby Ellsbury 2B Starlin Castro 1B Chris Carter OF Jarrod Dyson OF Ben Gamel",NA,"Kendrys Morales","0.16%",0
226,748522856,"superm123 (15/18)",0,119.3,"P Carlos Carrasco P Charlie Morton 2B José Altuve SS Carlos Correa OF George Springer OF Khris Davis OF Josh Reddick 1B Yuli Gurriel 3B Trevor Plouffe C Bruce Maxwell",NA,"Hanley Ramírez","0.16%",0
227,748416993,"DraftCheat (14/18)",0,119.15,"P Matt Andriese P Charlie Morton 3B Kris Bryant SS Trea Turner OF Ben Zobrist OF Andrew Benintendi 1B Chris Davis 2B Brad Miller OF Avisaíl García C James McCann",NA,"Nelson Cruz","0.16%",5
228,748193577,"SaahilSud (4/18)",0,119.05,"P Max Scherzer P Jerad Eickhoff SS Trea Turner 3B Maikel Franco 2B Jonathan Villar 1B Tommy Joseph OF Odúbel Herrera OF Aaron Altherr OF Domingo Santana C Cameron Rupp",NA,"Evan Gattis","0.16%",0
229,748538941,"thewildbuffalo",0,118.65,"P Max Scherzer P Robbie Ray OF Adam Duvall 3B Evan Longoria OF Billy Hamilton 2B Brad Miller SS Zack Cozart OF Corey Dickerson 1B Logan Morrison C Omar Narváez",NA,"Whit Merrifield","0.16%",0
230,748594762,"thoma069",0,118.6,"P Max Scherzer P Héctor Santiago OF Aaron Judge 1B Freddie Freeman OF Brett Gardner 3B Jake Lamb 2B José Ramírez OF Ender Inciarte SS Chris Owings C Salvador Pérez",NA,"Dee Gordon","0.16%",3
231,748522851,"superm123 (10/18)",0,118.5,"P Max Scherzer P Ariel Miranda 2B José Altuve SS Carlos Correa OF George Springer OF Khris Davis OF Josh Reddick 3B Trevor Plouffe 1B Yonder Alonso C Bruce Maxwell",NA,"Darwin Barney","0.16%",3
232,748402731,"aya961",0,118.3,"P Carlos Carrasco P Charlie Morton OF Bryce Harper C Gary Sánchez 2B Jason Kipnis 3B José Ramírez OF Josh Reddick SS Zack Cozart 1B Joe Mauer OF Corey Dickerson",NA,"Adam Wainwright","0.16%",5.2
233,748361809,"jrobsc11",0,118.15,"P Robbie Ray P Zack Wheeler 2B José Altuve SS Carlos Correa OF George Springer 3B Evan Longoria OF Adam Jones C Matt Wieters OF Corey Dickerson 1B Logan Morrison",NA,"Michael A. Taylor","0.16%",0
234,748450648,"ehafner (11/18)",0,117.85,"P Max Scherzer 1B Paul Goldschmidt SS Corey Seager OF A.J. Pollock OF Yasmany Tomás C Yasmani Grandal 3B Justin Turner OF David Peralta 2B Chris Taylor P Julio Urías",NA,"Adonis Garcia","0.16%",0
235,748081593,"ebor1973 (1/3)",0,117.8,"P Carlos Carrasco P Jharel Cotton SS Trea Turner 2B Daniel Murphy OF George Springer 3B Eugenio Suárez C J.T. Realmuto OF Cody Bellinger OF Corey Dickerson 1B Yonder Alonso",NA,"José Reyes","0.16%",7
236,748592331,"unsub",0,117.55,"P Carlos Carrasco P Drew Pomeranz OF Bryce Harper SS Trea Turner 3B Evan Longoria 2B Brad Miller OF Colby Rasmus OF Corey Dickerson 1B Logan Morrison C Yan Gomes",NA,"Francisco Cervelli","0.16%",9
236,748600529,"michaeladillard (2/2)",0,117.55,"P Charlie Morton P Héctor Santiago OF Bryce Harper OF Mookie Betts 1B Ryan Zimmerman SS Xander Bogaerts 3B Anthony Rendon 2B Dustin Pedroia OF Chris Young C Sandy León",NA,"","",NA
238,748533653,"devobrain",0,117.5,"P Max Scherzer P Ariel Miranda OF Bryce Harper 2B Daniel Murphy 1B Ryan Zimmerman SS Jean Segura C J.T. Realmuto OF Ben Gamel 3B T.J. Rivera OF Matt Joyce",NA,"","",NA
239,748040120,"rikkidee (5/9)",0,116.6,"P Max Scherzer P Héctor Santiago C Gary Sánchez OF Aaron Judge 3B Evan Longoria OF Jacoby Ellsbury 2B Brad Miller 1B Chris Carter OF Corey Dickerson SS Tim Beckham",NA,"","",NA
240,748516930,"moklovin (2/6)",0,116.55,"P Carlos Carrasco P Drew Pomeranz 3B Kris Bryant OF Ben Zobrist OF Max Kepler 2B Brad Miller SS Jorge Polanco OF Corey Dickerson 1B Logan Morrison C Jason Castro",NA,"","",NA
241,748541218,"ackarmasports (2/3)",0,116.15,"P Matt Andriese P Charlie Morton 3B Kris Bryant C Gary Sánchez OF Aaron Judge 1B José Abreu OF Adam Duvall OF Brett Gardner SS Didi Gregorius 2B Jed Lowrie",NA,"","",NA
242,748193559,"SaahilSud (1/18)",0,116,"P Max Scherzer P Drew Pomeranz C Gary Sánchez 1B Miguel Cabrera OF Justin Upton 3B Nicholas Castellanos 2B Brad Miller OF Corey Dickerson OF Mikie Mahtook SS José Iglesias",NA,"","",NA
243,748593247,"sandstorm",0,115.9,"P Max Scherzer P Justin Verlander 3B Evan Longoria 2B Brad Miller OF Avisaíl García OF Colby Rasmus OF Corey Dickerson C Brian McCann 1B Logan Morrison SS Christian Arroyo",NA,"","",NA
244,748057322,"rayofhope (4/12)",0,115.85,"P Max Scherzer OF Bryce Harper 3B Todd Frazier OF Max Kepler 1B Kennys Vargas 2B Tyler Saladino SS Jorge Polanco OF Corey Dickerson C Omar Narváez P Julio Urías",NA,"","",NA
244,748450654,"ehafner (17/18)",0,115.85,"P Max Scherzer OF Giancarlo Stanton 3B Evan Longoria OF Christian Yelich OF Marcell Ozuna 2B Brad Miller C J.T. Realmuto 1B Logan Morrison SS Tim Beckham P Julio Urías",NA,"","",NA
244,748449585,"Acekilla7676 (2/2)",0,115.85,"P Carlos Carrasco P Zack Wheeler SS Carlos Correa OF Aaron Judge OF George Springer OF Brett Gardner 2B Starlin Castro C Brian McCann 1B Yuli Gurriel 3B Yunel Escobar",NA,"","",NA
247,748616058,"drankwalter",0,115.55,"P Carlos Carrasco P Drew Pomeranz C Gary Sánchez 3B Evan Longoria OF Brett Gardner OF Jacoby Ellsbury SS Didi Gregorius 2B Brad Miller OF Corey Dickerson 1B Logan Morrison",NA,"","",NA
248,748442313,"ChipotleAddict (13/18)",0,115.4,"P Justin Verlander P Zack Wheeler C Gary Sánchez OF Aaron Judge 2B Robinson Canó OF Justin Upton OF Jacoby Ellsbury 3B Nicholas Castellanos 1B Chris Carter SS José Iglesias",NA,"","",NA
249,748686143,"LSphila (2/2)",0,115.35,"P Max Scherzer P Carlos Carrasco 1B Miguel Cabrera OF Justin Upton 3B Nicholas Castellanos OF David Peralta C Brian McCann 2B Jed Lowrie SS José Iglesias OF Andrew Romine",NA,"","",NA
249,748513494,"bigern33",0,115.35,"P Justin Verlander P Jharel Cotton 2B José Altuve SS Carlos Correa OF George Springer OF Adam Duvall OF Billy Hamilton 3B Eugenio Suárez 1B Logan Morrison C Yan Gomes",NA,"","",NA
251,748193563,"SaahilSud (2/18)",0,115.3,"P Max Scherzer P Zack Wheeler SS Trea Turner 1B Miguel Cabrera OF Justin Upton 3B Todd Frazier 2B Jason Kipnis C James McCann OF Mikie Mahtook OF Andrew Romine",NA,"","",NA
252,748336094,"ejs39861",0,115,"P Max Scherzer P Drew Pomeranz 3B Kris Bryant 2B José Altuve OF Josh Reddick 1B Kennys Vargas C J.T. Realmuto OF Corey Dickerson OF Andrew Toles SS Andrew Romine",NA,"","",NA
252,748474729,"BrandonAdams (9/18)",0,115,"P Max Scherzer P Drew Pomeranz OF George Springer SS Francisco Lindor 1B Edwin Encarnación 2B Jason Kipnis OF Carlos Beltrán OF Josh Reddick C Yan Gomes 3B Yandy Díaz",NA,"","",NA
252,748518269,"dahladino (5/5)",0,115,"P Max Scherzer P Alex Meyer SS Carlos Correa C Gary Sánchez OF Aaron Judge 3B Todd Frazier OF Jacoby Ellsbury 2B Starlin Castro 1B Chris Carter OF Odúbel Herrera",NA,"","",NA
255,748430537,"jontlevy",0,114.8,"P Charlie Morton OF Bryce Harper SS Trea Turner OF Mookie Betts 1B Carlos Santana 2B Brad Miller OF Eddie Rosario C J.T. Realmuto 3B Justin Turner P Julio Urías",NA,"","",NA
256,748360760,"tammytaylor58",0,114.65,"P Zack Wheeler P Dan Straily OF Bryce Harper SS Trea Turner 2B Daniel Murphy 1B Ryan Zimmerman OF Jayson Werth 3B José Ramírez OF Aaron Altherr C James McCann",NA,"","",NA
257,748533759,"mgrazi111",0,114.15,"P Matt Andriese P Charlie Morton 3B Kris Bryant OF Bryce Harper SS Trea Turner OF Andrew Benintendi OF Gerardo Parra 2B Brad Miller 1B Mitch Moreland C James McCann",NA,"","",NA
258,748206955,"IamPGM (1/2)",0,114.1,"P Carlos Carrasco P Chris Young 3B Kris Bryant OF Bryce Harper SS Trea Turner 2B José Altuve OF Jacoby Ellsbury OF Josh Reddick C Brian McCann 1B Yonder Alonso",NA,"","",NA
259,748450653,"ehafner (16/18)",0,113.85,"P Max Scherzer OF Giancarlo Stanton 3B Maikel Franco OF Christian Yelich 1B Tommy Joseph OF Marcell Ozuna C J.T. Realmuto SS Freddy Galvis 2B César Hernández P Julio Urías",NA,"","",NA
260,748348452,"Madindian1",0,113.75,"P Max Scherzer P Charlie Morton OF Bryce Harper 3B Anthony Rendon OF Aaron Judge OF Giancarlo Stanton C Sandy León 1B Yonder Alonso 2B Jed Lowrie SS Adam Rosales",NA,"","",NA
261,748501452,"papagates (15/18)",0,113.65,"P Max Scherzer P Robbie Ray OF Ryan Braun 1B Eric Thames 2B Jonathan Villar 3B Travis Shaw OF Domingo Santana SS Tim Anderson C Omar Narváez OF Willy García",NA,"","",NA
262,748270981,"gentlaw2 (2/5)",0,113.6,"P Max Scherzer P Héctor Santiago C Gary Sánchez OF Aaron Judge 1B Matt Carpenter 2B Starlin Castro SS Aledmys Díaz OF Yasmany Tomás 3B Jedd Gyorko OF Tommy Pham",NA,"","",NA
263,748160734,"tumorgroomer (3/5)",0,113.35,"P Zack Wheeler 3B Nolan Arenado C Gary Sánchez OF Aaron Judge OF Brett Gardner 2B Starlin Castro SS Didi Gregorius OF Scott Schebler 1B Ryon Healy P Julio Urías",NA,"","",NA
263,748522844,"superm123 (3/18)",0,113.35,"P Max Scherzer P Carlos Carrasco 3B Evan Longoria OF Khris Davis 2B Brad Miller 1B Ryon Healy OF Corey Dickerson SS Tim Beckham C Bruce Maxwell OF Matt Joyce",NA,"","",NA
265,748416981,"DraftCheat (2/18)",0,113.15,"P Matt Andriese P Charlie Morton 3B Kris Bryant OF Bryce Harper SS Trea Turner OF Andrew Benintendi 1B Carlos Santana 2B José Ramírez OF Corey Dickerson C James McCann",NA,"","",NA
266,748591281,"underjones (18/18)",0,113,"P Carlos Carrasco P Tim Adleman 3B Kris Bryant 2B Javier Báez C Willson Contreras 1B Freddie Freeman SS Addison Russell OF Ender Inciarte OF Nick Markakis OF Danny Santana",NA,"","",NA
267,748093165,"fortheoffice (4/10)",0,112.95,"P Justin Verlander OF Bryce Harper 1B Miguel Cabrera OF Aaron Judge OF Justin Upton 3B Nicholas Castellanos 2B Starlin Castro C James McCann SS José Iglesias P Julio Urías",NA,"","",NA
268,748189177,"scout326 (7/12)",0,112.75,"P Max Scherzer P Charlie Morton 3B Nolan Arenado 2B DJ LeMahieu OF Max Kepler 1B Kennys Vargas OF Eddie Rosario OF Cody Bellinger SS Jorge Polanco C Jason Castro",NA,"","",NA
269,748405201,"klink",0,112.55,"P Charlie Morton P Héctor Santiago 1B Anthony Rizzo 3B Kris Bryant 2B Javier Báez C Willson Contreras SS Addison Russell OF Max Kepler OF Joc Pederson OF Cody Bellinger",NA,"","",NA
269,748591271,"underjones (8/18)",0,112.55,"P Ariel Miranda 1B Anthony Rizzo 3B Kris Bryant OF Ryan Braun 2B Javier Báez SS Addison Russell OF Keon Broxton OF Domingo Santana C Manny Piña P Julio Urías",NA,"","",NA
271,748334628,"windchimesRrude (1/2)",0,112.45,"P Max Scherzer P Tim Adleman C Willson Contreras OF Giancarlo Stanton 1B José Abreu OF Adam Duvall 3B Kyle Seager OF Andrew McCutchen 2B Brad Miller SS Tim Anderson",NA,"","",NA
272,748471726,"getoffme2312 (2/2)",0,112.35,"P Max Scherzer P Carlos Carrasco OF Christian Yelich 1B Eric Hosmer OF Eddie Rosario C J.T. Realmuto OF Ender Inciarte SS Jorge Polanco 3B Eduardo Escobar 2B Jed Lowrie",NA,"","",NA
273,748620586,"frankiev3922 (5/5)",0,112.25,"P Zack Wheeler P Charlie Morton C Gary Sánchez 1B Miguel Cabrera OF Aaron Judge SS Francisco Lindor OF Justin Upton OF Khris Davis 3B Nicholas Castellanos 2B José Ramírez",NA,"","",NA
274,748664447,"mariob888",0,112.2,"P Carlos Carrasco P Robbie Ray SS Xander Bogaerts OF Andrew Benintendi OF Christian Yelich OF Marcell Ozuna 3B Ryon Healy C J.T. Realmuto 1B Yonder Alonso 2B Jed Lowrie",NA,"","",NA
275,748416982,"DraftCheat (3/18)",0,112.15,"P Matt Andriese P Charlie Morton 3B Kris Bryant OF Bryce Harper 1B Miguel Cabrera SS Francisco Lindor OF Justin Upton 2B Brad Miller OF Avisaíl García C Jason Castro",NA,"","",NA
276,748103910,"youdacao (14/18)",0,112,"P Max Scherzer P Drew Pomeranz 2B José Altuve OF George Springer OF Carlos Beltrán OF Josh Reddick 3B Eugenio Suárez SS Zack Cozart 1B Logan Morrison C Devin Mesoraco",NA,"","",NA
277,748400891,"mavngoose",0,111.8,"P Charlie Morton 3B Kris Bryant 1B Joey Votto OF Aaron Judge OF Giancarlo Stanton SS Jean Segura OF Adam Duvall 2B Starlin Castro C Jason Castro P Julio Urías",NA,"","",NA
278,748717568,"keithdor1187",0,111.65,"P Charlie Morton P Mike Pelfrey 3B Kris Bryant OF Bryce Harper 1B Ryan Zimmerman C Gary Sánchez OF Aaron Judge SS Jean Segura 2B Robinson Canó OF Adam Duvall",NA,"","",NA
279,748594381,"tomcat1290",0,111.55,"P Carlos Carrasco P Alex Meyer 1B Anthony Rizzo 3B Kris Bryant OF Ben Zobrist OF Ian Desmond SS Addison Russell 2B Brad Miller OF Corey Dickerson C Jeff Mathis",NA,"","",NA
280,748529147,"caronnaguy27 (1/2)",0,111.3,"P Carlos Carrasco P Charlie Morton 2B José Altuve SS Carlos Correa 3B Anthony Rendon OF Khris Davis 1B Carlos Santana OF Josh Reddick C Sandy León OF Matt Joyce",NA,"","",NA
281,748103914,"youdacao (18/18)",0,111,"P Max Scherzer P Alex Meyer 3B Nolan Arenado OF Ian Desmond SS Trevor Story C Willson Contreras OF Gerardo Parra 2B Brad Miller OF Corey Dickerson 1B Logan Morrison",NA,"","",NA
281,748381617,"Awesemo (10/10)",0,111,"P Max Scherzer P Drew Pomeranz 2B José Altuve SS Carlos Correa OF George Springer OF Josh Reddick 1B Joe Mauer C Brian McCann 3B Yunel Escobar OF Matt Joyce",NA,"","",NA
283,748556015,"Atlmaverick08",0,110.75,"P Carlos Carrasco P Matt Andriese 2B José Altuve OF Aaron Judge OF Adam Duvall 1B Edwin Encarnación 3B José Ramírez SS Zack Cozart OF Corey Dickerson C James McCann",NA,"","",NA
284,748522845,"superm123 (4/18)",0,110.35,"P Max Scherzer P Carlos Carrasco 3B Evan Longoria OF Khris Davis 1B Ryon Healy OF Colby Rasmus OF Corey Dickerson SS Tim Beckham 2B Jed Lowrie C Bruce Maxwell",NA,"","",NA
285,748416987,"DraftCheat (8/18)",0,110.15,"P Matt Andriese P Charlie Morton OF Bryce Harper 3B Anthony Rendon 1B Miguel Cabrera SS Francisco Lindor OF Andrew Benintendi 2B José Ramírez OF Josh Reddick C Brian McCann",NA,"","",NA
286,748090770,"scotty71",0,109.85,"P Carlos Carrasco P Zack Wheeler OF Bryce Harper SS Carlos Correa 3B Maikel Franco OF Avisaíl García 2B José Ramírez OF Colby Rasmus C Brian McCann 1B Logan Morrison",NA,"","",NA
287,748474829,"beatles7jb",0,109.75,"P Carlos Carrasco P Matt Andriese 2B José Altuve OF Aaron Judge OF Andrew Benintendi 3B Eugenio Suárez 1B Kennys Vargas SS Zack Cozart OF Corey Dickerson C Brian McCann",NA,"","",NA
288,748040123,"rikkidee (8/9)",0,109.2,"P Drew Pomeranz P Alex Meyer 1B Anthony Rizzo 3B Kris Bryant SS Carlos Correa 2B Ben Zobrist C Willson Contreras OF George Springer OF Carlos Beltrán OF Josh Reddick",NA,"","",NA
289,748626639,"Wreck-Havoc-22 (5/5)",0,109.15,"P Carlos Carrasco P Héctor Santiago C Gary Sánchez OF Aaron Judge SS Francisco Lindor 1B Edwin Encarnación 2B Jason Kipnis OF Jacoby Ellsbury 3B José Ramírez OF Lonnie Chisenhall",NA,"","",NA
290,748657183,"MrTuttle05 (2/5)",0,109.05,"P Drew Pomeranz 3B Kris Bryant SS Carlos Correa 1B Freddie Freeman OF George Springer OF Carlos Beltrán 2B José Ramírez OF Josh Reddick C Brian McCann P Julio Urías",NA,"","",NA
291,748294354,"madoublet98",0,109,"P Max Scherzer P Drew Pomeranz 3B Kris Bryant SS Trea Turner OF Max Kepler C J.T. Realmuto OF Corey Dickerson OF Andrew Toles 1B Yonder Alonso 2B Jed Lowrie",NA,"","",NA
291,748430661,"dahladino (3/5)",0,109,"P Max Scherzer P Alex Meyer 1B Anthony Rizzo 3B Kris Bryant OF Ben Zobrist C Willson Contreras SS Addison Russell OF Josh Reddick OF Andrew Toles 2B Ryan Goins",NA,"","",NA
293,748057325,"rayofhope (7/12)",0,108.9,"P Max Scherzer P Justin Verlander 3B Todd Frazier OF Max Kepler OF Avisaíl García 2B José Ramírez SS Jorge Polanco 1B Joe Mauer OF Corey Dickerson C Omar Narváez",NA,"","",NA
294,748063024,"Awesemo (5/10)",0,108.55,"P Carlos Carrasco P Drew Pomeranz OF Bryce Harper OF Justin Upton 3B Nicholas Castellanos OF Max Kepler 2B Brad Miller SS Jorge Polanco 1B Joe Mauer C Jason Castro",NA,"","",NA
295,748040122,"rikkidee (7/9)",0,108,"P Max Scherzer P Drew Pomeranz SS Corey Seager 3B Evan Longoria 2B Brad Miller OF Joc Pederson C Yasmani Grandal OF Corey Dickerson 1B Logan Morrison OF Andrew Toles",NA,"","",NA
295,748046741,"Biesterfield",0,108,"P Max Scherzer P Drew Pomeranz 3B Kris Bryant 2B Ben Zobrist OF A.J. Pollock OF Josh Reddick 1B Joe Mauer OF Corey Dickerson C Jason Castro SS Andrew Romine",NA,"","",NA
295,748388253,"boggslite (5/5)",0,108,"P Max Scherzer P Alex Meyer 1B Anthony Rizzo 3B Kris Bryant OF Ben Zobrist 2B Javier Báez SS Addison Russell OF Cody Bellinger OF Alexi Amarista C Jeff Mathis",NA,"","",NA
298,748522842,"superm123 (1/18)",0,107.35,"P Max Scherzer P Carlos Carrasco 2B José Altuve OF George Springer OF Norichika Aoki 1B Yuli Gurriel 3B Trevor Plouffe C Bruce Maxwell OF Matt Joyce SS Adam Rosales",NA,"","",NA
299,748302466,"bwolfgramm",0,107.3,"P Carlos Carrasco P Charlie Morton C Gary Sánchez OF Aaron Judge OF Brett Gardner OF Jacoby Ellsbury 2B Starlin Castro 3B Eugenio Suárez SS Zack Cozart 1B Logan Morrison",NA,"","",NA
300,748189172,"scout326 (2/12)",0,107.2,"P Max Scherzer P Matt Andriese 1B Joey Votto OF Adam Duvall OF Billy Hamilton 3B Jedd Gyorko SS Zack Cozart OF Randal Grichuk 2B Kolten Wong C Yadier Molina",NA,"","",NA
301,748370120,"fallfromgrace (5/6)",0,107,"P Max Scherzer P Drew Pomeranz 3B Kris Bryant SS Francisco Lindor 1B Edwin Encarnación 2B José Ramírez OF Corey Dickerson OF Jarrod Dyson OF Abraham Almonte C Yan Gomes",NA,"","",NA
301,748450644,"ehafner (7/18)",0,107,"P Max Scherzer P Drew Pomeranz OF Giancarlo Stanton 2B Robinson Canó OF Justin Upton 3B Nicholas Castellanos OF Marcell Ozuna C J.T. Realmuto 1B Justin Bour SS Andrew Romine",NA,"","",NA
303,748605824,"monds6 (2/6)",0,106.85,"P Carlos Carrasco P Zack Wheeler C Gary Sánchez OF Aaron Judge 3B Maikel Franco OF Brett Gardner OF Jacoby Ellsbury 1B Tommy Joseph 2B Starlin Castro SS Jordy Mercer",NA,"","",NA
304,748608181,"ebor1973 (3/3)",0,106.75,"P Max Scherzer P Charlie Morton OF Giancarlo Stanton SS Jean Segura 3B Maikel Franco OF Christian Yelich OF Max Kepler 2B Jedd Gyorko 1B Logan Morrison C Jason Castro",NA,"","",NA
305,748544829,"Piknik",0,106.55,"P Carlos Carrasco P Drew Pomeranz SS Carlos Correa OF Giancarlo Stanton 3B Evan Longoria OF Marcell Ozuna 2B Brad Miller C J.T. Realmuto OF Corey Dickerson 1B Logan Morrison",NA,"","",NA
306,748653462,"bennyv77",0,106.45,"P Robbie Ray P Héctor Santiago 3B Kris Bryant OF Bryce Harper 2B Daniel Murphy SS Addison Russell 1B Edwin Encarnación OF Corey Dickerson C Sandy León OF Lonnie Chisenhall",NA,"","",NA
307,748607395,"JDUB1010 (3/4)",0,106.4,"P Carlos Carrasco SS Trea Turner C Gary Sánchez OF George Springer OF Avisaíl García 2B José Ramírez OF Josh Reddick 1B Yuli Gurriel 3B Yandy Díaz P Julio Urías",NA,"","",NA
308,748152501,"tumorgroomer (1/5)",0,106.35,"P Zack Wheeler SS Carlos Correa C Gary Sánchez OF Aaron Judge OF Brett Gardner 2B Starlin Castro OF Scott Schebler 1B Chris Carter 3B Ryon Healy P Julio Urías",NA,"","",NA
309,748416988,"DraftCheat (9/18)",0,106.15,"P Matt Andriese P Charlie Morton 3B Kris Bryant OF Bryce Harper SS Trea Turner 1B José Abreu 2B José Ramírez OF Josh Reddick OF Corey Dickerson C Jason Castro",NA,"","",NA
310,748634194,"gentlaw2 (5/5)",0,106.05,"P Robbie Ray P Matt Andriese 1B Ryan Zimmerman 3B Anthony Rendon SS Jean Segura 2B Robinson Canó OF Jayson Werth OF Matt Kemp OF Ender Inciarte C Tyler Flowers",NA,"","",NA
311,748160828,"tumorgroomer (4/5)",0,105.35,"P Zack Wheeler 3B Nolan Arenado SS Carlos Correa OF Aaron Judge 1B Matt Carpenter 2B Jedd Gyorko OF Randal Grichuk C Yadier Molina OF Tommy Pham P Julio Urías",NA,"","",NA
312,748718616,"ayolessonhere",0,105.25,"P Zack Wheeler P Charlie Morton 1B Anthony Rizzo 3B Kris Bryant OF Ben Zobrist 2B Javier Báez SS Addison Russell OF Khris Davis OF Cody Bellinger C René Rivera",NA,"","",NA
313,748306722,"yankeesfan2 (2/2)",0,104.9,"P Max Scherzer P CC Sabathia C Gary Sánchez OF Aaron Judge SS Jean Segura OF Brett Gardner 2B Starlin Castro 1B Chris Carter OF Corey Dickerson 3B Derek Dietrich",NA,"","",NA
314,748522853,"superm123 (12/18)",0,104.5,"P Max Scherzer P Ariel Miranda 2B José Altuve SS Carlos Correa OF George Springer OF Khris Davis OF Norichika Aoki 3B Trevor Plouffe 1B Yonder Alonso C Bruce Maxwell",NA,"","",NA
315,748206480,"Gimpels",0,104.4,"P Drew Pomeranz P Matt Andriese OF Mookie Betts 1B Ryan Zimmerman SS Xander Bogaerts OF Andrew Benintendi OF Jay Bruce 2B Dustin Pedroia C Sandy León 3B Eduardo Escobar",NA,"","",NA
316,748152591,"tumorgroomer (2/5)",0,104.35,"P Zack Wheeler 3B Nolan Arenado OF Aaron Judge OF Brett Gardner OF Khris Davis 2B Starlin Castro SS Didi Gregorius 1B Chris Carter C James McCann P Julio Urías",NA,"","",NA
316,748382160,"Backnine (2/2)",0,104.35,"P Jeff Samardzija P Drew Pomeranz OF Mookie Betts SS Francisco Lindor OF Andrew Benintendi 2B Dustin Pedroia 3B Travis Shaw 1B Mitch Moreland OF Corey Dickerson C Brian McCann",NA,"","",NA
318,748160934,"tumorgroomer (5/5)",0,104.3,"P Max Scherzer P Zack Wheeler SS Carlos Correa 1B Mark Reynolds OF Khris Davis OF Rajai Davis 3B Ryon Healy C J.T. Realmuto 2B Jed Lowrie OF Matt Joyce",NA,"","",NA
319,748040124,"rikkidee (9/9)",0,104.25,"P Max Scherzer P Jharel Cotton C Gary Sánchez OF Aaron Judge 3B Evan Longoria OF Jacoby Ellsbury 2B Starlin Castro OF Corey Dickerson SS Tim Beckham 1B Rickie Weeks Jr.",NA,"","",NA
320,748103903,"youdacao (7/18)",0,104,"P Max Scherzer P Drew Pomeranz OF Adam Duvall 3B Evan Longoria OF Billy Hamilton 2B Brad Miller SS Zack Cozart OF Corey Dickerson 1B Logan Morrison C Devin Mesoraco",NA,"","",NA
321,748387856,"Giants1981",0,103.9,"P Carlos Carrasco P Wily Peralta 3B Kris Bryant 2B José Altuve SS Carlos Correa OF Aaron Judge OF Jacoby Ellsbury 1B Yuli Gurriel OF Domingo Santana C Manny Piña",NA,"","",NA
322,748574407,"myb821",0,103.7,"P Carlos Carrasco P Jeff Samardzija OF Adam Duvall 3B Todd Frazier OF Khris Davis 2B Brad Miller SS Zack Cozart OF Corey Dickerson C Brian McCann 1B Logan Morrison",NA,"","",NA
323,748635643,"shanksalot (1/2)",0,103.55,"P Carlos Carrasco P Drew Pomeranz SS Xander Bogaerts 2B Dustin Pedroia OF Adam Jones OF A.J. Pollock OF Carlos Beltrán 3B Jake Lamb 1B Mitch Moreland C Sandy León",NA,"","",NA
324,748416996,"DraftCheat (17/18)",0,103.15,"P Matt Andriese P Charlie Morton OF Bryce Harper 2B Daniel Murphy OF Ben Zobrist 1B Miguel Cabrera SS Francisco Lindor 3B José Ramírez OF Josh Reddick C Jason Castro",NA,"","",NA
325,748592795,"cubsfan333 (5/9)",0,103.05,"P Drew Pomeranz OF Bryce Harper 2B José Altuve SS Carlos Correa OF George Springer 3B Todd Frazier OF Josh Reddick C Brian McCann 1B Yonder Alonso P Julio Urías",NA,"","",NA
326,748604480,"cubsfan333 (6/9)",0,103,"P Max Scherzer P Drew Pomeranz 3B Kris Bryant SS Addison Russell 1B Edwin Encarnación 2B Brad Miller OF Cody Bellinger OF Corey Dickerson OF Andrew Toles C Omar Narváez",NA,"","",NA
327,748287686,"Dj4eagle2",0,102.55,"P Carlos Carrasco P Alex Meyer OF Bryce Harper 2B Daniel Murphy 1B Ryan Zimmerman 3B Anthony Rendon OF Jayson Werth OF Avisaíl García SS Zack Cozart C Cameron Rupp",NA,"","",NA
328,748457169,"boatsandhoes82",0,102.3,"P Carlos Carrasco P Charlie Morton OF Bryce Harper OF Andrew Benintendi OF Adam Duvall 1B Edwin Encarnación 2B Starlin Castro 3B Eugenio Suárez SS Zack Cozart C Devin Mesoraco",NA,"","",NA
329,748605826,"monds6 (4/6)",0,102.25,"P Zack Wheeler P Charlie Morton OF Bryce Harper SS Trea Turner 2B Daniel Murphy 1B Ryan Zimmerman C Matt Wieters 3B Jedd Gyorko OF Colby Rasmus OF Corey Dickerson",NA,"","",NA
330,748416990,"DraftCheat (11/18)",0,102.15,"P Matt Andriese P Charlie Morton 3B Kris Bryant OF Bryce Harper OF Ben Zobrist SS Francisco Lindor OF Andrew Benintendi 1B Kennys Vargas C Brian McCann 2B Jed Lowrie",NA,"","",NA
331,748591270,"underjones (7/18)",0,102.05,"P Drew Pomeranz 3B Kris Bryant OF Ben Zobrist 2B Javier Báez 1B Miguel Cabrera C Willson Contreras OF Justin Upton SS José Iglesias OF Andrew Romine P Julio Urías",NA,"","",NA
332,748189173,"scout326 (3/12)",0,101.95,"P Drew Pomeranz P Charlie Morton 1B Anthony Rizzo 3B Kris Bryant C Willson Contreras SS Addison Russell 2B Brad Miller OF Kevin Kiermaier OF Colby Rasmus OF Corey Dickerson",NA,"","",NA
333,748630884,"Al_Smizzle",0,101.85,"P Max Scherzer 3B Kris Bryant 2B Ben Zobrist OF Khris Davis 1B Carlos Santana OF Corey Dickerson SS Tim Beckham C Jason Castro OF Matt Joyce P Julio Urías",NA,"","",NA
