"Rank","EntryId","EntryName","TimeRemaining","Points","Lineup","X","Player","X.Drafted","FPTS"
452,748303964,"Ebonwraith",0,87.05,"P Drew Pomeranz 3B Kris Bryant SS Trea Turner 2B Ben Zobrist OF Michael Conforto OF A.J. Pollock C J.T. Realmuto 1B Cody Bellinger OF David Peralta P Julio Urías",NA,"","",NA
452,748310541,"nawmsayin (1/5)",0,87.05,"P Robbie Ray P Matt Andriese 3B Nolan Arenado OF Ian Desmond SS Trevor Story 2B DJ LeMahieu C Dustin Garneau OF Colby Rasmus OF Corey Dickerson 1B Logan Morrison",NA,"","",NA
454,748513263,"JuiceKing22",0,87,"P Matt Andriese P Héctor Santiago OF Bryce Harper SS Trea Turner 2B José Altuve OF Aaron Judge 1B Freddie Freeman 3B Evan Longoria OF Cody Bellinger C James McCann",NA,"","",NA
454,748575819,"dr00pd0g (1/2)",0,87,"P Max Scherzer P Drew Pomeranz SS Xander Bogaerts OF Andrew Benintendi OF A.J. Pollock 3B Jedd Gyorko 1B Mitch Moreland OF Chris Young 2B César Hernández C Sandy León",NA,"","",NA
454,748681725,"SamENole (3/3)",0,87,"P Max Scherzer P Drew Pomeranz OF Ian Desmond 1B Miguel Cabrera 2B DJ LeMahieu OF Gerardo Parra 3B Nicholas Castellanos C James McCann SS José Iglesias OF Andrew Romine",NA,"","",NA
457,748722674,"socrdave",0,86.95,"P Drew Pomeranz P Charlie Morton 1B Anthony Rizzo 3B Kris Bryant OF Bryce Harper 2B Javier Báez SS Addison Russell OF Andrew Toles C James McCann OF Andrew Romine",NA,"","",NA
458,748450650,"ehafner (13/18)",0,86.7,"P Robbie Ray C Gary Sánchez 1B Paul Goldschmidt OF Aaron Judge OF A.J. Pollock 2B Starlin Castro 3B Jake Lamb SS Chris Owings OF David Peralta P Julio Urías",NA,"","",NA
459,748474721,"BrandonAdams (1/18)",0,86.5,"P Drew Pomeranz P Zack Wheeler 1B Anthony Rizzo 3B Kris Bryant OF Ben Zobrist 2B Javier Báez C Willson Contreras OF Corey Dickerson SS Tim Beckham OF Mikie Mahtook",NA,"","",NA
459,748657582,"MrTuttle05 (3/5)",0,86.5,"P Drew Pomeranz P Zack Wheeler 3B Kris Bryant OF Bryce Harper SS Trea Turner 2B Daniel Murphy C Matt Wieters 1B Logan Morrison OF Chris Heisey OF Andrew Toles",NA,"","",NA
461,748416984,"DraftCheat (5/18)",0,86.15,"P Matt Andriese P Charlie Morton OF Bryce Harper SS Trea Turner 1B José Abreu OF Andrew Benintendi OF Gerardo Parra 3B Jake Lamb 2B Brad Miller C Brian McCann",NA,"","",NA
462,748442306,"ChipotleAddict (6/18)",0,86.1,"P Justin Verlander P Drew Pomeranz OF Bryce Harper SS Trea Turner 3B Evan Longoria C Matt Wieters 2B Brad Miller OF Colby Rasmus OF Corey Dickerson 1B Rickie Weeks Jr.",NA,"","",NA
463,748522859,"superm123 (18/18)",0,86.05,"P Carlos Carrasco P Ariel Miranda 2B José Altuve SS Carlos Correa OF George Springer OF Khris Davis OF Josh Reddick 1B Ryon Healy C Brian McCann 3B Trevor Plouffe",NA,"","",NA
464,748057326,"rayofhope (8/12)",0,86,"P Max Scherzer P Alex Meyer 1B Anthony Rizzo OF Bryce Harper 2B Ben Zobrist 3B Maikel Franco OF Max Kepler OF Eddie Rosario SS Jorge Polanco C Jason Castro",NA,"","",NA
465,748063027,"Awesemo (8/10)",0,85.85,"P Robbie Ray P Drew Pomeranz OF Mookie Betts OF Giancarlo Stanton SS Francisco Lindor OF Christian Yelich 1B Carlos Santana 2B José Ramírez C J.T. Realmuto 3B Derek Dietrich",NA,"","",NA
466,748123812,"Jquave76",0,85.45,"P Robbie Ray P Héctor Santiago OF Bryce Harper C Gary Sánchez OF Aaron Judge OF Brett Gardner 1B Matt Carpenter 2B Starlin Castro 3B Jedd Gyorko SS Zack Cozart",NA,"","",NA
466,748209182,"golions85 (2/2)",0,85.45,"P Matt Andriese P Jerad Eickhoff OF Bryce Harper 2B Daniel Murphy 1B Ryan Zimmerman 3B Anthony Rendon OF Aaron Judge OF Andrew Benintendi C Matt Wieters SS Cliff Pennington",NA,"","",NA
468,748442315,"ChipotleAddict (15/18)",0,85.4,"P Jeff Samardzija P Jerad Eickhoff 2B José Altuve SS Carlos Correa 1B Paul Goldschmidt OF A.J. Pollock 3B Jake Lamb OF Yasmany Tomás OF Josh Reddick C Brian McCann",NA,"","",NA
469,748036714,"scrawl",0,85.15,"P Matt Andriese P Charlie Morton OF Bryce Harper SS Trea Turner C Gary Sánchez OF Jayson Werth 1B Edwin Encarnación 2B Jason Kipnis 3B José Ramírez OF Lonnie Chisenhall",NA,"","",NA
470,748591274,"underjones (11/18)",0,85.05,"P Drew Pomeranz 3B Kris Bryant 2B Javier Báez 1B Freddie Freeman SS Addison Russell OF Albert Almora Jr. OF Ender Inciarte OF Nick Markakis C Tyler Flowers P Julio Urías",NA,"","",NA
471,748592264,"TBAP",0,84.85,"P Carlos Carrasco P Zack Wheeler OF Bryce Harper 1B Ryan Zimmerman OF Jayson Werth OF Marcell Ozuna 3B José Ramírez C J.T. Realmuto SS Zack Cozart 2B Jed Lowrie",NA,"","",NA
472,748040117,"rikkidee (2/9)",0,84.75,"P Drew Pomeranz P John Lackey 1B Anthony Rizzo 3B Kris Bryant 2B Ben Zobrist C Willson Contreras OF A.J. Pollock OF Yasmany Tomás SS Chris Owings OF David Peralta",NA,"","",NA
473,748450655,"ehafner (18/18)",0,84.55,"P Carlos Carrasco P Drew Pomeranz 1B Paul Goldschmidt OF Giancarlo Stanton OF A.J. Pollock 3B Jake Lamb OF Marcell Ozuna C J.T. Realmuto SS Chris Owings 2B Brandon Drury",NA,"","",NA
474,748683042,"FunkiMunki",0,84.45,"P Drew Pomeranz P Jharel Cotton OF Bryce Harper 3B Nolan Arenado SS Trea Turner OF Ian Desmond 2B Brad Miller OF Corey Dickerson 1B Logan Morrison C Yan Gomes",NA,"","",NA
475,748057330,"rayofhope (12/12)",0,84.1,"P Justin Verlander P Alex Meyer OF Bryce Harper SS Trea Turner 2B Daniel Murphy 1B Joey Votto OF Adam Duvall OF Jayson Werth 3B Eugenio Suárez C Devin Mesoraco",NA,"","",NA
476,748541217,"ackarmasports (1/3)",0,83.95,"P Drew Pomeranz P Charlie Morton OF Bryce Harper SS Trea Turner 2B Daniel Murphy 1B Ryan Zimmerman 3B Anthony Rendon OF Colby Rasmus OF Corey Dickerson C René Rivera",NA,"","",NA
477,748546652,"BeepImaJeep",0,83.8,"P Charlie Morton OF Bryce Harper SS Trea Turner 2B Daniel Murphy 1B Ryan Zimmerman OF Jayson Werth OF Max Kepler 3B Eduardo Escobar C Jason Castro P Julio Urías",NA,"","",NA
478,748040121,"rikkidee (6/9)",0,83.75,"P Drew Pomeranz P John Lackey 1B Anthony Rizzo 3B Kris Bryant 2B Ben Zobrist C Willson Contreras SS Corey Seager OF Joc Pederson OF Cody Bellinger OF Andrew Toles",NA,"","",NA
479,748462562,"gentlaw2 (3/5)",0,83.55,"P Carlos Carrasco P Drew Pomeranz 2B José Altuve 3B Evan Longoria OF Michael Conforto OF A.J. Pollock OF Yasmany Tomás SS Chris Owings 1B Kendrys Morales C Brian McCann",NA,"","",NA
480,748581183,"bigsexyca",0,83.4,"P Carlos Carrasco OF Bryce Harper 1B Ryan Zimmerman OF Adam Duvall OF Billy Hamilton 3B Eugenio Suárez SS Zack Cozart C Brian McCann 2B Ryan Goins P Julio Urías",NA,"","",NA
481,748721726,"antbank43",0,83.35,"P Jeff Samardzija P Drew Pomeranz OF Mookie Betts SS Francisco Lindor OF Andrew Benintendi 2B Jason Kipnis 1B Carlos Santana 3B José Ramírez OF Chris Young C Sandy León",NA,"","",NA
482,748384192,"boggslite (2/5)",0,83.3,"P Carlos Carrasco P Charlie Morton OF Bryce Harper SS Trea Turner 2B Daniel Murphy 1B Ryan Zimmerman OF Jayson Werth OF Matt Joyce 3B Yandy Díaz C Jeff Mathis",NA,"","",NA
483,748416994,"DraftCheat (15/18)",0,83.15,"P Matt Andriese P Charlie Morton OF Bryce Harper SS Trea Turner OF Ben Zobrist C Willson Contreras 3B Maikel Franco 2B Brad Miller OF Avisaíl García 1B Logan Morrison",NA,"","",NA
484,748315321,"yellowsub (1/2)",0,83.1,"P Justin Verlander P Drew Pomeranz 3B Kris Bryant SS Trea Turner OF George Springer C J.T. Realmuto 2B Tyler Saladino OF Corey Dickerson 1B Logan Morrison OF Andrew Toles",NA,"","",NA
485,748329144,"Ebone17",0,83.05,"P Carlos Carrasco P Ariel Miranda OF Bryce Harper 2B Daniel Murphy SS Francisco Lindor 1B Carlos Santana OF Jacoby Ellsbury C J.T. Realmuto OF Lorenzo Cain 3B T.J. Rivera",NA,"","",NA
486,748425485,"verbalcoltrane (1/2)",0,83,"P Charlie Morton P Jerad Eickhoff OF Bryce Harper 3B Nolan Arenado SS Carlos Correa OF Aaron Judge OF Andrew Benintendi C J.T. Realmuto 1B Mitch Moreland 2B Neil Walker",NA,"","",NA
487,748370121,"fallfromgrace (6/6)",0,82.85,"P Robbie Ray P Drew Pomeranz 3B Kris Bryant OF Bryce Harper 2B Ben Zobrist OF Max Kepler OF Byron Buxton SS Jorge Polanco 1B Joe Mauer C Jason Castro",NA,"","",NA
488,748281372,"mgriff20 (2/3)",0,82.55,"P Jeff Samardzija P Matt Andriese OF Bryce Harper 2B Daniel Murphy 1B Ryan Zimmerman OF Jayson Werth 3B Evan Longoria OF Corey Dickerson C Jason Castro SS Ehire Adrianza",NA,"","",NA
488,748409582,"nawmsayin (3/5)",0,82.55,"P Carlos Carrasco P Drew Pomeranz 3B Nolan Arenado OF Ian Desmond 1B Mark Reynolds OF Gerardo Parra 2B Brad Miller OF Corey Dickerson SS Tim Beckham C Jason Castro",NA,"","",NA
488,748436864,"reztes757 (1/6)",0,82.55,"P Carlos Carrasco P Drew Pomeranz 3B Kris Bryant SS Addison Russell OF Andrew Benintendi OF Khris Davis 1B Mitch Moreland OF Chris Young C Sandy León 2B Josh Rutledge",NA,"","",NA
491,748439914,"Tommyg1979 (3/4)",0,82.5,"P Max Scherzer P Ariel Miranda C Gary Sánchez OF Aaron Judge SS Jean Segura OF Brett Gardner 1B Edwin Encarnación OF Jacoby Ellsbury 2B Jed Lowrie 3B T.J. Rivera",NA,"","",NA
491,748592656,"cster14",0,82.5,"P Max Scherzer P Ariel Miranda C Gary Sánchez OF Aaron Judge SS Jean Segura OF Brett Gardner 1B Edwin Encarnación OF Jacoby Ellsbury 2B Jed Lowrie 3B T.J. Rivera",NA,"","",NA
493,748653124,"nawmsayin (5/5)",0,82.15,"P Matt Andriese P Charlie Morton OF Ben Zobrist 2B Javier Báez C Willson Contreras SS Addison Russell 1B José Abreu OF Albert Almora Jr. OF Avisaíl García 3B Matt Davidson",NA,"","",NA
494,748516932,"moklovin (4/6)",0,82.05,"P Drew Pomeranz 1B Anthony Rizzo 3B Kris Bryant 2B Ben Zobrist SS Addison Russell OF Joc Pederson C Yasmani Grandal OF Cody Bellinger OF Andrew Toles P Julio Urías",NA,"","",NA
494,748521724,"moklovin (6/6)",0,82.05,"P Drew Pomeranz 1B Anthony Rizzo 3B Kris Bryant 2B Ben Zobrist SS Addison Russell OF Joc Pederson C Yasmani Grandal OF Cody Bellinger OF Andrew Toles P Julio Urías",NA,"","",NA
496,748483492,"markcpro",0,82,"P Robbie Ray P Dan Straily OF Bryce Harper OF Aaron Judge SS Francisco Lindor 1B Edwin Encarnación 2B Jason Kipnis 3B José Ramírez OF Aaron Altherr C Brian McCann",NA,"","",NA
497,748111643,"Fly55",0,81.95,"P Drew Pomeranz P Charlie Morton 1B Ryan Zimmerman 3B Anthony Rendon OF Aaron Judge SS Francisco Lindor OF Andrew Benintendi C Matt Wieters 2B Starlin Castro OF Cody Bellinger",NA,"","",NA
498,748516173,"zakaro",0,81.6,"P Robbie Ray P Charlie Morton OF Bryce Harper SS Trea Turner 3B Anthony Rendon OF Giancarlo Stanton 1B Matt Carpenter 2B Kolten Wong C Yadier Molina OF Tommy Pham",NA,"","",NA
499,748189181,"scout326 (11/12)",0,81.4,"P Drew Pomeranz P Matt Andriese OF Bryce Harper SS Trea Turner 2B Daniel Murphy 1B Miguel Cabrera OF Jayson Werth 3B Nicholas Castellanos C James McCann OF Mikie Mahtook",NA,"","",NA
500,748593105,"smittycuc (2/2)",0,81.2,"P Carlos Carrasco P Robbie Ray 1B Ryan Zimmerman OF Adam Duvall OF Andrew McCutchen OF Avisaíl García 3B Jedd Gyorko SS Zack Cozart 2B Josh Harrison C Devin Mesoraco",NA,"","",NA
501,748416985,"DraftCheat (6/18)",0,81.15,"P Matt Andriese P Charlie Morton OF Bryce Harper 2B Daniel Murphy 1B Miguel Cabrera SS Francisco Lindor 3B Maikel Franco OF Avisaíl García OF Corey Dickerson C Brian McCann",NA,"","",NA
501,748416995,"DraftCheat (16/18)",0,81.15,"P Matt Andriese P Charlie Morton OF Bryce Harper SS Trea Turner 1B Miguel Cabrera OF Andrew Benintendi 3B Maikel Franco 2B Jonathan Villar OF Avisaíl García C Jason Castro",NA,"","",NA
503,748373098,"yellowsub (2/2)",0,81.1,"P Justin Verlander P Drew Pomeranz SS Carlos Correa OF George Springer 1B José Abreu 3B Todd Frazier OF Josh Reddick 2B Tyler Saladino OF Corey Dickerson C Brian McCann",NA,"","",NA
504,748494280,"BrandonAdams (11/18)",0,81,"P Max Scherzer P Drew Pomeranz C Gary Sánchez OF Giancarlo Stanton 1B Edwin Encarnación 2B Jason Kipnis 3B Jedd Gyorko OF Corey Dickerson SS Tim Beckham OF Matt Joyce",NA,"","",NA
505,748425166,"tinderella (1/5)",0,80.85001,"P Max Scherzer C Gary Sánchez OF Aaron Judge OF Brett Gardner OF Jacoby Ellsbury SS Eduardo Núñez 1B Brandon Belt 2B Joe Panik 3B Conor Gillaspie P Julio Urías",NA,"","",NA
506,748516933,"moklovin (5/6)",0,80.7,"P Robbie Ray 1B Anthony Rizzo 3B Kris Bryant 2B Ben Zobrist C Willson Contreras SS Addison Russell OF Andrew Toles OF Andrew Romine OF Matt Joyce P Julio Urías",NA,"","",NA
507,748588408,"suidmach",0,80.5,"P Drew Pomeranz P Zack Wheeler 3B Kris Bryant OF Bryce Harper OF Ben Zobrist C Willson Contreras 2B Brad Miller SS Zack Cozart 1B Mitch Moreland OF Corey Dickerson",NA,"","",NA
508,748591277,"underjones (14/18)",0,80.05,"P Drew Pomeranz 3B Kris Bryant OF Ben Zobrist 2B Javier Báez 1B Freddie Freeman SS Addison Russell OF Ender Inciarte OF Nick Markakis C Tyler Flowers P Julio Urías",NA,"","",NA
509,748339051,"moklovin (1/6)",0,80,"P Max Scherzer P Drew Pomeranz 3B Kris Bryant OF Bryce Harper 1B Carlos Santana C J.T. Realmuto OF Corey Dickerson OF Andrew Toles 2B Alexi Amarista SS Andrew Romine",NA,"","",NA
510,748605823,"monds6 (1/6)",0,79.75,"P Max Scherzer P Charlie Morton 3B Nolan Arenado OF Ian Desmond SS Trevor Story 1B Mark Reynolds OF Gerardo Parra 2B Jed Lowrie OF Matt Joyce C Martín Maldonado",NA,"","",NA
511,748275612,"mgriff20 (1/3)",0,79.5,"P Drew Pomeranz P Zack Wheeler 3B Kris Bryant C Gary Sánchez SS Trevor Story OF Aaron Judge OF Brett Gardner OF Gerardo Parra 1B Logan Morrison 2B Alexi Amarista",NA,"","",NA
511,748677936,"cubsfan333 (7/9)",0,79.5,"P Drew Pomeranz P Zack Wheeler 1B Anthony Rizzo 3B Kris Bryant OF Ben Zobrist 2B Javier Báez SS Addison Russell OF Andrew Benintendi OF Matt Joyce C Jeff Mathis",NA,"","",NA
513,748513314,"dahladino (4/5)",0,79.2,"P Drew Pomeranz P Alex Meyer 1B Anthony Rizzo 3B Kris Bryant OF Bryce Harper 2B Ben Zobrist C Willson Contreras SS Addison Russell OF Josh Reddick OF Corey Dickerson",NA,"","",NA
514,748046839,"meerkat",0,79,"P Jeff Samardzija P Robbie Ray C Gary Sánchez OF Aaron Judge SS Corey Seager OF Jacoby Ellsbury 2B Starlin Castro 3B Justin Turner 1B Cody Bellinger OF Andrew Toles",NA,"","",NA
515,748722639,"DonationKing",0,78.95,"P Drew Pomeranz P Charlie Morton SS Trea Turner C Gary Sánchez 1B Joey Votto OF Adam Duvall OF Billy Hamilton 2B Starlin Castro OF Scott Schebler 3B Eugenio Suárez",NA,"","",NA
516,748603452,"GOULET (2/2)",0,78.5,"P Drew Pomeranz P Zack Wheeler 3B Kris Bryant OF Bryce Harper SS Trea Turner 1B Mark Reynolds OF Gerardo Parra 2B Brad Miller OF Corey Dickerson C Devin Mesoraco",NA,"","",NA
517,748401853,"jarodnolley",0,78,"P Max Scherzer P Drew Pomeranz 1B Freddie Freeman SS Jean Segura OF Adam Duvall OF Brett Gardner 2B José Ramírez 3B Eugenio Suárez OF Corey Dickerson C René Rivera",NA,"","",NA
518,748586231,"jimmy0923",0,77.2,"P Carlos Carrasco P Robbie Ray SS Trea Turner 3B Anthony Rendon 1B Freddie Freeman OF Chris Young C Sandy León 2B Chris Taylor OF Trey Mancini OF Tommy Pham",NA,"","",NA
519,748193598,"SaahilSud (10/18)",0,77,"P Max Scherzer P Drew Pomeranz C Gary Sánchez 1B Paul Goldschmidt OF A.J. Pollock 3B Jake Lamb OF Yasmany Tomás OF David Peralta 2B Jed Lowrie SS José Iglesias",NA,"","",NA
520,748590743,"cubsfan333 (4/9)",0,76.95,"P Drew Pomeranz P Charlie Morton OF Bryce Harper SS Trea Turner 2B Daniel Murphy 1B Ryan Zimmerman OF Jayson Werth OF Cody Bellinger 3B Mike Moustakas C Omar Narváez",NA,"","",NA
521,748235231,"Stallion33 (1/2)",0,76.35,"P Jeff Samardzija P Drew Pomeranz SS Trea Turner OF Brett Gardner 1B Edwin Encarnación OF Khris Davis 3B Nicholas Castellanos C Matt Wieters 2B Brad Miller OF Colby Rasmus",NA,"","",NA
522,748040119,"rikkidee (4/9)",0,76.2,"P Drew Pomeranz P Alex Meyer 1B Anthony Rizzo 3B Kris Bryant 2B José Altuve OF Ben Zobrist OF George Springer SS Addison Russell OF Josh Reddick C Brian McCann",NA,"","",NA
523,748386242,"Drolson22 (2/2)",0,76,"P Max Scherzer P Drew Pomeranz OF Jay Bruce OF Brett Gardner 3B Kyle Seager 1B Edwin Encarnación OF Max Kepler SS Zack Cozart C Jason Castro 2B Jed Lowrie",NA,"","",NA
524,748425169,"tinderella (4/5)",0,75.4,"P Drew Pomeranz P Matt Andriese 3B Kris Bryant OF Ben Zobrist 2B Javier Báez SS Addison Russell OF Christian Yelich OF Marcell Ozuna C J.T. Realmuto 1B Justin Bour",NA,"","",NA
524,748442303,"ChipotleAddict (3/18)",0,75.4,"P Justin Verlander P Zack Wheeler OF Bryce Harper SS Trea Turner 1B José Abreu 3B Todd Frazier C Matt Wieters 2B Tyler Saladino OF Chris Heisey OF Willy García",NA,"","",NA
526,748310301,"jseating",0,74.45,"P Charlie Morton P Ariel Miranda OF Bryce Harper 2B José Altuve C Gary Sánchez 1B José Abreu SS Jean Segura OF Billy Hamilton OF A.J. Pollock 3B Eugenio Suárez",NA,"","",NA
527,748623139,"ErickW23",0,74.25,"P Dan Straily P CC Sabathia OF Bryce Harper 2B José Altuve 1B Ryan Zimmerman 3B Anthony Rendon OF Aaron Judge SS Francisco Lindor C Buster Posey OF Curtis Granderson",NA,"","",NA
528,748581544,"Wojo29",0,74.05,"P Robbie Ray P Matt Andriese OF Bryce Harper 2B Daniel Murphy OF Giancarlo Stanton 1B Edwin Encarnación 3B Eugenio Suárez SS Zack Cozart OF Corey Dickerson C Brian McCann",NA,"","",NA
529,748063022,"Awesemo (3/10)",0,74,"P Max Scherzer P Drew Pomeranz OF Bryce Harper 3B Nolan Arenado OF Max Kepler OF Eddie Rosario 1B Joe Mauer 2B Kolten Wong C Jason Castro SS Ehire Adrianza",NA,"","",NA
530,748415683,"daveterp55",0,73.95,"P Drew Pomeranz P Charlie Morton OF Bryce Harper SS Trea Turner 2B Daniel Murphy 3B Evan Longoria OF Khris Davis C Matt Wieters OF Corey Dickerson 1B Logan Morrison",NA,"","",NA
531,748184081,"BFER14",0,73.45,"P Charlie Morton P Ariel Miranda 2B José Altuve SS Carlos Correa C Gary Sánchez OF Aaron Judge OF Adam Duvall OF Billy Hamilton 1B Chris Carter 3B Ryon Healy",NA,"","",NA
532,748028611,"nomoreiloveyous (1/4)",0,73.2,"P Drew Pomeranz P Alex Meyer 1B Anthony Rizzo 3B Kris Bryant OF Bryce Harper SS Trea Turner OF Jayson Werth C Matt Wieters 2B Brad Miller OF Corey Dickerson",NA,"","",NA
533,748494281,"BrandonAdams (12/18)",0,73.1,"P Justin Verlander P Drew Pomeranz C Gary Sánchez OF Giancarlo Stanton SS Francisco Lindor 2B Jason Kipnis 1B Carlos Santana 3B José Ramírez OF Corey Dickerson OF Lonnie Chisenhall",NA,"","",NA
534,748620225,"WJC80",0,73.05,"P Drew Pomeranz OF Bryce Harper SS Trea Turner 1B Ryan Zimmerman OF Jayson Werth 3B Evan Longoria 2B Brad Miller OF Corey Dickerson C James McCann P Julio Urías",NA,"","",NA
535,748103905,"youdacao (9/18)",0,73,"P Max Scherzer P Drew Pomeranz 3B Nolan Arenado 1B Mark Reynolds OF Gerardo Parra OF Max Kepler OF Eddie Rosario SS Jorge Polanco C Jason Castro 2B Alexi Amarista",NA,"","",NA
535,748607394,"JDUB1010 (2/4)",0,73,"P Max Scherzer P Drew Pomeranz 3B Kris Bryant OF Bryce Harper SS Addison Russell C J.T. Realmuto 2B Kolten Wong OF Jarrod Dyson OF Willy García 1B Conor Gillaspie",NA,"","",NA
537,748534048,"ilikepie123 (2/2)",0,72.85,"P Robbie Ray P Drew Pomeranz 2B José Altuve SS Carlos Correa OF George Springer 3B Maikel Franco OF Brett Gardner OF Josh Reddick 1B Joe Mauer C Brian McCann",NA,"","",NA
538,748591275,"underjones (12/18)",0,72.65,"P Drew Pomeranz P Tim Adleman 3B Kris Bryant OF Bryce Harper 1B Ryan Zimmerman 2B Javier Báez C Willson Contreras SS Addison Russell OF Michael A. Taylor OF Chris Heisey",NA,"","",NA
539,748494285,"BrandonAdams (16/18)",0,72.1,"P Justin Verlander P Drew Pomeranz OF Ian Desmond C Willson Contreras SS Francisco Lindor 1B Edwin Encarnación 2B Jason Kipnis 3B José Ramírez OF Corey Dickerson OF Lonnie Chisenhall",NA,"","",NA
540,748679812,"bigticket8784",0,71.9,"P Matt Andriese P Ariel Miranda OF Bryce Harper C Gary Sánchez OF Aaron Judge 1B Freddie Freeman OF Andrew Benintendi 2B Robinson Canó 3B Eugenio Suárez SS Zack Cozart",NA,"","",NA
541,748696646,"chichigetda",0,71.85,"P Jeff Samardzija P Ariel Miranda 2B José Altuve SS Carlos Correa 1B Joey Votto OF Brett Gardner OF Billy Hamilton OF Scott Schebler 3B Ryon Healy C Brian McCann",NA,"","",NA
542,748685426,"bernielomax69",0,71.6,"P Robbie Ray P Charlie Morton OF Bryce Harper SS Trea Turner 2B Daniel Murphy 1B Ryan Zimmerman OF Jayson Werth 3B Justin Turner OF Matt Joyce C Omar Narváez",NA,"","",NA
543,748494284,"BrandonAdams (15/18)",0,71.55,"P Carlos Carrasco P Drew Pomeranz C Willson Contreras OF Giancarlo Stanton SS Francisco Lindor 2B Jason Kipnis 1B Carlos Santana 3B José Ramírez OF Corey Dickerson OF Mikie Mahtook",NA,"","",NA
544,748439913,"Tommyg1979 (2/4)",0,71.3,"P Ariel Miranda P Héctor Santiago OF Bryce Harper 2B Daniel Murphy 1B Ryan Zimmerman 3B Anthony Rendon OF Giancarlo Stanton SS Jean Segura OF Jayson Werth C J.T. Realmuto",NA,"","",NA
545,748474727,"BrandonAdams (7/18)",0,71.2,"P Drew Pomeranz P Alex Meyer 1B Anthony Rizzo 3B Kris Bryant OF Ben Zobrist OF Ian Desmond 2B Javier Báez SS Trevor Story C Willson Contreras OF Alexi Amarista",NA,"","",NA
546,748241200,"yankeesfan2 (1/2)",0,71.1,"P Justin Verlander P Drew Pomeranz 3B Nolan Arenado SS Trevor Story 1B Mark Reynolds OF Gerardo Parra 2B Brad Miller OF Josh Reddick OF Corey Dickerson C Jason Castro",NA,"","",NA
547,748383105,"petteytheft89 (4/6)",0,71.05,"P Drew Pomeranz 3B Kris Bryant OF Ben Zobrist C Willson Contreras SS Addison Russell 1B José Abreu OF Avisaíl García 2B Tyler Saladino OF Willy García P Julio Urías",NA,"","",NA
547,748591278,"underjones (15/18)",0,71.05,"P Drew Pomeranz 3B Kris Bryant 2B Ben Zobrist 1B Freddie Freeman SS Addison Russell OF Albert Almora Jr. OF Ender Inciarte OF Nick Markakis C Tyler Flowers P Julio Urías",NA,"","",NA
549,748197035,"dandydon (6/6)",0,70.7,"P Drew Pomeranz P Ariel Miranda 3B Kris Bryant OF Mookie Betts 2B Ben Zobrist SS Addison Russell OF Andrew Benintendi 1B Mitch Moreland OF Chris Young C Sandy León",NA,"","",NA
550,748583734,"Rotomania (5/6)",0,70.6,"P Robbie Ray P Charlie Morton 3B Nolan Arenado 2B José Altuve SS Trevor Story 1B Mark Reynolds OF Gerardo Parra OF Josh Reddick C Brian McCann OF Alexi Amarista",NA,"","",NA
551,748103829,"fortheoffice (10/10)",0,70.55,"P Ariel Miranda 1B Anthony Rizzo 3B Kris Bryant 2B Javier Báez C Willson Contreras SS Addison Russell OF Gerardo Parra OF Cody Bellinger OF Andrew Toles P Julio Urías",NA,"","",NA
551,748591266,"underjones (3/18)",0,70.55,"P Ariel Miranda 1B Anthony Rizzo 3B Kris Bryant OF Ryan Braun SS Addison Russell OF Albert Almora Jr. 2B Jonathan Villar OF Domingo Santana C Manny Piña P Julio Urías",NA,"","",NA
553,748064100,"patconser",0,70.3,"P Justin Verlander P Matt Andriese OF Bryce Harper OF Ian Desmond OF Brett Gardner C Matt Wieters 3B Ryon Healy 1B Mitch Moreland SS Chris Owings 2B Jed Lowrie",NA,"","",NA
554,748282823,"EMSBRO",0,70.1,"P Justin Verlander P Drew Pomeranz OF Bryce Harper 2B Daniel Murphy 1B Ryan Zimmerman 3B Anthony Rendon C Matt Wieters SS Alcides Escobar OF Ezequiel Carrera OF Magneuris Sierra",NA,"","",NA
554,748494286,"BrandonAdams (17/18)",0,70.1,"P Justin Verlander P Drew Pomeranz C Willson Contreras OF Giancarlo Stanton SS Francisco Lindor 1B Edwin Encarnación 2B Jason Kipnis 3B José Ramírez OF Corey Dickerson OF Lonnie Chisenhall",NA,"","",NA
556,748057327,"rayofhope (9/12)",0,70,"P Max Scherzer P Drew Pomeranz 1B José Abreu OF Adam Duvall OF Billy Hamilton OF Avisaíl García 3B Eugenio Suárez SS Zack Cozart 2B Tyler Saladino C Omar Narváez",NA,"","",NA
557,748474722,"BrandonAdams (2/18)",0,69.25,"P Drew Pomeranz P Jerad Eickhoff 1B Anthony Rizzo 3B Kris Bryant OF Ben Zobrist 2B Javier Báez C Willson Contreras OF Corey Dickerson OF Lonnie Chisenhall SS Tim Beckham",NA,"","",NA
558,748189178,"scout326 (8/12)",0,69.05,"P Drew Pomeranz OF Bryce Harper SS Trea Turner 2B Daniel Murphy 3B Manny Machado 1B Chris Davis OF Seth Smith OF Trey Mancini C Caleb Joseph P Julio Urías",NA,"","",NA
558,748633364,"fjbourne (2/2)",0,69.05,"P Drew Pomeranz 3B Nolan Arenado OF Ian Desmond SS Trevor Story 2B DJ LeMahieu 1B Mark Reynolds C Yasmani Grandal OF Cody Bellinger OF Andrew Toles P Julio Urías",NA,"","",NA
560,748344297,"1ucror",0,68.6,"P Carlos Carrasco P Jerad Eickhoff OF Bryce Harper SS Trea Turner 2B Daniel Murphy 1B Ryan Zimmerman OF Jayson Werth OF Alexi Amarista 3B Conor Gillaspie C René Rivera",NA,"","",NA
560,748350094,"thaley440",0,68.6,"P Ariel Miranda P CC Sabathia OF Bryce Harper OF Mookie Betts 2B José Altuve 1B Ryan Zimmerman SS Carlos Correa OF Aaron Judge C Brian McCann 3B Josh Rutledge",NA,"","",NA
562,748576317,"frankiev3922 (2/5)",0,68.55,"P Jeff Samardzija P Matt Andriese OF Giancarlo Stanton SS Francisco Lindor OF Christian Yelich 2B Dee Gordon 1B Carlos Santana OF Marcell Ozuna 3B José Ramírez C J.T. Realmuto",NA,"","",NA
563,748486339,"scottf1 (1/2)",0,68.3,"P Robbie Ray P Tim Adleman OF Bryce Harper SS Trea Turner 2B Daniel Murphy 1B Ryan Zimmerman OF Adam Duvall OF Jayson Werth 3B Eugenio Suárez C Devin Mesoraco",NA,"","",NA
564,748057321,"rayofhope (3/12)",0,67.95,"P Justin Verlander OF Bryce Harper SS Trea Turner 1B José Abreu 3B Todd Frazier OF Avisaíl García 2B Tyler Saladino OF Chris Heisey C Omar Narváez P Julio Urías",NA,"","",NA
565,748370119,"fallfromgrace (4/6)",0,67.85,"P Robbie Ray P Drew Pomeranz 3B Kris Bryant C Gary Sánchez OF Aaron Judge OF Brett Gardner OF Jacoby Ellsbury 1B Joe Mauer 2B Kolten Wong SS Ronald Torreyes",NA,"","",NA
566,748682707,"cubsfan333 (8/9)",0,67.25,"P Drew Pomeranz P Jerad Eickhoff 3B Kris Bryant C Gary Sánchez OF Aaron Judge SS Addison Russell OF Brett Gardner OF Jacoby Ellsbury 2B Starlin Castro 1B Logan Morrison",NA,"","",NA
567,748462532,"alainjakubowicz",0,66.85,"P Robbie Ray P Drew Pomeranz SS Xander Bogaerts 1B Paul Goldschmidt OF Aaron Judge OF Jacoby Ellsbury 2B Starlin Castro C Buster Posey 3B Justin Turner OF Cody Bellinger",NA,"","",NA
568,748603982,"JBingo (1/2)",0,66.6,"P Carlos Carrasco P Jerad Eickhoff OF Bryce Harper SS Carlos Correa 3B Maikel Franco 1B Edwin Encarnación OF Andrew McCutchen 2B Brandon Phillips OF Brandon Belt C Manny Piña",NA,"","",NA
568,748700299,"JBingo (2/2)",0,66.6,"P Carlos Carrasco P Jerad Eickhoff OF Bryce Harper SS Carlos Correa 3B Maikel Franco 1B Edwin Encarnación OF Andrew McCutchen 2B Brandon Phillips OF Brandon Belt C Manny Piña",NA,"","",NA
