"Rank","EntryId","EntryName","TimeRemaining","Points","Lineup","X","Player","X.Drafted","FPTS"
219,796048267,"cowboysromo22",0,84.7,"P Trevor Cahill P Adam Conley OF Mike Trout OF Charlie Blackmon OF Bryce Harper 1B Paul Goldschmidt 2B Jonathan Schoop 3B Jake Lamb SS Didi Gregorius C J.T. Realmuto",NA,"Stuart Turner","0.67%",16
220,795845860,"griffin777 (12/15)",0,84.35,"P Rick Porcello P Troy Scribner 2B José Altuve 1B Paul Goldschmidt OF J.D. Martinez SS Zack Cozart 3B Jake Lamb OF A.J. Pollock OF David Peralta C Buster Posey",NA,"Joe Panik","0.67%",5
221,796076863,"George7 (1/2)",0,83.9,"P Justin Verlander P Rick Porcello SS Corey Seager OF J.D. Martinez OF Aaron Judge OF A.J. Pollock 3B Hernán Pérez 2B Ben Zobrist C Manny Piña 1B Luis Valbuena",NA,"José Martínez","0.67%",17
222,796072030,"rnwinall (1/7)",0,83.5,"P Collin McHugh P Kyle Hendricks C Willson Contreras 3B Kris Bryant 1B Ryan Zimmerman 2B Ian Happ OF Shin-soo Choo SS Javier Báez OF Eric Thames OF Ji-Man Choi",NA,"Chad Pinder","0.67%",0
223,795849884,"griffin777 (14/15)",0,83.25,"P Kyle Hendricks P Asher Wojciechowski 1B Cody Bellinger SS Corey Seager 3B Justin Turner OF J.D. Martinez OF A.J. Pollock OF Yasiel Puig C Yasmani Grandal 2B Brandon Drury",NA,"Bartolo Colón","0.67%",26.15
224,796015647,"bobneill",0,83.2,"P Rick Porcello P Sean Newcomb 3B Manny Machado SS Francisco Lindor OF Aaron Judge 2B Jonathan Schoop OF Adam Jones C Gary Sánchez OF Trey Mancini 1B Chris Davis",NA,"Jacoby Ellsbury","0.67%",9
225,796091675,"garvchris",0,83.05,"P Alex Wood P Rafael Montero 2B José Altuve 3B José Ramírez OF Derek Fisher OF Mookie Betts OF Ryan Braun C Gary Sánchez 1B Eric Thames SS Marcus Semien",NA,"Brandon Moss","0.67%",0
226,796104864,"buchris532 (10/15)",0,82.95,"P Trevor Bauer P Jake Odorizzi 1B Joey Votto SS Marwin González 3B José Ramírez OF Derek Fisher OF Billy Hamilton 2B Jason Kipnis C Brian McCann OF Austin Jackson",NA,"Nick Williams","0.67%",2
227,796137725,"bladesandfloors (1/2)",0,82.85,"P Masahiro Tanaka P Mike Leake 2B José Altuve OF Cody Bellinger 3B Freddie Freeman OF Adam Duvall OF Mookie Betts 1B Wilmer Flores SS Amed Rosario C Brett Nicholas",NA,"Jed Lowrie","0.67%",9
228,795946754,"SUNSET76 (3/15)",0,82.8,"P Kevin Gausman P Masahiro Tanaka 2B José Altuve 1B Joey Gallo OF Nomar Mazara 3B Adrián Béltre OF Carlos Gómez SS Eric Sogard C Manny Piña OF Drew Robinson",NA,"Justin Upton","0.67%",0
229,796126627,"baumercol",0,82.7,"P Justin Verlander P Kyle Hendricks SS Corey Seager OF A.J. Pollock 2B Robinson Canó OF José Pirela C Cameron Rupp 1B Eric Thames 3B Wilmer Flores OF Yoenis Céspedes",NA,"Steve Pearce","0.67%",9
230,796066585,"gfay63 (14/15)",0,82.3,"P Justin Verlander P Sean Newcomb OF Mike Trout 2B Jonathan Schoop SS Tim Beckham OF Adam Jones OF Khris Davis 1B Chris Davis C Buster Posey 3B Luis Valbuena",NA,"Eddie Rosario","0.67%",6
231,796066580,"gfay63 (9/15)",0,82.2,"P Rick Porcello P Sean Newcomb OF Mike Trout 3B Manny Machado SS Tim Beckham OF Adam Jones OF Khris Davis 2B Robinson Canó 1B Chris Davis C Buster Posey",NA,"Joc Pederson","0.67%",11
232,795840106,"griffin777 (10/15)",0,82.1,"P Kyle Hendricks P Jake Odorizzi OF Bryce Harper 2B Daniel Murphy OF Andrew Benintendi OF Mookie Betts 3B Eduardo Núñez 1B Mitch Moreland C Matt Wieters SS Xander Bogaerts",NA,"Albert Almora Jr.","0.67%",17
233,796107329,"blackhaze13",0,81.75,"P Rick Porcello P Trevor Cahill 2B Chris Taylor 3B Freddie Freeman OF Giancarlo Stanton OF Nelson Cruz 1B Joey Gallo SS Paul DeJong OF Eric Thames C Buster Posey",NA,"Sandy Leon","0.67%",11
233,796126028,"jusaf10 (3/3)",0,81.75,"P Zack Greinke P Brandon Woodruff OF Bryce Harper SS Francisco Lindor OF Ryan Braun 2B Howie Kendrick OF Domingo Santana 3B Hernán Pérez 1B Eric Thames C René Rivera",NA,"Pablo Sandoval","0.45%",5
235,796079110,"George7 (2/2)",0,81.6,"P Justin Verlander P Jerad Eickhoff SS Corey Seager OF A.J. Pollock OF Ryan Braun OF Carlos Beltrán 3B Hernán Pérez 1B Matt Carpenter 2B Brandon Phillips C Manny Piña",NA,"Seth Smith","0.45%",0
236,796058396,"Hinobrown (1/3)",0,81.35,"P Collin McHugh P Trevor Bauer OF Brett Gardner 1B Justin Smoak 3B Travis Shaw 2B Yangervis Solarte SS Orlando Arcia C Russell Martin OF Steve Pearce OF José Bautista",NA,"Martín Maldonado","0.45%",0
237,795944116,"mattvandenburg",0,81.25,"P Masahiro Tanaka P Troy Scribner OF Mike Trout 3B Freddie Freeman OF Giancarlo Stanton SS Corey Seager OF Aaron Judge C Gary Sánchez 1B Eric Thames 2B Brad Miller",NA,"David Peralta","0.45%",2
238,796051863,"southtexaspanic",0,80.85,"P Alex Wood P Brandon Woodruff OF Cody Bellinger 1B Freddie Freeman SS Francisco Lindor 3B Kris Bryant OF Domingo Santana 2B Jason Kipnis OF Carlos Gómez C Roberto Pérez",NA,"Robinson Chirinos","0.45%",0
238,796137839,"spagy48",0,80.85,"P Ivan Nova P Jake Odorizzi OF Bryce Harper OF Adam Duvall C Willson Contreras 3B Kris Bryant 1B Justin Smoak 2B Ian Happ SS Didi Gregorius OF Randal Grichuk",NA,"Joe Mauer","0.45%",0
240,796115097,"Laffyville",0,80.8,"P Justin Verlander P Masahiro Tanaka OF Ryan Braun OF Carlos Beltrán 2B César Hernández 3B Maikel Franco OF Eric Thames C Yadier Molina 1B Eric Hosmer SS Xander Bogaerts",NA,"Tim Anderson","0.45%",25
240,796124781,"Rlongman19 (1/4)",0,80.8,"P Kevin Gausman P Masahiro Tanaka 1B Joey Votto 2B Yangervis Solarte OF Seth Smith OF Cory Spangenberg 3B Eugenio Suárez OF Yoenis Céspedes C Buster Posey SS José Peraza",NA,"Hanley Ramirez","0.45%",5
242,796020745,"mnm86",0,80.4,"P Brandon Woodruff P Adam Conley OF Mike Trout OF Charlie Blackmon 3B Nolan Arenado 2B Chris Taylor 1B Anthony Rizzo OF Mookie Betts C Gary Sánchez SS Andrelton Simmons",NA,"Starling Marte","0.45%",2
243,795985396,"eladk (1/2)",0,79.8,"P Gio González P Adam Conley OF Aaron Judge 3B Jake Lamb OF Andrew McCutchen OF Marcell Ozuna SS Didi Gregorius 1B Logan Morrison 2B Whit Merrifield C Christian Vázquez",NA,"Asdrúbal Cabrera","0.45%",0
244,796081078,"ombjac22 (2/2)",0,79.55,"P Madison Bumgarner P Jake Odorizzi OF Derek Fisher OF Bradley Zimmer OF Manuel Margot 3B Maikel Franco 2B Jed Lowrie 1B Eric Thames SS Eric Sogard C Manny Piña",NA,"Dansby Swanson","0.45%",0
245,796029727,"FreemanByrd",0,79.5,"P Collin McHugh P Kyle Hendricks OF Aaron Judge OF Michael Conforto 2B Paul DeJong 3B Josh Donaldson SS Andrelton Simmons 1B Matt Carpenter OF José Martínez C Yadier Molina",NA,"Dustin Pedroia","0.45%",0
246,796140834,"cattersmall",0,79.4,"P Collin McHugh OF Charlie Blackmon 3B Nolan Arenado SS Elvis Andrus 2B José Ramírez OF Jay Bruce C Brian McCann OF Austin Jackson 1B José Abreu P Martín Pérez",NA,"Christian Vázquez","0.45%",0
247,795816640,"jaduff28 (3/3)",0,79.2,"P Rick Porcello P Sean Newcomb OF Mike Trout 2B José Altuve 1B Freddie Freeman 3B Alex Bregman SS Orlando Arcia OF José Pirela OF Eric Thames C Cam Gallagher",NA,"Nick Tepesch","0.45%",2.35
248,796101685,"BRUMMIE22",0,79.15,"P Alex Wood P Trevor Cahill OF Mike Trout 1B Paul Goldschmidt SS Corey Seager 3B Kris Bryant OF Mookie Betts OF Carlos González C J.T. Realmuto 2B Brad Miller",NA,"Miguel González","0.45%",24.4
249,795936526,"mike4934",0,79.1,"P Alex Wood P Collin McHugh OF Aaron Judge OF Ryan Braun 1B Logan Morrison 3B Kyle Seager 2B Whit Merrifield C Brian McCann SS Freddy Galvis OF Corey Dickerson",NA,"Kevin Pillar","0.45%",5
250,796023842,"goochmonger (4/15)",0,78.85,"P Alex Wood P Trevor Bauer 3B Anthony Rendon OF Marwin González 2B José Ramírez OF Eduardo Núñez OF Khris Davis C Brian McCann SS Dusty Coleman 1B Matt Olson",NA,"Ender Inciarte","0.45%",0
250,796109783,"SquareNowski",0,78.85,"P Alex Wood P Brandon Woodruff 2B José Altuve 3B José Ramírez 1B Carlos Santana OF Gerardo Parra OF Jay Bruce SS Orlando Arcia OF Shin-soo Choo C Manny Piña",NA,"Ozzie Albies","0.45%",7
252,796137346,"hawk2116",0,78.8,"P Mike Leake P Rafael Montero OF Mike Trout OF Bryce Harper 3B Manny Machado SS Francisco Lindor 1B Carlos Santana C Gary Sánchez 2B Jason Kipnis OF Austin Jackson",NA,"Ryder Jones","0.45%",3
253,796023849,"goochmonger (11/15)",0,78,"P Alex Wood P Kyle Hendricks OF Bryce Harper OF Josh Reddick 3B Alex Bregman OF Aaron Judge C Welington Castillo SS Xander Bogaerts 2B Neil Walker 1B Matt Olson",NA,"Tyler White","0.45%",0
253,796023850,"goochmonger (12/15)",0,78,"P Alex Wood P Kyle Hendricks OF Bryce Harper OF Josh Reddick 3B Alex Bregman OF Aaron Judge C Welington Castillo SS Xander Bogaerts 2B Neil Walker 1B Matt Olson",NA,"Cory Spangenberg","0.45%",3
255,796132645,"rbrtlua (2/2)",0,77.85,"P Gio González P Rick Porcello OF Mike Trout OF J.D. Martinez SS Andrelton Simmons OF José Pirela C Buster Posey 1B Tyler White 3B José Reyes 2B Neil Walker",NA,"Jon Jay","0.45%",0
256,795838628,"griffin777 (8/15)",0,77.8,"P Masahiro Tanaka P César Valdez OF Bryce Harper 2B Daniel Murphy OF Giancarlo Stanton 3B Anthony Rendon 1B Ryan Zimmerman OF Marcell Ozuna C Matt Wieters SS Taylor Motter",NA,"Brock Holt","0.45%",9
257,796070398,"Bill4short",0,77.5,"P Yovani Gallardo P Brandon Woodruff OF Mike Trout OF Bryce Harper 1B Freddie Freeman 3B Justin Turner OF Ryan Braun 2B Dee Gordon SS Orlando Arcia C Yadier Molina",NA,"Yolmer Sánchez","0.45%",7
258,796061246,"kennon27",0,77.35,"P Masahiro Tanaka P Asher Wojciechowski 1B Cody Bellinger OF Aaron Judge OF Justin Upton 3B Mike Moustakas 2B DJ LeMahieu OF Dexter Fowler SS Javier Báez C Alex Avila",NA,"Ketel Marte","0.45%",7
259,795993368,"swimm111",0,77.15,"P Alex Wood P Trevor Cahill OF Mike Trout 1B Paul Goldschmidt SS Corey Seager 3B Kris Bryant OF A.J. Pollock OF Carlos González C J.T. Realmuto 2B Brad Miller",NA,"Alexi Amarista","0.45%",14
259,796083810,"snowman17.5",0,77.15,"P Zack Greinke P Yovani Gallardo OF Giancarlo Stanton 2B José Ramírez SS Francisco Lindor 3B Josh Donaldson OF Nomar Mazara 1B Eric Thames C Brian McCann OF Matt Olson",NA,"Hunter Pence","0.22%",19
261,796128004,"RocketWizard43 (2/5)",0,77,"P Ivan Nova P Brandon Woodruff OF Mike Trout 2B José Altuve OF Charlie Blackmon OF Chris Taylor 3B Alex Bregman C Gary Sánchez SS Andrelton Simmons 1B Luis Valbuena",NA,"José Iglesias","0.22%",2
262,796117818,"JFroShowtime",0,76.9,"P Kevin Gausman P Rick Porcello 2B José Altuve 1B Yuli Gurriel OF Eduardo Núñez 3B Kyle Seager OF José Pirela OF Yoenis Céspedes SS Xander Bogaerts C René Rivera",NA,"Juan Graterol","0.22%",0
262,796121574,"jajusjena (3/3)",0,76.9,"P Madison Bumgarner P Rafael Montero OF Mike Trout 2B José Ramírez SS Jean Segura 1B Edwin Encarnacion OF Khris Davis OF Eric Thames C René Rivera 3B Matt Chapman",NA,"Michael Brantley","0.22%",0
264,795946752,"SUNSET76 (2/15)",0,76.8,"P Kevin Gausman P Masahiro Tanaka SS Elvis Andrus OF Ryan Braun 2B Yangervis Solarte OF Shin-soo Choo 1B Eric Thames OF Carlos Gómez C Brett Nicholas 3B Drew Robinson",NA,"Mark Reynolds","0.22%",0
265,796127836,"AceSarafin (1/2)",0,76.7,"P Madison Bumgarner P Brandon Woodruff 3B Manny Machado SS Paul DeJong OF Khris Davis 2B Robinson Canó C Brian McCann OF Trey Mancini 1B Wilmer Flores OF Yoenis Céspedes",NA,"Scooter Gennett","0.22%",0
266,796097314,"jbeezy3333 (3/4)",0,76.45,"P Madison Bumgarner P Alex Wood OF Mike Trout 3B Freddie Freeman SS Corey Seager OF Jim Adduci C Francisco Cervelli OF Gregory Polanco 2B Kaleb Cowart 1B Matt Olson",NA,"Taylor Motter","0.22%",0
266,796100594,"jbeezy3333 (4/4)",0,76.45,"P Madison Bumgarner P Alex Wood OF Mike Trout 3B Freddie Freeman SS Corey Seager OF Jim Adduci C Francisco Cervelli OF Gregory Polanco 2B Kaleb Cowart 1B Matt Olson",NA,"A.J. Griffin","0.22%",0
268,795887568,"BK68 (1/9)",0,76.35,"P Collin McHugh P Trevor Bauer 3B José Ramírez SS Francisco Lindor 1B Edwin Encarnacion OF Keon Broxton 2B Jason Kipnis C Welington Castillo OF Carlos Gómez OF Corey Dickerson",NA,"Yasiel Puig","0.22%",9
268,796107694,"falcons7911",0,76.35,"P Collin McHugh P Trevor Bauer OF Bryce Harper OF J.D. Martinez OF Aaron Judge 3B Mike Moustakas 1B Logan Morrison SS Ketel Marte 2B Eric Sogard C Jeff Mathis",NA,"Brandon Drury","0.22%",0
270,795875129,"npr40 (1/2)",0,76.3,"P Antonio Senzatela P Trevor Cahill OF Mike Trout OF Charlie Blackmon OF Bryce Harper 3B Nolan Arenado 1B Freddie Freeman 2B Robinson Canó SS Andrelton Simmons C Brian McCann",NA,"Mike Napoli","0.22%",0
271,796023852,"goochmonger (14/15)",0,76.25,"P Gio González P Alex Wood OF Aaron Judge 2B Jonathan Schoop OF Khris Davis OF Yoenis Céspedes C Buster Posey SS Dusty Coleman 3B Jedd Gyorko 1B Matt Olson",NA,"Kendrys Morales","0.22%",0
271,796032715,"bpesch15",0,76.25,"P Kyle Hendricks P Asher Wojciechowski 1B Freddie Freeman OF Aaron Judge 2B Jonathan Schoop SS Jean Segura 3B Eduardo Núñez OF Khris Davis OF Hernán Pérez C Brian McCann",NA,"Melky Cabrera","0.22%",21
273,795970211,"dez_Wick",0,76,"P Justin Verlander P Kevin Gausman 2B José Altuve OF Khris Davis OF Domingo Santana 1B Eric Thames C Welington Castillo 3B Ryon Healy SS Dusty Coleman OF Gregory Polanco",NA,"Yan Gomes","0.22%",0
274,796148744,"sliddy",0,75.9,"P Mike Leake P Adam Conley OF Charlie Blackmon OF Giancarlo Stanton OF J.D. Martinez 2B Jonathan Schoop SS Jean Segura 3B Travis Shaw 1B Joey Gallo C Brian McCann",NA,"Ryan Goins","0.22%",11
275,795887576,"BK68 (2/9)",0,75.85,"P Justin Verlander P Trevor Cahill 2B José Altuve OF Josh Reddick SS Marwin González 1B Yuli Gurriel OF Aaron Judge OF José Bautista 3B Jedd Gyorko C Stuart Turner",NA,"Danny Valencia","0.22%",0
276,796065167,"dallasmojo505",0,75.8,"P Kevin Gausman P Masahiro Tanaka 1B Paul Goldschmidt OF Curtis Granderson OF Ryan Braun OF Brandon Moss C Yadier Molina SS Asdrúbal Cabrera 3B Evan Longoria 2B Brad Miller",NA,"Matt Adams","0.22%",0
277,796062693,"bunny2016 (2/2)",0,75.55,"P Kevin Gausman P Trevor Bauer 2B José Ramírez SS Francisco Lindor 1B Edwin Encarnacion OF Hernán Pérez C Brian McCann OF Yoenis Céspedes 3B Chase Headley OF Randal Grichuk",NA,"Garrett Cooper","0.22%",20
278,796021853,"fivestarco (2/6)",0,75.35,"P Collin McHugh P Trevor Bauer SS Corey Seager OF A.J. Pollock OF Ryan Braun 1B Logan Morrison 2B Robinson Canó 3B Hernán Pérez C Yadier Molina OF Yoenis Céspedes",NA,"Miguel Rojas","0.22%",3
278,796118241,"RGRC12",0,75.35,"P Collin McHugh P Trevor Bauer 2B Daniel Murphy SS Marwin González 3B José Ramírez 1B Joey Gallo OF Abraham Almonte OF Austin Jackson OF Yoenis Céspedes C Roberto Pérez",NA,"Tommy Pham","0.22%",5
280,796100727,"duffman87333",0,74.45,"P Madison Bumgarner P Sean Newcomb OF Giancarlo Stanton 3B Adrián Béltre OF Shin-soo Choo 2B Jason Kipnis 1B Eric Thames OF Yoenis Céspedes C Manny Piña SS José Reyes",NA,"Nolan Fontana","0.22%",0
281,795978216,"anabella",0,74.1,"P Alex Wood P Collin McHugh 3B Justin Turner OF Aaron Judge OF Ryan Braun OF Dexter Fowler 2B César Hernández 1B Matt Carpenter C Buster Posey SS Brandon Crawford",NA,"Jarrod Dyson","0.22%",5
281,796104198,"rkulp12 (2/3)",0,74.1,"P Masahiro Tanaka P Sean Newcomb 2B Daniel Murphy OF Giancarlo Stanton OF Ryan Braun C Gary Sánchez OF Domingo Santana 1B Eric Thames 3B Eugenio Suárez SS Marcus Semien",NA,"Nick Markakis","0.22%",10
281,796140677,"Dodgerboy1023",0,74.1,"P Asher Wojciechowski P Brandon Woodruff OF Mike Trout OF Bryce Harper 1B Joey Votto 2B Chris Taylor 3B Freddie Freeman SS Paul DeJong OF Austin Jackson C Roberto Pérez",NA,"Rob Refsnyder","0.22%",0
284,796150078,"rk053169",0,73.95,"P Alex Wood P Travis Wood OF Mike Trout OF Giancarlo Stanton 3B Manny Machado SS Tim Beckham 2B Robinson Canó OF Matt Joyce 1B Yonder Alonso C Roberto Pérez",NA,"Dawel Lugo","0.22%",0
285,795945599,"THEKID28",0,73.85,"P Sean Newcomb P Asher Wojciechowski OF Mike Trout 2B José Altuve 1B Paul Goldschmidt OF Giancarlo Stanton 3B José Ramírez OF Eric Thames SS Xander Bogaerts C Wilson Ramos",NA,"Ildemaro Vargas","0.22%",0
286,795931247,"smurfythegreek",0,73.75,"P Collin McHugh P Yovani Gallardo OF Mike Trout OF Bryce Harper OF Nelson Cruz 1B Justin Smoak 2B Dee Gordon 3B Maikel Franco C J.T. Realmuto SS Ryan Goins",NA,"Lucas Duda","0.22%",0
287,796146647,"coreyscastle120508",0,73.45,"P Masahiro Tanaka P Travis Wood OF Mike Trout 1B Paul Goldschmidt OF Cody Bellinger OF Giancarlo Stanton 3B Justin Turner SS Xander Bogaerts C Martín Maldonado 2B Kaleb Cowart",NA,"Jorge Bonifacio","0.22%",0
288,796023853,"goochmonger (15/15)",0,73.25,"P Gio González P Alex Wood OF Aaron Judge 2B Jonathan Schoop OF Khris Davis C Brian McCann OF Yoenis Céspedes SS Dusty Coleman 3B Jedd Gyorko 1B Matt Olson",NA,"Chase Utley","0.22%",0
289,796002486,"headzona",0,73.15,"P Alex Wood P Trevor Cahill 2B José Altuve 3B Manny Machado SS Francisco Lindor OF Ryan Braun C Gary Sánchez OF Domingo Santana OF Yoenis Céspedes 1B Miguel Cabrera",NA,"Arismendy Alcántara","0.22%",0
290,796144211,"barnett0472 (1/3)",0,72.95,"P Madison Bumgarner P Masahiro Tanaka SS Jean Segura OF David Peralta 1B José Abreu OF Yoenis Céspedes C Tyler Flowers 3B Evan Longoria 2B Joe Panik OF Brock Holt",NA,"Miguel Andújar","0.22%",0
291,795933855,"tjrams123",0,72.7,"P Collin McHugh P Rick Porcello OF Andrew Benintendi OF Aaron Judge OF Bradley Zimmer 3B Jake Lamb 1B Yonder Alonso 2B César Hernández SS Freddy Galvis C Buster Posey",NA,"Magneuris Sierra","0.22%",0
292,796064835,"tfamularo (1/3)",0,72.45,"P Madison Bumgarner P Sean Newcomb SS Corey Seager OF A.J. Pollock OF Ryan Braun 3B Hernán Pérez C Brian McCann 2B Brandon Phillips OF Jacoby Ellsbury 1B Victor Martinez",NA,"Adam Engel","0.22%",7
293,796060284,"Mvladic",0,72.35,"P Collin McHugh P Brandon Woodruff OF Mike Trout 1B Joey Votto 2B Brian Dozier OF Andrew McCutchen SS Wilmer Difo OF Eric Thames 3B Chase Headley C Francisco Cervelli",NA,"Eduardo Escobar","0.22%",0
293,796100182,"ehanc74",0,72.35,"P Collin McHugh P Brandon Woodruff OF Bryce Harper 1B Freddie Freeman 3B Anthony Rendon OF Adam Duvall SS Didi Gregorius OF Domingo Santana C Matt Wieters 2B Josh Harrison",NA,"Hunter Renfroe","0.22%",3
295,796123045,"rnwinall (5/7)",0,71.85,"P Jake Odorizzi P Antonio Senzatela 1B Cody Bellinger OF Josh Reddick OF Giancarlo Stanton 3B Anthony Rendon OF Marwin González SS Corey Seager 2B DJ LeMahieu C Yadier Molina",NA,"Carlos Asuaje","0.22%",0
296,796111681,"buchris532 (14/15)",0,71.75,"P Gio González P Collin McHugh SS Francisco Lindor OF Michael Conforto 1B Edwin Encarnacion OF Jay Bruce OF Yoenis Céspedes 3B Evan Longoria 2B Brad Miller C Roberto Pérez",NA,"Curtis Granderson","0.22%",0
297,795976986,"BALTIMORE123 (1/2)",0,71.7,"P Kevin Gausman P Kyle Hendricks OF Mike Trout SS Corey Seager 1B Logan Morrison OF Dexter Fowler OF Hernán Pérez C Yadier Molina 2B Josh Harrison 3B Luis Valbuena",NA,"Albert Pujols","0.22%",0
297,796079953,"angemade",0,71.7,"P Masahiro Tanaka P Rick Porcello 1B Joey Votto OF Aaron Judge OF Michael Conforto OF Jay Bruce C Gary Sánchez SS Amed Rosario 3B José Reyes 2B Neil Walker",NA,"Luke Voit","0.22%",0
297,796150198,"AceSarafin (2/2)",0,71.7,"P Madison Bumgarner P Asher Wojciechowski 3B Manny Machado 2B Jonathan Schoop OF Khris Davis OF Trey Mancini OF Mark Trumbo 1B Chris Davis C Buster Posey SS Brandon Crawford",NA,"Ji-Man Choi","0.22%",0
300,796031147,"DChecks19",0,71.55,"P Kevin Gausman P Trevor Bauer 2B José Altuve SS Marwin González 1B Yuli Gurriel 3B Alex Bregman OF Randal Grichuk OF Max Kepler C Francisco Cervelli OF John Jaso",NA,"Josh Bell","0.22%",12
301,796076081,"coot02",0,71.15,"P Sean Newcomb P Trevor Cahill OF Charlie Blackmon 1B Paul Goldschmidt SS Corey Seager 3B Kris Bryant OF Michael Conforto OF Adam Jones C Gary Sánchez 2B Jason Kipnis",NA,"Adam Frazier","0.22%",0
301,796133009,"devildog1949 (3/3)",0,71.15,"P Kyle Hendricks P Ivan Nova OF Bryce Harper OF Bradley Zimmer OF Michael Conforto 2B Robinson Canó 1B Matt Carpenter 3B Evan Longoria C Mike Zunino SS José Peraza",NA,"Cameron Maybin","0.22%",2
303,796104197,"rkulp12 (1/3)",0,71.1,"P Masahiro Tanaka P Sean Newcomb OF Mike Trout 3B Freddie Freeman OF Giancarlo Stanton C Gary Sánchez 2B Jason Kipnis SS Marcus Semien OF Jackie Bradley Jr. 1B Miguel Cabrera",NA,"Tommy Joseph","0.22%",0
303,796112165,"cherrick07",0,71.1,"P Collin McHugh P Sean Newcomb 2B José Altuve 1B Joey Votto OF Ryan Braun OF Steven Souza Jr. 3B Adrián Béltre SS Orlando Arcia C Austin Hedges OF Ben Gamel",NA,"Joey Rickard","0.22%",2
305,796001300,"everydaydominate",0,71,"P Madison Bumgarner P Trevor Cahill 1B Freddie Freeman 3B Anthony Rendon OF Ryan Braun OF Domingo Santana SS Wilmer Difo OF Brian Goodwin C Matt Wieters 2B Adrián Sanchez",NA,"Jackie Bradley Jr.","0.22%",0
306,795946773,"SUNSET76 (6/15)",0,70.8,"P Kevin Gausman P Masahiro Tanaka 3B Freddie Freeman OF Howie Kendrick OF Domingo Santana SS Wilmer Difo OF Brian Goodwin 1B Eric Thames C Matt Wieters 2B Adrián Sanchez",NA,"Leury García","0.22%",14
306,796102816,"ravenson3",0,70.8,"P Kevin Gausman P Masahiro Tanaka OF Giancarlo Stanton 3B Josh Donaldson 2B Kolten Wong SS Wilmer Difo 1B Yonder Alonso OF Joey Rickard OF Odúbel Herrera C Francisco Cervelli",NA,"Raimel Tapia","0.22%",0
306,796120164,"borrell9922",0,70.8,"P Kevin Gausman P Masahiro Tanaka SS Corey Seager 3B Adrián Béltre OF Khris Davis 2B Robinson Canó OF Dexter Fowler 1B Ryon Healy OF Ben Zobrist C Travis d'Arnaud",NA,"Travis d'Arnaud","0.22%",0
309,796119306,"mattloiselle89",0,70.7,"P Collin McHugh P Rick Porcello OF Bryce Harper OF Michael Conforto 1B Justin Smoak 2B Robinson Canó 3B Rafael Devers OF Dexter Fowler SS Andrelton Simmons C Juan Centeno",NA,"Alcides Escobar","0.22%",6
310,795989231,"UncleDutchy",0,70.55,"P Kyle Hendricks P Trevor Cahill 1B Freddie Freeman OF Giancarlo Stanton 2B José Ramírez 3B Travis Shaw OF Ryan Braun SS Didi Gregorius C Gary Sánchez OF Domingo Santana",NA,"Adam Lind","0.22%",0
310,796101799,"4wdt (1/2)",0,70.55,"P Kevin Gausman P Brandon Woodruff 1B Freddie Freeman SS Corey Seager 3B Justin Turner OF A.J. Pollock OF Ryan Braun OF Dexter Fowler 2B Ben Zobrist C Tyler Flowers",NA,"Ehire Adrianza","0.22%",0
312,796112918,"touchyoself",0,70.5,"P Collin McHugh P Kyle Hendricks OF Charlie Blackmon 1B Paul Goldschmidt 3B Justin Turner OF Gerardo Parra OF Raimel Tapia 2B Yoán Moncada SS Amed Rosario C Juan Centeno",NA,"Guillermo Heredia","0.22%",0
313,796085125,"NORTHFORK888 (2/3)",0,70.45,"P Kevin Gausman P Ivan Nova 1B Paul Goldschmidt OF Andrew Benintendi C Willson Contreras 3B Kris Bryant SS Javier Báez 2B Ben Zobrist OF Joc Pederson OF Jon Jay",NA,"Leonys Martin","0.22%",0
314,795925070,"Alo08",0,70.15,"P Alex Wood P Trevor Cahill OF Mike Trout SS Francisco Lindor OF Andrew McCutchen OF Adam Jones 3B Joey Gallo 2B Dee Gordon 1B Eric Hosmer C Buster Posey",NA,"Nicholas Castellanos","0.22%",24
315,796066586,"gfay63 (15/15)",0,70.1,"P Collin McHugh P Sean Newcomb 3B Manny Machado OF Nelson Cruz 2B Jonathan Schoop OF Adam Jones OF Khris Davis SS Marcus Semien 1B Chris Davis C Mike Zunino",NA,"","",NA
316,796116052,"rnwinall (3/7)",0,69.85,"P Jake Odorizzi P Antonio Senzatela OF Cody Bellinger OF Giancarlo Stanton 3B Anthony Rendon SS Francisco Lindor OF Aaron Judge 2B Jonathan Schoop C Willson Contreras 1B Trey Mancini",NA,"","",NA
317,796124601,"jusaf10 (2/3)",0,69.75,"P Alex Wood P Antonio Senzatela OF Charlie Blackmon 3B Manny Machado 2B José Ramírez SS Jean Segura OF Marcell Ozuna OF Domingo Santana 1B Yonder Alonso C René Rivera",NA,"","",NA
318,796149871,"gowest1989",0,69.55,"P Kevin Gausman P Trevor Bauer 3B Manny Machado SS Tim Beckham OF Adam Jones OF Khris Davis 2B Robinson Canó OF Yoenis Céspedes 1B Chris Davis C René Rivera",NA,"","",NA
319,796132393,"charlesrayallday (1/2)",0,68.9,"P Madison Bumgarner P Rafael Montero OF Mike Trout 1B Freddie Freeman OF Aaron Judge 2B Robinson Canó OF Eric Thames SS Marcus Semien C Tyler Flowers 3B Luis Valbuena",NA,"","",NA
319,796153359,"charlesrayallday (2/2)",0,68.9,"P Madison Bumgarner P Rafael Montero OF Mike Trout 1B Freddie Freeman OF Aaron Judge 2B Robinson Canó OF Eric Thames SS Marcus Semien C Tyler Flowers 3B Luis Valbuena",NA,"","",NA
321,796062563,"bunny2016 (1/2)",0,68.85,"P Madison Bumgarner P Kyle Hendricks OF Adam Jones OF Jay Bruce OF Trey Mancini C Matt Wieters 1B Wilmer Flores SS Trevor Story 3B Evan Longoria 2B Eric Sogard",NA,"","",NA
321,796143609,"paulmdueck (1/2)",0,68.85,"P Sean Newcomb P Brandon Woodruff 2B José Altuve 1B Freddie Freeman 3B Manny Machado OF Aaron Judge SS Tim Beckham OF Ryan Braun C Gary Sánchez OF Corey Dickerson",NA,"","",NA
323,796113061,"4wdt (2/2)",0,68.8,"P Kevin Gausman P Collin McHugh OF Giancarlo Stanton SS Corey Seager 2B Paul DeJong OF Dexter Fowler 1B Matt Carpenter C Yadier Molina OF Yoenis Céspedes 3B Matt Chapman",NA,"","",NA
324,795982534,"garciacm",0,68.7,"P Masahiro Tanaka P Rick Porcello 3B Manny Machado 1B Carlos Santana SS Jean Segura OF Adam Jones 2B Robinson Canó OF José Pirela C Cameron Rupp OF Patrick Kivlehan",NA,"","",NA
325,796139569,"RocketWizard43 (5/5)",0,68.3,"P Ivan Nova P Adam Conley OF Mike Trout OF Charlie Blackmon OF Chris Taylor 3B Freddie Freeman 1B Justin Smoak C Gary Sánchez SS Andrelton Simmons 2B César Hernández",NA,"","",NA
326,796077767,"Zildjianist",0,67.65,"P Collin McHugh P Trevor Cahill 2B José Altuve OF Bryce Harper 3B Freddie Freeman SS Francisco Lindor C Gary Sánchez OF Eric Thames OF Yoenis Céspedes 1B Miguel Cabrera",NA,"","",NA
327,796002729,"theavondon303",0,67.35,"P Collin McHugh P Brandon Woodruff 2B José Altuve OF Josh Reddick OF Marwin González 1B Yuli Gurriel OF Adam Duvall C Brian McCann 3B Eugenio Suárez SS José Peraza",NA,"","",NA
327,796080111,"clevebrown32",0,67.35,"P Masahiro Tanaka P Trevor Bauer 3B José Ramírez OF A.J. Pollock OF Ryan Braun 2B Yangervis Solarte OF Hernán Pérez 1B Eric Thames C J.T. Realmuto SS Xander Bogaerts",NA,"","",NA
329,796023848,"goochmonger (10/15)",0,67.1,"P Alex Wood P Masahiro Tanaka OF Josh Reddick 3B Alex Bregman OF Nelson Cruz OF Aaron Judge C Brian McCann SS Dusty Coleman 2B Neil Walker 1B Matt Olson",NA,"","",NA
