"Rank","EntryId","EntryName","TimeRemaining","Points","Lineup","X","Player","X.Drafted","FPTS"
329,796144213,"barnett0472 (3/3)",0,67.1,"P Alex Wood P Collin McHugh OF Mike Trout 1B Freddie Freeman SS Jean Segura 2B Jason Kipnis C Jonathan Lucroy OF Carlos González 3B José Reyes OF Drew Robinson",NA,"","",NA
331,796079029,"mykemike35",0,66.6,"P Asher Wojciechowski P Mike Leake 2B José Altuve 3B Nolan Arenado OF Bradley Zimmer SS Tim Beckham OF Justin Upton 1B Edwin Encarnacion OF Manuel Margot C Brian McCann",NA,"","",NA
332,796117821,"jojoballz",0,66.35,"P Masahiro Tanaka P Brandon Woodruff OF Mike Trout 3B Nolan Arenado SS Marwin González OF Michael Conforto OF Khris Davis 2B Robinson Canó 1B Eric Hosmer C Wilson Ramos",NA,"","",NA
333,796124921,"Rlongman19 (3/4)",0,66.2,"P Zack Greinke P Kevin Gausman OF Aaron Judge OF Michael Conforto 2B Yangervis Solarte 3B Adrián Béltre OF Yoenis Céspedes C Sandy Leon SS José Reyes 1B Victor Martinez",NA,"","",NA
334,796143147,"JAYSCARDS",0,65.8,"P Kevin Gausman P Collin McHugh SS Elvis Andrus OF Michael Conforto 1B Joey Gallo OF Nomar Mazara OF Jay Bruce C Buster Posey 3B José Reyes 2B Neil Walker",NA,"","",NA
335,795897620,"wlcjr1963",0,65.35,"P Masahiro Tanaka P Trevor Bauer 3B Manny Machado SS Marwin González 2B Robinson Canó OF Shin-soo Choo OF Eric Thames OF Yoenis Céspedes 1B Chris Davis C Buster Posey",NA,"","",NA
335,796075474,"JaradWard",0,65.35,"P Collin McHugh P Trevor Bauer OF Josh Reddick 3B Anthony Rendon SS Corey Seager OF Andrew McCutchen 1B Josh Bell C Welington Castillo OF Corey Dickerson 2B Ozzie Albies",NA,"","",NA
337,796073143,"tfamularo (2/3)",0,64.95,"P Madison Bumgarner P Masahiro Tanaka SS Corey Seager OF A.J. Pollock OF Dexter Fowler 3B Hernán Pérez C Brian McCann 2B Brandon Phillips OF John Jaso 1B Luis Valbuena",NA,"","",NA
338,795919578,"shonemac15",0,64.75,"P Kyle Hendricks P Mike Leake OF Charlie Blackmon 1B Freddie Freeman SS Corey Seager 3B Justin Turner OF Aaron Judge OF Corey Dickerson C Buster Posey 2B Yoán Moncada",NA,"","",NA
339,796072902,"BK68 (9/9)",0,64.7,"P Justin Verlander P Kyle Hendricks OF Mike Trout 3B Manny Machado 2B Jonathan Schoop OF Adam Jones 1B Chris Davis SS Xander Bogaerts C Bruce Maxwell OF Matt Olson",NA,"","",NA
340,795908866,"kfurtah",0,64.6,"P Alex Wood P Sean Newcomb SS Tim Beckham 1B Justin Smoak OF Andrew McCutchen 3B Mike Moustakas OF Ryan Braun OF Starling Marte 2B Ben Zobrist C Yasmani Grandal",NA,"","",NA
340,796122275,"Cantonborn",0,64.6,"P Masahiro Tanaka P Collin McHugh 2B José Ramírez OF Michael Conforto 1B Joey Gallo OF Jay Bruce 3B Adrián Béltre C Welington Castillo OF Carlos Gómez SS José Reyes",NA,"","",NA
342,795976987,"BALTIMORE123 (2/2)",0,64.35,"P Collin McHugh P Brandon Woodruff 1B Paul Goldschmidt SS Corey Seager 3B Justin Turner OF A.J. Pollock OF Ryan Braun 2B DJ LeMahieu OF Dexter Fowler C J.T. Realmuto",NA,"","",NA
342,796032591,"WVD365",0,64.35,"P Masahiro Tanaka P Trevor Bauer 3B Manny Machado C Willson Contreras OF Ryan Braun OF José Pirela OF Carlos Gómez SS Freddy Galvis 2B Josh Harrison 1B Chris Davis",NA,"","",NA
344,796137720,"r.turney",0,64.25,"P Masahiro Tanaka P Troy Scribner OF Mike Trout 3B Freddie Freeman OF Giancarlo Stanton SS Corey Seager C Gary Sánchez 2B Jason Kipnis 1B Eric Thames OF Max Kepler",NA,"","",NA
345,796124988,"keniff",0,64.1,"P Zack Greinke P Rick Porcello OF Michael Conforto 2B Paul DeJong OF Khris Davis SS Javier Báez OF Eddie Rosario 3B Maikel Franco 1B José Abreu C Manny Piña",NA,"","",NA
346,796056335,"absolutely",0,63.85,"P Sean Newcomb P Asher Wojciechowski OF Mike Trout SS Marwin González 3B Justin Turner OF Aaron Judge 2B Jonathan Schoop 1B Edwin Encarnacion OF Yoenis Céspedes C Roberto Pérez",NA,"","",NA
347,796122962,"wall_y7",0,63.7,"P Masahiro Tanaka P Rick Porcello 3B José Ramírez OF Aaron Judge OF Derek Fisher OF Ryan Braun 2B Jason Kipnis 1B Eric Thames C Buster Posey SS José Reyes",NA,"","",NA
348,796148707,"mikeyz414",0,63.65,"P Masahiro Tanaka P Trevor Cahill OF Bryce Harper 1B Joey Votto OF Giancarlo Stanton 2B Dee Gordon SS Javier Báez OF Abraham Almonte C Jonathan Lucroy 3B Wilmer Flores",NA,"","",NA
349,796023839,"goochmonger (1/15)",0,63.45,"P Madison Bumgarner P Alex Wood OF Josh Reddick 2B Robinson Canó OF Eric Thames C Brian McCann OF Corey Dickerson SS Dusty Coleman 3B Jedd Gyorko 1B Matt Olson",NA,"","",NA
350,795972794,"toby3695 (1/2)",0,63.2,"P Alex Wood P Rick Porcello 2B Jonathan Schoop OF Andrew McCutchen OF Adam Jones SS Orlando Arcia 3B Rafael Devers C Brian McCann OF Trey Mancini 1B Eric Hosmer",NA,"","",NA
351,796028525,"fivestarco (5/6)",0,62.8,"P Kevin Gausman P Collin McHugh OF Aaron Judge 3B Miguel Sanó 1B Logan Morrison 2B Robinson Canó OF José Pirela C Yadier Molina OF Yoenis Céspedes SS Xander Bogaerts",NA,"","",NA
352,795908461,"dhulljr",0,62.35,"P Gio González P Jake Odorizzi OF Aaron Judge 1B Justin Smoak 3B Mike Moustakas 2B Robinson Canó SS Andrelton Simmons OF Avisaíl García C Brian McCann OF Yoenis Céspedes",NA,"","",NA
353,796134923,"rnwinall (7/7)",0,62.15,"P Gio González P Zack Greinke C Brian McCann 1B José Abreu OF Yoenis Céspedes OF Adam Lind OF Kyle Schwarber SS Freddy Galvis 3B Ryon Healy 2B Ehire Adrianza",NA,"","",NA
354,796084702,"LIONHEART21",0,62.05,"P Alex Wood P Rafael Montero 2B José Altuve OF Bryce Harper 1B Freddie Freeman 3B Eduardo Núñez OF Jay Bruce OF Domingo Santana SS Freddy Galvis C René Rivera",NA,"","",NA
355,796090430,"billythekid29",0,61.8,"P Justin Verlander P Masahiro Tanaka 1B Freddie Freeman OF Aaron Judge 3B Mike Moustakas OF Ryan Braun OF Yoenis Céspedes SS José Reyes 2B Neil Walker C René Rivera",NA,"","",NA
356,796112412,"zbark2 (2/6)",0,60.35,"P Masahiro Tanaka P Trevor Bauer 3B Freddie Freeman OF Aaron Judge OF Ryan Braun 2B Robinson Canó 1B Eric Thames OF Yoenis Céspedes C Manny Piña SS José Reyes",NA,"","",NA
356,796151924,"zbark2 (5/6)",0,60.35,"P Masahiro Tanaka P Trevor Bauer 3B Freddie Freeman OF Aaron Judge OF Ryan Braun 2B Robinson Canó 1B Eric Thames OF Yoenis Céspedes C Manny Piña SS José Reyes",NA,"","",NA
358,796023843,"goochmonger (5/15)",0,60,"P Alex Wood P Kyle Hendricks OF Aaron Judge 2B Jonathan Schoop 3B Eduardo Núñez OF Carlos Beltrán OF Khris Davis 1B Eric Thames C Manny Piña SS Dusty Coleman",NA,"","",NA
359,796074526,"tfamularo (3/3)",0,59.85,"P Trevor Bauer P Sean Newcomb OF Josh Reddick 1B Freddie Freeman SS Corey Seager OF A.J. Pollock 3B Hernán Pérez OF Eric Thames C Brian McCann 2B Brandon Phillips",NA,"","",NA
360,796021860,"fivestarco (3/6)",0,59.65,"P Collin McHugh P Trevor Cahill 1B Freddie Freeman OF Marwin González SS Francisco Lindor OF Andrew Benintendi C Willson Contreras 3B Josh Donaldson 2B César Hernández OF Yoenis Céspedes",NA,"","",NA
360,796146660,"jesse615",0,59.65,"P Collin McHugh P Trevor Cahill OF Bryce Harper OF Josh Reddick OF George Springer SS Francisco Lindor 3B Miguel Sanó 2B Whit Merrifield 1B Eric Thames C Manny Piña",NA,"","",NA
362,796002614,"BaltoTom",0,58.85,"P Alex Wood P Asher Wojciechowski 2B José Altuve OF Chris Taylor 3B Manny Machado OF Domingo Santana OF Ender Inciarte 1B Matt Carpenter SS Eric Sogard C Manny Piña",NA,"","",NA
363,795953087,"SUNSET76 (14/15)",0,58.8,"P Kevin Gausman P Masahiro Tanaka OF George Springer 3B Alex Bregman OF Derek Fisher OF Carlos Beltrán 1B Eric Thames C Brian McCann SS Dansby Swanson 2B Brad Miller",NA,"","",NA
364,796134745,"coach2143",0,58.65,"P Justin Verlander P Travis Wood OF Josh Reddick 1B Freddie Freeman OF Brett Gardner 3B Kris Bryant OF Ryan Braun SS Javier Báez 2B Jason Kipnis C Manny Piña",NA,"","",NA
365,796103964,"fetus445",0,58.1,"P Alex Wood P Masahiro Tanaka 1B Freddie Freeman OF Giancarlo Stanton OF Dexter Fowler 2B César Hernández C Brian McCann 3B Evan Longoria SS Xander Bogaerts OF Jon Jay",NA,"","",NA
366,796131065,"devildog1949 (2/3)",0,57.85,"P Ivan Nova P Jake Odorizzi OF Bryce Harper SS Francisco Lindor 2B Jonathan Schoop OF Michael Conforto 1B Justin Smoak OF Adam Jones 3B Josh Donaldson C Brian McCann",NA,"","",NA
367,796152298,"Dan228x",0,57.8,"P Kevin Gausman P Masahiro Tanaka 1B Freddie Freeman 3B Manny Machado 2B Jonathan Schoop OF Shin-soo Choo OF Yoenis Céspedes C J.T. Realmuto OF Gregory Polanco SS Adrián Sanchez",NA,"","",NA
368,796089282,"Prparent",0,57.35,"P Collin McHugh P Brandon Woodruff 2B José Altuve 3B Freddie Freeman OF Giancarlo Stanton OF George Springer C Gary Sánchez 1B Eric Thames OF Yoenis Céspedes SS José Peraza",NA,"","",NA
369,796036165,"AcesWayUp (1/2)",0,57.15,"P Alex Wood P Trevor Cahill OF Mike Trout 2B José Altuve 3B Freddie Freeman SS Corey Seager C Gary Sánchez OF José Pirela OF Jim Adduci 1B Victor Martinez",NA,"","",NA
369,796039537,"AcesWayUp (2/2)",0,57.15,"P Alex Wood P Trevor Cahill OF Mike Trout 2B José Altuve 3B Freddie Freeman SS Corey Seager C Gary Sánchez OF José Pirela OF Jim Adduci 1B Victor Martinez",NA,"","",NA
371,795896773,"RonnieJames2",0,57,"P Ivan Nova P Brandon Woodruff OF Bryce Harper 3B Freddie Freeman SS Francisco Lindor 2B Jonathan Schoop 1B Justin Smoak OF Andrew McCutchen OF Marcell Ozuna C J.T. Realmuto",NA,"","",NA
372,796040204,"jbills79",0,56.95,"P Jharel Cotton P Trevor Cahill OF Mike Trout 2B José Altuve OF Bryce Harper 1B Freddie Freeman 3B Josh Donaldson OF Khris Davis SS Andrelton Simmons C Brian McCann",NA,"","",NA
373,796097782,"JHOOPER436",0,56.85,"P Collin McHugh P Mike Leake OF Mike Trout OF Giancarlo Stanton SS Tim Beckham 1B Justin Smoak 3B Eduardo Núñez 2B Yangervis Solarte OF José Bautista C Manny Piña",NA,"","",NA
374,796153368,"deadphish",0,56.35,"P Collin McHugh P Brandon Woodruff OF Mike Trout OF Charlie Blackmon OF Josh Reddick 1B Freddie Freeman C Willson Contreras 2B Robinson Canó SS Xander Bogaerts 3B Luis Valbuena",NA,"","",NA
375,796138945,"RocketWizard43 (4/5)",0,56.15,"P Sean Newcomb P Adam Conley OF Mike Trout OF Charlie Blackmon OF Chris Taylor 1B Freddie Freeman 2B Jonathan Schoop 3B Rafael Devers SS Andrelton Simmons C Russell Martin",NA,"","",NA
376,796148279,"BaconPoopingUnicorns",0,55.75,"P Zack Greinke P Brandon Woodruff OF Giancarlo Stanton OF Aaron Judge 1B Justin Smoak 3B Eduardo Núñez OF Marcell Ozuna 2B Dee Gordon SS Marcus Semien C Roberto Pérez",NA,"","",NA
377,796061805,"Brice12345",0,55.6,"P Masahiro Tanaka P Collin McHugh 3B Alex Bregman OF Aaron Judge 2B Jonathan Schoop OF Ryan Braun SS Didi Gregorius 1B Eric Thames C Brian McCann OF Matt Olson",NA,"","",NA
378,796058544,"Hinobrown (3/3)",0,55.35,"P Collin McHugh P Trevor Bauer SS Marwin González 3B Alex Bregman OF Adam Jones 2B Carlos Asuaje OF Cory Spangenberg 1B Trey Mancini C Welington Castillo OF Mark Trumbo",NA,"","",NA
379,796111716,"buchris532 (15/15)",0,55.25,"P Collin McHugh P Ivan Nova OF Charlie Blackmon 3B José Ramírez SS Tim Beckham OF Adam Jones OF Abraham Almonte 2B Jason Kipnis C Jonathan Lucroy 1B Chris Davis",NA,"","",NA
380,795997957,"huskers17",0,55.1,"P Alex Wood P Collin McHugh 3B Eduardo Núñez OF Adam Jones 1B Logan Morrison 2B Yangervis Solarte SS Andrelton Simmons OF José Pirela C Welington Castillo OF Corey Dickerson",NA,"","",NA
380,796097308,"Rich4585",0,55.1,"P Collin McHugh P Sean Newcomb OF Marwin González OF Aaron Judge 3B Miguel Sanó 2B Ian Happ OF Lorenzo Cain 1B Mitch Moreland SS Javier Báez C Brian McCann",NA,"","",NA
382,795815067,"jaduff28 (2/3)",0,54.8,"P Justin Verlander P Collin McHugh 2B José Altuve OF George Springer 3B Eduardo Núñez SS Andrelton Simmons OF José Pirela 1B Ryon Healy OF Jaycob Brugman C Juan Graterol",NA,"","",NA
383,795830730,"griffin777 (5/15)",0,54.7,"P Trevor Cahill P Adam Conley OF Charlie Blackmon OF Bryce Harper 3B Nolan Arenado SS Corey Seager 1B Mark Reynolds C Willson Contreras OF Gerardo Parra 2B DJ LeMahieu",NA,"","",NA
384,796152953,"MomboJackson",0,54.2,"P Collin McHugh P Jake Odorizzi OF Charlie Blackmon OF Bradley Zimmer OF Michael Conforto 1B Edwin Encarnacion 3B Adrián Béltre 2B DJ LeMahieu C Jonathan Lucroy SS Trevor Story",NA,"","",NA
385,795946941,"Wick2448",0,54.1,"P Collin McHugh P Sean Newcomb 1B Cody Bellinger OF Giancarlo Stanton 3B Manny Machado C Willson Contreras OF Brandon Moss 2B Dustin Pedroia OF Ben Gamel SS Amed Rosario",NA,"","",NA
386,796103464,"buchris532 (7/15)",0,54,"P Alex Wood P Kyle Hendricks 3B José Ramírez SS Francisco Lindor OF Michael Conforto OF Adam Jones 2B Jason Kipnis OF Yoenis Céspedes 1B Chris Davis C René Rivera",NA,"","",NA
387,795914437,"TerribleToms",0,53.6,"P Masahiro Tanaka P Collin McHugh OF Mike Trout 2B José Altuve OF George Springer 1B Joey Gallo OF Yoenis Céspedes 3B Jedd Gyorko SS José Reyes C Cam Gallagher",NA,"","",NA
388,796090256,"Bal83",0,53.15,"P Alex Wood P Trevor Cahill OF Mike Trout 2B José Altuve 1B Paul Goldschmidt 3B Kris Bryant OF Yoenis Céspedes OF Corey Dickerson C J.T. Realmuto SS Brandon Crawford",NA,"","",NA
389,796100204,"supertroopa22",0,52.5,"P Collin McHugh P Kyle Hendricks 2B José Altuve 3B Freddie Freeman OF Ryan Braun C Gary Sánchez OF Eric Thames OF Yoenis Céspedes 1B Chris Davis SS José Reyes",NA,"","",NA
390,796148576,"KDOOLZ8",0,51.95,"P Madison Bumgarner P Collin McHugh OF Michael Conforto OF Domingo Santana 2B César Hernández 3B Maikel Franco 1B Eric Thames OF Yoenis Céspedes C Manny Piña SS Adrián Sanchez",NA,"","",NA
391,795702119,"jaduff28 (1/3)",0,51.5,"P Collin McHugh P Kyle Hendricks 2B José Altuve OF Josh Reddick OF George Springer 1B Yuli Gurriel 3B Alex Bregman SS Jorge Polanco C Cam Gallagher OF Matt Olson",NA,"","",NA
392,796124850,"Rlongman19 (2/4)",0,51.35,"P Masahiro Tanaka P Brandon Woodruff 2B José Altuve 1B Joey Votto 3B Manny Machado OF Adam Jones OF Eric Thames OF Trey Mancini C Welington Castillo SS Marcus Semien",NA,"","",NA
393,796066579,"gfay63 (8/15)",0,51.1,"P Collin McHugh P Sean Newcomb OF Mike Trout 3B Manny Machado 2B Jonathan Schoop OF Khris Davis OF Trey Mancini SS Marcus Semien 1B Chris Davis C Buster Posey",NA,"","",NA
394,796066573,"gfay63 (2/15)",0,50.7,"P Collin McHugh P Rick Porcello OF Mike Trout 3B Manny Machado OF Adam Jones 2B Robinson Canó OF Trey Mancini SS Marcus Semien 1B Chris Davis C Buster Posey",NA,"","",NA
395,795896928,"BK68 (5/9)",0,50.3,"P Rick Porcello P Jake Odorizzi 2B José Altuve 3B Anthony Rendon SS Marwin González OF Aaron Judge OF Ryan Braun OF Domingo Santana 1B Eric Thames C Manny Piña",NA,"","",NA
396,796021480,"jamwatt1549 (1/3)",0,50,"P Alex Wood P Kyle Hendricks 2B Ian Happ OF Jay Bruce C Gary Sánchez OF Keon Broxton OF Domingo Santana SS Javier Báez 1B Lucas Duda 3B Maikel Franco",NA,"","",NA
397,796089390,"fallon24",0,49.6,"P Masahiro Tanaka P Collin McHugh 3B Anthony Rendon OF Derek Fisher OF Adam Duvall 2B DJ LeMahieu OF José Pirela C Cameron Rupp SS Marcus Semien 1B Buster Posey",NA,"","",NA
398,795838978,"griffin777 (9/15)",0,49.55,"P Masahiro Tanaka P Rafael Montero 1B Paul Goldschmidt OF Giancarlo Stanton SS Corey Seager OF Marcell Ozuna C Gary Sánchez 2B Dee Gordon OF Christian Yelich 3B Derek Dietrich",NA,"","",NA
398,796058292,"NORTHFORK888 (1/3)",0,49.55,"P Masahiro Tanaka P Rafael Montero OF Mike Trout OF Giancarlo Stanton SS Corey Seager 3B José Ramírez C Gary Sánchez 2B Jason Kipnis 1B Eric Thames OF Max Kepler",NA,"","",NA
398,796070706,"aggie42",0,49.55,"P Masahiro Tanaka P Rafael Montero OF Mike Trout OF Giancarlo Stanton SS Corey Seager 3B José Ramírez C Gary Sánchez 2B Jason Kipnis 1B Eric Thames OF Max Kepler",NA,"","",NA
401,796126351,"rocadre30",0,49.25,"P Zack Greinke P Mike Leake 3B Manny Machado SS Francisco Lindor 2B Jonathan Schoop OF Adam Jones OF Trey Mancini OF Yoenis Céspedes 1B Chris Davis C Bruce Maxwell",NA,"","",NA
402,796146635,"flamethrowers",0,48.6,"P Masahiro Tanaka P Collin McHugh OF Andrew Benintendi 3B Miguel Sanó 2B Jonathan Schoop OF Ryan Braun 1B Eric Thames C Brian McCann OF Yoenis Céspedes SS José Reyes",NA,"","",NA
403,795934964,"allsportsman3422",0,48.35,"P Masahiro Tanaka P Brandon Woodruff OF Mike Trout 3B José Ramírez SS Francisco Lindor OF Bradley Zimmer 1B Edwin Encarnacion 2B Jason Kipnis OF Mark Trumbo C Manny Piña",NA,"","",NA
404,796035895,"buchris532 (2/15)",0,48.2,"P Collin McHugh P Jake Odorizzi OF Josh Reddick OF Derek Fisher C Willson Contreras 3B Kris Bryant SS Paul DeJong OF Billy Hamilton 1B Matt Carpenter 2B Arismendy Alcántara",NA,"","",NA
405,796066576,"gfay63 (5/15)",0,48.1,"P Collin McHugh P Sean Newcomb OF Mike Trout 3B Manny Machado 2B Jonathan Schoop OF Adam Jones OF Khris Davis 1B Trey Mancini SS Marcus Semien C Mike Zunino",NA,"","",NA
405,796066582,"gfay63 (11/15)",0,48.1,"P Collin McHugh P Sean Newcomb OF Mike Trout 3B Manny Machado 2B Jonathan Schoop OF Khris Davis OF Trey Mancini SS Marcus Semien 1B Chris Davis C Mike Zunino",NA,"","",NA
407,795946759,"SUNSET76 (4/15)",0,47.3,"P Kevin Gausman P Sean Newcomb 2B José Altuve OF Josh Reddick OF George Springer SS Marwin González 1B Yuli Gurriel 3B Jedd Gyorko OF Gregory Polanco C Cam Gallagher",NA,"","",NA
408,796088230,"wallyswahoos",0,46.95,"P Madison Bumgarner P Collin McHugh 2B José Altuve OF Michael Conforto 1B Logan Morrison OF Keon Broxton SS Xander Bogaerts C René Rivera OF Brock Holt 3B Luis Valbuena",NA,"","",NA
409,796022202,"Drpimper32",0,46.85,"P Collin McHugh P Mike Leake 2B José Altuve OF Josh Reddick SS Marwin González 3B Alex Bregman OF Derek Fisher 1B Eric Hosmer C Buster Posey OF Jorge Bonifacio",NA,"","",NA
410,795946324,"perihadion",0,45.8,"P Kevin Gausman P Masahiro Tanaka 2B José Altuve OF George Springer SS Marwin González OF Hernán Pérez 1B Matt Carpenter 3B Jedd Gyorko OF Patrick Kivlehan C Cam Gallagher",NA,"","",NA
410,795953078,"SUNSET76 (13/15)",0,45.8,"P Kevin Gausman P Masahiro Tanaka 1B Freddie Freeman OF Aaron Judge OF Ryan Braun SS Orlando Arcia 3B Hernán Pérez 2B Eric Sogard C Manny Piña OF Gregory Polanco",NA,"","",NA
412,796141616,"DirtWolves",0,45.35,"P Masahiro Tanaka P Brandon Woodruff OF Mike Trout OF Giancarlo Stanton SS Corey Seager 3B Eduardo Núñez 2B Robinson Canó C Cameron Rupp 1B Eric Thames OF Yoenis Céspedes",NA,"","",NA
413,795979617,"RSFHouston420 (3/5)",0,45.25,"P Masahiro Tanaka P Ivan Nova 3B Manny Machado SS Tim Beckham OF Ryan Braun OF Adam Jones 2B Yangervis Solarte OF Domingo Santana 1B Trey Mancini C Welington Castillo",NA,"","",NA
414,796118530,"rnwinall (4/7)",0,44.85,"P Jake Odorizzi P Antonio Senzatela SS Elvis Andrus OF Giancarlo Stanton OF Aaron Judge C Willson Contreras 3B Kris Bryant 1B Justin Smoak OF Andrew McCutchen 2B Ian Happ",NA,"","",NA
415,795997572,"jkosh74 (1/2)",0,44.6,"P Masahiro Tanaka P Collin McHugh 2B José Altuve OF J.D. Martinez OF Steven Souza Jr. 1B Logan Morrison OF Domingo Santana 3B Wilmer Flores SS Brandon Crawford C Bruce Maxwell",NA,"","",NA
415,796142823,"johnnyo_21",0,44.6,"P Trevor Cahill P Rafael Montero SS Francisco Lindor OF Ryan Braun OF Yoenis Céspedes C Manny Piña 1B Victor Martinez OF Gregory Polanco 2B Adrián Sanchez 3B Drew Robinson",NA,"","",NA
417,796066574,"gfay63 (3/15)",0,44.1,"P Collin McHugh P Sean Newcomb OF Mike Trout 3B Manny Machado OF Adam Jones 2B Robinson Canó OF Trey Mancini SS Marcus Semien 1B Chris Davis C Buster Posey",NA,"","",NA
417,796105922,"GUALANDRATHAl (1/2)",0,44.1,"P Alex Wood P Collin McHugh 2B Jonathan Schoop C Willson Contreras 3B Kris Bryant 1B Justin Smoak SS Javier Báez OF Kyle Schwarber OF Joc Pederson OF Jaycob Brugman",NA,"","",NA
417,796111559,"GUALANDRATHAl (2/2)",0,44.1,"P Alex Wood P Collin McHugh 2B Jonathan Schoop C Willson Contreras 3B Kris Bryant 1B Justin Smoak SS Javier Báez OF Kyle Schwarber OF Joc Pederson OF Jaycob Brugman",NA,"","",NA
420,795849023,"griffin777 (13/15)",0,43.85,"P Adam Conley P César Valdez OF Mike Trout 2B José Altuve OF Bryce Harper 3B Nolan Arenado OF Josh Reddick SS Marwin González 1B Yuli Gurriel C Brian McCann",NA,"","",NA
421,795830220,"griffin777 (4/15)",0,43.65,"P Masahiro Tanaka P Trevor Cahill OF Bryce Harper 3B José Ramírez SS Francisco Lindor OF Michael Brantley 1B Edwin Encarnacion 2B Jason Kipnis OF Eric Thames C Matt Wieters",NA,"","",NA
422,795953098,"SUNSET76 (15/15)",0,43.55,"P Kevin Gausman P Asher Wojciechowski 2B José Altuve OF Josh Reddick SS Marwin González 1B Yuli Gurriel OF Carlos Beltrán 3B Chase Headley C Manny Piña OF John Jaso",NA,"","",NA
423,796079517,"cshap327",0,42.45,"P Kevin Gausman P Ivan Nova 2B Daniel Murphy OF Andrew McCutchen OF Starling Marte OF Jay Bruce 3B Hernán Pérez 1B Matt Carpenter SS Freddy Galvis C Buster Posey",NA,"","",NA
424,796008842,"Rummie",0,42.15,"P Collin McHugh 2B José Altuve OF Bryce Harper OF Giancarlo Stanton C Willson Contreras OF Michael Conforto 1B Justin Smoak SS Freddy Galvis 3B Evan Longoria P Nick Tepesch",NA,"","",NA
425,796110810,"gabefranchise",0,41.85,"P Alex Wood P Brandon Woodruff 3B Freddie Freeman OF George Springer SS Marwin González OF Ryan Braun 2B Jason Kipnis 1B Eric Thames C Brian McCann OF Yoenis Céspedes",NA,"","",NA
426,796064529,"dven1970",0,41.6,"P Masahiro Tanaka P Collin McHugh OF Aaron Judge 2B Jonathan Schoop 1B Edwin Encarnacion OF Eric Thames C Brian McCann 3B Eugenio Suárez OF Yoenis Céspedes SS José Reyes",NA,"","",NA
427,795827752,"griffin777 (3/15)",0,40.7,"P Kyle Hendricks P César Valdez OF Bryce Harper OF Giancarlo Stanton 1B Anthony Rizzo C Willson Contreras 3B Kris Bryant OF Ryan Braun 2B Ian Happ SS Javier Báez",NA,"","",NA
428,796040529,"RD1991",0,39.35,"P Collin McHugh P Brandon Woodruff 2B José Altuve 1B Paul Goldschmidt OF Josh Reddick SS Marwin González OF Mookie Betts C Brian McCann 3B Miguel Andújar OF Magneuris Sierra",NA,"","",NA
429,796063538,"geoleo",0,39.3,"P Ivan Nova P Trevor Cahill OF Mike Trout 2B Jonathan Schoop OF Adam Duvall C Willson Contreras SS Tim Beckham OF Andrew McCutchen 1B Logan Morrison 3B Adrián Béltre",NA,"","",NA
430,795953022,"SUNSET76 (12/15)",0,37.8,"P Kevin Gausman P Masahiro Tanaka 3B Freddie Freeman OF Aaron Judge SS Orlando Arcia OF Keon Broxton OF Domingo Santana 1B Eric Thames 2B Eric Sogard C Cam Gallagher",NA,"","",NA
431,795894171,"CCSV2013",0,37.15,"P Mike Leake P Jharel Cotton 3B Anthony Rendon OF Marwin González OF Aaron Judge OF Khris Davis 1B Ryon Healy SS José Reyes 2B Neil Walker C Bruce Maxwell",NA,"","",NA
432,796092192,"NORTHFORK888 (3/3)",0,34.85,"P Jharel Cotton P Rafael Montero 2B José Altuve OF Chris Taylor OF Giancarlo Stanton SS Marwin González 1B Yuli Gurriel 3B Alex Bregman OF Gerardo Parra C Brian McCann",NA,"","",NA
433,796146729,"mrbdoremi (2/3)",0,34.65,"P Masahiro Tanaka P Trevor Cahill 3B José Ramírez SS Francisco Lindor OF Aaron Judge OF Michael Conforto 1B Edwin Encarnacion 2B Jason Kipnis OF Yoenis Céspedes C Roberto Pérez",NA,"","",NA
434,796112411,"zbark2 (1/6)",0,34.6,"P Masahiro Tanaka P Collin McHugh 2B José Altuve 3B Freddie Freeman OF Aaron Judge OF Eric Thames OF Yoenis Céspedes C Manny Piña 1B Miguel Cabrera SS José Reyes",NA,"","",NA
434,796151935,"zbark2 (6/6)",0,34.6,"P Masahiro Tanaka P Collin McHugh 2B José Altuve 3B Freddie Freeman OF Aaron Judge OF Eric Thames OF Yoenis Céspedes C Manny Piña 1B Miguel Cabrera SS José Reyes",NA,"","",NA
436,796066578,"gfay63 (7/15)",0,34.1,"P Collin McHugh P Sean Newcomb OF Mike Trout 3B Manny Machado 2B Jonathan Schoop OF Adam Jones OF Trey Mancini SS Marcus Semien 1B Chris Davis C Mike Zunino",NA,"","",NA
437,795845149,"griffin777 (11/15)",0,33.35,"P Masahiro Tanaka P Brandon Woodruff 1B Joey Votto 2B Daniel Murphy SS Zack Cozart 3B Travis Shaw OF Ryan Braun OF Keon Broxton OF Eric Thames C Manny Piña",NA,"","",NA
438,796116274,"dnotez",0,32.6,"P Masahiro Tanaka P Collin McHugh OF Aaron Judge 3B Miguel Sanó 2B Jonathan Schoop OF Ryan Braun 1B Eric Thames C Brian McCann OF Yoenis Céspedes SS José Reyes",NA,"","",NA
439,795972886,"toby3695 (2/2)",0,31.1,"P Alex Wood P Collin McHugh 1B Freddie Freeman OF Tommy Pham OF Christian Yelich 3B Rafael Devers SS Andrelton Simmons OF José Pirela C Russell Martin 2B Nolan Fontana",NA,"","",NA
440,796152838,"yisman15",0,26.6,"P Masahiro Tanaka P Collin McHugh 3B Freddie Freeman 2B Jonathan Schoop 1B Edwin Encarnacion OF Ryan Braun OF Eric Thames OF Yoenis Céspedes C Manny Piña SS José Reyes",NA,"","",NA
441,795952992,"SUNSET76 (11/15)",0,25.8,"P Kevin Gausman P Masahiro Tanaka 2B José Altuve OF Ryan Braun OF Domingo Santana 3B Hernán Pérez 1B Eric Thames OF Corey Dickerson C Manny Piña SS Dusty Coleman",NA,"","",NA
442,796138958,"avo4077",0,24.6,"P Masahiro Tanaka P Collin McHugh OF Josh Reddick 3B Freddie Freeman 2B Robinson Canó OF Eric Thames C Brian McCann OF Yoenis Céspedes 1B Chris Davis SS Xander Bogaerts",NA,"","",NA
443,795827435,"griffin777 (2/15)",0,22.25,"P Masahiro Tanaka P Ivan Nova OF Mike Trout 3B Manny Machado 2B Jonathan Schoop OF Adam Jones SS Andrelton Simmons OF Seth Smith 1B Chris Davis C Martín Maldonado",NA,"","",NA
444,795927616,"hffvjjbgfcvjgfgjjbh",0,20.6,"P Masahiro Tanaka P Collin McHugh OF Josh Reddick OF Marwin González 1B Yuli Gurriel C Brian McCann OF Yoenis Céspedes 2B Josh Harrison 3B Jedd Gyorko SS José Reyes",NA,"","",NA
445,795933381,"javimente15",0,0,"",NA,"","",NA
445,796004051,"harwilso",0,0,"",NA,"","",NA
445,796085649,"Marktheshark42",0,0,"",NA,"","",NA
445,796127366,"kevinthieleman",0,0,"",NA,"","",NA
