"Rank","EntryId","EntryName","TimeRemaining","Points","Lineup","X","Player","X.Drafted","FPTS"
110,796036271,"Ghostmagic",0,103.15,"P Jerad Eickhoff P Asher Wojciechowski OF Mike Trout 2B José Altuve OF Josh Reddick 1B Justin Smoak SS Didi Gregorius 3B Adrián Béltre C Buster Posey OF Nicky Delmonico",NA,"César Hernández","2.90%",7
111,796023846,"goochmonger (8/15)",0,103,"P Alex Wood P Kyle Hendricks 1B Joey Votto OF Josh Reddick OF Aaron Judge SS Didi Gregorius OF Khris Davis C John Hicks 2B Neil Walker 3B Matt Chapman",NA,"Dusty Coleman","2.90%",0
111,796023847,"goochmonger (9/15)",0,103,"P Alex Wood P Kyle Hendricks 1B Joey Votto OF Josh Reddick OF Aaron Judge SS Didi Gregorius OF Khris Davis C John Hicks 2B Neil Walker 3B Matt Chapman",NA,"Ryon Healy","2.68%",0
113,796087212,"ToTheMax5",0,102.9,"P Alex Wood 3B José Ramírez SS Francisco Lindor OF Aaron Judge 1B Edwin Encarnacion OF Adam Jones OF Billy Hamilton 2B Robinson Canó C Jonathan Lucroy P Martín Pérez",NA,"Andrew Benintendi","2.68%",20
114,796115269,"jajusjena (2/3)",0,102.7,"P Madison Bumgarner P Asher Wojciechowski 3B Eduardo Núñez OF Andrew McCutchen 1B Joey Gallo 2B Dee Gordon SS Andrelton Simmons C Yadier Molina OF Yoenis Céspedes OF Gregory Polanco",NA,"Paul DeJong","2.68%",0
114,796125131,"RocketWizard43 (1/5)",0,102.7,"P Jharel Cotton OF Mike Trout OF Charlie Blackmon 3B Manny Machado SS Francisco Lindor 1B Carlos Santana 2B Jonathan Schoop OF Khris Davis C Russell Martin P Martín Pérez",NA,"J.D. Martinez","2.68%",10
116,795892612,"BK68 (4/9)",0,102.65,"P Zack Greinke P Ivan Nova OF Aaron Judge OF Brett Gardner 3B Mike Moustakas SS Didi Gregorius C Gary Sánchez OF Domingo Santana 1B José Abreu 2B Adrián Sanchez",NA,"Mike Moustakas","2.68%",8
117,796028777,"jamwatt1549 (3/3)",0,102.15,"P Trevor Bauer P Jerad Eickhoff OF Bryce Harper SS Francisco Lindor 3B Kris Bryant 1B Wil Myers OF Keon Broxton 2B Chase Utley OF Eric Thames C Matt Wieters",NA,"Josh Donaldson","2.68%",11
117,796135301,"jhc1532",0,102.15,"P Sean Newcomb P Trevor Cahill 2B José Altuve OF Bryce Harper 3B Freddie Freeman OF Brett Gardner OF Eduardo Núñez 1B Joey Gallo SS Didi Gregorius C Matt Wieters",NA,"Austin Jackson","2.68%",3
119,795896941,"BK68 (7/9)",0,101.75,"P Alex Wood P Ivan Nova OF Bryce Harper 3B Anthony Rendon 1B Ryan Zimmerman OF Mookie Betts C Matt Wieters OF Corey Dickerson 2B Brandon Phillips SS Dusty Coleman",NA,"George Springer","2.46%",3
120,796139277,"idog1483",0,101.6,"P Alex Wood P Sean Newcomb 1B Cody Bellinger 2B José Ramírez 3B Eduardo Núñez OF Keon Broxton SS Andrelton Simmons C Jonathan Lucroy OF Carlos González OF José Bautista",NA,"Lorenzo Cain","2.46%",20
121,795965719,"mannyz1",0,101.3,"P Justin Verlander P Sean Newcomb 1B Paul Goldschmidt 3B Freddie Freeman SS Corey Seager OF A.J. Pollock 2B Javier Báez C Yadier Molina OF Patrick Kivlehan OF John Jaso",NA,"Marcell Ozuna","2.46%",3
121,796134623,"chadman13",0,101.3,"P Rick Porcello P Miguel González OF Mike Trout OF Bryce Harper OF Giancarlo Stanton 3B Manny Machado 1B Anthony Rizzo SS Didi Gregorius 2B Dustin Pedroia C Buster Posey",NA,"Elvis Andrus","2.46%",12
123,796081276,"JsickaDarlin",0,100.5,"P Gio González P Trevor Bauer 1B Paul Goldschmidt OF Giancarlo Stanton C Cameron Rupp 2B Ben Zobrist SS Marcus Semien OF Max Kepler OF Denard Span 3B José Reyes",NA,"Miguel Sanó","2.46%",9
124,796017974,"Maintizzle22",0,100.35,"P Collin McHugh P Trevor Bauer 1B Yuli Gurriel OF Billy Hamilton 2B Yangervis Solarte SS Orlando Arcia 3B Kyle Seager OF Keon Broxton OF Domingo Santana C Yadier Molina",NA,"Brandon Phillips","2.46%",3
125,796049283,"KingTerror",0,100.25,"P Gio González P Alex Wood OF Derek Fisher OF Ryan Braun OF Yoenis Céspedes C Manny Piña 1B Miguel Cabrera 2B Ozzie Albies SS Adrián Sanchez 3B Ryder Jones",NA,"Adrián Sanchez","2.46%",14
126,795997573,"jkosh74 (2/2)",0,100.15,"P Madison Bumgarner P Justin Verlander OF Keon Broxton OF Domingo Santana 1B Yonder Alonso OF Eric Thames C Welington Castillo SS Brandon Crawford 2B Brad Miller 3B Matt Chapman",NA,"Brandon Crawford","2.46%",5
127,796066186,"football7573",0,99.9,"P Justin Verlander P Rick Porcello OF Giancarlo Stanton OF Eduardo Núñez OF Billy Hamilton 3B Adrián Béltre 1B José Abreu SS Marcus Semien C Buster Posey 2B Yoán Moncada",NA,"Freddy Galvis","2.46%",12
128,796104860,"chrisech612 (1/2)",0,99.35,"P Rick Porcello P Antonio Senzatela 3B Nolan Arenado SS Francisco Lindor OF Bradley Zimmer 1B Justin Smoak OF Mookie Betts OF Marcell Ozuna 2B Dee Gordon C Yadier Molina",NA,"Brian Dozier","2.46%",31
129,795965475,"mikechaz (2/2)",0,98.9,"P Madison Bumgarner P Rafael Montero 2B José Altuve C Gary Sánchez OF Khris Davis OF Matt Joyce OF Eric Thames SS Marcus Semien 3B Matt Chapman 1B Matt Olson",NA,"Logan Morrison","2.46%",0
130,796036704,"usmcbean",0,98.85,"P Madison Bumgarner P Kyle Hendricks C Gary Sánchez 2B Robinson Canó OF José Pirela OF Avisaíl García SS Freddy Galvis 1B Chris Davis OF Max Kepler 3B Jedd Gyorko",NA,"Drew Robinson","2.46%",6
131,795914255,"nickgreen84",0,98.8,"P Justin Verlander P Collin McHugh OF Nelson Cruz OF J.D. Martinez 3B Adrián Béltre 1B Matt Carpenter OF Yoenis Céspedes 2B Asdrúbal Cabrera C Buster Posey SS Brandon Crawford",NA,"Roberto Pérez","2.46%",3
131,795963822,"jerryfrench",0,98.8,"P Justin Verlander P Masahiro Tanaka OF Mike Trout 1B Yuli Gurriel 2B Jonathan Schoop C Yadier Molina OF Ben Gamel OF Nicky Delmonico 3B Jedd Gyorko SS Miguel Rojas",NA,"DJ LeMahieu","2.23%",3
133,796135877,"rhambor",0,98.5,"P Zack Greinke P Alex Wood 1B Freddie Freeman OF Khris Davis 2B Whit Merrifield SS Andrelton Simmons OF José Pirela OF Nicky Delmonico 3B Jedd Gyorko C Francisco Cervelli",NA,"Brett Gardner","2.23%",7
134,796102411,"fstmonty",0,98.35,"P Collin McHugh P Trevor Bauer 1B Carlos Santana OF Michael Conforto OF Eduardo Núñez 3B Josh Donaldson 2B César Hernández C Yadier Molina OF Yoenis Céspedes SS Freddy Galvis",NA,"Keon Broxton","2.23%",0
135,796132938,"pigpen95",0,97.95,"P Rick Porcello P Mike Leake 2B José Altuve 1B Cody Bellinger OF Aaron Judge 3B Kris Bryant C Gary Sánchez OF Khris Davis OF Eric Thames SS Trevor Story",NA,"Chris Taylor","2.23%",2
136,796146239,"mrbdoremi (1/3)",0,97.7,"P Madison Bumgarner P Trevor Bauer OF Aaron Judge OF Michael Conforto C Gary Sánchez 1B Wilmer Flores OF Yoenis Céspedes SS Dusty Coleman 3B José Reyes 2B Neil Walker",NA,"Max Kepler","2.23%",6
137,796039311,"buchris532 (6/15)",0,97.5,"P Gio González P Trevor Bauer SS Francisco Lindor OF Bradley Zimmer OF Adam Jones OF Steven Souza Jr. 1B Trey Mancini 3B Evan Longoria 2B Brad Miller C Roberto Pérez",NA,"Cameron Rupp","2.23%",0
138,796124818,"Bamskee",0,97.25,"P Jerad Eickhoff P Travis Wood OF Chris Taylor OF Cody Bellinger 3B Freddie Freeman OF Mookie Betts 2B Whit Merrifield 1B Eric Thames C Matt Wieters SS Ketel Marte",NA,"Todd Frazier","2.01%",34
139,796111192,"rnwinall (2/7)",0,96.85,"P Jake Odorizzi P Antonio Senzatela OF Giancarlo Stanton 3B Anthony Rendon SS Francisco Lindor OF Aaron Judge 2B Jonathan Schoop C Willson Contreras 1B Ryan Zimmerman OF Carlos Beltrán",NA,"Troy Scribner","2.01%",19.45
140,795946816,"SUNSET76 (9/15)",0,96.8,"P Kevin Gausman P Masahiro Tanaka SS Corey Seager OF Brett Gardner OF Eric Thames 3B Todd Frazier OF Jacoby Ellsbury C Manny Piña 1B Garrett Cooper 2B Ronald Torreyes",NA,"Adam Conley","2.01%",0.85
141,796092644,"jbeezy3333 (1/4)",0,96.5,"P Zack Greinke P Alex Wood 3B Nolan Arenado SS Elvis Andrus OF Aaron Judge OF Billy Hamilton C Cameron Rupp 2B Brad Miller OF Matt Olson 1B Luis Valbuena",NA,"Maikel Franco","2.01%",0
142,796023851,"goochmonger (13/15)",0,96.45,"P Madison Bumgarner P Alex Wood OF Gerardo Parra OF Khris Davis 2B Robinson Canó SS Andrelton Simmons OF Corey Dickerson C John Hicks 3B Jedd Gyorko 1B Matt Olson",NA,"Dee Gordon","2.01%",0
143,796106836,"fivestarco (6/6)",0,96.4,"P Gio González P Troy Scribner 1B Joey Votto 3B Freddie Freeman OF Aaron Judge OF Manuel Margot 2B Robinson Canó OF José Pirela C Austin Hedges SS Xander Bogaerts",NA,"Tyler Flowers","2.01%",8
144,795853495,"jeff8735",0,96.35,"P Collin McHugh P Brandon Woodruff 2B José Altuve OF Charlie Blackmon 3B Nolan Arenado 1B Freddie Freeman OF Derek Fisher OF Odúbel Herrera SS José Peraza C Juan Centeno",NA,"Yonder Alonso","2.01%",0
145,796061053,"nick.jess",0,96.15,"P Kyle Hendricks P Antonio Senzatela OF Charlie Blackmon OF Bryce Harper OF Aaron Judge SS Jean Segura 3B Adrián Béltre 2B Robinson Canó 1B Trey Mancini C Matt Wieters",NA,"Chase Headley","2.01%",3
146,795972829,"brianLiza",0,96.1,"P Trevor Bauer P Asher Wojciechowski C Willson Contreras OF Gerardo Parra 1B Edwin Encarnacion OF Andrew McCutchen OF Ryan Braun 3B Josh Donaldson 2B Yangervis Solarte SS Orlando Arcia",NA,"Eric Sogard","2.01%",5
146,796035900,"buchris532 (3/15)",0,96.1,"P Kyle Hendricks P Jake Odorizzi OF Mike Trout OF Adam Duvall C Willson Contreras 3B Kris Bryant OF Michael Conforto 1B Joey Gallo SS Wilmer Difo 2B Brad Miller",NA,"Carlos Santana","2.01%",10
148,796023845,"goochmonger (7/15)",0,96,"P Alex Wood P Kyle Hendricks OF Bryce Harper OF Gerardo Parra SS Didi Gregorius 3B Adrián Béltre 2B Robinson Canó OF Eric Thames C Brian McCann 1B Matt Olson",NA,"Abraham Almonte","2.01%",10
148,796128435,"mstockholm01 (4/4)",0,96,"P Trevor Bauer P Ivan Nova 3B Freddie Freeman SS Francisco Lindor 2B Jonathan Schoop OF Ryan Braun 1B Joey Gallo OF Khris Davis OF Eric Thames C Manny Piña",NA,"Jake Lamb","1.79%",0
150,796126856,"chrisech612 (2/2)",0,95.9,"P Justin Verlander P Rick Porcello OF Mookie Betts OF Manuel Margot OF Christian Yelich 3B Rafael Devers SS Javier Báez 2B César Hernández 1B Matt Carpenter C Yasmani Grandal",NA,"Gerardo Parra","1.79%",6
151,796118766,"malikabdur",0,95.6,"P Trevor Bauer P Mike Leake 1B Paul Goldschmidt OF Cody Bellinger OF Michael Conforto OF Jay Bruce 3B Adrián Béltre C Gary Sánchez 2B Jason Kipnis SS Trevor Story",NA,"Daniel Murphy","1.79%",0
152,796039301,"buchris532 (5/15)",0,95.45,"P Madison Bumgarner P Sean Newcomb OF Aaron Judge SS Tim Beckham OF Adam Jones C Gary Sánchez OF Corey Dickerson 1B Chris Davis 3B Evan Longoria 2B Brad Miller",NA,"Travis Wood","1.79%",8.65
152,796126167,"gijoe411",0,95.45,"P Madison Bumgarner P Alex Wood SS Corey Seager 1B Joey Gallo OF Shin-soo Choo 2B Jason Kipnis OF Yoenis Céspedes C René Rivera OF Gregory Polanco 3B Drew Robinson",NA,"Victor Martinez","1.79%",0
152,796128002,"bmallow",0,95.45,"P Jerad Eickhoff P Trevor Cahill OF Mike Trout OF Charlie Blackmon OF Bryce Harper 2B Jonathan Schoop 1B Joey Gallo 3B Adrián Béltre SS Trevor Story C J.T. Realmuto",NA,"Ben Zobrist","1.79%",6
155,796139073,"mike4pros",0,95.25,"P Trevor Bauer P Kyle Hendricks 2B José Ramírez SS Francisco Lindor OF Michael Conforto 1B Joey Gallo 3B Adrián Béltre OF Austin Jackson OF Yoenis Céspedes C Alex Avila",NA,"Eric Hosmer","1.79%",8
156,796022801,"jamwatt1549 (2/3)",0,95.15,"P Madison Bumgarner P Justin Verlander OF Keon Broxton OF Carlos Gómez 1B Joe Mauer C J.T. Realmuto 3B Evan Longoria OF Denard Span 2B Eric Sogard SS Brandon Crawford",NA,"Jerad Eickhoff","1.79%",21.6
157,795975579,"RSFHouston420 (1/5)",0,94.85,"P Alex Wood P Asher Wojciechowski OF Josh Reddick 3B Alex Bregman OF Eduardo Núñez SS Paul DeJong 2B Kolten Wong OF Dexter Fowler 1B Matt Carpenter C Brian McCann",NA,"Wilson Ramos","1.79%",0
157,796056264,"WS2016CUBBIES",0,94.85,"P Sean Newcomb P Asher Wojciechowski OF Mike Trout 2B José Altuve OF Charlie Blackmon OF Bryce Harper 3B Eduardo Núñez 1B Tyler White SS Xander Bogaerts C Robinson Chirinos",NA,"Brian Goodwin","1.79%",11
159,795946810,"SUNSET76 (8/15)",0,94.8,"P Kevin Gausman P Masahiro Tanaka OF Aaron Judge OF Brett Gardner SS Didi Gregorius C Gary Sánchez OF Eric Thames 1B Chase Headley 3B Evan Longoria 2B Brad Miller",NA,"Jonathan Lucroy","1.79%",9
160,796104871,"buchris532 (11/15)",0,94.6,"P Masahiro Tanaka P Collin McHugh OF Charlie Blackmon SS Francisco Lindor 1B Carlos Santana OF Abraham Almonte C Jonathan Lucroy OF Austin Jackson 3B Evan Longoria 2B Brad Miller",NA,"Cam Gallagher","1.56%",0
161,796100637,"pitts.83",0,94.45,"P Madison Bumgarner P Alex Wood OF Mike Trout 1B Matt Carpenter OF Corey Dickerson C J.T. Realmuto 3B Evan Longoria SS Xander Bogaerts 2B Brad Miller OF Gregory Polanco",NA,"Wil Myers","1.56%",16
161,796112326,"Kdog11145",0,94.45,"P Madison Bumgarner P Alex Wood OF Mike Trout 1B Matt Carpenter OF Corey Dickerson C J.T. Realmuto 3B Evan Longoria SS Xander Bogaerts 2B Brad Miller OF Gregory Polanco",NA,"Ian Happ","1.56%",0
163,796058471,"Hinobrown (2/3)",0,94.35,"P Collin McHugh P Trevor Bauer OF Bryce Harper 3B Miguel Sanó OF Manuel Margot 2B Yangervis Solarte 1B Wil Myers SS Eduardo Escobar OF Hunter Renfroe C Manny Piña",NA,"Travis Shaw","1.56%",0
164,796094118,"2tearsInAhBucket",0,94.1,"P Alex Wood P Collin McHugh OF Cody Bellinger OF Giancarlo Stanton 3B Joey Gallo 2B Yangervis Solarte SS Xander Bogaerts C Alex Avila OF Albert Almora Jr. 1B Tommy Joseph",NA,"José Peraza","1.56%",14
165,796140426,"JohnFSt3",0,94,"P Alex Wood P Kyle Hendricks OF Bryce Harper OF Giancarlo Stanton 3B José Ramírez 1B Edwin Encarnacion OF Dexter Fowler 2B Alexi Amarista SS José Reyes C Roberto Pérez",NA,"Josh Harrison","1.56%",0
166,796069489,"drinkingbuddy",0,93.4,"P Gio González P Ivan Nova OF J.D. Martinez SS Didi Gregorius OF Nick Williams 2B Robinson Canó OF Brian Goodwin 1B Luke Voit C J.T. Realmuto 3B Derek Dietrich",NA,"Nicky Delmonico","1.56%",13
167,796104199,"rkulp12 (3/3)",0,93.3,"P Trevor Bauer P Rafael Montero 2B José Altuve 3B Freddie Freeman OF Giancarlo Stanton SS Francisco Lindor OF Ryan Braun C Gary Sánchez OF Eric Thames 1B Miguel Cabrera",NA,"José Abreu","1.56%",0
168,795870423,"musicnsports",0,93.25,"P Gio González P Sean Newcomb OF Billy Hamilton C Gary Sánchez OF Lorenzo Cain SS Andrelton Simmons 3B Hernán Pérez 1B Kendrys Morales OF Eric Thames 2B Rougned Odor",NA,"Patrick Kivlehan","1.56%",5
169,795968517,"meangene0473",0,93.2,"P Alex Wood P Rick Porcello 1B Freddie Freeman OF Aaron Judge OF Ryan Braun C Gary Sánchez OF Eric Thames 3B Wilmer Flores 2B Brandon Phillips SS José Reyes",NA,"Wilmer Difo","1.56%",7
170,795808734,"bignickgus70",0,93.05,"P Zack Greinke P Trevor Cahill OF Andrew Benintendi OF Adam Duvall 3B Jake Lamb OF Mookie Betts 2B Paul DeJong 1B Wil Myers C Welington Castillo SS Xander Bogaerts",NA,"Carlos Beltrán","1.56%",0
171,796131696,"Rlongman19 (4/4)",0,92.75,"P Zack Greinke P Brandon Woodruff OF Mike Trout 3B Manny Machado 2B Jonathan Schoop OF Michael Conforto C Gary Sánchez 1B Wilmer Flores SS José Peraza OF Drew Robinson",NA,"Ian Kinsler","1.56%",36
172,796112428,"qbjjj",0,92.7,"P Madison Bumgarner P Trevor Bauer 3B Justin Turner 1B Edwin Encarnacion OF Avisaíl García OF Leury García OF Yoenis Céspedes C Buster Posey SS José Reyes 2B Yolmer Sánchez",NA,"Carlos González","1.56%",8
173,796081033,"ombjac22 (1/2)",0,92.5,"P Collin McHugh P Kyle Hendricks OF Derek Fisher OF Bradley Zimmer SS Tim Beckham 3B Joey Gallo OF Manuel Margot 1B Matt Carpenter 2B Jed Lowrie C Manny Piña",NA,"Francisco Cervelli","1.56%",0
174,795849235,"KROSS420",0,92.3,"P Alex Wood P A.J. Griffin 2B José Altuve OF Adam Jones OF Lorenzo Cain OF Domingo Santana SS Andrelton Simmons 1B Eric Thames 3B Todd Frazier C Welington Castillo",NA,"Randal Grichuk","1.34%",8
174,796146226,"stevecunico",0,92.3,"P Ivan Nova P Trevor Cahill OF Charlie Blackmon 3B Nolan Arenado 1B Freddie Freeman 2B José Ramírez SS Francisco Lindor C Gary Sánchez OF Abraham Almonte OF Carlos González",NA,"Bruce Maxwell","1.34%",2
176,796128427,"mstockholm01 (3/4)",0,92,"P Trevor Bauer P Ivan Nova 2B José Altuve 1B Freddie Freeman OF Aaron Judge SS Tim Beckham OF Ryan Braun C Gary Sánchez 3B Wilmer Flores OF Matt Olson",NA,"Brett Nicholas","1.34%",3
177,796059645,"JakeBru3",0,91.6,"P Masahiro Tanaka P Collin McHugh OF Nelson Cruz OF Aaron Judge 3B Eduardo Núñez 2B Jason Kipnis 1B Matt Carpenter C Yadier Molina OF Carlos Gómez SS Xander Bogaerts",NA,"Martín Pérez","1.34%",27.6
178,796123589,"juice04951",0,91.25,"P Kyle Hendricks P Brandon Woodruff OF Mike Trout 1B Freddie Freeman OF Nelson Cruz OF Bradley Zimmer 3B Adrián Béltre 2B Robinson Canó SS Andrelton Simmons C Tyler Flowers",NA,"Matt Chapman","1.34%",3
179,795950359,"golddesk",0,91,"P Ivan Nova P Asher Wojciechowski OF Mike Trout OF Bryce Harper 1B Joey Votto SS Paul DeJong OF Khris Davis 2B Kolten Wong C Matt Wieters 3B Josh Harrison",NA,"Rafael Devers","1.34%",0
180,795852801,"griffin777 (15/15)",0,90.95,"P Rick Porcello P Mike Leake OF Mike Trout OF Bryce Harper SS Elvis Andrus OF Cody Bellinger 3B Adrián Béltre 2B Rougned Odor 1B Mike Napoli C Robinson Chirinos",NA,"Jim Adduci","1.34%",4
181,795882882,"paycory (1/2)",0,90.8,"P Justin Verlander P Masahiro Tanaka OF Josh Reddick OF Bradley Zimmer SS Orlando Arcia 2B Robinson Canó C Brian McCann 3B Eugenio Suárez OF Denard Span 1B Luis Valbuena",NA,"Trevor Story","1.34%",2
181,796076350,"pepman9 (2/2)",0,90.8,"P Justin Verlander P Masahiro Tanaka OF Marcell Ozuna 1B Joey Gallo OF Carlos Beltrán 3B Eugenio Suárez C Matt Wieters 2B Adam Frazier OF Cameron Maybin SS Xander Bogaerts",NA,"Manuel Margot","1.34%",14
183,796067060,"pepman9 (1/2)",0,90.55,"P Kevin Gausman P Trevor Bauer 3B Justin Turner OF A.J. Pollock OF Ryan Braun 2B Yangervis Solarte OF Steve Pearce C J.T. Realmuto SS Xander Bogaerts 1B Miguel Cabrera",NA,"Yasmani Grandal","1.12%",0
184,796107390,"marielys63 (2/3)",0,89.65,"P Gio González P Kyle Hendricks 3B Manny Machado OF Nelson Cruz OF Jay Bruce C Matt Wieters 1B Wilmer Flores OF Corey Dickerson SS José Reyes 2B Neil Walker",NA,"Odúbel Herrera","1.12%",20
185,796085276,"KillerV23",0,89.5,"P Gio González P Asher Wojciechowski 2B José Altuve 1B Justin Smoak OF Gerardo Parra 3B Travis Shaw OF Christian Yelich OF Albert Almora Jr. SS Brandon Crawford C Sandy Leon",NA,"Jharel Cotton","1.12%",4.1
185,796109064,"louiswat (2/2)",0,89.5,"P Gio González P Trevor Bauer OF Bradley Zimmer OF Michael Conforto 3B Adrián Béltre 2B Jason Kipnis OF Carlos Gómez 1B Wilmer Flores SS Amed Rosario C Brett Nicholas",NA,"Christian Yelich","1.12%",0
187,796142307,"NWODESTROYER",0,89.35,"P Madison Bumgarner P Zack Greinke OF Michael Conforto 3B Kyle Seager OF José Pirela C Matt Wieters 1B Hanley Ramirez SS Dusty Coleman OF Gregory Polanco 2B Kaleb Cowart",NA,"Austin Hedges","1.12%",0
188,795944593,"Bryanwke31",0,89.25,"P Collin McHugh P Ivan Nova OF Bryce Harper 2B Chris Taylor OF Michael Conforto 1B Joey Gallo OF Jay Bruce 3B Todd Frazier C Tyler Flowers SS Xander Bogaerts",NA,"Avisaíl García","1.12%",2
189,796015960,"upton-maddux",0,89.1,"P Collin McHugh P Sean Newcomb 1B Freddie Freeman OF Andrew Benintendi OF Adam Duvall OF Marcell Ozuna 2B DJ LeMahieu 3B Kyle Seager SS Andrelton Simmons C Tyler Flowers",NA,"José Bautista","1.12%",14
189,796066575,"gfay63 (4/15)",0,89.1,"P Collin McHugh P Sean Newcomb OF Mike Trout OF Nelson Cruz OF Adam Jones 3B Kyle Seager 2B Robinson Canó SS Marcus Semien 1B Chris Davis C Mike Zunino",NA,"Mark Trumbo","1.12%",0
191,795909365,"PaPamoneyman (1/2)",0,88.75,"P Alex Wood P Troy Scribner OF Mike Trout 1B Cody Bellinger SS Corey Seager 3B Justin Turner OF Steven Souza Jr. 2B Javier Báez OF Kole Calhoun C Buster Posey",NA,"Ben Gamel","1.12%",8
192,795930881,"dirkadude",0,88.7,"P Collin McHugh P Rick Porcello 2B José Altuve 3B José Ramírez OF Derek Fisher OF Ryan Braun C Gary Sánchez OF Eric Thames 1B Miguel Cabrera SS José Reyes",NA,"Steven Souza Jr.","1.12%",3
193,795927345,"Pmatchie",0,88.35,"P Masahiro Tanaka P Brandon Woodruff OF Bryce Harper OF Cody Bellinger 3B Anthony Rendon OF Ryan Braun SS Orlando Arcia 2B Whit Merrifield 1B Eric Thames C Manny Piña",NA,"Nomar Mazara","1.12%",15
193,796107979,"Jaymars17",0,88.35,"P Collin McHugh P Asher Wojciechowski 2B José Altuve OF Giancarlo Stanton OF Andrew Benintendi 3B Eduardo Núñez SS Orlando Arcia 1B Matt Carpenter OF Carlos Gómez C J.T. Realmuto",NA,"John Jaso","1.12%",2
195,796119132,"marielys63 (3/3)",0,88.2,"P Zack Greinke P Kevin Gausman 2B José Ramírez 1B Edwin Encarnacion OF Shin-soo Choo OF Hernán Pérez OF Austin Jackson 3B Ryon Healy SS José Peraza C Stuart Turner",NA,"Amed Rosario","1.12%",3
196,795959276,"heavyhitterz805",0,88.15,"P Alex Wood P Trevor Cahill 2B José Altuve SS Francisco Lindor OF Derek Fisher OF Mookie Betts 3B Travis Shaw C Gary Sánchez OF Eric Thames 1B Miguel Cabrera",NA,"Kolten Wong","1.12%",14
197,795879846,"ttmshaunkerr",0,88.1,"P Madison Bumgarner P Gio González 2B César Hernández OF Avisaíl García SS Marcus Semien OF Corey Dickerson C J.T. Realmuto OF Nicky Delmonico 3B Jedd Gyorko 1B Victor Martinez",NA,"Kaleb Cowart","1.12%",9
197,795915382,"Rmonarch365",0,88.1,"P Alex Wood P Masahiro Tanaka OF Mike Trout OF Dexter Fowler OF José Pirela 1B Matt Carpenter 3B Maikel Franco SS Freddy Galvis C Buster Posey 2B Yoán Moncada",NA,"Ronald Torreyes","0.89%",10
199,796091880,"kayteydray",0,88.05,"P Antonio Senzatela 2B José Altuve OF Bryce Harper 3B Manny Machado OF Marwin González 1B Yuli Gurriel OF Aaron Judge SS Tim Beckham C Welington Castillo P Martín Pérez",NA,"Jaycob Brugman","0.89%",2
200,796104424,"evand_3",0,87.85,"P Masahiro Tanaka P Mike Leake 3B Anthony Rendon OF Aaron Judge OF Brett Gardner SS Didi Gregorius C Gary Sánchez 2B DJ LeMahieu OF Shin-soo Choo 1B Yonder Alonso",NA,"Mitch Moreland","0.89%",2
201,795993740,"spitfire827",0,87.7,"P Collin McHugh P Rick Porcello 3B Manny Machado 1B Yuli Gurriel OF Eduardo Núñez OF Ryan Braun OF Nick Williams 2B Ian Kinsler C Matt Wieters SS Xander Bogaerts",NA,"Rougned Odor","0.89%",0
202,796037512,"bend9276",0,87.5,"P Masahiro Tanaka P Kyle Hendricks OF George Springer SS Marwin González OF Aaron Judge C Gary Sánchez 1B Eric Thames 3B Eugenio Suárez OF Yoenis Céspedes 2B Brad Miller",NA,"Jeff Mathis","0.89%",0
203,796144902,"zbark2 (3/6)",0,87.35,"P Collin McHugh P Trevor Bauer 3B Freddie Freeman OF Ryan Braun C Gary Sánchez OF Khris Davis 2B Robinson Canó 1B Eric Thames OF Yoenis Céspedes SS Marcus Semien",NA,"Alex Avila","0.89%",0
203,796146593,"zbark2 (4/6)",0,87.35,"P Collin McHugh P Trevor Bauer 3B Freddie Freeman OF Ryan Braun C Gary Sánchez OF Khris Davis 2B Robinson Canó 1B Eric Thames OF Yoenis Céspedes SS Marcus Semien",NA,"Kole Calhoun","0.89%",13
205,795965311,"mikechaz (1/2)",0,87.25,"P Kyle Hendricks P Asher Wojciechowski 2B José Altuve OF Marwin González OF Aaron Judge 3B Miguel Sanó C Gary Sánchez OF Brian Goodwin 1B Eric Thames SS Eric Sogard",NA,"Yoán Moncada","0.89%",11
206,796066572,"gfay63 (1/15)",0,87.2,"P Rick Porcello P Sean Newcomb OF Mike Trout 3B Manny Machado OF Nelson Cruz 2B Jonathan Schoop OF Adam Jones SS Marcus Semien 1B Chris Davis C Mike Zunino",NA,"Yovani Gallardo","0.89%",4.95
207,796136176,"GHROSS",0,87.15,"P Madison Bumgarner P Justin Verlander OF Khris Davis 2B Robinson Canó 1B Yonder Alonso SS Chad Pinder 3B Ryon Healy OF Guillermo Heredia C Bruce Maxwell OF Jaycob Brugman",NA,"Howie Kendrick","0.89%",17
208,796104884,"buchris532 (12/15)",0,87.05,"P Madison Bumgarner P Rick Porcello SS Elvis Andrus OF Michael Conforto OF Jay Bruce 2B Jason Kipnis 1B Wilmer Flores 3B José Reyes C René Rivera OF Drew Robinson",NA,"Matt Joyce","0.89%",19
209,795877499,"npr40 (2/2)",0,86.95,"P Madison Bumgarner P Masahiro Tanaka OF Billy Hamilton OF Khris Davis OF Melky Cabrera 1B Joe Mauer 2B Brandon Phillips SS Xander Bogaerts 3B Derek Dietrich C Yan Gomes",NA,"Russell Martin","0.89%",0
210,796023841,"goochmonger (3/15)",0,86.85,"P Alex Wood P Trevor Bauer OF Bryce Harper 3B Anthony Rendon 2B José Ramírez OF Khris Davis OF Eric Thames SS Xander Bogaerts C Manny Piña 1B Matt Olson",NA,"John Hicks","0.89%",11
211,796095574,"jbeezy3333 (2/4)",0,86.45,"P Madison Bumgarner P Alex Wood 3B Nolan Arenado SS Elvis Andrus C Brian McCann OF Kevin Pillar 2B Yolmer Sánchez OF Jim Adduci 1B Victor Martinez OF Gregory Polanco",NA,"Kyle Schwarber","0.89%",3
212,796121259,"mstockholm01 (1/4)",0,86.35,"P Masahiro Tanaka P Trevor Bauer 2B José Altuve 3B Freddie Freeman 1B Joey Gallo OF Khris Davis OF Eric Thames SS Marcus Semien OF Patrick Kivlehan C Wilson Ramos",NA,"Jorge Polanco","0.67%",15
213,796106208,"louiswat (1/2)",0,86.2,"P Antonio Senzatela P Rafael Montero OF Mike Trout OF Charlie Blackmon 3B Nolan Arenado 2B José Ramírez 1B Carlos Santana OF Bradley Zimmer SS Tim Beckham C Jonathan Lucroy",NA,"César Valdez","0.67%",0
214,795978011,"frogkaytee",0,86.1,"P Collin McHugh P Sean Newcomb 1B Freddie Freeman 3B Alex Bregman OF Adam Duvall OF Adam Jones SS Didi Gregorius OF Eric Thames C Welington Castillo 2B Brandon Phillips",NA,"Anthony Rizzo","0.67%",0
215,796145988,"askmjones",0,85.05,"P Kevin Gausman P Mike Leake OF Charlie Blackmon 1B Joey Votto OF Marwin González 3B Adrián Béltre 2B DJ LeMahieu C Buster Posey SS Xander Bogaerts OF Albert Almora Jr.",NA,"Derek Dietrich","0.67%",2
216,796023840,"goochmonger (2/15)",0,85,"P Alex Wood P Kyle Hendricks 3B José Ramírez OF Aaron Judge OF Eduardo Núñez SS Didi Gregorius 1B Matt Carpenter OF Trey Mancini C Yasmani Grandal 2B Neil Walker",NA,"Zack Cozart","0.67%",0
217,795877376,"Eddtertainment",0,84.85,"P Alex Wood P Trevor Bauer 1B Joey Votto 3B Miguel Sanó OF Ryan Braun OF Avisaíl García OF Yoenis Céspedes 2B Josh Harrison C Buster Posey SS Xander Bogaerts",NA,"Juan Centeno","0.67%",0
218,796091438,"jajusjena (1/3)",0,84.8,"P Kevin Gausman P Collin McHugh 3B Eduardo Núñez OF Andrew McCutchen 1B Joey Gallo OF Lorenzo Cain 2B Dee Gordon SS Andrelton Simmons C Yadier Molina OF Gregory Polanco",NA,"Denard Span","0.67%",12
