"Rank","EntryId","EntryName","TimeRemaining","Points","Lineup","X","Player","X.Drafted","FPTS"
1,787437925,"coachspath1 (3/3)",0,194.7,"OF Rajai Davis 1B Joey Votto P Mike Leake OF Giancarlo Stanton C Salvador Perez 2B José Altuve P James Paxton OF J.D. Martinez SS Marcus Semien 3B Matt Chapman",NA,"Jacob deGrom","38.44%",29.8
2,787469861,"Colefloflo (1/2)",0,189.7,"OF Adam Jones P Mike Leake OF Alex Presley OF Giancarlo Stanton 2B José Altuve P James Paxton C Josh Phegley 3B Manny Machado SS Corey Seager 1B Cody Bellinger",NA,"Cody Bellinger","27.08%",18
3,787655338,"Prolificd (9/20)",0,182.05,"SS Elvis Andrus OF Giancarlo Stanton 1B Wilmer Flores OF Randal Grichuk P James Paxton 2B Scooter Gennett C J.T. Realmuto P Kevin Gausman OF Cody Bellinger 3B Matt Chapman",NA,"Giancarlo Stanton","23.98%",32
4,787659956,"cjs5555 (6/7)",0,181.55,"P Francisco Liriano SS Troy Tulowitzki OF Giancarlo Stanton 2B Daniel Descalso C Salvador Perez OF A.J. Pollock 1B Paul Goldschmidt OF J.D. Martinez 3B Jake Lamb P Kevin Gausman",NA,"Justin Verlander","22.62%",23.55
5,787544520,"MyThirdEye (3/3)",0,178.95,"C Brian McCann OF Andrew McCutchen P Mike Leake 3B Marwin González SS Jordy Mercer 2B José Altuve OF Starling Marte OF George Springer P Eduardo Rodríguez 1B Josh Bell",NA,"Carlos Gómez","19.52%",3
6,787445397,"boozinbuffalo (3/20)",0,172.3,"SS Asdrúbal Cabrera OF Andrew McCutchen C Francisco Cervelli OF Giancarlo Stanton 2B Josh Harrison 3B Wilmer Flores OF Starling Marte P Kevin Gausman P Eduardo Rodríguez 1B Josh Bell",NA,"Jonathan Lucroy","18.92%",7
7,787480068,"sfdskins (1/2)",0,172.05,"SS Asdrúbal Cabrera OF David Peralta C Jonathan Lucroy 1B Wilmer Flores OF A.J. Pollock P James Paxton OF J.D. Martinez 3B Jake Lamb P Kevin Gausman 2B Rougned Odor",NA,"Marcus Semien","18.79%",4
7,787651947,"Teegarden4",0,172.05,"SS Asdrúbal Cabrera OF David Peralta C Jonathan Lucroy 1B Wilmer Flores OF A.J. Pollock P James Paxton OF J.D. Martinez 3B Jake Lamb P Kevin Gausman 2B Rougned Odor",NA,"Adrián Béltre","18.37%",12
9,787567605,"bcalicore (15/20)",0,171.8,"OF Carlos Beltrán 3B José Reyes C Brian McCann SS Asdrúbal Cabrera OF Marwin González 2B José Altuve 1B Wilmer Flores P James Paxton OF Yoenis Céspedes P Hyun-Jin Ryu",NA,"J.T. Realmuto","17.73%",5
10,787489400,"ganondorf (11/20)",0,171.7,"P Mike Leake OF David Peralta 3B Mike Moustakas C Salvador Perez 1B Eric Hosmer OF A.J. Pollock P James Paxton SS Chris Owings OF J.D. Martinez 2B Paul DeJong",NA,"Rougned Odor","17.18%",0
11,787601337,"sploush (13/20)",0,171.3,"P Francisco Liriano C Brian McCann 1B Miguel Cabrera OF Josh Reddick OF Giancarlo Stanton 2B José Altuve OF George Springer SS Francisco Lindor 3B Alex Bregman P Hyun-Jin Ryu",NA,"Corey Seager","16.45%",3
12,787685836,"rednekrob",0,169.95,"C Jeff Mathis OF Justin Upton 1B Freddie Freeman OF Giancarlo Stanton 2B José Altuve P James Paxton SS Marcus Semien P Eduardo Rodríguez OF Nick Williams 3B Matt Chapman",NA,"James Paxton","16.11%",37.35
13,787628652,"juliusn10",0,169.5,"C Jeff Mathis 1B Miguel Cabrera SS Elvis Andrus OF Tommy Pham OF Josh Reddick OF A.J. Pollock P Kevin Gausman P Jacob deGrom 2B Rougned Odor 3B Matt Chapman",NA,"Kevin Gausman","16.07%",28.7
14,787599581,"saints5386 (8/10)",0,168.35,"P Zack Greinke P Mike Leake 3B Mike Moustakas OF Giancarlo Stanton OF A.J. Pollock SS Marcus Semien C J.T. Realmuto 2B Rougned Odor 1B Ryon Healy OF Cody Bellinger",NA,"Ryon Healy","15.22%",5
15,787601297,"tomjk321 (11/20)",0,168.25,"C Jonathan Lucroy 2B José Altuve OF A.J. Pollock SS Chris Owings 1B Paul Goldschmidt OF J.D. Martinez OF Starling Marte 3B Jake Lamb P Kevin Gausman P Blake Snell",NA,"Mike Napoli","14.80%",0
16,787522875,"tylmartin2345",0,167.85,"P Francisco Liriano 1B Joey Votto P Zack Greinke OF Lorenzo Cain C Jonathan Lucroy OF Giancarlo Stanton SS Brandon Crawford 3B Josh Harrison 2B José Altuve OF Yoenis Céspedes",NA,"Manny Machado","14.46%",12
17,787588892,"bellaedward4eva (8/20)",0,167.15,"C Jeff Mathis P Mike Leake OF David Peralta OF A.J. Pollock 1B Paul Goldschmidt OF J.D. Martinez 2B Danny Santana SS Marcus Semien P Jacob deGrom 3B Matt Chapman",NA,"José Bautista","13.90%",4
18,787411012,"SlowQueen (14/20)",0,167.05,"C Russell Martin SS Troy Tulowitzki 3B Josh Donaldson 2B Daniel Descalso OF A.J. Pollock P James Paxton OF Chris Owings 1B Paul Goldschmidt OF J.D. Martinez P Kevin Gausman",NA,"Miguel Cabrera","13.48%",7
18,787680524,"migkompressor",0,167.05,"OF Alex Presley 3B Mike Moustakas OF Giancarlo Stanton C Salvador Perez 1B Eric Hosmer P James Paxton 2B Whit Merrifield OF Jorge Bonifacio P Kevin Gausman SS Paul DeJong",NA,"Hyun-Jin Ryu","13.35%",12.45
18,787701687,"smarkov11",0,167.05,"P Justin Verlander 1B Carlos Santana P Josh Tomlin OF Giancarlo Stanton SS Jean Segura OF Billy Hamilton OF Starling Marte 3B Manny Machado C J.T. Realmuto 2B Paul DeJong",NA,"Francisco Liriano","13.22%",18.85
21,787540911,"bluester111 (19/20)",0,165.9,"OF Dexter Fowler P Justin Verlander OF Tommy Pham OF Giancarlo Stanton 2B Kolten Wong 3B Wilmer Flores P James Paxton 1B Luke Voit C J.T. Realmuto SS Paul DeJong",NA,"Elvis Andrus","12.37%",3
22,787576588,"bgpapa6 (12/20)",0,165.55,"P Francisco Liriano C Brian McCann OF Charlie Blackmon 2B José Altuve 1B Paul Goldschmidt 3B Manny Machado P Kevin Gausman OF Yoenis Céspedes SS Corey Seager OF Cody Bellinger",NA,"Gerrit Cole","12.16%",15.5
23,787671208,"pd1956",0,165.05,"1B Carlos Santana OF Tommy Pham C Roberto Pérez OF Giancarlo Stanton P Brad Peacock SS Eduardo Escobar OF Scooter Gennett 3B Manny Machado P Kevin Gausman 2B Rougned Odor",NA,"Zack Greinke","11.90%",27
23,787735056,"rwalkersc (16/20)",0,165.05,"C Jeff Mathis OF Adam Jones OF Daniel Descalso SS Rubén Tejada P James Paxton 1B Paul Goldschmidt OF J.D. Martinez 2B Jonathan Schoop 3B Manny Machado P Kevin Gausman",NA,"Yoenis Céspedes","11.65%",16
25,787681710,"Mghtank (2/3)",0,164.7,"OF Adam Jones OF Justin Upton P Mike Leake OF Giancarlo Stanton C Salvador Perez P James Paxton 2B Jonathan Schoop SS Marcus Semien 3B Manny Machado 1B Trey Mancini",NA,"Eduardo Rodríguez","11.10%",10.6
26,787546748,"SpaceJam23 (5/20)",0,164.65,"OF Carlos Beltrán P Francisco Liriano C Brian McCann 1B Carlos Santana OF Abraham Almonte SS Tim Beckham P Jacob deGrom 2B José Ramírez OF Bradley Zimmer 3B Alex Bregman",NA,"Marcell Ozuna","10.97%",10
27,787634994,"hairbone",0,164.4,"P Francisco Liriano P Justin Verlander OF Andrew McCutchen C Francisco Cervelli 3B Justin Turner SS Jordy Mercer 2B Josh Harrison OF Starling Marte OF Chris Taylor 1B Cody Bellinger",NA,"Francisco Lindor","10.76%",3
28,787632222,"HaggertyU (9/20)",0,164.25,"3B Adrián Béltre P Justin Verlander SS Elvis Andrus 1B Carlos Santana OF Giancarlo Stanton OF J.D. Martinez OF Marcell Ozuna C J.T. Realmuto P Kevin Gausman 2B Rougned Odor",NA,"Matt Chapman","10.76%",14
29,787411010,"SlowQueen (12/20)",0,164.05,"OF Carlos Beltrán C Russell Martin SS Troy Tulowitzki OF Steve Pearce OF Josh Reddick 3B Josh Donaldson 2B José Altuve P James Paxton P Kevin Gausman 1B Yuli Gurriel",NA,"Russell Martin","10.63%",17
30,787660207,"mike4934",0,163.2,"SS José Reyes P Francisco Liriano OF Michael Brantley 3B Josh Donaldson OF Giancarlo Stanton 2B Josh Harrison P James Paxton C J.T. Realmuto OF Bradley Zimmer 1B Cody Bellinger",NA,"Blake Snell","10.08%",13.55
31,787551964,"scout326 (5/20)",0,163.15,"2B Asdrúbal Cabrera OF Michael Brantley 1B Carlos Santana P Mike Leake C Travis d'Arnaud 3B Wilmer Flores P Jacob deGrom SS Francisco Lindor OF Bradley Zimmer OF Yoenis Céspedes",NA,"Justin Upton","9.95%",5
32,787488993,"rcdog (2/4)",0,163.1,"P Chris Smith P Zack Greinke 1B Miguel Cabrera OF Adam Jones SS Asdrúbal Cabrera OF Tommy Pham 3B Marwin González C Alex Avila 2B José Altuve OF Nick Williams",NA,"Alex Presley","9.86%",4
33,787668719,"cchawkman (1/2)",0,162.35,"3B Adrián Béltre C Yadier Molina P Francisco Liriano 1B Joey Votto OF Tommy Pham P Gerrit Cole OF Charlie Blackmon 2B José Altuve OF Eddie Rosario SS Paul DeJong",NA,"Khris Davis","9.78%",0
34,787549779,"rstrohl00 (8/20)",0,162.2,"P Francisco Liriano P Mike Leake C Yasmani Grandal 2B José Altuve OF Marcell Ozuna OF George Springer SS Corey Seager 3B Alex Bregman OF Cody Bellinger 1B Yuli Gurriel",NA,"José Ramírez","9.78%",0
34,787599232,"saints5386 (4/10)",0,162.2,"P Francisco Liriano P Mike Leake OF Giancarlo Stanton C Alex Avila OF A.J. Pollock 2B Scooter Gennett 3B Jake Lamb OF George Springer SS Corey Seager 1B Cody Bellinger",NA,"Michael Brantley","9.69%",5
36,787729389,"sbeatty3 (3/3)",0,162.05,"OF Michael Brantley OF Giancarlo Stanton OF Daniel Descalso 1B Wilmer Flores P James Paxton C J.T. Realmuto P Kevin Gausman 2B Chris Taylor SS Corey Seager 3B Matt Chapman",NA,"Paul DeJong","9.57%",8
37,787568775,"F0rsaken (19/20)",0,161.85,"3B Adrián Béltre P Francisco Liriano P Zack Greinke OF Andrew McCutchen OF Alex Presley SS Jordy Mercer C Alex Avila 2B Josh Harrison OF Starling Marte 1B Josh Bell",NA,"Troy Tulowitzki","9.18%",2
38,787561247,"boggslite (9/10)",0,161.55,"P Zack Greinke 2B Asdrúbal Cabrera P Justin Verlander OF Jay Bruce C Jonathan Lucroy 1B Wilmer Flores OF A.J. Pollock OF Yoenis Céspedes SS Corey Seager 3B Matt Chapman",NA,"Mark Trumbo","9.18%",3
39,787506461,"youdacao (13/20)",0,161.4,"3B Adrián Béltre P Francisco Liriano P Justin Verlander OF Giancarlo Stanton 2B Dee Gordon OF A.J. Pollock SS Chris Owings 1B Paul Goldschmidt OF J.D. Martinez C J.T. Realmuto",NA,"Ian Kinsler","9.01%",8
39,787671889,"gehrenberg (7/20)",0,161.4,"P Francisco Liriano 2B Ian Kinsler 3B Justin Turner OF Giancarlo Stanton C Yasmani Grandal OF A.J. Pollock OF Joc Pederson P Blake Snell SS Corey Seager 1B Cody Bellinger",NA,"Bradley Zimmer","8.42%",14
41,787638244,"HaggertyU (19/20)",0,161.25,"3B Adrián Béltre 1B Mike Napoli P Justin Verlander SS Troy Tulowitzki OF Giancarlo Stanton 2B José Altuve OF J.D. Martinez OF Marcell Ozuna C J.T. Realmuto P Kevin Gausman",NA,"Chris Taylor","8.21%",13
41,787675020,"parsaver1476",0,161.25,"C Russell Martin OF Mark Trumbo P Justin Verlander OF Andrew McCutchen 3B David Freese OF Khris Davis SS Zack Cozart 2B José Altuve P Kevin Gausman 1B Josh Bell",NA,"Josh Donaldson","8.16%",9
43,787570761,"GillTicket",0,161.15,"OF Carlos Beltrán C Brian McCann P Mike Leake OF Josh Reddick 2B Brian Dozier OF Starling Marte SS Marcus Semien P Jacob deGrom 1B Ryon Healy 3B Alex Bregman",NA,"Brad Peacock","8.16%",10.35
44,787666664,"RAkime77",0,160.95,"P Francisco Liriano P Chris Smith OF Steven Souza Jr. OF Giancarlo Stanton C Yasmani Grandal 2B José Altuve OF A.J. Pollock 3B Jedd Gyorko SS Corey Seager 1B Cody Bellinger",NA,"Jonathan Schoop","7.95%",2
45,787592556,"saints5386 (3/10)",0,160.85,"OF Michael Brantley 1B Carlos Santana OF Daniel Descalso P Gerrit Cole 2B José Altuve P James Paxton C Josh Phegley SS Francisco Lindor OF Bradley Zimmer 3B Matt Chapman",NA,"Joc Pederson","7.40%",14
46,787514417,"hbecker22 (1/3)",0,160.3,"3B Marwin González C Yasmani Grandal 2B José Altuve OF Jorge Bonifacio P Kevin Gausman P Eduardo Rodríguez OF Joc Pederson SS Corey Seager OF Yasiel Puig 1B Cody Bellinger",NA,"José Altuve","7.02%",30
47,787659957,"cjs5555 (7/7)",0,159.65,"SS José Reyes P Francisco Liriano 2B Asdrúbal Cabrera 3B Josh Donaldson C Travis d'Arnaud OF Giancarlo Stanton OF Daniel Descalso 1B Wilmer Flores P Jacob deGrom OF Yoenis Céspedes",NA,"Logan Forsythe","6.93%",0
48,787481048,"Sarlatan5",0,159.05,"3B Adrián Béltre OF Giancarlo Stanton 1B Wilmer Flores P James Paxton 2B Brian Dozier OF Marcell Ozuna SS Marcus Semien C J.T. Realmuto P Kevin Gausman OF Yoenis Céspedes",NA,"George Springer","6.80%",0
49,787493833,"Hachiroku (5/7)",0,158.9,"SS Asdrúbal Cabrera C Welington Castillo OF Giancarlo Stanton P Brad Peacock 3B Wilmer Flores OF Marcell Ozuna P Adam Conley 2B Chris Taylor OF Yoenis Céspedes 1B Cody Bellinger",NA,"Alex Avila","6.72%",7
50,787702164,"muxcity",0,158.7,"P Jason Hammel C Brian McCann SS Asdrúbal Cabrera P Justin Verlander OF Andrew McCutchen 1B Carlos Santana OF Josh Reddick 3B Josh Donaldson OF George Springer 2B Paul DeJong",NA,"Yasmani Grandal","6.72%",14
51,787655224,"dmichaelo",0,158.55,"SS José Reyes OF Andrew McCutchen C Yasmani Grandal 2B Dee Gordon OF A.J. Pollock P James Paxton 1B Justin Bour OF Starling Marte P Antonio Senzatela 3B Matt Chapman",NA,"Rajai Davis","6.72%",4
52,787445412,"boozinbuffalo (18/20)",0,158.5,"3B Eduardo Núñez 1B Carlos Santana OF Brandon Belt C Buster Posey SS Brandon Crawford OF J.D. Martinez P Kevin Gausman P Jacob deGrom 2B Joe Panik OF Bradley Zimmer",NA,"J.D. Martinez","6.59%",18
53,787716827,"rack15",0,158.15,"P Mike Leake OF Tommy Pham OF Giancarlo Stanton 2B Dee Gordon 3B Jedd Gyorko C J.T. Realmuto P Jacob deGrom 1B Ryon Healy OF Nick Williams SS Paul DeJong",NA,"Chris Smith","6.51%",6.1
54,787735302,"yaboyjroach1 (1/2)",0,158.05,"P Justin Verlander SS Troy Tulowitzki 2B Jed Lowrie C Jonathan Lucroy OF Giancarlo Stanton P Gerrit Cole OF A.J. Pollock 3B Manny Machado OF Yoenis Céspedes 1B Cody Bellinger",NA,"Josh Phegley","6.51%",0
55,787562708,"suidmach (1/20)",0,157.9,"OF Carlos Beltrán C Brian McCann P Justin Verlander OF Josh Reddick 1B Danny Valencia P Brad Peacock SS Rubén Tejada 2B José Altuve 3B Alex Bregman OF Guillermo Heredia",NA,"Justin Turner","6.46%",8
56,787411015,"SlowQueen (17/20)",0,157.25,"P Justin Verlander OF Giancarlo Stanton 2B Daniel Descalso 1B Tyler Moore OF A.J. Pollock SS Chris Owings OF J.D. Martinez 3B Jake Lamb C J.T. Realmuto P Kevin Gausman",NA,"Brian Dozier","6.46%",0
57,787715363,"rossg1",0,156.9,"1B Miguel Cabrera P Justin Verlander SS Troy Tulowitzki C Jonathan Lucroy OF Giancarlo Stanton 2B Logan Forsythe P James Paxton OF J.D. Martinez 3B Manny Machado OF Cody Bellinger",NA,"Corey Dickerson","6.42%",2
58,787575262,"gfay63 (11/20)",0,156.25,"2B Ian Kinsler P Justin Verlander C Yasmani Grandal 3B Wilmer Flores OF Starling Marte P Kevin Gausman OF Yoenis Céspedes SS Corey Seager OF Yasiel Puig 1B Cody Bellinger",NA,"Welington Castillo","6.29%",5
58,787659953,"cjs5555 (3/7)",0,156.25,"OF Michael Brantley 1B Carlos Santana 3B Josh Donaldson OF Giancarlo Stanton C Salvador Perez P Kevin Gausman SS Francisco Lindor P Blake Snell 2B José Ramírez OF Bradley Zimmer",NA,"Daniel Descalso","6.08%",10
58,787731639,"jdhender (17/20)",0,156.25,"P Justin Verlander C Jonathan Lucroy OF Giancarlo Stanton OF J.D. Martinez 3B Manny Machado P Kevin Gausman SS Francisco Lindor 2B José Ramírez OF Bradley Zimmer 1B Cody Bellinger",NA,"Chris Owings","6.04%",0
58,787731696,"jdhender (19/20)",0,156.25,"P Justin Verlander SS Elvis Andrus C Jonathan Lucroy OF Giancarlo Stanton OF J.D. Martinez 3B Manny Machado P Kevin Gausman 2B José Ramírez OF Bradley Zimmer 1B Cody Bellinger",NA,"Charlie Blackmon","5.95%",3
62,787411007,"SlowQueen (9/20)",0,155.9,"C Jeff Mathis P Justin Verlander 3B Josh Donaldson 2B Daniel Descalso P James Paxton SS Chris Owings 1B Paul Goldschmidt OF J.D. Martinez OF Bradley Zimmer OF Yoenis Céspedes",NA,"Jake Lamb","5.91%",8
63,787496576,"frickster2121",0,155.55,"C Brian McCann P Zack Greinke 1B Miguel Cabrera 2B Asdrúbal Cabrera P Justin Verlander OF Justin Upton OF Steven Souza Jr. SS Jordy Mercer OF Mikie Mahtook 3B Matt Chapman",NA,"Mike Leake","5.91%",29.35
64,787724307,"bongpal",0,155.5,"OF Andrew McCutchen 1B Brandon Belt OF Khris Davis C Salvador Perez SS Tim Beckham OF Jorge Bonifacio P Kevin Gausman P Jacob deGrom 3B Matt Chapman 2B Paul DeJong",NA,"Paul Goldschmidt","5.53%",13
65,787668751,"GatorKing",0,155.2,"P Josh Tomlin 3B Marwin González 1B Freddie Freeman OF Giancarlo Stanton C Salvador Perez OF Randal Grichuk 2B Whit Merrifield P Kevin Gausman OF Nick Williams SS Paul DeJong",NA,"Trey Mancini","5.06%",0
66,787675368,"JDH285 (4/18)",0,154.85,"OF Rajai Davis P Mike Leake P Josh Tomlin OF Giancarlo Stanton C Salvador Perez 3B Kyle Seager 2B Jonathan Schoop SS Corey Seager OF Cody Bellinger 1B Yuli Gurriel",NA,"Adam Jones","4.89%",24
67,787513794,"JNeal916",0,154.4,"P Francisco Liriano SS Asdrúbal Cabrera P Justin Verlander C Travis d'Arnaud OF Giancarlo Stanton 2B José Altuve 3B Wilmer Flores 1B Justin Bour OF George Springer OF Yoenis Céspedes",NA,"Wilmer Flores","4.80%",14
68,787659955,"cjs5555 (5/7)",0,154.25,"3B Justin Turner OF Giancarlo Stanton C Salvador Perez 2B Logan Forsythe OF J.D. Martinez P Kevin Gausman OF Joc Pederson P Blake Snell SS Corey Seager 1B Cody Bellinger",NA,"Shin-soo Choo","4.63%",3
69,787484364,"Hachiroku (3/7)",0,154.15,"P R.A. Dickey SS Asdrúbal Cabrera OF Giancarlo Stanton C Salvador Perez P Gerrit Cole 3B Wilmer Flores OF Marcell Ozuna 2B Chris Taylor OF Yoenis Céspedes 1B Cody Bellinger",NA,"A.J. Pollock","4.46%",32
70,787506789,"darcmaniluk (1/20)",0,154.1,"OF José Bautista C Russell Martin P Justin Verlander OF David Peralta 3B Josh Donaldson 2B José Altuve OF A.J. Pollock SS Chris Owings 1B Paul Goldschmidt P Blake Snell",NA,"Nelson Cruz","4.46%",2
71,787702204,"Shawnss98",0,153.9,"C Jeff Mathis P Justin Verlander 1B Carlos Santana OF Josh Reddick SS Zack Cozart P Martín Pérez OF A.J. Pollock 3B Jake Lamb 2B Jonathan Schoop OF George Springer",NA,"Brian McCann","4.38%",23
72,787637365,"kramer926 (1/2)",0,153.5,"C Jeff Mathis OF Michael Brantley 1B Carlos Santana OF Josh Reddick 3B Marwin González SS Tim Beckham 2B Logan Forsythe P Kevin Gausman P Jacob deGrom OF Bradley Zimmer",NA,"Dee Gordon","4.34%",7
73,787588211,"ford66",0,153.4,"OF Adam Jones P Clayton Richard 2B Jed Lowrie 3B Marwin González C Salvador Perez SS Marcus Semien OF Jorge Bonifacio P Jacob deGrom 1B Josh Bell OF Nick Williams",NA,"Edwin Encarnacion","4.29%",5
74,787506795,"darcmaniluk (7/20)",0,153.25,"3B Adrián Béltre OF Giancarlo Stanton 2B Dee Gordon OF A.J. Pollock SS Chris Owings 1B Paul Goldschmidt OF Marcell Ozuna C J.T. Realmuto P Kevin Gausman P Blake Snell",NA,"Salvador Perez","4.25%",19
74,787727460,"jdhender (3/20)",0,153.25,"3B Adrián Béltre P Justin Verlander C Jonathan Lucroy OF Giancarlo Stanton OF J.D. Martinez OF Marcell Ozuna SS Marcus Semien P Kevin Gausman 2B José Ramírez 1B Cody Bellinger",NA,"Marwin González","4.25%",7
76,787542968,"Mongoose09 (3/20)",0,153.2,"C Jeff Mathis P Francisco Liriano OF Denard Span OF Josh Reddick SS Zack Cozart 1B Freddie Freeman 2B Daniel Descalso P James Paxton OF J.D. Martinez 3B Jake Lamb",NA,"Tyler Moore","4.04%",0
77,787725377,"sbeatty3 (1/3)",0,153.05,"C Jeff Mathis OF Mark Trumbo OF Brandon Belt OF Marwin González 2B José Altuve P James Paxton 3B Jake Lamb SS Marcus Semien P Kevin Gausman 1B Yuli Gurriel",NA,"Tim Beckham","4.00%",5
78,787568771,"TheCommish (15/20)",0,152.9,"OF Adam Jones OF Mark Trumbo P Justin Verlander OF Alex Presley C Welington Castillo SS Zack Cozart 2B José Altuve P James Paxton 3B Manny Machado 1B Trey Mancini",NA,"Tommy Pham","3.95%",23
79,787637695,"tildo21",0,152.3,"2B Ian Kinsler SS Asdrúbal Cabrera OF David Peralta C Jonathan Lucroy OF A.J. Pollock 1B Paul Goldschmidt OF J.D. Martinez 3B Jake Lamb P Kevin Gausman P Eduardo Rodríguez",NA,"Asdrúbal Cabrera","3.95%",15
80,787541312,"leznets2424",0,152.05,"C Yasmani Grandal OF Tyler Moore P James Paxton OF Marcell Ozuna P Kevin Gausman OF Joc Pederson 2B Chris Taylor SS Corey Seager 1B Cody Bellinger 3B Matt Chapman",NA,"Starling Marte","3.70%",18
81,787684562,"B-Ran14 (4/5)",0,151.9,"3B Adrián Béltre C Brian McCann OF Carlos Gómez P Justin Verlander SS Elvis Andrus P Mike Leake OF Josh Reddick 2B José Altuve OF George Springer 1B Yuli Gurriel",NA,"David Peralta","3.61%",12
82,787606253,"sbolen15",0,151.4,"P Francisco Liriano C Brian McCann 2B Ian Kinsler P Justin Verlander SS Elvis Andrus OF David Peralta OF Giancarlo Stanton 3B Nicholas Castellanos OF Yasiel Puig 1B Cody Bellinger",NA,"Justin Smoak","3.61%",8
83,787621384,"mile-high-midget",0,151.3,"3B Adrián Béltre OF Khris Davis OF Giancarlo Stanton OF Daniel Descalso C Salvador Perez P Kevin Gausman P Eduardo Rodríguez 2B Chris Taylor 1B Cody Bellinger SS Paul DeJong",NA,"Scooter Gennett","3.57%",14
84,787541700,"pjc3320",0,151.2,"P Francisco Liriano SS Asdrúbal Cabrera C Welington Castillo OF David Peralta OF Daniel Descalso 2B Logan Forsythe OF A.J. Pollock P James Paxton 1B Paul Goldschmidt 3B Jake Lamb",NA,"Yasiel Puig","3.49%",13
84,787561239,"boggslite (1/10)",0,151.2,"P Francisco Liriano OF David Peralta C Jonathan Lucroy SS Tim Beckham OF A.J. Pollock P James Paxton 1B Paul Goldschmidt 2B Brian Dozier OF J.D. Martinez 3B Jake Lamb",NA,"Steve Pearce","3.44%",5
86,787506453,"youdacao (5/20)",0,151.15,"C Russell Martin OF Michael Brantley 1B Carlos Santana P Mike Leake P Jacob deGrom SS Francisco Lindor 2B José Ramírez OF Bradley Zimmer 3B Ryon Healy OF Yoenis Céspedes",NA,"Steven Souza Jr.","3.36%",5
87,787655318,"Prolificd (7/20)",0,151.05,"OF Michael Brantley OF Justin Upton OF Giancarlo Stanton P James Paxton 2B Jonathan Schoop SS Marcus Semien C J.T. Realmuto P Kevin Gausman 1B Cody Bellinger 3B Matt Chapman",NA,"Yuli Gurriel","3.27%",11
87,787697307,"Deagan (7/8)",0,151.05,"3B Adrián Béltre OF Khris Davis C Welington Castillo OF Giancarlo Stanton P James Paxton SS Marcus Semien P Kevin Gausman OF Joc Pederson 2B Rougned Odor 1B Cody Bellinger",NA,"Jed Lowrie","3.23%",0
89,787540971,"bluester111 (20/20)",0,150.9,"P Justin Verlander OF Giancarlo Stanton 3B Wilmer Flores P James Paxton 2B Brian Dozier OF Marcell Ozuna C J.T. Realmuto 1B Ryon Healy OF Yoenis Céspedes SS Paul DeJong",NA,"Joey Votto","3.19%",7
89,787682443,"4Lteam (2/2)",0,150.9,"OF Carlos Beltrán C Brian McCann P Justin Verlander OF Marwin González 2B José Altuve P James Paxton OF George Springer SS Marcus Semien 1B Ryon Healy 3B Matt Chapman",NA,"Nicholas Castellanos","3.10%",0
91,787577874,"leo888 (1/7)",0,150.85,"P Francisco Liriano P Zack Greinke OF David Peralta C Jonathan Lucroy SS Tim Beckham OF A.J. Pollock 2B Ryan Goins 1B Paul Goldschmidt OF J.D. Martinez 3B Jake Lamb",NA,"Jedd Gyorko","3.10%",2
92,787595366,"ehafner (7/20)",0,150.65,"C Yadier Molina P Francisco Liriano OF Tommy Pham OF Giancarlo Stanton 1B Tyler Moore 2B Kolten Wong OF Marcell Ozuna 3B Jedd Gyorko P Jacob deGrom SS Paul DeJong",NA,"Andrew McCutchen","3.02%",20
92,787713600,"j0rdantay10r (1/2)",0,150.65,"C Jeff Mathis P Francisco Liriano OF Carlos Gómez OF Andrew McCutchen SS Tim Beckham 2B Josh Harrison OF Starling Marte 3B Manny Machado P Jacob deGrom 1B Josh Bell",NA,"Dexter Fowler","2.98%",4
94,787714113,"calibaybe",0,150.6,"P Matt Cain OF Tommy Pham C Jonathan Lucroy OF Giancarlo Stanton SS Brandon Crawford 2B Jonathan Schoop 3B Manny Machado P Jacob deGrom OF Yoenis Céspedes 1B Cody Bellinger",NA,"Brad Miller","2.89%",3
95,787445396,"boozinbuffalo (2/20)",0,150.55,"P Francisco Liriano OF Giancarlo Stanton C Yasmani Grandal 2B Logan Forsythe SS Chris Owings 1B Paul Goldschmidt OF J.D. Martinez 3B Jake Lamb P Kevin Gausman OF Cody Bellinger",NA,"Josh Reddick","2.85%",17
96,787637460,"tballew0908",0,150.5,"P Jason Hammel C Brian McCann OF Steven Souza Jr. OF Giancarlo Stanton OF Charlie Blackmon P James Paxton SS Marcus Semien 2B Brad Miller 1B Cody Bellinger 3B Matt Chapman",NA,"Kevin Pillar","2.81%",0
97,787566870,"sdkole67 (1/5)",0,150.45,"P Chris Smith OF Andrew McCutchen OF Khris Davis C Salvador Perez 2B José Altuve P James Paxton OF Corey Dickerson SS Marcus Semien 1B Cody Bellinger 3B Matt Chapman",NA,"Carlos Santana","2.76%",32
98,787606020,"GRyan (17/20)",0,150.25,"3B Adrián Béltre 1B Mike Napoli C Russell Martin P Justin Verlander SS Elvis Andrus OF Giancarlo Stanton 2B Jonathan Schoop P Kevin Gausman OF Bradley Zimmer OF Cody Bellinger",NA,"Wilson Ramos","2.68%",0
98,787628114,"HaggertyU (1/20)",0,150.25,"P Justin Verlander SS Elvis Andrus OF Giancarlo Stanton OF J.D. Martinez OF Marcell Ozuna 3B Manny Machado C J.T. Realmuto P Kevin Gausman 2B Rougned Odor 1B Cody Bellinger",NA,"Logan Morrison","2.68%",2
100,787461201,"mikev1210 (1/4)",0,150.2,"OF Carlos Beltrán P Francisco Liriano C Brian McCann OF Mark Trumbo 2B José Altuve P James Paxton OF George Springer 3B Manny Machado 1B Yuli Gurriel SS Paul DeJong",NA,"Scott Schebler","2.64%",0
100,787627521,"scooterbz3604",0,150.2,"3B Adrián Béltre P Francisco Liriano 2B Daniel Descalso C Yasmani Grandal 1B Wilmer Flores P James Paxton OF Marcell Ozuna SS Corey Seager OF Yasiel Puig OF Cody Bellinger",NA,"Josh Tomlin","2.59%",22.5
102,787672728,"Larrioto (12/20)",0,150.15,"C Russell Martin SS Asdrúbal Cabrera P Justin Verlander 1B Lucas Duda OF Giancarlo Stanton 2B Dee Gordon 3B Wilmer Flores P Eduardo Rodríguez OF Yoenis Céspedes OF Michael Conforto",NA,"Lorenzo Cain","2.55%",8
102,787715610,"Cfhmarino13 (2/3)",0,150.15,"P Mike Leake OF Josh Reddick 2B José Altuve C Josh Phegley OF Corey Dickerson SS Marcus Semien P Jacob deGrom OF Chris Taylor 1B Yuli Gurriel 3B Matt Chapman",NA,"Evan Longoria","2.51%",3
104,787620312,"cwka140",0,150.05,"SS José Reyes 1B Edwin Encarnacion C Russell Martin OF Andrew McCutchen OF Giancarlo Stanton P Gerrit Cole 2B Brian Dozier 3B Manny Machado P Adam Conley OF Chris Taylor",NA,"Freddie Freeman","2.42%",5
104,787686299,"Kirkkirk3 (2/2)",0,150.05,"OF Adam Jones OF Mark Trumbo C Welington Castillo P James Paxton 2B Jonathan Schoop 3B Manny Machado P Kevin Gausman SS Corey Seager OF Nick Williams 1B Cody Bellinger",NA,"Billy Hamilton","2.34%",3
106,787448525,"star9wars",0,149.95,"1B Edwin Encarnacion OF Tommy Pham C Salvador Perez SS Jean Segura P James Paxton 2B César Hernández OF Drew Robinson P Eduardo Rodríguez 3B Alex Bregman OF Magneuris Sierra",NA,"José Reyes","2.34%",10
106,787567592,"bcalicore (2/20)",0,149.95,"C Yadier Molina P Mike Leake OF Tommy Pham 3B Marwin González 2B José Altuve OF Randal Grichuk OF George Springer P Eduardo Rodríguez 1B Yuli Gurriel SS Paul DeJong",NA,"Jorge Bonifacio","2.25%",22
