"Rank","EntryId","EntryName","TimeRemaining","Points","Lineup","X","Player","X.Drafted","FPTS"
111,777762679,"pjrusso1",0,134.2,"P Max Scherzer P James Paxton OF Jackie Bradley Jr. 1B Logan Morrison 2B Jonathan Schoop OF Marcell Ozuna C Russell Martin SS Tzu-Wei Lin 3B Matt Davidson OF Clint Frazier",NA,"Tim Adleman","3.23%",11.05
112,777733235,"jynx86",0,133.6,"P Max Scherzer P Rafael Montero OF Corey Dickerson 3B Adrián Béltre OF Billy Hamilton 1B Justin Bour 2B Ian Happ OF Eric Thames C Russell Martin SS Ramón Torres",NA,"José Quintana","3.23%",8.95
113,777713031,"BALTIMORE123",0,133.2,"P Drew Pomeranz P Héctor Santiago OF Mookie Betts SS Carlos Correa OF Adam Duvall OF Khris Davis 3B Justin Turner 1B Logan Morrison 2B Jonathan Schoop C Matt Wieters",NA,"Alex Gordon","3.23%",9
114,777735185,"nrlane24",0,133,"P Max Scherzer P Carlos Martínez OF Steven Souza Jr. 1B Justin Bour 2B Whit Merrifield OF Eric Thames 3B Matt Davidson OF Matt Olson C Caleb Joseph SS Ramón Torres",NA,"George Springer","3.23%",12
115,777697841,"RSFHouston420 (1/5)",0,132.55,"P Carlos Martínez P Dan Straily 3B Miguel Sanó OF Giancarlo Stanton 2B Brian Dozier C J.T. Realmuto 1B Justin Bour OF Christian Yelich OF Marcell Ozuna SS Eduardo Escobar",NA,"Adam Duvall","3.06%",2
116,777773319,"JDizz6780",0,132.3,"P Max Scherzer P Jake Arrieta 1B José Abreu OF David Peralta C Willson Contreras OF Adam Jones OF Marcell Ozuna 3B Logan Forsythe SS Troy Tulowitzki 2B Rougned Odor",NA,"Taylor Featherston","3.06%",0
117,777742259,"baumercol",0,132.25,"P Max Scherzer P Jeff Samardzija 1B Carlos Santana 3B Eduardo Escobar OF Robbie Grossman 2B José Pirela OF Steve Pearce SS Troy Tulowitzki OF Mark Trumbo C Jonathan Lucroy",NA,"Manny Piña","3.06%",0
118,777780142,"cwest827",0,132.15,"P James Paxton P Mike Clevinger OF Aaron Judge SS Elvis Andrus OF Carlos Gómez 3B Adrián Béltre 1B Marwin González C Robinson Chirinos 2B Whit Merrifield OF Delino DeShields",NA,"Adam Jones","3.06%",0
119,777765547,"Ebbdawson",0,132,"P Sean Manaea P Dan Straily OF Bryce Harper OF Josh Reddick 1B Eric Hosmer OF Cameron Maybin C Salvador Perez 3B Nicholas Castellanos SS Eric Sogard 2B Brandon Drury",NA,"Trey Mancini","2.89%",2
120,777679119,"georgejester",0,131.9,"P Sean Manaea P Travis Wood 2B Robinson Canó SS Jean Segura 1B Anthony Rizzo 3B Kris Bryant OF Giancarlo Stanton OF Yoenis Céspedes C Salvador Perez OF Marcell Ozuna",NA,"Elvis Andrus","2.89%",12
121,777678214,"priz365 (2/2)",0,131.3,"P José Quintana P Kevin Gausman OF Aaron Judge 3B Jake Lamb 1B Miguel Cabrera C Salvador Perez 2B Ian Happ OF Nick Williams SS Troy Tulowitzki OF Mark Trumbo",NA,"Eric Sogard","2.89%",0
122,777734243,"rustedone (2/2)",0,131.25,"P Luis Severino P James Paxton OF Mookie Betts OF Charlie Blackmon 1B Buster Posey 3B Todd Frazier 2B Brandon Phillips C Brian McCann OF Mark Trumbo SS Dansby Swanson",NA,"Lonnie Chisenhall","2.72%",24
123,777699908,"spencerspn7 (9/13)",0,131.15,"P Trevor Williams P Tim Adleman OF Bryce Harper SS Carlos Correa 2B Daniel Murphy OF Adam Duvall 3B Anthony Rendon OF Michael A. Taylor 1B Adam Lind C Andrew Knapp",NA,"Tyson Ross","2.72%",3.25
124,777781505,"manos8",0,131.05,"P Sean Manaea P Jake Arrieta OF Aaron Judge OF Mookie Betts OF Corey Dickerson C Alex Avila 3B Josh Donaldson 1B Justin Bour 2B Eric Sogard SS Troy Tulowitzki",NA,"Brett Gardner","2.55%",0
125,777655651,"JDH285 (1/12)",0,130.75,"P James Paxton P Dan Straily 2B José Ramírez SS Chris Owings 1B Lucas Duda OF José Bautista OF Yoenis Céspedes OF Domingo Santana 3B Martín Prado C Devin Mesoraco",NA,"Steve Pearce","2.55%",2
126,777705752,"dshaw524",0,130.7,"P Héctor Santiago P Travis Wood OF George Springer OF Mookie Betts 2B Robinson Canó 1B Joey Votto SS Elvis Andrus OF Adam Duvall 3B Nolan Arenado C Buster Posey",NA,"Hernán Pérez","2.55%",3
127,777695665,"red34sox",0,130.6,"P Max Scherzer P Tyson Ross OF Mookie Betts SS Xander Bogaerts 2B Dustin Pedroia 1B Logan Morrison C Christian Vázquez OF Odúbel Herrera 3B Kaleb Cowart OF Shane Peterson",NA,"Scott Schebler","2.55%",0
128,777696428,"WGMathers (1/2)",0,130.35,"P Rafael Montero P Trevor Williams 2B José Ramírez C Gary Sánchez OF Corey Dickerson OF Ryan Braun 1B Hanley Ramirez OF Michael Brantley 3B Miguel Sanó SS Francisco Lindor",NA,"Martín Prado","2.55%",14
129,777768817,"AGSmith52",0,130.25,"P Max Scherzer P Héctor Santiago OF Aaron Judge OF Bryce Harper 1B Alex Avila 2B Jonathan Schoop 3B Manny Machado SS Troy Tulowitzki OF Jon Jay C Jesús Sucre",NA,"Ryon Healy","2.55%",0
130,777680740,"griffin777 (10/15)",0,130.2,"P Drew Pomeranz P Héctor Santiago OF Aaron Judge 3B José Ramírez OF J.D. Martinez 1B Edwin Encarnacion OF Michael Brantley SS Francisco Lindor 2B Jason Kipnis C Willson Contreras",NA,"Shin-soo Choo","2.55%",8
131,777740191,"dreday7",0,130,"P Sean Manaea P Dan Straily OF Mookie Betts OF Jay Bruce 1B Lucas Duda 3B Kris Bryant 2B Dustin Pedroia C Willson Contreras OF Steve Pearce SS Troy Tulowitzki",NA,"Byron Buxton","2.38%",4
131,777743216,"BortlesBrigade",0,130,"P Max Scherzer P Jesse Chávez OF George Springer 1B Miguel Cabrera 3B Miguel Sanó 2B Brian Dozier OF Melky Cabrera OF Eric Thames C Jonathan Lucroy SS Ramón Torres",NA,"José Abreu","2.38%",9
133,777781573,"CatfishBeach",0,129.8,"P Max Scherzer P Alex Cobb 3B José Reyes 1B Justin Bour C Willson Contreras OF Ian Happ SS Addison Russell OF Kevin Pillar 2B Brandon Drury OF Alex Gordon",NA,"Jesús Sucre","2.38%",14
134,777751547,"gabelgabel",0,129.75,"P Carlos Martínez P Sean Manaea 1B Anthony Rizzo SS Xander Bogaerts 3B Josh Donaldson C Willson Contreras 2B Ian Happ OF Marcell Ozuna OF Robbie Grossman OF Gregory Polanco",NA,"Xander Bogaerts","2.38%",0
135,777675284,"G2Zone",0,129.6,"P Max Scherzer P Rafael Montero 1B Anthony Rizzo OF Ben Gamel 3B Josh Donaldson C Robinson Chirinos 2B Whit Merrifield OF Brandon Nimmo OF Jorge Soler SS Wilmer Difo",NA,"Adrián Béltre","2.38%",6
136,777678490,"dannywightman",0,129.2,"P James Paxton P Taijuan Walker 1B Cody Bellinger 2B José Altuve SS Jean Segura OF Ryan Braun OF Brandon Belt C Robinson Chirinos OF Eric Thames 3B Cory Spangenberg",NA,"Jorge Soler","2.38%",7
137,777673836,"griffin777 (1/15)",0,129.15,"P Max Scherzer P Travis Wood OF Mookie Betts 1B Justin Smoak OF José Bautista 3B Josh Donaldson OF Kevin Pillar C Manny Piña SS Troy Tulowitzki 2B Dixon Machado",NA,"Brandon Moss","2.38%",0
138,777705075,"horsetooth (2/3)",0,128.75,"P Drew Pomeranz P Alex Cobb OF Mookie Betts OF Corey Dickerson 3B Miguel Sanó OF Yoenis Céspedes 1B Logan Morrison 2B Ian Happ C Sandy Leon SS Adeiny Hechavarria",NA,"Brandon Crawford","2.38%",5
139,777757381,"kmancuso",0,128.6,"P Max Scherzer P Kenta Maeda OF Mookie Betts SS Asdrúbal Cabrera OF Domingo Santana 3B T.J. Rivera OF Austin Slater 1B Luis Valbuena C Yan Gomes 2B Taylor Featherston",NA,"Robbie Grossman","2.38%",5
140,777762822,"Woodpiles32",0,127.75,"P Luis Severino P Taijuan Walker OF Bryce Harper 1B Joey Votto OF Khris Davis OF Steven Souza Jr. 3B Nicholas Castellanos 2B Jonathan Schoop C Sandy Leon SS Freddy Galvis",NA,"John Jaso","2.21%",17
141,777680906,"sliddy",0,127.55,"P Kenta Maeda P Drew Pomeranz 2B Robinson Canó 1B Lucas Duda 3B Justin Turner OF Ian Happ C Robinson Chirinos OF Christian Yelich SS Adam Rosales OF Jorge Soler",NA,"Carlos Santana","2.21%",18
142,777690143,"tonzoo (4/4)",0,127.45,"P Max Scherzer P Sean Manaea 1B Ian Desmond 2B Brian Dozier OF Yasiel Puig 3B Manny Machado OF Scott Schebler OF Mark Trumbo SS Trevor Story C Kevan Smith",NA,"Jesse Chávez","2.04%",9.65
143,777722671,"SDEE",0,127.35,"P Kenta Maeda P Sean Manaea OF Mookie Betts 2B Robinson Canó 3B Travis Shaw OF Andrew McCutchen OF Melky Cabrera 1B Albert Pujols SS Alcides Escobar C Tucker Barnhart",NA,"Kevan Smith","2.04%",2
144,777685669,"SUNSET76 (8/15)",0,127.3,"P Max Scherzer P Jake Arrieta 3B Anthony Rendon OF Michael A. Taylor 2B Brian Dozier OF Brian Goodwin C Matt Wieters 1B Tommy Joseph SS Wilmer Difo OF Byron Buxton",NA,"Mark Reynolds","2.04%",0
145,777637405,"dpg188 (1/2)",0,127.1,"P Kenta Maeda P James Paxton OF Andrew Benintendi OF Jackie Bradley Jr. 1B Miguel Cabrera OF Steven Souza Jr. C Alex Avila 3B Nicholas Castellanos 2B Ian Happ SS Orlando Arcia",NA,"Orlando Arcia","2.04%",17
145,777643966,"dpg188 (2/2)",0,127.1,"P Kenta Maeda P James Paxton OF Andrew Benintendi OF Jackie Bradley Jr. 1B Miguel Cabrera OF Steven Souza Jr. C Alex Avila 3B Nicholas Castellanos 2B Ian Happ SS Orlando Arcia",NA,"Lucas Duda","2.04%",2
147,777712375,"jawjr (1/2)",0,126.7,"P Max Scherzer P Taijuan Walker OF J.D. Martinez 1B Anthony Rizzo OF Jackie Bradley Jr. 2B Dee Gordon C Brian McCann 3B Maikel Franco SS Jorge Polanco OF Matt Olson",NA,"José Bautista","2.04%",5
147,777719740,"jawjr (2/2)",0,126.7,"P Max Scherzer P Taijuan Walker OF J.D. Martinez 1B Anthony Rizzo OF Jackie Bradley Jr. 2B Dee Gordon C Brian McCann 3B Maikel Franco SS Jorge Polanco OF Matt Olson",NA,"Jason Castro","2.04%",7
147,777754457,"ffmatt1",0,126.7,"P Max Scherzer P Taijuan Walker 3B Justin Turner OF Marwin González SS Didi Gregorius 2B Jed Lowrie OF Jorge Bonifacio 1B Yuli Gurriel C Jason Castro OF Clint Frazier",NA,"Seth Smith","2.04%",11
150,777761905,"hawk2116 (3/10)",0,126.45,"P Max Scherzer P Sean Manaea OF Giancarlo Stanton C Salvador Perez OF David Peralta 1B Justin Bour 2B Jonathan Schoop OF Eric Thames 3B Derek Dietrich SS Ramón Torres",NA,"Hanley Ramirez","2.04%",26
150,777771424,"Demskins21",0,126.45,"P Max Scherzer P Sean Manaea 1B Joey Votto 2B Chris Taylor OF Gregory Polanco 3B Martín Prado OF Jon Jay SS Orlando Arcia OF Clint Frazier C Caleb Joseph",NA,"José Reyes","2.04%",0
152,777699212,"dayden",0,126.35,"P Kenta Maeda P Trevor Williams SS Jean Segura OF Khris Davis OF Ryan Braun OF Andrew Benintendi 1B Eric Hosmer 3B Adrián Béltre 2B Ian Happ C Mike Zunino",NA,"Mike Fiers","2.04%",19.4
152,777720359,"canucme100",0,126.35,"P Kenta Maeda P Sean Manaea OF Cody Bellinger 1B Anthony Rizzo OF Andrew Benintendi OF Melky Cabrera 2B Ian Happ 3B Manny Machado C René Rivera SS Freddy Galvis",NA,"Ian Desmond","2.04%",6
154,777779385,"baller503",0,126.25,"P Kevin Gausman P Héctor Santiago OF Cody Bellinger 2B Robinson Canó 3B José Ramírez OF J.D. Martinez C Gary Sánchez 1B Mark Reynolds OF Yoenis Céspedes SS Francisco Lindor",NA,"Dansby Swanson","2.04%",0
155,777651976,"wlcjr1963",0,125.6,"P Max Scherzer P Rafael Montero 3B Miguel Sanó 1B Logan Morrison 2B Brian Dozier OF Matt Kemp OF Christian Yelich OF Mallex Smith C Russell Martin SS Trevor Story",NA,"Carlos Gómez","1.87%",3
155,777737269,"pittpantherfeet (1/2)",0,125.6,"P Max Scherzer P Rafael Montero SS Asdrúbal Cabrera 3B Adrián Béltre 2B Whit Merrifield OF Adam Jones 1B Eric Thames OF Scott Schebler C Russell Martin OF Mark Trumbo",NA,"Kyle Seager","1.87%",0
157,777708221,"parks1979",0,125.5,"P Luis Severino P Sean Manaea 3B Justin Turner 1B Edwin Encarnacion OF Stephen Piscotty OF Melky Cabrera OF Brandon Belt 2B Jonathan Schoop C Robinson Chirinos SS Addison Russell",NA,"Chase Utley","1.87%",0
158,777709963,"alfred1834 (2/2)",0,125.3,"P Luis Severino P Jeff Samardzija 3B Josh Donaldson 1B Yonder Alonso OF Melky Cabrera OF Brandon Belt OF Adam Frazier SS Eric Sogard C Robinson Chirinos 2B Whit Merrifield",NA,"Jhoulys Chacin","1.87%",21.85
159,777762828,"SkippyJay97 (3/3)",0,125.25,"P Max Scherzer P Jeff Samardzija 1B Logan Morrison 2B Jonathan Schoop OF Adam Jones 3B Manny Machado OF Seth Smith OF Mark Trumbo C Jason Castro SS Ramón Torres",NA,"Kevin Pillar","1.87%",0
160,777782036,"Megatron8135",0,125.2,"P Jeff Samardzija P Mike Clevinger 2B José Ramírez OF Corey Dickerson OF Brett Gardner SS Asdrúbal Cabrera C J.T. Realmuto OF Jacoby Ellsbury 3B Manny Machado 1B Trey Mancini",NA,"Joe Panik","1.87%",7
161,777745668,"vonta88",0,125.15,"P Max Scherzer P Travis Wood SS Chris Owings OF Khris Davis OF Billy Hamilton C Salvador Perez 3B José Reyes 2B Jonathan Schoop OF John Jaso 1B T.J. Rivera",NA,"Tommy Joseph","1.87%",8
162,777677850,"brando66",0,125.1,"P Kenta Maeda P James Paxton OF Khris Davis 2B Scooter Gennett OF Steven Souza Jr. 3B Ryon Healy 1B Logan Morrison C J.T. Realmuto OF Marcell Ozuna SS Orlando Arcia",NA,"Rubén Tejada","1.87%",9
162,777687584,"Keddy008 (2/2)",0,125.1,"P Max Scherzer P Nick Pivetta OF Lonnie Chisenhall OF Steven Souza Jr. 1B Logan Morrison 3B Josh Donaldson 2B Jonathan Schoop OF Trey Mancini SS Orlando Arcia C Yan Gomes",NA,"José Iglesias","1.87%",4
164,777675024,"thing2.5",0,124.95,"P James Paxton P Sean Manaea OF Aaron Judge OF Bryce Harper OF Cody Bellinger SS Carlos Correa 1B Anthony Rizzo 3B Miguel Andújar C Juan Centeno 2B Drew Robinson",NA,"Josh Reddick","1.70%",9
165,777761906,"hawk2116 (4/10)",0,124.9,"P Carlos Martínez P Kenta Maeda 1B Anthony Rizzo 3B Kris Bryant C J.T. Realmuto 2B Whit Merrifield OF Christian Yelich SS Javier Báez OF Seth Smith OF Matt Olson",NA,"Jed Lowrie","1.70%",0
165,777761907,"hawk2116 (5/10)",0,124.9,"P Carlos Martínez P Kenta Maeda 3B Kris Bryant C Salvador Perez OF Brandon Belt 1B Justin Bour 2B Whit Merrifield OF Eric Thames OF Christian Yelich SS JT Riddle",NA,"Nick Pivetta","1.70%",22.75
167,777718717,"retoohstyoh",0,124.6,"P Carlos Martínez P Jake Arrieta OF Chris Owings 3B Miguel Sanó 2B Dustin Pedroia 1B Eric Hosmer OF Aaron Altherr OF Robbie Grossman C Andrew Knapp SS Alcides Escobar",NA,"Yolmer Sánchez","1.70%",18
168,777710773,"JohnCriton (1/6)",0,124.45,"P Max Scherzer P Sean Manaea OF Jorge Bonifacio 2B Brian Dozier OF Matt Joyce OF Yasiel Puig 1B Brandon Belt SS Addison Russell 3B Cory Spangenberg C Caleb Joseph",NA,"José Pirela","1.70%",14
168,777718198,"JohnCriton (3/6)",0,124.45,"P Max Scherzer P Sean Manaea OF Jorge Bonifacio 2B Brian Dozier OF Matt Joyce OF Yasiel Puig 1B Brandon Belt SS Addison Russell 3B Cory Spangenberg C Caleb Joseph",NA,"Brandon Drury","1.70%",12
170,777779078,"wrigleyrat",0,124.3,"P Max Scherzer P Jake Arrieta 1B Ryon Healy 2B Ben Zobrist 3B Todd Frazier OF Trey Mancini SS Addison Russell OF Gregory Polanco C Chris Iannetta OF Mark Trumbo",NA,"Ender Inciarte","1.70%",13
171,777630783,"Adi2zz6le",0,124.1,"P Drew Pomeranz P Travis Wood OF Bryce Harper SS Carlos Correa 3B Jake Lamb OF Giancarlo Stanton OF Chris Young 1B Matt Carpenter 2B Yolmer Sánchez C Yan Gomes",NA,"Ben Gamel","1.53%",4
172,777700033,"spencerspn7 (11/13)",0,123.8,"P James Paxton P Jake Arrieta 1B Paul Goldschmidt 3B Jake Lamb SS Chris Owings OF Khris Davis C Salvador Perez OF Grégor Blanco 2B Brandon Drury OF Clint Frazier",NA,"Yan Gomes","1.53%",8
173,777761941,"nathan2795",0,123.65,"P Nick Pivetta P Héctor Santiago 2B José Ramírez OF J.D. Martinez C Gary Sánchez 3B Travis Shaw SS Jean Segura OF Chris Owings 1B Ryan Zimmerman OF Corey Dickerson",NA,"Matt Kemp","1.53%",10
174,777672714,"jbuffa",0,123.6,"P Max Scherzer P Rafael Montero OF J.D. Martinez SS Asdrúbal Cabrera 3B Evan Longoria 2B Whit Merrifield 1B John Jaso OF Brandon Nimmo C Jonathan Lucroy OF Clint Frazier",NA,"Josh Bell","1.53%",0
175,777692388,"spencerspn7 (1/13)",0,123.4,"P Max Scherzer P Tim Adleman 1B José Abreu OF Steven Souza Jr. OF Billy Hamilton C Salvador Perez 3B Todd Frazier OF Melky Cabrera 2B Yolmer Sánchez SS Tim Anderson",NA,"Justin Smoak","1.53%",10
176,777728946,"DeeMac74",0,123.15,"P Max Scherzer P Júnior Guerra SS Andrelton Simmons 3B Nicholas Castellanos 1B Josh Bell 2B Jonathan Schoop OF Manuel Margot OF Eric Thames C Chris Herrmann OF John Jaso",NA,"Mitch Haniger","1.53%",0
177,777520881,"laballer620",0,122.65,"P Max Scherzer P Justin Verlander OF Melky Cabrera SS Zack Cozart 1B Eric Thames 3B Manny Machado C Mike Zunino 2B Javier Báez OF John Jaso OF Byron Buxton",NA,"Cory Spangenberg","1.53%",0
178,777635905,"learj7",0,122.35,"P Luis Severino P Jake Arrieta 1B Paul Goldschmidt OF Charlie Blackmon OF Steven Souza Jr. 2B Brian Dozier 3B Josh Donaldson C Willson Contreras OF Ian Happ SS Trevor Story",NA,"Marwin González","1.36%",16
179,777759093,"Iate_nemo",0,122.05,"P Sean Manaea P Jake Arrieta OF Bryce Harper OF Charlie Blackmon 3B Kris Bryant OF Michael A. Taylor SS Didi Gregorius 1B Yonder Alonso 2B Jonathan Schoop C Willson Contreras",NA,"Matt Carpenter","1.36%",5
180,777742739,"ximib32d",0,121.8,"P James Paxton P Jake Arrieta OF Aaron Judge 1B Paul Goldschmidt 3B Kris Bryant OF Aaron Altherr C Willson Contreras 2B Ian Happ OF Mallex Smith SS Brandon Crawford",NA,"Edwin Encarnacion","1.36%",26
181,777757455,"Deondree",0,121.75,"P Jeff Samardzija P James Paxton SS Elvis Andrus 1B Anthony Rizzo 3B Adrián Béltre OF Ben Zobrist 2B Ian Happ C Brian McCann OF Scott Schebler OF Clint Frazier",NA,"Nicholas Castellanos","1.36%",18
182,777772225,"Moses1996",0,121.35,"P Luis Severino P Jake Arrieta OF Bryce Harper 1B Anthony Rizzo OF José Bautista 2B Dustin Pedroia C Yadier Molina 3B Josh Donaldson SS Zack Cozart OF Brett Eibner",NA,"Chris Iannetta","1.36%",5
183,777767686,"dave2503",0,121.15,"P Max Scherzer P Travis Wood OF Bryce Harper 1B Anthony Rizzo OF Charlie Blackmon 3B Josh Donaldson 2B Jonathan Schoop OF Mallex Smith C Jonathan Lucroy SS Dansby Swanson",NA,"Albert Pujols","1.36%",2
184,777782833,"mello610",0,120.65,"P Max Scherzer P Justin Verlander 1B Miguel Cabrera 2B Brian Dozier OF Ian Happ OF Adam Jones OF Eric Thames 3B Manny Machado C Ryan Hanigan SS Ramón Torres",NA,"Raimel Tapia","1.36%",0
185,777761104,"moneymetalcakes",0,120.45,"P Max Scherzer P Sean Manaea 3B Evan Longoria 1B Logan Morrison 2B Jonathan Schoop OF Daniel Nava C Kurt Suzuki OF Seth Smith SS Freddy Galvis OF Jon Jay",NA,"Mitch Moreland","1.36%",5
186,777685629,"SUNSET76 (2/15)",0,120.3,"P Max Scherzer P Jake Arrieta OF Charlie Blackmon 2B Brian Dozier OF Shin-soo Choo OF Delino DeShields 1B Mike Napoli SS Freddy Galvis C Jonathan Lucroy 3B Pete Kozma",NA,"Caleb Joseph","1.36%",13
186,777685638,"SUNSET76 (3/15)",0,120.3,"P Max Scherzer P Jake Arrieta SS Elvis Andrus OF Carlos Gómez 3B Adrián Béltre C Robinson Chirinos 1B Mike Napoli OF Chris Herrmann OF Byron Buxton 2B Taylor Featherston",NA,"Matt Wieters","1.36%",7
186,777689812,"cdknisal",0,120.3,"P Max Scherzer P Jake Arrieta 3B Miguel Sanó OF Giancarlo Stanton 2B Jonathan Schoop 1B Eric Thames OF Mallex Smith SS Troy Tulowitzki C Jonathan Lucroy OF Matt Olson",NA,"Michael A. Taylor","1.36%",7
189,777674198,"griffin777 (4/15)",0,120.25,"P Max Scherzer P Héctor Santiago 1B Joey Votto SS Carlos Correa OF Ryan Braun 2B Jonathan Schoop OF Adam Jones 3B Manny Machado OF Mark Trumbo C Yan Gomes",NA,"Alen Hanson","1.36%",9
190,777740393,"buchris532 (5/11)",0,119.7,"P Alex Cobb P Tyson Ross OF Mookie Betts OF Andrew Benintendi OF Jackie Bradley Jr. 3B Miguel Sanó 1B Eric Hosmer C Salvador Perez 2B Brian Dozier SS Eduardo Escobar",NA,"Adam Engel","1.36%",2
191,777729061,"hsgoalie",0,119.6,"P Max Scherzer P Kenta Maeda C Alex Avila OF Hernán Pérez 1B Joe Mauer 2B Ian Happ 3B T.J. Rivera SS Trevor Story OF Clint Frazier OF Byron Buxton",NA,"David Peralta","1.36%",0
192,777692096,"Mo.Del.Sol",0,119.45,"P Max Scherzer P Sean Manaea OF Charlie Blackmon OF Steven Souza Jr. SS Eric Sogard 1B Eric Thames C Brian McCann OF Mark Trumbo 2B Danny Espinosa 3B Luis Valbuena",NA,"Gregory Polanco","1.36%",7
193,777672266,"Wormjdh",0,119.15,"P Justin Verlander P Jhoulys Chacin 2B Robinson Canó 3B José Ramírez 1B Mark Reynolds OF Ryan Braun OF Steven Souza Jr. C Salvador Perez OF Melky Cabrera SS Javier Báez",NA,"Bruce Maxwell","1.36%",7
194,777688682,"Jaymars17",0,118.6,"P Max Scherzer P Rafael Montero OF Ryan Braun OF Ian Desmond 2B Chase Utley OF Christian Yelich 3B Eduardo Escobar C René Rivera 1B T.J. Rivera SS Troy Tulowitzki",NA,"Stephen Piscotty","1.36%",5
195,777739846,"buchris532 (4/11)",0,118.55,"P Drew Pomeranz P Tyson Ross OF Mookie Betts C Gary Sánchez OF Andrew Benintendi 3B Miguel Sanó 1B Logan Morrison 2B Brian Dozier SS Eduardo Escobar OF Clint Frazier",NA,"Hunter Pence","1.36%",4
196,777707711,"jmeyer215",0,117.75,"P James Paxton P Héctor Santiago OF George Springer OF Mookie Betts 3B Kyle Seager 2B Chris Taylor C Buster Posey SS Francisco Lindor OF Billy Hamilton 1B Carlos Santana",NA,"Jason Kipnis","1.36%",2
196,777713547,"JB48",0,117.75,"P Drew Pomeranz P Alex Cobb 1B Anthony Rizzo 3B Justin Turner OF Yoenis Céspedes 2B Dustin Pedroia OF Ender Inciarte OF Brandon Belt C Robinson Chirinos SS Troy Tulowitzki",NA,"Joc Pederson","1.36%",7
198,777687386,"Caiman",0,117.65,"P Mike Fiers P Tyson Ross 2B Robinson Canó SS Jean Segura OF Corey Dickerson 3B Kris Bryant 1B Eric Hosmer OF Cameron Maybin C Willson Contreras OF Christian Yelich",NA,"Luis Valbuena","1.36%",5
199,777733903,"joshv651981",0,117.25,"P Max Scherzer P Jeff Samardzija OF Jacoby Ellsbury 3B Chase Headley 2B Javier Báez 1B Tommy Joseph C Russell Martin SS Freddy Galvis OF Mark Trumbo OF Jorge Soler",NA,"Denard Span","1.36%",0
200,777709993,"brasstwo",0,117,"P Max Scherzer P Carlos Martínez OF Brandon Belt 3B Maikel Franco SS Jordy Mercer OF Steve Pearce OF Adam Engel 2B Dixon Machado 1B Matt Davidson C Kevan Smith",NA,"Jordy Mercer","1.36%",16
201,777641763,"skeeter1981",0,116.75,"P German Márquez P Travis Wood OF Aaron Judge OF Bryce Harper 1B Cody Bellinger SS Carlos Correa 3B Nolan Arenado OF Charlie Blackmon C Chris Iannetta 2B Danny Espinosa",NA,"Maikel Franco","1.36%",15
202,777758504,"bunny2016 (3/3)",0,116.6,"P Max Scherzer P Rafael Montero OF Jorge Bonifacio OF Yasiel Puig OF Melky Cabrera 1B Josh Bell 3B Manny Machado C Brian McCann 2B Alen Hanson SS Adam Rosales",NA,"Chris Stewart","1.19%",0
203,777691777,"pepsiluver13 (3/6)",0,116.45,"P Max Scherzer P Sean Manaea OF Khris Davis 3B Ryon Healy 1B Yonder Alonso OF Matt Joyce C Chris Herrmann 2B José Pirela OF Matt Olson SS Carlos Asuaje",NA,"René Rivera","1.19%",2
203,777692121,"jimiobo43 (1/4)",0,116.45,"P Max Scherzer P Sean Manaea 1B Eric Hosmer 3B Hernán Pérez SS Eric Sogard 2B Yolmer Sánchez C Manny Piña OF Steve Pearce OF Mikie Mahtook OF Mark Trumbo",NA,"Adam Frazier","1.19%",3
203,777716331,"BostonRob25 (4/5)",0,116.45,"P Max Scherzer P Sean Manaea 3B Miguel Sanó OF Aaron Altherr OF Brandon Belt 1B Josh Bell 2B Javier Báez SS Freddy Galvis OF Clint Frazier C Kevan Smith",NA,"Eugenio Suárez","1.19%",2
206,777722544,"BostonRob25 (5/5)",0,116.4,"P Drew Pomeranz P Sean Manaea OF Mookie Betts OF Andrew Benintendi OF Chris Taylor 3B Miguel Sanó 1B Ryon Healy 2B Jed Lowrie SS Freddy Galvis C Kevan Smith",NA,"Joe Biagini","1.19%",4.8
206,777708443,"eladk (2/2)",0,116.4,"P Max Scherzer P Tim Adleman 1B Justin Smoak 2B Scooter Gennett C Alex Avila 3B Todd Frazier OF Andrew Romine OF Bradley Zimmer SS Jordy Mercer OF Austin Slater",NA,"Wilmer Difo","1.19%",7
208,777736056,"dandemy",0,116.3,"P Max Scherzer P Jake Arrieta 1B Anthony Rizzo OF Charlie Blackmon 2B Brian Dozier 3B Josh Donaldson OF Mallex Smith C Jonathan Lucroy SS Dansby Swanson OF Byron Buxton",NA,"Kendrys Morales","1.19%",4
208,777751299,"wjr1975",0,116.3,"P Max Scherzer P Jake Arrieta OF Charlie Blackmon C Salvador Perez 2B Brian Dozier 3B Josh Donaldson 1B Eric Thames OF Mallex Smith SS Dansby Swanson OF Byron Buxton",NA,"Dee Gordon","1.19%",0
210,777681716,"griffin777 (13/15)",0,116.15,"P Max Scherzer P Travis Wood OF Ryan Braun OF Yoenis Céspedes 1B Eric Hosmer OF Steven Souza Jr. C Salvador Perez 2B Whit Merrifield 3B Eugenio Suárez SS Troy Tulowitzki",NA,"Cameron Maybin","1.19%",2
211,777682945,"Lnash5",0,116.05,"P Rafael Montero P Travis Wood OF Aaron Judge OF Bryce Harper SS Carlos Correa 2B José Altuve OF Nelson Cruz 3B Kris Bryant 1B Eric Hosmer C Robinson Chirinos",NA,"Yadier Molina","1.19%",0
212,777743820,"bills58 (2/4)",0,116,"P Jeff Samardzija P Sean Manaea OF Cody Bellinger SS Corey Seager 3B Justin Turner 2B Chase Utley OF Marcell Ozuna C Yasmani Grandal OF Raimel Tapia 1B Matt Davidson",NA,"Grégor Blanco","1.19%",3
213,777682265,"griffin777 (15/15)",0,115.95,"P Mike Clevinger P Jesse Chávez OF Cody Bellinger 1B Joey Votto SS Carlos Correa 2B Daniel Murphy 3B Justin Turner OF Joc Pederson OF Yasiel Puig C Yasmani Grandal",NA,"Nick Williams","1.02%",8
214,777732968,"Joelweeks98",0,115.3,"P Kenta Maeda P Julio Teheran 2B José Ramírez OF Charlie Blackmon 3B Miguel Sanó SS Didi Gregorius C Salvador Perez 1B Logan Morrison OF Matt Kemp OF Eric Thames",NA,"Ryan Hanigan","1.02%",3
215,777748724,"Cantonborn (2/2)",0,114.95,"P James Paxton P Sean Manaea 2B Robinson Canó OF J.D. Martinez OF Charlie Blackmon 3B Kyle Seager 1B José Abreu OF Melky Cabrera SS Freddy Galvis C Kevan Smith",NA,"Kevin Gausman","1.02%",35.35
216,777760748,"ttt1971",0,114.8,"P James Paxton P Jake Arrieta SS Elvis Andrus OF Corey Dickerson 1B Anthony Rizzo OF Chris Taylor 3B Miguel Sanó OF Ender Inciarte 2B Jonathan Schoop C Caleb Joseph",NA,"Kole Calhoun","1.02%",4
217,777561743,"Xtreme20s",0,114.65,"P Drew Pomeranz P Kevin Gausman OF Aaron Judge SS Elvis Andrus OF Charlie Blackmon 3B Justin Turner 2B Jonathan Schoop C Robinson Chirinos 1B Eric Thames OF Derek Fisher",NA,"Eddie Rosario","1.02%",3
218,777692523,"spencerspn7 (7/13)",0,114.45,"P Max Scherzer P Trevor Williams 3B Miguel Sanó 1B Eric Hosmer C Salvador Perez OF Jorge Bonifacio 2B Brian Dozier OF Mallex Smith OF Alex Gordon SS Alcides Escobar",NA,"Jedd Gyorko","1.02%",2
219,777724738,"buchris532 (2/11)",0,114.3,"P Luis Severino P Jeff Samardzija OF Giancarlo Stanton OF Steven Souza Jr. 3B Evan Longoria C J.T. Realmuto 1B Justin Bour 2B Whit Merrifield OF Mallex Smith SS Alcides Escobar",NA,"Miguel Andújar","1.02%",0
220,777742616,"fakpeddie (1/2)",0,114.25,"P Alex Cobb P Joe Biagini OF Mookie Betts OF Bryce Harper 1B Ryan Zimmerman OF Justin Upton SS Francisco Lindor C Alex Avila 3B Evan Longoria 2B Jonathan Schoop",NA,"Drew Robinson","1.02%",0
