"Rank","EntryId","EntryName","TimeRemaining","Points","Lineup","X","Player","X.Drafted","FPTS"
220,777742885,"fakpeddie (2/2)",0,114.25,"P Alex Cobb P Joe Biagini OF Mookie Betts OF Bryce Harper 1B Ryan Zimmerman OF Justin Upton SS Francisco Lindor C Alex Avila 3B Evan Longoria 2B Jonathan Schoop",NA,"Juan Centeno","1.02%",0
222,777757617,"Debills",0,113.95,"P James Paxton P Sean Manaea SS Jean Segura OF Corey Dickerson 3B Miguel Sanó C Salvador Perez OF Jorge Bonifacio 1B Logan Morrison 2B Whit Merrifield OF Mallex Smith",NA,"Domingo Santana","1.02%",13
223,777732559,"hambonelicious (1/2)",0,113.65,"P Max Scherzer P Drew Pomeranz 3B Miguel Sanó C Salvador Perez 1B Joe Mauer OF Robbie Grossman 2B Yolmer Sánchez SS Alcides Escobar OF Brandon Moss OF Matt Olson",NA,"Ty Kelly","1.02%",2
224,777778962,"mhb1892",0,113.6,"P Max Scherzer P Rafael Montero 1B Paul Goldschmidt C Alex Avila 3B Evan Longoria 2B Jonathan Schoop OF Grégor Blanco OF Christian Yelich OF Matt Olson SS JT Riddle",NA,"Jacoby Ellsbury","1.02%",0
225,777768536,"matrixs44",0,113.3,"P Luis Severino P Jeff Samardzija 1B Joey Votto OF Billy Hamilton C Alex Avila SS Zack Cozart OF Marcell Ozuna 2B Javier Báez 3B Martín Prado OF Jon Jay",NA,"Brandon Nimmo","1.02%",0
226,777719632,"Agency10",0,113.25,"P Max Scherzer P Dan Straily OF Bryce Harper 2B Daniel Murphy 3B Evan Longoria OF Kevin Pillar OF Steve Pearce 1B Matt Davidson SS José Iglesias C Chris Stewart",NA,"Randal Grichuk","1.02%",0
226,777732520,"Dseery15",0,113.25,"P Mike Clevinger P German Márquez OF George Springer OF Aaron Judge SS Carlos Correa OF Charlie Blackmon 3B Jedd Gyorko 1B Ian Desmond 2B Joe Panik C Jonathan Lucroy",NA,"Manuel Margot","1.02%",21
226,777767677,"srken",0,113.25,"P Drew Pomeranz P Jake Arrieta 1B Paul Goldschmidt OF Corey Dickerson 3B Kris Bryant OF Steven Souza Jr. OF Aaron Altherr C Willson Contreras 2B Ian Happ SS Brandon Crawford",NA,"Júnior Guerra","1.02%",7.8
229,777685123,"jdkenn (6/7)",0,113.2,"P Dan Straily P Mike Clevinger OF Cody Bellinger SS Jean Segura 3B Justin Turner 1B José Abreu OF Billy Hamilton C Salvador Perez 2B Brian Dozier OF Brandon Belt",NA,"Logan Forsythe","1.02%",4
230,777685642,"SUNSET76 (4/15)",0,113.15,"P Max Scherzer P Travis Wood OF George Springer SS Carlos Correa 2B José Altuve OF Josh Reddick C Brian McCann 1B Tommy Joseph OF Brandon Moss 3B Rubén Tejada",NA,"Adam Lind","1.02%",7
231,777661986,"jaduff28 (3/3)",0,113.1,"P Kenta Maeda P James Paxton OF George Springer SS Carlos Correa 2B José Altuve 1B Logan Morrison OF Melky Cabrera OF Steve Pearce 3B Derek Dietrich C Caleb Joseph",NA,"Tim Anderson","1.02%",3
232,777689564,"Tburke34",0,112.75,"P Max Scherzer P Luis Severino 3B Miguel Sanó C Robinson Chirinos 2B Javier Báez 1B Tommy Joseph OF Mark Trumbo OF Clint Frazier SS Brandon Crawford OF Austin Slater",NA,"Joe Mauer","1.02%",0
233,777710064,"bobrci81 (2/2)",0,112.7,"P Max Scherzer P Taijuan Walker 2B Daniel Murphy OF Ender Inciarte 1B Ryon Healy OF Yasiel Puig OF Grégor Blanco 3B Yunel Escobar C Matt Wieters SS Dansby Swanson",NA,"Christian Vázquez","0.85%",5
234,777525926,"Slonging",0,112.55,"P Carlos Martínez P Dan Straily 2B Robinson Canó OF Ben Gamel OF Marwin González 1B Matt Carpenter C Robinson Chirinos OF John Jaso 3B Deven Marrero SS Freddy Galvis",NA,"Derek Dietrich","0.85%",22
235,777684444,"jdkenn (5/7)",0,112.4,"P Max Scherzer P Tim Adleman 3B Justin Turner OF Steven Souza Jr. SS Didi Gregorius OF Ben Zobrist 1B Logan Morrison C J.T. Realmuto OF Manuel Margot 2B Taylor Featherston",NA,"Adam Rosales","0.85%",4
235,777734320,"quimper1",0,112.4,"P Max Scherzer P Tim Adleman OF Michael A. Taylor OF Aaron Altherr C Salvador Perez 1B Adam Lind OF Shin-soo Choo 2B Brandon Drury 3B T.J. Rivera SS Wilmer Difo",NA,"Dixon Machado","0.85%",10
237,777674279,"griffin777 (5/15)",0,112.1,"P Nick Pivetta P Taijuan Walker 1B Joey Votto 2B José Altuve C Gary Sánchez SS Chris Owings OF Ryan Braun 3B Kris Bryant OF Keon Broxton OF Eric Thames",NA,"Yonder Alonso","0.85%",7
238,777709696,"Groundhog2265",0,111.5,"P Sean Manaea P Mike Fiers 3B Justin Turner OF Ryan Braun OF Michael Brantley 1B Eric Hosmer SS Francisco Lindor OF Lonnie Chisenhall C Alex Avila 2B Chase Utley",NA,"Matt Adams","0.85%",0
239,777680652,"1124Rocket",0,111.4,"P Max Scherzer P Julio Teheran C Buster Posey 1B Matt Adams OF Ender Inciarte OF Hunter Pence OF Matt Kemp 3B Martín Prado SS Erik González 2B Ryan Goins",NA,"Wilson Ramos","0.85%",0
240,777767295,"Barnking44 (2/2)",0,111.25,"P Jake Arrieta P Mike Clevinger OF George Springer OF Aaron Judge 1B Paul Goldschmidt OF Andrew Benintendi C Buster Posey 2B Brian Dozier 3B Matt Davidson SS Brandon Crawford",NA,"Ryan Zimmerman","0.85%",2
241,777678436,"tonzoo (3/4)",0,111.15,"P Dan Straily P Tyson Ross OF Mookie Betts OF Charlie Blackmon OF Jackie Bradley Jr. 1B Ian Desmond 3B Ryon Healy SS Didi Gregorius C Salvador Perez 2B Brian Dozier",NA,"Tommy Pham","0.85%",18
242,777625822,"123usa",0,111,"P Max Scherzer P Jesse Chávez 1B Edwin Encarnacion C Salvador Perez 3B Evan Longoria OF Lorenzo Cain 2B Kiké Hernández OF Matt Kemp OF Kole Calhoun SS Javier Báez",NA,"Yuli Gurriel","0.85%",28
243,777513179,"mudmann13",0,110.4,"P Mike Clevinger P Trevor Williams OF Aaron Judge SS Corey Seager 2B Robinson Canó OF Adam Duvall OF Ryan Braun 3B Manny Machado C Mike Zunino 1B Trey Mancini",NA,"Jorge Polanco","0.85%",0
244,777760614,"TheChiT25",0,110.35,"P Kenta Maeda P Sean Manaea OF Mookie Betts 2B José Altuve OF Jackie Bradley Jr. OF Steven Souza Jr. SS Didi Gregorius 1B Justin Bour 3B Martín Prado C Devin Mesoraco",NA,"Brandon Phillips","0.85%",5
245,777715157,"avo4077",0,110.2,"P Max Scherzer P James Paxton 3B Miguel Sanó 1B Logan Morrison 2B Brian Dozier SS Zack Cozart OF Robbie Grossman C Jesús Sucre OF Matt Olson OF Byron Buxton",NA,"Derek Fisher","0.68%",0
246,777691090,"thedew42 (2/2)",0,110.1,"P Kevin Gausman P Nick Pivetta OF Aaron Judge OF J.D. Martinez 3B Nolan Arenado OF Charlie Blackmon 2B Chris Taylor 1B Miguel Cabrera SS Didi Gregorius C Willson Contreras",NA,"Lorenzo Cain","0.68%",0
246,777704871,"dmal5014 (4/4)",0,110.1,"P Kenta Maeda P James Paxton OF Aaron Judge OF Charlie Blackmon 2B Brian Dozier SS Zack Cozart 1B Eric Thames OF Marcell Ozuna C Brian McCann 3B Maikel Franco",NA,"German Márquez","0.68%",13.95
248,777718677,"soxmachine9584",0,109.95,"P James Paxton P Sean Manaea 1B Paul Goldschmidt 3B Justin Turner OF Jackie Bradley Jr. 2B Dustin Pedroia OF Lonnie Chisenhall OF Adam Jones C Manny Piña SS Troy Tulowitzki",NA,"Danny Espinosa","0.68%",3
248,777755472,"gpaniner",0,109.95,"P James Paxton P Sean Manaea 1B Anthony Rizzo OF José Bautista OF Giancarlo Stanton SS Asdrúbal Cabrera C Salvador Perez 2B Brian Dozier 3B Josh Donaldson OF Marcell Ozuna",NA,"Max Moroff","0.68%",3
250,777692401,"spencerspn7 (2/13)",0,109.75,"P Carlos Martínez P Trevor Williams 3B José Ramírez 1B Edwin Encarnacion OF Michael Brantley SS Francisco Lindor 2B Jason Kipnis C Willson Contreras OF Mallex Smith OF Jon Jay",NA,"Mike Napoli","0.68%",14
251,777779681,"mrtee1",0,109.5,"P Sean Manaea P Mike Fiers 1B Anthony Rizzo 3B Miguel Sanó OF Josh Reddick OF Giancarlo Stanton OF Yoenis Céspedes 2B Dustin Pedroia C Salvador Perez SS Zack Cozart",NA,"Rougned Odor","0.68%",3
252,777683912,"WIBrewed",0,109.35,"P Kenta Maeda P Sean Manaea 3B Nolan Arenado 1B Anthony Rizzo OF Charlie Blackmon OF Steven Souza Jr. C J.T. Realmuto SS Zack Cozart 2B Dee Gordon OF Marcell Ozuna",NA,"Darwin Barney","0.68%",3
253,777695970,"rstockley",0,109.3,"P Julio Teheran P Rafael Montero OF Aaron Judge 1B Joey Votto OF Jay Bruce 3B Nolan Arenado C Buster Posey SS José Reyes 2B Ian Happ OF Brandon Nimmo",NA,"Michael Brantley","0.68%",12
254,777701623,"JakeyB20",0,109.2,"P Max Scherzer P James Paxton C Buster Posey OF Billy Hamilton 3B Evan Longoria SS Eduardo Escobar 1B John Jaso OF Mark Trumbo OF Clint Frazier 2B Taylor Featherston",NA,"Yunel Escobar","0.68%",5
255,777706690,"Warren4594",0,109.1,"P Max Scherzer P Nick Pivetta 1B Cody Bellinger 3B Josh Donaldson 2B Joe Panik OF Melky Cabrera OF Mallex Smith SS Troy Tulowitzki C Jonathan Lucroy OF Ty Kelly",NA,"Andrew Knapp","0.68%",12
255,777747728,"Cantonborn (1/2)",0,109.1,"P Kenta Maeda P Jhoulys Chacin OF Jay Bruce C Gary Sánchez OF Khris Davis 3B Nolan Arenado SS Asdrúbal Cabrera 2B Eric Sogard OF Marcell Ozuna 1B John Jaso",NA,"Delino DeShields","0.68%",0
257,777763788,"WillyOsiris",0,108.8,"P James Paxton P Jake Arrieta 1B Paul Goldschmidt OF J.D. Martinez OF Charlie Blackmon OF José Bautista C Alex Avila 3B Josh Donaldson 2B José Pirela SS Troy Tulowitzki",NA,"Brian Goodwin","0.68%",9
258,777685621,"SUNSET76 (1/15)",0,108.3,"P Max Scherzer P Jake Arrieta SS Elvis Andrus OF Carlos Gómez 3B Adrián Béltre OF Shin-soo Choo OF Delino DeShields 1B Tommy Joseph C Héctor Sánchez 2B Taylor Featherston",NA,"Anthony Rendon","0.68%",9
259,777738078,"georgerichards9",0,108,"P Jeff Samardzija P Sean Manaea OF Jay Bruce 1B Lucas Duda 2B Dustin Pedroia SS Asdrúbal Cabrera 3B José Reyes C Willson Contreras OF Marcell Ozuna OF Jon Jay",NA,"Peter Bourjos","0.68%",3
259,777753594,"sportshead",0,108,"P José Quintana P Tim Adleman 2B Robinson Canó OF Khris Davis OF Ryan Braun OF Giancarlo Stanton 3B Evan Longoria 1B Carlos Santana C Manny Piña SS Orlando Arcia",NA,"Alex Mejia","0.51%",0
261,777746927,"EloyT (1/2)",0,107.85,"P Jeff Samardzija P Jake Arrieta SS Corey Seager 1B Anthony Rizzo 3B Kris Bryant OF Aaron Altherr C Salvador Perez 2B Brian Dozier OF Yasiel Puig OF Byron Buxton",NA,"Greg Garcia","0.51%",5
262,777766769,"lkyluke1989",0,107.75,"P James Paxton P Dan Straily OF Bryce Harper OF Charlie Blackmon 3B Justin Turner OF Yasiel Puig 2B Jonathan Schoop C Robinson Chirinos SS Zack Cozart 1B Joey Gallo",NA,"Danny Valencia","0.51%",0
263,777623470,"jusaf10 (1/2)",0,107.65,"P Drew Pomeranz P Taijuan Walker OF Aaron Judge OF Cody Bellinger 2B Robinson Canó SS Jean Segura 3B Miguel Sanó 1B Buster Posey OF Austin Slater C Chris Stewart",NA,"Mikie Mahtook","0.51%",3
264,777626072,"blacksunfire (1/2)",0,107.6,"P James Paxton P Nick Pivetta OF Aaron Judge 1B Cody Bellinger SS Corey Seager OF Chris Taylor 3B Todd Frazier OF Eddie Rosario 2B Yolmer Sánchez C Kevan Smith",NA,"Keon Broxton","0.51%",0
265,777769890,"trp123170",0,107.4,"P Max Scherzer P Tim Adleman 2B Robinson Canó C Gary Sánchez 3B Miguel Sanó OF Jacoby Ellsbury OF Adam Frazier 1B Chris Carter OF Peter Bourjos SS JT Riddle",NA,"Andrew McCutchen","0.51%",0
266,777779531,"freckles420",0,107,"P Max Scherzer P Carlos Martínez OF José Bautista OF Adam Jones OF Eric Thames 1B Kendrys Morales 3B Maikel Franco C Jesús Sucre 2B Taylor Featherston SS Rubén Tejada",NA,"Hunter Renfroe","0.51%",14
267,777752076,"ewmbabq",0,106.65,"P Max Scherzer P Drew Pomeranz OF Steven Souza Jr. OF Ender Inciarte OF Aaron Altherr C J.T. Realmuto 1B Tommy Joseph SS Freddy Galvis 3B Renato Núñez 2B Taylor Featherston",NA,"Stephen Vogt","0.51%",0
268,777662672,"JDH285 (8/12)",0,106.4,"P Sean Manaea P Mike Clevinger OF George Springer 1B Paul Goldschmidt SS Chris Owings OF José Bautista OF Yoenis Céspedes 3B Wilmer Flores C J.T. Realmuto 2B Taylor Featherston",NA,"Ian Kinsler","0.51%",0
269,777747651,"EloyT (2/2)",0,106.25,"P Drew Pomeranz P Jake Arrieta 1B Paul Goldschmidt OF Corey Dickerson 3B Kris Bryant OF Aaron Altherr C Salvador Perez 2B Brian Dozier OF Marcell Ozuna SS Brandon Crawford",NA,"Carlos Beltrán","0.51%",12
270,777684446,"motown22 (2/2)",0,106.05,"P Trevor Williams P German Márquez SS Corey Seager 2B Robinson Canó OF J.D. Martinez 1B Anthony Rizzo 3B Justin Turner OF Chris Taylor OF Yoenis Céspedes C Salvador Perez",NA,"Jae-gyun Hwang","0.51%",6
270,777766863,"barnett0472 (1/2)",0,106.05,"P Justin Verlander P Nick Pivetta 1B Cody Bellinger SS Jean Segura OF Charlie Blackmon OF Andrew Benintendi 2B Brian Dozier 3B Josh Donaldson C J.T. Realmuto OF Christian Yelich",NA,"Odúbel Herrera","0.51%",0
272,777769969,"madmase",0,105.95,"P James Paxton P Sean Manaea SS Corey Seager 1B Miguel Cabrera 3B Miguel Sanó OF Yoenis Céspedes 2B Brian Dozier OF Yasiel Puig OF Eric Thames C Jonathan Lucroy",NA,"Jaycob Brugman","0.51%",4
273,777747600,"bills58 (3/4)",0,105.55,"P Drew Pomeranz P Tyson Ross OF Aaron Judge 1B Joey Votto C Gary Sánchez 3B Miguel Sanó 2B Brian Dozier OF Christian Yelich SS Trevor Story OF Matt Olson",NA,"Martín Maldonado","0.51%",3
274,777692501,"spencerspn7 (5/13)",0,105.4,"P Max Scherzer P Tim Adleman 2B Scooter Gennett 1B Hanley Ramirez C Buster Posey OF Denard Span OF Hunter Pence SS Zack Cozart 3B Jae-gyun Hwang OF Austin Slater",NA,"Chase Headley","0.51%",7
275,777761909,"hawk2116 (7/10)",0,105.2,"P Jeff Samardzija P Justin Verlander SS Corey Seager OF Khris Davis 1B Eric Hosmer OF Jorge Bonifacio 2B Jason Kipnis C J.T. Realmuto OF Brandon Moss 3B Derek Dietrich",NA,"Travis Shaw","0.51%",0
276,777733739,"acdcrocks915 (2/2)",0,104.75,"P Jeff Samardzija P James Paxton OF Jay Bruce C Buster Posey 1B Alex Avila 2B Brian Dozier 3B Todd Frazier OF Melky Cabrera OF Shin-soo Choo SS Tim Anderson",NA,"JT Riddle","0.51%",8
276,777755925,"rookie_nm",0,104.75,"P Jeff Samardzija P James Paxton OF J.D. Martinez C Gary Sánchez OF Steven Souza Jr. 3B Evan Longoria 2B Jonathan Schoop OF Eric Thames 1B Tommy Joseph SS Alcides Escobar",NA,"Kaleb Cowart","0.34%",0
278,777728341,"geoleo",0,104.65,"P Max Scherzer P Mike Clevinger OF Cody Bellinger 2B Brian Dozier 3B Josh Harrison 1B Justin Bour C Wilson Ramos OF Mark Trumbo OF Odúbel Herrera SS Brandon Crawford",NA,"Ronald Torreyes","0.34%",0
279,777767411,"Bighaas13",0,104.6,"P Max Scherzer P Tyson Ross 1B Logan Morrison OF Brandon Belt SS Zack Cozart OF Shin-soo Choo 3B Manny Machado 2B Dee Gordon OF Scott Schebler C Russell Martin",NA,"Daniel Nava","0.34%",13
280,777761760,"Ozarkian",0,104.5,"P Carlos Martínez P James Paxton 1B Paul Goldschmidt OF Denard Span OF Stephen Piscotty C Yasmani Grandal 2B Javier Báez 3B Martín Prado OF Mark Trumbo SS Trevor Story",NA,"Andrew Romine","0.34%",5
281,777715298,"BostonRob25 (2/5)",0,104.25,"P Justin Verlander P Jake Arrieta SS Elvis Andrus OF J.D. Martinez 1B Anthony Rizzo OF Charlie Blackmon OF Andrew Benintendi 2B Dustin Pedroia 3B Matt Davidson C Kevan Smith",NA,"Nelson Cruz","0.34%",0
282,777708463,"zmarcove1",0,104.2,"P Max Scherzer P James Paxton OF Aaron Judge OF Charlie Blackmon SS Zack Cozart 1B Eric Thames OF Jaycob Brugman 3B Miguel Andújar C Juan Centeno 2B Drew Robinson",NA,"Joey Gallo","0.34%",0
283,777744939,"JaradWard",0,104,"P José Quintana P Tim Adleman 1B Paul Goldschmidt 3B Justin Turner SS Asdrúbal Cabrera OF Lonnie Chisenhall OF Aaron Altherr 2B Brian Dozier OF Christian Yelich C Yasmani Grandal",NA,"Aledmys Díaz","0.34%",0
284,777692503,"spencerspn7 (6/13)",0,103.95,"P James Paxton P Trevor Williams OF Aaron Judge C Gary Sánchez 1B Anthony Rizzo 3B Kris Bryant OF Brett Gardner SS Didi Gregorius 2B Whit Merrifield OF Clint Frazier",NA,"Tim Beckham","0.34%",2
284,777722658,"UncleDutchy",0,103.95,"P James Paxton P Sean Manaea OF Cody Bellinger OF Adam Duvall OF J.D. Martinez 1B Logan Morrison C Willson Contreras 3B Manny Machado 2B Javier Báez SS Freddy Galvis",NA,"Héctor Sánchez","0.34%",0
286,777680572,"Croooone",0,103.9,"P James Paxton P Julio Teheran 2B Robinson Canó OF Andrew McCutchen 3B Justin Turner 1B Eric Hosmer SS Didi Gregorius OF Hunter Renfroe OF Shin-soo Choo C Mike Zunino",NA,"Shane Peterson","0.34%",0
287,777739233,"Lob-Stars",0,103.75,"P Carlos Martínez P Sean Manaea 1B Paul Goldschmidt 2B José Ramírez SS Francisco Lindor 3B José Reyes OF Eric Thames OF Steve Pearce C Jonathan Lucroy OF Matt Olson",NA,"Carlos Asuaje","0.34%",5
288,777727003,"fwhited",0,103.45,"P Max Scherzer P Sean Manaea OF Billy Hamilton 2B Whit Merrifield SS Zack Cozart OF Kole Calhoun 3B Eugenio Suárez OF Scott Schebler 1B Albert Pujols C Devin Mesoraco",NA,"Bradley Zimmer","0.34%",6
288,777747456,"Smar320 (1/3)",0,103.45,"P Max Scherzer P Sean Manaea OF Brett Gardner 3B Miguel Sanó 1B Buster Posey 2B Joe Panik C Willson Contreras OF Jorge Soler OF Austin Slater SS Ramón Torres",NA,"Mike Moustakas","0.34%",0
290,777692487,"spencerspn7 (3/13)",0,103.25,"P Max Scherzer P Dan Straily C Salvador Perez 2B Jonathan Schoop SS Zack Cozart OF Adam Jones 3B Manny Machado 1B Trey Mancini OF Mark Trumbo OF Clint Frazier",NA,"Sandy Leon","0.34%",0
291,777742458,"snowman1357",0,103.15,"P Drew Pomeranz P James Paxton 2B Dustin Pedroia 3B Adrián Béltre 1B Matt Adams OF Steven Souza Jr. OF Billy Hamilton C Alex Avila OF Melky Cabrera SS Zack Cozart",NA,"Andrelton Simmons","0.34%",0
291,777674742,"griffin777 (7/15)",0,103.15,"P Max Scherzer P Travis Wood OF Cody Bellinger SS Elvis Andrus OF Carlos Gómez 3B Adrián Béltre 1B Mike Napoli C Chris Iannetta 2B Rougned Odor OF Alex Gordon",NA,"Tzu-Wei Lin","0.34%",18
293,777753603,"sabercat1",0,102.95,"P James Paxton P Sean Manaea 2B Robinson Canó OF Jay Bruce OF Khris Davis SS Didi Gregorius 3B Evan Longoria 1B Logan Morrison C Willson Contreras OF Matt Olson",NA,"D.J. Peterson","0.34%",0
294,777705815,"Domination09 (2/2)",0,102.9,"P James Paxton P Julio Teheran OF Aaron Judge 3B Jedd Gyorko OF Stephen Piscotty C Yadier Molina SS José Reyes OF Brandon Belt 1B Matt Carpenter 2B Javier Báez",NA,"Daniel Descalso","0.34%",0
295,777760544,"littlewag",0,102.85,"P Julio Teheran P Júnior Guerra OF Aaron Judge OF Cody Bellinger 2B Daniel Murphy SS Jean Segura 3B Kris Bryant OF Matt Kemp 1B Eric Thames C Russell Martin",NA,"Justin Upton","0.34%",0
296,777705727,"RSFHouston420 (4/5)",0,102.75,"P Drew Pomeranz P Alex Cobb 3B Nolan Arenado OF Charlie Blackmon OF Andrew Benintendi 2B Dustin Pedroia 1B Ian Desmond OF Steven Souza Jr. C Jonathan Lucroy SS Trevor Story",NA,"David Freese","0.34%",0
297,777692884,"rcampbell",0,102.7,"P Max Scherzer P Kevin Gausman 2B Chris Taylor OF Brett Gardner 1B Eric Hosmer 3B Josh Donaldson SS Taylor Motter OF Adam Engel C Jason Castro OF Brandon Moss",NA,"Deven Marrero","0.17%",21
298,777722843,"rtrocino",0,102.6,"P Kenta Maeda P Taijuan Walker OF Jay Bruce OF Khris Davis 3B Kris Bryant OF Andrew Benintendi 2B Dustin Pedroia C Alex Avila 1B Logan Morrison SS Addison Russell",NA,"Kiké Hernández","0.17%",0
299,777728248,"gillionick",0,102.55,"P Kenta Maeda P Drew Pomeranz 3B José Ramírez OF Corey Dickerson OF Steven Souza Jr. SS Didi Gregorius 1B Logan Morrison OF Melky Cabrera 2B Yolmer Sánchez C Devin Mesoraco",NA,"Chris Young","0.17%",0
300,777715535,"CBath",0,102.45,"P Max Scherzer P Trevor Williams OF Aaron Judge 1B Paul Goldschmidt 2B Jonathan Schoop C Willson Contreras OF Jon Jay SS Orlando Arcia 3B Jae-gyun Hwang OF Byron Buxton",NA,"José Martínez","0.17%",0
301,777726593,"jwcs45",0,102.2,"P Jake Arrieta P Rafael Montero OF Aaron Judge 1B Cody Bellinger OF J.D. Martinez C Gary Sánchez 3B Miguel Sanó 2B Brian Dozier SS Ronald Torreyes OF Mark Trumbo",NA,"Alex Bregman","0.17%",0
301,777760813,"starrstrukk",0,102.2,"P Jake Arrieta P Tyson Ross OF Aaron Judge 3B José Ramírez C Gary Sánchez OF Corey Dickerson SS Francisco Lindor 1B Logan Morrison 2B Jonathan Schoop OF Clint Frazier",NA,"Wilmer Flores","0.17%",0
303,777682093,"griffin777 (14/15)",0,102.15,"P Júnior Guerra P Taijuan Walker OF Aaron Judge SS Carlos Correa 2B Daniel Murphy 3B Nolan Arenado 1B Mark Reynolds OF Charlie Blackmon OF Ian Desmond C Chris Iannetta",NA,"Victor Martinez","0.17%",0
304,777634645,"jwtcannon",0,101.95,"P Carlos Martínez P Mike Clevinger 1B Joey Votto OF J.D. Martinez 3B Nolan Arenado OF Yoenis Céspedes 2B Ian Happ OF Trey Mancini C Kevan Smith SS Alex Mejia",NA,"Ketel Marte","0.17%",8
305,777696502,"johnz123",0,101.85,"P Julio Teheran P Júnior Guerra SS Carlos Correa OF J.D. Martinez OF Chris Owings OF Corey Dickerson 1B Anthony Rizzo 2B Ben Zobrist 3B Evan Longoria C Mike Zunino",NA,"Nomar Mazara","0.17%",0
306,777739999,"gittyup",0,101.75,"P Carlos Martínez P Sean Manaea 2B José Altuve OF Khris Davis 3B Ryon Healy 1B Logan Morrison OF Matt Joyce OF Ian Happ C Brian McCann SS Ramón Torres",NA,"Erik González","0.17%",0
307,777715820,"BostonRob25 (3/5)",0,101.4,"P Drew Pomeranz P Sean Manaea OF Aaron Judge 1B Paul Goldschmidt 2B Chris Taylor 3B Miguel Sanó OF Marcell Ozuna C Manny Piña SS Freddy Galvis OF Clint Frazier",NA,"Ryan Goins","0.17%",0
308,777766628,"wildekoyote",0,101.35,"P Kenta Maeda P Sean Manaea OF Andrew Benintendi 1B Hanley Ramirez OF Jackie Bradley Jr. 2B Dustin Pedroia SS Didi Gregorius C Alex Avila 3B Eduardo Escobar OF Scott Schebler",NA,"Evan Gattis","0.17%",0
309,777723104,"hannah2208",0,101.2,"P Kenta Maeda P Jake Arrieta OF Aaron Judge C Gary Sánchez OF Brett Gardner SS Didi Gregorius 1B Brandon Belt 3B Chase Headley 2B Javier Báez OF Seth Smith",NA,"Rajai Davis","0.17%",0
310,777679399,"wallyswahoos",0,101.15,"P Sean Manaea P Julio Teheran 1B Cody Bellinger SS Corey Seager C Gary Sánchez OF Ryan Braun 3B Todd Frazier 2B Chase Utley OF Adam Jones OF Mark Trumbo",NA,"Danny Santana","0.17%",11
310,777706072,"mrussell1982",0,101.15,"P Jeff Samardzija P Kenta Maeda 1B Anthony Rizzo OF Giancarlo Stanton 2B Brian Dozier C J.T. Realmuto OF Eric Thames 3B Manny Machado OF Mallex Smith SS Troy Tulowitzki",NA,"Mike Trout","0.17%",0
310,777725862,"dirkadude",0,101.15,"P Jeff Samardzija P Kenta Maeda 1B Anthony Rizzo OF Giancarlo Stanton 2B Brian Dozier C J.T. Realmuto OF Eric Thames 3B Manny Machado OF Mallex Smith SS Troy Tulowitzki",NA,"Pete Kozma","0.17%",2
313,777683716,"rschnase49",0,101,"P Carlos Martínez P Taijuan Walker OF Chris Owings 3B Miguel Sanó OF Tommy Pham OF Ian Desmond C Salvador Perez 2B Brian Dozier 1B Josh Bell SS Jordy Mercer",NA,"Norichika Aoki","0.17%",4
314,777630434,"angelsfanatic266",0,100.85,"P Luis Severino P Alex Cobb OF Khris Davis 1B Anthony Rizzo C Buster Posey 2B Dustin Pedroia 3B Josh Donaldson SS Zack Cozart OF Mark Trumbo OF Clint Frazier",NA,"Travis d'Arnaud","0.17%",0
315,777769603,"Trevor1489",0,100.75,"P Luis Severino P Taijuan Walker OF Bryce Harper 3B Jedd Gyorko OF Tommy Pham OF Stephen Piscotty 1B Matt Adams C Yadier Molina 2B Wilmer Difo SS Alex Mejia",NA,"Taylor Motter","0.17%",0
316,777773862,"memarrin1",0,100.65,"P Max Scherzer P Mike Clevinger OF Aaron Judge OF Mitch Haniger C Brian McCann 2B Javier Báez 1B Kendrys Morales SS Troy Tulowitzki OF Clint Frazier 3B David Freese",NA,"Max Kepler","0.17%",0
317,777679743,"theproudllama",0,100.25,"P Max Scherzer P Dan Straily OF Aaron Judge OF Cody Bellinger SS Zack Cozart 1B Eric Thames OF Seth Smith 3B Miguel Andújar C Juan Centeno 2B Drew Robinson",NA,"Matt Holliday","0.17%",0
318,777753279,"SkippyJay97 (1/3)",0,100.2,"P José Quintana P Rafael Montero OF Ryan Braun 1B Eric Hosmer C Salvador Perez OF Jorge Bonifacio 3B Hernán Pérez SS Eric Sogard 2B Whit Merrifield OF Eric Thames",NA,"Anthony Santander","0.17%",0
319,777700053,"spencerspn7 (12/13)",0,100.15,"P Drew Pomeranz P James Paxton 3B Nolan Arenado 1B Anthony Rizzo OF Charlie Blackmon OF Ian Desmond 2B Ben Zobrist C Willson Contreras OF Raimel Tapia SS Trevor Story",NA,"Adeiny Hechavarria","0.17%",0
320,777727652,"bodybyjake10",0,99.64999,"P Max Scherzer P Mike Clevinger OF Aaron Judge 3B Evan Longoria 1B Logan Morrison 2B Eric Sogard OF Mallex Smith OF Jon Jay C Jesús Sucre SS Max Moroff",NA,"Tony Wolters","0.17%",3
321,777647345,"cheaptrickmonster",0,99.6,"P Max Scherzer P Tyson Ross OF Carlos Gómez C Salvador Perez 2B Brian Dozier 3B Manny Machado SS Eduardo Escobar 1B Albert Pujols OF Raimel Tapia OF Mark Trumbo",NA,"Stephen Drew","0.17%",0
322,777678500,"KingCramp03",0,99.39999,"P Max Scherzer P Julio Teheran 1B Joey Votto OF Charlie Blackmon 2B Eric Sogard SS Zack Cozart 3B Eugenio Suárez C Jason Castro OF Brandon Moss OF Byron Buxton",NA,"Eric Young Jr.","0.17%",2
323,777772750,"allsportsman3422 (1/2)",0,99.25,"P Max Scherzer P Héctor Santiago OF Cody Bellinger 1B Paul Goldschmidt 2B Jason Kipnis 3B Josh Donaldson SS Zack Cozart OF Marcell Ozuna C Bruce Maxwell OF Clint Frazier",NA,"Tucker Barnhart","0.17%",5
324,777736221,"bills58 (1/4)",0,99.2,"P Drew Pomeranz P Dan Straily SS Corey Seager OF Giancarlo Stanton OF Steven Souza Jr. 1B Logan Morrison 2B Jonathan Schoop 3B Manny Machado OF Trey Mancini C Jesús Sucre",NA,"Johan Camargo","0.17%",5
325,777754546,"jllevybeer",0,98.9,"P James Paxton P Julio Teheran OF Cody Bellinger 1B Paul Goldschmidt 3B Kyle Seager OF Giancarlo Stanton 2B Ben Zobrist SS Javier Báez OF John Jaso C Jonathan Lucroy",NA,"Josh Harrison","0.17%",0
326,777700493,"bears2015chicago",0,98.39999,"P Max Scherzer P Julio Teheran 3B Kris Bryant 2B Brian Dozier OF Adam Jones C Mike Zunino OF Max Kepler 1B Kendrys Morales SS Jordy Mercer OF Jorge Soler",NA,"Trea Turner","0.17%",0
327,777684184,"btwice80 (1/3)",0,98.35,"P Kenta Maeda P Sean Manaea SS Corey Seager 1B Anthony Rizzo OF Ryan Braun 3B Miguel Sanó 2B Brian Dozier OF Christian Yelich C Chris Herrmann OF Matt Olson",NA,"Nick Markakis","0.17%",4
327,777689715,"btwice80 (2/3)",0,98.35,"P Kenta Maeda P Sean Manaea SS Corey Seager 1B Anthony Rizzo OF Ryan Braun 3B Miguel Sanó 2B Brian Dozier OF Christian Yelich C Chris Herrmann OF Matt Olson",NA,"Renato Núñez","0.17%",0
327,777774079,"btwice80 (3/3)",0,98.35,"P Kenta Maeda P Sean Manaea SS Corey Seager 1B Anthony Rizzo OF Ryan Braun 3B Miguel Sanó 2B Brian Dozier OF Christian Yelich C Chris Herrmann OF Matt Olson",NA,"Ryan Schimpf","0.17%",0
330,777727181,"connja",0,98.3,"P Luis Severino P Dan Straily OF Bryce Harper 1B Cody Bellinger OF Jorge Bonifacio 2B Brian Dozier 3B Todd Frazier SS Javier Báez C Wilson Ramos OF Clint Frazier",NA,"Kurt Suzuki","0.17%",28
331,777744114,"Krystalizer",0,97.95,"P Carlos Martínez P Mike Clevinger 1B Joey Votto OF Jay Bruce OF Ryan Braun 3B Miguel Sanó 2B Brian Dozier OF Marcell Ozuna C Russell Martin SS Ramón Torres",NA,"Chris Carter","0.17%",5
