"Rank","EntryId","EntryName","TimeRemaining","Points","Lineup","X","Player","X.Drafted","FPTS"
451,777751276,"buchris532 (9/11)",0,78.85,"P Luis Severino P Alex Cobb OF Khris Davis 3B Justin Turner 1B Eric Hosmer OF Ben Zobrist OF Matt Joyce C Willson Contreras 2B Chase Utley SS Alcides Escobar",NA,"","",NA
452,777715787,"jackbauer4774",0,78.8,"P José Quintana P Jhoulys Chacin 2B José Altuve OF Brett Gardner OF Josh Reddick OF Ian Desmond SS Didi Gregorius 3B José Reyes 1B Yuli Gurriel C Manny Piña",NA,"","",NA
453,777655837,"JDH285 (4/12)",0,78.7,"P Luis Severino P Drew Pomeranz 2B Robinson Canó OF Jay Bruce OF Giancarlo Stanton 1B José Abreu C Alex Avila OF Jon Jay 3B Matt Davidson SS Ramón Torres",NA,"","",NA
454,777760120,"Partytime12",0,78.5,"P Carlos Martínez P Jhoulys Chacin OF Ryan Braun 1B Ryon Healy SS Didi Gregorius OF Hunter Renfroe OF Manuel Margot C Chris Herrmann 3B Ryan Schimpf 2B José Pirela",NA,"","",NA
455,777670462,"rk053169",0,78.45,"P Carlos Martínez P Travis Wood SS Corey Seager 2B Robinson Canó 3B Kyle Seager C Salvador Perez 1B Logan Morrison OF Andrew Romine OF Mikie Mahtook OF Mark Trumbo",NA,"","",NA
456,777705487,"RSFHouston420 (2/5)",0,78.3,"P Jeff Samardzija P Mike Fiers 1B Cody Bellinger 3B Justin Turner OF Carlos Gómez C Salvador Perez OF Jorge Bonifacio OF Yasiel Puig 2B Chase Utley SS Alcides Escobar",NA,"","",NA
457,777662919,"JDH285 (12/12)",0,78,"P Carlos Martínez P Taijuan Walker OF Khris Davis 2B Scooter Gennett OF Yoenis Céspedes 1B José Abreu OF Jorge Bonifacio 3B Josh Donaldson C Brian McCann SS Addison Russell",NA,"","",NA
458,777711072,"jkonetz",0,77.75,"P Carlos Martínez P Sean Manaea OF Andrew Benintendi OF Brett Gardner OF José Bautista 1B Marwin González 3B Josh Donaldson SS Jordy Mercer 2B Rougned Odor C Jason Castro",NA,"","",NA
458,777765270,"shawnd87",0,77.75,"P Carlos Martínez P Sean Manaea OF Khris Davis 1B Anthony Rizzo 3B Kris Bryant OF Josh Reddick 2B Jonathan Schoop C Willson Contreras OF Austin Slater SS Alex Mejia",NA,"","",NA
460,777705382,"horsetooth (3/3)",0,77.3,"P James Paxton P Alex Cobb SS Jean Segura OF Corey Dickerson 3B Miguel Sanó OF Mitch Haniger OF Steven Souza Jr. 1B Logan Morrison C Brian McCann 2B José Pirela",NA,"","",NA
461,777672869,"Playaflyreborn",0,76.95,"P Carlos Martínez P Mike Clevinger 1B Lucas Duda 2B Scooter Gennett OF José Bautista SS Asdrúbal Cabrera OF Shin-soo Choo 3B Manny Machado C Manny Piña OF Seth Smith",NA,"","",NA
462,777703368,"cliff00",0,76.35,"P Sean Manaea P Rafael Montero OF Cody Bellinger OF Khris Davis OF Corey Dickerson 2B Chris Taylor 3B Miguel Sanó 1B Logan Morrison C Stephen Vogt SS Zack Cozart",NA,"","",NA
462,777716949,"trav2268e",0,76.35,"P Kenta Maeda P Sean Manaea OF Jay Bruce 1B Anthony Rizzo OF Ben Gamel 3B Miguel Sanó 2B Brian Dozier C Willson Contreras OF Eric Thames SS Tim Anderson",NA,"","",NA
464,777771309,"cheeseman1165",0,76.2,"P Kenta Maeda P Jake Arrieta OF Charlie Blackmon 3B Justin Turner OF Ryan Braun OF Domingo Santana SS Didi Gregorius 1B Carlos Santana 2B Jonathan Schoop C Manny Piña",NA,"","",NA
465,777766650,"Hockeydude99",0,76.15,"P Kenta Maeda P Dan Straily 1B Joey Votto OF Chris Taylor 3B Miguel Sanó SS Asdrúbal Cabrera OF Steven Souza Jr. OF Brandon Belt 2B Jonathan Schoop C Jesús Sucre",NA,"","",NA
466,777750297,"bills58 (4/4)",0,75.9,"P James Paxton P Tim Adleman 1B Paul Goldschmidt OF Jay Bruce 3B Nolan Arenado OF Corey Dickerson OF Ryan Braun 2B Brian Dozier SS Zack Cozart C Yasmani Grandal",NA,"","",NA
467,777702797,"barnardjon",0,75.75,"P Alex Cobb P Mike Clevinger OF Aaron Judge OF Corey Dickerson 1B Anthony Rizzo 3B Miguel Sanó OF Billy Hamilton 2B Brian Dozier C Willson Contreras SS Zack Cozart",NA,"","",NA
467,777708873,"jcpancake22",0,75.75,"P Sean Manaea P Jesse Chávez OF Cody Bellinger 3B Jake Lamb 1B Mark Reynolds OF Tommy Pham 2B Ian Kinsler C Yadier Molina SS Zack Cozart OF Eric Thames",NA,"","",NA
469,777733615,"theschmidt82",0,75.7,"P Drew Pomeranz P Mike Fiers SS Elvis Andrus OF Charlie Blackmon C Buster Posey OF Giancarlo Stanton 1B Mitch Moreland OF Lorenzo Cain 2B Dee Gordon 3B Cory Spangenberg",NA,"","",NA
470,777680884,"covi",0,75.25,"P Luis Severino P James Paxton C Gary Sánchez 1B Mark Reynolds OF Ryan Braun OF Billy Hamilton 2B Yolmer Sánchez OF Kevin Pillar 3B Martín Prado SS Freddy Galvis",NA,"","",NA
471,777708808,"tna3020",0,75,"P José Quintana P Tim Adleman 3B Jedd Gyorko OF Andrew Benintendi 2B Chris Taylor OF Tommy Pham OF Randal Grichuk C Yadier Molina 1B Matt Carpenter SS Jordy Mercer",NA,"","",NA
472,777688475,"pmryder",0,74.8,"P Max Scherzer P Alex Cobb OF Ryan Braun 1B Mitch Moreland C Mike Zunino 2B Alen Hanson OF Nick Williams SS Freddy Galvis OF Jon Jay 3B Cory Spangenberg",NA,"","",NA
473,777736086,"onorio55",0,74.75,"P Drew Pomeranz P Alex Cobb OF Cody Bellinger 1B Hanley Ramirez OF Jackie Bradley Jr. 3B Miguel Sanó 2B Chase Utley SS Eduardo Escobar C Manny Piña OF Jon Jay",NA,"","",NA
473,777767036,"NEpats802",0,74.75,"P Drew Pomeranz P Alex Cobb 1B Cody Bellinger OF Khris Davis OF Corey Dickerson 3B Justin Turner 2B Brandon Phillips C Yasmani Grandal OF Jon Jay SS Tim Anderson",NA,"","",NA
475,777768161,"Rebelrod",0,74.4,"P Justin Verlander P Sean Manaea OF Cody Bellinger SS Carlos Correa 2B Chris Taylor OF Josh Reddick 1B Marwin González OF Carlos Beltrán C Brian McCann 3B Ty Kelly",NA,"","",NA
476,777691774,"pepsiluver13 (2/6)",0,74.35,"P Kenta Maeda P Sean Manaea 2B Robinson Canó 3B Nolan Arenado 1B Mark Reynolds OF Charlie Blackmon OF Ian Desmond C Chris Herrmann SS Trevor Story OF Matt Olson",NA,"","",NA
477,777637224,"gtbcwood",0,74.15,"P Drew Pomeranz P James Paxton OF Aaron Judge 1B Justin Smoak OF Jay Bruce SS Didi Gregorius 2B Brian Dozier C Robinson Chirinos 3B Miguel Andújar OF Drew Robinson",NA,"","",NA
478,777675226,"Uoftexas23",0,73.95,"P James Paxton P Sean Manaea 2B Robinson Canó OF Corey Dickerson OF Giancarlo Stanton 1B Ryon Healy OF Billy Hamilton 3B Evan Longoria C Brian McCann SS Ketel Marte",NA,"","",NA
479,777768240,"slyrascal29",0,73.75,"P Alex Cobb P Mike Clevinger 1B Joey Votto OF Adam Duvall OF J.D. Martinez OF Corey Dickerson 2B Ben Zobrist 3B Evan Longoria SS Zack Cozart C Jesús Sucre",NA,"","",NA
480,777766214,"blackcows",0,73.64999,"P Max Scherzer P Justin Verlander OF Aaron Altherr C Salvador Perez 2B Brian Dozier 1B Justin Bour OF Gregory Polanco OF Alex Gordon SS Brandon Crawford 3B Jae-gyun Hwang",NA,"","",NA
481,777727072,"blong6565",0,73.6,"P Max Scherzer P Kenta Maeda 2B Daniel Murphy 1B Lucas Duda OF Hunter Pence OF Jorge Soler C Jason Castro 3B Johan Camargo SS Dansby Swanson OF Ty Kelly",NA,"","",NA
482,777773441,"darthor61",0,72.39999,"P Max Scherzer P Tim Adleman OF Ryan Braun 1B Alex Avila 3B Josh Donaldson 2B Eric Sogard SS Zack Cozart OF Mallex Smith OF Scott Schebler C Russell Martin",NA,"","",NA
483,777710033,"packmanmatt",0,72.15,"P Jeff Samardzija P Kenta Maeda OF Cody Bellinger 1B Anthony Rizzo C Salvador Perez 2B Brian Dozier 3B Manny Machado OF Mallex Smith SS Troy Tulowitzki OF Matt Olson",NA,"","",NA
484,777662761,"JDH285 (9/12)",0,71.4,"P Justin Verlander P Sean Manaea OF J.D. Martinez 1B Lucas Duda OF Ryan Braun OF Yoenis Céspedes 3B Josh Donaldson 2B Ian Happ SS Zack Cozart C René Rivera",NA,"","",NA
485,777677967,"jeff8735",0,71.3,"P Dan Straily P Mike Fiers SS Carlos Correa OF Corey Dickerson 1B Mark Reynolds 2B Chris Taylor OF Josh Reddick 3B Evan Longoria C Brian McCann OF Scott Schebler",NA,"","",NA
486,777671361,"priz365 (1/2)",0,70.75,"P Carlos Martínez P Sean Manaea OF George Springer SS Carlos Correa OF Adam Frazier OF Mallex Smith C Chris Herrmann 1B Victor Martinez 2B Alen Hanson 3B Ty Kelly",NA,"","",NA
487,777692728,"weller96",0,70.35,"P Kenta Maeda P Sean Manaea OF Charlie Blackmon 3B Miguel Sanó OF Giancarlo Stanton SS Didi Gregorius 1B Logan Morrison OF Melky Cabrera 2B Jonathan Schoop C Willson Contreras",NA,"","",NA
487,777705623,"RSFHouston420 (3/5)",0,70.35,"P Kenta Maeda P Sean Manaea SS Jean Segura 3B Kyle Seager OF Denard Span 1B Danny Valencia 2B Joe Panik OF Brandon Belt OF Hunter Pence C Mike Zunino",NA,"","",NA
489,777683546,"DEANLONG53",0,70.3,"P Rafael Montero P Tim Adleman OF Aaron Judge 1B Paul Goldschmidt C Gary Sánchez 3B Nolan Arenado OF Charlie Blackmon SS Xander Bogaerts 2B Brian Dozier OF Trey Mancini",NA,"","",NA
490,777735744,"NickeLee32 (1/2)",0,70.25,"P Luis Severino P James Paxton 1B Paul Goldschmidt SS Carlos Correa 2B José Altuve OF Charlie Blackmon OF Derek Fisher OF Clint Frazier 3B Miguel Andújar C Juan Centeno",NA,"","",NA
491,777743564,"dallasmojo505",0,69.95,"P Carlos Martínez P Drew Pomeranz 3B Miguel Sanó OF Aaron Altherr C Salvador Perez OF Jorge Bonifacio 2B Brian Dozier 1B Eric Thames OF Brandon Nimmo SS Alcides Escobar",NA,"","",NA
492,777684920,"rharvey80",0,69.75,"P Carlos Martínez P Sean Manaea OF Corey Dickerson OF Steven Souza Jr. 3B Evan Longoria 1B Justin Bour 2B Eric Sogard OF Shin-soo Choo C Yasmani Grandal SS Trevor Story",NA,"","",NA
493,777744405,"shagdog",0,69.64999,"P Max Scherzer P Justin Verlander OF Giancarlo Stanton 1B José Abreu C Mike Zunino 2B Brandon Drury SS Troy Tulowitzki OF Alex Gordon 3B Matt Davidson OF Clint Frazier",NA,"","",NA
494,777708800,"MolsonBrewCrew",0,69.25,"P Jeff Samardzija P Taijuan Walker OF Adam Duvall 3B Jake Lamb OF Corey Dickerson OF Giancarlo Stanton 1B Logan Morrison 2B Brian Dozier C Russell Martin SS Freddy Galvis",NA,"","",NA
495,777723181,"HamptonMoesquad (1/2)",0,69,"P Max Scherzer P Carlos Martínez OF Corey Dickerson OF Charlie Blackmon 1B Miguel Cabrera OF Austin Slater 3B Greg Garcia C Ryan Hanigan 2B Taylor Featherston SS Ramón Torres",NA,"","",NA
496,777760511,"tomkeb",0,68.5,"P Carlos Martínez P James Paxton OF Ryan Braun OF Domingo Santana 1B Logan Morrison 3B Hernán Pérez 2B Jonathan Schoop OF Eric Thames C Manny Piña SS José Iglesias",NA,"","",NA
497,777709709,"alfred1834 (1/2)",0,68.05,"P Rafael Montero P Travis Wood 1B Joey Votto OF Jay Bruce OF J.D. Martinez C Gary Sánchez 3B Jake Lamb OF Corey Dickerson 2B Scooter Gennett SS Francisco Lindor",NA,"","",NA
498,777714388,"BostonRob25 (1/5)",0,67.95,"P James Paxton P Sean Manaea OF Aaron Judge OF Cody Bellinger 3B Nolan Arenado 2B Chris Taylor 1B Josh Bell SS Freddy Galvis OF Clint Frazier C Kevan Smith",NA,"","",NA
499,777688413,"chefcris",0,67.6,"P Max Scherzer P Kenta Maeda OF Jackie Bradley Jr. SS Didi Gregorius 2B Jonathan Schoop C Manny Piña 1B Tommy Joseph OF Jon Jay OF Clint Frazier 3B Rubén Tejada",NA,"","",NA
500,777729481,"ifuseek13 (2/3)",0,67.35001,"P Luis Severino P Jake Arrieta C Gary Sánchez OF Charlie Blackmon SS Asdrúbal Cabrera OF Steven Souza Jr. 1B Logan Morrison OF David Peralta 2B Daniel Descalso 3B Matt Davidson",NA,"","",NA
501,777718027,"DDD3",0,66.7,"P Luis Severino P Drew Pomeranz SS Elvis Andrus 3B Adrián Béltre OF David Peralta 2B Jonathan Schoop C Robinson Chirinos OF Shin-soo Choo 1B Kendrys Morales OF Eric Young Jr.",NA,"","",NA
502,777762977,"jawish1963",0,66.35,"P Jeff Samardzija P Alex Cobb SS Corey Seager OF Corey Dickerson OF Steven Souza Jr. 3B Evan Longoria 1B Logan Morrison 2B Brian Dozier OF Mallex Smith C Yan Gomes",NA,"","",NA
503,777675303,"Silver123",0,66.3,"P James Paxton P Alex Cobb 1B Joey Votto C Buster Posey OF Randal Grichuk 2B Jed Lowrie 3B Evan Longoria SS José Reyes OF Brandon Belt OF Nomar Mazara",NA,"","",NA
504,777682247,"Obone44",0,66.05,"P Carlos Martínez P Mike Fiers SS Chris Owings 3B Kyle Seager 1B Miguel Cabrera 2B Ben Zobrist C Stephen Vogt OF Rajai Davis OF Danny Santana OF Seth Smith",NA,"","",NA
505,777759407,"monymkerms",0,65.8,"P Max Scherzer P Alex Cobb 1B Mitch Moreland OF David Peralta 2B Brandon Phillips C Mike Zunino OF Nick Williams SS Freddy Galvis OF Jon Jay 3B Cory Spangenberg",NA,"","",NA
506,777682028,"jamabel",0,65.2,"P Jeff Samardzija P Justin Verlander 1B Ryan Zimmerman OF Andrew Benintendi OF Yoenis Céspedes OF Melky Cabrera C Willson Contreras 3B Yunel Escobar 2B Logan Forsythe SS Addison Russell",NA,"","",NA
506,777722082,"ld2knee",0,65.2,"P Jake Arrieta P Tyson Ross 3B Nolan Arenado OF Corey Dickerson 1B Miguel Cabrera C Buster Posey OF Giancarlo Stanton OF Randal Grichuk SS Francisco Lindor 2B Brian Dozier",NA,"","",NA
506,777763602,"BigRay",0,65.2,"P José Quintana P Rafael Montero 1B Joey Votto OF Khris Davis OF Stephen Piscotty OF Billy Hamilton C Yadier Molina 3B Josh Donaldson SS Troy Tulowitzki 2B Darwin Barney",NA,"","",NA
509,777680795,"griffin777 (11/15)",0,65.1,"P Drew Pomeranz P Júnior Guerra OF Aaron Judge SS Carlos Correa OF Corey Dickerson OF Steven Souza Jr. 3B Evan Longoria 1B Logan Morrison 2B Jonathan Schoop C Wilson Ramos",NA,"","",NA
510,777716187,"ruligo1971",0,65.05,"P Kenta Maeda P Travis Wood 1B Cody Bellinger SS Corey Seager 3B Justin Turner OF Randal Grichuk OF Carlos Gómez OF Lonnie Chisenhall 2B Ben Zobrist C Alex Avila",NA,"","",NA
511,777782255,"marielys63",0,65,"P Max Scherzer P Carlos Martínez OF Steven Souza Jr. 2B Ben Zobrist SS Zack Cozart OF Mallex Smith 3B David Freese OF Peter Bourjos 1B Luis Valbuena C Chris Stewart",NA,"","",NA
512,777747560,"hawkers",0,64.65,"P Kenta Maeda P Mike Fiers 1B Cody Bellinger 3B Justin Turner OF Joc Pederson OF Yasiel Puig 2B Jonathan Schoop OF Matt Kemp SS Zack Cozart C Yasmani Grandal",NA,"","",NA
513,777699624,"jimiobo43 (3/4)",0,64.55,"P Carlos Martínez P Jeff Samardzija OF Steven Souza Jr. OF Ender Inciarte 3B Josh Donaldson OF Hernán Pérez C Brian McCann 1B Kendrys Morales 2B José Pirela SS Troy Tulowitzki",NA,"","",NA
514,777682386,"bunny2016 (2/3)",0,64.1,"P Carlos Martínez P Alex Cobb SS Didi Gregorius 3B Evan Longoria 2B Brian Dozier OF Matt Joyce C J.T. Realmuto 1B Justin Bour OF Eric Thames OF Robbie Grossman",NA,"","",NA
514,777752342,"Recievers",0,64.1,"P Kenta Maeda P James Paxton OF Corey Dickerson 1B Anthony Rizzo SS Asdrúbal Cabrera C Alex Avila 3B Evan Longoria 2B Brian Dozier OF Melky Cabrera OF Austin Slater",NA,"","",NA
516,777677922,"AMST158",0,63.75,"P Carlos Martínez P Trevor Williams OF Aaron Judge C Gary Sánchez OF Scooter Gennett 1B Eric Hosmer OF Stephen Piscotty 2B Brian Dozier 3B Cory Spangenberg SS Max Moroff",NA,"","",NA
517,777762930,"buchris532 (11/11)",0,63.65,"P Luis Severino P Rafael Montero OF Jay Bruce OF Giancarlo Stanton OF Yoenis Céspedes 3B Evan Longoria 1B Logan Morrison 2B Brian Dozier C J.T. Realmuto SS Eduardo Escobar",NA,"","",NA
518,777742437,"dr_ikjyotsinghk",0,63.3,"P Luis Severino P Jeff Samardzija 1B Paul Goldschmidt 2B Daniel Murphy OF Brett Gardner C Robinson Chirinos OF Steve Pearce SS Freddy Galvis 3B Matt Davidson OF Clint Frazier",NA,"","",NA
519,777737835,"Barnking44 (1/2)",0,63.1,"P Mike Clevinger P Joe Biagini OF Aaron Judge 1B Cody Bellinger 2B José Altuve 3B Justin Turner OF Brett Gardner C Buster Posey SS Asdrúbal Cabrera OF Shin-soo Choo",NA,"","",NA
520,777748385,"TeamMofos",0,62.95,"P James Paxton P Sean Manaea 3B Miguel Sanó OF Yoenis Céspedes OF Cameron Maybin SS Asdrúbal Cabrera 1B Ryon Healy C Salvador Perez 2B Brian Dozier OF Matt Joyce",NA,"","",NA
521,777756229,"DapKing",0,62.85,"P Luis Severino P Alex Cobb OF Cody Bellinger OF Corey Dickerson 1B Alex Avila 2B Whit Merrifield 3B Eugenio Suárez C Brian McCann OF Kevin Pillar SS Adam Rosales",NA,"","",NA
522,777717130,"johnflynn1031",0,62.7,"P Luis Severino P Justin Verlander OF Aaron Judge 3B Kris Bryant 1B Eric Hosmer 2B Dee Gordon C Yasmani Grandal OF Kevin Pillar OF Mark Trumbo SS Trevor Story",NA,"","",NA
523,777754259,"JccDK",0,62.4,"P Alex Cobb P Jake Arrieta OF Cody Bellinger 2B José Altuve 3B Kris Bryant 1B Miguel Cabrera OF Yoenis Céspedes OF Billy Hamilton C Yasmani Grandal SS Dansby Swanson",NA,"","",NA
524,777692999,"jimiobo43 (2/4)",0,61.35,"P Kenta Maeda P Sean Manaea OF Aaron Judge 3B Jake Lamb 2B Dustin Pedroia OF Ian Desmond 1B Josh Bell C Mike Zunino SS Eduardo Escobar OF Brandon Moss",NA,"","",NA
525,777732181,"Thomson73",0,61.3,"P Julio Teheran P Tyson Ross OF Cody Bellinger 1B Justin Smoak 3B Jake Lamb OF Jackie Bradley Jr. SS Asdrúbal Cabrera C Salvador Perez 2B Jason Kipnis OF Brandon Nimmo",NA,"","",NA
526,777779467,"bangush (1/3)",0,61.25,"P José Quintana P Drew Pomeranz OF Corey Dickerson SS Xander Bogaerts OF Andrew Benintendi 3B Evan Longoria 1B Logan Morrison OF Robbie Grossman C Jesús Sucre 2B Taylor Featherston",NA,"","",NA
527,777765367,"cthaller",0,60.4,"P Carlos Martínez P Nick Pivetta 2B Robinson Canó OF Corey Dickerson OF Charlie Blackmon SS Didi Gregorius 1B Logan Morrison 3B Josh Donaldson OF Jon Jay C Devin Mesoraco",NA,"","",NA
528,777699095,"pepsiluver13 (4/6)",0,60.35,"P Kenta Maeda P Sean Manaea 1B Cody Bellinger SS Corey Seager 3B Justin Turner OF Joc Pederson 2B Chase Utley OF Kole Calhoun C Bruce Maxwell OF Matt Olson",NA,"","",NA
528,777699097,"pepsiluver13 (5/6)",0,60.35,"P Kenta Maeda P Sean Manaea 1B Paul Goldschmidt 2B Robinson Canó 3B Jake Lamb OF Ben Gamel OF Matt Joyce C Chris Herrmann OF Matt Olson SS Carlos Asuaje",NA,"","",NA
530,777674321,"tmph1",0,60.2,"P Jeff Samardzija P Justin Verlander OF Khris Davis OF Giancarlo Stanton 3B Evan Longoria 1B Yonder Alonso 2B Joe Panik C Willson Contreras SS Zack Cozart OF Trey Mancini",NA,"","",NA
531,777724256,"buchris532 (1/11)",0,60.1,"P Kenta Maeda P James Paxton OF Corey Dickerson OF Giancarlo Stanton 1B Eric Hosmer OF Steven Souza Jr. C Salvador Perez 3B Hernán Pérez 2B Eric Sogard SS Alcides Escobar",NA,"","",NA
532,777707897,"srgttsb",0,60.05,"P José Quintana P Sean Manaea 1B Eric Hosmer OF Mitch Haniger OF Steven Souza Jr. 3B Evan Longoria 2B Brian Dozier SS Eduardo Escobar C Brian McCann OF Scott Schebler",NA,"","",NA
532,777721648,"garciacm (2/2)",0,60.05,"P José Quintana P Sean Manaea OF Steven Souza Jr. C Salvador Perez OF Jorge Bonifacio 3B Evan Longoria 1B Logan Morrison 2B Brian Dozier SS Addison Russell OF Clint Frazier",NA,"","",NA
534,777678642,"Mmoney1126",0,59.75,"P Carlos Martínez P Sean Manaea 1B Mark Reynolds C Buster Posey OF Aaron Altherr 2B Jed Lowrie 3B Todd Frazier SS Javier Báez OF Kevin Pillar OF Gregory Polanco",NA,"","",NA
535,777747475,"DFLOYD",0,59.6,"P Max Scherzer P Kenta Maeda OF Corey Dickerson OF Steven Souza Jr. 3B Evan Longoria 1B Logan Morrison C Chris Iannetta OF Clint Frazier 2B Taylor Featherston SS Ramón Torres",NA,"","",NA
536,777761966,"buchris532 (10/11)",0,59.15,"P Jeff Samardzija P Rafael Montero OF Jay Bruce OF J.D. Martinez 1B Miguel Cabrera SS Asdrúbal Cabrera 2B Ben Zobrist 3B Evan Longoria C Willson Contreras OF Jon Jay",NA,"","",NA
537,777724462,"trbs1972",0,58.9,"P Carlos Martínez P Kenta Maeda 3B Kris Bryant C Salvador Perez OF Eddie Rosario 1B Joe Mauer 2B Whit Merrifield OF Trey Mancini OF Robbie Grossman SS Alcides Escobar",NA,"","",NA
538,777738515,"jerpen",0,58.5,"P Mike Fiers P Trevor Williams OF Aaron Judge OF Jay Bruce 2B José Altuve C Gary Sánchez 1B Lucas Duda OF Aaron Altherr 3B José Reyes SS Freddy Galvis",NA,"","",NA
539,777691773,"pepsiluver13 (1/6)",0,58.35,"P Kenta Maeda P Sean Manaea 2B Robinson Canó SS Jean Segura 1B Mark Reynolds 3B Kyle Seager OF Mitch Haniger C Chris Herrmann OF Raimel Tapia OF Matt Olson",NA,"","",NA
539,777705134,"mikechaz (1/2)",0,58.35,"P Kenta Maeda P Sean Manaea OF Corey Dickerson OF Charlie Blackmon SS Asdrúbal Cabrera C Alex Avila 3B Evan Longoria 1B Logan Morrison 2B Brian Dozier OF Mark Trumbo",NA,"","",NA
541,777755891,"ahunter1533",0,58.25,"P Justin Verlander P Jake Arrieta OF Jay Bruce 1B Anthony Rizzo 2B Scooter Gennett 3B Kris Bryant OF Billy Hamilton C Alex Avila SS Zack Cozart OF Adam Engel",NA,"","",NA
542,777695583,"Attacksystem",0,58.15,"P Kenta Maeda P Dan Straily 1B Cody Bellinger OF Corey Dickerson SS Asdrúbal Cabrera C Salvador Perez OF Jorge Bonifacio 2B Whit Merrifield 3B Eduardo Escobar OF Jon Jay",NA,"","",NA
543,777699647,"LockandLoad26 (2/2)",0,58.05,"P Kenta Maeda P Travis Wood OF George Springer OF Aaron Judge 1B Cody Bellinger 3B Justin Turner 2B Chris Taylor SS Didi Gregorius C Yasmani Grandal OF Alex Gordon",NA,"","",NA
543,777779840,"bangush (3/3)",0,58.05,"P José Quintana P Sean Manaea OF Corey Dickerson 1B Lucas Duda 3B Miguel Sanó OF Steven Souza Jr. C Salvador Perez SS José Reyes 2B Dixon Machado OF Brandon Moss",NA,"","",NA
545,777662619,"JDH285 (7/12)",0,57.6,"P Carlos Martínez P José Quintana SS Xander Bogaerts OF Billy Hamilton 1B Logan Morrison 2B Whit Merrifield C Chris Iannetta 3B Matt Davidson OF Clint Frazier OF Ty Kelly",NA,"","",NA
546,777687204,"msherman82",0,57.15,"P Kenta Maeda P Dan Straily OF Charlie Blackmon OF Scooter Gennett 1B Eric Hosmer OF Randal Grichuk SS Francisco Lindor 2B Jonathan Schoop 3B Logan Forsythe C Matt Wieters",NA,"","",NA
547,777758791,"Needdacash",0,57.1,"P Kenta Maeda P James Paxton OF Cody Bellinger 1B Joey Votto 3B Justin Turner OF Joc Pederson SS Addison Russell 2B Alen Hanson OF Clint Frazier C Devin Mesoraco",NA,"","",NA
548,777692732,"kareem21",0,56.55,"P Kenta Maeda P Drew Pomeranz SS Elvis Andrus 1B Buster Posey OF Billy Hamilton 2B Eric Sogard 3B Manny Machado C Mike Zunino OF Bradley Zimmer OF Trey Mancini",NA,"","",NA
549,777713650,"garciacm (1/2)",0,55.1,"P Kenta Maeda P James Paxton OF Corey Dickerson 1B Anthony Rizzo 3B Justin Turner C Alex Avila 2B Brian Dozier OF Grégor Blanco SS Tim Beckham OF Clint Frazier",NA,"","",NA
549,777716967,"acdcrocks915 (1/2)",0,55.1,"P Kenta Maeda P James Paxton OF Corey Dickerson 1B Anthony Rizzo C Alex Avila 3B Evan Longoria 2B Brian Dozier OF Hernán Pérez SS Addison Russell OF Kevin Pillar",NA,"","",NA
551,777644017,"PrinceX1233",0,53.9,"P Carlos Martínez P Kenta Maeda OF Aaron Judge SS Carlos Correa 2B Daniel Murphy OF Billy Hamilton 1B Eric Thames 3B Kaleb Cowart C Juan Centeno OF Drew Robinson",NA,"","",NA
552,777695956,"Bigdawg73",0,53.65,"P Luis Severino P Rafael Montero OF Aaron Judge C Gary Sánchez 3B Miguel Sanó 2B Brian Dozier OF Jacoby Ellsbury 1B Joe Mauer OF Robbie Grossman SS Jorge Polanco",NA,"","",NA
553,777722959,"cogline75",0,53.55,"P Kenta Maeda P Justin Verlander 1B Anthony Rizzo OF Ryan Braun 3B Miguel Sanó OF Yoenis Céspedes 2B Brian Dozier OF Eric Thames C Jonathan Lucroy SS Trevor Story",NA,"","",NA
554,777761912,"hawk2116 (10/10)",0,53.15,"P Justin Verlander P James Paxton OF Corey Dickerson SS Asdrúbal Cabrera C Salvador Perez OF Jorge Bonifacio 3B Evan Longoria 1B Logan Morrison OF Adam Frazier 2B Whit Merrifield",NA,"","",NA
555,777678337,"tonzoo (2/4)",0,52.75,"P Justin Verlander P Alex Cobb C Gary Sánchez OF Charlie Blackmon 2B Chris Taylor 1B Ryon Healy SS Didi Gregorius 3B Todd Frazier OF Christian Yelich OF Scott Schebler",NA,"","",NA
556,777736787,"jez0321",0,52.5,"P Carlos Martínez P James Paxton 3B Jake Lamb OF Aaron Altherr 2B Joe Panik OF Hunter Pence C Mike Zunino SS Addison Russell OF Kevin Pillar 1B Tommy Joseph",NA,"","",NA
557,777755720,"AEVANS1 (2/2)",0,52.1,"P Kenta Maeda P James Paxton 1B Cody Bellinger SS Corey Seager 3B Justin Turner 2B Chris Taylor OF Steve Pearce OF Jon Jay OF Alex Gordon C Devin Mesoraco",NA,"","",NA
558,777748417,"Smar320 (2/3)",0,51.55,"P Kenta Maeda P Drew Pomeranz OF Cody Bellinger 3B Justin Turner OF Joc Pederson C Salvador Perez 2B Jed Lowrie 1B Yonder Alonso OF Jorge Soler SS Ramón Torres",NA,"","",NA
559,777503837,"gravesendny",0,51.3,"P Kenta Maeda P Julio Teheran 1B Paul Goldschmidt 2B Robinson Canó OF Brett Gardner SS Asdrúbal Cabrera C Salvador Perez 3B Evan Longoria OF Steve Pearce OF Clint Frazier",NA,"","",NA
560,777739091,"HamptonMoesquad (2/2)",0,51.05,"P Carlos Martínez P Luis Severino OF Cody Bellinger 1B Paul Goldschmidt OF Charlie Blackmon 3B T.J. Rivera 2B Rougned Odor C Devin Mesoraco OF Austin Slater SS Ramón Torres",NA,"","",NA
561,777633396,"lucking2wayne",0,50.6,"P Drew Pomeranz P Justin Verlander OF Aaron Judge OF Adam Duvall 2B Ben Zobrist C Alex Avila 1B Josh Bell SS Addison Russell 3B T.J. Rivera OF Clint Frazier",NA,"","",NA
562,777761910,"hawk2116 (8/10)",0,50.2,"P Jeff Samardzija P Justin Verlander OF Corey Dickerson SS Asdrúbal Cabrera C Salvador Perez OF Jorge Bonifacio 3B Evan Longoria 1B Logan Morrison 2B Whit Merrifield OF Brandon Moss",NA,"","",NA
563,777734794,"JohnCriton (5/6)",0,50.1,"P Kenta Maeda P James Paxton OF Corey Dickerson 1B Anthony Rizzo OF Steven Souza Jr. 2B Ben Zobrist 3B Evan Longoria OF Mallex Smith SS Addison Russell C Manny Piña",NA,"","",NA
563,777735098,"JohnCriton (6/6)",0,50.1,"P Kenta Maeda P James Paxton OF Corey Dickerson 1B Anthony Rizzo OF Steven Souza Jr. 2B Ben Zobrist 3B Evan Longoria OF Mallex Smith SS Addison Russell C Manny Piña",NA,"","",NA
565,777724315,"MichiganKevin",0,48.55,"P Justin Verlander P Rafael Montero 1B Cody Bellinger SS Corey Seager 3B Jake Lamb C Buster Posey 2B Jonathan Schoop OF Adam Jones OF Trey Mancini OF Mark Trumbo",NA,"","",NA
566,777744218,"NickeLee32 (2/2)",0,48.25,"P Luis Severino P James Paxton 1B Paul Goldschmidt 2B José Altuve OF Charlie Blackmon SS Trea Turner OF Derek Fisher OF Clint Frazier 3B Miguel Andújar C Juan Centeno",NA,"","",NA
567,777671859,"tbozz",0,47.55,"P Kenta Maeda P Mike Clevinger OF Adam Duvall 3B Justin Turner OF Brett Gardner OF Steven Souza Jr. SS Didi Gregorius 1B Logan Morrison C Robinson Chirinos 2B Chase Utley",NA,"","",NA
568,777708330,"RSFHouston420 (5/5)",0,46.15,"P Justin Verlander P James Paxton 1B Paul Goldschmidt 3B Kris Bryant 2B Ben Zobrist OF Aaron Altherr OF Matt Joyce C Willson Contreras OF Grégor Blanco SS Javier Báez",NA,"","",NA
569,777745420,"JJ_Delgado",0,45.9,"P Carlos Martínez P Kenta Maeda OF Charlie Blackmon 1B Buster Posey 2B Brian Dozier 3B Josh Donaldson OF Yasiel Puig SS Trevor Story C Bruce Maxwell OF Clint Frazier",NA,"","",NA
