"Rank","EntryId","EntryName","TimeRemaining","Points","Lineup","X","Player","X.Drafted","FPTS"
1,777702296,"theone11",0,227.7,"P Max Scherzer P Taijuan Walker 1B Anthony Rizzo OF Giancarlo Stanton C Willson Contreras 2B Ian Happ OF Christian Yelich OF Marcell Ozuna SS Addison Russell 3B Derek Dietrich",NA,"Max Scherzer","32.14%",41.35
2,777661501,"jaduff28 (2/3)",0,204.95,"P James Paxton P Sean Manaea OF Mookie Betts 1B Paul Goldschmidt 2B José Ramírez 3B Jake Lamb OF Steven Souza Jr. OF Marcell Ozuna C Jesús Sucre SS Ramón Torres",NA,"Brian Dozier","18.54%",5
3,777723313,"BrooCroo",0,196.15,"P Taijuan Walker P Travis Wood OF George Springer OF Mookie Betts 2B Robinson Canó SS Carlos Correa 1B Justin Smoak 3B José Ramírez OF Ryan Braun C René Rivera",NA,"Sean Manaea","17.86%",19.1
4,777761903,"hawk2116 (1/10)",0,195.45,"P Max Scherzer P Sean Manaea 1B Anthony Rizzo OF Giancarlo Stanton C Willson Contreras 2B Ian Happ OF Marcell Ozuna SS Brandon Crawford 3B Derek Dietrich OF Matt Olson",NA,"Kenta Maeda","17.52%",-5.75
5,777768675,"DaHood",0,194.15,"P James Paxton P Mike Clevinger OF Adam Duvall 3B José Ramírez OF Andrew Benintendi SS Francisco Lindor OF Ender Inciarte C J.T. Realmuto 2B Ian Happ 1B Eric Thames",NA,"James Paxton","17.35%",19.85
6,777697305,"dmal5014 (2/4)",0,193.2,"P Max Scherzer P James Paxton OF Adam Frazier OF Eric Thames OF Marcell Ozuna 1B Yuli Gurriel SS Javier Báez 2B Brandon Drury 3B T.J. Rivera C Jason Castro",NA,"Corey Dickerson","12.93%",0
7,777727879,"19bobthedog",0,191.3,"P Max Scherzer P Jake Arrieta OF Giancarlo Stanton 2B Brian Dozier C J.T. Realmuto 1B Eric Thames 3B Manny Machado OF Marcell Ozuna OF Mark Trumbo SS José Iglesias",NA,"Aaron Judge","12.76%",8
8,777740363,"Thugatron151",0,186.7,"P Max Scherzer P Taijuan Walker 3B José Ramírez OF Denard Span OF Lonnie Chisenhall OF Marcell Ozuna C Brian McCann 2B José Pirela 1B Albert Pujols SS Freddy Galvis",NA,"Logan Morrison","12.76%",5
9,777749256,"fjbourne",0,183.45,"P Max Scherzer P Sean Manaea OF Giancarlo Stanton 2B Brian Dozier C J.T. Realmuto 1B Eric Thames 3B Manny Machado OF Marcell Ozuna OF Mark Trumbo SS Ramón Torres",NA,"Salvador Perez","12.24%",5
10,777766541,"shartman208",0,182.45,"P Sean Manaea P Kevin Gausman OF Aaron Judge OF Mookie Betts 1B Paul Goldschmidt OF Charlie Blackmon SS Francisco Lindor 3B Manny Machado 2B Javier Báez C Caleb Joseph",NA,"Cody Bellinger","11.73%",3
11,777754861,"tombutler23",0,182.35,"P Alex Cobb P Dan Straily OF Mookie Betts 3B José Ramírez OF Corey Dickerson SS Francisco Lindor OF Lonnie Chisenhall 1B Carlos Santana 2B Javier Báez C Jason Castro",NA,"Anthony Rizzo","10.54%",16
12,777722333,"tblades",0,179,"P Max Scherzer P Jesse Chávez OF Bryce Harper 2B Daniel Murphy 3B Nicholas Castellanos 1B Eric Thames OF Christian Yelich OF Brian Goodwin C Brian McCann SS José Iglesias",NA,"Charlie Blackmon","10.54%",10
13,777673985,"griffin777 (3/15)",0,178.65,"P Mike Clevinger P Taijuan Walker OF Aaron Judge OF Bryce Harper OF Cody Bellinger 1B Anthony Rizzo 3B Kris Bryant C Willson Contreras 2B Ian Happ SS Javier Báez",NA,"Miguel Sanó","10.54%",8
14,777770836,"Ghostmagic",0,178.4,"P Sean Manaea P Mike Clevinger OF Mookie Betts 1B Anthony Rizzo SS Xander Bogaerts 3B Justin Turner OF Mitch Haniger 2B Brian Dozier OF Ian Happ C Yasmani Grandal",NA,"Steven Souza Jr.","10.37%",5
15,777769991,"pittpantherfeet (2/2)",0,177.3,"P Max Scherzer P Jake Arrieta 2B José Ramírez 3B Kyle Seager OF Lonnie Chisenhall OF Hernán Pérez 1B Carlos Santana OF John Jaso SS Max Moroff C Chris Stewart",NA,"Evan Longoria","10.20%",0
16,777739351,"TitanUpML",0,177.2,"P Max Scherzer P James Paxton OF Ender Inciarte OF Brandon Belt 1B Eric Thames 3B Manny Machado C Chris Iannetta OF Mark Trumbo SS Orlando Arcia 2B Danny Espinosa",NA,"Eric Thames","10.20%",18
17,777662800,"JDH285 (10/12)",0,176.2,"P Jeff Samardzija P Justin Verlander OF Mookie Betts 2B Robinson Canó OF Steven Souza Jr. C J.T. Realmuto OF Ian Happ 1B T.J. Rivera SS Orlando Arcia 3B Matt Davidson",NA,"Jake Arrieta","10.20%",29.95
18,777699906,"Felipe1515",0,175.85,"P Nick Pivetta P Trevor Williams OF Mookie Betts SS Carlos Correa 1B Justin Smoak OF Corey Dickerson OF Ryan Braun 2B Dustin Pedroia C Alex Avila 3B Manny Machado",NA,"Drew Pomeranz","9.35%",17.3
19,777732113,"shanehw (1/3)",0,171.05,"P Jake Arrieta P Trevor Williams OF Aaron Judge OF Bryce Harper C Gary Sánchez 1B Anthony Rizzo 3B Miguel Sanó OF Giancarlo Stanton 2B Whit Merrifield SS Alcides Escobar",NA,"Carlos Martínez","9.18%",0.65
20,777667328,"0_for_5",0,169.6,"P Max Scherzer P Kenta Maeda 2B Brian Dozier C J.T. Realmuto 1B Justin Bour OF Christian Yelich OF Marcell Ozuna 3B T.J. Rivera OF Mark Trumbo SS Ramón Torres",NA,"Clint Frazier","8.67%",2
21,777688131,"twisterspecial015",0,168.35,"P Sean Manaea P Rafael Montero OF Mookie Betts 2B Robinson Canó SS Chris Owings 3B Justin Turner 1B Eric Hosmer OF Brandon Belt C Chris Herrmann OF Adam Engel",NA,"Jonathan Schoop","8.50%",0
22,777744340,"perihadion",0,168.3,"P Max Scherzer P Jake Arrieta OF Aaron Judge 3B Miguel Sanó 1B Eric Hosmer 2B Whit Merrifield OF Seth Smith OF Alex Gordon C Yan Gomes SS Ramón Torres",NA,"Robinson Canó","8.33%",20
23,777740288,"shanehw (3/3)",0,166.05,"P Jake Arrieta P Trevor Williams OF Bryce Harper SS Corey Seager C Gary Sánchez 1B Anthony Rizzo 3B Miguel Sanó OF Giancarlo Stanton 2B Whit Merrifield OF Raimel Tapia",NA,"Justin Turner","8.33%",4
24,777742028,"Caddoman18",0,165.4,"P Max Scherzer P Julio Teheran 3B Adrián Béltre OF Melky Cabrera 2B Whit Merrifield SS Zack Cozart 1B Eric Thames OF Delino DeShields OF Mark Trumbo C Jonathan Lucroy",NA,"Kris Bryant","8.33%",3
25,777778419,"Shaggy44",0,164.35,"P Drew Pomeranz P Julio Teheran OF Mookie Betts SS Xander Bogaerts 1B Edwin Encarnacion OF Steven Souza Jr. OF Ender Inciarte 2B Joe Panik C Willson Contreras 3B T.J. Rivera",NA,"Zack Cozart","8.16%",3
26,777768870,"Drewfustino",0,163.45,"P Max Scherzer P Trevor Williams OF Keon Broxton OF Lonnie Chisenhall SS José Reyes C Willson Contreras 2B Whit Merrifield 3B Manny Machado 1B Yuli Gurriel OF Jon Jay",NA,"Willson Contreras","8.16%",7
27,777729457,"clyde3393",0,162.3,"P Max Scherzer P Jake Arrieta 1B Justin Bour 2B Ian Happ OF Matt Kemp OF Manuel Margot OF Grégor Blanco 3B Yunel Escobar C Chris Herrmann SS Troy Tulowitzki",NA,"Mookie Betts","8.16%",53
28,777682217,"BigPhill99",0,160.7,"P Alex Cobb P Tyson Ross OF Mookie Betts 3B Justin Turner 1B Hanley Ramirez 2B Dustin Pedroia OF Domingo Santana SS Didi Gregorius OF Manuel Margot C Andrew Knapp",NA,"Mark Trumbo","7.82%",16
29,777685665,"SUNSET76 (7/15)",0,159.7,"P Max Scherzer P Taijuan Walker OF Bryce Harper 2B Daniel Murphy OF Michael A. Taylor 1B Adam Lind OF Brian Goodwin C Bruce Maxwell SS Ramón Torres 3B Rubén Tejada",NA,"Giancarlo Stanton","7.65%",5
30,777701024,"gimpbeavis",0,159.3,"P Max Scherzer P Jake Arrieta OF Giancarlo Stanton 2B Brian Dozier C J.T. Realmuto 1B Eric Thames 3B Manny Machado OF Mallex Smith OF Mark Trumbo SS José Iglesias",NA,"Jeff Samardzija","7.65%",19.9
31,777762161,"jjohn704",0,159.25,"P Drew Pomeranz P Jake Arrieta OF Cody Bellinger OF Khris Davis OF Charlie Blackmon SS Didi Gregorius 3B Nicholas Castellanos C Willson Contreras 2B Whit Merrifield 1B John Jaso",NA,"Didi Gregorius","7.31%",2
32,777722515,"oldfish",0,159.2,"P Sean Manaea P Trevor Williams OF Mookie Betts 1B Joey Votto OF Adam Duvall 3B Jake Lamb OF Corey Dickerson 2B Ian Happ C Manny Piña SS Orlando Arcia",NA,"Marcell Ozuna","7.31%",35
32,777740798,"AEVANS1 (1/2)",0,159.2,"P Max Scherzer P James Paxton 1B Anthony Rizzo C Willson Contreras 2B Ian Happ SS Addison Russell 3B Martín Prado OF Adam Engel OF Alex Gordon OF Clint Frazier",NA,"Ian Happ","7.31%",40
34,777736421,"hank3shawn22",0,158.6,"P Max Scherzer P Rafael Montero OF Ryan Braun C Buster Posey OF Hernán Pérez 2B Ian Happ 3B Maikel Franco 1B T.J. Rivera SS Trevor Story OF Alex Gordon",NA,"Eric Hosmer","7.14%",14
35,777705788,"Domination09 (1/2)",0,157.9,"P James Paxton P Julio Teheran OF Aaron Judge OF Bryce Harper 3B Anthony Rendon OF Brandon Belt 1B Adam Lind C Matt Wieters 2B Javier Báez SS Wilmer Difo",NA,"Alex Avila","7.14%",9
36,777676075,"paycory (2/2)",0,157.45,"P Jesse Chávez P Travis Wood OF Aaron Judge OF Mookie Betts OF Cody Bellinger 1B Paul Goldschmidt 2B Robinson Canó 3B José Ramírez SS Francisco Lindor C Salvador Perez",NA,"Whit Merrifield","7.14%",32
37,777692144,"ddogss",0,157.4,"P Sean Manaea P Mike Clevinger OF Mookie Betts 1B Cody Bellinger OF Khris Davis C Buster Posey OF Yoenis Céspedes 2B Joe Panik 3B T.J. Rivera SS Adam Rosales",NA,"Paul Goldschmidt","6.97%",6
38,777756714,"perldog",0,156.75,"P Max Scherzer P Mike Fiers SS Carlos Correa 2B José Altuve OF Marwin González OF Marcell Ozuna 1B Kendrys Morales OF Jorge Soler C Devin Mesoraco 3B Rubén Tejada",NA,"Ryan Braun","6.80%",5
39,777675044,"Laffyville",0,156.45,"P Max Scherzer P Sean Manaea 1B Eric Hosmer OF Aaron Altherr OF Adam Frazier 2B Whit Merrifield OF Marcell Ozuna SS Freddy Galvis C Jason Castro 3B Matt Davidson",NA,"Manny Machado","6.80%",18
40,777728001,"terrybaby",0,156.25,"P James Paxton P Mike Fiers 2B José Ramírez OF Charlie Blackmon 3B Justin Turner OF Andrew Benintendi 1B José Abreu C J.T. Realmuto OF Melky Cabrera SS Troy Tulowitzki",NA,"Bryce Harper","6.63%",37
41,777655747,"JDH285 (3/12)",0,156.15,"P Jeff Samardzija P Rafael Montero OF Mookie Betts OF Corey Dickerson 1B Mitch Moreland SS Francisco Lindor C Salvador Perez 2B Ian Happ OF Trey Mancini 3B T.J. Rivera",NA,"Justin Verlander","6.29%",-13.7
42,777700725,"Dogcatcher32",0,155.1,"P Rafael Montero P Jhoulys Chacin OF Mookie Betts 1B Joey Votto OF J.D. Martinez OF Corey Dickerson 3B Kris Bryant SS Didi Gregorius C Alex Avila 2B Whit Merrifield",NA,"Luis Severino","6.29%",7.4
43,777710618,"scaper1",0,154.7,"P Max Scherzer P Taijuan Walker OF Bryce Harper 1B Edwin Encarnacion OF Steven Souza Jr. 3B Eugenio Suárez C Russell Martin SS Jorge Polanco OF Alex Gordon 2B Dixon Machado",NA,"Rafael Montero","6.29%",12.25
44,777675526,"wilks4428",0,154.4,"P Justin Verlander P Sean Manaea OF Mookie Betts 3B Justin Turner OF Andrew Benintendi 1B Hanley Ramirez OF Jackie Bradley Jr. C Salvador Perez 2B Whit Merrifield SS Ramón Torres",NA,"Ramón Torres","6.12%",7
45,777688607,"SUNSET76 (10/15)",0,154.3,"P Max Scherzer P Jake Arrieta 3B Kris Bryant 1B Eric Hosmer C Salvador Perez OF Jorge Bonifacio 2B Whit Merrifield OF Seth Smith OF Jorge Soler SS Rubén Tejada",NA,"Alex Cobb","6.12%",3.45
46,777772814,"allsportsman3422 (2/2)",0,153.25,"P Max Scherzer P Héctor Santiago OF Cody Bellinger 1B Paul Goldschmidt SS Zack Cozart 3B Manny Machado OF Christian Yelich OF Marcell Ozuna 2B Yolmer Sánchez C Russell Martin",NA,"Josh Donaldson","6.12%",0
47,777745113,"sjalb",0,152.35,"P Kenta Maeda P Sean Manaea OF Cody Bellinger 3B Jake Lamb 1B Edwin Encarnacion OF Giancarlo Stanton 2B Ian Happ OF Marcell Ozuna C Yasmani Grandal SS Rubén Tejada",NA,"Billy Hamilton","6.12%",0
48,777692022,"Ironlungpa (1/5)",0,152.15,"P Max Scherzer P Travis Wood OF Mookie Betts 2B Robinson Canó 3B Kris Bryant 1B Eric Hosmer OF Matt Joyce SS Trevor Story C Devin Mesoraco OF Austin Slater",NA,"Mallex Smith","6.12%",3
48,777692024,"Ironlungpa (2/5)",0,152.15,"P Max Scherzer P Travis Wood OF Mookie Betts 2B Robinson Canó 3B Kris Bryant 1B Eric Hosmer OF Matt Joyce SS Trevor Story C Devin Mesoraco OF Austin Slater",NA,"Gary Sánchez","6.12%",8
48,777699343,"Ironlungpa (3/5)",0,152.15,"P Max Scherzer P Travis Wood OF Mookie Betts 2B Robinson Canó 3B Kris Bryant 1B Eric Hosmer OF Matt Joyce SS Trevor Story C Devin Mesoraco OF Austin Slater",NA,"Mike Clevinger","5.78%",25.3
48,777699345,"Ironlungpa (4/5)",0,152.15,"P Max Scherzer P Travis Wood OF Mookie Betts 2B Robinson Canó 3B Kris Bryant 1B Eric Hosmer OF Matt Joyce SS Trevor Story C Devin Mesoraco OF Austin Slater",NA,"J.T. Realmuto","5.78%",19
48,777699346,"Ironlungpa (5/5)",0,152.15,"P Max Scherzer P Travis Wood OF Mookie Betts 2B Robinson Canó 3B Kris Bryant 1B Eric Hosmer OF Matt Joyce SS Trevor Story C Devin Mesoraco OF Austin Slater",NA,"Javier Báez","5.61%",15
53,777769882,"leobeer83",0,151.95,"P Julio Teheran P Héctor Santiago OF Aaron Judge OF Bryce Harper 3B José Ramírez 2B José Altuve OF Charlie Blackmon 1B Edwin Encarnacion C Salvador Perez SS José Reyes",NA,"Taijuan Walker","5.61%",24.35
54,777729050,"pittkidd (2/2)",0,151.7,"P Max Scherzer P Taijuan Walker 3B Justin Turner OF Ben Zobrist C Salvador Perez 1B Carlos Santana OF Ian Happ 2B Logan Forsythe SS Eduardo Escobar OF Matt Olson",NA,"Joey Votto","5.61%",10
55,777710937,"savalicious",0,150.45,"P Max Scherzer P Sean Manaea OF Giancarlo Stanton 1B Alex Avila 2B Brian Dozier OF Marcell Ozuna C Yasmani Grandal OF Steve Pearce 3B Martín Prado SS José Iglesias",NA,"Troy Tulowitzki","5.61%",3
56,777760487,"Bal83",0,150.3,"P Max Scherzer P Jake Arrieta OF Khris Davis 2B Brian Dozier 3B Josh Donaldson OF Matt Kemp 1B Eric Thames OF Mark Trumbo C Jonathan Lucroy SS Dansby Swanson",NA,"Khris Davis","5.44%",23
57,777735862,"keving315",0,149.9,"P José Quintana P Jake Arrieta 3B José Ramírez OF Andrew McCutchen SS Francisco Lindor OF Lonnie Chisenhall 1B Carlos Santana 2B José Pirela C Russell Martin OF Alex Gordon",NA,"Buster Posey","5.27%",7
58,777731051,"Onthelam",0,149.65,"P Max Scherzer P Drew Pomeranz OF Scooter Gennett 2B Whit Merrifield OF Scott Schebler OF Gregory Polanco 1B T.J. Rivera 3B Martín Prado SS Alcides Escobar C Martín Maldonado",NA,"Carlos Correa","5.27%",22
59,777688615,"SUNSET76 (11/15)",0,149.3,"P Max Scherzer P Jake Arrieta 1B Anthony Rizzo 3B Kris Bryant OF Jorge Bonifacio C Alex Avila 2B Whit Merrifield OF Alex Gordon OF Brandon Moss SS Ramón Torres",NA,"Matt Olson","5.27%",5
60,777676637,"louiswat",0,148,"P Max Scherzer P Jesse Chávez OF Aaron Judge 1B Alex Avila 3B Todd Frazier C J.T. Realmuto SS Eric Sogard 2B Whit Merrifield OF Eric Thames OF Brandon Moss",NA,"Francisco Lindor","5.10%",5
61,777737897,"alphonsodudley4479",0,147.75,"P Max Scherzer P Luis Severino 3B Nicholas Castellanos C Willson Contreras OF Ian Happ 2B Yolmer Sánchez SS Freddy Galvis OF Alex Gordon 1B Matt Davidson OF Clint Frazier",NA,"Jake Lamb","5.10%",5
62,777681300,"milli05",0,146.4,"P Max Scherzer P Tim Adleman OF Bryce Harper 3B Miguel Sanó OF Eddie Rosario C Brian McCann 1B Kendrys Morales 2B Brandon Drury OF Mark Trumbo SS Trevor Story",NA,"Andrew Benintendi","5.10%",11
63,777735300,"Dope_Smokin_DJs",0,145.95,"P James Paxton P Sean Manaea 2B Robinson Canó 3B José Ramírez OF Ryan Braun 1B Eric Hosmer OF Stephen Piscotty OF Shin-soo Choo C Manny Piña SS Alcides Escobar",NA,"José Ramírez","5.10%",41
64,777753306,"SkippyJay97 (2/3)",0,145.85,"P José Quintana P Jeff Samardzija 3B Miguel Sanó OF Giancarlo Stanton 2B Brian Dozier C J.T. Realmuto 1B Justin Bour OF Christian Yelich OF Marcell Ozuna SS Ramón Torres",NA,"Melky Cabrera","4.93%",20
65,777688588,"SUNSET76 (9/15)",0,145.7,"P Max Scherzer P Taijuan Walker OF Bryce Harper 2B Daniel Murphy 3B Anthony Rendon 1B Adam Lind OF Jorge Soler OF Ty Kelly SS Wilmer Difo C Héctor Sánchez",NA,"Yoenis Céspedes","4.93%",2
66,777761904,"hawk2116 (2/10)",0,144.45,"P Max Scherzer P Sean Manaea OF Giancarlo Stanton C Salvador Perez 2B Brian Dozier 1B Justin Bour 3B Manny Machado OF Marcell Ozuna OF Brandon Moss SS Ramón Torres",NA,"J.D. Martinez","4.93%",12
67,777685653,"SUNSET76 (5/15)",0,144.3,"P Max Scherzer P Jake Arrieta 2B José Altuve 3B Kris Bryant OF Marwin González OF Carlos Beltrán 1B Yuli Gurriel C Russell Martin OF Norichika Aoki SS Ramón Torres",NA,"Matt Davidson","4.93%",2
68,777718744,"jusaf10 (2/2)",0,144.25,"P Max Scherzer P Dan Straily 2B José Altuve 3B Miguel Sanó 1B Eric Hosmer OF Melky Cabrera OF Marcell Ozuna SS José Iglesias OF Peter Bourjos C Chris Stewart",NA,"Brian McCann","4.93%",2
69,777761658,"M4wood",0,143.6,"P Max Scherzer P Rafael Montero OF Giancarlo Stanton C J.T. Realmuto 1B Justin Bour 2B Jonathan Schoop OF Adam Jones 3B Manny Machado OF Marcell Ozuna SS José Iglesias",NA,"Freddy Galvis","4.76%",3
70,777673469,"lamondatd",0,143.3,"P Alex Cobb P Jhoulys Chacin OF George Springer 1B Joey Votto 3B José Ramírez SS Chris Owings OF Steven Souza Jr. C Robinson Chirinos OF Shin-soo Choo 2B José Pirela",NA,"Addison Russell","4.59%",8
71,777759200,"pigskin101",0,143.2,"P James Paxton P Taijuan Walker OF Adam Duvall OF Khris Davis OF Ryan Braun 1B Hanley Ramirez 3B Miguel Sanó 2B Dustin Pedroia SS Francisco Lindor C Jonathan Lucroy",NA,"Jon Jay","4.59%",0
72,777712923,"BigPete1988",0,143.15,"P Drew Pomeranz P Jhoulys Chacin OF Mookie Betts OF Khris Davis 3B Justin Turner 1B Miguel Cabrera 2B Ben Zobrist SS Eric Sogard OF Eric Thames C Mike Zunino",NA,"Trevor Williams","4.42%",13.1
73,777623858,"quietstormms32",0,142.7,"P Max Scherzer P Taijuan Walker OF Jackie Bradley Jr. SS Didi Gregorius 1B Logan Morrison 3B Hernán Pérez 2B Jonathan Schoop OF Marcell Ozuna C Christian Vázquez OF Mark Trumbo",NA,"Ben Zobrist","4.42%",4
74,777742339,"buchris532 (6/11)",0,142.6,"P Max Scherzer P Rafael Montero OF Jorge Bonifacio 1B Logan Morrison 2B Brian Dozier C J.T. Realmuto OF Marcell Ozuna OF Mallex Smith SS Eduardo Escobar 3B Martín Prado",NA,"Christian Yelich","4.42%",29
75,777761908,"hawk2116 (6/10)",0,142.5,"P Carlos Martínez P James Paxton 1B Anthony Rizzo 3B Kris Bryant C Willson Contreras OF Eric Thames OF Christian Yelich OF Marcell Ozuna 2B Alen Hanson SS Brandon Crawford",NA,"José Altuve","4.42%",3
76,777549262,"jaduff28 (1/3)",0,142.45,"P Max Scherzer P Sean Manaea 3B Nolan Arenado 1B Anthony Rizzo OF Josh Reddick 2B Javier Báez OF Nick Williams OF Mark Trumbo C Ryan Hanigan SS Ramón Torres",NA,"Asdrúbal Cabrera","4.25%",0
77,777740225,"shanehw (2/3)",0,141.95,"P James Paxton P Sean Manaea OF Bryce Harper 2B Robinson Canó OF Andrew Benintendi 1B Mitch Moreland C Salvador Perez SS Zack Cozart 3B Manny Machado OF Byron Buxton",NA,"Chris Taylor","4.25%",3
78,777677439,"shag_nast",0,141.65,"P Max Scherzer P Mike Clevinger C Willson Contreras 2B Eric Sogard OF Matt Kemp SS Zack Cozart 1B Eric Thames 3B Joey Gallo OF Marcell Ozuna OF Trey Mancini",NA,"Miguel Cabrera","4.25%",2
78,777767037,"pepman9",0,141.65,"P Max Scherzer P Mike Clevinger OF Giancarlo Stanton OF Lonnie Chisenhall OF Billy Hamilton 1B Carlos Santana C Willson Contreras 2B Javier Báez SS Freddy Galvis 3B Darwin Barney",NA,"Russell Martin","4.25%",0
80,777715546,"Camikazee (1/2)",0,141.45,"P Max Scherzer P Sean Manaea OF Bryce Harper 1B Anthony Rizzo OF Billy Hamilton 2B Brian Dozier OF Clint Frazier C Jesús Sucre 3B D.J. Peterson SS Ramón Torres",NA,"Julio Teheran","4.08%",22.05
80,777723024,"Camikazee (2/2)",0,141.45,"P Max Scherzer P Sean Manaea OF Bryce Harper 1B Anthony Rizzo OF Billy Hamilton 2B Brian Dozier OF Clint Frazier C Jesús Sucre 3B D.J. Peterson SS Ramón Torres",NA,"Corey Seager","4.08%",17
82,777688618,"SUNSET76 (12/15)",0,141.3,"P Max Scherzer P Jake Arrieta OF Charlie Blackmon 1B Eric Hosmer C Salvador Perez 2B Brian Dozier 3B Maikel Franco OF Jorge Soler SS Alcides Escobar OF Brandon Moss",NA,"Dan Straily","4.08%",15.9
83,777733564,"upton-maddux",0,141,"P Jeff Samardzija P Sean Manaea OF Aaron Judge 3B Kris Bryant 1B Logan Morrison C J.T. Realmuto OF Brandon Belt 2B Jonathan Schoop OF Christian Yelich SS Trevor Story",NA,"Brandon Belt","4.08%",26
84,777673665,"jongibson25",0,140.95,"P Sean Manaea P Jhoulys Chacin OF Aaron Judge OF Mookie Betts 2B José Altuve OF J.D. Martinez 1B Ryon Healy 3B Manny Machado C Brian McCann SS Adam Rosales",NA,"Jackie Bradley Jr.","4.08%",11
85,777667031,"FrankBostonTank",0,140.3,"P Max Scherzer P Jake Arrieta OF Yoenis Céspedes 1B Danny Valencia 3B Josh Donaldson OF Daniel Nava OF Christian Yelich C Matt Wieters 2B Javier Báez SS Max Moroff",NA,"Travis Wood","4.08%",6.8
86,777686071,"bkukor",0,140.2,"P Max Scherzer P James Paxton 1B Justin Bour 2B Jonathan Schoop OF Eric Thames 3B Manny Machado OF Trey Mancini SS Troy Tulowitzki OF Mark Trumbo C Caleb Joseph",NA,"Trevor Story","4.08%",12
87,777707514,"coachcd13",0,139.95,"P James Paxton P Sean Manaea C Gary Sánchez OF Khris Davis 1B Anthony Rizzo 3B Kris Bryant SS Didi Gregorius 2B Ian Happ OF Jaycob Brugman OF Matt Olson",NA,"Jay Bruce","4.08%",2
88,777685658,"SUNSET76 (6/15)",0,139.7,"P Max Scherzer P Taijuan Walker OF George Springer SS Carlos Correa OF Josh Reddick OF Carlos Beltrán C Brian McCann 1B Tommy Joseph 2B Taylor Featherston 3B Rubén Tejada",NA,"Jorge Bonifacio","4.08%",2
89,777779833,"bangush (2/3)",0,139.4,"P Drew Pomeranz P Sean Manaea OF Mookie Betts OF Andrew Benintendi 1B Hanley Ramirez OF Jackie Bradley Jr. SS Asdrúbal Cabrera 3B Evan Longoria C René Rivera 2B Taylor Featherston",NA,"Nolan Arenado","3.91%",8
90,777739539,"9768e",0,139.3,"P Max Scherzer P José Quintana OF Andrew Benintendi 2B Dustin Pedroia 1B Albert Pujols OF Seth Smith OF Mark Trumbo SS Orlando Arcia 3B Rubén Tejada C Chris Stewart",NA,"Jean Segura","3.91%",20
91,777749161,"cking29",0,138.9,"P James Paxton P Julio Teheran 3B Nolan Arenado OF Charlie Blackmon SS Xander Bogaerts C Buster Posey 2B Dustin Pedroia 1B Matt Carpenter OF Ian Happ OF Hunter Pence",NA,"Dustin Pedroia","3.91%",23
92,777706945,"Badseed66",0,138.75,"P Justin Verlander P Alex Cobb OF Mookie Betts OF Bryce Harper 1B Justin Smoak SS Andrelton Simmons 3B Todd Frazier 2B Whit Merrifield OF Peter Bourjos C Tony Wolters",NA,"Justin Bour","3.91%",9
93,777688620,"SUNSET76 (13/15)",0,138.3,"P Max Scherzer P Jake Arrieta 2B Robinson Canó 3B Jake Lamb OF Chris Owings OF Chris Herrmann C Bruce Maxwell OF Matt Olson 1B Luis Valbuena SS Ramón Torres",NA,"Yasmani Grandal","3.74%",16
93,777688633,"SUNSET76 (14/15)",0,138.3,"P Max Scherzer P Jake Arrieta 2B Robinson Canó 3B Jake Lamb OF Chris Owings OF Chris Herrmann C Bruce Maxwell OF Matt Olson 1B Luis Valbuena SS Ramón Torres",NA,"Devin Mesoraco","3.74%",0
93,777688646,"SUNSET76 (15/15)",0,138.3,"P Max Scherzer P Jake Arrieta 2B Robinson Canó 3B Jake Lamb OF Chris Owings OF Chris Herrmann C Bruce Maxwell OF Matt Olson 1B Luis Valbuena SS Ramón Torres",NA,"Robinson Chirinos","3.57%",10
96,777770546,"FootballFoolery",0,138.15,"P Jeff Samardzija P Tyson Ross 1B Joey Votto 2B José Ramírez OF Scooter Gennett 3B Miguel Sanó OF Melky Cabrera OF Brandon Belt SS Zack Cozart C Devin Mesoraco",NA,"Chris Owings","3.57%",18
97,777689899,"thedlmatt (2/2)",0,137.75,"P Jeff Samardzija P James Paxton SS Carlos Correa 3B Kris Bryant C J.T. Realmuto 1B Justin Bour 2B Jonathan Schoop OF Adam Jones OF Christian Yelich OF Mark Trumbo",NA,"Jonathan Lucroy","3.57%",7
98,777773300,"GhettoAztec",0,137.7,"P Kenta Maeda P Alex Cobb OF Mookie Betts 2B José Ramírez 3B Kris Bryant 1B Hanley Ramirez C Matt Wieters SS Addison Russell OF Jon Jay OF Clint Frazier",NA,"Héctor Santiago","3.57%",-0.1
99,777707896,"luckyleo_101",0,137.65,"P Max Scherzer P Mike Clevinger OF Corey Dickerson 1B Eric Hosmer C Salvador Perez 3B Evan Longoria OF Marcell Ozuna SS Alcides Escobar OF Brandon Moss 2B Darwin Barney",NA,"Alcides Escobar","3.57%",14
100,777716999,"wreich0721",0,137.5,"P Kenta Maeda P Rafael Montero OF Mookie Betts SS Elvis Andrus 3B Kris Bryant 1B José Abreu OF Yasiel Puig OF Eric Thames C Yasmani Grandal 2B Brandon Drury",NA,"T.J. Rivera","3.40%",14
101,777717341,"MutableLeopard",0,137.2,"P Jake Arrieta P Rafael Montero OF Bryce Harper SS Elvis Andrus C Gary Sánchez 3B Kris Bryant OF José Bautista 2B Dustin Pedroia 1B Logan Morrison OF Clint Frazier",NA,"Chris Herrmann","3.40%",0
102,777678023,"badger3fan",0,137.15,"P Max Scherzer P Travis Wood OF Corey Dickerson OF Steven Souza Jr. SS Didi Gregorius 3B Evan Longoria 1B Logan Morrison 2B Ian Happ OF Manuel Margot C Yasmani Grandal",NA,"Aaron Altherr","3.40%",0
102,777728976,"stevviev",0,137.15,"P Kenta Maeda P Dan Straily 2B Robinson Canó 3B José Ramírez OF J.D. Martinez OF Lonnie Chisenhall 1B Matt Carpenter OF Shin-soo Choo SS Alcides Escobar C Martín Maldonado",NA,"Matt Joyce","3.40%",2
104,777744882,"BarnesBoyz1724 (2/2)",0,136.5,"P Carlos Martínez P James Paxton C Salvador Perez OF Melky Cabrera 1B Matt Carpenter OF Nick Markakis 2B Whit Merrifield SS Zack Cozart 3B Manny Machado OF Christian Yelich",NA,"Mike Zunino","3.23%",0
105,777756508,"dylana13",0,136.3,"P Max Scherzer P Jake Arrieta OF Adam Duvall 1B Josh Bell C Chris Herrmann OF John Jaso SS Jordy Mercer OF Gregory Polanco 2B Alen Hanson 3B Martín Prado",NA,"Yasiel Puig","3.23%",8
106,777684914,"AddItUpBaby",0,135.7,"P Luis Severino P Drew Pomeranz OF Jay Bruce C Buster Posey 1B Brandon Belt OF Hunter Pence 2B Whit Merrifield OF Eric Thames SS Addison Russell 3B Martín Prado",NA,"Scooter Gennett","3.23%",7
107,777692457,"teltran1",0,135.4,"P Drew Pomeranz P Sean Manaea SS Jean Segura 1B Hanley Ramirez C Buster Posey OF Domingo Santana OF Billy Hamilton OF Adam Jones 3B Manny Machado 2B Javier Báez",NA,"Austin Slater","3.23%",0
108,777760604,"km2939",0,135.35,"P Drew Pomeranz P Tim Adleman OF Mookie Betts 1B Joey Votto 2B José Altuve OF Andrew Benintendi OF Jackie Bradley Jr. 3B Evan Longoria C Christian Vázquez SS Alcides Escobar",NA,"Todd Frazier","3.23%",11
109,777730197,"Americasteam2277",0,134.45,"P Max Scherzer P Trevor Williams 2B Robinson Canó 1B Miguel Cabrera OF Lonnie Chisenhall OF Hunter Renfroe 3B Manny Machado C Russell Martin OF Clint Frazier SS Dansby Swanson",NA,"Daniel Murphy","3.23%",11
110,777729960,"hightopsfeet",0,134.25,"P Luis Severino P Jhoulys Chacin OF Bryce Harper OF Corey Dickerson 3B Adrián Béltre SS Didi Gregorius C Alex Avila 2B Jason Kipnis OF Marcell Ozuna 1B Mike Napoli",NA,"Eduardo Escobar","3.23%",6
