"Rank","EntryId","EntryName","TimeRemaining","Points","Lineup","X","Player","X.Drafted","FPTS"
560,758917422,"darcmaniluk (34/50)",0,120.8,"P Max Scherzer P Jake Arrieta OF Steven Souza Jr. 2B Rougned Odor OF Josh Reddick 3B Evan Longoria OF George Springer C Evan Gattis 1B Yuli Gurriel SS Tim Beckham",NA,"","",NA
560,758938682,"shayray",0,120.8,"P Max Scherzer P Zack Godley OF Bryce Harper 1B Matt Carpenter OF Andrew Benintendi 2B Rougned Odor 3B Evan Longoria OF George Springer SS Tim Beckham C Austin Romine",NA,"","",NA
560,758952447,"twbizzell (5/5)",0,120.8,"P Max Scherzer P Zack Godley OF Bryce Harper OF Michael Conforto 3B Anthony Rendon OF Jay Bruce 1B Adam Lind SS Tim Beckham 2B Andrés Blanco C Derek Norris",NA,"","",NA
560,759031816,"rommels91",0,120.8,"P Jake Arrieta P Zack Godley OF Aaron Judge 1B Justin Bour SS Chris Owings OF Aaron Hicks 2B Dee Gordon OF Yasmany Tomás C Jonathan Lucroy 3B Greg Garcia",NA,"","",NA
560,759056638,"Tglodek11 (27/30)",0,120.8,"P Max Scherzer P Zack Godley 1B Edwin Encarnación OF Michael Brantley SS Francisco Lindor OF Josh Reddick 3B José Ramírez 2B Starlin Castro C Evan Gattis OF Odúbel Herrera",NA,"","",NA
566,758893730,"ocdobv (2/50)",0,120.75,"P Alex Wood P Masahiro Tanaka SS Trea Turner 3B Jedd Gyorko 1B Matt Carpenter OF Dexter Fowler 2B Kolten Wong OF Tommy Pham OF George Springer C Martín Maldonado",NA,"","",NA
566,759010639,"bcalicore (47/50)",0,120.75,"P Max Scherzer OF Khris Davis OF Giancarlo Stanton OF Nelson Cruz 2B Jed Lowrie 1B Tommy Joseph 3B Trevor Plouffe C Stephen Vogt SS Adam Rosales P Mike Clevinger",NA,"","",NA
568,758914709,"eagles51020 (12/20)",0,120.6,"P Max Scherzer P Aaron Nola 3B Nolan Arenado 2B José Altuve OF Nelson Cruz SS Carlos Correa OF George Springer OF Carlos Beltrán 1B Yuli Gurriel C Martín Maldonado",NA,"","",NA
568,758939575,"martin_joonya (1/2)",0,120.6,"P Max Scherzer P Aaron Nola 1B Matt Carpenter 3B Manny Machado OF Nelson Cruz SS Carlos Correa 2B Rougned Odor OF Tommy Pham OF Justin Ruggiano C Martín Maldonado",NA,"","",NA
568,759024655,"sharksbay99 (1/2)",0,120.6,"P Max Scherzer P Luis Perdomo OF Aaron Judge OF José Bautista 1B Hanley Ramírez SS Carlos Correa 2B Rougned Odor C Salvador Perez OF Odúbel Herrera 3B Josh Rutledge",NA,"","",NA
568,759028340,"braakchalk (2/6)",0,120.6,"P Max Scherzer P Eduardo Rodríguez OF Aaron Altherr 3B Maikel Franco OF Shin-soo Choo 2B Neil Walker OF Michael Saunders 1B Tommy Joseph C Cameron Rupp SS Tim Beckham",NA,"","",NA
568,759060612,"ce2525 (1/2)",0,120.6,"P Max Scherzer P Aaron Nola OF Aaron Judge SS Carlos Correa 3B Mike Moustakas 2B Rougned Odor OF Josh Reddick OF Brandon Belt 1B Yuli Gurriel C Austin Hedges",NA,"","",NA
568,759069995,"underjones (26/50)",0,120.6,"P Max Scherzer P Aaron Nola 3B Joey Gallo SS Carlos Correa 2B Rougned Odor OF Josh Reddick 1B Mike Napoli OF George Springer C Evan Gattis OF Jared Hoying",NA,"","",NA
568,759057984,"gustavo0413 (4/5)",0,120.6,"P Eduardo Rodríguez P Zack Godley 1B Paul Goldschmidt 3B Jake Lamb OF Aaron Judge SS Chris Owings OF David Peralta OF Aaron Hicks 2B Starlin Castro C Martín Maldonado",NA,"","",NA
575,758917396,"darcmaniluk (8/50)",0,120.55,"P Max Scherzer P Jesse Chávez OF José Bautista OF Kevin Pillar 3B Mike Moustakas 2B Devon Travis 1B Kendrys Morales OF Lorenzo Cain C Russell Martin SS Alcides Escobar",NA,"","",NA
576,758975060,"lionssuck",0,120.45,"P Max Scherzer OF Aaron Hicks OF George Springer OF Kole Calhoun 3B Luis Valbuena 1B Yuli Gurriel C Devin Mesoraco 2B Andrés Blanco SS JT Riddle P Jacob deGrom",NA,"","",NA
577,758902461,"SlowQueen (14/50)",0,120.4,"P Alex Wood P Júnior Guerra OF Charlie Blackmon OF José Bautista 3B Josh Donaldson SS Trevor Story 2B DJ LeMahieu OF Kevin Pillar 1B Kendrys Morales C Russell Martin",NA,"","",NA
577,759025709,"CJNIII (2/3)",0,120.4,"P Alex Wood P Júnior Guerra OF Charlie Blackmon SS Trea Turner 3B Jedd Gyorko 1B Matt Carpenter OF Dexter Fowler 2B Jason Kipnis OF Bradley Zimmer C Yasmani Grandal",NA,"","",NA
577,759034647,"ehafner (41/50)",0,120.4,"P Max Scherzer P Mike Bolsinger OF Mookie Betts OF Michael Conforto 1B Mitch Moreland OF Andrew Benintendi SS José Reyes 2B Neil Walker C Christian Vázquez 3B Josh Rutledge",NA,"","",NA
580,758960169,"mark3821 (2/4)",0,120.3,"P Zack Godley P Héctor Santiago 1B Paul Goldschmidt OF Mike Trout OF Charlie Blackmon 3B Nolan Arenado 2B Robinson Canó OF Brett Gardner C J.T. Realmuto SS J.J. Hardy",NA,"","",NA
580,759046124,"windsordjay",0,120.3,"P Max Scherzer P Héctor Santiago 3B Jedd Gyorko 1B Matt Carpenter OF Giancarlo Stanton OF Matt Kemp C J.T. Realmuto OF George Springer 2B Jonathan Schoop SS J.J. Hardy",NA,"","",NA
582,758917415,"darcmaniluk (27/50)",0,120.2,"P Chris Archer SS Carlos Correa OF Josh Reddick OF George Springer C Evan Gattis 3B Ryan Schimpf 1B Yuli Gurriel 2B Yangervis Solarte OF Cory Spangenberg P Jacob deGrom",NA,"","",NA
583,758946873,"cremedelasauce",0,120.15,"P Alex Wood P Zack Godley SS Trea Turner OF Michael Conforto 1B Matt Carpenter OF Brett Gardner 2B Devon Travis OF Tommy Pham 3B Greg Garcia C Yasmani Grandal",NA,"","",NA
583,758986965,"Tolpeko (7/50)",0,120.15,"P Alex Wood P Jake Arrieta OF José Bautista OF Khris Davis 2B Jed Lowrie 1B Kendrys Morales SS Troy Tulowitzki OF Matt Joyce 3B Trevor Plouffe C Stephen Vogt",NA,"","",NA
585,759039451,"Grhaas08",0,120.1,"P Max Scherzer P Kevin Gausman 1B Joey Votto OF Nelson Cruz SS Jean Segura OF Christian Yelich 3B Evan Longoria 2B Jonathan Schoop C Matt Wieters OF Odúbel Herrera",NA,"","",NA
586,758984905,"APKiller (1/2)",0,120.05,"P Max Scherzer P Júnior Guerra SS Trea Turner 3B Nolan Arenado 1B Matt Carpenter OF Nelson Cruz C Yadier Molina OF Tommy Pham OF George Springer 2B Andrés Blanco",NA,"","",NA
586,758994413,"APKiller (2/2)",0,120.05,"P Max Scherzer P Júnior Guerra SS Trea Turner 3B Nolan Arenado 1B Matt Carpenter OF Nelson Cruz C Yadier Molina OF Tommy Pham OF George Springer 2B Andrés Blanco",NA,"","",NA
586,759018642,"immoney",0,120.05,"P Max Scherzer P Júnior Guerra SS Trea Turner 1B Eric Thames 3B Jedd Gyorko OF Nelson Cruz OF Tommy Pham OF Lorenzo Cain C Jonathan Lucroy 2B Andrés Blanco",NA,"","",NA
589,758895483,"papagates (7/50)",0,119.9,"P Chris Archer P Alex Wood OF Mike Trout OF Khris Davis 2B Jed Lowrie 1B Ryon Healy OF Rajai Davis 3B Ryan Schimpf C Austin Hedges SS Allen Cordoba",NA,"","",NA
590,758913425,"jaystellmach",0,119.8,"P Max Scherzer P Zack Godley 1B Edwin Encarnación OF Michael Brantley SS Francisco Lindor 2B Kolten Wong 3B José Ramírez OF Nick Markakis OF Matt Adams C Tyler Flowers",NA,"","",NA
590,758943766,"Da_Banditz",0,119.8,"P Max Scherzer P Zack Godley OF Bryce Harper SS Xander Bogaerts 1B Matt Carpenter OF Josh Reddick 3B Evan Longoria C Stephen Vogt 2B Yangervis Solarte OF Justin Ruggiano",NA,"","",NA
592,758973570,"jbarks06 (11/25)",0,119.75,"P Dan Straily 1B Mark Reynolds SS Francisco Lindor OF Adam Jones OF Aaron Altherr 2B José Ramírez 3B Ryon Healy C Christian Vázquez OF Jared Hoying P Jacob deGrom",NA,"","",NA
593,758937006,"oliphantj15 (2/3)",0,119.4,"P Masahiro Tanaka P Zack Godley OF Charlie Blackmon OF Bryce Harper OF Mookie Betts 2B José Altuve C Buster Posey 1B Brandon Belt 3B Evan Longoria SS Brandon Crawford",NA,"","",NA
593,758946073,"scout326 (21/50)",0,119.4,"P Max Scherzer P Mike Bolsinger 3B Nolan Arenado 1B Mark Reynolds 2B José Altuve OF Carlos González SS Carlos Correa OF George Springer C Evan Gattis OF Jake Marisnick",NA,"","",NA
593,758946085,"scout326 (33/50)",0,119.4,"P Max Scherzer P Mike Bolsinger OF Bryce Harper SS Trea Turner OF Corey Dickerson 1B Logan Morrison OF Jayson Werth 3B Evan Longoria C Derek Norris 2B Daniel Robertson",NA,"","",NA
596,758895493,"papagates (17/50)",0,119.35,"P Chris Archer P Aaron Nola OF Charlie Blackmon SS Trevor Story 2B DJ LeMahieu OF Khris Davis 1B Wil Myers 3B Ryan Schimpf OF Cory Spangenberg C Austin Hedges",NA,"","",NA
597,758884504,"shawnzhan (4/50)",0,119.25,"P Max Scherzer P Joe Musgrove 2B José Altuve SS Jean Segura OF Josh Reddick OF George Springer 3B Kyle Seager C Evan Gattis 1B Danny Valencia OF Guillermo Heredia",NA,"","",NA
598,758938866,"madrevenge",0,119.2,"P Masahiro Tanaka P Aaron Nola OF Aaron Judge 2B José Altuve 1B Hanley Ramírez 3B Manny Machado OF Giancarlo Stanton SS Jean Segura C Welington Castillo OF Mark Canha",NA,"","",NA
598,759002446,"ahurley23 (15/50)",0,119.2,"P Masahiro Tanaka P Aaron Nola 3B Nolan Arenado 1B Mark Reynolds 2B José Altuve OF Ian Desmond SS Carlos Correa C Yadier Molina OF George Springer OF Carlos Beltrán",NA,"","",NA
600,758893756,"ocdobv (28/50)",0,119.15,"P Alex Wood P Zack Godley OF Bryce Harper SS Trea Turner 3B Jedd Gyorko OF Dexter Fowler C Yadier Molina OF Jayson Werth 2B José Ramírez 1B Adam Lind",NA,"","",NA
600,758986998,"Tolpeko (40/50)",0,119.15,"P Alex Wood P Jake Arrieta OF Randal Grichuk OF Dexter Fowler 1B Justin Bour 2B Dee Gordon C Yadier Molina OF Christian Yelich 3B Derek Dietrich SS JT Riddle",NA,"","",NA
600,759044900,"juanshen (11/50)",0,119.15,"P Chris Archer P Mike Bolsinger OF Charlie Blackmon 3B Nolan Arenado OF Carlos González 2B DJ LeMahieu 1B Ian Desmond OF Steven Souza Jr. C Mike Zunino SS Tim Beckham",NA,"","",NA
603,758884536,"shawnzhan (36/50)",0,119.05,"P Max Scherzer P Júnior Guerra OF José Bautista 3B Josh Donaldson 2B José Altuve SS Carlos Correa 1B Justin Smoak OF George Springer OF Carlos Beltrán C Russell Martin",NA,"","",NA
603,758958675,"jictor",0,119.05,"P Max Scherzer P Júnior Guerra 3B Anthony Rendon OF Andrew Benintendi OF Mark Trumbo SS Carlos Correa 2B Devon Travis 1B Buster Posey OF Josh Reddick C Evan Gattis",NA,"","",NA
605,758912898,"petteytheft89 (25/35)",0,119,"P Masahiro Tanaka P Mike Bolsinger OF Charlie Blackmon 3B Nolan Arenado OF Randal Grichuk SS Trevor Story 2B DJ LeMahieu 1B Ian Desmond OF Nelson Cruz C Yadier Molina",NA,"","",NA
606,758986999,"Tolpeko (41/50)",0,118.95,"P Alex Wood P Aaron Nola 3B Jedd Gyorko OF Randal Grichuk OF Dexter Fowler 1B Justin Bour 2B Dee Gordon C J.T. Realmuto OF Christian Yelich SS JT Riddle",NA,"","",NA
607,758917406,"darcmaniluk (18/50)",0,118.9,"P Chris Archer P Alex Wood SS Francisco Lindor 2B Jason Kipnis 1B Carlos Santana OF Josh Reddick 3B José Ramírez C Evan Gattis OF Carlos Beltrán OF Daniel Robertson",NA,"","",NA
607,758987846,"getchia (1/5)",0,118.9,"P Max Scherzer P Antonio Senzatela OF Aaron Judge 1B Eric Thames OF Khris Davis 3B Joey Gallo OF Nelson Cruz 2B Starlin Castro SS Tim Beckham C Martín Maldonado",NA,"","",NA
609,758983271,"FlyingSquirrels48609",0,118.85,"P Max Scherzer P Matt Cain SS Francisco Lindor OF Kevin Pillar 1B Yonder Alonso OF Shin-soo Choo C Buster Posey OF George Springer 2B Neil Walker 3B Logan Forsythe",NA,"","",NA
610,758895488,"papagates (12/50)",0,118.8,"P Max Scherzer P Jake Arrieta 2B Brian Dozier OF Steven Souza Jr. OF Matt Joyce OF Mark Canha 3B Trevor Plouffe C Stephen Vogt 1B Rickie Weeks Jr. SS Tim Beckham",NA,"","",NA
610,758917405,"darcmaniluk (17/50)",0,118.8,"P Max Scherzer P Jake Arrieta 1B Hanley Ramírez OF Andrew Benintendi 2B Rougned Odor OF Shin-soo Choo C Christian Vázquez SS Tim Beckham OF Jared Hoying 3B Deven Marrero",NA,"","",NA
610,759071056,"brettpanter66 (3/5)",0,118.8,"P Max Scherzer P Zack Godley 3B Jake Lamb OF Corey Dickerson OF Randal Grichuk OF Steven Souza Jr. C Buster Posey 1B Rickie Weeks Jr. SS Tim Beckham 2B Daniel Robertson",NA,"","",NA
613,758915894,"eagles51020 (20/20)",0,118.6,"P Max Scherzer P Eduardo Rodríguez 3B Manny Machado OF Aaron Altherr SS Carlos Correa OF Michael Saunders C Evan Gattis OF Odúbel Herrera 1B Yuli Gurriel 2B Andrés Blanco",NA,"","",NA
613,759069970,"underjones (1/50)",0,118.6,"P Max Scherzer P Aaron Nola 3B Joey Gallo OF Aaron Altherr SS Elvis Andrus OF Shin-soo Choo C Jonathan Lucroy 1B Tommy Joseph OF Odúbel Herrera 2B Andrés Blanco",NA,"","",NA
613,758985551,"tsfizzle13 (4/5)",0,118.6,"P Eduardo Rodríguez P Zack Godley OF Mookie Betts SS Xander Bogaerts 3B Jedd Gyorko 1B Hanley Ramírez OF Andrew Benintendi OF Steven Souza Jr. 2B Neil Walker C Evan Gattis",NA,"","",NA
616,758969114,"dzynski",0,118.5,"P Chris Archer OF Scott Schebler SS Zack Cozart 2B José Peraza OF Domingo Santana 3B Hernán Pérez OF Denard Span C Jett Bandy 1B Adrián González P Mike Clevinger",NA,"","",NA
616,758979697,"otbjoe (7/8)",0,118.5,"P Chris Archer OF Dexter Fowler 1B Justin Bour 3B Hernán Pérez 2B Rougned Odor C Jonathan Lucroy OF Michael Saunders OF Jason Heyward SS Taylor Motter P Mike Clevinger",NA,"","",NA
618,758974709,"SeligKcim",0,118.45,"P Max Scherzer 3B Evan Longoria C Jonathan Lucroy 1B Tommy Joseph OF Odúbel Herrera OF Kole Calhoun OF Guillermo Heredia 2B Andrés Blanco SS Alcides Escobar P Jacob deGrom",NA,"","",NA
618,759009058,"bbrookie9 (3/3)",0,118.45,"P Zack Godley 1B Paul Goldschmidt SS Chris Owings OF Aaron Hicks 3B Evan Longoria OF George Springer 2B Starlin Castro OF Odúbel Herrera C Chris Iannetta P Jacob deGrom",NA,"","",NA
618,759051223,"hopandgo",0,118.45,"P Alex Wood P Yovani Gallardo 1B Paul Goldschmidt 3B Jake Lamb OF Bryce Harper SS Chris Owings OF Keon Broxton OF Domingo Santana 2B Jonathan Schoop C Matt Wieters",NA,"","",NA
621,758933448,"fallfromgrace (11/50)",0,118.4,"P Max Scherzer P Mike Bolsinger OF Bryce Harper OF Mookie Betts SS Trea Turner OF Jayson Werth 3B Evan Longoria 1B Adam Lind C Matt Wieters 2B Andrés Blanco",NA,"","",NA
621,758940246,"Dunnit247",0,118.4,"P Max Scherzer P Mike Bolsinger OF Mike Trout OF José Bautista 3B Josh Donaldson 2B Devon Travis 1B Kendrys Morales SS Troy Tulowitzki OF Kole Calhoun C Derek Norris",NA,"","",NA
621,758973842,"errovike (5/8)",0,118.4,"P Carlos Martínez P Aaron Nola 1B Edwin Encarnación 3B Jedd Gyorko 2B Dee Gordon OF Giancarlo Stanton SS Jean Segura OF Hernán Pérez OF Marcell Ozuna C J.T. Realmuto",NA,"","",NA
624,758987185,"dogmeat58",0,118.35,"P Chris Archer P Carlos Martínez 1B Joey Votto OF Kevin Pillar OF Marcell Ozuna OF Lorenzo Cain 2B José Ramírez C Jonathan Lucroy 3B Luis Valbuena SS Alcides Escobar",NA,"","",NA
625,759002391,"ahurley23 (6/50)",0,118.2,"P Masahiro Tanaka P Aaron Nola OF Bryce Harper SS Trea Turner OF Aaron Judge 3B Anthony Rendon OF Jayson Werth 2B Starlin Castro 1B Adam Lind C Austin Romine",NA,"","",NA
626,758895479,"papagates (3/50)",0,118.15,"P Max Scherzer P Alex Wood OF Khris Davis OF Steven Souza Jr. 2B Jed Lowrie 3B Evan Longoria OF Mark Canha 1B Rickie Weeks Jr. C Derek Norris SS Adam Rosales",NA,"","",NA
626,758895522,"papagates (46/50)",0,118.15,"P Max Scherzer P Alex Wood OF Khris Davis 2B Brian Dozier OF Rajai Davis 1B Kennys Vargas OF Mark Canha 3B Trevor Plouffe C Jason Castro SS Adam Rosales",NA,"","",NA
626,758917423,"darcmaniluk (35/50)",0,118.15,"P Max Scherzer P Alex Wood 2B Jason Kipnis 1B Carlos Santana OF Shin-soo Choo 3B José Ramírez C Jonathan Lucroy SS Tim Beckham OF Jared Hoying OF Daniel Robertson",NA,"","",NA
626,758935392,"tinderella (31/50)",0,118.15,"P Chris Archer P Mike Bolsinger OF Charlie Blackmon 3B Nolan Arenado OF Carlos González 2B DJ LeMahieu SS Carlos Correa OF George Springer C Evan Gattis 1B Yuli Gurriel",NA,"","",NA
626,758954841,"ftbll6235",0,118.15,"P Max Scherzer P Alex Wood 3B Joey Gallo 2B Rougned Odor OF Shin-soo Choo OF Tommy Pham C Russell Martin 1B Rickie Weeks Jr. SS Tim Beckham OF Jared Hoying",NA,"","",NA
626,759005729,"Theblender (39/50)",0,118.15,"P Chris Archer P Masahiro Tanaka OF Michael Conforto 1B Logan Morrison SS Corey Seager OF Cody Bellinger 3B Evan Longoria OF Odúbel Herrera 2B Logan Forsythe C Derek Norris",NA,"","",NA
632,758893763,"ocdobv (35/50)",0,118.05,"P Max Scherzer P Júnior Guerra OF José Bautista 3B Josh Donaldson OF Kevin Pillar 1B Kendrys Morales SS Troy Tulowitzki 2B José Ramírez OF George Springer C Evan Gattis",NA,"","",NA
632,758924244,"ganondorf (42/50)",0,118.05,"P Max Scherzer P Júnior Guerra OF Mike Trout OF Aaron Judge 1B Matt Carpenter OF Khris Davis 2B Jed Lowrie 3B Ryon Healy C Stephen Vogt SS Adam Rosales",NA,"","",NA
632,758933463,"fallfromgrace (26/50)",0,118.05,"P Max Scherzer P Júnior Guerra OF José Bautista 3B Josh Donaldson 1B Matt Carpenter 2B Devon Travis SS Troy Tulowitzki C Buster Posey OF George Springer OF Ezequiel Carrera",NA,"","",NA
632,759045891,"bellaedward4eva (36/50)",0,118.05,"P Max Scherzer P Júnior Guerra OF Mookie Betts 2B Jonathan Villar 1B Hanley Ramírez OF Keon Broxton OF Hernán Pérez SS Orlando Arcia C Jett Bandy 3B Josh Rutledge",NA,"","",NA
636,758946084,"scout326 (32/50)",0,117.95,"P Alex Wood P Aaron Nola OF Bryce Harper SS Trea Turner 3B Anthony Rendon OF Aaron Altherr OF Jayson Werth 1B Tommy Joseph C Matt Wieters 2B Andrés Blanco",NA,"","",NA
636,759048391,"Gordon-Shumway (17/23)",0,117.95,"P Alex Wood P Aaron Nola OF Bryce Harper SS Trea Turner 3B Anthony Rendon OF Jayson Werth C Jonathan Lucroy OF George Springer 2B Starlin Castro 1B Adam Lind",NA,"","",NA
638,759010628,"bcalicore (36/50)",0,117.9,"P Chris Archer P Alex Wood OF Khris Davis OF Jay Bruce 2B Jed Lowrie OF Tommy Pham 3B Ryon Healy 1B Tommy Joseph C Stephen Vogt SS Adam Rosales",NA,"","",NA
639,758933330,"twomindsbluff (7/10)",0,117.8,"P Max Scherzer P Zack Godley OF Bryce Harper 1B Matt Carpenter OF Dexter Fowler 2B Jason Kipnis OF George Springer C Matt Wieters SS Tim Beckham 3B Andrés Blanco",NA,"","",NA
639,758991347,"coachspath1 (4/4)",0,117.8,"P Max Scherzer P Zack Godley SS Xander Bogaerts OF Khris Davis 2B Jed Lowrie 3B Evan Longoria OF Matt Joyce OF George Springer 1B Ryon Healy C Stephen Vogt",NA,"","",NA
639,759006967,"rktman16",0,117.8,"P Max Scherzer P Zack Godley OF Bryce Harper 1B Matt Carpenter OF Andrew Benintendi 2B Rougned Odor OF Josh Reddick 3B Evan Longoria SS Tim Beckham C René Rivera",NA,"","",NA
639,759034963,"mjmass2223",0,117.8,"P Max Scherzer P Zack Godley OF Andrew Benintendi OF Nomar Mazara SS Carlos Correa 2B Rougned Odor OF Shin-soo Choo 1B Matt Holliday C Jonathan Lucroy 3B Rio Ruiz",NA,"","",NA
643,758993000,"windchimesRrude (7/32)",0,117.65,"P Zack Godley OF Charlie Blackmon 3B Jedd Gyorko 1B Matt Carpenter SS Trevor Story OF Carlos González OF Dexter Fowler 2B Kolten Wong C Tony Wolters P Sean Manaea",NA,"","",NA
643,759047062,"smoulder",0,117.65,"P Chris Archer P A.J. Griffin 1B Mitch Moreland OF Nomar Mazara 3B Joey Gallo OF Giancarlo Stanton SS Elvis Andrus 2B Rougned Odor C Matt Wieters OF Delino DeShields",NA,"","",NA
645,758893733,"ocdobv (5/50)",0,117.6,"P Max Scherzer P Aaron Nola 3B Jedd Gyorko SS Carlos Correa 1B Kendrys Morales OF Josh Reddick OF George Springer C Evan Gattis OF Carlos Beltrán 2B Andrés Blanco",NA,"","",NA
645,758895505,"papagates (29/50)",0,117.6,"P Max Scherzer P Aaron Nola OF Khris Davis 2B Jed Lowrie 3B Mike Moustakas OF Brandon Moss C Salvador Perez OF Matt Joyce 1B Ryon Healy SS Adam Rosales",NA,"","",NA
645,759069974,"underjones (5/50)",0,117.6,"P Max Scherzer P Aaron Nola SS Elvis Andrus 2B Rougned Odor 3B Maikel Franco OF Shin-soo Choo C Jonathan Lucroy OF Michael Saunders 1B Tommy Joseph OF Odúbel Herrera",NA,"","",NA
645,759070003,"underjones (34/50)",0,117.6,"P Max Scherzer P Aaron Nola OF Bryce Harper SS Trea Turner OF Jayson Werth 3B Evan Longoria OF Michael A. Taylor 1B Rickie Weeks Jr. C Derek Norris 2B Daniel Robertson",NA,"","",NA
645,759050059,"Skoorbtra (6/13)",0,117.6,"P Eduardo Rodríguez P Zack Godley 1B Paul Goldschmidt 3B Jake Lamb SS Xander Bogaerts OF Andrew Benintendi OF David Peralta 2B Neil Walker C Evan Gattis OF Grégor Blanco",NA,"","",NA
650,758977775,"mafiaman4",0,117.55,"P Max Scherzer P Chris Archer OF Steven Souza Jr. 3B Evan Longoria OF Michael Saunders 1B Tommy Joseph OF Odúbel Herrera SS Tim Beckham 2B Andrés Blanco C René Rivera",NA,"","",NA
650,758993022,"windchimesRrude (29/32)",0,117.55,"P Chris Archer P Zack Godley 1B Paul Goldschmidt SS Chris Owings OF David Peralta 3B Manny Machado OF Seth Smith 2B Jonathan Schoop OF Hyun Soo Kim C Chris Iannetta",NA,"","",NA
652,758884515,"shawnzhan (15/50)",0,117.4,"P Max Scherzer P Masahiro Tanaka 2B Robinson Canó OF Nelson Cruz SS Jean Segura OF Steven Souza Jr. 3B Evan Longoria 1B Rickie Weeks Jr. OF Guillermo Heredia C Derek Norris",NA,"","",NA
652,758908942,"DEADFISH52",0,117.4,"P Carlos Martínez P Eduardo Rodríguez 1B Joey Votto OF Brett Gardner OF Giancarlo Stanton OF Brandon Moss 2B Josh Harrison C Jonathan Lucroy 3B Ryon Healy SS Brandon Crawford",NA,"","",NA
652,758929752,"Caiman",0,117.4,"P Alex Wood P Júnior Guerra OF Charlie Blackmon OF Mookie Betts 1B Joey Votto 2B José Altuve SS Corey Seager 3B Evan Longoria C Jonathan Lucroy OF George Springer",NA,"","",NA
652,758989019,"cwright1087",0,117.4,"OF Andrew Benintendi SS Elvis Andrus OF Marcell Ozuna 2B Rougned Odor 1B Kendrys Morales 3B Evan Longoria OF Odúbel Herrera C Derek Norris P Jacob deGrom P Mike Clevinger",NA,"","",NA
652,759023412,"gehrenberg (9/19)",0,117.4,"P Max Scherzer P Masahiro Tanaka 3B Jedd Gyorko 1B Matt Carpenter OF Dexter Fowler 2B Kolten Wong OF Tommy Pham SS Tim Beckham OF Justin Ruggiano C Martín Maldonado",NA,"","",NA
652,759045870,"bellaedward4eva (15/50)",0,117.4,"P Alex Wood P Júnior Guerra OF Bryce Harper SS Trea Turner 2B Jonathan Villar 1B Eric Thames 3B Travis Shaw OF Domingo Santana OF Hernán Pérez C Matt Wieters",NA,"","",NA
652,759050527,"Skoorbtra (12/13)",0,117.4,"P Eduardo Rodríguez P Aaron Nola OF Aaron Judge OF Michael Conforto 3B Jedd Gyorko OF Jay Bruce SS Francisco Lindor 1B Lucas Duda 2B Neil Walker C Derek Norris",NA,"","",NA
659,759002486,"ahurley23 (20/50)",0,117.3,"P Max Scherzer P Héctor Santiago OF Michael Brantley SS Francisco Lindor 2B Jason Kipnis 1B Carlos Santana 3B José Ramírez OF George Springer C Evan Gattis OF Carlos Beltrán",NA,"","",NA
660,758944985,"sfhc1922 (1/6)",0,117.25,"P Eduardo Rodríguez SS Carlos Correa 1B Lucas Duda 3B Alex Bregman OF Josh Reddick C Welington Castillo OF Curtis Granderson 2B Jonathan Schoop OF Carlos Beltrán P Jacob deGrom",NA,"","",NA
661,758917404,"darcmaniluk (16/50)",0,117.15,"P Max Scherzer P Alex Wood OF Nelson Cruz OF Jayson Werth 3B Kyle Seager OF Michael A. Taylor 1B Adam Lind C Matt Wieters 2B Taylor Motter SS Wilmer Difo",NA,"","",NA
661,758935362,"tinderella (1/50)",0,117.15,"P Alex Wood P Zack Godley OF Bryce Harper SS Trea Turner OF Aaron Judge 3B Anthony Rendon OF Aaron Hicks 1B Matt Holliday 2B Starlin Castro C Austin Romine",NA,"","",NA
661,759003124,"forlife36 (3/5)",0,117.15,"P Max Scherzer P Alex Wood 3B Manny Machado SS Carlos Correa OF George Springer OF Seth Smith C Evan Gattis OF Kole Calhoun 1B Yuli Gurriel 2B Andrés Blanco",NA,"","",NA
661,759005728,"Theblender (38/50)",0,117.15,"P Chris Archer P Masahiro Tanaka OF José Bautista OF Kevin Pillar 2B Devon Travis C Buster Posey 3B Evan Longoria OF George Springer 1B Rickie Weeks Jr. SS Tim Beckham",NA,"","",NA
661,759034894,"burnie4488",0,117.15,"P Max Scherzer P Alex Wood 3B Manny Machado SS Carlos Correa OF George Springer OF Seth Smith C Evan Gattis OF Kole Calhoun 1B Yuli Gurriel 2B Andrés Blanco",NA,"","",NA
661,759045868,"bellaedward4eva (13/50)",0,117.15,"P Max Scherzer P Alex Wood 2B Jed Lowrie OF Brandon Moss C Salvador Perez OF Matt Joyce 1B Ryon Healy OF Mark Canha 3B Trevor Plouffe SS Alcides Escobar",NA,"","",NA
667,758986997,"Tolpeko (39/50)",0,117.1,"P Alex Wood OF Randal Grichuk OF Dexter Fowler 1B Justin Bour 2B Dee Gordon C J.T. Realmuto OF Christian Yelich SS Greg Garcia 3B Derek Dietrich P Mike Clevinger",NA,"","",NA
668,758924211,"ganondorf (9/50)",0,117.05,"P Max Scherzer P Júnior Guerra OF Aaron Judge 3B Josh Donaldson OF Aaron Hicks SS Carlos Correa 1B Kendrys Morales OF Tommy Pham 2B Starlin Castro C Russell Martin",NA,"","",NA
669,758893759,"ocdobv (31/50)",0,116.8,"P Max Scherzer P Zack Godley OF Randal Grichuk 2B Brian Dozier OF Steven Souza Jr. C Yadier Molina 3B Evan Longoria SS Greg Garcia OF Kevin Kiermaier 1B Rickie Weeks Jr.",NA,"","",NA
669,758895485,"papagates (9/50)",0,116.8,"P Max Scherzer P Jake Arrieta OF Khris Davis 2B Brian Dozier OF Matt Joyce 3B Ryon Healy 1B Kennys Vargas C Stephen Vogt OF Eddie Rosario SS Adam Rosales",NA,"","",NA
669,758946096,"scout326 (44/50)",0,116.8,"P Max Scherzer P Zack Godley OF Mike Trout 1B Matt Carpenter 2B Kolten Wong SS Andrelton Simmons OF Tommy Pham OF Kole Calhoun 3B Luis Valbuena C Martín Maldonado",NA,"","",NA
669,758997152,"oliphantj15 (3/3)",0,116.8,"P Max Scherzer P Zack Godley OF Bryce Harper 1B Matt Carpenter OF Nelson Cruz 3B Evan Longoria C Jonathan Lucroy OF George Springer 2B Jonathan Schoop SS Alcides Escobar",NA,"","",NA
669,759034636,"ehafner (30/50)",0,116.8,"P Max Scherzer P Zack Godley OF Mike Trout 3B Jedd Gyorko 2B Kolten Wong 1B Albert Pujols SS Andrelton Simmons OF Tommy Pham OF Kole Calhoun C Martín Maldonado",NA,"","",NA
669,759056367,"JFerrie23 (2/3)",0,116.8,"P Max Scherzer P Zack Godley OF Bryce Harper OF Aaron Judge 3B Anthony Rendon OF Jayson Werth 2B Starlin Castro 1B Adam Lind SS Tim Beckham C Derek Norris",NA,"","",NA
675,758986970,"Tolpeko (12/50)",0,116.75,"P Max Scherzer OF Khris Davis SS Carlos Correa 2B Jed Lowrie OF Matt Joyce OF George Springer 3B Trevor Plouffe C Stephen Vogt 1B Yuli Gurriel P Mike Clevinger",NA,"","",NA
675,759016037,"jdhender (4/5)",0,116.75,"P Max Scherzer OF Corey Dickerson 1B Logan Morrison OF Steven Souza Jr. 3B Evan Longoria OF George Springer C Evan Gattis SS Tim Beckham 2B Andrés Blanco P Mike Clevinger",NA,"","",NA
677,759002385,"ahurley23 (5/50)",0,116.7,"P Masahiro Tanaka P Dan Straily OF Bryce Harper SS Trea Turner OF Dexter Fowler 3B Anthony Rendon 2B Kolten Wong C Yadier Molina OF Jayson Werth 1B Adam Lind",NA,"","",NA
678,758884519,"shawnzhan (19/50)",0,116.6,"P Max Scherzer P Aaron Nola OF Nomar Mazara OF Steven Souza Jr. 2B Rougned Odor OF Shin-soo Choo 3B Evan Longoria C Jonathan Lucroy 1B Rickie Weeks Jr. SS Tim Beckham",NA,"","",NA
