"Rank","EntryId","EntryName","TimeRemaining","Points","Lineup","X","Player","X.Drafted","FPTS"
1,759062150,"TON80",0,195.8,"P Max Scherzer P Zack Godley OF Bryce Harper OF Michael Conforto OF Jay Bruce SS José Reyes 1B Lucas Duda 2B Neil Walker 3B Andrés Blanco C Martín Maldonado",NA,"Max Scherzer","54.12%",43.9
2,758976251,"gchmiele (2/2)",0,189.4,"P Max Scherzer P Masahiro Tanaka OF José Bautista OF Mark Trumbo OF Steven Souza Jr. 3B Mike Moustakas 1B Mike Napoli 2B Neil Walker SS Tim Beckham C Martín Maldonado",NA,"Tim Beckham","21.68%",3
3,758905464,"eagles51020 (1/20)",0,185.05,"P Max Scherzer P Júnior Guerra OF Charlie Blackmon 3B Nolan Arenado 1B Mark Reynolds SS Trevor Story OF Carlos González OF Carlos Beltrán 2B Andrés Blanco C Martín Maldonado",NA,"Aaron Nola","21.26%",8.7
4,758933446,"fallfromgrace (9/50)",0,176.05,"P Max Scherzer P Júnior Guerra OF Charlie Blackmon 3B Nolan Arenado OF Carlos González 1B Ian Desmond OF George Springer 2B Neil Walker C Tony Wolters SS Tim Beckham",NA,"George Springer","20.07%",6
5,758976269,"Starscream99 (3/4)",0,173.8,"P Max Scherzer P Zack Godley OF Mookie Betts OF Michael Conforto OF Jay Bruce 3B José Reyes 1B Lucas Duda 2B Neil Walker SS Tim Beckham C Martín Maldonado",NA,"Matt Carpenter","18.79%",3
6,759045878,"bellaedward4eva (23/50)",0,173.55,"P Chris Archer P Zack Godley OF Charlie Blackmon 3B Nolan Arenado SS Trevor Story 2B Rougned Odor 1B Mike Napoli OF Delino DeShields C Tony Wolters OF Jared Hoying",NA,"Evan Longoria","17.09%",0
7,758893746,"ocdobv (18/50)",0,173.05,"P Max Scherzer P Júnior Guerra OF Bryce Harper SS Trea Turner OF Steven Souza Jr. 3B Mike Moustakas 2B Rougned Odor OF Jayson Werth 1B Adam Lind C Matt Wieters",NA,"Zack Godley","17.01%",21.9
8,758900184,"dacoltz (32/50)",0,171.8,"P Max Scherzer P Zack Godley 1B Justin Bour 2B Dee Gordon OF Giancarlo Stanton SS Elvis Andrus OF Marcell Ozuna OF Christian Yelich 3B Evan Longoria C Derek Norris",NA,"Jedd Gyorko","16.58%",0
9,758896296,"damoney8888 (4/5)",0,170.5,"P Max Scherzer OF Charlie Blackmon SS Corey Seager 3B Evan Longoria 2B José Ramírez OF George Springer 1B Matt Adams C Tony Wolters OF Carlos Beltrán P Tim Adleman",NA,"Evan Gattis","15.94%",6
10,759024717,"sabercat1",0,168.9,"P Max Scherzer P Antonio Senzatela 3B Anthony Rendon 1B Jay Bruce OF Adam Duvall SS Carlos Correa OF Josh Reddick 2B Neil Walker OF Matt Adams C Tyler Flowers",NA,"Dexter Fowler","15.35%",3
11,758958829,"neldozer (3/4)",0,168.7,"P Júnior Guerra OF Bryce Harper OF Carlos González OF Giancarlo Stanton SS Carlos Correa 1B Justin Smoak 3B Evan Longoria 2B Neil Walker C Matt Wieters P Jacob deGrom",NA,"Alex Wood","15.22%",28.25
12,758977894,"otbjoe (1/8)",0,167.85,"P Masahiro Tanaka P Joe Musgrove SS Trea Turner 2B Jonathan Villar 3B Travis Shaw 1B Hanley Ramírez OF Yasmany Tomás C J.T. Realmuto OF Christian Yelich OF Kevin Kiermaier",NA,"Carlos Correa","14.37%",8
13,759029826,"dschmiege",0,167.8,"P Max Scherzer P Zack Godley 3B Nolan Arenado SS Trevor Story OF Matt Kemp 1B Lucas Duda 2B Neil Walker C Yasmani Grandal OF Nick Markakis OF Guillermo Heredia",NA,"Tommy Pham","13.86%",3
14,759010625,"bcalicore (33/50)",0,166.55,"P Chris Archer P Zack Godley OF Charlie Blackmon 3B Nolan Arenado 1B Mark Reynolds SS Trevor Story 2B Jonathan Schoop C Tony Wolters OF Justin Ruggiano OF Daniel Robertson",NA,"José Altuve","13.39%",0
15,758895520,"papagates (44/50)",0,166.15,"P Max Scherzer P Alex Wood OF Jay Bruce 1B Lucas Duda OF Matt Joyce 3B Ryon Healy 2B Neil Walker OF Mark Canha C Stephen Vogt SS Adam Rosales",NA,"Yadier Molina","12.88%",3
16,758985527,"tsfizzle13 (1/5)",0,165.6,"P Max Scherzer P Eduardo Rodríguez 1B Justin Smoak OF Josh Reddick 3B Evan Longoria C Jonathan Lucroy OF George Springer 2B Neil Walker OF Carlos Beltrán SS Tim Beckham",NA,"Chris Archer","12.76%",35.65
16,759055067,"cashman19 (2/3)",0,165.6,"P Eduardo Rodríguez P Zack Godley 3B Jake Lamb OF Bryce Harper OF Andrew Benintendi OF Nomar Mazara SS Carlos Correa 1B Lucas Duda C Jonathan Lucroy 2B Neil Walker",NA,"Bryce Harper","12.12%",18
18,758893766,"ocdobv (38/50)",0,165.4,"P Max Scherzer P Masahiro Tanaka 3B Josh Donaldson SS Carlos Correa OF Josh Reddick OF George Springer 2B Neil Walker C Evan Gattis OF Carlos Beltrán 1B Rickie Weeks Jr.",NA,"Starlin Castro","11.78%",3
19,759044456,"richwill27 (5/10)",0,164.45,"P Max Scherzer SS Asdrúbal Cabrera OF Josh Reddick OF George Springer 2B Neil Walker 1B Yuli Gurriel 3B Deven Marrero OF Ezequiel Carrera C Martín Maldonado P Jacob deGrom",NA,"Júnior Guerra","11.52%",17.15
20,758933459,"fallfromgrace (22/50)",0,164.05,"P Max Scherzer P Júnior Guerra OF Charlie Blackmon 3B Nolan Arenado 1B Mark Reynolds OF Carlos González OF George Springer C Tony Wolters SS Tim Beckham 2B Andrés Blanco",NA,"Andrés Blanco","10.93%",9
21,758902961,"cjs5555 (3/3)",0,163.8,"P Max Scherzer P Zack Godley OF Bryce Harper 3B Kris Bryant SS Jean Segura OF Jayson Werth 2B Neil Walker 1B Adam Lind C Matt Wieters OF Guillermo Heredia",NA,"Mike Clevinger","10.71%",9.85
22,758956127,"cammander2 (3/3)",0,163.6,"P Max Scherzer P Eduardo Rodríguez OF Aaron Judge 1B Justin Smoak OF Steven Souza Jr. OF Christian Yelich 2B Starlin Castro SS Orlando Arcia 3B Deven Marrero C Martín Maldonado",NA,"José Bautista","10.59%",0
23,758917391,"darcmaniluk (3/50)",0,163.55,"P Max Scherzer P Chris Archer OF Jayson Werth OF Curtis Granderson 2B Neil Walker OF Michael A. Taylor 1B Adam Lind SS Wilmer Difo 3B Andrés Blanco C René Rivera",NA,"Eduardo Rodríguez","10.54%",20.7
24,758993012,"windchimesRrude (19/32)",0,163.15,"P Alex Wood P Zack Godley OF Charlie Blackmon 3B Nolan Arenado SS Trevor Story OF Carlos González 2B Devon Travis 1B Kendrys Morales C Russell Martin OF Ezequiel Carrera",NA,"Derek Norris","9.95%",0
25,759002411,"ahurley23 (8/50)",0,163.05,"P Max Scherzer P Júnior Guerra OF Charlie Blackmon OF Corey Dickerson 2B DJ LeMahieu 1B Logan Morrison 3B Evan Longoria OF Kevin Kiermaier C Tony Wolters SS Tim Beckham",NA,"Greg Garcia","9.35%",0
26,758973375,"jbarks06 (10/25)",0,162.85,"P Chris Archer P Dan Straily OF Charlie Blackmon 3B Nolan Arenado 1B Mark Reynolds OF George Springer 2B Starlin Castro C Stephen Vogt OF Jake Marisnick SS Christian Arroyo",NA,"Josh Reddick","9.14%",5
27,758978122,"gfay63 (34/50)",0,162.8,"P Max Scherzer P Zack Godley OF Michael Brantley OF Giancarlo Stanton OF Kevin Pillar 1B Kendrys Morales SS Troy Tulowitzki 3B Evan Longoria 2B Neil Walker C Russell Martin",NA,"Mike Bolsinger","9.10%",4.5
27,759034645,"ehafner (39/50)",0,162.8,"P Max Scherzer P Zack Godley OF Mike Trout 2B Dee Gordon OF Giancarlo Stanton 1B Albert Pujols OF Marcell Ozuna SS Andrelton Simmons 3B Luis Valbuena C Martín Maldonado",NA,"Mookie Betts","8.63%",2
29,758964935,"Toothbrush (2/9)",0,162.45,"P Max Scherzer 1B Kendrys Morales OF George Springer OF Odúbel Herrera OF Carlos Beltrán C Chris Iannetta 3B Josh Rutledge SS Tim Beckham 2B Andrés Blanco P Jacob deGrom",NA,"Andrew Benintendi","8.50%",0
30,758946065,"scout326 (13/50)",0,162.4,"P Max Scherzer P Mike Bolsinger OF Bryce Harper 3B Anthony Rendon 1B Justin Bour 2B Dee Gordon OF Giancarlo Stanton OF Christian Yelich C Matt Wieters SS Wilmer Difo",NA,"Nelson Cruz","8.50%",0
30,759034630,"ehafner (24/50)",0,162.4,"P Max Scherzer P Mike Bolsinger 1B Justin Bour SS Francisco Lindor OF Giancarlo Stanton 2B Jason Kipnis OF Marcell Ozuna C J.T. Realmuto OF Christian Yelich 3B José Ramírez",NA,"Aaron Judge","7.87%",8
32,758985533,"tsfizzle13 (2/5)",0,161.8,"P Max Scherzer P Zack Godley OF Corey Dickerson OF Jay Bruce 1B Logan Morrison OF Steven Souza Jr. 3B Evan Longoria 2B Neil Walker C Evan Gattis SS Tim Beckham",NA,"Francisco Lindor","7.74%",10
33,758946095,"scout326 (43/50)",0,161.6,"P Max Scherzer P Aaron Nola 1B Justin Bour 2B Dee Gordon OF Giancarlo Stanton C J.T. Realmuto OF Christian Yelich OF Odúbel Herrera SS Freddy Galvis 3B Andrés Blanco",NA,"Jason Kipnis","7.48%",0
34,759034608,"ehafner (2/50)",0,161.4,"P Max Scherzer P Mike Bolsinger OF Charlie Blackmon 3B Nolan Arenado 2B DJ LeMahieu 1B Logan Morrison OF Steven Souza Jr. OF Kevin Kiermaier SS Tim Beckham C Derek Norris",NA,"Steven Souza Jr.","7.40%",14
35,759019250,"braakchalk (1/6)",0,160.8,"P Max Scherzer P Zack Godley OF Michael Conforto OF Jay Bruce 1B Lucas Duda SS Asdrúbal Cabrera 3B Evan Longoria 2B Neil Walker C Evan Gattis OF Carlos Beltrán",NA,"Odúbel Herrera","7.27%",7
36,758981985,"cwest827",0,160.45,"P Eduardo Rodríguez OF Charlie Blackmon OF Bryce Harper 3B Anthony Rendon SS Jean Segura OF Jayson Werth C Jonathan Lucroy 1B Luis Valbuena 2B Danny Espinosa P Sean Manaea",NA,"Josh Donaldson","6.93%",5
37,758998962,"getchia (3/5)",0,160.4,"P Max Scherzer P Masahiro Tanaka OF Nelson Cruz SS Corey Seager 2B Rougned Odor OF Christian Yelich 3B Evan Longoria C Russell Martin 1B Adrián González OF Andrew McCutchen",NA,"Randal Grichuk","6.80%",5
38,758884525,"shawnzhan (25/50)",0,160.05,"P Max Scherzer P Júnior Guerra OF Bryce Harper SS Trea Turner 2B Dee Gordon C J.T. Realmuto OF Christian Yelich OF Jayson Werth 1B Adam Lind 3B Derek Dietrich",NA,"Mike Trout","6.68%",6
38,759005694,"Theblender (4/50)",0,160.05,"P Masahiro Tanaka OF José Bautista 1B Justin Smoak OF Steven Souza Jr. 3B Evan Longoria OF Curtis Granderson 2B Neil Walker C Russell Martin SS Tim Beckham P Jacob deGrom",NA,"Russell Martin","6.59%",5
40,758952689,"xXxPLOSIVE",0,159.4,"P Max Scherzer P Masahiro Tanaka OF Bryce Harper OF Giancarlo Stanton 1B Kendrys Morales 3B Evan Longoria C Evan Gattis OF Kole Calhoun SS Tim Beckham 2B Andrés Blanco",NA,"Charlie Blackmon","6.42%",34
40,759034613,"ehafner (7/50)",0,159.4,"P Max Scherzer P Mike Bolsinger SS Trea Turner 3B Anthony Rendon 2B Dee Gordon OF Giancarlo Stanton OF Marcell Ozuna C J.T. Realmuto OF Christian Yelich 1B Adam Lind",NA,"Neil Walker","6.34%",37
42,758893761,"ocdobv (33/50)",0,159.05,"P Max Scherzer P Júnior Guerra SS Trea Turner 2B Brian Dozier 1B Logan Morrison OF Steven Souza Jr. OF Jayson Werth 3B Evan Longoria OF Kevin Kiermaier C Matt Wieters",NA,"Rougned Odor","6.29%",20
42,758935380,"tinderella (19/50)",0,159.05,"P Max Scherzer P Júnior Guerra OF Bryce Harper 3B Anthony Rendon SS Elvis Andrus 2B Rougned Odor OF Shin-soo Choo OF Jayson Werth 1B Mike Napoli C Matt Wieters",NA,"Masahiro Tanaka","6.29%",37.5
44,758900178,"dacoltz (26/50)",0,158.9,"P Aaron Nola P Dan Straily OF Bryce Harper SS Trea Turner 3B Anthony Rendon 1B Justin Bour 2B Dee Gordon OF Giancarlo Stanton OF Christian Yelich C Matt Wieters",NA,"Anthony Rendon","6.21%",7
45,759010630,"bcalicore (38/50)",0,158.8,"P Max Scherzer P Zack Godley OF Mookie Betts SS Xander Bogaerts OF Giancarlo Stanton OF Jackie Bradley Jr. 2B Neil Walker 1B Adam Lind C Christian Vázquez 3B Josh Rutledge",NA,"Khris Davis","6.21%",8
46,758978128,"gfay63 (40/50)",0,157.8,"P Max Scherzer P Zack Godley OF José Bautista 3B Josh Donaldson OF Giancarlo Stanton 1B Kendrys Morales OF Shin-soo Choo 2B Neil Walker C Russell Martin SS JT Riddle",NA,"Michael Brantley","6.16%",7
47,758953111,"DCSTEEL28",0,156.6,"P Eduardo Rodríguez P Zack Godley OF Charlie Blackmon 3B Jake Lamb 1B Mark Reynolds SS Trevor Story OF Khris Davis 2B Jed Lowrie C Evan Gattis OF Ezequiel Carrera",NA,"Kendrys Morales","6.08%",17
47,758995779,"melzi44",0,156.6,"P Max Scherzer P Eduardo Rodríguez OF Michael Conforto 1B Lucas Duda SS Asdrúbal Cabrera OF Curtis Granderson 2B Neil Walker OF Seth Smith 3B Chase Headley C Martín Maldonado",NA,"Trea Turner","6.04%",19
49,758917432,"darcmaniluk (44/50)",0,156.55,"P Max Scherzer P Chris Archer 3B Mike Moustakas 1B Carlos Santana OF Lorenzo Cain 2B José Ramírez OF Bradley Zimmer SS Alcides Escobar OF Daniel Robertson C Martín Maldonado",NA,"Carlos González","5.99%",0
50,758968475,"tsschroe (1/2)",0,156.45,"P Max Scherzer OF Bryce Harper 2B Jonathan Schoop OF Kole Calhoun 1B Yuli Gurriel OF Jake Marisnick SS Wilmer Difo 3B Andrés Blanco C Martín Maldonado P Jacob deGrom",NA,"Jake Arrieta","5.91%",19.9
51,758987001,"Tolpeko (43/50)",0,156.1,"P Alex Wood OF José Bautista 3B Josh Donaldson 1B Justin Bour OF Giancarlo Stanton 2B Devon Travis C J.T. Realmuto OF Christian Yelich SS JT Riddle P Mike Clevinger",NA,"José Ramírez","5.82%",14
51,759035761,"MagicEnsemble",0,156.1,"P Max Scherzer P Dan Straily 3B Jedd Gyorko 1B Justin Bour 2B Dee Gordon OF Giancarlo Stanton OF Marcell Ozuna OF Christian Yelich C René Rivera SS Adam Rosales",NA,"Kevin Pillar","5.74%",0
53,758884520,"shawnzhan (20/50)",0,156.05,"P Max Scherzer P Júnior Guerra OF Bryce Harper SS Trea Turner 3B Anthony Rendon 2B Rougned Odor OF Shin-soo Choo 1B Mike Napoli C Matt Wieters OF Jared Hoying",NA,"Jacob deGrom","5.48%",36.55
53,758998124,"getchia (2/5)",0,156.05,"P Max Scherzer P Júnior Guerra OF Mookie Betts SS Trea Turner 3B Nolan Arenado 1B Carlos Santana OF George Springer 2B Neil Walker C Matt Wieters OF Andrew McCutchen",NA,"Manny Machado","5.44%",10
55,758884527,"shawnzhan (27/50)",0,155.6,"P Max Scherzer P Aaron Nola 1B Justin Bour 2B Dee Gordon OF Giancarlo Stanton OF Christian Yelich 3B Evan Longoria OF Kevin Kiermaier SS Tim Beckham C Derek Norris",NA,"Buster Posey","5.40%",2
55,759000766,"gustavo0413 (3/5)",0,155.6,"P Eduardo Rodríguez P Zack Godley OF Bryce Harper SS Trea Turner OF Michael Conforto 3B Anthony Rendon OF Jay Bruce C J.T. Realmuto 2B Neil Walker 1B Adam Lind",NA,"Xander Bogaerts","5.23%",5
57,758904378,"Coffeeman112",0,155.45,"P Masahiro Tanaka P Matt Cain OF Charlie Blackmon OF Aaron Judge 3B Travis Shaw 1B Logan Morrison 2B Javier Báez SS Corey Seager OF Steven Souza Jr. C Evan Gattis",NA,"Matt Holliday","5.23%",0
58,758987004,"Tolpeko (46/50)",0,154.95,"P Alex Wood P Aaron Nola OF José Bautista 3B Josh Donaldson 1B Justin Bour OF Giancarlo Stanton 2B Devon Travis C J.T. Realmuto OF Christian Yelich SS JT Riddle",NA,"Rickie Weeks Jr.","5.14%",3
59,759015649,"thortynumber22",0,154.6,"P Max Scherzer P Aaron Nola OF Michael Conforto OF Steven Souza Jr. 1B Lucas Duda 3B Evan Longoria OF Kevin Kiermaier 2B Neil Walker C Russell Martin SS Tim Beckham",NA,"Nolan Arenado","5.14%",16
60,759012774,"ahurley23 (50/50)",0,154.4,"P Max Scherzer P Mike Bolsinger OF Charlie Blackmon 3B Nolan Arenado 1B Mark Reynolds OF Carlos González 2B DJ LeMahieu OF George Springer SS Tim Beckham C Martín Maldonado",NA,"Carlos Beltrán","5.10%",14
61,758884540,"shawnzhan (40/50)",0,154.05,"P Max Scherzer P Júnior Guerra OF Bryce Harper 3B Anthony Rendon SS Elvis Andrus 2B Rougned Odor OF Shin-soo Choo OF Jayson Werth C Jonathan Lucroy 1B Adam Lind",NA,"Michael Conforto","5.06%",4
62,758963666,"ragu201",0,153.65,"P Zack Godley 1B Paul Goldschmidt 3B Jake Lamb OF Bryce Harper OF Mookie Betts SS Carlos Correa 2B Jed Lowrie OF Marcell Ozuna C Martín Maldonado P Sean Manaea",NA,"Martín Maldonado","5.02%",21
63,759034631,"ehafner (25/50)",0,153.4,"P Max Scherzer P Mike Bolsinger OF Bryce Harper SS Trea Turner 3B Josh Donaldson 2B Devon Travis 1B Kendrys Morales OF Jayson Werth C Russell Martin OF Ezequiel Carrera",NA,"Jayson Werth","4.97%",9
64,758973785,"errovike (3/8)",0,153.05,"P Chris Archer P Héctor Santiago 3B Nolan Arenado 1B Mark Reynolds SS Trevor Story OF Nelson Cruz OF Domingo Santana OF Lorenzo Cain 2B Neil Walker C Russell Martin",NA,"Kolten Wong","4.93%",0
65,758995452,"snosauce",0,152.8,"P Max Scherzer P Zack Godley OF Bryce Harper SS Trea Turner 3B Anthony Rendon OF Jayson Werth OF Curtis Granderson 2B Starlin Castro 1B Adam Lind C Martín Maldonado",NA,"Aaron Hicks","4.85%",7
65,759073103,"MichiganKevin (4/4)",0,152.8,"P Max Scherzer P Zack Godley OF Michael Conforto 3B Jedd Gyorko 1B Matt Carpenter OF Jorge Bonifacio SS Greg Garcia OF George Springer 2B Neil Walker C Martín Maldonado",NA,"Giancarlo Stanton","4.68%",22
67,758920811,"Oneninesix9",0,152.7,"P Masahiro Tanaka P Dan Straily OF Charlie Blackmon OF Bryce Harper 2B Robinson Canó 1B Mark Reynolds OF Andrew Benintendi 3B José Ramírez C Christian Vázquez SS Tim Beckham",NA,"Jed Lowrie","4.63%",13
68,758984081,"mikecheckgw (2/3)",0,152.4,"P Max Scherzer P Mike Bolsinger OF Bryce Harper OF Mookie Betts OF Giancarlo Stanton 1B Justin Smoak C Buster Posey 3B Evan Longoria 2B Neil Walker SS Tim Beckham",NA,"Tommy Joseph","4.63%",0
69,759070008,"underjones (39/50)",0,152.1,"P Max Scherzer P Dan Straily OF Michael Conforto 3B Joey Gallo SS Elvis Andrus OF Shin-soo Choo 1B Lucas Duda 2B Neil Walker OF Jared Hoying C René Rivera",NA,"Matt Wieters","4.59%",10
70,758967980,"Starscream99 (1/4)",0,151.8,"P Max Scherzer P Zack Godley OF Bryce Harper SS Trea Turner 3B Anthony Rendon OF Jayson Werth OF George Springer 2B Starlin Castro 1B Adam Lind C Martín Maldonado",NA,"Kole Calhoun","4.59%",3
70,758985545,"tsfizzle13 (3/5)",0,151.8,"P Max Scherzer P Zack Godley OF Michael Conforto OF Jay Bruce 1B Lucas Duda SS Asdrúbal Cabrera 3B Evan Longoria 2B Neil Walker C Evan Gattis OF Matt Adams",NA,"Dan Straily","4.59%",17.2
70,759045896,"bellaedward4eva (41/50)",0,151.8,"P Max Scherzer P Zack Godley 3B Josh Donaldson 2B Dee Gordon OF Giancarlo Stanton 1B Justin Smoak OF Marcell Ozuna SS Troy Tulowitzki C Russell Martin OF Ezequiel Carrera",NA,"Carlos Santana","4.46%",2
70,759055076,"cashman19 (3/3)",0,151.8,"P Max Scherzer P Zack Godley OF Brett Gardner OF Nomar Mazara 2B Rougned Odor 1B Kendrys Morales OF Christian Yelich 3B Evan Longoria C Jonathan Lucroy SS Tim Beckham",NA,"Jonathan Lucroy","4.21%",16
74,758977068,"bamo44",0,151.75,"P Dan Straily 1B Justin Bour 2B Dee Gordon OF Giancarlo Stanton OF Aaron Altherr OF Marcell Ozuna C J.T. Realmuto SS Freddy Galvis 3B Andrés Blanco P Jacob deGrom",NA,"Paul Goldschmidt","4.08%",6
75,758884512,"shawnzhan (12/50)",0,151.6,"P Max Scherzer P Aaron Nola 2B Dee Gordon OF Giancarlo Stanton 3B Mike Moustakas OF Marcell Ozuna OF Christian Yelich C Salvador Perez 1B Eric Hosmer SS Alcides Escobar",NA,"Jonathan Schoop","4.00%",8
76,759010603,"bcalicore (11/50)",0,151.55,"P Chris Archer P Zack Godley 3B Josh Donaldson OF Jay Bruce 1B Justin Smoak OF Kevin Pillar SS Troy Tulowitzki OF Curtis Granderson 2B Neil Walker C Russell Martin",NA,"Mark Trumbo","3.91%",0
77,758964936,"Toothbrush (3/9)",0,151.45,"P Max Scherzer SS Greg Garcia 2B Neil Walker 1B Tommy Joseph OF Nick Markakis C Jett Bandy OF Guillermo Heredia 3B Deven Marrero OF Ezequiel Carrera P Jacob deGrom",NA,"Corey Dickerson","3.91%",5
78,758893741,"ocdobv (13/50)",0,151.2,"P Masahiro Tanaka P Aaron Nola OF Bryce Harper OF Mookie Betts SS Trea Turner 1B Hanley Ramírez OF Andrew Benintendi 2B Neil Walker C Matt Wieters 3B Josh Rutledge",NA,"Matt Joyce","3.87%",4
79,759005732,"Theblender (42/50)",0,151.15,"P Chris Archer P Masahiro Tanaka 3B Josh Donaldson OF Carlos González OF Steven Souza Jr. 2B Devon Travis 1B Kendrys Morales OF Jayson Werth SS Tim Beckham C Derek Norris",NA,"Chris Davis","3.74%",0
80,758884506,"shawnzhan (6/50)",0,151.05,"P Max Scherzer P Júnior Guerra OF Bryce Harper SS Trea Turner 3B Anthony Rendon 2B Rougned Odor OF Shin-soo Choo C Jonathan Lucroy 1B Adam Lind OF Jared Hoying",NA,"Adam Lind","3.70%",3
80,759069993,"underjones (24/50)",0,151.05,"P Max Scherzer P Júnior Guerra OF Bryce Harper SS Trea Turner 3B Anthony Rendon 2B Rougned Odor OF Shin-soo Choo C Jonathan Lucroy 1B Adam Lind OF Jared Hoying",NA,"Welington Castillo","3.61%",0
82,758978138,"gfay63 (50/50)",0,150.8,"P Max Scherzer P Zack Godley OF José Bautista 3B Josh Donaldson OF Giancarlo Stanton 2B Devon Travis 1B Kendrys Morales C Russell Martin OF Andrew McCutchen SS Tim Beckham",NA,"Brett Gardner","3.61%",2
83,758917399,"darcmaniluk (11/50)",0,150.45,"P Max Scherzer OF Kevin Pillar 2B Devon Travis 1B Kendrys Morales C Russell Martin 3B Andrés Blanco OF Ezequiel Carrera OF Daniel Robertson SS Adam Rosales P Jacob deGrom",NA,"Devon Travis","3.61%",30
84,758902960,"cjs5555 (2/3)",0,150.3,"P Max Scherzer P Jaime García 3B Joey Gallo OF Nelson Cruz SS Jean Segura 2B Rougned Odor 1B Mike Napoli C Jonathan Lucroy OF Odúbel Herrera OF Guillermo Heredia",NA,"Shin-soo Choo","3.57%",3
85,758942543,"jstone2424",0,150.15,"P Alex Wood P Zack Godley OF Charlie Blackmon OF Bryce Harper OF José Bautista 3B Josh Donaldson 1B Matt Carpenter 2B Jed Lowrie SS J.J. Hardy C Martín Maldonado",NA,"Justin Smoak","3.53%",20
85,758992996,"windchimesRrude (3/32)",0,150.15,"P Chris Archer P Masahiro Tanaka OF Charlie Blackmon SS Trevor Story OF Carlos González 1B Wil Myers C Tony Wolters 3B Ryan Schimpf 2B Yangervis Solarte OF Cory Spangenberg",NA,"Yuli Gurriel","3.53%",3
87,758956126,"warfsu (5/5)",0,150.1,"P Dan Straily P Zack Godley OF Charlie Blackmon OF Bryce Harper OF José Bautista 3B Josh Donaldson 1B Matt Carpenter SS Carlos Correa 2B Neil Walker C Evan Gattis",NA,"Stephen Vogt","3.49%",16
88,758905535,"eagles51020 (2/20)",0,149.8,"P Max Scherzer P Zack Godley OF José Bautista 3B Josh Donaldson 1B Kendrys Morales SS Troy Tulowitzki OF George Springer 2B Neil Walker OF Matt Adams C Russell Martin",NA,"Hanley Ramírez","3.40%",12
88,759028344,"braakchalk (3/6)",0,149.8,"P Max Scherzer P Zack Godley OF Nomar Mazara 3B Joey Gallo OF Steven Souza Jr. 2B Rougned Odor OF Shin-soo Choo 1B Lucas Duda C Jonathan Lucroy SS Tim Beckham",NA,"Matt Adams","3.36%",5
90,759014766,"RAPIDRIK1",0,149.75,"P Alex Wood P Masahiro Tanaka OF Charlie Blackmon 3B Nolan Arenado 1B Anthony Rizzo 2B Ben Zobrist C J.T. Realmuto OF Nick Markakis OF Kole Calhoun SS J.J. Hardy",NA,"Aaron Altherr","3.36%",9
91,758884542,"shawnzhan (42/50)",0,149.6,"P Max Scherzer P Aaron Nola OF Mike Trout 1B Justin Bour 2B Dee Gordon OF Christian Yelich OF Kole Calhoun 3B Luis Valbuena SS JT Riddle C Martín Maldonado",NA,"Didi Gregorius","3.23%",2
91,758936221,"ojeda5star (2/2)",0,149.6,"P Max Scherzer P Eduardo Rodríguez 3B Anthony Rendon 1B Lucas Duda OF Jayson Werth 2B Neil Walker SS Dansby Swanson OF Matt Adams C Cameron Rupp OF Kole Calhoun",NA,"Yan Gomes","3.15%",0
91,758946066,"scout326 (14/50)",0,149.6,"P Aaron Nola P Zack Godley OF Charlie Blackmon 3B Nolan Arenado 1B Mark Reynolds SS Trevor Story OF Carlos González 2B Rougned Odor OF Shin-soo Choo C Jonathan Lucroy",NA,"Bradley Zimmer","3.10%",7
91,758982030,"Delaweez81 (1/4)",0,149.6,"P Max Scherzer P Eduardo Rodríguez OF Michael Conforto OF Jay Bruce 1B Lucas Duda 3B Greg Garcia 2B Neil Walker C Christian Vázquez SS Tim Beckham OF Daniel Robertson",NA,"Cody Bellinger","3.06%",0
91,759034629,"ehafner (23/50)",0,149.6,"P Max Scherzer P Aaron Nola OF Michael Conforto OF Jay Bruce 1B Lucas Duda 3B Evan Longoria OF Kevin Kiermaier 2B Neil Walker SS Tim Beckham C René Rivera",NA,"DJ LeMahieu","3.06%",5
96,759034652,"ehafner (46/50)",0,149.4,"P Max Scherzer P Mike Bolsinger OF Bryce Harper 3B Anthony Rendon 1B Justin Bour 2B Dee Gordon OF Giancarlo Stanton OF Marcell Ozuna C Matt Wieters SS Wilmer Difo",NA,"Ezequiel Carrera","3.02%",2
97,759005704,"Theblender (14/50)",0,149.35,"P Chris Archer P Eduardo Rodríguez OF Charlie Blackmon OF José Bautista 1B Kendrys Morales 3B Evan Longoria 2B Neil Walker SS Tim Beckham C Derek Norris OF Ezequiel Carrera",NA,"Troy Tulowitzki","2.98%",9
98,759034626,"ehafner (20/50)",0,149.15,"P Max Scherzer P Alex Wood 1B Justin Bour OF Giancarlo Stanton OF Marcell Ozuna 3B Evan Longoria OF Kevin Kiermaier SS Tim Beckham C Derek Norris 2B Daniel Robertson",NA,"Michael Saunders","2.98%",2
99,758893750,"ocdobv (22/50)",0,149.05,"P Max Scherzer P Júnior Guerra OF Mike Trout OF Corey Dickerson 1B Logan Morrison OF Steven Souza Jr. C Yadier Molina 3B Evan Longoria 2B Neil Walker SS Tim Beckham",NA,"Ryon Healy","2.89%",0
100,758913780,"AgLawman (3/3)",0,148.8,"P Max Scherzer P Zack Godley OF Bryce Harper OF Khris Davis 1B Justin Smoak 2B Jed Lowrie OF Matt Joyce 3B Ryon Healy C Jett Bandy SS Tim Beckham",NA,"Josh Rutledge","2.89%",7
100,759029712,"vicvinegar21",0,148.8,"P Max Scherzer P Zack Godley OF Bryce Harper OF Khris Davis 3B Anthony Rendon OF Aaron Hicks 2B Neil Walker 1B Adam Lind SS Tim Beckham C Derek Norris",NA,"Chris Owings","2.85%",12
100,759069529,"haynest76",0,148.8,"P Max Scherzer P Zack Godley OF Mike Trout OF Aaron Judge SS Carlos Correa OF Kevin Pillar 3B Evan Longoria 2B Neil Walker 1B Yuli Gurriel C Martín Maldonado",NA,"Elvis Andrus","2.81%",17
103,758924249,"ganondorf (47/50)",0,148.55,"P Chris Archer P Zack Godley 3B Nolan Arenado OF Corey Dickerson SS Trevor Story 1B Logan Morrison OF Steven Souza Jr. OF Kevin Kiermaier C Evan Gattis 2B Daniel Robertson",NA,"Daniel Robertson","2.81%",0
103,758994019,"adambomb33",0,148.55,"P Max Scherzer P Chris Archer OF Adam Duvall 1B Eric Hosmer OF Jason Heyward 2B Jonathan Schoop 3B Chase Headley OF Andrew McCutchen SS Tim Beckham C Martín Maldonado",NA,"Trevor Story","2.76%",9
103,759040520,"ethanbabineau (1/2)",0,148.55,"P Max Scherzer P Chris Archer OF Bryce Harper 2B Starlin Castro OF Seth Smith 1B Adam Lind OF Carlos Beltrán 3B Josh Rutledge SS Adam Rosales C Martín Maldonado",NA,"Trevor Plouffe","2.68%",5
106,759051599,"angelozz (2/2)",0,148.45,"P Max Scherzer 3B Anthony Rendon OF Michael A. Taylor 2B Jonathan Schoop C Stephen Vogt 1B Yuli Gurriel OF Jake Marisnick SS Alcides Escobar OF Daniel Robertson P Jacob deGrom",NA,"Edwin Encarnación","2.68%",3
107,758926289,"bgizzle714",0,148.4,"P Max Scherzer P Masahiro Tanaka OF Nelson Cruz C Yadier Molina 1B Lucas Duda 3B Evan Longoria SS Greg Garcia OF George Springer 2B Neil Walker OF Guillermo Heredia",NA,"Seth Smith","2.68%",0
107,758935387,"tinderella (26/50)",0,148.4,"P Max Scherzer P Mike Bolsinger OF Mike Trout OF Charlie Blackmon 3B Nolan Arenado 2B DJ LeMahieu SS Andrelton Simmons OF Kole Calhoun 1B Luis Valbuena C Martín Maldonado",NA,"Dee Gordon","2.64%",13
107,758946101,"scout326 (49/50)",0,148.4,"P Max Scherzer P Mike Bolsinger OF Mike Trout OF Charlie Blackmon 3B Nolan Arenado 2B DJ LeMahieu SS Andrelton Simmons OF Kole Calhoun 1B Luis Valbuena C Martín Maldonado",NA,"Guillermo Heredia","2.59%",3
