"Rank","EntryId","EntryName","TimeRemaining","Points","Lineup","X","Player","X.Drafted","FPTS"
1146,758925996,"switzer28",0,101.85,"P Antonio Senzatela 1B Paul Goldschmidt OF Bryce Harper 2B José Altuve OF Brett Gardner SS Francisco Lindor OF Giancarlo Stanton 3B Ryon Healy C Yasmani Grandal P Mike Clevinger",NA,"","",NA
1147,758893769,"ocdobv (41/50)",0,101.8,"P Chris Archer P Júnior Guerra 3B Josh Donaldson OF Randal Grichuk OF Michael Brantley SS Francisco Lindor 1B Carlos Santana C Yadier Molina OF Tommy Pham 2B José Ramírez",NA,"","",NA
1147,758935369,"tinderella (8/50)",0,101.8,"P Max Scherzer P Zack Godley 1B Matt Carpenter OF Dexter Fowler OF Khris Davis 2B Jed Lowrie C Yadier Molina OF Tommy Pham 3B Ryon Healy SS Adam Rosales",NA,"","",NA
1147,758945580,"sfhc1922 (2/6)",0,101.8,"P Max Scherzer P Zack Godley 3B Jedd Gyorko 1B Matt Carpenter OF Andrew Benintendi OF Jackie Bradley Jr. OF Josh Reddick 2B Jonathan Schoop C Christian Vázquez SS Tim Beckham",NA,"","",NA
1147,759006025,"jdhender (1/5)",0,101.8,"P Max Scherzer P Zack Godley OF Bryce Harper 1B Matt Carpenter OF Dexter Fowler OF Tommy Pham 3B Evan Longoria SS Greg Garcia 2B Andrés Blanco C Derek Norris",NA,"","",NA
1147,759034621,"ehafner (15/50)",0,101.8,"P Max Scherzer P Zack Godley OF Corey Dickerson 1B Logan Morrison 2B Brandon Phillips OF Matt Kemp OF Ender Inciarte 3B Evan Longoria SS Tim Beckham C Derek Norris",NA,"","",NA
1152,758924219,"ganondorf (17/50)",0,101.75,"P Max Scherzer OF Aaron Altherr SS Carlos Correa 3B Maikel Franco OF Michael Saunders C Evan Gattis 1B Tommy Joseph OF Carlos Beltrán 2B Andrés Blanco P Mike Clevinger",NA,"","",NA
1153,758933444,"fallfromgrace (7/50)",0,101.6,"P Max Scherzer P Aaron Nola OF Dexter Fowler 2B Jason Kipnis SS Carlos Correa OF Steven Souza Jr. 3B Evan Longoria OF Kevin Kiermaier 1B Rickie Weeks Jr. C Derek Norris",NA,"","",NA
1153,758933461,"fallfromgrace (24/50)",0,101.6,"P Max Scherzer P Aaron Nola OF Bryce Harper 2B Brian Dozier OF Steven Souza Jr. 3B Evan Longoria OF George Springer 1B Rickie Weeks Jr. SS Tim Beckham C Derek Norris",NA,"","",NA
1153,759034699,"shagdog (1/2)",0,101.6,"P Max Scherzer P Eduardo Rodríguez 1B Edwin Encarnación 3B Nolan Arenado C Welington Castillo OF Nick Markakis SS Addison Russell OF Andrew McCutchen 2B Yangervis Solarte OF Ezequiel Carrera",NA,"","",NA
1153,759070017,"underjones (48/50)",0,101.6,"P Max Scherzer P Aaron Nola 3B Jedd Gyorko C Yadier Molina 2B Rougned Odor OF Tommy Pham 1B Mike Napoli SS Greg Garcia OF Delino DeShields OF Jared Hoying",NA,"","",NA
1153,759070018,"underjones (49/50)",0,101.6,"P Max Scherzer P Aaron Nola OF Aaron Judge OF Aaron Hicks SS Carlos Correa 2B Starlin Castro C Evan Gattis 3B Chase Headley OF Carlos Beltrán 1B Yuli Gurriel",NA,"","",NA
1153,758922277,"ChipotleAddict (33/50)",0,101.6,"P Jake Arrieta P Aaron Nola OF Bryce Harper SS Trea Turner 2B José Altuve 3B Anthony Rendon OF George Springer C Evan Gattis OF Carlos Beltrán 1B Yuli Gurriel",NA,"","",NA
1159,758884522,"shawnzhan (22/50)",0,101.4,"P Max Scherzer P Mike Bolsinger OF Mike Trout OF Mookie Betts SS Xander Bogaerts 1B Hanley Ramírez OF Andrew Benintendi 3B Luis Valbuena 2B Danny Espinosa C Martín Maldonado",NA,"","",NA
1159,758900165,"dacoltz (13/50)",0,101.4,"P Max Scherzer P Mike Bolsinger OF Mookie Betts 2B José Altuve 1B Hanley Ramírez OF Andrew Benintendi SS Corey Seager C Evan Gattis OF Carlos Beltrán 3B Josh Rutledge",NA,"","",NA
1159,758935411,"tinderella (50/50)",0,101.4,"P Max Scherzer P Mike Bolsinger OF Bryce Harper OF Aaron Judge 3B Anthony Rendon OF Aaron Hicks 1B Matt Holliday 2B Starlin Castro C Matt Wieters SS Wilmer Difo",NA,"","",NA
1159,759034607,"ehafner (1/50)",0,101.4,"P Max Scherzer P Mike Bolsinger OF Corey Dickerson 2B José Altuve 1B Logan Morrison SS Carlos Correa OF Steven Souza Jr. 3B Evan Longoria OF George Springer C Derek Norris",NA,"","",NA
1159,759034644,"ehafner (38/50)",0,101.4,"P Max Scherzer P Mike Bolsinger OF Mookie Betts 1B Hanley Ramírez OF Andrew Benintendi SS Corey Seager OF Jackie Bradley Jr. C Yasmani Grandal 2B Logan Forsythe 3B Josh Rutledge",NA,"","",NA
1159,759065272,"haakee (1/14)",0,101.4,"P Max Scherzer P Mike Bolsinger OF Bryce Harper 2B Jonathan Villar 1B Eric Thames OF Steven Souza Jr. 3B Evan Longoria OF George Springer C Evan Gattis SS Tim Beckham",NA,"","",NA
1165,758893751,"ocdobv (23/50)",0,101.35,"P Chris Archer P Aaron Nola OF Mike Trout OF Corey Dickerson OF Steven Souza Jr. 2B Rougned Odor 3B Evan Longoria C Evan Gattis 1B Rickie Weeks Jr. SS Tim Beckham",NA,"","",NA
1165,758905893,"juniorsenior",0,101.35,"P Chris Archer P Eduardo Rodríguez OF José Bautista 3B Josh Donaldson OF Jorge Bonifacio C Salvador Perez 1B Eric Hosmer OF Matt Adams 2B Yangervis Solarte SS Tim Beckham",NA,"","",NA
1165,759058530,"saffybn25 (5/5)",0,101.35,"P Chris Archer P Carlos Martínez SS Carlos Correa 1B Matt Holliday OF Josh Reddick OF George Springer 2B Starlin Castro C Evan Gattis 3B Chase Headley OF Carlos Beltrán",NA,"","",NA
1168,758900189,"dacoltz (37/50)",0,101.15,"P Max Scherzer P Alex Wood OF Aaron Altherr C Buster Posey 3B Evan Longoria OF Michael Saunders 1B Tommy Joseph OF Odúbel Herrera SS Christian Arroyo 2B Andrés Blanco",NA,"","",NA
1168,758924210,"ganondorf (8/50)",0,101.15,"P Max Scherzer P Alex Wood SS Corey Seager OF Steven Souza Jr. OF Cody Bellinger 3B Evan Longoria OF Yasiel Puig 1B Rickie Weeks Jr. C Derek Norris 2B Daniel Robertson",NA,"","",NA
1168,758986973,"Tolpeko (15/50)",0,101.15,"P Alex Wood P Jake Arrieta OF Brett Gardner OF Khris Davis SS Didi Gregorius 2B Jed Lowrie 1B Chris Carter OF Rajai Davis 3B Trevor Plouffe C Stephen Vogt",NA,"","",NA
1168,758986980,"Tolpeko (22/50)",0,101.15,"P Alex Wood P Jake Arrieta 1B Matt Carpenter OF Dexter Fowler OF Khris Davis 2B Jed Lowrie SS Greg Garcia OF Mark Canha 3B Trevor Plouffe C Stephen Vogt",NA,"","",NA
1168,759042809,"tborotkanics",0,101.15,"P Alex Wood P Zack Godley OF Aaron Judge 3B Jedd Gyorko OF Ian Desmond 1B Jay Bruce 2B Jason Kipnis SS Corey Seager OF Josh Reddick C Matt Wieters",NA,"","",NA
1168,759071804,"BarOfSoap (15/25)",0,101.15,"P Chris Archer P Mike Bolsinger 1B Paul Goldschmidt 3B Jake Lamb OF David Peralta SS Carlos Correa 2B Brandon Drury OF Josh Reddick OF Michael Saunders C Chris Iannetta",NA,"","",NA
1168,759071813,"BarOfSoap (24/25)",0,101.15,"P Chris Archer P Mike Bolsinger SS Trea Turner OF Aaron Judge OF Brett Gardner OF Aaron Hicks 3B Mike Moustakas C Yadier Molina 1B Matt Holliday 2B Starlin Castro",NA,"","",NA
1175,758895499,"papagates (23/50)",0,101.05,"P Max Scherzer P Júnior Guerra 3B Jedd Gyorko 1B Matt Carpenter OF Randal Grichuk OF Khris Davis 2B Kolten Wong OF Mark Canha C Stephen Vogt SS Adam Rosales",NA,"","",NA
1175,758933457,"fallfromgrace (20/50)",0,101.05,"P Max Scherzer P Júnior Guerra OF Mike Trout OF Bryce Harper OF Aaron Judge 1B Matt Holliday SS Greg Garcia 2B Starlin Castro 3B Chase Headley C Austin Romine",NA,"","",NA
1175,759012723,"ahurley23 (43/50)",0,101.05,"P Max Scherzer P Júnior Guerra OF Aaron Judge SS Xander Bogaerts OF Brett Gardner OF Aaron Hicks 1B Matt Holliday 2B Starlin Castro C Christian Vázquez 3B Josh Rutledge",NA,"","",NA
1178,758902489,"SlowQueen (42/50)",0,100.95,"P Alex Wood P Aaron Nola SS Trea Turner OF Carlos González 2B DJ LeMahieu 1B Ian Desmond OF Steven Souza Jr. 3B Evan Longoria OF Kevin Kiermaier C Derek Norris",NA,"","",NA
1178,758986962,"Tolpeko (4/50)",0,100.95,"P Alex Wood P Eduardo Rodríguez 1B Matt Carpenter OF Dexter Fowler OF Khris Davis 2B Jed Lowrie SS Greg Garcia OF Matt Joyce 3B Trevor Plouffe C Stephen Vogt",NA,"","",NA
1178,759047834,"Tglodek11 (18/30)",0,100.95,"P Alex Wood P Eduardo Rodríguez OF Mookie Betts 1B Mitch Moreland 3B Manny Machado SS Elvis Andrus 2B Starlin Castro C Evan Gattis OF Odúbel Herrera OF Delino DeShields",NA,"","",NA
1181,758902487,"SlowQueen (40/50)",0,100.9,"P Alex Wood P Jesse Chávez OF Charlie Blackmon 3B Nolan Arenado OF Randal Grichuk OF Ian Desmond 2B Kolten Wong SS Greg Garcia C Tony Wolters 1B Rickie Weeks Jr.",NA,"","",NA
1181,758924248,"ganondorf (46/50)",0,100.9,"P Chris Archer P Alex Wood OF David Peralta OF Yasmany Tomás 2B Brandon Drury 1B Tommy Joseph OF Odúbel Herrera SS Freddy Galvis C Chris Iannetta 3B Andrés Blanco",NA,"","",NA
1181,758997148,"derekralph91",0,100.9,"P Max Scherzer P Antonio Senzatela 1B Paul Goldschmidt SS Chris Owings OF Kevin Pillar OF Steven Souza Jr. 3B Evan Longoria OF Ben Gamel 2B Taylor Motter C Jesús Sucre",NA,"","",NA
1181,759010609,"bcalicore (17/50)",0,100.9,"P Chris Archer P Alex Wood SS Francisco Lindor OF Aaron Altherr 3B Maikel Franco OF Bradley Zimmer OF Michael Saunders C Yan Gomes 1B Tommy Joseph 2B Andrés Blanco",NA,"","",NA
1185,759028654,"MartyBaceda (1/2)",0,100.85,"P Max Scherzer P Matt Cain 3B Jedd Gyorko 2B DJ LeMahieu OF Tommy Pham OF Jayson Werth C Jonathan Lucroy SS Greg Garcia OF George Springer 1B Adam Lind",NA,"","",NA
1186,758933327,"twomindsbluff (4/10)",0,100.8,"P Max Scherzer P Zack Godley 2B José Altuve 3B Manny Machado 1B Chris Davis SS Carlos Correa OF George Springer OF Seth Smith C Evan Gattis OF Hyun Soo Kim",NA,"","",NA
1186,758937093,"EricMix",0,100.8,"P Max Scherzer P Zack Godley OF José Bautista 3B Jedd Gyorko 1B Matt Carpenter OF Dexter Fowler 2B Rougned Odor OF Kole Calhoun SS Tim Beckham C René Rivera",NA,"","",NA
1186,759068693,"cjack51 (1/2)",0,100.8,"P Max Scherzer P Zack Godley SS Xander Bogaerts 3B Jedd Gyorko OF Aaron Hicks OF Steven Souza Jr. OF George Springer 2B Starlin Castro 1B Tommy Joseph C Derek Norris",NA,"","",NA
1189,758885797,"calvinnolte",0,100.75,"P Zack Godley OF Bryce Harper OF Aaron Judge 2B José Altuve 3B Kris Bryant OF Aaron Hicks SS Carlos Correa 1B Justin Smoak C Evan Gattis P Mike Clevinger",NA,"","",NA
1189,758972918,"ajbobs",0,100.75,"P Max Scherzer OF Mookie Betts SS Xander Bogaerts OF Tommy Pham 2B Starlin Castro 3B Trevor Plouffe 1B Matt Adams OF Kole Calhoun C Martín Maldonado P Mike Clevinger",NA,"","",NA
1191,758895491,"papagates (15/50)",0,100.6,"P Max Scherzer P Aaron Nola OF Khris Davis 2B Brian Dozier 1B Logan Morrison 3B Evan Longoria OF Rajai Davis OF Mark Canha SS Tim Beckham C Derek Norris",NA,"","",NA
1191,758933466,"fallfromgrace (29/50)",0,100.6,"P Max Scherzer P Aaron Nola 2B José Altuve 1B Matt Carpenter SS Carlos Correa OF Josh Reddick C Evan Gattis OF Carlos Beltrán OF Kole Calhoun 3B Andrés Blanco",NA,"","",NA
1191,759012611,"chrannens",0,100.6,"P Max Scherzer P Aaron Nola 1B Edwin Encarnación SS Francisco Lindor OF Aaron Altherr 3B Maikel Franco OF Michael Saunders OF Odúbel Herrera C Tyler Flowers 2B Andrés Blanco",NA,"","",NA
1191,759034632,"ehafner (26/50)",0,100.6,"P Max Scherzer P Aaron Nola 2B José Altuve OF Aaron Altherr SS Carlos Correa OF George Springer C Evan Gattis OF Odúbel Herrera 1B Yuli Gurriel 3B Andrés Blanco",NA,"","",NA
1195,758895498,"papagates (22/50)",0,100.55,"P Chris Archer P Jake Arrieta OF Khris Davis SS Francisco Lindor OF Bradley Zimmer C Yan Gomes 1B Wil Myers 3B Ryan Schimpf 2B Yangervis Solarte OF Matt Szczur",NA,"","",NA
1195,758900164,"dacoltz (12/50)",0,100.55,"P Chris Archer P Zack Godley OF Bryce Harper OF Mark Trumbo OF Giancarlo Stanton 2B Jason Kipnis 1B Chris Davis 3B Evan Longoria SS Tim Beckham C Derek Norris",NA,"","",NA
1195,758917419,"darcmaniluk (31/50)",0,100.55,"P Chris Archer P Zack Godley 1B Matt Carpenter OF Dexter Fowler SS Francisco Lindor 2B Jason Kipnis C Yadier Molina OF Tommy Pham 3B José Ramírez OF Odúbel Herrera",NA,"","",NA
1195,758961877,"rlnd33",0,100.55,"P Chris Archer P Jake Arrieta OF Andrew Benintendi SS Didi Gregorius OF Lorenzo Cain 1B Mike Napoli 3B Evan Longoria OF Jason Heyward 2B Jonathan Schoop C Christian Vázquez",NA,"","",NA
1199,758993013,"windchimesRrude (20/32)",0,100.45,"P Carlos Martínez 1B Matt Carpenter OF Randal Grichuk 3B Travis Shaw OF Dexter Fowler 2B Kolten Wong OF Domingo Santana SS Orlando Arcia C Jett Bandy P Sean Manaea",NA,"","",NA
1200,758968586,"Wormjdh",0,100.4,"P Carlos Martínez P Aaron Nola OF Mike Trout OF José Bautista 3B Travis Shaw OF Mark Trumbo 1B Justin Smoak 2B Devon Travis SS J.J. Hardy C Derek Norris",NA,"","",NA
1200,758968865,"reign0187",0,100.4,"P Max Scherzer P Mike Bolsinger OF Mike Trout 2B Jonathan Villar 1B Eric Thames 3B Travis Shaw OF Khris Davis OF Keon Broxton SS Adam Rosales C Martín Maldonado",NA,"","",NA
1202,758900156,"dacoltz (4/50)",0,100.15,"P Max Scherzer P Alex Wood OF Corey Dickerson OF Josh Reddick 3B Evan Longoria OF George Springer C Evan Gattis 1B Rickie Weeks Jr. SS Tim Beckham 2B Daniel Robertson",NA,"","",NA
1202,758924252,"ganondorf (50/50)",0,100.15,"P Max Scherzer P Alex Wood OF Corey Dickerson 1B Matt Carpenter OF Matt Kemp OF Matt Adams SS Tim Beckham 2B Andrés Blanco C Derek Norris 3B Rio Ruiz",NA,"","",NA
1202,759028250,"boggslite (1/5)",0,100.15,"P Max Scherzer P Alex Wood OF Dexter Fowler OF Aaron Altherr 3B Maikel Franco OF Michael Saunders 1B Tommy Joseph C Devin Mesoraco SS Tim Beckham 2B Andrés Blanco",NA,"","",NA
1202,759045899,"bellaedward4eva (44/50)",0,100.15,"P Max Scherzer P Alex Wood 3B Manny Machado 1B Chris Davis OF Seth Smith 2B Jonathan Schoop SS Taylor Motter C Mike Zunino OF Hyun Soo Kim OF Guillermo Heredia",NA,"","",NA
1206,758993018,"windchimesRrude (25/32)",0,100.1,"P Carlos Martínez P Héctor Santiago OF Bryce Harper SS Trea Turner 3B Jedd Gyorko 1B Matt Carpenter OF Dexter Fowler 2B Kolten Wong OF Jayson Werth C Matt Wieters",NA,"","",NA
1207,758886667,"BirdWings (1/2)",0,100.05,"P Max Scherzer P Júnior Guerra OF Bryce Harper 3B Jedd Gyorko 1B Matt Carpenter OF Dexter Fowler OF Tommy Pham 2B Starlin Castro C Evan Gattis SS Tim Beckham",NA,"","",NA
1207,758939799,"webb5008",0,100.05,"P Max Scherzer P Júnior Guerra OF Bryce Harper 2B José Altuve 1B Matt Carpenter OF Dexter Fowler 3B Greg Garcia OF George Springer C Evan Gattis SS Tim Beckham",NA,"","",NA
1207,759010614,"bcalicore (22/50)",0,100.05,"P Max Scherzer P Júnior Guerra OF Corey Dickerson OF Randal Grichuk OF Dexter Fowler 1B Logan Morrison C Yadier Molina 3B Evan Longoria SS Tim Beckham 2B Daniel Robertson",NA,"","",NA
1207,759059617,"youdacao (21/50)",0,100.05,"P Max Scherzer P Júnior Guerra 2B José Altuve 3B Jedd Gyorko 1B Matt Carpenter OF Dexter Fowler SS Carlos Correa OF Josh Reddick C Evan Gattis OF Jake Marisnick",NA,"","",NA
1211,758933443,"fallfromgrace (6/50)",0,99.95,"P Alex Wood P Aaron Nola OF José Bautista 3B Josh Donaldson OF Dexter Fowler OF Andrew Benintendi 2B Devon Travis 1B Kendrys Morales C Russell Martin SS Tim Beckham",NA,"","",NA
1211,758978113,"gfay63 (25/50)",0,99.95,"P Alex Wood P Aaron Nola OF Michael Brantley SS Francisco Lindor OF Giancarlo Stanton 2B Jason Kipnis 3B Mike Moustakas 1B Carlos Santana OF Tommy Pham C Yan Gomes",NA,"","",NA
1211,759056630,"Tglodek11 (25/30)",0,99.95,"P Alex Wood P Carlos Martínez SS Xander Bogaerts 1B Hanley Ramírez OF Andrew Benintendi OF Jackie Bradley Jr. OF George Springer 2B Starlin Castro C Evan Gattis 3B Josh Rutledge",NA,"","",NA
1214,759050920,"spittingmidgets (2/3)",0,99.9,"P Chris Archer P Ian Kennedy OF Nomar Mazara 3B Manny Machado 1B Chris Davis SS Elvis Andrus 2B Brandon Drury OF Josh Reddick C Jonathan Lucroy OF Andrew McCutchen",NA,"","",NA
1215,758905593,"eagles51020 (3/20)",0,99.8,"P Max Scherzer P Zack Godley 3B Jedd Gyorko 1B Matt Carpenter OF Dexter Fowler OF Marcell Ozuna OF Tommy Pham SS Greg Garcia C Evan Gattis 2B Andrés Blanco",NA,"","",NA
1215,758912891,"petteytheft89 (18/35)",0,99.8,"P Chris Archer P Júnior Guerra 3B Jedd Gyorko 1B Matt Carpenter OF Randal Grichuk OF Dexter Fowler SS Francisco Lindor OF Steven Souza Jr. C Yadier Molina 2B Andrés Blanco",NA,"","",NA
1215,758917413,"darcmaniluk (25/50)",0,99.8,"P Max Scherzer P Zack Godley 3B Jedd Gyorko 1B Matt Carpenter OF Randal Grichuk OF Dexter Fowler 2B Rougned Odor OF Tommy Pham C Derek Norris SS Alcides Escobar",NA,"","",NA
1215,758935395,"tinderella (34/50)",0,99.8,"P Max Scherzer P Zack Godley 1B Matt Carpenter OF Dexter Fowler 2B Kolten Wong OF Aaron Altherr C Yadier Molina SS Greg Garcia OF Odúbel Herrera 3B Andrés Blanco",NA,"","",NA
1215,758969206,"ob_44",0,99.8,"P Max Scherzer P Zack Godley SS Chris Owings OF David Peralta OF Aaron Hicks 3B Joey Gallo 1B Matt Holliday 2B Starlin Castro OF Odúbel Herrera C Derek Norris",NA,"","",NA
1215,759045867,"bellaedward4eva (12/50)",0,99.8,"P Max Scherzer P Zack Godley OF Aaron Judge OF Jay Bruce SS Didi Gregorius 1B Matt Holliday OF Curtis Granderson 2B Starlin Castro 3B Chase Headley C René Rivera",NA,"","",NA
1221,758885792,"griffin777 (3/6)",0,99.75,"P Zack Godley 1B Paul Goldschmidt 3B Jake Lamb OF Bryce Harper SS Chris Owings OF David Peralta 2B Brandon Drury OF Jayson Werth C Devin Mesoraco P Mike Clevinger",NA,"","",NA
1221,758996411,"1sully1",0,99.75,"P Max Scherzer OF Nelson Cruz 2B Jason Kipnis OF Matt Kemp 1B Kendrys Morales C Buster Posey OF Carlos Beltrán 3B Josh Rutledge SS Adam Rosales P Mike Clevinger",NA,"","",NA
1221,759045900,"bellaedward4eva (45/50)",0,99.75,"P Max Scherzer SS Francisco Lindor 1B Carlos Santana 3B José Ramírez OF Bradley Zimmer C Yan Gomes OF Seth Smith 2B Jonathan Schoop OF Hyun Soo Kim P Mike Clevinger",NA,"","",NA
1224,758933441,"fallfromgrace (4/50)",0,99.60001,"P Max Scherzer P Aaron Nola OF Bryce Harper OF Dexter Fowler OF Steven Souza Jr. SS Troy Tulowitzki 3B Evan Longoria 1B Rickie Weeks Jr. C Derek Norris 2B Daniel Robertson",NA,"","",NA
1224,758933451,"fallfromgrace (14/50)",0,99.60001,"P Max Scherzer P Aaron Nola OF Bryce Harper OF José Bautista OF Steven Souza Jr. 3B Evan Longoria C Yasmani Grandal 1B Rickie Weeks Jr. SS Tim Beckham 2B Daniel Robertson",NA,"","",NA
1224,758964940,"Toothbrush (7/9)",0,99.60001,"P Max Scherzer P Aaron Nola 2B Jonathan Villar 1B Eric Thames 3B Travis Shaw OF Hernán Pérez OF Odúbel Herrera C Jett Bandy OF Justin Ruggiano SS Alcides Escobar",NA,"","",NA
1224,759023408,"gehrenberg (5/19)",0,99.60001,"P Max Scherzer P Aaron Nola 3B Jedd Gyorko 1B Matt Carpenter OF Dexter Fowler OF Josh Reddick SS Greg Garcia OF George Springer 2B Andrés Blanco C Martín Maldonado",NA,"","",NA
1224,759039082,"marcodoubypops",0,99.60001,"P Max Scherzer P Eduardo Rodríguez SS Xander Bogaerts 2B Dee Gordon 3B José Reyes 1B Buster Posey C Welington Castillo OF Justin Ruggiano OF Matt Szczur OF Drew Stubbs",NA,"","",NA
1224,759069986,"underjones (17/50)",0,99.60001,"P Max Scherzer P Aaron Nola OF Mookie Betts SS Xander Bogaerts OF Aaron Altherr 1B Tommy Joseph OF Odúbel Herrera C Christian Vázquez 3B Josh Rutledge 2B Andrés Blanco",NA,"","",NA
1224,758922272,"ChipotleAddict (28/50)",0,99.6,"P Jake Arrieta P Aaron Nola OF Bryce Harper SS Trea Turner 3B Miguel Sanó 2B Brian Dozier OF Jayson Werth 1B Adam Lind C Matt Wieters OF Eddie Rosario",NA,"","",NA
1231,758902459,"SlowQueen (12/50)",0,99.55,"P Chris Archer P Zack Godley OF Mookie Betts SS Xander Bogaerts 1B Hanley Ramírez OF Andrew Benintendi OF Steven Souza Jr. 3B Evan Longoria 2B Andrés Blanco C Derek Norris",NA,"","",NA
1231,758917426,"darcmaniluk (38/50)",0,99.55,"P Max Scherzer P Jesse Chávez 1B Hanley Ramírez OF Andrew Benintendi OF Michael Brantley SS Francisco Lindor 2B José Ramírez C Evan Gattis 3B Josh Rutledge OF Daniel Robertson",NA,"","",NA
1231,758972717,"ReggaeBush",0,99.55,"P Aaron Nola OF Charlie Blackmon OF Corey Dickerson 1B Mitch Moreland OF Michael Brantley SS Jean Segura 2B Jason Kipnis 3B Kyle Seager C Matt Wieters P Mike Clevinger",NA,"","",NA
1234,759063731,"scotchbomb7",0,99.45,"P Masahiro Tanaka P Matt Cain OF Mike Trout OF Bryce Harper 2B José Altuve 3B Kris Bryant SS Trevor Story 1B Albert Pujols C Salvador Perez OF Alex Gordon",NA,"","",NA
1235,758949579,"sspiva1 (2/2)",0,99.35001,"P Chris Archer P Aaron Nola SS Trea Turner OF José Bautista 2B José Altuve OF Michael Brantley 3B Mike Moustakas 1B Yuli Gurriel OF Jared Hoying C Austin Hedges",NA,"","",NA
1236,758927480,"CMORTON72 (1/3)",0,99.3,"P Max Scherzer P Jaime García 1B Edwin Encarnación OF José Bautista OF Michael Brantley 2B Jason Kipnis 3B José Ramírez OF Kole Calhoun SS Tim Beckham C Derek Norris",NA,"","",NA
1236,759012486,"ahurley23 (27/50)",0,99.3,"P Max Scherzer P Héctor Santiago OF Aaron Judge 2B José Altuve OF Brett Gardner SS Carlos Correa C Evan Gattis 3B Chase Headley OF Carlos Beltrán 1B Yuli Gurriel",NA,"","",NA
1236,759012548,"ahurley23 (28/50)",0,99.3,"P Max Scherzer P Jaime García OF Aaron Judge SS Didi Gregorius 1B Matt Holliday OF Josh Reddick OF George Springer 2B Starlin Castro C Evan Gattis 3B Chase Headley",NA,"","",NA
1239,758893775,"ocdobv (47/50)",0,99.2,"P Masahiro Tanaka P Aaron Nola 1B Paul Goldschmidt SS Trea Turner 3B Jedd Gyorko OF David Peralta OF Nelson Cruz 2B Brandon Drury OF Jayson Werth C Chris Iannetta",NA,"","",NA
1239,759012761,"ahurley23 (48/50)",0,99.2,"P Masahiro Tanaka P Aaron Nola OF José Bautista 3B Jedd Gyorko 1B Matt Carpenter OF Randal Grichuk 2B Devon Travis C Yadier Molina SS Troy Tulowitzki OF Tommy Pham",NA,"","",NA
1241,758978129,"gfay63 (41/50)",0,99.15,"P Alex Wood P Zack Godley 1B Paul Goldschmidt 3B Jake Lamb 2B Brian Dozier OF David Peralta OF Yasmany Tomás OF George Springer C Evan Gattis SS Tim Beckham",NA,"","",NA
1241,759045880,"bellaedward4eva (25/50)",0,99.15,"P Max Scherzer P Alex Wood 2B Brian Dozier OF Nelson Cruz 3B Kyle Seager 1B Danny Valencia SS Jorge Polanco C Mike Zunino OF Guillermo Heredia OF Eddie Rosario",NA,"","",NA
1241,759045895,"bellaedward4eva (40/50)",0,99.15,"P Max Scherzer P Alex Wood OF Mike Trout 3B Eugenio Suárez OF Kole Calhoun 2B Danny Espinosa 1B Rickie Weeks Jr. SS Tim Beckham OF Jared Hoying C Derek Norris",NA,"","",NA
1244,758884534,"shawnzhan (34/50)",0,99.05,"P Max Scherzer P Júnior Guerra OF Mike Trout 2B José Altuve 1B Albert Pujols SS Andrelton Simmons 3B Alex Bregman OF Josh Reddick C Evan Gattis OF Kole Calhoun",NA,"","",NA
1244,758927034,"ThatStunna (9/18)",0,99.05,"P Max Scherzer P Júnior Guerra OF Mike Trout OF Bryce Harper OF Aaron Judge 1B Matt Holliday 3B Evan Longoria 2B Starlin Castro SS Tim Beckham C Derek Norris",NA,"","",NA
1244,759029967,"shartman208",0,99.05,"P Max Scherzer P Júnior Guerra 3B Jedd Gyorko SS Trevor Story OF Matt Kemp 1B Albert Pujols 2B Josh Harrison C Buster Posey OF Tommy Pham OF Seth Smith",NA,"","",NA
1244,759044932,"juanshen (43/50)",0,99.05,"P Max Scherzer P Júnior Guerra 3B Josh Donaldson OF Randal Grichuk OF Dexter Fowler 2B Jason Kipnis 1B Kendrys Morales OF Tommy Pham SS Greg Garcia C Russell Martin",NA,"","",NA
1248,758922281,"ChipotleAddict (37/50)",0,98.95,"P Alex Wood P Aaron Nola 1B Edwin Encarnación OF Khris Davis OF Michael Brantley SS Francisco Lindor 2B Jason Kipnis 3B José Ramírez OF Matt Joyce C Stephen Vogt",NA,"","",NA
1248,758933477,"fallfromgrace (40/50)",0,98.95,"P Alex Wood P Aaron Nola OF Bryce Harper SS Trea Turner OF Carlos González OF Jayson Werth 3B Evan Longoria 2B Starlin Castro 1B Adam Lind C Matt Wieters",NA,"","",NA
1248,758986972,"Tolpeko (14/50)",0,98.95,"P Alex Wood P Eduardo Rodríguez OF Brett Gardner OF Khris Davis SS Didi Gregorius 2B Jed Lowrie 1B Chris Carter OF Matt Joyce 3B Trevor Plouffe C Stephen Vogt",NA,"","",NA
1251,758888085,"rkess93",0,98.85001,"P Max Scherzer P Chad Kuhl 1B Hanley Ramírez 2B Dee Gordon SS Jean Segura OF Matt Kemp C Welington Castillo 3B David Freese OF Odúbel Herrera OF Kole Calhoun",NA,"","",NA
1252,758902485,"SlowQueen (38/50)",0,98.8,"P Chris Archer P Júnior Guerra 3B Josh Donaldson OF Carlos González 2B DJ LeMahieu OF Ian Desmond OF Kevin Pillar 1B Kendrys Morales SS Troy Tulowitzki C Russell Martin",NA,"","",NA
1252,759047635,"Todd_Opong (3/3)",0,98.8,"P Max Scherzer P Zack Godley 3B Jedd Gyorko OF Khris Davis 2B Jed Lowrie 1B Carlos Santana C Welington Castillo OF Matt Joyce OF George Springer SS Freddy Galvis",NA,"","",NA
1254,758979581,"bangbang3033",0,98.7,"P Eduardo Rodríguez P Antonio Senzatela OF Billy Hamilton 2B José Altuve OF Khris Davis SS Francisco Lindor OF Gregory Polanco 1B Carlos Santana C Buster Posey 3B Evan Longoria",NA,"","",NA
1255,758909294,"madhater28 (2/3)",0,98.60001,"P Max Scherzer P Aaron Nola 1B Matt Carpenter OF Dexter Fowler C Yadier Molina OF Josh Reddick 2B José Ramírez OF George Springer SS Tim Beckham 3B Andrés Blanco",NA,"","",NA
1255,758923867,"sharkbite09 (1/5)",0,98.60001,"P Max Scherzer P Aaron Nola OF José Bautista 3B Josh Donaldson OF Kevin Pillar 1B Kendrys Morales OF Odúbel Herrera C Russell Martin SS Tim Beckham 2B Andrés Blanco",NA,"","",NA
1255,758927039,"ThatStunna (14/18)",0,98.60001,"P Max Scherzer P Aaron Nola OF José Bautista 3B Josh Donaldson OF Kevin Pillar 1B Kendrys Morales OF Odúbel Herrera C Russell Martin SS Tim Beckham 2B Andrés Blanco",NA,"","",NA
1255,758972781,"Meth",0,98.60001,"P Max Scherzer P Aaron Nola 1B Matt Carpenter OF Giancarlo Stanton OF Tommy Pham 3B Evan Longoria OF George Springer 2B Starlin Castro C Evan Gattis SS Tim Beckham",NA,"","",NA
1255,759005740,"Theblender (50/50)",0,98.60001,"P Max Scherzer P Eduardo Rodríguez 2B José Altuve 1B Carlos Santana OF Jayson Werth 3B Evan Longoria OF George Springer OF Carlos Beltrán SS Tim Beckham C Derek Norris",NA,"","",NA
1260,759044930,"juanshen (41/50)",0,98.55,"P Max Scherzer P Chris Archer OF Nelson Cruz 3B Kyle Seager 1B Danny Valencia 2B Taylor Motter OF Kole Calhoun OF Guillermo Heredia SS Tim Beckham C Derek Norris",NA,"","",NA
1261,758962660,"davedave536 (2/2)",0,98.45,"P Zack Godley OF Michael Conforto 1B Justin Bour SS Didi Gregorius OF Shin-soo Choo 2B Ian Happ OF Marwin González 3B Wilmer Flores C Matt Wieters P Jacob deGrom",NA,"","",NA
1261,759048243,"ethanbabineau (2/2)",0,98.45,"P Max Scherzer OF Matt Joyce OF Seth Smith 1B Adam Lind 2B Jonathan Schoop 3B Chase Headley OF Kole Calhoun C Derek Norris SS Alcides Escobar P Jacob deGrom",NA,"","",NA
