"Rank","EntryId","EntryName","TimeRemaining","Points","Lineup","X","Player","X.Drafted","FPTS"
1729,759002418,"ahurley23 (9/50)",0,86.4,"P Max Scherzer P Mike Bolsinger OF José Bautista OF Michael Brantley SS Francisco Lindor 2B Jason Kipnis OF Kevin Pillar 1B Carlos Santana 3B José Ramírez C Russell Martin",NA,"","",NA
1729,759047633,"Tglodek11 (6/30)",0,86.4,"P Carlos Martínez P Eduardo Rodríguez 2B José Altuve 1B Matt Carpenter 3B Manny Machado OF Yasmany Tomás SS Carlos Correa OF George Springer C Evan Gattis OF Odúbel Herrera",NA,"","",NA
1731,759027260,"tomjenna1",0,86.35,"P Masahiro Tanaka OF José Bautista 1B Matt Carpenter OF Dexter Fowler 3B Anthony Rendon 2B Jason Kipnis SS Carlos Correa OF Jayson Werth C Yasmani Grandal P Mike Clevinger",NA,"","",NA
1732,758884524,"shawnzhan (24/50)",0,86.3,"P Max Scherzer P Héctor Santiago 1B Matt Carpenter OF Dexter Fowler OF Nelson Cruz SS Jean Segura C Yadier Molina 3B Greg Garcia 2B Taylor Motter OF Guillermo Heredia",NA,"","",NA
1733,759002492,"ahurley23 (23/50)",0,86.2,"P Masahiro Tanaka P Aaron Nola OF Aaron Judge OF José Bautista 3B Josh Donaldson SS Didi Gregorius OF Kevin Pillar 1B Kendrys Morales 2B Starlin Castro C Russell Martin",NA,"","",NA
1734,758970949,"bah3tenn",0,86.15,"P Alex Wood P Zack Godley OF Mookie Betts SS Xander Bogaerts 2B José Altuve 1B Mitch Moreland OF Andrew Benintendi OF Josh Reddick C Evan Gattis 3B Ryan Schimpf",NA,"","",NA
1734,759044892,"juanshen (3/50)",0,86.15,"P Chris Archer P Mike Bolsinger SS Trea Turner 3B Jedd Gyorko 1B Matt Carpenter OF Randal Grichuk OF Dexter Fowler OF Tommy Pham 2B Starlin Castro C Matt Wieters",NA,"","",NA
1734,759044905,"juanshen (16/50)",0,86.15,"P Chris Archer P Mike Bolsinger OF Bryce Harper SS Trea Turner 3B Jedd Gyorko OF Nelson Cruz 2B Kolten Wong C Yadier Molina OF Tommy Pham 1B Adam Lind",NA,"","",NA
1737,758973585,"jbarks06 (12/25)",0,86.10001,"P Max Scherzer P Dan Straily 1B Edwin Encarnación OF José Bautista OF Kevin Pillar 3B Maikel Franco SS Asdrúbal Cabrera C Russell Martin OF Guillermo Heredia 2B Andrés Blanco",NA,"","",NA
1737,759028251,"boggslite (2/5)",0,86.10001,"P Max Scherzer P Dan Straily 3B Jedd Gyorko 1B Matt Carpenter OF Dexter Fowler OF Tommy Pham SS Greg Garcia OF Odúbel Herrera 2B Andrés Blanco C Derek Norris",NA,"","",NA
1739,758895523,"papagates (47/50)",0,86.05,"P Max Scherzer P Júnior Guerra OF Mike Trout 3B Miguel Sanó OF Khris Davis 2B Brian Dozier OF Max Kepler 1B Ryon Healy C Jason Castro SS Adam Rosales",NA,"","",NA
1739,758924203,"ganondorf (1/50)",0,86.05,"P Max Scherzer P Júnior Guerra OF Aaron Judge OF Aaron Hicks OF Mark Trumbo 1B Chris Davis SS Didi Gregorius C Welington Castillo 2B Jonathan Schoop 3B Chase Headley",NA,"","",NA
1739,759059620,"youdacao (24/50)",0,86.05,"P Max Scherzer P Júnior Guerra 2B José Altuve 3B Jedd Gyorko OF Carlos González OF Dexter Fowler SS Carlos Correa OF Josh Reddick C Evan Gattis 1B Yuli Gurriel",NA,"","",NA
1739,759065850,"michacarr11",0,86.05,"P Jake Arrieta P Júnior Guerra OF Mookie Betts SS Xander Bogaerts OF José Bautista 3B Jedd Gyorko 1B Matt Carpenter OF Matt Kemp 2B Rougned Odor C Jonathan Lucroy",NA,"","",NA
1743,758986995,"Tolpeko (37/50)",0,85.95,"P Alex Wood P Carlos Martínez 3B Miguel Sanó 2B Brian Dozier OF Max Kepler SS Carlos Correa OF Josh Reddick OF George Springer 1B Joe Mauer C Jason Castro",NA,"","",NA
1744,758912877,"petteytheft89 (4/35)",0,85.8,"P Chris Archer P Júnior Guerra SS Trea Turner OF Randal Grichuk OF Dexter Fowler 2B Kolten Wong C Yadier Molina OF Tommy Pham 3B Evan Longoria 1B Tommy Joseph",NA,"","",NA
1744,758917418,"darcmaniluk (30/50)",0,85.8,"P Max Scherzer P Jake Arrieta OF Dexter Fowler OF Nelson Cruz SS Greg Garcia 3B Kyle Seager C Evan Gattis 2B Taylor Motter 1B Yuli Gurriel OF Guillermo Heredia",NA,"","",NA
1744,758978124,"gfay63 (36/50)",0,85.8,"P Max Scherzer P Zack Godley 3B Jedd Gyorko 1B Matt Carpenter OF Randal Grichuk OF Dexter Fowler OF Tommy Pham 2B Starlin Castro SS Tim Beckham C Derek Norris",NA,"","",NA
1744,759016004,"jdhender (3/5)",0,85.8,"P Max Scherzer P Zack Godley OF Mookie Betts 1B Matt Carpenter OF Dexter Fowler OF Tommy Pham 3B Evan Longoria SS Greg Garcia 2B Andrés Blanco C Derek Norris",NA,"","",NA
1748,759012752,"ahurley23 (46/50)",0,85.7,"P Masahiro Tanaka P Dan Straily 3B Jedd Gyorko 1B Matt Carpenter OF Randal Grichuk OF Michael Brantley SS Francisco Lindor 2B Jason Kipnis C Yadier Molina OF Tommy Pham",NA,"","",NA
1749,758884503,"shawnzhan (3/50)",0,85.60001,"P Max Scherzer P Aaron Nola 1B Matt Carpenter OF Dexter Fowler 2B Kolten Wong OF Tommy Pham 3B Evan Longoria OF Kevin Kiermaier SS Tim Beckham C Derek Norris",NA,"","",NA
1749,758900200,"dacoltz (48/50)",0,85.60001,"P Max Scherzer P Aaron Nola OF Corey Dickerson OF Steven Souza Jr. 3B Evan Longoria OF Michael Saunders 1B Tommy Joseph SS Tim Beckham 2B Andrés Blanco C Derek Norris",NA,"","",NA
1749,759010610,"bcalicore (18/50)",0,85.60001,"P Max Scherzer P Aaron Nola 2B Jonathan Villar 1B Matt Carpenter OF Matt Kemp OF Nick Markakis OF Matt Adams C Tyler Flowers SS Tim Beckham 3B Rio Ruiz",NA,"","",NA
1749,759032134,"starstx (3/3)",0,85.6,"P Aaron Nola P Zack Godley 1B Paul Goldschmidt 3B Jake Lamb 2B José Altuve OF Chris Owings OF Yasmany Tomás SS Carlos Correa C Salvador Perez OF George Springer",NA,"","",NA
1749,759039380,"Gordon-Shumway (3/23)",0,85.6,"P Dan Straily P Jaime García OF Mookie Betts SS Xander Bogaerts 3B Josh Donaldson 1B Hanley Ramírez OF Andrew Benintendi OF Kevin Pillar C Jonathan Lucroy 2B Starlin Castro",NA,"","",NA
1749,759040447,"coachnicastro",0,85.6,"P Jake Arrieta P Aaron Nola SS Trea Turner OF Aaron Judge 1B Joey Votto OF Michael Brantley OF Aaron Altherr 3B Wilmer Flores 2B Andrés Blanco C René Rivera",NA,"","",NA
1749,759047620,"Tglodek11 (4/30)",0,85.6,"P Eduardo Rodríguez P Zack Godley OF Mookie Betts SS Xander Bogaerts 1B Hanley Ramírez OF Andrew Benintendi OF Nomar Mazara 3B Manny Machado 2B Starlin Castro C Evan Gattis",NA,"","",NA
1749,759050930,"spittingmidgets (3/3)",0,85.6,"P Jake Arrieta P Aaron Nola 2B Jonathan Villar OF Nomar Mazara SS Francisco Lindor 3B Manny Machado OF Keon Broxton OF Steven Souza Jr. 1B Joe Mauer C Russell Martin",NA,"","",NA
1757,758900186,"dacoltz (34/50)",0,85.55,"P Chris Archer P Zack Godley SS Francisco Lindor 3B Manny Machado 2B Jason Kipnis 1B Chris Davis OF Shin-soo Choo OF Josh Reddick C Welington Castillo OF Seth Smith",NA,"","",NA
1757,759018593,"Delaweez81 (2/4)",0,85.55,"P Eduardo Rodríguez OF Mike Trout OF Bryce Harper 1B Matt Carpenter C Buster Posey SS Greg Garcia OF Rajai Davis 2B Starlin Castro 3B Ryan Schimpf P Mike Clevinger",NA,"","",NA
1759,758935407,"tinderella (46/50)",0,85.4,"P Max Scherzer P Mike Bolsinger OF Mookie Betts SS Xander Bogaerts 1B Hanley Ramírez OF Andrew Benintendi 3B Maikel Franco OF Odúbel Herrera C Cameron Rupp 2B Andrés Blanco",NA,"","",NA
1759,758939805,"tommyq236 (1/2)",0,85.4,"P Max Scherzer P Mike Bolsinger OF Bryce Harper 1B Matt Carpenter OF Carlos González SS Francisco Lindor OF Nelson Cruz 3B Evan Longoria 2B Starlin Castro C René Rivera",NA,"","",NA
1759,758946077,"scout326 (25/50)",0,85.4,"P Max Scherzer P Mike Bolsinger OF Mookie Betts 1B Hanley Ramírez OF Andrew Benintendi SS Corey Seager OF Cody Bellinger C Yasmani Grandal 2B Chris Taylor 3B Logan Forsythe",NA,"","",NA
1759,758947711,"skynyrdus62",0,85.4,"P A.J. Griffin P Héctor Santiago 3B Jake Lamb OF Bryce Harper OF Michael Conforto 1B Joey Votto OF Adam Duvall 2B Jason Kipnis SS Carlos Correa C Yadier Molina",NA,"","",NA
1759,759014844,"zanda5404",0,85.4,"P Eduardo Rodríguez P Aaron Nola OF Mookie Betts 3B Manny Machado OF Giancarlo Stanton OF Matt Kemp SS Didi Gregorius 1B Cody Bellinger C J.T. Realmuto 2B Starlin Castro",NA,"","",NA
1759,759047825,"Tglodek11 (16/30)",0,85.4,"P Carlos Martínez P Eduardo Rodríguez SS Xander Bogaerts OF Brett Gardner 1B Mitch Moreland OF Andrew Benintendi C Jonathan Lucroy OF George Springer 2B Starlin Castro 3B Josh Rutledge",NA,"","",NA
1765,759074965,"worm1977 (2/2)",0,85.3,"P Jake Arrieta P Héctor Santiago OF Bryce Harper 2B Jonathan Villar 1B Joey Votto OF Jay Bruce SS Francisco Lindor 3B Maikel Franco OF George Springer C Willson Contreras",NA,"","",NA
1766,759002497,"ahurley23 (24/50)",0,85.2,"P Masahiro Tanaka P Aaron Nola OF Aaron Judge 3B Josh Donaldson OF Brett Gardner OF Aaron Hicks SS Troy Tulowitzki 1B Matt Holliday 2B Starlin Castro C Russell Martin",NA,"","",NA
1766,759012757,"ahurley23 (47/50)",0,85.2,"P Masahiro Tanaka P Aaron Nola OF José Bautista 3B Josh Donaldson SS Trevor Story OF Dexter Fowler 2B Kolten Wong OF Kevin Pillar 1B Kendrys Morales C Russell Martin",NA,"","",NA
1768,758895487,"papagates (11/50)",0,85.15,"P Alex Wood P Jake Arrieta 3B Miguel Sanó OF Khris Davis 2B Brian Dozier OF Max Kepler 1B Wil Myers OF Mark Canha C Stephen Vogt SS Adam Rosales",NA,"","",NA
1768,758986993,"Tolpeko (35/50)",0,85.15,"P Alex Wood P Jake Arrieta 3B Miguel Sanó 2B Brian Dozier OF Max Kepler SS Carlos Correa OF Josh Reddick OF George Springer 1B Kennys Vargas C Jason Castro",NA,"","",NA
1770,759023416,"gehrenberg (13/19)",0,85.05,"P Max Scherzer P Júnior Guerra OF José Bautista 3B Jedd Gyorko 1B Matt Carpenter OF Dexter Fowler C Yadier Molina SS Greg Garcia OF George Springer 2B Andrés Blanco",NA,"","",NA
1770,759070009,"underjones (40/50)",0,85.05,"P Max Scherzer P Júnior Guerra OF Aaron Judge 3B Jedd Gyorko OF Aaron Hicks C Yadier Molina 1B Matt Holliday OF Tommy Pham SS Greg Garcia 2B Starlin Castro",NA,"","",NA
1772,758978110,"gfay63 (22/50)",0,84.95,"P Alex Wood P Aaron Nola 1B Edwin Encarnación OF Michael Brantley SS Francisco Lindor OF Giancarlo Stanton 2B Jason Kipnis 3B Evan Longoria OF George Springer C Yan Gomes",NA,"","",NA
1772,758978117,"gfay63 (29/50)",0,84.95,"P Alex Wood P Aaron Nola 1B Paul Goldschmidt 3B Jake Lamb SS Chris Owings OF David Peralta OF Yasmany Tomás OF Andrew McCutchen 2B Yangervis Solarte C Derek Norris",NA,"","",NA
1774,758959383,"kilzman2",0,84.9,"P Jaime García P Mike Bolsinger 1B Paul Goldschmidt OF Bryce Harper OF Mookie Betts OF Michael Conforto 2B José Altuve 3B Anthony Rendon SS Jean Segura C Buster Posey",NA,"","",NA
1774,759010615,"bcalicore (23/50)",0,84.9,"P Chris Archer P Alex Wood 3B Jedd Gyorko 1B Matt Carpenter OF Randal Grichuk OF Dexter Fowler 2B Yangervis Solarte OF Cory Spangenberg C Austin Hedges SS Allen Cordoba",NA,"","",NA
1774,759050021,"uswntgo4gold (4/7)",0,84.9,"P Eduardo Rodríguez P Dan Straily 3B Jake Lamb 2B Jonathan Villar 1B Matt Carpenter SS Didi Gregorius C Buster Posey OF Matt Joyce OF George Springer OF Matt Adams",NA,"","",NA
1777,758989306,"RSMdk01 (2/3)",0,84.85,"P Chad Kuhl P Zack Godley 1B Paul Goldschmidt OF Bryce Harper OF José Bautista 3B Anthony Rendon OF Mark Trumbo SS Didi Gregorius 2B Jed Lowrie C Jonathan Lucroy",NA,"","",NA
1778,758922288,"ChipotleAddict (44/50)",0,84.8,"P Chris Archer P Júnior Guerra 3B Jedd Gyorko OF Dexter Fowler OF Michael Brantley SS Francisco Lindor 2B Jason Kipnis 1B Carlos Santana C Yadier Molina OF Bradley Zimmer",NA,"","",NA
1778,758969072,"Lesmac24",0,84.8,"P Max Scherzer P Zack Godley OF José Bautista 3B Jedd Gyorko 1B Matt Carpenter OF Aaron Hicks OF Tommy Pham 2B Starlin Castro SS Tim Beckham C Derek Norris",NA,"","",NA
1778,759044913,"juanshen (24/50)",0,84.8,"P Chris Archer P Júnior Guerra OF Mookie Betts 1B Hanley Ramírez OF Andrew Benintendi OF Nelson Cruz SS Jean Segura 3B Evan Longoria 2B Taylor Motter C Mike Zunino",NA,"","",NA
1778,759045873,"bellaedward4eva (18/50)",0,84.8,"P Chris Archer P Júnior Guerra 3B Jedd Gyorko 1B Matt Carpenter OF Dexter Fowler OF Jay Bruce 2B Kolten Wong C Yadier Molina SS Asdrúbal Cabrera OF Curtis Granderson",NA,"","",NA
1782,759025078,"ttbaileyfinch",0,84.75,"P Zack Godley OF Bryce Harper SS Xander Bogaerts 2B José Altuve 1B Matt Carpenter 3B Joey Gallo OF Mark Trumbo C Jonathan Lucroy OF George Springer P Mike Clevinger",NA,"","",NA
1782,759039606,"Hipful2014 (2/2)",0,84.75,"P Zack Godley 1B Paul Goldschmidt 3B Jake Lamb 2B José Altuve OF David Peralta OF Aaron Hicks SS Carlos Correa OF Josh Reddick C Evan Gattis P Mike Clevinger",NA,"","",NA
1784,758902451,"SlowQueen (4/50)",0,84.60001,"P Max Scherzer P Aaron Nola 1B Matt Carpenter OF Dexter Fowler OF Steven Souza Jr. OF Tommy Pham 3B Evan Longoria SS Greg Garcia 2B Andrés Blanco C Derek Norris",NA,"","",NA
1784,758923811,"JoseB17 (1/3)",0,84.60001,"P Max Scherzer P Aaron Nola 2B José Altuve 1B Matt Carpenter OF Andrew Benintendi OF George Springer C Evan Gattis OF Matt Adams SS Tim Beckham 3B Andrés Blanco",NA,"","",NA
1784,758927040,"ThatStunna (15/18)",0,84.60001,"P Max Scherzer P Aaron Nola OF Aaron Judge OF Aaron Hicks 1B Matt Holliday 3B Evan Longoria OF George Springer 2B Starlin Castro SS Tim Beckham C Austin Romine",NA,"","",NA
1784,758931646,"JoseB17 (2/3)",0,84.60001,"P Max Scherzer P Aaron Nola 2B José Altuve 1B Matt Carpenter OF Andrew Benintendi OF George Springer C Evan Gattis OF Matt Adams SS Tim Beckham 3B Andrés Blanco",NA,"","",NA
1784,758931859,"JoseB17 (3/3)",0,84.60001,"P Max Scherzer P Aaron Nola 2B José Altuve 1B Matt Carpenter OF Andrew Benintendi OF George Springer C Evan Gattis OF Matt Adams SS Tim Beckham 3B Andrés Blanco",NA,"","",NA
1784,758951675,"rogersw",0,84.60001,"P Max Scherzer P Aaron Nola 1B Matt Carpenter OF Dexter Fowler C Yadier Molina OF Josh Reddick 3B Greg Garcia OF George Springer SS Tim Beckham 2B Andrés Blanco",NA,"","",NA
1784,758978091,"gfay63 (3/50)",0,84.60001,"P Max Scherzer P Aaron Nola OF Michael Brantley 2B Jason Kipnis 1B Carlos Santana OF Tommy Pham 3B José Ramírez C Yan Gomes OF Kole Calhoun SS Tim Beckham",NA,"","",NA
1784,758978100,"gfay63 (12/50)",0,84.60001,"P Max Scherzer P Aaron Nola OF Michael Brantley 2B Jason Kipnis 1B Carlos Santana OF Tommy Pham 3B José Ramírez C Yan Gomes OF Andrew McCutchen SS Tim Beckham",NA,"","",NA
1784,759069981,"underjones (12/50)",0,84.60001,"P Max Scherzer P Aaron Nola 2B José Altuve SS Carlos Correa 3B Maikel Franco OF George Springer OF Michael Saunders C Evan Gattis OF Odúbel Herrera 1B Yuli Gurriel",NA,"","",NA
1784,759075369,"Johnnyscalz (2/2)",0,84.6,"P Jake Arrieta P Eduardo Rodríguez 2B José Altuve 3B Manny Machado OF Mark Trumbo 1B Chris Davis SS Carlos Correa OF George Springer C Evan Gattis OF Carlos Beltrán",NA,"","",NA
1794,758993017,"windchimesRrude (24/32)",0,84.45,"P Jake Arrieta 3B Manny Machado OF Nelson Cruz OF Seth Smith 1B Danny Valencia 2B Jonathan Schoop SS Taylor Motter C Mike Zunino OF Hyun Soo Kim P Jacob deGrom",NA,"","",NA
1795,758900202,"dacoltz (50/50)",0,84.4,"P Max Scherzer P Mike Bolsinger OF Mike Trout 3B Josh Donaldson 2B José Altuve SS Carlos Correa OF Josh Reddick C Evan Gattis OF Kole Calhoun 1B Yuli Gurriel",NA,"","",NA
1795,759034646,"ehafner (40/50)",0,84.4,"P Max Scherzer P Mike Bolsinger 2B Jonathan Villar 1B Eric Thames OF Corey Dickerson OF Steven Souza Jr. OF Hernán Pérez 3B Evan Longoria SS Tim Beckham C Derek Norris",NA,"","",NA
1795,759044908,"juanshen (19/50)",0,84.4,"P Max Scherzer P Mike Bolsinger OF Corey Dickerson 3B Jedd Gyorko 1B Matt Carpenter 2B Brian Dozier OF Steven Souza Jr. C Yadier Molina OF Tommy Pham SS Tim Beckham",NA,"","",NA
1795,759047641,"Tglodek11 (7/30)",0,84.4,"P Carlos Martínez P Eduardo Rodríguez 2B José Altuve 1B Matt Carpenter 3B Manny Machado OF Adam Jones SS Carlos Correa OF George Springer C Evan Gattis OF Odúbel Herrera",NA,"","",NA
1795,759069384,"rrentz",0,84.4,"P Max Scherzer P Mike Bolsinger OF José Bautista 3B Jedd Gyorko OF Andrew Benintendi OF Nelson Cruz 2B Jed Lowrie 1B Lucas Duda C Buster Posey SS Tim Beckham",NA,"","",NA
1800,758893736,"ocdobv (8/50)",0,84.35001,"P Chris Archer P Aaron Nola OF Corey Dickerson 1B Matt Carpenter OF Dexter Fowler OF Steven Souza Jr. C Yadier Molina 3B Evan Longoria SS Tim Beckham 2B Andrés Blanco",NA,"","",NA
1801,758986961,"Tolpeko (3/50)",0,84.15,"P Alex Wood P Jake Arrieta OF Dexter Fowler OF Khris Davis 2B Jed Lowrie C Yadier Molina SS Greg Garcia OF Matt Joyce 1B Ryon Healy 3B Trevor Plouffe",NA,"","",NA
1802,759007994,"TinkyTyler (7/23)",0,84.10001,"P Max Scherzer P Dan Straily OF Randal Grichuk 2B Kolten Wong OF Tommy Pham 3B Alex Bregman SS Greg Garcia OF George Springer C Evan Gattis 1B Yuli Gurriel",NA,"","",NA
1803,758922267,"ChipotleAddict (23/50)",0,84.05,"P Max Scherzer P Júnior Guerra OF Randal Grichuk OF Dexter Fowler SS Francisco Lindor 2B Jason Kipnis 1B Carlos Santana OF Tommy Pham 3B Greg Garcia C Yan Gomes",NA,"","",NA
1803,758930531,"jakz101",0,84.05,"P Max Scherzer P Júnior Guerra 3B Jedd Gyorko 1B Matt Carpenter OF Randal Grichuk OF Dexter Fowler 2B Jason Kipnis OF Tommy Pham C Evan Gattis SS Tim Beckham",NA,"","",NA
1803,758974206,"tim961",0,84.05,"P Max Scherzer P Júnior Guerra 1B Matt Carpenter OF Dexter Fowler 2B Kolten Wong SS Carlos Correa C Yadier Molina OF Shin-soo Choo OF Tommy Pham 3B Evan Longoria",NA,"","",NA
1803,759003111,"forlife36 (2/5)",0,84.05,"P Max Scherzer P Júnior Guerra 1B Matt Carpenter OF Dexter Fowler 2B Kolten Wong SS Carlos Correa C Yadier Molina OF Shin-soo Choo OF Tommy Pham 3B Evan Longoria",NA,"","",NA
1803,759044441,"richwill27 (2/10)",0,84.05,"P Max Scherzer P Júnior Guerra 2B José Altuve 3B Jedd Gyorko 1B Matt Carpenter OF Carlos González SS Carlos Correa OF Tommy Pham OF George Springer C René Rivera",NA,"","",NA
1808,759025249,"FLThunder70 (1/4)",0,84,"P Masahiro Tanaka P Mike Bolsinger OF Mike Trout OF Bryce Harper 2B José Altuve 3B Jedd Gyorko 1B Matt Carpenter OF Aaron Hicks SS Carlos Correa C Welington Castillo",NA,"","",NA
1809,758966193,"LyleB (1/2)",0,83.95,"P Alex Wood P Eduardo Rodríguez OF Mike Trout 3B Jedd Gyorko 2B DJ LeMahieu 1B Albert Pujols C Buster Posey OF Kole Calhoun SS J.J. Hardy OF Justin Ruggiano",NA,"","",NA
1810,759042978,"Dylthepickle1 (1/2)",0,83.9,"P Aaron Nola P Dan Straily OF Khris Davis 1B Justin Bour 2B Adam Frazier OF David Peralta SS Francisco Lindor 3B Manny Machado OF Aaron Hicks C Buster Posey",NA,"","",NA
1811,758895482,"papagates (6/50)",0,83.8,"P Max Scherzer P Jake Arrieta OF Adam Jones 1B Chris Davis C Welington Castillo OF Matt Joyce 3B Ryon Healy OF Mark Canha 2B Jonathan Schoop SS Adam Rosales",NA,"","",NA
1811,758949514,"dez_Wick",0,83.8,"P Max Scherzer P Zack Godley OF Matt Kemp SS Didi Gregorius OF Marcell Ozuna 1B Cody Bellinger 2B Ian Happ OF Tommy Pham C Welington Castillo 3B Evan Longoria",NA,"","",NA
1811,759044912,"juanshen (23/50)",0,83.8,"P Chris Archer P Júnior Guerra 3B Jedd Gyorko 1B Matt Carpenter OF Randal Grichuk SS Trevor Story OF Adam Jones C Yadier Molina OF Tommy Pham 2B Jonathan Schoop",NA,"","",NA
1811,759045885,"bellaedward4eva (30/50)",0,83.8,"P Max Scherzer P Zack Godley 3B Jedd Gyorko 1B Matt Carpenter OF Dexter Fowler 2B Kolten Wong OF Tommy Pham OF Odúbel Herrera C Cameron Rupp SS Freddy Galvis",NA,"","",NA
1811,759045892,"bellaedward4eva (37/50)",0,83.8,"P Chris Archer P Júnior Guerra 3B Jedd Gyorko 1B Matt Carpenter OF Randal Grichuk 2B Kolten Wong SS Carlos Correa OF Tommy Pham OF George Springer C Evan Gattis",NA,"","",NA
1811,759053837,"richwill27 (10/10)",0,83.8,"P Max Scherzer P Zack Godley OF Mookie Betts 3B Jedd Gyorko 1B Matt Carpenter OF Andrew Benintendi C Cameron Rupp SS Freddy Galvis 2B Andrés Blanco OF Ezequiel Carrera",NA,"","",NA
1817,758924251,"ganondorf (49/50)",0,83.75,"P Max Scherzer OF Mookie Betts 2B Brandon Phillips OF Matt Kemp 1B Tommy Joseph OF Nick Markakis SS Taylor Motter C Christian Vázquez 3B Deven Marrero P Mike Clevinger",NA,"","",NA
1817,759023681,"santoro4422",0,83.75,"P Zack Godley OF Mike Trout OF Bryce Harper OF Mookie Betts 3B Anthony Rendon SS Carlos Correa 1B Buster Posey 2B Starlin Castro C Evan Gattis P Mike Clevinger",NA,"","",NA
1819,759053966,"Jlbarrels",0,83.7,"P Masahiro Tanaka P Dan Straily OF Mike Trout 2B Robinson Canó OF Randal Grichuk 3B Miguel Sanó SS Aledmys Díaz 1B Carlos Santana C Jonathan Lucroy OF Peter Bourjos",NA,"","",NA
1820,758895521,"papagates (45/50)",0,83.60001,"P Max Scherzer P Aaron Nola OF Randal Grichuk OF Khris Davis 2B Kolten Wong C Yadier Molina 1B Ryon Healy OF Rajai Davis 3B Trevor Plouffe SS Adam Rosales",NA,"","",NA
1820,758933442,"fallfromgrace (5/50)",0,83.60001,"P Max Scherzer P Aaron Nola OF Mike Trout 1B Eric Thames OF Steven Souza Jr. 3B Evan Longoria OF George Springer SS Tim Beckham C Derek Norris 2B Daniel Robertson",NA,"","",NA
1820,758978098,"gfay63 (10/50)",0,83.60001,"P Max Scherzer P Aaron Nola 2B José Altuve SS Carlos Correa OF Josh Reddick 3B Evan Longoria OF George Springer C Evan Gattis OF Kole Calhoun 1B Rickie Weeks Jr.",NA,"","",NA
1820,759069978,"underjones (9/50)",0,83.60001,"P Max Scherzer P Aaron Nola 3B Jedd Gyorko OF Aaron Altherr C Yadier Molina OF Tommy Pham SS Greg Garcia 1B Tommy Joseph OF Odúbel Herrera 2B Andrés Blanco",NA,"","",NA
1820,758946071,"scout326 (19/50)",0,83.6,"P Aaron Nola P Zack Godley 1B Paul Goldschmidt 3B Jake Lamb 2B José Altuve SS Chris Owings OF David Peralta OF Yasmany Tomás OF George Springer C Evan Gattis",NA,"","",NA
1825,758900166,"dacoltz (14/50)",0,83.55,"P Chris Archer P Zack Godley OF José Bautista 3B Josh Donaldson 2B José Altuve SS Carlos Correa OF Kevin Pillar OF Josh Reddick C Russell Martin 1B Yuli Gurriel",NA,"","",NA
1825,758950709,"shane918 (1/2)",0,83.55,"P Eduardo Rodríguez 3B Nolan Arenado 1B Matt Carpenter OF Carlos González OF Brett Gardner 2B Jed Lowrie SS Andrelton Simmons OF George Springer C Russell Martin P Mike Clevinger",NA,"","",NA
1825,758950749,"shane918 (2/2)",0,83.55,"P Eduardo Rodríguez 3B Nolan Arenado 1B Matt Carpenter OF Carlos González OF Brett Gardner 2B Jed Lowrie SS Andrelton Simmons OF George Springer C Russell Martin P Mike Clevinger",NA,"","",NA
1825,759020895,"southpaw1969 (1/2)",0,83.55,"P Aaron Nola OF Aaron Judge 3B Nolan Arenado 2B José Altuve OF Andrew Benintendi 1B Justin Bour OF Jackie Bradley Jr. SS Carlos Correa C Austin Hedges P Mike Clevinger",NA,"","",NA
1829,758907019,"eagles51020 (8/20)",0,83.4,"P Eduardo Rodríguez P Aaron Nola OF José Bautista 3B Josh Donaldson 2B José Altuve OF Carlos González 1B Justin Smoak SS Troy Tulowitzki C Evan Gattis OF Carlos Beltrán",NA,"","",NA
1829,758993996,"black26 (4/6)",0,83.4,"P Eduardo Rodríguez P Aaron Nola OF Charlie Blackmon 2B José Altuve OF Dexter Fowler OF Andrew Benintendi SS Carlos Correa 3B Evan Longoria C Evan Gattis 1B Rickie Weeks Jr.",NA,"","",NA
1829,758994010,"black26 (5/6)",0,83.4,"P Eduardo Rodríguez P Aaron Nola OF Charlie Blackmon 2B José Altuve OF Dexter Fowler OF Andrew Benintendi SS Carlos Correa 3B Evan Longoria C Evan Gattis 1B Rickie Weeks Jr.",NA,"","",NA
1829,758994018,"black26 (6/6)",0,83.4,"P Eduardo Rodríguez P Aaron Nola OF Charlie Blackmon 2B José Altuve OF Dexter Fowler OF Andrew Benintendi SS Carlos Correa 3B Evan Longoria C Evan Gattis 1B Rickie Weeks Jr.",NA,"","",NA
1829,759068812,"KRONWALLED1134",0,83.4,"P Max Scherzer P Mike Bolsinger OF Bryce Harper 1B Matt Carpenter OF Carlos González OF Nelson Cruz SS Carlos Correa 3B Evan Longoria 2B Starlin Castro C René Rivera",NA,"","",NA
1834,758934045,"oliphantj15 (1/3)",0,83.2,"P Masahiro Tanaka P Aaron Nola OF Mike Trout 3B Kris Bryant 2B DJ LeMahieu OF Andrew Benintendi 1B Albert Pujols C Buster Posey OF George Springer SS J.J. Hardy",NA,"","",NA
1835,758880240,"gilbertformvp",0,83.1,"P Alex Wood OF Michael Conforto SS Xander Bogaerts 3B Anthony Rendon OF Andrew Benintendi 2B Jed Lowrie 1B Adam Lind OF Matt Adams C Christian Vázquez P Mike Clevinger",NA,"","",NA
1835,758972491,"pueblowesthoggy",0,83.1,"P Carlos Martínez P Jaime García 1B Matt Carpenter 2B Adam Frazier SS Francisco Lindor OF Aaron Hicks OF Mark Trumbo OF Nelson Cruz C Yadier Molina 3B Josh Harrison",NA,"","",NA
1837,758884516,"shawnzhan (16/50)",0,83.05,"P Max Scherzer P Júnior Guerra 3B Jedd Gyorko OF Michael Brantley 2B Jason Kipnis 1B Carlos Santana C Yadier Molina OF Tommy Pham SS Greg Garcia OF Bradley Zimmer",NA,"","",NA
1837,758933439,"fallfromgrace (2/50)",0,83.05,"P Max Scherzer P Júnior Guerra OF Aaron Judge 1B Matt Carpenter OF Dexter Fowler 2B Kolten Wong OF Tommy Pham 3B Evan Longoria SS Greg Garcia C Russell Martin",NA,"","",NA
1837,759023420,"gehrenberg (17/19)",0,83.05,"P Max Scherzer P Júnior Guerra 2B José Altuve 3B Jedd Gyorko 1B Matt Carpenter OF Dexter Fowler OF Tommy Pham SS Greg Garcia C Evan Gattis OF Odúbel Herrera",NA,"","",NA
1837,759044923,"juanshen (34/50)",0,83.05,"P Max Scherzer P Júnior Guerra 2B Robinson Canó 3B Jedd Gyorko OF Dexter Fowler SS Francisco Lindor OF Nelson Cruz C Yadier Molina 1B Danny Valencia OF Guillermo Heredia",NA,"","",NA
1841,758900160,"dacoltz (8/50)",0,82.95,"P Alex Wood P Aaron Nola SS Trea Turner OF José Bautista 2B José Altuve 3B Anthony Rendon OF Josh Reddick OF George Springer C Evan Gattis 1B Yuli Gurriel",NA,"","",NA
1842,758904860,"southphillyspud",0,82.8,"P Max Scherzer P Jake Arrieta 3B Maikel Franco OF Tommy Pham OF Jayson Werth OF Brandon Belt 1B Ryon Healy 2B Starlin Castro C Cameron Rupp SS Freddy Galvis",NA,"","",NA
1842,758935368,"tinderella (7/50)",0,82.8,"P Max Scherzer P Zack Godley 3B Jedd Gyorko 1B Matt Carpenter OF Dexter Fowler C Buster Posey OF Brandon Belt SS Brandon Crawford 2B Logan Forsythe OF Justin Ruggiano",NA,"","",NA
1844,758912875,"petteytheft89 (2/35)",0,82.75,"P Alex Wood P Mike Bolsinger SS Trea Turner 3B Jedd Gyorko OF Randal Grichuk 1B Hanley Ramírez OF Dexter Fowler 2B Brian Dozier C Yadier Molina OF Tommy Pham",NA,"","",NA
1844,758971955,"kkon11",0,82.75,"P Zack Godley OF Mike Trout OF Bryce Harper OF Mookie Betts SS Francisco Lindor 1B Albert Pujols C Buster Posey 3B Evan Longoria 2B Starlin Castro P Mike Clevinger",NA,"","",NA
