"Rank","EntryId","EntryName","TimeRemaining","Points","Lineup","X","Player","X.Drafted","FPTS"
223,761462047,"Rakiki",0,125.15,"P Jake Arrieta P Mike Pelfrey OF Corey Dickerson 3B Jake Lamb 2B Brian Dozier OF Chris Owings 1B Joey Votto OF Jason Heyward SS Tim Beckham C Tyler Flowers",NA,"Yolmer Sánchez","0.96%",0
224,761429104,"quartermil01",0,125.05,"P Max Scherzer P Jake Arrieta OF Aaron Altherr 2B Rougned Odor 3B Travis Shaw 1B Chris Davis C Jonathan Lucroy OF Lorenzo Cain OF Hernán Pérez SS Dansby Swanson",NA,"Nicholas Castellanos","0.96%",10
225,761399176,"kaysizzle (13/16)",0,124.75,"P Drew Pomeranz P James Paxton 3B Evan Longoria OF Ben Zobrist SS Xander Bogaerts 1B Miguel Cabrera 2B Jason Kipnis C Evan Gattis OF Jayson Werth OF Byron Buxton",NA,"José Iglesias","0.96%",3
226,761271321,"TeamTexans2003",0,124.6,"P James Paxton OF Aaron Judge SS Carlos Correa OF Corey Dickerson 3B Josh Donaldson OF Brett Gardner 1B Joey Votto 2B Starlin Castro C Matt Wieters P David Paulino",NA,"Matt Davidson","0.96%",3
227,761406317,"FlameThrower4",0,124.55,"P Max Scherzer P Mike Clevinger OF Aaron Judge OF Corey Dickerson 1B José Abreu C Salvador Perez SS JT Riddle 3B Daniel Robertson 2B Eric Sogard OF Franchy Cordero",NA,"Eddie Rosario","0.96%",26
228,761451863,"RastaAK47",0,124.4,"P Jake Arrieta P Hyun-Jin Ryu OF Ben Zobrist SS Chris Owings 2B Daniel Murphy OF Shin-soo Choo OF Marwin González 3B Manny Machado 1B Eric Thames C Buster Posey",NA,"Mike Bolsinger","0.96%",15.2
229,761362108,"JosephBanks",0,124.05,"P Max Scherzer P Jake Arrieta OF Bryce Harper 1B Ryan Zimmerman C Travis d'Arnaud OF Seth Smith 3B Eduardo Escobar 2B Eric Sogard OF Kole Calhoun SS Alcides Escobar",NA,"Brandon Crawford","0.85%",0
229,761367901,"coolhandthomas (1/4)",0,124.05,"P Max Scherzer P Júnior Guerra 3B Evan Longoria OF Ender Inciarte OF Matt Kemp 1B Albert Pujols OF Avisaíl García 2B Whit Merrifield SS Tim Beckham C Chris Iannetta",NA,"Joe Panik","0.85%",5
231,761442719,"JHOOPER436",0,123.95,"P Max Scherzer P James Paxton OF Kevin Kiermaier 1B Mitch Moreland 3B Ryon Healy OF Avisaíl García OF Jorge Bonifacio SS Tim Beckham C Salvador Perez 2B Josh Rutledge",NA,"Kevin Pillar","0.85%",0
232,761388148,"mrole",0,123.9,"P Zack Godley P James Paxton 3B Jake Lamb 1B Ryan Zimmerman 2B Daniel Murphy SS Jean Segura OF Cody Bellinger OF Tommy Pham OF Avisaíl García C Buster Posey",NA,"Mark Reynolds","0.85%",0
232,761446340,"Guyute17",0,123.9,"P Zack Godley P James Paxton OF J.D. Martinez 2B José Ramírez 1B Joey Votto SS Trea Turner OF Matt Kemp OF Kevin Pillar 3B Kyle Seager C Alex Avila",NA,"Colby Rasmus","0.85%",5
234,761338790,"remjr.75",0,123.85,"P Max Scherzer P Hyun-Jin Ryu OF Adam Duvall OF Billy Hamilton 1B Joey Votto 2B Devon Travis OF Scott Schebler C Tucker Barnhart 3B Christian Arroyo SS Alcides Escobar",NA,"Eduardo Núñez","0.85%",5
235,761409570,"zpop2 (2/4)",0,123.75,"P Drew Pomeranz P James Paxton 2B José Altuve OF Billy Hamilton SS Elvis Andrus 1B Miguel Cabrera OF Matt Kemp OF Scooter Gennett 3B Maikel Franco C Martín Maldonado",NA,"Dansby Swanson","0.74%",0
236,761475953,"goochmonger (2/25)",0,123.55,"P Chris Archer P James Paxton 1B Yonder Alonso SS Zack Cozart 2B Devon Travis OF Scott Schebler OF Matt Kemp 3B Kyle Seager OF Ben Gamel C Tucker Barnhart",NA,"Kiké Hernández","0.74%",5
237,761322264,"ccleaver94 (3/4)",0,123.5,"P Drew Pomeranz P Jaime García OF Aaron Judge OF Steven Souza Jr. 1B Ryan Zimmerman 2B Adam Frazier 3B Marwin González C Russell Martin SS Asdrúbal Cabrera OF Cory Spangenberg",NA,"Joe Mauer","0.74%",0
238,761473038,"jamesberg (2/2)",0,123.45,"P Max Scherzer P Zack Godley OF Robbie Grossman 1B Wil Myers OF Max Kepler 2B José Peraza SS Jorge Polanco OF Grégor Blanco 3B Daniel Descalso C Chris Gimenez",NA,"Brandon Drury","0.74%",5
239,761442059,"Buckmulligan (3/3)",0,123.25,"P Mike Pelfrey 1B Paul Goldschmidt OF Charlie Blackmon 2B José Altuve OF Aaron Judge SS Carlos Correa 3B Kris Bryant OF Corey Dickerson C René Rivera P David Paulino",NA,"Mike Pelfrey","0.74%",18.85
240,761375437,"kaysizzle (4/16)",0,122.75,"P Drew Pomeranz P James Paxton SS Carlos Correa 3B Evan Longoria OF Ben Zobrist 1B Miguel Cabrera 2B Jason Kipnis C Buster Posey OF Byron Buxton OF Odúbel Herrera",NA,"Brandon Belt","0.74%",5
241,761397950,"greek2117",0,122.7,"P Jake Arrieta OF Charlie Blackmon OF George Springer SS Elvis Andrus 1B Ryan Zimmerman 2B Neil Walker OF Kyle Schwarber 3B Manny Machado C Brian McCann P David Paulino",NA,"Rio Ruiz","0.74%",0
241,761428869,"OSGT2015",0,122.7,"P Jake Arrieta 3B Kris Bryant OF Adam Duvall OF Billy Hamilton 1B Joey Votto SS Zack Cozart OF Scott Schebler 2B DJ LeMahieu C Evan Gattis P David Paulino",NA,"Derek Dietrich","0.74%",5
243,761260732,"Relaunch",0,122.5,"P Zack Godley P Mike Clevinger SS Carlos Correa OF Steven Souza Jr. OF Kevin Kiermaier 1B Lucas Duda 3B Marwin González 2B Jonathan Schoop OF Jayson Werth C Tyler Flowers",NA,"Norichika Aoki","0.74%",14
244,761404225,"bcrenner (3/4)",0,122.3,"P Jacob deGrom P Hyun-Jin Ryu 3B Nolan Arenado OF J.D. Martinez 2B Jonathan Schoop OF Adam Jones OF Mark Trumbo 1B Chris Davis SS José Iglesias C Alex Avila",NA,"Drew Butera","0.74%",0
245,761352458,"MabNC13 (5/6)",0,122.1,"P Jake Arrieta P Mike Clevinger SS Francisco Lindor OF Aaron Hicks 2B Dee Gordon 1B Joe Mauer OF Jackie Bradley Jr. OF Cody Bellinger C Evan Gattis 3B Deven Marrero",NA,"Maikel Franco","0.74%",6
245,761360910,"MabNC13 (6/6)",0,122.1,"P Jake Arrieta P Mike Clevinger SS Francisco Lindor OF Aaron Hicks 2B Dee Gordon 1B Joe Mauer OF Jackie Bradley Jr. OF Cody Bellinger C Evan Gattis 3B Deven Marrero",NA,"Hunter Renfroe","0.64%",2
247,761464984,"jmugavero1",0,121.75,"P Zack Godley P Antonio Senzatela OF Michael Conforto SS Xander Bogaerts 1B Joey Votto 3B Anthony Rendon 2B Devon Travis OF Christian Yelich OF Matt Kemp C Salvador Perez",NA,"Caleb Joseph","0.64%",7
248,761470289,"proto144 (6/8)",0,121.7,"P Chris Archer P Sean Manaea 3B Anthony Rendon 2B Daniel Murphy SS Jean Segura OF Matt Kemp OF Avisaíl García OF Leury García C Tyler Flowers 1B John Jaso",NA,"Ryan Schimpf","0.64%",14
248,761470313,"proto144 (7/8)",0,121.7,"P Chris Archer P Sean Manaea 3B Anthony Rendon 2B Daniel Murphy SS Jean Segura OF Matt Kemp OF Avisaíl García OF Leury García C Tyler Flowers 1B John Jaso",NA,"Wilmer Flores","0.64%",3
250,761437637,"bigmac70 (2/7)",0,121.55,"P Aaron Nola 2B José Altuve SS Carlos Correa 3B Kris Bryant 1B Anthony Rizzo OF George Springer OF Michael Brantley OF Jackie Bradley Jr. C Matt Wieters P David Paulino",NA,"Welington Castillo","0.64%",0
251,761355391,"bluejays1984",0,121.45,"P Max Scherzer P Zack Godley OF Tommy Pham 1B Eric Thames 2B Rougned Odor SS Nick Ahmed C Jonathan Lucroy OF Jayson Werth 3B Chase Headley OF Hernán Pérez",NA,"Addison Russell","0.64%",0
252,761317790,"afong343",0,121.35,"P Jake Arrieta P Antonio Senzatela OF Aaron Judge 1B Ryan Zimmerman SS Zack Cozart 2B Starlin Castro OF Mark Trumbo 3B Travis Shaw C Buster Posey OF Jayson Werth",NA,"John Jaso","0.64%",11
252,761367665,"mikeb2320 (2/2)",0,121.35,"P Mike Clevinger P Luis Perdomo 3B Jake Lamb OF Brett Gardner 1B Joey Votto SS Trea Turner 2B Daniel Murphy OF Colby Rasmus OF Andrew Benintendi C Salvador Perez",NA,"Cory Spangenberg","0.64%",0
254,761454863,"baldguy3 (3/3)",0,121.3,"P Jake Arrieta P Dan Straily 3B José Ramírez 1B Justin Bour SS Corey Seager OF Andrew McCutchen 2B Starlin Castro OF Tommy Pham C Francisco Cervelli OF Guillermo Heredia",NA,"Cliff Pennington","0.64%",0
255,761330959,"Playaflyreborn (1/2)",0,121.15,"P Carlos Martínez P Sean Manaea 1B Anthony Rizzo SS Francisco Lindor 2B José Ramírez OF Max Kepler 3B Derek Dietrich OF Andrew Romine OF Lorenzo Cain C Andrew Knapp",NA,"Brian Goodwin","0.64%",0
256,761227705,"frankdog4",0,120.9,"P Max Scherzer P Masahiro Tanaka OF Marwin González OF Melky Cabrera 1B Cody Bellinger OF Matt Kemp 2B Whit Merrifield 3B Logan Forsythe C Jason Castro SS JT Riddle",NA,"Mark Canha","0.64%",5
256,761430477,"RexHoyt22 (1/5)",0,120.9,"P Zack Godley P James Paxton SS Carlos Correa 2B Jason Kipnis OF Shin-soo Choo 3B Marwin González OF Tommy Pham 1B Albert Pujols OF Max Kepler C Russell Martin",NA,"Troy Tulowitzki","0.64%",0
258,761341105,"saviortellez",0,120.85,"P Max Scherzer P Hyun-Jin Ryu 2B Ben Zobrist SS Corey Seager OF Matt Kemp OF Mark Trumbo 3B Kyle Seager C Yasmani Grandal OF Jayson Werth 1B Adrián González",NA,"Alex Gordon","0.64%",3
258,761445327,"RexHoyt22 (5/5)",0,120.85,"P Max Scherzer P Hyun-Jin Ryu 2B Daniel Murphy 3B Marwin González OF Tommy Pham 1B Albert Pujols C Russell Martin OF Jayson Werth OF Howie Kendrick SS J.J. Hardy",NA,"Michael A. Taylor","0.64%",7
260,761381364,"kingdrafter99",0,120.75,"P Drew Pomeranz P James Paxton OF Aaron Judge OF J.D. Martinez 1B Ryan Zimmerman 2B Daniel Murphy SS Jean Segura OF Tommy Pham C Welington Castillo 3B Paul DeJong",NA,"Mike Zunino","0.64%",12
261,761440548,"dreday7 (2/5)",0,120.4,"P Jake Arrieta P Hyun-Jin Ryu OF José Bautista 1B Joey Votto SS Zack Cozart 2B Devon Travis OF Justin Upton OF Scott Schebler 3B Eugenio Suárez C Russell Martin",NA,"Jace Peterson","0.64%",3
262,761335148,"Chris_fdog (1/2)",0,120.3,"P Max Scherzer P Drew Pomeranz 2B Ian Happ OF Tommy Pham SS Tim Beckham 1B Chris Davis C Yasmani Grandal OF Jayson Werth OF Lorenzo Cain 3B Hernán Pérez",NA,"Jesús Aguilar","0.64%",9
262,761406772,"phillies1964 (3/3)",0,120.3,"P Jake Arrieta P Dan Straily OF Mookie Betts OF Marcell Ozuna OF Andrew Benintendi SS Corey Seager 2B Starlin Castro 3B Todd Frazier 1B Chris Davis C Matt Wieters",NA,"Keon Broxton","0.64%",16
264,761409560,"zpop2 (1/4)",0,120.25,"P Zack Godley P Drew Pomeranz 2B José Altuve OF Mookie Betts SS Elvis Andrus 1B Miguel Cabrera OF Scott Schebler OF Lorenzo Cain 3B Maikel Franco C Martín Maldonado",NA,"Danny Santana","0.64%",0
265,761340874,"BK68 (14/20)",0,120.1,"P Drew Pomeranz P Luis Perdomo OF Aaron Judge OF Brett Gardner C Gary Sánchez 1B Ryan Zimmerman 3B Anthony Rendon SS Trea Turner 2B Starlin Castro OF Michael A. Taylor",NA,"Brett Eibner","0.64%",0
266,761485258,"goochmonger (25/25)",0,120,"P James Paxton P Mike Clevinger OF Michael Conforto 2B Robinson Canó 1B Justin Smoak SS Zack Cozart OF Robbie Grossman OF Scott Schebler 3B Kyle Seager C Evan Gattis",NA,"Adam Jones","0.53%",32
267,761466179,"twilly2401",0,119.95,"P Max Scherzer P James Paxton OF Aaron Judge SS Xander Bogaerts 1B Trey Mancini OF Jayson Werth C Christian Vázquez 3B Logan Forsythe 2B Daniel Robertson OF Eric Young Jr.",NA,"Josh Reddick","0.53%",0
268,761389273,"dramsfan61 (1/4)",0,119.9,"P Chris Archer P Drew Pomeranz SS Carlos Correa OF J.D. Martinez OF Avisaíl García 1B Buster Posey C J.T. Realmuto OF Michael Saunders 3B Hernán Pérez 2B Jace Peterson",NA,"Jonathan Villar","0.53%",0
268,761389277,"dramsfan61 (2/4)",0,119.9,"P Chris Archer P Drew Pomeranz SS Carlos Correa OF J.D. Martinez OF Avisaíl García 1B Buster Posey C J.T. Realmuto OF Michael Saunders 3B Hernán Pérez 2B Jace Peterson",NA,"Mike Moustakas","0.53%",0
268,761389279,"dramsfan61 (3/4)",0,119.9,"P Chris Archer P Drew Pomeranz SS Carlos Correa OF J.D. Martinez OF Avisaíl García 1B Buster Posey C J.T. Realmuto OF Michael Saunders 3B Hernán Pérez 2B Jace Peterson",NA,"Ryan Goins","0.53%",11
268,761398255,"dramsfan61 (4/4)",0,119.9,"P Chris Archer P Drew Pomeranz SS Carlos Correa OF J.D. Martinez OF Avisaíl García 1B Buster Posey C J.T. Realmuto OF Michael Saunders 3B Hernán Pérez 2B Jace Peterson",NA,"Luke Maile","0.53%",16
268,761436939,"bigmac70 (1/7)",0,119.9,"P Mike Clevinger P Hyun-Jin Ryu OF Mookie Betts 3B Nolan Arenado OF George Springer OF Billy Hamilton 2B Robinson Canó 1B Jay Bruce C Evan Gattis SS José Iglesias",NA,"Jarrod Dyson","0.53%",4
273,761426399,"BradStizzy (3/3)",0,119.85,"P Matthew Boyd 1B Paul Goldschmidt 2B José Altuve OF Adam Duvall 3B Jake Lamb OF Billy Hamilton OF Chris Owings SS Zack Cozart C Evan Gattis P David Paulino",NA,"Chris Young","0.53%",0
274,761360465,"sackmaster10",0,119.55,"P Dan Straily P Ian Kennedy OF Corey Dickerson SS Elvis Andrus OF Brett Gardner 1B Lucas Duda 3B Manny Machado OF David Peralta 2B Starlin Castro C Evan Gattis",NA,"Carlos Beltrán","0.53%",0
274,761485208,"goochmonger (15/25)",0,119.55,"P Chris Archer P James Paxton SS Carlos Correa 1B Jay Bruce OF Robbie Grossman OF Scott Schebler 3B Kyle Seager OF Howie Kendrick 2B Eric Sogard C Tucker Barnhart",NA,"Curtis Granderson","0.53%",8
276,761344444,"metalmaster (14/25)",0,119.4,"P Jacob deGrom P James Paxton OF Aaron Hicks SS Corey Seager 3B Manny Machado 2B Jonathan Schoop OF Adam Jones OF Mark Trumbo 1B Chris Davis C Drew Butera",NA,"José Reyes","0.53%",0
277,761343344,"jgAllDay (9/10)",0,119.3,"P Max Scherzer P Drew Pomeranz OF Ben Zobrist C Willson Contreras 2B Whit Merrifield 3B Daniel Descalso SS Ronald Torreyes 1B Jesús Aguilar OF Kole Calhoun OF Franchy Cordero",NA,"Jordy Mercer","0.53%",17
277,761483196,"billbrady (3/5)",0,119.3,"P Max Scherzer P Drew Pomeranz SS Zack Cozart 2B Starlin Castro OF Tommy Pham 1B Ryon Healy 3B Logan Forsythe OF Keon Broxton C Manny Piña OF Odúbel Herrera",NA,"Luis Torrens","0.53%",5
279,761383897,"kaysizzle (5/16)",0,119.25,"P Carlos Martínez P Matthew Boyd OF J.D. Martinez OF Ben Zobrist SS Xander Bogaerts 2B Jason Kipnis 3B Alex Bregman 1B Wil Myers C Evan Gattis OF Byron Buxton",NA,"Ian Desmond","0.43%",0
280,761408930,"mikeroberta12",0,119.1,"P Jake Arrieta P Mike Clevinger OF Bryce Harper 3B Marwin González 2B Devon Travis OF Andrew McCutchen OF Matt Kemp 1B Matt Carpenter SS Tim Beckham C Yasmani Grandal",NA,"Daniel Robertson","0.43%",3
281,761380314,"brewofthecrew1",0,119,"P Zack Godley P Júnior Guerra OF Charlie Blackmon OF Mookie Betts OF Billy Hamilton 3B Marwin González SS Zack Cozart 2B Devon Travis 1B Eric Thames C Russell Martin",NA,"Luis Valbuena","0.43%",0
281,761485249,"goochmonger (23/25)",0,119,"P James Paxton P Mike Clevinger OF Aaron Judge 2B Robinson Canó 1B Matt Holliday 3B Marwin González SS Zack Cozart OF Robbie Grossman OF Scott Schebler C Andrew Knapp",NA,"Austin Romine","0.43%",3
283,761249354,"Kennethbetz",0,118.85,"P Jake Arrieta P Ian Kennedy 2B José Altuve OF Mookie Betts 1B Joey Votto 3B Anthony Rendon SS Trea Turner C Evan Gattis OF Lorenzo Cain OF Kole Calhoun",NA,"Nelson Cruz","0.43%",5
283,761368314,"coolhandthomas (4/4)",0,118.85,"P Max Scherzer P Hyun-Jin Ryu SS Zack Cozart OF Scott Schebler OF Melky Cabrera 1B Albert Pujols 3B Todd Frazier OF Avisaíl García 2B Yolmer Sánchez C Alex Avila",NA,"A.J. Ellis","0.43%",10
285,761343600,"AIdle31",0,118.8,"P Dan Straily P Mike Clevinger 1B Paul Goldschmidt SS Francisco Lindor OF Andrew Benintendi 3B Manny Machado OF Matt Kemp 2B César Hernández OF Max Kepler C Salvador Perez",NA,"Orlando Arcia","0.43%",5
285,761455777,"wreckingcrew7",0,118.8,"P Max Scherzer P Antonio Senzatela OF Cody Bellinger OF Matt Kemp SS Aledmys Díaz 3B Travis Shaw 2B Jonathan Villar 1B Chris Davis C Yasmani Grandal OF Jayson Werth",NA,"Alen Hanson","0.43%",2
287,761419370,"zpop2 (4/4)",0,118.75,"P Drew Pomeranz P Kevin Gausman 2B José Altuve OF Mookie Betts SS Elvis Andrus 1B Miguel Cabrera OF Scott Schebler C Russell Martin OF Lorenzo Cain 3B Maikel Franco",NA,"Erick Aybar","0.43%",5
287,761482173,"Brandtrl1",0,118.75,"P Mike Clevinger P Jaime García 1B Anthony Rizzo 2B Brian Dozier OF Michael Conforto 3B Alex Bregman SS Troy Tulowitzki OF Marcell Ozuna OF Aaron Altherr C J.T. Realmuto",NA,"J.J. Hardy","0.43%",12
289,761399021,"benberger",0,118.6,"P Jake Arrieta P Júnior Guerra SS Carlos Correa 3B Kris Bryant OF Adam Duvall 1B Joey Votto OF Max Kepler 2B Whit Merrifield OF Grégor Blanco C Martín Maldonado",NA,"Michael Saunders","0.43%",7
290,761394462,"Gooch82",0,118.5,"P James Paxton P Júnior Guerra 2B José Altuve OF Aaron Judge SS Carlos Correa 3B Josh Donaldson OF Josh Reddick OF Matt Kemp 1B Albert Pujols C Martín Maldonado",NA,"Manny Piña","0.43%",7
291,761467419,"DOGSIMIT",0,118.45,"P Max Scherzer P Zack Godley OF Brett Gardner 2B Starlin Castro OF Jason Heyward SS Nick Ahmed OF Grégor Blanco C Chris Iannetta 1B John Jaso 3B Daniel Descalso",NA,"Chris Coghlan","0.43%",2
292,761165512,"therealboobiedixon (2/2)",0,118.15,"P Max Scherzer 1B Paul Goldschmidt OF Adam Duvall OF Christian Yelich 2B César Hernández 3B Eugenio Suárez SS Aledmys Díaz OF Ezequiel Carrera C Salvador Perez P David Paulino",NA,"Carlos González","0.32%",0
292,761294772,"maygi557",0,118.15,"P Dan Straily P Masahiro Tanaka OF Mookie Betts 2B Robinson Canó 1B Justin Bour OF Marcell Ozuna OF Christian Yelich 3B Kyle Seager C Russell Martin SS Tim Beckham",NA,"Devin Mesoraco","0.32%",0
292,761308168,"tmduketech",0,118.15,"P Max Scherzer 2B José Altuve OF Adam Duvall 1B Ryan Zimmerman 3B Anthony Rendon SS Jean Segura OF Howie Kendrick C Tyler Flowers OF Alex Presley P David Paulino",NA,"Christian Arroyo","0.32%",0
292,761488668,"MJBrad15",0,118.15,"P Dan Straily P Jesse Chávez SS Carlos Correa OF Corey Dickerson OF José Bautista 3B Anthony Rendon 1B Cody Bellinger OF Matt Kemp 2B Chris Taylor C Tucker Barnhart",NA,"Didi Gregorius","0.32%",0
296,761476740,"bigmac70 (6/7)",0,118.1,"P Jake Arrieta P Mike Clevinger OF Nomar Mazara OF Jay Bruce 1B Matt Holliday 2B Neil Walker OF Jackie Bradley Jr. 3B Alex Bregman SS Andrelton Simmons C Evan Gattis",NA,"Denard Span","0.32%",0
297,761341576,"Baitking (1/2)",0,118.05,"P Max Scherzer P Jake Arrieta OF Aaron Judge 1B Matt Holliday OF Ezequiel Carrera 2B Joe Panik SS Ryan Goins 3B Josh Rutledge C Tony Wolters OF Cory Spangenberg",NA,"John Hicks","0.32%",0
297,761358835,"packers521285",0,118.05,"P Max Scherzer P Júnior Guerra OF Aaron Judge 3B Nolan Arenado 2B Daniel Murphy OF Cody Bellinger OF Matt Kemp 1B Wil Myers SS Cliff Pennington C Luis Torrens",NA,"Hanley Ramírez","0.32%",0
297,761420697,"matt514tx",0,118.05,"P Max Scherzer P Jake Arrieta OF Matt Kemp 1B Albert Pujols 2B César Hernández OF Grégor Blanco C Andrew Knapp OF Guillermo Heredia 3B Daniel Descalso SS Freddy Galvis",NA,"Yasiel Puig","0.32%",0
300,761365092,"jbrodsky77 (2/2)",0,118,"P Jake Arrieta P Zack Godley OF Billy Hamilton 2B Ben Zobrist OF Kyle Schwarber OF Scott Schebler C Evan Gattis 1B Chris Davis 3B Jedd Gyorko SS Tim Anderson",NA,"Sam Travis","0.32%",0
300,761419463,"funache (1/2)",0,118,"P Chris Archer P Chad Kuhl SS Xander Bogaerts 1B Kendrys Morales OF Kevin Kiermaier 2B Ian Happ OF Scott Schebler OF Max Kepler C Evan Gattis 3B Nicholas Castellanos",NA,"Pat Valaika","0.21%",0
302,761353919,"sperius",0,117.9,"P Zack Godley P James Paxton OF Billy Hamilton 2B Robinson Canó 1B Joey Votto SS Zack Cozart 3B Alex Bregman OF Scott Schebler C Buster Posey OF Ezequiel Carrera",NA,"Randal Grichuk","0.21%",0
303,761255212,"dobie420",0,117.8,"P Dan Straily P Mike Clevinger 2B Brian Dozier OF Michael Conforto OF Brett Gardner OF Aaron Hicks 1B Joe Mauer SS Asdrúbal Cabrera 3B Wilmer Flores C Jason Castro",NA,"Allen Cordoba","0.21%",0
304,761377155,"mikewilksmadeit (2/4)",0,117.75,"P Drew Pomeranz P James Paxton SS Carlos Correa OF Corey Dickerson OF José Bautista 1B Joey Votto 2B Starlin Castro OF Jayson Werth C Martín Maldonado 3B Deven Marrero",NA,"Bradley Zimmer","0.21%",0
305,761401981,"pittpantherfeet (2/2)",0,117.7,"P Drew Pomeranz P Masahiro Tanaka OF Aaron Judge SS Carlos Correa 2B Brian Dozier 1B Miguel Cabrera OF Matt Kemp OF Jayson Werth C Martín Maldonado 3B Ronald Torreyes",NA,"Jared Hoying","0.21%",0
306,761485222,"goochmonger (17/25)",0,117.55,"P Chris Archer P James Paxton 1B Logan Morrison 3B Marwin González SS Zack Cozart OF Cody Bellinger OF Aaron Altherr 2B Chris Taylor OF Howie Kendrick C Andrew Knapp",NA,"Tony Wolters","0.21%",6
307,761372212,"outlaws745 (8/11)",0,117.45,"P Max Scherzer P Zack Godley OF Shin-soo Choo OF Cody Bellinger OF Matt Kemp 2B DJ LeMahieu 1B Eric Hosmer 3B Maikel Franco SS JT Riddle C Tucker Barnhart",NA,"Rajai Davis","0.21%",0
308,761485168,"zwalter",0,117.35,"P Jake Arrieta P Antonio Senzatela 1B Paul Goldschmidt OF Mookie Betts OF Tommy Pham 2B César Hernández SS Andrelton Simmons C Evan Gattis 3B David Freese OF Curtis Granderson",NA,"Nick Franklin","0.21%",0
309,761399174,"kaysizzle (11/16)",0,117.25,"P Carlos Martínez P Matthew Boyd SS Carlos Correa OF Ben Zobrist 2B Jason Kipnis 3B Alex Bregman OF Andrew McCutchen 1B Wil Myers C Buster Posey OF Byron Buxton",NA,"Trevor Plouffe","0.21%",4
310,761353759,"Mattyjam559",0,117.15,"P Max Scherzer OF Mookie Betts 1B Joey Votto SS Trea Turner OF Nomar Mazara OF Andrew Benintendi 3B Manny Machado 2B Andrew Romine C Alex Avila P David Paulino",NA,"Gift Ngoepe","0.21%",0
311,761412432,"nelloms1572 (3/11)",0,117.1,"P Max Scherzer P Chris Archer 1B Mitch Moreland 3B Pablo Sandoval OF Matt Adams OF Andrew Romine OF Lorenzo Cain C Alex Avila 2B Josh Rutledge SS Alcides Escobar",NA,"Scott Van Slyke","0.21%",0
311,761417373,"nelloms1572 (8/11)",0,117.1,"P Max Scherzer P Chris Archer 1B Mitch Moreland 3B Pablo Sandoval OF Matt Adams OF Andrew Romine OF Lorenzo Cain C Alex Avila 2B Josh Rutledge SS Alcides Escobar",NA,"Sandy León","0.21%",0
311,761422042,"nelloms1572 (10/11)",0,117.1,"P Max Scherzer P Chris Archer 1B Mitch Moreland 3B Pablo Sandoval OF Matt Adams OF Andrew Romine OF Lorenzo Cain C Alex Avila 2B Josh Rutledge SS Alcides Escobar",NA,"Chris Herrmann","0.21%",2
314,761350658,"CMAC2525 (1/2)",0,117.05,"P Max Scherzer P Jake Arrieta 3B Josh Donaldson 2B Scooter Gennett 1B Chris Davis OF Michael A. Taylor OF Jayson Werth OF Lorenzo Cain C Salvador Perez SS Alcides Escobar",NA,"Taylor Motter","0.21%",0
314,761350823,"CMAC2525 (2/2)",0,117.05,"P Max Scherzer P Jake Arrieta 3B Josh Donaldson 2B Scooter Gennett 1B Victor Martinez OF Michael A. Taylor OF Jayson Werth OF Lorenzo Cain C Salvador Perez SS Alcides Escobar",NA,"Stephen Piscotty","0.21%",8
316,761214541,"evicerator",0,116.95,"P Max Scherzer P James Paxton OF Mookie Betts OF Avisaíl García 3B Travis Shaw SS Jorge Polanco 2B Chase Utley 1B Trey Mancini OF Howie Kendrick C Caleb Joseph",NA,"Travis d'Arnaud","0.21%",0
316,761477904,"albertomac",0,116.95,"P Max Scherzer P Mike Bolsinger OF Corey Dickerson OF Steven Souza Jr. 3B Josh Harrison OF Colby Rasmus 2B Starlin Castro 1B Eric Hosmer C Salvador Perez SS Freddy Galvis",NA,"Kurt Suzuki","0.21%",3
318,761412904,"lall650",0,116.9,"P Jacob deGrom P Tim Adleman OF Aaron Hicks 1B Lucas Duda SS Zack Cozart 2B Devon Travis OF Melky Cabrera OF Adam Jones 3B Kyle Seager C Evan Gattis",NA,"Juan Centeno","0.21%",0
319,761341889,"chrisn817",0,116.75,"P Drew Pomeranz P James Paxton OF Aaron Judge OF Mookie Betts OF Michael Conforto 1B Ryan Zimmerman 2B Javier Báez 3B Kyle Seager C Salvador Perez SS Dansby Swanson",NA,"Francisco Peña","0.21%",0
319,761358449,"c_chrisman12",0,116.75,"P Chris Archer 2B José Altuve OF J.D. Martinez OF Adam Frazier SS Zack Cozart 3B Alex Bregman OF Marcell Ozuna 1B Cody Bellinger C Buster Posey P David Paulino",NA,"Robinson Chirinos","0.21%",0
319,761419290,"zpop2 (3/4)",0,116.75,"P Drew Pomeranz P Kevin Gausman 2B José Altuve OF Mookie Betts SS Elvis Andrus 1B Miguel Cabrera OF Matt Kemp OF Lorenzo Cain 3B Maikel Franco C Martín Maldonado",NA,"Gerardo Parra","0.21%",0
322,761353718,"rudylicious",0,116.55,"P Max Scherzer P Mike Clevinger OF Michael Conforto SS Jean Segura OF Cody Bellinger OF Tommy Pham 2B Whit Merrifield 1B Alex Avila C Salvador Perez 3B Paul DeJong",NA,"Chris Gimenez","0.21%",9
323,761390652,"rryan2267",0,116.5,"P Zack Godley P Mike Clevinger OF Adam Duvall 3B Jake Lamb 1B Joey Votto SS Zack Cozart 2B Starlin Castro OF Aaron Altherr OF Ben Gamel C Alex Avila",NA,"Delino DeShields","0.11%",0
324,761453272,"BooSloth",0,116.45,"P Max Scherzer P Zack Godley OF Aaron Judge OF Tommy Pham 2B César Hernández SS Jorge Polanco 3B Nicholas Castellanos C Salvador Perez 1B Jesús Aguilar OF Alex Presley",NA,"Adam Lind","0.11%",0
325,761459059,"owendaniel2010",0,116.4,"P Dan Straily 2B José Altuve OF Aaron Judge SS Carlos Correa OF Mookie Betts OF J.D. Martinez 3B Eugenio Suárez C Russell Martin 1B Sam Travis P David Paulino",NA,"Adam Engel","0.11%",0
326,761321772,"redhawks55",0,116.25,"P Jesse Chávez P Hyun-Jin Ryu OF Aaron Judge SS Francisco Lindor OF Billy Hamilton 2B Robinson Canó 3B José Ramírez OF Marcell Ozuna 1B Eric Thames C J.T. Realmuto",NA,"Austin Hedges","0.11%",0
327,761327769,"packerbackerdale",0,116.2,"P Chris Archer P Mike Pelfrey OF Charlie Blackmon OF Aaron Judge SS Zack Cozart OF Cody Bellinger 1B Mitch Moreland 3B Travis Shaw C Evan Gattis 2B Yolmer Sánchez",NA,"Ty Kelly","0.11%",0
328,761412389,"nelloms1572 (2/11)",0,116.05,"P Max Scherzer P Júnior Guerra OF Aaron Judge OF Brett Gardner 3B Manny Machado 1B Mitch Moreland SS Andrelton Simmons OF Jayson Werth C Alex Avila 2B Josh Rutledge",NA,"José Martínez","0.11%",0
328,761412482,"nelloms1572 (5/11)",0,116.05,"P Max Scherzer P Júnior Guerra OF Aaron Judge OF Brett Gardner 3B Manny Machado 1B Mitch Moreland SS Andrelton Simmons OF Jayson Werth C Alex Avila 2B Josh Rutledge",NA,"Kevan Smith","0.11%",0
328,761421819,"nelloms1572 (9/11)",0,116.05,"P Max Scherzer P Júnior Guerra OF Aaron Judge OF Brett Gardner 3B Manny Machado 1B Mitch Moreland SS Andrelton Simmons OF Jayson Werth C Alex Avila 2B Josh Rutledge",NA,"Jhonny Peralta","0.11%",0
331,761463581,"Rich4585",0,116,"P Jacob deGrom P Mike Clevinger 2B Devon Travis OF Marcell Ozuna 1B Ian Desmond OF Mark Trumbo 3B Kyle Seager C Russell Martin OF Leury García SS Nick Ahmed",NA,"Cameron Rupp","0.11%",0
332,761330540,"Sewardian (1/6)",0,115.95,"P Max Scherzer P Jacob deGrom OF Eddie Rosario OF Jarrod Dyson 1B Alex Avila OF Seth Smith 3B Eduardo Escobar C Yadier Molina 2B Josh Rutledge SS JT Riddle",NA,"Paul Janish","0.11%",0
