"Rank","EntryId","EntryName","TimeRemaining","Points","Lineup","X","Player","X.Drafted","FPTS"
689,761425673,"Socal1 (1/4)",0,88.95,"P Drew Pomeranz OF Charlie Blackmon OF Aaron Judge 3B Kris Bryant OF Mookie Betts 2B Daniel Murphy SS Corey Seager 1B Albert Pujols C Russell Martin P David Paulino",NA,"","",NA
690,761346874,"lot49lah",0,88.9,"P Max Scherzer P Masahiro Tanaka OF Aaron Judge OF Billy Hamilton OF David Peralta 2B Andrew Romine 1B Luis Valbuena SS JT Riddle C Devin Mesoraco 3B Paul DeJong",NA,"","",NA
691,761441721,"priz365",0,88.8,"P Carlos Martínez P Dan Straily OF José Bautista 1B Kendrys Morales OF Robbie Grossman OF Max Kepler SS Jorge Polanco C Matt Wieters 3B Eduardo Escobar 2B Yangervis Solarte",NA,"","",NA
692,761359763,"corruption79 (1/4)",0,88.7,"P Drew Pomeranz P Masahiro Tanaka OF Charlie Blackmon SS Trea Turner 1B Yonder Alonso OF Carlos González OF Andrew Benintendi 3B Eugenio Suárez C Evan Gattis 2B Alen Hanson",NA,"","",NA
693,761443214,"josifjd9",0,88.6,"P Jake Arrieta P Júnior Guerra OF Corey Dickerson OF Mookie Betts SS Xander Bogaerts OF Chris Owings 2B Daniel Murphy 1B Mitch Moreland 3B Eduardo Núñez C Tyler Flowers",NA,"","",NA
694,761423391,"cjbaby21",0,88.5,"P Chris Archer P Jesse Chávez 3B Jake Lamb 1B Lucas Duda SS Zack Cozart OF Jackie Bradley Jr. OF Andrew Benintendi OF Tommy Pham C Buster Posey 2B Josh Rutledge",NA,"","",NA
695,761433731,"baltbruins (3/4)",0,88.4,"P Jacob deGrom P Kevin Gausman 2B Brian Dozier OF Michael Conforto OF Khris Davis 1B Jay Bruce OF Scott Schebler 3B Todd Frazier C Jason Castro SS JT Riddle",NA,"","",NA
695,761443161,"bigmac70 (3/7)",0,88.4,"P Ian Kennedy P Matt Cain 2B José Altuve OF Mookie Betts 3B Nolan Arenado OF George Springer 1B Edwin Encarnación SS Xander Bogaerts OF Andrew McCutchen C Russell Martin",NA,"","",NA
697,761401843,"pittpantherfeet (1/2)",0,88.15,"P Jacob deGrom P Jaime García 1B Ryan Zimmerman OF Kevin Kiermaier OF Marwin González OF Tommy Pham 2B Whit Merrifield C Russell Martin SS Tim Beckham 3B Deven Marrero",NA,"","",NA
698,761374693,"JoshHuff73",0,88.05,"P Chris Archer P Tim Adleman OF Steven Souza Jr. 1B Joey Votto 2B Neil Walker SS Zack Cozart OF Robbie Grossman OF Jorge Bonifacio C Russell Martin 3B Nicholas Castellanos",NA,"","",NA
698,761466759,"liltroy17",0,88.05,"P Chris Archer P Austin Bibens-Dirkx OF Adam Duvall OF Steven Souza Jr. SS Elvis Andrus 2B José Ramírez 1B Joey Votto OF Melky Cabrera 3B Kyle Seager C Tucker Barnhart",NA,"","",NA
698,761475860,"bennylyman (1/6)",0,88.05,"P Max Scherzer P Júnior Guerra OF Bryce Harper 3B Joey Gallo SS Trea Turner 2B Daniel Murphy 1B Albert Pujols C Brian McCann OF Danny Santana OF Brett Eibner",NA,"","",NA
698,761475902,"bennylyman (2/6)",0,88.05,"P Max Scherzer P Júnior Guerra OF Bryce Harper 3B Joey Gallo SS Trea Turner 2B Daniel Murphy 1B Albert Pujols C Brian McCann OF Danny Santana OF Brett Eibner",NA,"","",NA
698,761475907,"bennylyman (3/6)",0,88.05,"P Max Scherzer P Júnior Guerra OF Bryce Harper 3B Joey Gallo SS Trea Turner 2B Daniel Murphy 1B Albert Pujols C Brian McCann OF Danny Santana OF Brett Eibner",NA,"","",NA
698,761475925,"bennylyman (4/6)",0,88.05,"P Max Scherzer P Júnior Guerra OF Bryce Harper 3B Joey Gallo SS Trea Turner 2B Daniel Murphy 1B Albert Pujols C Brian McCann OF Danny Santana OF Brett Eibner",NA,"","",NA
698,761475931,"bennylyman (5/6)",0,88.05,"P Max Scherzer P Júnior Guerra OF Bryce Harper 3B Joey Gallo SS Trea Turner 2B Daniel Murphy 1B Albert Pujols C Brian McCann OF Danny Santana OF Brett Eibner",NA,"","",NA
698,761475936,"bennylyman (6/6)",0,88.05,"P Max Scherzer P Júnior Guerra OF Bryce Harper 3B Joey Gallo SS Trea Turner 2B Daniel Murphy 1B Albert Pujols C Brian McCann OF Danny Santana OF Brett Eibner",NA,"","",NA
706,761351591,"paleale",0,87.95,"P Max Scherzer P Jacob deGrom OF Colby Rasmus 1B Mitch Moreland SS Tim Beckham OF Guillermo Heredia 2B Daniel Robertson 3B Deven Marrero C Derek Norris OF Alex Presley",NA,"","",NA
707,761351982,"MabNC13 (4/6)",0,87.85,"P Jake Arrieta P Drew Pomeranz 3B Kris Bryant OF Jay Bruce 1B Matt Holliday SS Corey Seager 2B DJ LeMahieu C Miguel Montero OF Andrew Romine OF Jake Marisnick",NA,"","",NA
708,761401347,"SportsJDL",0,87.5,"P Jacob deGrom P Jake Arrieta OF Kevin Kiermaier OF Cody Bellinger SS Aledmys Díaz 2B José Peraza 1B Yuli Gurriel 3B Chase Headley OF Lorenzo Cain C Salvador Perez",NA,"","",NA
708,761481150,"Marktrack18",0,87.5,"P James Paxton P Júnior Guerra 1B Paul Goldschmidt OF Charlie Blackmon OF Mookie Betts OF Adam Frazier 2B Josh Harrison 3B Kyle Seager C J.T. Realmuto SS Asdrúbal Cabrera",NA,"","",NA
710,761287172,"kimballwaters",0,87.4,"P Max Scherzer P Chad Kuhl OF Khris Davis 3B Anthony Rendon 2B Daniel Murphy OF Justin Upton 1B Albert Pujols OF Kevin Pillar C Welington Castillo SS Addison Russell",NA,"","",NA
711,761108858,"schaff51",0,87.35,"P Drew Pomeranz P Mike Clevinger OF Charlie Blackmon OF Adam Duvall OF Michael Conforto 1B Ryon Healy 3B Eugenio Suárez 2B Whit Merrifield SS Andrelton Simmons C Alex Avila",NA,"","",NA
711,761468946,"dwiz5",0,87.35,"P James Paxton P Masahiro Tanaka 3B Evan Longoria OF Mookie Betts 2B Robinson Canó OF Matt Kemp OF Aaron Altherr SS Tim Beckham 1B Alex Avila C Salvador Perez",NA,"","",NA
713,761334693,"metalmaster (2/25)",0,87.3,"P Jacob deGrom P Hyun-Jin Ryu 1B Anthony Rizzo 2B Brian Dozier OF Robbie Grossman OF Max Kepler OF Eddie Rosario SS Jorge Polanco C Andrew Knapp 3B Daniel Descalso",NA,"","",NA
714,761360242,"rmcasillas (14/25)",0,87.25,"P James Paxton P Antonio Senzatela OF Adam Duvall OF Billy Hamilton 1B Joey Votto SS Zack Cozart OF Scott Schebler C Yasmani Grandal 2B Chase Utley 3B Logan Forsythe",NA,"","",NA
715,761411551,"dayneg66",0,87.1,"P Jake Arrieta P Mike Clevinger 2B José Ramírez 1B Kendrys Morales OF Kevin Kiermaier OF Jay Bruce OF Shin-soo Choo 3B Kyle Seager SS Andrelton Simmons C Chris Iannetta",NA,"","",NA
716,761344904,"metalmaster (18/25)",0,87,"P James Paxton P Mike Clevinger OF J.D. Martinez 2B Robinson Canó OF Nelson Cruz 1B Edwin Encarnación SS Jean Segura 3B Kyle Seager C Yasmani Grandal OF Ben Gamel",NA,"","",NA
717,761347614,"pudgefist27",0,86.7,"P Aaron Nola P Ian Kennedy 2B José Altuve 3B Kris Bryant OF Steven Souza Jr. 1B Justin Smoak SS Chris Owings OF Jackie Bradley Jr. C Evan Gattis OF Odúbel Herrera",NA,"","",NA
718,761333854,"trubino513 (2/7)",0,86.65,"P Chris Archer P Jake Arrieta 1B Ryan Zimmerman 2B DJ LeMahieu 3B Kyle Seager SS Asdrúbal Cabrera OF Ben Gamel OF Trey Mancini OF Curtis Granderson C Yadier Molina",NA,"","",NA
719,761434069,"Brothaman007",0,86.5,"P Carlos Martínez P Zack Godley OF Charlie Blackmon 2B Devon Travis OF Tommy Pham OF Kevin Pillar 1B Matt Carpenter SS Aledmys Díaz 3B Eduardo Escobar C Mike Zunino",NA,"","",NA
720,761423724,"drudy8 (2/2)",0,86.4,"P Jacob deGrom P James Paxton 2B Brian Dozier SS Zack Cozart 1B Wil Myers 3B Eugenio Suárez OF Jason Heyward OF Howie Kendrick C Alex Avila OF Kole Calhoun",NA,"","",NA
721,761327066,"javimente15 (1/2)",0,86.25,"P Jaime García P Júnior Guerra OF Mookie Betts OF Michael Conforto OF J.D. Martinez 1B José Abreu 3B Anthony Rendon SS Trea Turner 2B Daniel Murphy C Stephen Vogt",NA,"","",NA
721,761374716,"BigChiefer",0,86.25,"P Zack Godley P Drew Pomeranz 2B José Altuve OF Aaron Judge 3B Kris Bryant SS Jean Segura 1B Cody Bellinger OF Yasiel Puig C Juan Centeno OF Alex Presley",NA,"","",NA
723,761416238,"mpetitt (1/4)",0,86.2,"P Max Scherzer P Matthew Boyd 3B Kris Bryant 1B José Abreu OF Michael Brantley 2B Scooter Gennett OF Grégor Blanco C Chris Iannetta OF Norichika Aoki SS JT Riddle",NA,"","",NA
724,761412977,"awesomebri (3/4)",0,86.05,"P Chris Archer P Zack Godley SS Xander Bogaerts OF Aaron Hicks 3B Marwin González 2B Starlin Castro 1B Albert Pujols OF Nick Markakis C Chris Iannetta OF Odúbel Herrera",NA,"","",NA
725,761340873,"BK68 (13/20)",0,86,"P Jake Arrieta P Zack Godley OF Mookie Betts OF Nelson Cruz SS Xander Bogaerts OF Andrew Benintendi 3B Kyle Seager 1B Danny Valencia 2B Josh Rutledge C Mike Zunino",NA,"","",NA
726,761232008,"vuwantsaferrari (1/2)",0,85.9,"P Zack Godley P James Paxton OF Adam Duvall OF Billy Hamilton SS Chris Owings 1B Joey Votto OF Aaron Hicks 2B Starlin Castro C Chris Iannetta 3B Christian Arroyo",NA,"","",NA
726,761238921,"vuwantsaferrari (2/2)",0,85.9,"P Zack Godley P James Paxton OF Adam Duvall OF Billy Hamilton SS Chris Owings 1B Joey Votto OF Aaron Hicks 2B Starlin Castro C Chris Iannetta 3B Ty Kelly",NA,"","",NA
728,761377428,"mikewilksmadeit (3/4)",0,85.5,"P Jacob deGrom P Júnior Guerra 3B Jake Lamb 1B Anthony Rizzo OF Brett Gardner 2B Ian Happ OF Jason Heyward OF Lorenzo Cain C Alex Avila SS Eduardo Escobar",NA,"","",NA
728,761455844,"dreday7 (4/5)",0,85.5,"P Chris Archer P Aaron Nola OF Adam Frazier 2B Josh Harrison 3B Alex Bregman SS Jordy Mercer OF Aaron Altherr C Francisco Cervelli OF Howie Kendrick 1B Danny Valencia",NA,"","",NA
730,761350212,"jruiz36",0,85.4,"P Matt Cain P Luis Perdomo OF Charlie Blackmon OF Aaron Judge SS Carlos Correa 2B Robinson Canó 1B Edwin Encarnación OF Khris Davis 3B Joey Gallo C Derek Norris",NA,"","",NA
731,761413839,"pete1217",0,84.9,"P Zack Godley P James Paxton SS Xander Bogaerts OF Michael Brantley OF Jay Bruce 1B Matt Holliday OF Jackie Bradley Jr. 2B Devon Travis 3B Manny Machado C Salvador Perez",NA,"","",NA
732,761475940,"thetruth199523",0,84.55,"P Chris Archer P James Paxton OF Mookie Betts 1B Logan Morrison OF Jay Bruce 2B Whit Merrifield 3B José Reyes SS Asdrúbal Cabrera C Sandy León OF Guillermo Heredia",NA,"","",NA
733,761340872,"BK68 (12/20)",0,84.25,"P Jesse Chávez P Hyun-Jin Ryu OF Aaron Judge SS Francisco Lindor OF Mookie Betts 3B José Ramírez OF Brett Gardner 2B Jason Kipnis 1B Matt Holliday C Austin Romine",NA,"","",NA
733,761427251,"newyoricanuto",0,84.25,"P Zack Godley P Luis Perdomo SS Carlos Correa OF Adam Duvall OF Steven Souza Jr. 3B José Ramírez OF Melky Cabrera 2B Whit Merrifield C Russell Martin 1B Chase Utley",NA,"","",NA
735,761409932,"smokeufool",0,84,"P Jake Arrieta P Austin Bibens-Dirkx OF Charlie Blackmon 2B José Altuve OF Adam Duvall 3B Jake Lamb OF Melky Cabrera C Brian McCann SS Andrelton Simmons 1B Alex Avila",NA,"","",NA
736,761340595,"philliboy",0,83.95,"P Max Scherzer P Jacob deGrom OF Matt Kemp C Buster Posey 2B Chase Utley OF Howie Kendrick 1B John Hicks OF Allen Cordoba SS Freddy Galvis 3B Paul DeJong",NA,"","",NA
736,761425432,"mpetitt (3/4)",0,83.95,"P Max Scherzer P Jacob deGrom OF Adam Frazier 1B Matt Carpenter 3B Derek Dietrich OF Lorenzo Cain SS Freddy Galvis 2B Danny Espinosa OF Odúbel Herrera C Luke Maile",NA,"","",NA
738,761313762,"sparky901",0,83.8,"P Dan Straily P Mike Clevinger SS Francisco Lindor 1B Edwin Encarnación OF Kevin Kiermaier 2B Jason Kipnis OF Kyle Schwarber 3B Eugenio Suárez OF Bradley Zimmer C Yan Gomes",NA,"","",NA
739,761360246,"rmcasillas (18/25)",0,83.75,"P Drew Pomeranz P James Paxton OF José Bautista 1B Justin Smoak SS Zack Cozart OF Cody Bellinger 3B Eugenio Suárez C Yasmani Grandal 2B Logan Forsythe OF Ezequiel Carrera",NA,"","",NA
740,761421284,"Can8dn",0,83.55,"P Jacob deGrom P Chris Archer 1B Joey Votto OF Scott Schebler 3B Eugenio Suárez OF Lorenzo Cain OF Jake Marisnick SS JT Riddle C John Hicks 2B Danny Espinosa",NA,"","",NA
741,761256761,"mkiderman",0,83.35,"P James Paxton P Masahiro Tanaka OF Aaron Judge 2B Brian Dozier OF Kevin Kiermaier 1B Matt Holliday OF Tommy Pham C Brian McCann SS Aledmys Díaz 3B Jedd Gyorko",NA,"","",NA
741,761486386,"buchris532 (2/2)",0,83.35,"P James Paxton P Masahiro Tanaka OF Billy Hamilton 2B Adam Frazier 1B Joey Votto 3B Josh Harrison SS Zack Cozart OF Andrew McCutchen OF Dexter Fowler C Yadier Molina",NA,"","",NA
743,761392746,"mwstovik23",0,83.25,"P Zack Godley P Ian Kennedy 2B José Altuve OF Aaron Judge SS Zack Cozart OF Jackie Bradley Jr. OF Robbie Grossman 3B Manny Machado C Evan Gattis 1B Trey Mancini",NA,"","",NA
743,761399177,"kaysizzle (14/16)",0,83.25,"P Carlos Martínez P Matthew Boyd 3B Evan Longoria OF Ben Zobrist SS Xander Bogaerts 2B Jason Kipnis 1B Wil Myers OF Max Kepler C Buster Posey OF Byron Buxton",NA,"","",NA
745,761344039,"BrandonOSports",0,83,"P Jake Arrieta P Zack Godley 1B Kendrys Morales 3B Joey Gallo 2B Daniel Murphy SS Zack Cozart OF Andrew Benintendi OF Matt Kemp OF Grégor Blanco C Martín Maldonado",NA,"","",NA
746,761292057,"Emevjen (3/3)",0,82.9,"P Jacob deGrom P Zack Godley OF Khris Davis OF Marwin González OF Marcell Ozuna C Russell Martin 1B Chase Utley 2B Chris Taylor SS Kiké Hernández 3B Hernán Pérez",NA,"","",NA
746,761427777,"joesteub",0,82.9,"P Max Scherzer P Aaron Nola OF Mookie Betts 2B Daniel Murphy OF Andrew Benintendi 1B Mitch Moreland OF Howie Kendrick C Salvador Perez 3B Daniel Descalso SS Orlando Arcia",NA,"","",NA
748,761396181,"jwl8691",0,82.85,"P Zack Godley P Masahiro Tanaka OF Aaron Judge OF Adam Duvall 2B Devon Travis SS Corey Seager 1B Cody Bellinger 3B Travis Shaw OF Trey Mancini C Alex Avila",NA,"","",NA
749,761453164,"mrmehaan (1/2)",0,82.65,"P Zack Godley P Jaime García OF Aaron Judge 3B José Ramírez SS Trea Turner 2B Jed Lowrie 1B Joe Mauer OF David Peralta OF Jayson Werth C Alex Avila",NA,"","",NA
750,761329305,"dirtysnachez",0,82.55,"P Chris Archer P James Paxton OF J.D. Martinez OF Brett Gardner OF Tommy Pham 1B Mitch Moreland 3B Ryon Healy SS José Iglesias 2B Chris Taylor C Chris Iannetta",NA,"","",NA
750,761335149,"nelsonms077",0,82.55,"P Chris Archer P James Paxton OF José Bautista SS Zack Cozart 1B Cody Bellinger OF Max Kepler OF Jason Heyward 2B Chase Utley 3B Trevor Plouffe C Jason Castro",NA,"","",NA
750,761386232,"jtsmoov",0,82.55,"P Chris Archer P James Paxton OF Michael Conforto 3B José Ramírez OF Jay Bruce 2B Jason Kipnis SS Tim Beckham 1B Alex Avila C Yan Gomes OF Alex Presley",NA,"","",NA
750,761485243,"goochmonger (22/25)",0,82.55,"P Max Scherzer P Mike Clevinger OF Michael Brantley OF Robbie Grossman 2B Jonathan Schoop 3B Eugenio Suárez 1B Matt Carpenter SS Tim Beckham OF Ezequiel Carrera C Drew Butera",NA,"","",NA
754,761352873,"ef4852",0,82.45,"P Max Scherzer P Austin Bibens-Dirkx OF Aaron Judge 3B Nolan Arenado 2B Robinson Canó OF Ender Inciarte OF Matt Kemp 1B Albert Pujols C Sandy León SS Dixon Machado",NA,"","",NA
755,761466623,"smilesp12 (1/2)",0,82.35,"P Jacob deGrom P Jesse Chávez OF Aaron Judge OF Brett Gardner 1B Matt Holliday 2B Starlin Castro 3B Todd Frazier OF Avisaíl García SS Tim Anderson C René Rivera",NA,"","",NA
756,761427469,"baysquad",0,82.25,"P Drew Pomeranz P Austin Bibens-Dirkx OF Aaron Judge 1B Anthony Rizzo OF Mookie Betts OF Ben Zobrist SS Xander Bogaerts 2B Starlin Castro 3B Kyle Seager C Buster Posey",NA,"","",NA
756,761470224,"jruiz717",0,82.25,"P James Paxton P Antonio Senzatela OF Mookie Betts OF J.D. Martinez 1B Mark Reynolds SS Jean Segura 3B Manny Machado 2B Starlin Castro OF Aaron Altherr C Alex Avila",NA,"","",NA
758,761336822,"johnnyR5",0,82.1,"P Jake Arrieta P Mike Clevinger OF Charlie Blackmon SS Xander Bogaerts 1B Ryan Zimmerman 2B Daniel Murphy C Buster Posey OF Jason Heyward OF Nick Markakis 3B Jhonny Peralta",NA,"","",NA
759,761330014,"ajbasha2000",0,81.85,"P Jake Arrieta P Drew Pomeranz OF José Bautista OF J.D. Martinez OF Kyle Schwarber SS Corey Seager 1B Cody Bellinger 3B Jedd Gyorko 2B Logan Forsythe C Tony Wolters",NA,"","",NA
759,761389428,"DieselDon28",0,81.85,"P Antonio Senzatela P Mike Clevinger OF Mookie Betts OF Michael Conforto OF J.D. Martinez 1B Miguel Cabrera 2B Daniel Murphy 3B Josh Harrison SS Andrelton Simmons C Kurt Suzuki",NA,"","",NA
761,761359767,"corruption79 (2/4)",0,81.75,"P Jake Arrieta P Matthew Boyd OF Charlie Blackmon 1B Edwin Encarnación OF Khris Davis OF Kevin Kiermaier SS Javier Báez 3B Eugenio Suárez C Evan Gattis 2B Alen Hanson",NA,"","",NA
762,761359493,"blackfordja",0,81.5,"P Jake Arrieta P James Paxton OF Mookie Betts SS Xander Bogaerts 1B Joe Mauer OF Robbie Grossman 2B Starlin Castro OF Max Kepler 3B Pablo Sandoval C Drew Butera",NA,"","",NA
763,761419395,"Baitking (2/2)",0,81.45,"P Jake Arrieta P Masahiro Tanaka OF Charlie Blackmon 2B José Altuve OF Aaron Judge 1B Matt Holliday C Russell Martin OF Eric Young Jr. 3B Rio Ruiz SS Freddy Galvis",NA,"","",NA
764,761390431,"chefmaster",0,81.4,"P Jacob deGrom P James Paxton SS Elvis Andrus 1B Ryan Zimmerman OF Tommy Pham 3B Ryon Healy OF Jayson Werth 2B Yolmer Sánchez OF Howie Kendrick C Salvador Perez",NA,"","",NA
765,761387012,"kaysizzle (6/16)",0,81.25,"P Carlos Martínez P Matthew Boyd OF Ben Zobrist SS Xander Bogaerts 1B Miguel Cabrera 2B Jason Kipnis 3B Alex Bregman OF Andrew Benintendi C Buster Posey OF Byron Buxton",NA,"","",NA
766,761409115,"alecandes",0,81.1,"P Jake Arrieta P Mike Clevinger 1B Paul Goldschmidt OF Billy Hamilton 2B Devon Travis OF Andrew Benintendi 3B Manny Machado SS Andrelton Simmons OF Jayson Werth C Martín Maldonado",NA,"","",NA
766,761446477,"CWatson33",0,81.1,"P Jake Arrieta P Mike Clevinger OF Giancarlo Stanton 3B José Ramírez 1B Carlos Santana SS Trea Turner OF Matt Kemp 2B Rougned Odor C Yasmani Grandal OF Guillermo Heredia",NA,"","",NA
768,761312025,"Pickerknows",0,81.05,"P Jacob deGrom P Mike Pelfrey OF Charlie Blackmon 3B Jake Lamb OF Mookie Betts 1B Miguel Cabrera 2B Brandon Drury OF Seth Smith SS Brandon Crawford C Matt Wieters",NA,"","",NA
769,761335482,"daysha10",0,81,"P Jake Arrieta P Tim Adleman OF Michael Brantley OF Adam Frazier 3B Anthony Rendon 2B Daniel Murphy 1B Lucas Duda OF Marwin González SS Zack Cozart C J.T. Realmuto",NA,"","",NA
770,761474259,"tobybear1",0,80.9,"P Jacob deGrom P Zack Godley 1B Paul Goldschmidt 3B Kyle Seager OF Avisaíl García 2B Whit Merrifield SS José Iglesias OF Lorenzo Cain C Matt Wieters OF Byron Buxton",NA,"","",NA
771,761372142,"outlaws745 (5/11)",0,80.85,"P Zack Godley P Aaron Nola OF Aaron Judge OF Corey Dickerson SS Elvis Andrus OF Brett Gardner 1B Tommy Joseph 2B Rougned Odor 3B Derek Dietrich C Tucker Barnhart",NA,"","",NA
772,761485219,"goochmonger (16/25)",0,80.55,"P Chris Archer P James Paxton 2B Robinson Canó 3B José Ramírez SS Zack Cozart OF Scott Schebler 1B Ryon Healy OF Howie Kendrick OF Guillermo Heredia C Tucker Barnhart",NA,"","",NA
773,761488749,"gfay63 (1/10)",0,80.35,"P Jacob deGrom P Aaron Nola OF Mookie Betts SS Trea Turner 3B Manny Machado OF Matt Kemp 1B Chris Davis OF Lorenzo Cain C Alex Avila 2B Josh Rutledge",NA,"","",NA
774,761423690,"rjd213",0,80.1,"P Jake Arrieta P Mike Clevinger OF Charlie Blackmon OF Aaron Judge OF Khris Davis 1B Chris Carter 2B Starlin Castro 3B Chase Headley SS J.J. Hardy C Austin Romine",NA,"","",NA
775,761311108,"CeppsDaGod21 (1/2)",0,80.05,"P Chris Archer P Tim Adleman OF Aaron Judge OF Brett Gardner 1B Matt Holliday SS Zack Cozart OF Tommy Pham 3B Kyle Seager 2B Rougned Odor C Yan Gomes",NA,"","",NA
775,761311155,"CeppsDaGod21 (2/2)",0,80.05,"P Chris Archer P Tim Adleman OF Aaron Judge OF Brett Gardner 1B Matt Holliday SS Zack Cozart OF Tommy Pham 3B Kyle Seager 2B Rougned Odor C Yan Gomes",NA,"","",NA
775,761426915,"Bones4200 (2/3)",0,80.05,"P Jacob deGrom P Mike Pelfrey 2B José Altuve SS Xander Bogaerts 1B Yonder Alonso OF Jackie Bradley Jr. 3B Alex Bregman C Buster Posey OF Ben Gamel OF Guillermo Heredia",NA,"","",NA
778,761324975,"Tribetown85",0,79.5,"P Zack Godley P Mike Clevinger SS Francisco Lindor 3B José Ramírez 1B Edwin Encarnación OF Michael Brantley 2B Jason Kipnis OF Mark Trumbo OF Jason Heyward C Salvador Perez",NA,"","",NA
778,761488754,"gfay63 (6/10)",0,79.5,"P Jacob deGrom P Jake Arrieta OF José Bautista 2B Devon Travis 1B Buster Posey C Russell Martin OF Grégor Blanco OF Ezequiel Carrera 3B Chris Coghlan SS Alcides Escobar",NA,"","",NA
778,761488755,"gfay63 (7/10)",0,79.5,"P Jacob deGrom P Jake Arrieta OF José Bautista 2B Devon Travis 1B Buster Posey C Russell Martin OF Grégor Blanco OF Ezequiel Carrera 3B Chris Coghlan SS Alcides Escobar",NA,"","",NA
781,761360232,"rmcasillas (4/25)",0,79.25,"P James Paxton P Antonio Senzatela OF Aaron Judge OF Corey Dickerson SS Corey Seager OF Cody Bellinger C Buster Posey 1B Chase Utley 2B Chris Taylor 3B Logan Forsythe",NA,"","",NA
782,761476006,"goochmonger (8/25)",0,79.15,"P Chris Archer P Mike Clevinger OF Michael Conforto 1B Joey Votto 2B Josh Harrison SS Jean Segura OF Aaron Altherr 3B Eugenio Suárez OF Jayson Werth C Drew Butera",NA,"","",NA
783,761315790,"lilrob2389",0,79.1,"P Jake Arrieta P Mike Clevinger SS Francisco Lindor 1B Edwin Encarnación 2B Jason Kipnis 3B Manny Machado OF Matt Kemp OF Jason Heyward OF Mark Canha C Jonathan Lucroy",NA,"","",NA
784,761328648,"lags24",0,78.9,"P Zack Godley P James Paxton OF Mookie Betts OF Billy Hamilton 1B Miguel Cabrera SS Jean Segura OF Melky Cabrera 2B Jonathan Schoop 3B Matt Davidson C Alex Avila",NA,"","",NA
784,761409845,"phatt11959 (1/2)",0,78.9,"P Jacob deGrom P Zack Godley 3B Josh Harrison SS Jean Segura OF Marcell Ozuna OF Matt Kemp C Yasmani Grandal OF Jayson Werth 1B Adrián González 2B Yangervis Solarte",NA,"","",NA
784,761419480,"funache (2/2)",0,78.9,"P Max Scherzer P Masahiro Tanaka OF Corey Dickerson OF Mookie Betts OF Kevin Kiermaier 1B Matt Adams C Christian Vázquez 2B Daniel Robertson 3B Rio Ruiz SS Cliff Pennington",NA,"","",NA
787,761360231,"rmcasillas (3/25)",0,78.85,"P Jake Arrieta P Luis Perdomo OF Aaron Judge OF Corey Dickerson SS Corey Seager OF Cody Bellinger C Buster Posey 1B Chase Utley 2B Chris Taylor 3B Logan Forsythe",NA,"","",NA
787,761388127,"oouno",0,78.85,"P Zack Godley P Masahiro Tanaka OF Aaron Judge 3B Nolan Arenado OF Brett Gardner 2B Daniel Murphy OF Scott Schebler 1B Buster Posey SS Tim Beckham C Salvador Perez",NA,"","",NA
789,761438787,"Tkyoung",0,78.7,"P Jake Arrieta 2B José Altuve OF Aaron Judge SS Francisco Lindor 3B Nolan Arenado 1B Carlos Santana OF Michael Brantley C J.T. Realmuto OF Daniel Robertson P David Paulino",NA,"","",NA
790,761454198,"jrrankin18753 (1/3)",0,78.45,"P Jake Arrieta P Jesse Chávez OF J.D. Martinez 1B Kendrys Morales OF Jay Bruce 2B Jason Kipnis SS Trevor Story OF Andrew McCutchen 3B Kyle Seager C J.T. Realmuto",NA,"","",NA
790,761454287,"jrrankin18753 (2/3)",0,78.45,"P Jake Arrieta P Jesse Chávez OF J.D. Martinez 1B Kendrys Morales OF Jay Bruce 2B Jason Kipnis SS Trevor Story OF Andrew McCutchen 3B Kyle Seager C J.T. Realmuto",NA,"","",NA
790,761462698,"jrrankin18753 (3/3)",0,78.45,"P Jake Arrieta P Jesse Chávez OF J.D. Martinez 1B Kendrys Morales OF Jay Bruce 2B Jason Kipnis SS Trevor Story OF Andrew McCutchen 3B Kyle Seager C J.T. Realmuto",NA,"","",NA
793,761295551,"tlager2",0,78.4,"P Jacob deGrom P James Paxton OF Brett Gardner OF Jay Bruce OF Dexter Fowler C Brian McCann 1B Chris Davis 2B Brandon Drury 3B Jedd Gyorko SS Brandon Crawford",NA,"","",NA
794,761327080,"javimente15 (2/2)",0,78.25,"P Jaime García P Júnior Guerra OF Mookie Betts OF Michael Conforto 3B Nolan Arenado OF J.D. Martinez 1B José Abreu SS Trea Turner 2B Daniel Murphy C Stephen Vogt",NA,"","",NA
794,761345404,"Chris_fdog (2/2)",0,78.25,"P Mike Clevinger P Matthew Boyd OF Corey Dickerson OF Mookie Betts 1B Justin Smoak OF Adam Frazier 3B Anthony Rendon 2B Daniel Murphy SS Jean Segura C Evan Gattis",NA,"","",NA
796,761435370,"Buckmulligan (2/3)",0,78,"P Jake Arrieta P Zack Godley OF Aaron Judge 3B Kris Bryant OF Kevin Kiermaier 1B Jay Bruce OF Andrew Benintendi 2B Logan Forsythe C René Rivera SS Cliff Pennington",NA,"","",NA
797,761335674,"metalmaster (8/25)",0,77.95,"P Masahiro Tanaka P Mike Clevinger OF Aaron Judge OF J.D. Martinez OF Brett Gardner 1B Matt Holliday SS Trevor Story 2B Starlin Castro 3B Ryan Schimpf C Yan Gomes",NA,"","",NA
797,761359298,"nippsy737",0,77.95,"P Masahiro Tanaka P Mike Clevinger OF Charlie Blackmon 3B Kris Bryant SS Xander Bogaerts OF Cody Bellinger OF Tommy Pham 1B Eric Thames 2B Whit Merrifield C Buster Posey",NA,"","",NA
799,761372782,"PeezyChainz",0,77.8,"P Jake Arrieta P Héctor Santiago OF Aaron Judge SS Elvis Andrus OF Brett Gardner 1B Carlos Santana OF Carlos Beltrán 2B DJ LeMahieu 3B Todd Frazier C Buster Posey",NA,"","",NA
800,761375431,"andymac114",0,77.6,"P James Paxton 2B José Altuve OF Corey Dickerson OF Mookie Betts 3B Josh Donaldson SS Xander Bogaerts 1B Mitch Moreland OF Kevin Pillar C Martín Maldonado P David Paulino",NA,"","",NA
801,761457956,"arealjerk",0,77.45,"P Jake Arrieta P Masahiro Tanaka 1B Joey Votto 3B Joey Gallo SS Trea Turner OF Shin-soo Choo 2B DJ LeMahieu OF Tommy Pham C Russell Martin OF Andrew Romine",NA,"","",NA
802,761367377,"steed39",0,77.35,"P James Paxton P Masahiro Tanaka OF Giancarlo Stanton OF Brett Gardner 1B Ryan Zimmerman SS Jean Segura 2B Devon Travis OF Andrew Benintendi 3B Ryon Healy C Russell Martin",NA,"","",NA
803,761337897,"steem4 (1/2)",0,77.3,"P Jacob deGrom P Hyun-Jin Ryu OF Michael Conforto OF Brett Gardner 3B Marwin González 1B Matt Davidson 2B Whit Merrifield SS Aledmys Díaz OF Jorge Bonifacio C Matt Wieters",NA,"","",NA
804,761331968,"Oriole8",0,77.15,"P James Paxton P Jaime García 2B José Altuve 1B José Abreu OF Adam Frazier SS Troy Tulowitzki 3B Manny Machado OF Tommy Pham OF Mark Trumbo C Stephen Vogt",NA,"","",NA
805,761452665,"andyh6020",0,77.05,"P Chris Archer P Zack Godley OF Andrew Benintendi OF Ian Desmond 1B Cody Bellinger OF Matt Kemp 2B Whit Merrifield 3B Travis Shaw SS Asdrúbal Cabrera C Jonathan Lucroy",NA,"","",NA
806,761418190,"mrtee1",0,76.95,"P Mike Clevinger P Jesse Chávez OF Adam Duvall OF Giancarlo Stanton 1B Miguel Cabrera OF Jay Bruce 2B Daniel Murphy 3B Josh Harrison SS Corey Seager C Willson Contreras",NA,"","",NA
807,761367999,"Youngram212",0,76.85,"P Antonio Senzatela P Mike Clevinger OF Charlie Blackmon OF Aaron Judge 3B Josh Donaldson 1B Miguel Cabrera SS Corey Seager 2B Starlin Castro C Welington Castillo OF Ezequiel Carrera",NA,"","",NA
