"Rank","EntryId","EntryName","TimeRemaining","Points","Lineup","X","Player","X.Drafted","FPTS"
449,761463325,"emperorwaldo",0,106.45,"P Max Scherzer P Austin Bibens-Dirkx 3B José Ramírez SS Trea Turner 2B Daniel Murphy OF Cody Bellinger 1B Eric Thames OF Leury García OF Trey Mancini C Jonathan Lucroy",NA,"","",NA
452,761354521,"swoosh1",0,106.25,"P Masahiro Tanaka P Hyun-Jin Ryu OF Charlie Blackmon 2B Brian Dozier OF Mookie Betts 3B Joey Gallo SS Zack Cozart OF Marcell Ozuna 1B Eric Thames C Salvador Perez",NA,"","",NA
453,761360245,"rmcasillas (17/25)",0,106.15,"P Max Scherzer OF Adam Duvall OF Billy Hamilton 1B Joey Votto SS Zack Cozart OF Scott Schebler 2B Chase Utley 3B Logan Forsythe C Yan Gomes P David Paulino",NA,"","",NA
453,761341119,"Playaflyreborn (2/2)",0,106.15,"P Carlos Martínez P Sean Manaea 3B Evan Longoria 2B Ben Zobrist 1B Miguel Cabrera OF Aaron Altherr OF Jorge Bonifacio SS Asdrúbal Cabrera C Jonathan Lucroy OF Daniel Descalso",NA,"","",NA
455,761340743,"BK68 (10/20)",0,106,"P Carlos Martínez P James Paxton OF Mookie Betts SS Xander Bogaerts OF Andrew Benintendi 3B Manny Machado 1B Chris Davis OF Trey Mancini C Alex Avila 2B Josh Rutledge",NA,"","",NA
456,761313598,"boomanfoo (2/2)",0,105.95,"P Masahiro Tanaka P Mike Clevinger OF Corey Dickerson 3B Evan Longoria OF Mookie Betts 1B Joey Votto 2B Daniel Murphy OF Andrew Benintendi C Evan Gattis SS Alcides Escobar",NA,"","",NA
456,761353304,"Little24",0,105.95,"P Max Scherzer P Jacob deGrom 1B Chris Davis OF Ben Gamel OF Lorenzo Cain 2B Logan Forsythe OF Seth Smith C Yadier Molina 3B Daniel Descalso SS Alcides Escobar",NA,"","",NA
458,761273570,"TxBombers74",0,105.9,"P Zack Godley P James Paxton 1B Paul Goldschmidt OF Aaron Judge SS Zack Cozart OF Robbie Grossman 2B César Hernández OF Howie Kendrick 3B Chase Headley C Alex Avila",NA,"","",NA
458,761368313,"coolhandthomas (3/4)",0,105.9,"P Jacob deGrom P Zack Godley OF George Springer OF Matt Kemp 1B Albert Pujols OF Avisaíl García 2B Whit Merrifield SS Andrelton Simmons C Martín Maldonado 3B Ronald Torreyes",NA,"","",NA
458,761379633,"garciacm",0,105.9,"P Chris Archer P Drew Pomeranz OF Brett Gardner 1B Yonder Alonso 2B Neil Walker SS Zack Cozart 3B Kyle Seager OF Howie Kendrick C Salvador Perez OF Eric Young Jr.",NA,"","",NA
461,761423631,"KyleWright3",0,105.85,"P Jake Arrieta P Drew Pomeranz 1B Jay Bruce OF Kyle Schwarber 3B Alex Bregman SS Troy Tulowitzki OF Scott Schebler 2B DJ LeMahieu OF Max Kepler C Matt Wieters",NA,"","",NA
461,761477273,"mattymclean22",0,105.85,"P Jake Arrieta P Ian Kennedy OF Mookie Betts 1B Ryan Zimmerman SS Trea Turner 2B Dee Gordon 3B Manny Machado OF Matt Kemp OF Max Kepler C Buster Posey",NA,"","",NA
463,761410203,"sheldon1962",0,105.7,"P Jake Arrieta 3B Kris Bryant OF Adam Duvall OF Billy Hamilton 1B Joey Votto SS Zack Cozart 2B Devon Travis OF Scott Schebler C Russell Martin P David Paulino",NA,"","",NA
464,761278485,"pipjj",0,105.5,"P Jake Arrieta P James Paxton OF Aaron Judge 3B Manny Machado OF Matt Kemp 1B Albert Pujols 2B César Hernández OF Avisaíl García C Russell Martin SS Asdrúbal Cabrera",NA,"","",NA
465,761372172,"outlaws745 (6/11)",0,105.45,"P Max Scherzer P Zack Godley OF Ben Zobrist OF Cody Bellinger 1B Eric Hosmer OF Avisaíl García 2B Whit Merrifield 3B Maikel Franco SS JT Riddle C Tucker Barnhart",NA,"","",NA
465,761441841,"zad19",0,105.45,"P Jake Arrieta P Jesse Chávez 2B José Altuve OF Mookie Betts 1B Miguel Cabrera OF Andrew Benintendi 3B Manny Machado C Evan Gattis SS Tim Beckham OF Lorenzo Cain",NA,"","",NA
467,761486951,"billbrady (5/5)",0,104.95,"P Max Scherzer P Jacob deGrom OF Ben Gamel 3B Chase Headley 2B Logan Forsythe OF Keon Broxton SS Kiké Hernández C Yadier Molina 1B Jesús Aguilar OF Eric Young Jr.",NA,"","",NA
468,761475973,"goochmonger (4/25)",0,104.9,"P Zack Godley P James Paxton SS Francisco Lindor 2B José Ramírez 1B Joey Votto OF Marcell Ozuna OF Andrew Benintendi 3B Manny Machado OF Scooter Gennett C Chris Iannetta",NA,"","",NA
469,761355113,"waltwizza",0,104.7,"P Dan Straily P Tim Adleman 2B José Altuve 3B Evan Longoria OF Steven Souza Jr. 1B José Abreu OF Adam Frazier SS Jordy Mercer C Chris Herrmann OF Alex Gordon",NA,"","",NA
470,761409703,"crossbones2222",0,104.6,"P Antonio Senzatela P Ian Kennedy OF Charlie Blackmon OF Aaron Judge 1B Joey Votto SS Trea Turner 2B Javier Báez OF Andrew McCutchen C Willson Contreras 3B Travis Shaw",NA,"","",NA
471,761479380,"proto144 (8/8)",0,104.55,"P Jacob deGrom P Sean Manaea 3B Anthony Rendon 2B Daniel Murphy SS Jean Segura OF Matt Kemp OF Avisaíl García OF Leury García C Tyler Flowers 1B John Jaso",NA,"","",NA
471,761485197,"goochmonger (14/25)",0,104.55,"P Chris Archer P James Paxton 2B José Ramírez 1B Kendrys Morales SS Jean Segura 3B Marwin González OF Robbie Grossman OF Scott Schebler C Tucker Barnhart OF Alex Presley",NA,"","",NA
473,761313086,"codeseve7 (1/4)",0,104.35,"P Drew Pomeranz P Mike Clevinger OF Mookie Betts OF Michael Conforto OF Brett Gardner 2B Daniel Murphy SS Jean Segura 3B Alex Bregman 1B Albert Pujols C Martín Maldonado",NA,"","",NA
473,761340880,"BK68 (20/20)",0,104.35,"P Antonio Senzatela P Júnior Guerra 2B José Altuve OF Adam Duvall OF José Bautista 1B Joey Votto OF Marwin González SS Zack Cozart 3B Eugenio Suárez C Russell Martin",NA,"","",NA
473,761345963,"metalmaster (24/25)",0,104.35,"P Jacob deGrom P Jesse Chávez OF Adam Duvall 1B Joey Votto SS Zack Cozart OF Scott Schebler 3B Eugenio Suárez C Evan Gattis OF Daniel Descalso 2B Danny Espinosa",NA,"","",NA
476,761356362,"louisql36",0,104.25,"P Zack Godley P Ian Kennedy OF Aaron Judge SS Carlos Correa 1B Joey Votto 2B Devon Travis OF Robbie Grossman OF David Peralta C Chris Iannetta 3B Daniel Descalso",NA,"","",NA
476,761462727,"dan8653",0,104.25,"P Masahiro Tanaka P Hyun-Jin Ryu OF Charlie Blackmon OF Aaron Judge SS Carlos Correa 2B Brian Dozier 1B Joey Votto OF Jayson Werth C Salvador Perez 3B Josh Rutledge",NA,"","",NA
476,761485224,"jitmoney",0,104.25,"P Jake Arrieta P Jaime García OF Mookie Betts OF Billy Hamilton 3B Marwin González SS Zack Cozart OF Andrew Benintendi 1B Mitch Moreland 2B José Peraza C Salvador Perez",NA,"","",NA
479,761324097,"tim722",0,104.15,"P James Paxton P Jaime García OF Steven Souza Jr. OF Brett Gardner OF Aaron Hicks 3B Joey Gallo 1B Matt Holliday 2B Devon Travis SS Tim Beckham C Chris Iannetta",NA,"","",NA
480,761429809,"jdwills126",0,104.1,"P Jake Arrieta P Mike Clevinger 1B Mark Reynolds 2B Adam Frazier SS Jean Segura OF Marwin González OF Matt Kemp C Willson Contreras 3B Kyle Seager OF Jason Heyward",NA,"","",NA
481,761405542,"Sixthman",0,104,"P Jake Arrieta P Tim Adleman OF Adam Duvall OF Giancarlo Stanton 1B Ryan Zimmerman SS Zack Cozart 3B Alex Bregman OF Scott Schebler 2B Whit Merrifield C Russell Martin",NA,"","",NA
481,761473684,"rdsx4ever",0,104,"P Jacob deGrom P Mike Clevinger OF Aaron Judge 3B Jake Lamb OF Scott Schebler 1B Eric Hosmer 2B Scooter Gennett OF Jake Marisnick SS JT Riddle C Tucker Barnhart",NA,"","",NA
483,761362557,"Jmboudreaux93",0,103.9,"P Zack Godley P James Paxton 3B Jake Lamb OF Mookie Betts 1B Ryan Zimmerman SS Troy Tulowitzki OF David Peralta C Welington Castillo OF Brandon Moss 2B Brandon Drury",NA,"","",NA
484,761413613,"runt13",0,103.85,"P Jake Arrieta P Ian Kennedy OF Aaron Judge OF J.D. Martinez OF Brett Gardner 1B Ryan Zimmerman 3B Alex Bregman 2B Whit Merrifield SS Asdrúbal Cabrera C Matt Wieters",NA,"","",NA
484,761468474,"dreday7 (5/5)",0,103.85,"P Max Scherzer P Hyun-Jin Ryu OF Ben Zobrist OF Brett Gardner 2B Adam Frazier 1B Joey Votto 3B Eugenio Suárez OF Guillermo Heredia C Martín Maldonado SS Alcides Escobar",NA,"","",NA
486,761380471,"FLEX305JC",0,103.75,"P Mike Clevinger P Jaime García OF Corey Dickerson OF Mookie Betts 1B Logan Morrison 3B Anthony Rendon SS Trea Turner 2B Daniel Murphy C Yasmani Grandal OF Lorenzo Cain",NA,"","",NA
486,761440033,"zjazz",0,103.75,"P Jake Arrieta P Matthew Boyd OF Bryce Harper OF Steven Souza Jr. SS Elvis Andrus 3B Adrián Béltre OF Andrew McCutchen 2B Starlin Castro 1B Buster Posey C Salvador Perez",NA,"","",NA
488,761474496,"christhecomet (1/5)",0,103.6,"P Jacob deGrom 2B José Altuve OF Mookie Betts SS Trea Turner OF Andrew Benintendi 3B Manny Machado C Evan Gattis 1B Chris Davis OF Lorenzo Cain P David Paulino",NA,"","",NA
489,761428303,"Inglorious11 (2/2)",0,103.35,"P James Paxton P Aaron Nola OF Aaron Judge 3B Jake Lamb OF Mookie Betts SS Xander Bogaerts 1B Albert Pujols 2B Whit Merrifield OF Lorenzo Cain C Alex Avila",NA,"","",NA
490,761403072,"SH31",0,103.25,"P Zack Godley P Drew Pomeranz OF Billy Hamilton 1B Joey Votto OF Jay Bruce 2B Daniel Murphy 3B Alex Bregman OF Andrew Benintendi SS Tim Beckham C Salvador Perez",NA,"","",NA
490,761408459,"Stickman731",0,103.25,"P Jacob deGrom P Antonio Senzatela 1B Paul Goldschmidt 2B Daniel Murphy OF Christian Yelich OF Matt Kemp 3B Pablo Sandoval C Alex Avila SS Ronald Torreyes OF Odúbel Herrera",NA,"","",NA
492,761401450,"cjcox94 (2/2)",0,103.2,"P Jacob deGrom P Dan Straily OF Marcell Ozuna 3B Kyle Seager OF Avisaíl García 2B Whit Merrifield OF Jason Heyward SS Tim Beckham C Yasmani Grandal 1B Alex Avila",NA,"","",NA
493,761360230,"rmcasillas (2/25)",0,103.15,"P Max Scherzer OF Aaron Judge OF Corey Dickerson SS Corey Seager OF Cody Bellinger C Willson Contreras 1B Chase Utley 2B Chris Taylor 3B Logan Forsythe P David Paulino",NA,"","",NA
493,761397435,"phillies1964 (1/3)",0,103.15,"P Max Scherzer SS Trea Turner OF Nomar Mazara 2B Daniel Murphy 1B Matt Holliday OF Shin-soo Choo OF Kyle Schwarber 3B Manny Machado C Yadier Molina P David Paulino",NA,"","",NA
493,761397951,"phillies1964 (2/3)",0,103.15,"P Jacob deGrom P Jaime García 1B Miguel Cabrera OF Jackie Bradley Jr. 3B Alex Bregman OF Christian Yelich OF Avisaíl García SS Aledmys Díaz 2B José Peraza C Salvador Perez",NA,"","",NA
496,761319606,"WestieBoz",0,103.1,"P Jake Arrieta P Mike Clevinger OF Charlie Blackmon OF Aaron Judge OF Aaron Hicks 2B Whit Merrifield C Buster Posey 3B Nicholas Castellanos SS José Iglesias 1B Alex Avila",NA,"","",NA
497,761427998,"Inglorious11 (1/2)",0,103.05,"P Max Scherzer P Júnior Guerra OF Mookie Betts C Gary Sánchez SS Trea Turner 1B Albert Pujols 2B Whit Merrifield OF Stephen Piscotty OF Lorenzo Cain 3B Deven Marrero",NA,"","",NA
498,761257898,"jamook15",0,102.9,"P Zack Godley P James Paxton OF Mookie Betts OF Michael Conforto 3B José Ramírez SS Trea Turner OF Marcell Ozuna 1B Buster Posey 2B Chris Taylor C Yan Gomes",NA,"","",NA
499,761485899,"fladrit",0,102.75,"P Mike Clevinger P Jaime García OF Mookie Betts OF Michael Conforto OF Billy Hamilton 1B Ryan Zimmerman 3B Marwin González SS Zack Cozart 2B Starlin Castro C Chris Iannetta",NA,"","",NA
500,761443750,"OaklandAs2015 (2/2)",0,102.7,"P Dan Straily P Zack Godley OF Adam Duvall OF Mookie Betts 1B Kendrys Morales OF David Peralta 3B Eugenio Suárez 2B José Peraza C Salvador Perez SS Ryan Goins",NA,"","",NA
501,761326801,"Gannimal",0,102.55,"P Max Scherzer P Mike Clevinger OF Brett Gardner 2B Daniel Murphy SS Jean Segura 1B Matt Carpenter 3B Kyle Seager OF Andrew Romine C Yadier Molina OF Alex Presley",NA,"","",NA
501,761450451,"sillywun",0,102.55,"P Chris Archer P Mike Bolsinger OF Aaron Judge SS Trea Turner 2B Dee Gordon OF Jackie Bradley Jr. 3B Manny Machado 1B Cody Bellinger OF Matt Kemp C Yasmani Grandal",NA,"","",NA
501,761476673,"coach421",0,102.55,"P Max Scherzer P Mike Clevinger OF Aaron Judge 1B José Abreu 2B Adam Frazier 3B Ryan Schimpf OF Daniel Descalso SS Ronald Torreyes C Tucker Barnhart OF Odúbel Herrera",NA,"","",NA
504,761340871,"BK68 (11/20)",0,102.5,"P Carlos Martínez P Zack Godley OF J.D. Martinez 1B Miguel Cabrera OF Justin Upton SS Aledmys Díaz OF Randal Grichuk 3B Jedd Gyorko 2B Andrew Romine C Alex Avila",NA,"","",NA
505,761404210,"bcrenner (1/4)",0,102.45,"P Max Scherzer P Tim Adleman OF J.D. Martinez 1B José Abreu SS Zack Cozart OF Justin Upton 3B Matt Davidson OF Leury García 2B Yolmer Sánchez C Tucker Barnhart",NA,"","",NA
506,761373041,"kaysizzle (1/16)",0,102.25,"P Carlos Martínez P Matthew Boyd SS Carlos Correa OF Ben Zobrist 1B Miguel Cabrera 2B Jason Kipnis 3B Alex Bregman C Buster Posey OF Jayson Werth OF Byron Buxton",NA,"","",NA
507,761333029,"jgAllDay (8/10)",0,102.1,"P Max Scherzer P Chris Archer SS Jean Segura 2B Whit Merrifield 1B Trey Mancini OF Chris Young C Jason Castro 3B Daniel Descalso OF Alex Gordon OF Franchy Cordero",NA,"","",NA
507,761336116,"BudAdd (1/2)",0,102.1,"P Jake Arrieta P Mike Clevinger 3B Kris Bryant SS Chris Owings 1B Joey Votto OF Andrew McCutchen 2B César Hernández C Russell Martin OF Jayson Werth OF Jake Marisnick",NA,"","",NA
507,761425473,"mpetitt (4/4)",0,102.1,"P Jake Arrieta P Mike Clevinger OF Mookie Betts 1B Ryan Zimmerman OF Kevin Kiermaier OF Justin Upton 2B Javier Báez 3B Todd Frazier C Yasmani Grandal SS Jorge Polanco",NA,"","",NA
510,761322318,"KentuckySamsquanch",0,102,"P Jake Arrieta P Zack Godley 3B Evan Longoria SS Trea Turner 2B Daniel Murphy OF Andrew Benintendi 1B Mitch Moreland OF Avisaíl García OF Lorenzo Cain C Salvador Perez",NA,"","",NA
511,761442200,"TopGun37",0,101.9,"P Zack Godley P James Paxton OF Aaron Judge OF Mookie Betts 1B Ryan Zimmerman SS Zack Cozart 3B Eugenio Suárez 2B Whit Merrifield OF Howie Kendrick C Christian Vázquez",NA,"","",NA
512,761485722,"dnobbs30",0,101.85,"P Jake Arrieta P Drew Pomeranz SS Xander Bogaerts OF Chris Owings 2B Neil Walker OF Andrew McCutchen OF Matt Kemp 1B Albert Pujols 3B Logan Forsythe C Yan Gomes",NA,"","",NA
513,761484287,"NShermn211",0,101.75,"P Mike Clevinger P Jaime García OF Aaron Judge OF Corey Dickerson SS Xander Bogaerts OF Michael Brantley 2B Devon Travis 3B Alex Bregman 1B Matt Adams C Christian Vázquez",NA,"","",NA
514,761433518,"ekaufman128",0,101.65,"P Zack Godley P Jaime García OF Adam Duvall OF José Bautista 1B Kendrys Morales SS Jean Segura 3B Alex Bregman OF Marcell Ozuna 2B Whit Merrifield C Mike Zunino",NA,"","",NA
515,761387915,"goochmonger (1/25)",0,101.55,"P Chris Archer P James Paxton OF Brett Gardner 1B Yonder Alonso SS Jean Segura OF Robbie Grossman OF Max Kepler 3B Ryan Schimpf C Andrew Knapp 2B Eric Sogard",NA,"","",NA
515,761435500,"Pedrog8",0,101.55,"P Max Scherzer P Mike Clevinger OF Aaron Hicks OF Carlos Beltrán 2B Jonathan Schoop 1B Albert Pujols OF Max Kepler SS Andrelton Simmons 3B Chase Headley C Luis Torrens",NA,"","",NA
517,761415437,"dhurlers (1/4)",0,101.4,"P Max Scherzer P Chad Kuhl 1B Anthony Rizzo 3B Joey Gallo OF Jay Bruce 2B Ian Happ OF Scott Schebler OF Tommy Pham C Yan Gomes SS JT Riddle",NA,"","",NA
517,761415510,"dhurlers (2/4)",0,101.4,"P Max Scherzer P Chad Kuhl 1B Anthony Rizzo 3B Joey Gallo OF Jay Bruce 2B Ian Happ OF Scott Schebler OF Tommy Pham C Yan Gomes SS JT Riddle",NA,"","",NA
517,761424938,"dhurlers (3/4)",0,101.4,"P Max Scherzer P Chad Kuhl 1B Anthony Rizzo 3B Joey Gallo OF Jay Bruce 2B Ian Happ OF Scott Schebler OF Tommy Pham C Yan Gomes SS JT Riddle",NA,"","",NA
517,761424952,"dhurlers (4/4)",0,101.4,"P Max Scherzer P Chad Kuhl 1B Anthony Rizzo 3B Joey Gallo OF Jay Bruce 2B Ian Happ OF Scott Schebler OF Tommy Pham C Yan Gomes SS JT Riddle",NA,"","",NA
521,761423746,"2dirty",0,101.35,"P Drew Pomeranz P Mike Clevinger 3B Kris Bryant SS Francisco Lindor OF Kevin Kiermaier OF Jackie Bradley Jr. 1B Cody Bellinger OF Tommy Pham 2B Whit Merrifield C Russell Martin",NA,"","",NA
522,761399172,"kaysizzle (9/16)",0,101.25,"P Carlos Martínez P Matthew Boyd SS Carlos Correa 3B Evan Longoria OF Ben Zobrist 2B Jason Kipnis 1B Wil Myers C Buster Posey OF Byron Buxton OF Kole Calhoun",NA,"","",NA
523,761465964,"chrisd1982",0,100.95,"P Max Scherzer P Jacob deGrom OF Avisaíl García 2B Chris Taylor OF Jayson Werth 3B Chase Headley 1B Alex Avila C Salvador Perez SS JT Riddle OF Alex Presley",NA,"","",NA
524,761475968,"goochmonger (3/25)",0,100.75,"P Drew Pomeranz P James Paxton 2B Robinson Canó 3B José Ramírez 1B Kendrys Morales SS Jean Segura OF Robbie Grossman OF Marcell Ozuna OF Howie Kendrick C Andrew Knapp",NA,"","",NA
525,761355209,"Light5",0,100.7,"P Max Scherzer P Jaime García 3B José Ramírez OF Matt Kemp 1B Albert Pujols OF Aaron Altherr SS Asdrúbal Cabrera 2B Andrew Romine C Tyler Flowers OF Guillermo Heredia",NA,"","",NA
525,761452807,"emman21",0,100.7,"P Héctor Santiago P Mike Bolsinger OF Charlie Blackmon OF Aaron Judge OF Corey Dickerson 3B Evan Longoria 2B Brian Dozier SS Elvis Andrus 1B Edwin Encarnación C Willson Contreras",NA,"","",NA
527,761473452,"pacman201739",0,100.5,"P Jake Arrieta P James Paxton 1B José Abreu 3B Adrián Béltre 2B Jed Lowrie OF Nomar Mazara OF Christian Yelich SS Asdrúbal Cabrera C Yan Gomes OF Seth Smith",NA,"","",NA
528,761165493,"therealboobiedixon (1/2)",0,100.45,"P Max Scherzer P Austin Bibens-Dirkx OF Aaron Judge 1B Ryan Zimmerman SS Trea Turner 2B Daniel Murphy OF Andrew Benintendi C Jonathan Lucroy OF Jayson Werth 3B Daniel Descalso",NA,"","",NA
528,761339097,"BK68 (9/20)",0,100.45,"P Chris Archer P Hyun-Jin Ryu SS Francisco Lindor OF Michael Brantley 2B Jason Kipnis OF Hunter Renfroe 1B Wil Myers OF Mark Trumbo 3B Ryan Schimpf C Salvador Perez",NA,"","",NA
530,761438198,"haggis1234",0,100.4,"P Dan Straily OF Charlie Blackmon OF Mookie Betts OF Giancarlo Stanton 2B Daniel Murphy 1B Justin Bour SS Zack Cozart 3B Eugenio Suárez C J.T. Realmuto P David Paulino",NA,"","",NA
531,761327643,"HWStack",0,100.35,"P James Paxton P Aaron Nola OF Mookie Betts OF J.D. Martinez 3B Joey Gallo SS Trea Turner 2B Devon Travis 1B Wil Myers OF Aaron Altherr C Alex Avila",NA,"","",NA
532,761237813,"smarkus23",0,100.3,"P Max Scherzer P Ian Kennedy 3B Nolan Arenado 2B Daniel Murphy OF Tommy Pham 1B Mitch Moreland OF Avisaíl García OF Jayson Werth C Alex Avila SS Tim Anderson",NA,"","",NA
532,761466739,"smilesp12 (2/2)",0,100.3,"P Chris Archer P Jaime García OF J.D. Martinez 1B Miguel Cabrera OF Jay Bruce OF Justin Upton 3B Kyle Seager SS Asdrúbal Cabrera 2B Andrew Romine C Alex Avila",NA,"","",NA
534,761412462,"nelloms1572 (4/11)",0,100.25,"P James Paxton P Antonio Senzatela OF Mookie Betts OF J.D. Martinez SS Xander Bogaerts OF Jackie Bradley Jr. 1B Mitch Moreland 3B Pablo Sandoval 2B Andrew Romine C Alex Avila",NA,"","",NA
534,761414593,"nelloms1572 (7/11)",0,100.25,"P James Paxton P Antonio Senzatela OF Mookie Betts OF J.D. Martinez SS Xander Bogaerts OF Jackie Bradley Jr. 1B Mitch Moreland 3B Pablo Sandoval 2B Andrew Romine C Alex Avila",NA,"","",NA
534,761475974,"goochmonger (5/25)",0,100.25,"P Zack Godley P Drew Pomeranz OF Michael Conforto 2B José Ramírez 1B Kendrys Morales SS Zack Cozart OF Marcell Ozuna 3B Eugenio Suárez OF Howie Kendrick C Chris Iannetta",NA,"","",NA
537,761343345,"jgAllDay (10/10)",0,100.1,"P Max Scherzer P Chris Archer SS Jean Segura 2B DJ LeMahieu OF Austin Jackson C Alex Avila 1B T.J. Rivera 3B Daniel Descalso OF Kole Calhoun OF Franchy Cordero",NA,"","",NA
538,761408595,"frydaddybassmaster",0,100.05,"P Chris Archer P Austin Bibens-Dirkx OF Aaron Judge OF José Bautista SS Francisco Lindor 1B Miguel Cabrera 2B Dee Gordon OF Andrew McCutchen C Christian Vázquez 3B Deven Marrero",NA,"","",NA
539,761430331,"Buckmulligan (1/3)",0,99.95,"P Max Scherzer P Jacob deGrom OF Jay Bruce OF Max Kepler 1B Wilmer Flores 2B Joe Panik 3B Josh Rutledge SS JT Riddle C Luke Maile OF Alex Presley",NA,"","",NA
540,761422047,"DSinc86",0,99.9,"P Zack Godley P James Paxton OF Mookie Betts OF Michael Conforto 3B Josh Donaldson OF Marcell Ozuna SS Corey Seager 1B Wil Myers 2B Whit Merrifield C Yadier Molina",NA,"","",NA
540,761440605,"dreday7 (3/5)",0,99.9,"P Mike Clevinger P Hyun-Jin Ryu OF Corey Dickerson OF José Bautista SS Elvis Andrus 1B Kendrys Morales OF Aaron Hicks 2B Devon Travis 3B Eugenio Suárez C Russell Martin",NA,"","",NA
542,761380099,"Richardkc (3/4)",0,99.7,"P Dan Straily P Zack Godley 2B José Altuve 1B Justin Smoak OF Chris Owings 3B Josh Harrison OF David Peralta OF Howie Kendrick C Chris Iannetta SS JT Riddle",NA,"","",NA
542,761380839,"Richardkc (4/4)",0,99.7,"P Dan Straily P Zack Godley 2B José Altuve 1B Justin Smoak OF Chris Owings 3B Josh Harrison OF David Peralta OF Howie Kendrick C Chris Iannetta SS JT Riddle",NA,"","",NA
544,761404737,"Cathy145",0,99.6,"P Drew Pomeranz P Antonio Senzatela OF Aaron Judge OF Mookie Betts SS Xander Bogaerts 1B Ryan Zimmerman 2B Daniel Murphy OF Shin-soo Choo C Matt Wieters 3B Deven Marrero",NA,"","",NA
545,761164912,"crash12",0,99.5,"P Drew Pomeranz P Jaime García 2B Robinson Canó SS Xander Bogaerts 1B Ryan Zimmerman OF Andrew Benintendi OF Matt Kemp OF Tommy Pham 3B Eugenio Suárez C Buster Posey",NA,"","",NA
545,761466749,"RyFoley",0,99.5,"P Zack Godley P Mike Clevinger 3B Jake Lamb OF Giancarlo Stanton OF Brett Gardner SS Corey Seager OF Christian Yelich 1B Albert Pujols C Buster Posey 2B Jonathan Villar",NA,"","",NA
547,761452238,"proto144 (1/8)",0,99.35,"P James Paxton P Masahiro Tanaka 2B José Altuve OF Aaron Judge 3B Anthony Rendon 1B Matt Holliday SS Zack Cozart OF Scott Schebler C Russell Martin OF Alex Presley",NA,"","",NA
547,761460608,"proto144 (3/8)",0,99.35,"P James Paxton P Masahiro Tanaka 2B José Altuve OF Aaron Judge 3B Anthony Rendon 1B Matt Holliday SS Zack Cozart OF Scott Schebler C Russell Martin OF Alex Presley",NA,"","",NA
547,761460649,"proto144 (4/8)",0,99.35,"P James Paxton P Masahiro Tanaka 2B José Altuve OF Aaron Judge 3B Anthony Rendon 1B Matt Holliday SS Zack Cozart OF Scott Schebler C Russell Martin OF Alex Presley",NA,"","",NA
550,761467368,"Cubs4Ever",0,99.3,"P Jake Arrieta P Dan Straily 1B Anthony Rizzo OF Michael Conforto 2B Ian Happ OF Scott Schebler 3B Eugenio Suárez C Yasmani Grandal SS Dansby Swanson OF Kole Calhoun",NA,"","",NA
551,761356551,"agrimeyd (2/2)",0,99.15,"P Jacob deGrom P Jaime García OF Marcell Ozuna SS Corey Seager OF Cody Bellinger 1B Eric Thames 3B Eugenio Suárez OF Avisaíl García C Buster Posey 2B Yolmer Sánchez",NA,"","",NA
552,761404739,"DarthSchroeder (1/4)",0,99.1,"P Zack Godley OF Aaron Judge OF Corey Dickerson 3B Evan Longoria OF Billy Hamilton SS Chris Owings 1B Joey Votto 2B Starlin Castro C Chris Iannetta P David Paulino",NA,"","",NA
553,761473565,"luckygeo7",0,98.95,"P Max Scherzer P Jacob deGrom OF Jason Heyward 1B Chris Davis C Francisco Cervelli 3B David Freese OF José Osuna SS Freddy Galvis 2B Ehire Adrianza OF Alex Presley",NA,"","",NA
554,761233286,"SLundqvist",0,98.85,"P Jake Arrieta P Drew Pomeranz 1B Anthony Rizzo 3B Nolan Arenado OF Giancarlo Stanton OF Andrew McCutchen SS Didi Gregorius OF Mark Trumbo 2B Joe Panik C Austin Hedges",NA,"","",NA
555,761373716,"kaysizzle (2/16)",0,98.75,"P Drew Pomeranz P James Paxton 3B Evan Longoria OF Ben Zobrist SS Xander Bogaerts 1B Miguel Cabrera 2B Jason Kipnis C Buster Posey OF Jayson Werth OF Byron Buxton",NA,"","",NA
555,761472702,"dozet88 (1/2)",0,98.75,"P Max Scherzer P Dan Straily 3B Nolan Arenado OF Andrew McCutchen 2B César Hernández OF Mark Canha SS Taylor Motter OF Chris Young C Kevin Plawecki 1B Scott Van Slyke",NA,"","",NA
557,761411139,"rjohnson2371",0,98.45,"P Dan Straily P Matthew Boyd OF Corey Dickerson OF José Bautista 3B Evan Longoria 1B Logan Morrison 2B Dee Gordon SS Trevor Story C Russell Martin OF Odúbel Herrera",NA,"","",NA
558,761344237,"metalmaster (12/25)",0,98.15,"P Jacob deGrom P Jaime García OF J.D. Martinez 1B Miguel Cabrera OF Justin Upton 2B Starlin Castro SS Asdrúbal Cabrera 3B Nicholas Castellanos C Alex Avila OF Seth Smith",NA,"","",NA
559,761426104,"Socal1 (4/4)",0,98.1,"P Mike Clevinger P Júnior Guerra OF Aaron Judge 3B Kris Bryant OF José Bautista OF Mookie Betts 2B José Ramírez SS Corey Seager 1B Eric Thames C Yadier Molina",NA,"","",NA
559,761451532,"alwaysaction",0,98.1,"P Jaime García P Jesse Chávez 3B Kris Bryant 1B Anthony Rizzo OF Mookie Betts OF J.D. Martinez 2B Ben Zobrist C Evan Gattis SS Addison Russell OF Mark Canha",NA,"","",NA
561,761444288,"Ozarkian",0,98.05,"P Chris Archer P Zack Godley 1B Joey Votto 2B Jed Lowrie SS Corey Seager OF Matt Kemp OF Tommy Pham 3B Kyle Seager OF Howie Kendrick C Caleb Joseph",NA,"","",NA
562,761421269,"GeneFunk",0,98,"P James Paxton P Mike Clevinger 3B Kris Bryant SS Francisco Lindor OF Michael Conforto 1B Ryan Zimmerman 2B Ian Happ OF Andrew Benintendi OF Cody Bellinger C Luis Torrens",NA,"","",NA
563,761433730,"baltbruins (2/4)",0,97.95,"P Carlos Martínez P Aaron Nola SS Francisco Lindor 2B Ben Zobrist 1B Jay Bruce 3B Alex Bregman OF Ben Gamel OF Mark Canha OF Austin Jackson C Mike Zunino",NA,"","",NA
563,761481872,"bser",0,97.95,"P Max Scherzer P Mike Bolsinger OF José Bautista 3B Nolan Arenado 1B Kendrys Morales OF Kevin Kiermaier OF Kyle Schwarber 2B Whit Merrifield C Salvador Perez SS Alcides Escobar",NA,"","",NA
565,761406910,"jawish1963 (1/4)",0,97.9,"P Max Scherzer P Masahiro Tanaka OF Khris Davis 1B Joey Votto OF Tommy Pham OF Dexter Fowler SS Aledmys Díaz 2B Joe Panik 3B Rio Ruiz C A.J. Ellis",NA,"","",NA
565,761406911,"jawish1963 (2/4)",0,97.9,"P Max Scherzer P Masahiro Tanaka OF Khris Davis 1B Joey Votto OF Tommy Pham OF Dexter Fowler SS Aledmys Díaz 2B Joe Panik 3B Rio Ruiz C A.J. Ellis",NA,"","",NA
565,761448101,"NastyNateRowe",0,97.9,"P Max Scherzer P Masahiro Tanaka OF Brett Gardner 1B Miguel Cabrera SS Corey Seager OF Matt Kemp OF Jayson Werth C Martín Maldonado 3B Ronald Torreyes 2B Danny Espinosa",NA,"","",NA
568,761375260,"RockyAli",0,97.8,"P Hyun-Jin Ryu P Tim Adleman 2B José Altuve OF Aaron Judge SS Carlos Correa 1B Anthony Rizzo OF Mookie Betts 3B Anthony Rendon C Travis d'Arnaud OF Joey Rickard",NA,"","",NA
569,761485234,"goochmonger (20/25)",0,97.7,"P Chris Archer P Sean Manaea 3B Kris Bryant 1B Yonder Alonso OF Robbie Grossman OF Marcell Ozuna 2B Jonathan Schoop OF Jason Heyward SS Tim Beckham C Tucker Barnhart",NA,"","",NA
