"Rank","EntryId","EntryName","TimeRemaining","Points","Lineup","X","Player","X.Drafted","FPTS"
1,774178016,"Twoseamer",0,168.85,"P Ervin Santana P Sonny Gray C Gary Sánchez SS Didi Gregorius OF Khris Davis OF Andrew McCutchen 2B Jonathan Schoop 1B Wil Myers OF Jay Bruce 3B Ronald Torreyes",NA,"Aaron Judge","38.32%",16
2,774295882,"potzie165",0,159.85,"P Rafael Montero OF Aaron Judge 1B Cody Bellinger OF Bryce Harper 2B Daniel Murphy C Gary Sánchez SS Carlos Correa 3B Evan Longoria OF Trey Mancini P Francis Martes",NA,"Gary Sánchez","28.34%",20
3,774129541,"bobmac91",0,158.05,"P Sonny Gray P Mike Montgomery OF Cody Bellinger 1B Logan Morrison SS Francisco Lindor OF Andrew Benintendi 2B Jonathan Schoop 3B Josh Donaldson C Evan Gattis OF Trey Mancini",NA,"Bryce Harper","27.55%",13
4,774320758,"jfarf22",0,154.45,"P Francisco Liriano P Matt Moore OF Aaron Judge OF Cody Bellinger C Gary Sánchez OF Mookie Betts SS Carlos Correa 2B Scooter Gennett 3B Evan Longoria 1B Ryon Healy",NA,"Brandon McCarthy","20.18%",-0.85
5,774336716,"jonswinger",0,152.85,"P Ervin Santana P Sonny Gray OF Aaron Judge SS Elvis Andrus 2B Jonathan Schoop 1B Lucas Duda C J.T. Realmuto OF Max Kepler OF Jay Bruce 3B Wilmer Flores",NA,"Trea Turner","19.27%",0
6,774249673,"matt4486",0,150.35,"P Sonny Gray P Jake Odorizzi OF Aaron Judge C Gary Sánchez 2B Ian Happ 3B Evan Longoria OF Keon Broxton OF Mallex Smith 1B Ryon Healy SS Franklin Barreto",NA,"Mookie Betts","18.25%",0
7,774346477,"bmaxwell24",0,149.25,"P Sonny Gray P Doug Fister OF Aaron Judge OF Cody Bellinger 2B José Altuve OF Charlie Blackmon C Gary Sánchez 3B Adrián Béltre 1B Miguel Cabrera SS Franklin Barreto",NA,"Mike Leake","18.03%",6.7
8,774187633,"kchatmon77",0,148.45,"P Sonny Gray P Mike Leake OF Aaron Judge OF Cody Bellinger 2B José Ramírez OF Khris Davis 3B Evan Longoria C Salvador Perez 1B Ryon Healy SS Franklin Barreto",NA,"Corey Dickerson","16.89%",8
9,774352419,"brmosher1015",0,147.85,"P Ervin Santana P Sonny Gray OF Aaron Judge C Gary Sánchez SS Asdrúbal Cabrera 3B Kyle Seager OF Mallex Smith 2B José Pirela OF Melky Cabrera 1B Mitch Moreland",NA,"Evan Longoria","16.33%",18
10,774139608,"biggoldengreek (9/10)",0,146.85,"P Francisco Liriano P Josh Tomlin 1B Cody Bellinger SS Trea Turner C Gary Sánchez OF Corey Dickerson 3B Justin Turner OF Khris Davis OF Joc Pederson 2B Chris Taylor",NA,"Paul Goldschmidt","14.74%",10
11,774279271,"jguyette (2/2)",0,146.65,"P Sonny Gray P Tanner Roark OF Bryce Harper SS Trea Turner OF Giancarlo Stanton 2B Scooter Gennett 1B Eric Thames 3B Travis Shaw OF Keon Broxton C Manny Piña",NA,"Daniel Murphy","14.63%",3
12,774325356,"geos24",0,145.45,"P Francisco Liriano P Matt Moore OF Aaron Judge OF Cody Bellinger 2B José Altuve C Gary Sánchez SS Carlos Correa OF Giancarlo Stanton 3B Josh Donaldson 1B Ryon Healy",NA,"Jordan Zimmermann","13.38%",3.6
13,774133932,"Knicks64fan",0,145.05,"P Sonny Gray P Mike Montgomery OF Cody Bellinger OF Corey Dickerson 1B Joey Votto 2B Scooter Gennett OF Khris Davis SS Asdrúbal Cabrera 3B Kyle Seager C Mike Zunino",NA,"Logan Morrison","13.38%",3
14,774259437,"loboboy",0,144.4,"P Chad Kuhl P Rafael Montero 1B Paul Goldschmidt OF Cody Bellinger 3B Nolan Arenado OF Charlie Blackmon C Gary Sánchez SS Carlos Correa OF Michael Conforto 2B Chris Taylor",NA,"Ervin Santana","13.04%",26.1
15,774392800,"Joelweeks98",0,143.95,"P Mike Leake P Randall Delgado OF Aaron Judge OF Cody Bellinger OF Bryce Harper C Gary Sánchez 1B Eric Thames 2B Jonathan Schoop 3B Josh Donaldson SS Brandon Crawford",NA,"Michael Pineda","12.59%",-1.2
16,774260575,"donthaveaname",0,143.6,"P Ervin Santana P Doug Fister 1B Cody Bellinger OF Bryce Harper C Gary Sánchez OF Mookie Betts OF Corey Dickerson 2B Josh Harrison 3B Evan Longoria SS Franklin Barreto",NA,"Cody Bellinger","12.13%",35
17,774335187,"codestar5537",0,142.35,"P Sonny Gray P Jake Odorizzi OF Aaron Judge OF Cody Bellinger C Gary Sánchez OF Mookie Betts 1B Ryon Healy 2B Daniel Robertson 3B Cheslor Cuthbert SS Ronald Torreyes",NA,"Dustin Pedroia","12.13%",0
18,774273043,"aburd85 (1/3)",0,141.85,"P Francisco Liriano P Rafael Montero 1B Paul Goldschmidt OF Aaron Judge OF Bryce Harper SS Trea Turner C Gary Sánchez 2B Scooter Gennett OF Khris Davis 3B Ryon Healy",NA,"Sonny Gray","12.02%",28.75
18,774392767,"j0rdantay10r (2/7)",0,141.85,"P Jordan Zimmermann P Randall Delgado 1B Paul Goldschmidt OF Aaron Judge OF Cody Bellinger C Gary Sánchez OF Corey Dickerson 3B Evan Longoria 2B Tommy La Stella SS Franklin Barreto",NA,"George Springer","12.02%",18
18,774402083,"j0rdantay10r (6/7)",0,141.85,"P Jordan Zimmermann P Randall Delgado 1B Paul Goldschmidt OF Aaron Judge OF Cody Bellinger C Gary Sánchez OF Corey Dickerson 3B Evan Longoria 2B Tommy La Stella SS Franklin Barreto",NA,"Francisco Liriano","11.79%",13.3
18,774404873,"j0rdantay10r (7/7)",0,141.85,"P Jordan Zimmermann P Randall Delgado 1B Paul Goldschmidt OF Aaron Judge OF Cody Bellinger C Gary Sánchez OF Corey Dickerson 3B Evan Longoria 2B Tommy La Stella SS Franklin Barreto",NA,"Mike Montgomery","11.56%",21.3
22,774341633,"Sitch463 (2/2)",0,141.55,"P Ervin Santana P Jason Hammel OF Nelson Cruz OF J.D. Martinez 2B Scooter Gennett 3B Evan Longoria OF Jackie Bradley Jr. SS Nick Ahmed 1B Ian Desmond C Salvador Perez",NA,"Buster Posey","11.11%",4
23,774162287,"masahirox",0,141.35,"P Michael Pineda P Rafael Montero OF Aaron Judge C Gary Sánchez 1B Joey Votto OF Scooter Gennett SS Didi Gregorius OF José Bautista 3B Chase Headley 2B Taylor Featherston",NA,"Jake Odorizzi","10.66%",8.6
24,774272265,"rubes1 (1/2)",0,140.95,"P Mike Leake P Randall Delgado OF Cody Bellinger C Gary Sánchez OF George Springer SS Carlos Correa 1B Joey Votto OF Yoenis Céspedes 3B Evan Longoria 2B Rougned Odor",NA,"Ryon Healy","10.66%",8
25,774206140,"SquareNowski",0,140.8,"P Mike Montgomery P Doug Fister OF Aaron Judge 2B José Ramírez C Gary Sánchez 1B Edwin Encarnacion OF George Springer OF Justin Upton SS Didi Gregorius 3B Evan Longoria",NA,"Julio Teheran","10.54%",-6.65
26,774345530,"cartooner111",0,140.6,"P Rafael Montero P Nick Martínez 1B Paul Goldschmidt OF Aaron Judge OF Cody Bellinger 2B Daniel Murphy SS Trea Turner 3B Justin Turner C Yasmani Grandal OF Curtis Granderson",NA,"Salvador Perez","10.54%",5
27,774374832,"scotnic",0,139.8,"P Ervin Santana P Mike Leake OF Bryce Harper 1B José Abreu OF Giancarlo Stanton OF José Bautista 2B Jonathan Schoop 3B Josh Donaldson C Salvador Perez SS Troy Tulowitzki",NA,"Carlos Correa","10.32%",14
28,774406084,"Fixthefernback",0,139.05,"P Sonny Gray P Mike Montgomery OF Aaron Judge OF Bryce Harper 2B José Ramírez 1B Edwin Encarnacion 3B Kris Bryant OF Khris Davis SS Franklin Barreto C Caleb Joseph",NA,"Khris Davis","10.09%",10
29,773914542,"patoatessr",0,138.3,"P Jake Odorizzi P Jeremy Hellickson OF Aaron Judge 1B Cody Bellinger OF J.D. Martinez OF Andrew Benintendi C Yasmani Grandal SS Didi Gregorius 2B Jonathan Schoop 3B Josh Donaldson",NA,"Brett Gardner","9.98%",0
29,774399945,"Irishclovers1",0,138.3,"P Sonny Gray P Rafael Montero 1B Cody Bellinger 2B José Ramírez OF Brett Gardner OF Andrew Benintendi OF Yoenis Céspedes 3B Evan Longoria C Salvador Perez SS Franklin Barreto",NA,"José Ramírez","9.64%",13
31,774204208,"SSchus87 (4/5)",0,135.55,"P Mike Montgomery P Randall Delgado 1B Paul Goldschmidt OF Aaron Judge OF George Springer SS Chris Owings 3B Justin Turner OF Joc Pederson 2B Whit Merrifield C Evan Gattis",NA,"Anthony Rizzo","9.64%",5
32,774191622,"dallasstunt91",0,135.4,"P Derek Holland P Doug Fister OF Aaron Judge OF Cody Bellinger OF Bryce Harper 2B Daniel Murphy 1B José Abreu 3B Travis Shaw SS Franklin Barreto C Juan Centeno",NA,"Franklin Barreto","9.07%",8
33,774111311,"2catfish (1/2)",0,132.9,"P Sonny Gray P Matt Moore OF Aaron Judge OF Bryce Harper C Gary Sánchez 1B Joey Votto 2B Robinson Canó 3B Adrián Béltre OF Kevin Pillar SS Brandon Crawford",NA,"Giancarlo Stanton","8.96%",16
34,774252476,"Djoes78",0,132.8,"P Ervin Santana P Mike Leake OF Aaron Judge 1B Cody Bellinger OF Cameron Maybin OF Mitch Haniger 3B Travis Shaw C Salvador Perez 2B José Pirela SS Franklin Barreto",NA,"Didi Gregorius","8.50%",5
35,774163174,"choaterboy24",0,132.65,"P Ervin Santana P Josh Tomlin OF George Springer SS Carlos Correa 1B Joey Votto 2B Robinson Canó 3B Josh Donaldson C Russell Martin OF Billy Hamilton OF Randal Grichuk",NA,"Doug Fister","8.16%",13.5
36,774256415,"mikeshoe31",0,132.55,"P Ervin Santana P Jason Hammel C Gary Sánchez OF Michael Conforto OF Shin-soo Choo SS Elvis Andrus 3B Adrián Béltre 1B Miguel Cabrera OF Melky Cabrera 2B Rougned Odor",NA,"Mallex Smith","8.16%",9
37,774309527,"AgLawman",0,131.95,"P Jake Odorizzi P Julio Teheran 1B Cody Bellinger OF George Springer 3B Justin Turner OF Giancarlo Stanton OF Joc Pederson SS Nick Ahmed 2B Howie Kendrick C Evan Gattis",NA,"Kris Bryant","8.05%",5
38,774155788,"spanky3768",0,131.45,"P Sonny Gray P Mike Leake OF Bryce Harper OF Justin Upton SS Jean Segura OF Lonnie Chisenhall 2B Jonathan Schoop 3B Travis Shaw 1B Albert Pujols C Evan Gattis",NA,"Randall Delgado","7.94%",16.25
39,774208184,"JQ2727 (3/3)",0,131.35,"P Jason Hammel P Derek Holland 1B Cody Bellinger OF Bryce Harper 3B Kris Bryant OF Carlos Gómez SS Didi Gregorius OF Keon Broxton 2B Jason Kipnis C Jonathan Lucroy",NA,"José Altuve","7.94%",9
40,774144316,"Struttdaddy",0,131.3,"P Sonny Gray P Rafael Montero OF Aaron Judge 1B Cody Bellinger SS Carlos Correa OF Nelson Cruz OF Carlos Gómez 3B Josh Donaldson C Mike Zunino 2B Dustin Pedroia",NA,"Xander Bogaerts","7.71%",0
41,774336648,"falcon1024",0,131.05,"P Jordan Zimmermann P Jason Hammel OF Cody Bellinger OF George Springer SS Carlos Correa 3B Justin Turner 2B Chris Taylor C Mike Zunino 1B John Jaso OF Norichika Aoki",NA,"Josh Donaldson","7.60%",11
42,774153126,"swilson2006 (1/5)",0,130,"P Jeremy Hellickson 1B Cody Bellinger OF Bryce Harper 2B José Altuve SS Carlos Correa OF Corey Dickerson 3B Kris Bryant OF Justin Upton C Buster Posey P Francis Martes",NA,"Anthony Rendon","7.48%",0
43,774277656,"ddore1",0,128.4,"P Ervin Santana P Mike Montgomery 1B Joey Votto OF Ian Happ OF Avisaíl García OF Shin-soo Choo SS Elvis Andrus 2B Jonathan Schoop 3B Adrián Béltre C Salvador Perez",NA,"Joey Votto","7.48%",5
44,774276932,"SimplyClutch1024",0,128.35,"P Sonny Gray P Jordan Zimmermann OF Aaron Judge OF Bryce Harper 2B Daniel Murphy C Gary Sánchez 1B Mitch Moreland OF Rajai Davis 3B Wilmer Flores SS Franklin Barreto",NA,"Justin Turner","7.37%",18
45,774325860,"kru036 (1/2)",0,128.05,"P Sonny Gray 2B José Ramírez OF George Springer 3B Kris Bryant 1B Joey Votto OF J.D. Martinez SS Elvis Andrus OF Jay Bruce C Evan Gattis P Francis Martes",NA,"Jason Hammel","7.26%",14.45
46,774385056,"mcewenmarc (4/5)",0,127.4,"P Ervin Santana P Francisco Liriano 2B Brian Dozier SS Carlos Correa 1B Justin Smoak OF José Bautista OF Eddie Rosario C Russell Martin 3B Eduardo Escobar OF Max Kepler",NA,"Evan Gattis","7.14%",16
47,774316925,"ian3reid",0,126.8,"P Tanner Roark P Derek Holland OF Cody Bellinger OF Bryce Harper OF Charlie Blackmon C Gary Sánchez 3B Kris Bryant SS Francisco Lindor 1B Mitch Moreland 2B Alen Hanson",NA,"Steven Souza Jr.","6.58%",5
48,774132143,"dolfinette",0,126.65,"P Brandon McCarthy P Doug Fister 1B Paul Goldschmidt OF Aaron Judge OF Cody Bellinger C Gary Sánchez 3B Justin Turner 2B Ian Happ OF Mitch Haniger SS Alcides Escobar",NA,"Andrew Benintendi","6.35%",6
48,774206009,"quintpat36",0,126.65,"P Sonny Gray P Tanner Roark OF Cody Bellinger SS Chris Owings 3B Justin Turner OF Steven Souza Jr. OF Khris Davis 2B Brandon Drury C Mike Zunino 1B Yuli Gurriel",NA,"Charlie Blackmon","6.35%",0
50,774091139,"Jaz60",0,126.6,"P Ervin Santana P Doug Fister OF Aaron Judge 1B Cody Bellinger SS Xander Bogaerts 2B José Altuve OF Tommy Pham 3B Travis Shaw OF Austin Slater C Austin Hedges",NA,"Matt Moore","6.24%",3.15
51,774259751,"celfo72 (1/2)",0,126.55,"P Mike Montgomery P Randall Delgado OF Aaron Judge OF Cody Bellinger C Gary Sánchez 3B Kris Bryant OF Carlos Gómez 1B Matt Adams 2B Whit Merrifield SS Franklin Barreto",NA,"Eric Thames","6.12%",0
52,774145045,"leighthol",0,126.3,"P Ervin Santana P Parker Bridwell SS Trea Turner 1B Edwin Encarnacion OF George Springer 3B Justin Turner OF Justin Upton 2B Jonathan Schoop OF Adam Jones C Salvador Perez",NA,"Ian Happ","5.90%",3
53,774299817,"GOINGOINGONE",0,126.25,"P Mike Leake P Rafael Montero 1B Paul Goldschmidt OF Aaron Judge OF Bryce Harper 2B Daniel Murphy 3B Nolan Arenado C Gary Sánchez SS Troy Tulowitzki OF Drew Robinson",NA,"Francisco Lindor","5.90%",0
53,774325413,"jweinfeld214 (1/2)",0,126.25,"P Sonny Gray P Doug Fister 1B Paul Goldschmidt 3B Nolan Arenado OF George Springer SS Carlos Correa C Buster Posey OF Giancarlo Stanton OF Andrew McCutchen 2B Rougned Odor",NA,"Aaron Hicks","5.78%",3
55,774257343,"scarf1968",0,125.65,"P Brandon McCarthy P Doug Fister 1B Cody Bellinger C Gary Sánchez OF Mookie Betts 3B Justin Turner SS Didi Gregorius OF Joc Pederson 2B Chris Taylor OF Yasiel Puig",NA,"Brian Goodwin","5.67%",6
56,774330107,"cnorris",0,125.25,"P Sonny Gray P Doug Fister SS Trea Turner 1B Logan Morrison C Gary Sánchez 2B Ian Kinsler OF J.D. Martinez OF Justin Upton 3B Evan Longoria OF Marcell Ozuna",NA,"Cameron Maybin","5.67%",0
57,774128118,"ocktane15",0,124.95,"P Ervin Santana P Chad Kuhl 1B Paul Goldschmidt OF Cody Bellinger C Gary Sánchez OF J.D. Martinez 2B Josh Harrison OF Andrew McCutchen SS Jordy Mercer 3B David Freese",NA,"Justin Upton","5.10%",16
58,774170082,"Ibarbo",0,124.85,"P Ervin Santana P Sonny Gray SS Carlos Correa 2B Brandon Phillips OF Andrew McCutchen 3B Travis Shaw OF Marcell Ozuna 1B Yonder Alonso C Mike Zunino OF Melky Cabrera",NA,"Matt Adams","4.88%",5
59,774257680,"jguyette (1/2)",0,124.8,"P Tanner Roark P Derek Holland OF Aaron Judge 1B Cody Bellinger 2B Daniel Murphy 3B Justin Turner OF Carlos Gómez OF Domingo Santana SS Orlando Arcia C Manny Piña",NA,"Brandon Phillips","4.88%",0
60,774353414,"rafiki2016",0,124.6,"P Ervin Santana P Doug Fister OF Cody Bellinger OF Mookie Betts OF George Springer 1B Anthony Rizzo 2B Robinson Canó C J.T. Realmuto SS Javier Báez 3B Ryon Healy",NA,"J.T. Realmuto","4.88%",3
61,774253508,"Rexella (2/2)",0,124.35,"P Nick Martínez OF Cody Bellinger OF Bryce Harper 2B José Ramírez 3B Nolan Arenado OF George Springer SS Carlos Correa C Buster Posey 1B Adam Lind P Francis Martes",NA,"Nolan Arenado","4.88%",9
62,774312651,"jfray72",0,123.5,"P Jordan Zimmermann P Ariel Miranda OF Aaron Judge OF Cody Bellinger OF Bryce Harper 1B Joey Votto 2B Scooter Gennett SS Nick Ahmed C Mike Zunino 3B Ryon Healy",NA,"Edwin Encarnacion","4.76%",0
63,774279134,"Angel209",0,123.25,"P Tanner Roark P Scott Feldman OF Cody Bellinger 3B Nolan Arenado C Gary Sánchez SS Carlos Correa OF Tommy Pham 2B Josh Harrison OF Andrew McCutchen 1B Matt Carpenter",NA,"Travis Shaw","4.65%",20
64,774359777,"stros56 (1/2)",0,123.2,"P Sonny Gray P Jason Hammel 2B Daniel Murphy OF Nelson Cruz 3B Anthony Rendon SS Didi Gregorius OF Chris Taylor OF Adam Jones 1B Ian Desmond C René Rivera",NA,"Tanner Roark","4.42%",8.9
65,774201667,"garycaca",0,123,"P Sonny Gray P Edinson Volquez 1B Cody Bellinger OF Michael Conforto OF Adam Duvall 2B Robinson Canó OF Andrew Benintendi 3B Travis Shaw C Mike Zunino SS Dansby Swanson",NA,"Brian Dozier","4.31%",2
66,774383288,"mdeff19",0,122.85,"P Jason Hammel P Clayton Richard OF Cody Bellinger OF Charlie Blackmon 3B Manny Machado 1B José Abreu OF Domingo Santana 2B Chris Taylor SS Nick Ahmed C Evan Gattis",NA,"Robinson Canó","4.31%",11
67,774193990,"SSchus87 (1/5)",0,122.7,"P Matt Moore P Rafael Montero OF Aaron Judge 1B Cody Bellinger 2B Daniel Murphy 3B Justin Turner SS Francisco Lindor C Yasmani Grandal OF Lonnie Chisenhall OF Joc Pederson",NA,"Francis Martes","4.31%",2.3
68,774216262,"bigcardsfan",0,122.45,"P Sonny Gray P Mike Leake SS Trea Turner C Gary Sánchez OF Tommy Pham OF Curtis Granderson 1B Matt Carpenter OF Randal Grichuk 2B Paul DeJong 3B Greg Garcia",NA,"Josh Phegley","4.20%",0
69,774283325,"superlee34 (1/2)",0,122.35,"P Sonny Gray P Jake Odorizzi OF Aaron Judge 1B Logan Morrison C Gary Sánchez OF Corey Dickerson OF Chris Owings 3B Evan Longoria SS Franklin Barreto 2B Taylor Featherston",NA,"Marcell Ozuna","4.20%",7
69,774403534,"superlee34 (2/2)",0,122.35,"P Sonny Gray P Jake Odorizzi OF Aaron Judge 1B Logan Morrison C Gary Sánchez OF Corey Dickerson OF Chris Owings 3B Evan Longoria SS Franklin Barreto 2B Taylor Featherston",NA,"Chris Owings","4.08%",5
71,774282859,"aburd85 (3/3)",0,122.3,"P Sonny Gray P Rafael Montero 1B Paul Goldschmidt OF Aaron Judge SS Trea Turner C Gary Sánchez OF Cameron Maybin OF Khris Davis 3B Ryon Healy 2B José Peraza",NA,"Mike Zunino","3.97%",0
72,774316011,"scootds34",0,122.2,"P Mike Montgomery P Derek Holland OF Cody Bellinger OF Bryce Harper 1B Anthony Rizzo 3B Kris Bryant 2B Ian Kinsler SS Eric Sogard OF Lorenzo Cain C Salvador Perez",NA,"Adam Lind","3.97%",7
73,774276718,"RobFTW2014 (1/2)",0,122.05,"P Jason Hammel P Jake Odorizzi OF Aaron Judge C Gary Sánchez OF Steven Souza Jr. OF Giancarlo Stanton 3B Evan Longoria 2B Eric Sogard 1B Adam Lind SS Adam Rosales",NA,"Jean Segura","3.74%",0
74,774405603,"binderjoel",0,122,"P Sonny Gray P Randall Delgado 1B Paul Goldschmidt OF Aaron Judge SS Chris Owings OF J.D. Martinez 2B Robinson Canó 3B Josh Donaldson C Salvador Perez OF Joey Rickard",NA,"J.D. Martinez","3.63%",10
75,774293078,"jawish1963 (2/3)",0,121.65,"P Sonny Gray P Tanner Roark OF Aaron Judge OF Bryce Harper C Gary Sánchez 3B Anthony Rendon SS Didi Gregorius OF Michael A. Taylor 1B Adam Lind 2B Taylor Featherston",NA,"Javier Báez","3.63%",5
76,774351448,"skacsir",0,121.5,"P Jordan Zimmermann P Derek Holland 1B Paul Goldschmidt OF Cody Bellinger 3B Nolan Arenado OF Tommy Pham 2B Scooter Gennett OF Billy Hamilton C Mike Zunino SS Alcides Escobar",NA,"Josh Tomlin","3.63%",7.55
77,774350836,"Loboferoz",0,121.35,"P Ervin Santana P Edinson Volquez OF Aaron Judge 3B Justin Turner 1B Joey Votto SS Jean Segura 2B Jonathan Schoop OF Jackie Bradley Jr. OF Brian Goodwin C Yan Gomes",NA,"Mitch Moreland","3.63%",17
78,774317944,"CMansbach99",0,121.2,"P Mike Leake P Doug Fister OF Aaron Judge OF Cody Bellinger SS Xander Bogaerts OF Mookie Betts 3B Justin Turner 2B Scooter Gennett 1B Eric Thames C Salvador Perez",NA,"Carlos Gómez","3.63%",0
78,774381609,"tbarenberg",0,121.2,"P Sonny Gray P Jason Hammel OF Aaron Judge OF George Springer 1B Matt Adams OF Cameron Maybin 3B Evan Longoria C J.T. Realmuto 2B Kiké Hernández SS JT Riddle",NA,"Manny Machado","3.63%",5
80,774111312,"2catfish (2/2)",0,120.9,"P Sonny Gray P Matt Moore OF Aaron Judge 2B Daniel Murphy C Gary Sánchez OF Corey Dickerson 3B Adrián Béltre 1B Matt Carpenter OF Ian Desmond SS Brandon Crawford",NA,"Eric Sogard","3.51%",3
81,774191753,"weevie12",0,120.6,"P Mike Montgomery P Francisco Liriano 1B Paul Goldschmidt OF Aaron Judge OF Bryce Harper C Gary Sánchez OF Corey Dickerson 3B Josh Donaldson 2B Dustin Pedroia SS Franklin Barreto",NA,"Whit Merrifield","3.40%",0
82,774219489,"Graymatta",0,120.4,"P Ervin Santana P Mike Montgomery OF Cody Bellinger OF Steven Souza Jr. 1B Matt Adams SS Didi Gregorius 3B Evan Longoria OF Kole Calhoun 2B Starlin Castro C Mike Zunino",NA,"Miguel Sanó","3.40%",2
83,774235186,"Petieman",0,120.2,"P Mike Leake P Doug Fister OF Aaron Judge OF Cody Bellinger OF Bryce Harper SS Carlos Correa 2B Josh Harrison 1B Eric Thames 3B Travis Shaw C Brian McCann",NA,"Wilmer Flores","3.29%",14
84,774390157,"EyesWide73 (1/2)",0,120.05,"P Sonny Gray P Mike Montgomery OF Aaron Judge OF Cody Bellinger 2B Daniel Murphy OF Mookie Betts 1B Eric Thames C Kurt Suzuki 3B Ryon Healy SS Franklin Barreto",NA,"Taylor Featherston","3.29%",7
85,774113723,"KingOfQueens2326",0,119.85,"P Francisco Liriano P Josh Tomlin 1B Paul Goldschmidt OF Aaron Judge OF Cody Bellinger OF George Springer C Buster Posey 2B Josh Harrison 3B Maikel Franco SS Jordy Mercer",NA,"Jonathan Schoop","3.17%",23
86,774247223,"scots1212",0,119.05,"P Jason Hammel P Jake Odorizzi 1B Logan Morrison OF Corey Dickerson 3B Anthony Rendon 2B Scooter Gennett SS Didi Gregorius OF Keon Broxton OF Brian Goodwin C Evan Gattis",NA,"Matt Carpenter","3.17%",5
86,774312422,"perihadion",0,119.05,"P Sonny Gray P Mike Montgomery OF Aaron Judge OF Bryce Harper SS Trea Turner C Gary Sánchez 3B Anthony Rendon 1B Ryon Healy OF Mason Williams 2B Taylor Featherston",NA,"Andrew McCutchen","3.17%",5
88,774201192,"Natashaj",0,118.9,"P Jordan Zimmermann P Mike Montgomery OF Aaron Judge 2B José Altuve C Gary Sánchez 3B Manny Machado OF Justin Upton 1B Eric Thames OF Trey Mancini SS Adam Rosales",NA,"Scooter Gennett","3.17%",27
89,774350264,"j0rdantay10r (1/7)",0,118.85,"P Jordan Zimmermann P Randall Delgado 1B Paul Goldschmidt OF Cody Bellinger C Gary Sánchez OF Corey Dickerson OF Cameron Maybin 2B Brandon Drury 3B Evan Longoria SS Franklin Barreto",NA,"Derek Holland","3.17%",19.9
90,774263634,"RamHammer",0,118.7,"P Ervin Santana P Jake Odorizzi 1B Cody Bellinger 3B Justin Turner C Buster Posey OF Joc Pederson OF Kole Calhoun OF Marcell Ozuna 2B Dustin Pedroia SS Trevor Story",NA,"Rafael Montero","3.17%",24.55
91,774332757,"DeanS22",0,118.6,"P Ervin Santana P Doug Fister OF Bryce Harper 2B Daniel Murphy SS Carlos Correa 3B Kris Bryant OF Andrew Benintendi OF Giancarlo Stanton C Salvador Perez 1B Mitch Moreland",NA,"Rougned Odor","3.17%",8
92,774256081,"Kenon (1/3)",0,118.25,"P Sonny Gray P Doug Fister OF Aaron Judge 1B Logan Morrison C Gary Sánchez OF Corey Dickerson OF Andrew Benintendi SS Didi Gregorius 3B Evan Longoria 2B Dustin Pedroia",NA,"Jorge Polanco","3.17%",3
92,774266152,"Kenon (2/3)",0,118.25,"P Sonny Gray P Doug Fister OF Aaron Judge 1B Logan Morrison C Gary Sánchez OF Corey Dickerson OF Andrew Benintendi SS Didi Gregorius 3B Evan Longoria 2B Dustin Pedroia",NA,"Rajai Davis","3.06%",5
92,774266730,"Kenon (3/3)",0,118.25,"P Sonny Gray P Doug Fister OF Aaron Judge 1B Logan Morrison C Gary Sánchez OF Corey Dickerson OF Andrew Benintendi SS Didi Gregorius 3B Evan Longoria 2B Dustin Pedroia",NA,"Miguel Cabrera","3.06%",3
95,774256413,"dwandell",0,118.2,"P Sonny Gray P Jason Hammel 1B Logan Morrison OF George Springer 2B Ian Kinsler OF J.D. Martinez OF Justin Upton C Buster Posey 3B Maikel Franco SS Franklin Barreto",NA,"Albert Pujols","3.06%",0
96,774311245,"wooskers",0,118.05,"P Sonny Gray P Francisco Liriano OF Cody Bellinger OF Charlie Blackmon SS Chris Owings 3B Evan Longoria OF Hernán Pérez 2B Jason Kipnis 1B Matt Carpenter C J.T. Realmuto",NA,"Edinson Volquez","2.95%",13.25
97,774182235,"cangelo10",0,117.7,"P Ervin Santana P Jordan Zimmermann 3B Kris Bryant 1B Matt Adams OF Justin Upton C Buster Posey OF José Bautista OF Jay Bruce 2B Javier Báez SS Troy Tulowitzki",NA,"Hanley Ramirez","2.95%",5
98,774208420,"Hansc27",0,116.9,"P Jake Odorizzi P Francisco Liriano OF Aaron Judge OF Bryce Harper SS Carlos Correa OF Corey Dickerson 1B Joey Votto 3B Travis Shaw 2B José Pirela C Elias Díaz",NA,"Adam Jones","2.83%",2
99,774154217,"jtortona (1/3)",0,116.6,"P Jason Hammel P Brandon McCarthy OF Aaron Judge 2B Daniel Murphy OF George Springer 1B Lucas Duda OF Curtis Granderson SS Asdrúbal Cabrera C Salvador Perez 3B Wilmer Flores",NA,"Jason Kipnis","2.83%",3
100,774363840,"Mopar666",0,115.95,"P Jake Odorizzi P Julio Teheran OF Aaron Judge 1B Logan Morrison C Gary Sánchez OF Corey Dickerson 2B Scooter Gennett 3B Evan Longoria OF Melky Cabrera SS Franklin Barreto",NA,"Zach Davies","2.83%",16.75
101,774363461,"steve-o602",0,115.65,"P Ervin Santana P Josh Tomlin OF Aaron Judge OF Bryce Harper 3B Manny Machado 1B Joey Votto OF Andrew Benintendi 2B Jonathan Schoop C Yan Gomes SS Ronald Torreyes",NA,"Matt Olson","2.72%",2
102,774285164,"angemade",0,115.6,"P Mike Leake P Ariel Miranda 1B Paul Goldschmidt OF Aaron Judge 2B Daniel Murphy C Gary Sánchez OF Michael Conforto OF Curtis Granderson SS Asdrúbal Cabrera 3B Wilmer Flores",NA,"Clayton Richard","2.72%",1.4
103,774234028,"jfitzgerald",0,115.25,"P Ervin Santana P Brandon McCarthy OF Justin Upton C Buster Posey SS Jean Segura OF Giancarlo Stanton 2B Brandon Drury OF José Bautista 3B Josh Donaldson 1B Wil Myers",NA,"Elvis Andrus","2.72%",9
104,774321495,"goleafsgo14",0,115.1,"P Michael Pineda P Francisco Liriano OF Aaron Judge OF George Springer 2B Scooter Gennett OF Eric Thames 3B Evan Longoria C Miguel Montero 1B Ryon Healy SS Franklin Barreto",NA,"Yasmani Grandal","2.61%",0
105,774317843,"chasecarter09",0,114.8,"P Ervin Santana P Jeremy Hellickson 1B Paul Goldschmidt OF Aaron Judge OF Bryce Harper 2B Ian Happ SS Jean Segura 3B Josh Donaldson C Miguel Montero OF Patrick Kivlehan",NA,"Tyler Anderson","2.61%",-4.95
106,774363102,"pauliet722",0,114.7,"P Ervin Santana P Jake Odorizzi OF Aaron Judge OF Cody Bellinger SS Didi Gregorius C J.T. Realmuto 2B Joe Panik 3B Kyle Seager 1B Trey Mancini OF Matt Olson",NA,"Nelson Cruz","2.61%",2
107,774208289,"notmild",0,114.35,"P Ervin Santana P Edinson Volquez SS Trea Turner C Gary Sánchez OF George Springer 1B Matt Adams OF Cameron Maybin OF Andrew McCutchen 3B Travis Shaw 2B Taylor Featherston",NA,"Brandon Belt","2.49%",3
108,774322662,"1hartless1",0,114.2,"P Derek Holland OF Aaron Judge OF Cody Bellinger OF Bryce Harper SS Xander Bogaerts 1B Joey Votto C Buster Posey 2B Dustin Pedroia 3B Nicholas Castellanos P Francis Martes",NA,"Stephen Piscotty","2.49%",4
109,774154229,"jtortona (2/3)",0,113.9,"P Jordan Zimmermann P Mike Montgomery OF Aaron Judge 1B Logan Morrison 2B Ian Kinsler OF J.D. Martinez SS Addison Russell OF Justin Upton 3B Nicholas Castellanos C Jason Castro",NA,"Josh Harrison","2.49%",2
109,774373124,"msteiny99 (1/2)",0,113.9,"P Sonny Gray P Brandon McCarthy 2B Daniel Murphy 1B Logan Morrison C Gary Sánchez 3B Evan Longoria OF Jackie Bradley Jr. OF Mallex Smith SS Javier Báez OF Melky Cabrera",NA,"Avisaíl García","2.49%",0
