"Rank","EntryId","EntryName","TimeRemaining","Points","Lineup","X","Player","X.Drafted","FPTS"
567,774176196,"mrussell1982 (2/2)",0,74.45,"P Brandon McCarthy P Francisco Liriano 1B Paul Goldschmidt OF Aaron Judge C Gary Sánchez OF Mookie Betts 3B Kris Bryant OF Aaron Hicks 2B Dustin Pedroia SS Franklin Barreto",NA,"","",NA
567,774279514,"wolfpackclh731",0,74.45,"P Brandon McCarthy P Francisco Liriano 1B Paul Goldschmidt OF Aaron Judge C Gary Sánchez OF Mookie Betts 3B Kris Bryant OF Aaron Hicks 2B Dustin Pedroia SS Franklin Barreto",NA,"","",NA
567,774394789,"H8ter2",0,74.45,"P Brandon McCarthy P Francisco Liriano 1B Paul Goldschmidt OF Aaron Judge C Gary Sánchez OF Mookie Betts 3B Kris Bryant OF Aaron Hicks 2B Dustin Pedroia SS Franklin Barreto",NA,"","",NA
571,774292219,"cdknisal",0,74.4,"P Michael Pineda P Jake Odorizzi C Buster Posey OF Giancarlo Stanton OF Khris Davis 2B Jason Kipnis 1B Miguel Cabrera OF Mallex Smith 3B Nicholas Castellanos SS Brandon Crawford",NA,"","",NA
571,774395029,"topspinner",0,74.4,"P Brandon McCarthy P Randall Delgado OF Aaron Judge 2B José Altuve 1B Logan Morrison OF Mookie Betts OF Corey Dickerson SS Didi Gregorius 3B Evan Longoria C Josh Phegley",NA,"","",NA
573,774249579,"ChiBkHnd",0,74.3,"P Brandon McCarthy P Matt Moore 1B Paul Goldschmidt OF Aaron Judge C Gary Sánchez OF Mookie Betts SS Jean Segura OF Khris Davis 3B Ryon Healy 2B Rougned Odor",NA,"","",NA
574,774304966,"DaHood (2/2)",0,74.2,"P Mike Montgomery P Derek Holland OF Bryce Harper 2B Daniel Murphy SS Trea Turner 3B Anthony Rendon OF Adam Duvall 1B Joey Votto OF Scott Schebler C Omar Narváez",NA,"","",NA
575,774167853,"BigPhill99 (1/2)",0,73.9,"P Jordan Zimmermann P Francisco Liriano OF Aaron Judge SS Xander Bogaerts 3B Justin Turner OF Carlos Gómez 2B Brandon Phillips OF Joc Pederson C Salvador Perez 1B Brandon Belt",NA,"","",NA
575,774303134,"sstone01",0,73.9,"P Jake Odorizzi P Francisco Liriano SS Trea Turner 2B Brian Dozier C Gary Sánchez OF Brett Gardner OF Khris Davis 3B Josh Donaldson 1B Matt Davidson OF Mallex Smith",NA,"","",NA
577,774287426,"Denis007 (2/2)",0,73.85,"P Brandon McCarthy P Mike Leake OF Aaron Judge C Gary Sánchez OF Brett Gardner SS Didi Gregorius OF Aaron Hicks 3B Adrián Béltre 1B Mike Napoli 2B Rougned Odor",NA,"","",NA
577,774289491,"FTC1",0,73.85,"P Jason Hammel P Clayton Richard OF Aaron Judge OF Bryce Harper 3B José Ramírez OF Charlie Blackmon 2B Whit Merrifield C Salvador Perez 1B Eric Hosmer SS Alcides Escobar",NA,"","",NA
579,774344452,"beck66 (1/2)",0,73.8,"P Sonny Gray OF Aaron Judge 3B José Ramírez SS Trea Turner 1B Edwin Encarnacion OF Carlos Gómez 2B José Peraza C Tucker Barnhart OF Patrick Kivlehan P Tyler Anderson",NA,"","",NA
579,774387753,"beck66 (2/2)",0,73.8,"P Sonny Gray OF Aaron Judge 3B José Ramírez SS Trea Turner 1B Edwin Encarnacion OF Carlos Gómez 2B José Peraza C Tucker Barnhart OF Patrick Kivlehan P Tyler Anderson",NA,"","",NA
579,774396353,"NiceArrowShot (13/20)",0,73.8,"P Jason Hammel P Julio Teheran OF Aaron Judge OF Bryce Harper 1B Edwin Encarnacion SS Carlos Correa OF Austin Jackson 2B Dustin Pedroia 3B Chase Headley C Jesús Sucre",NA,"","",NA
582,774148766,"Tuckersteam36 (2/2)",0,73.75,"P Jason Hammel P Mike Montgomery 3B José Ramírez 1B Edwin Encarnacion SS Francisco Lindor OF Avisaíl García OF Andrew Benintendi OF Lonnie Chisenhall 2B Jason Kipnis C Miguel Montero",NA,"","",NA
582,774380564,"bentom",0,73.75,"P Edinson Volquez P Doug Fister OF Aaron Judge OF Bryce Harper SS Trea Turner 2B Brian Dozier OF Mookie Betts 3B Josh Donaldson 1B Albert Pujols C Salvador Perez",NA,"","",NA
584,774114042,"bstock13",0,73.7,"P Ervin Santana P Jordan Zimmermann OF Bryce Harper 2B José Ramírez 1B Ryan Zimmerman 3B Evan Longoria OF Ben Gamel SS Dansby Swanson C Travis d'Arnaud OF Jaff Decker",NA,"","",NA
585,774154014,"tcyoda (1/2)",0,73.6,"P Julio Teheran P Randall Delgado OF Aaron Judge OF Charlie Blackmon OF George Springer 2B Brandon Phillips 3B Evan Longoria 1B Adam Lind C Salvador Perez SS Dansby Swanson",NA,"","",NA
585,774396346,"NiceArrowShot (6/20)",0,73.6,"P Jason Hammel P Brandon McCarthy OF Aaron Judge 1B Logan Morrison C Gary Sánchez OF Brett Gardner SS Francisco Lindor OF Aaron Hicks 3B Chase Headley 2B Taylor Featherston",NA,"","",NA
587,774229565,"nomorestoreii (2/4)",0,73.55,"P Brandon McCarthy P Clayton Richard OF Aaron Judge 1B Logan Morrison C Gary Sánchez OF Corey Dickerson OF Brett Gardner SS Didi Gregorius 3B Chase Headley 2B Daniel Robertson",NA,"","",NA
588,774193541,"washubeek (1/3)",0,73.5,"P Julio Teheran P Brandon McCarthy 1B Paul Goldschmidt 3B Nolan Arenado OF Chris Owings OF Giancarlo Stanton OF Khris Davis SS Nick Ahmed C Evan Gattis 2B Alen Hanson",NA,"","",NA
589,774304155,"kennyscards",0,73.45,"P Brandon McCarthy OF Aaron Judge 1B Cody Bellinger OF Bryce Harper 3B Kris Bryant OF Brett Gardner 2B Brandon Drury SS Dansby Swanson C Austin Hedges P Francis Martes",NA,"","",NA
589,774128225,"mhickey11",0,73.45,"P Tanner Roark P Josh Tomlin 3B Nolan Arenado OF Charlie Blackmon OF George Springer 1B Anthony Rizzo 2B Ian Kinsler OF Carlos Gómez SS Didi Gregorius C Russell Martin",NA,"","",NA
591,774358150,"Isidoros",0,73.4,"P Ervin Santana P Francisco Liriano 2B Brian Dozier 3B Miguel Sanó OF Avisaíl García 1B José Abreu OF Khris Davis OF Max Kepler C Salvador Perez SS Franklin Barreto",NA,"","",NA
592,774126852,"obsfrankh (1/2)",0,73.2,"P Mike Montgomery P Tanner Roark OF Bryce Harper 2B Daniel Murphy SS Trea Turner C Gary Sánchez 3B Anthony Rendon 1B Matt Adams OF Cameron Maybin OF Matt Olson",NA,"","",NA
593,774202831,"bears57",0,73.15,"P Michael Pineda P Julio Teheran OF Nelson Cruz 1B Joey Votto OF José Bautista 3B Josh Donaldson OF Marcell Ozuna 2B Daniel Descalso C Jason Castro SS Alcides Escobar",NA,"","",NA
593,774353211,"Jimbroni",0,73.15,"P Jordan Zimmermann P Rafael Montero OF Aaron Judge 2B Daniel Murphy 1B Anthony Rizzo OF Brett Gardner OF Yoenis Céspedes 3B Todd Frazier C Russell Martin SS Javier Báez",NA,"","",NA
595,774178731,"doublecheckthis",0,73.05,"P Michael Pineda P Randall Delgado C Gary Sánchez OF Mookie Betts OF Justin Upton 3B Matt Davidson OF Lorenzo Cain 2B DJ LeMahieu 1B Ryon Healy SS Pat Valaika",NA,"","",NA
595,774224774,"JanetKoranda",0,73.05,"P Julio Teheran P Mike Leake 1B Cody Bellinger OF Corey Dickerson 3B Manny Machado OF J.D. Martinez OF Khris Davis SS Andrelton Simmons 2B Starlin Castro C Mike Zunino",NA,"","",NA
597,774396339,"bet65",0,73,"P Ervin Santana P Tanner Roark 1B Anthony Rizzo OF Corey Dickerson 3B Kris Bryant OF Cameron Maybin SS Eric Sogard C Russell Martin OF Brian Goodwin 2B Dustin Pedroia",NA,"","",NA
598,774327616,"shakyjake26",0,72.85,"P Brandon McCarthy P Mike Leake OF Aaron Judge OF Cody Bellinger OF David Peralta 3B Luis Valbuena 1B Albert Pujols SS Andrelton Simmons C Salvador Perez 2B Dustin Pedroia",NA,"","",NA
599,774199199,"carnaggie",0,72.75,"P Jason Hammel P Mike Montgomery OF Charlie Blackmon 3B Kris Bryant OF Brett Gardner 1B Joey Votto 2B Robinson Canó SS Jean Segura OF Cameron Maybin C Evan Gattis",NA,"","",NA
600,774318539,"burke04",0,72.65,"P Julio Teheran P Francisco Liriano SS Trea Turner 2B Brian Dozier C Gary Sánchez OF Mookie Betts 3B Justin Turner OF Giancarlo Stanton 1B Adam Lind OF Tyler Austin",NA,"","",NA
601,774342983,"floresj7",0,72.45,"P Brandon McCarthy P Mike Montgomery OF Aaron Judge OF Mookie Betts SS Francisco Lindor OF Avisaíl García C Yasmani Grandal 3B Evan Longoria 1B Luis Valbuena 2B Logan Forsythe",NA,"","",NA
602,774365117,"The_Boss_Sasha_Banks",0,72.4,"P Brandon McCarthy P Randall Delgado 1B Paul Goldschmidt OF Cody Bellinger SS Corey Seager 3B Jake Lamb OF Mookie Betts 2B DJ LeMahieu C Chris Iannetta OF Byron Buxton",NA,"","",NA
603,774376871,"joshf31",0,72.35,"P Sonny Gray P Jordan Zimmermann OF Mookie Betts OF Corey Dickerson OF Adam Duvall SS Addison Russell 3B Luis Valbuena 1B Eric Hosmer 2B Javier Báez C Christian Vázquez",NA,"","",NA
604,774182182,"roshea",0,72.25,"P Clayton Richard P Chad Kuhl 1B Paul Goldschmidt OF Aaron Judge SS Xander Bogaerts 2B José Altuve 3B Justin Turner OF Carlos Gómez OF Andrew McCutchen C Austin Hedges",NA,"","",NA
604,774216618,"viper3000",0,72.25,"P Ervin Santana P Matt Moore SS Xander Bogaerts OF Mookie Betts OF Corey Dickerson OF Steven Souza Jr. 1B Eric Thames 3B Evan Longoria 2B Eric Sogard C Jesús Sucre",NA,"","",NA
606,774143108,"chittowncapone",0,72.05,"P Brandon McCarthy P Derek Holland C Gary Sánchez 3B Anthony Rendon OF Steven Souza Jr. OF J.D. Martinez 2B Robinson Canó OF Avisaíl García 1B José Abreu SS Jean Segura",NA,"","",NA
606,774261152,"codyjames427",0,72.05,"P Sonny Gray P Francisco Liriano OF Charlie Blackmon OF Mookie Betts 1B Anthony Rizzo 3B Anthony Rendon OF Justin Upton SS Elvis Andrus 2B Starlin Castro C Yan Gomes",NA,"","",NA
606,774384622,"Antz707",0,72.05,"P Michael Pineda P Randall Delgado OF Bryce Harper SS Elvis Andrus OF Matt Kemp 3B Travis Shaw 2B Jason Kipnis OF Lorenzo Cain 1B Brandon Belt C John Hicks",NA,"","",NA
609,774328510,"cotrigger",0,72,"P Ervin Santana P Ariel Miranda OF Aaron Judge 1B Anthony Rizzo OF J.D. Martinez C Buster Posey 2B Brandon Phillips 3B Josh Harrison OF Nick Markakis SS Tim Anderson",NA,"","",NA
610,774137222,"Charta",0,71.95,"P Michael Pineda P Matt Moore 1B Cody Bellinger 2B José Altuve 3B Jake Lamb OF David Peralta OF Brian Goodwin OF Daniel Descalso C Josh Phegley SS Franklin Barreto",NA,"","",NA
610,774401021,"Hainsey",0,71.95,"P Michael Pineda P Brandon McCarthy 1B Joey Votto 2B Robinson Canó OF Mitch Haniger 3B Josh Donaldson OF Adam Frazier OF Mallex Smith SS Jorge Polanco C James McCann",NA,"","",NA
612,774406155,"masterparachutist911",0,71.75,"P Jake Odorizzi P Brandon McCarthy OF George Springer OF Corey Dickerson 2B Ian Happ OF Scott Schebler 3B Evan Longoria 1B Kendrys Morales C J.T. Realmuto SS Nick Ahmed",NA,"","",NA
613,774263993,"tank12345",0,71.6,"P Clayton Richard P Parker Bridwell OF Aaron Judge 3B Jake Lamb 2B Brian Dozier OF Mookie Betts SS Carlos Correa 1B Justin Smoak C Buster Posey OF Hunter Renfroe",NA,"","",NA
614,774197229,"JQ2727 (2/3)",0,71.5,"P Ervin Santana P Clayton Richard OF Charlie Blackmon 1B Logan Morrison OF Michael Conforto 2B Scooter Gennett OF Andrew McCutchen SS Orlando Arcia C Manny Piña 3B David Freese",NA,"","",NA
614,774370094,"mcewenmarc (3/5)",0,71.5,"P Jake Odorizzi P Derek Holland 2B Daniel Murphy OF Corey Dickerson OF Steven Souza Jr. OF Avisaíl García 1B José Abreu SS Elvis Andrus C Russell Martin 3B Matt Davidson",NA,"","",NA
616,774234987,"mattyb78",0,71.45,"P Brandon McCarthy P Mike Montgomery SS Trea Turner 1B Logan Morrison OF Corey Dickerson OF Steven Souza Jr. 2B Ian Happ 3B Travis Shaw C J.T. Realmuto OF Mallex Smith",NA,"","",NA
616,774304741,"gfay63 (3/20)",0,71.45,"P Mike Leake P Zach Davies OF Bryce Harper SS Trea Turner 1B Anthony Rizzo 3B Kris Bryant OF Eric Thames OF Mallex Smith 2B Dustin Pedroia C Evan Gattis",NA,"","",NA
616,774304745,"gfay63 (7/20)",0,71.45,"P Mike Leake P Zach Davies OF Bryce Harper SS Trea Turner 1B Anthony Rizzo 3B Kris Bryant OF Grégor Blanco OF Mallex Smith 2B Dustin Pedroia C Evan Gattis",NA,"","",NA
619,774257037,"marcaas",0,71.4,"P Michael Pineda P Jordan Zimmermann OF Aaron Judge C Gary Sánchez 2B Jason Kipnis 1B Miguel Cabrera OF Mallex Smith 3B Ryon Healy SS Franklin Barreto OF Matt Olson",NA,"","",NA
620,774324647,"StaffordsJohnson (2/2)",0,71.25,"P Ervin Santana P Brandon McCarthy 1B Logan Morrison SS Jean Segura OF Giancarlo Stanton OF Eric Thames 2B Chris Taylor 3B Matt Davidson OF Adam Jones C Salvador Perez",NA,"","",NA
621,774350886,"mink3434",0,71.2,"P Tanner Roark P Francisco Liriano OF Aaron Judge OF Bryce Harper OF Mookie Betts 3B Kris Bryant 1B Matt Adams SS Addison Russell C Salvador Perez 2B Javier Báez",NA,"","",NA
622,774395414,"missjanisjames",0,71.1,"P Jake Odorizzi P Doug Fister 1B Paul Goldschmidt 2B Daniel Murphy SS Trea Turner C Gary Sánchez 3B Anthony Rendon OF Andrew Benintendi OF Khris Davis OF Jaycob Brugman",NA,"","",NA
622,774404510,"mitchyd777",0,71.1,"P Sonny Gray P Julio Teheran OF Aaron Judge SS Carlos Correa OF Brett Gardner 1B Justin Bour 2B Whit Merrifield OF Lorenzo Cain 3B Martín Prado C Yan Gomes",NA,"","",NA
624,774366846,"NYGpete (2/2)",0,70.95,"P Jake Odorizzi P Julio Teheran OF Aaron Judge SS Xander Bogaerts 1B Logan Morrison OF Michael Conforto OF J.D. Martinez C Evan Gattis 2B Rougned Odor 3B Wilmer Flores",NA,"","",NA
624,774377330,"jaygodz",0,70.95,"P Jake Odorizzi P Julio Teheran C Gary Sánchez 3B Justin Turner OF Brett Gardner 1B Matt Adams OF Giancarlo Stanton 2B Brandon Phillips OF Aaron Hicks SS Jordy Mercer",NA,"","",NA
624,774391048,"Kdubb5",0,70.95,"P Mike Leake P Edinson Volquez OF Aaron Judge SS Trea Turner 3B Nolan Arenado 2B Ian Kinsler OF Aaron Hicks 1B Matt Carpenter C Mike Zunino OF Joey Rickard",NA,"","",NA
627,774172189,"Schne91",0,70.9,"P Julio Teheran P Josh Tomlin OF Aaron Judge OF Bryce Harper 2B Daniel Murphy OF Giancarlo Stanton 3B Adrián Béltre 1B Miguel Cabrera C Chris Iannetta SS Brandon Crawford",NA,"","",NA
628,774234751,"redsoxfan865",0,70.85,"P Julio Teheran P Doug Fister SS Xander Bogaerts 3B Jake Lamb C Gary Sánchez 1B Ryan Zimmerman OF Ender Inciarte 2B Scooter Gennett OF Stephen Piscotty OF Andrew McCutchen",NA,"","",NA
628,774247704,"thebobscotch",0,70.85,"P Jordan Zimmermann P Randall Delgado OF Aaron Judge 1B Logan Morrison C Gary Sánchez OF Brett Gardner OF Adam Duvall 2B Brandon Phillips SS Orlando Arcia 3B David Freese",NA,"","",NA
628,774291911,"dumbkopf4",0,70.85,"P Julio Teheran P Doug Fister OF Bryce Harper 2B José Altuve OF George Springer 1B Anthony Rizzo SS Francisco Lindor OF Steven Souza Jr. 3B Josh Donaldson C J.T. Realmuto",NA,"","",NA
631,774235494,"Bigzyw",0,70.65,"P Julio Teheran P Francisco Liriano 2B José Altuve OF Charlie Blackmon OF George Springer 1B Joey Votto SS Francisco Lindor OF Giancarlo Stanton 3B Josh Donaldson C Jonathan Lucroy",NA,"","",NA
632,774269560,"bills58 (2/4)",0,70.6,"P Mike Montgomery P Francisco Liriano OF Aaron Judge SS Xander Bogaerts 2B Brian Dozier OF Corey Dickerson C Yasmani Grandal OF Khris Davis 1B Albert Pujols 3B David Freese",NA,"","",NA
633,774379135,"aforgio",0,70.45,"P Brandon McCarthy P Francisco Liriano OF Bryce Harper 2B Daniel Murphy SS Trea Turner OF Mookie Betts 3B Anthony Rendon OF Mallex Smith 1B Mitch Moreland C Evan Gattis",NA,"","",NA
634,774283380,"declercq12",0,70.4,"P Brandon McCarthy P Randall Delgado OF Aaron Judge SS Trea Turner C Gary Sánchez OF Mookie Betts OF Aaron Hicks 3B Josh Donaldson 1B Hanley Ramirez 2B Dustin Pedroia",NA,"","",NA
635,774279678,"mrtoe71",0,70.25,"P Michael Pineda P Jason Hammel OF Tommy Pham OF Cameron Maybin 3B Evan Longoria OF Adam Jones 2B Kiké Hernández 1B Adam Lind C Salvador Perez SS Alcides Escobar",NA,"","",NA
636,774289495,"corybaker10",0,70.05,"P Mike Montgomery P Zach Davies OF Bryce Harper 2B Daniel Murphy 3B Jake Lamb SS Addison Russell C Buster Posey OF Cameron Maybin OF Kole Calhoun 1B Matt Carpenter",NA,"","",NA
636,774301402,"smitty0007",0,70.05,"P Jason Hammel P Jake Odorizzi 3B Justin Turner OF Carlos Gómez OF Andrew Benintendi SS Elvis Andrus 1B Buster Posey 2B Brandon Drury OF Andrew McCutchen C Salvador Perez",NA,"","",NA
638,774351763,"bryanjwright",0,69.9,"P Jordan Zimmermann P Francisco Liriano OF Aaron Judge 2B Daniel Murphy OF Nelson Cruz OF Stephen Piscotty 3B Evan Longoria 1B Albert Pujols C Salvador Perez SS Javier Báez",NA,"","",NA
639,774161121,"MyThirdEye",0,69.85,"P Mike Leake P Matt Moore 1B Paul Goldschmidt OF Mookie Betts OF Chris Owings 3B Manny Machado OF Andrew Benintendi C Buster Posey 2B Jonathan Schoop SS Nick Ahmed",NA,"","",NA
639,774246771,"padrino1921",0,69.85,"P Brandon McCarthy P Mike Leake OF Aaron Judge SS Trea Turner OF George Springer 3B Kris Bryant C Buster Posey OF Odúbel Herrera 2B Dustin Pedroia 1B Wilmer Flores",NA,"","",NA
641,774299867,"manager1",0,69.65,"P Michael Pineda P Chad Kuhl OF Tommy Pham 1B Justin Bour OF Domingo Santana SS Jean Segura 2B Brandon Phillips 3B Matt Davidson OF Keon Broxton C Salvador Perez",NA,"","",NA
642,774175556,"bovice123",0,69.6,"P Mike Leake P Tanner Roark C Gary Sánchez OF Mookie Betts SS Carlos Correa 2B Ian Kinsler OF Carlos Gómez OF Cameron Maybin 3B Luis Valbuena 1B Matt Carpenter",NA,"","",NA
643,774331461,"fillersabiotch51",0,69.4,"P Ervin Santana P Mike Montgomery 2B Daniel Murphy OF Charlie Blackmon OF Mookie Betts SS Carlos Correa 3B Anthony Rendon C J.T. Realmuto 1B John Hicks OF Matt Olson",NA,"","",NA
644,774251497,"Duckmarks",0,69.3,"P Michael Pineda P Doug Fister OF Charlie Blackmon OF Mookie Betts OF Corey Dickerson 2B Brandon Phillips SS Didi Gregorius 3B Evan Longoria 1B Mitch Moreland C Jesús Sucre",NA,"","",NA
644,774322343,"Chelsea_1",0,69.3,"P Randall Delgado 2B José Ramírez 3B Nolan Arenado OF Charlie Blackmon C Gary Sánchez 1B Edwin Encarnacion SS Francisco Lindor OF Marcell Ozuna OF Hunter Renfroe P Tyler Anderson",NA,"","",NA
646,774205324,"MichiganKevin",0,69.05,"P Jordan Zimmermann P Jason Hammel 2B Daniel Murphy 1B Anthony Rizzo 3B Justin Turner OF Brett Gardner OF Ian Happ C Mike Zunino OF Trey Mancini SS Franklin Barreto",NA,"","",NA
647,774221592,"drcunningham",0,68.95,"P Jake Odorizzi P Julio Teheran 1B Paul Goldschmidt 3B José Ramírez OF Mookie Betts OF Giancarlo Stanton SS Nick Ahmed 2B Dustin Pedroia C Evan Gattis OF Rajai Davis",NA,"","",NA
647,774389803,"Exwallman",0,68.95,"P Jake Odorizzi P Julio Teheran SS Trea Turner 2B Brian Dozier C Gary Sánchez 1B Buster Posey OF José Bautista OF Lorenzo Cain OF Max Kepler 3B Ryon Healy",NA,"","",NA
649,774204690,"SSchus87 (5/5)",0,68.9,"P Jordan Zimmermann OF Bryce Harper 1B Logan Morrison OF Corey Dickerson 3B Kris Bryant 2B Ian Happ OF Giancarlo Stanton SS Nick Ahmed C Miguel Montero P Francis Martes",NA,"","",NA
650,774352688,"bluebluejays",0,68.85001,"P Michael Pineda OF Aaron Judge OF Bryce Harper C Buster Posey 1B Eric Thames OF Byron Buxton 2B José Peraza SS Erick Aybar 3B Wilmer Flores P Tyler Anderson",NA,"","",NA
650,774366409,"dooberdanny",0,68.85,"P Jordan Zimmermann P Randall Delgado OF Aaron Judge SS Trea Turner 1B Joey Votto C Buster Posey 3B Todd Frazier 2B Brandon Phillips OF Billy Hamilton OF Mallex Smith",NA,"","",NA
652,774371262,"acesph59 (3/4)",0,68.7,"P Brandon McCarthy P Josh Tomlin OF Bryce Harper 2B José Ramírez 1B Edwin Encarnacion SS Francisco Lindor C Buster Posey OF Giancarlo Stanton OF Lonnie Chisenhall 3B Ryon Healy",NA,"","",NA
653,774173691,"brasstwo",0,68.6,"P Mike Leake P Tanner Roark 1B Justin Smoak 3B Manny Machado OF Ender Inciarte OF J.D. Martinez 2B Robinson Canó C Yasmani Grandal OF Justin Upton SS Jean Segura",NA,"","",NA
653,774340232,"belanger90",0,68.6,"P Mike Leake P Tanner Roark 1B Paul Goldschmidt SS Carlos Correa OF Chris Owings OF Tommy Pham OF Carlos Beltrán C Buster Posey 3B Jedd Gyorko 2B José Pirela",NA,"","",NA
655,774195012,"scotties24",0,68.45,"P Mike Montgomery P Matt Moore OF Aaron Judge 2B Brian Dozier OF Charlie Blackmon 1B Logan Morrison C Gary Sánchez OF Mookie Betts SS Jorge Polanco 3B David Freese",NA,"","",NA
655,774248936,"brods33",0,68.45,"P Ervin Santana P Julio Teheran OF Aaron Judge 3B Miguel Sanó OF Aaron Hicks SS Eduardo Escobar 1B Matt Carpenter 2B Starlin Castro OF Byron Buxton C Jason Castro",NA,"","",NA
655,774304742,"gfay63 (4/20)",0,68.45,"P Mike Leake P Zach Davies OF Bryce Harper SS Trea Turner 1B Anthony Rizzo OF Grégor Blanco OF Eric Thames 3B Josh Donaldson 2B Dustin Pedroia C Evan Gattis",NA,"","",NA
658,774194580,"SSchus87 (2/5)",0,68.4,"P Michael Pineda P Jordan Zimmermann OF Justin Upton OF Khris Davis OF Andrew McCutchen 1B Josh Bell SS Javier Báez 3B Nicholas Castellanos 2B Taylor Motter C Yan Gomes",NA,"","",NA
659,774350641,"Justin_garcia23",0,68.35001,"P Mike Montgomery SS Trea Turner 2B Brian Dozier C Gary Sánchez 3B Miguel Sanó OF Brett Gardner OF Khris Davis OF Billy Hamilton 1B Ryon Healy P Tyler Anderson",NA,"","",NA
660,774230851,"FreeSince76",0,68.3,"P Michael Pineda P Doug Fister OF Aaron Judge 1B Logan Morrison C Gary Sánchez OF Brett Gardner SS Didi Gregorius OF Aaron Hicks 3B Cheslor Cuthbert 2B Taylor Featherston",NA,"","",NA
660,774273175,"aburd85 (2/3)",0,68.3,"P Brandon McCarthy P Matt Moore 1B Paul Goldschmidt OF Aaron Judge SS Trea Turner C Gary Sánchez OF Khris Davis OF Adam Jones 2B Dustin Pedroia 3B Ryon Healy",NA,"","",NA
662,774382043,"perry04",0,68.25,"P Mike Leake P Rafael Montero 1B Paul Goldschmidt OF Bryce Harper SS Xander Bogaerts OF Mookie Betts 3B Miguel Sanó OF Andrew Benintendi 2B Brandon Drury C Christian Vázquez",NA,"","",NA
663,774357085,"csingle123",0,68.1,"P Michael Pineda P Francisco Liriano 1B Logan Morrison OF Corey Dickerson OF Steven Souza Jr. 3B Evan Longoria OF Brian Goodwin C Salvador Perez 2B Rougned Odor SS Brandon Crawford",NA,"","",NA
664,774239270,"EdoubleU23 (5/20)",0,67.9,"P Jake Odorizzi P Francisco Liriano OF Bryce Harper 2B Daniel Murphy SS Trea Turner OF Khris Davis 1B Adam Lind 3B Ryon Healy OF Rajai Davis C Josh Phegley",NA,"","",NA
665,774211537,"carrieduge02",0,67.85,"P Francisco Liriano P Josh Tomlin OF Aaron Judge OF Bryce Harper 3B José Ramírez 1B Edwin Encarnacion OF Michael Conforto SS Francisco Lindor 2B Jason Kipnis C Yan Gomes",NA,"","",NA
665,774398403,"SoreOnSunday",0,67.85,"P Brandon McCarthy P Mike Leake OF Aaron Judge C Gary Sánchez OF Brett Gardner OF Carlos Gómez 3B Adrián Béltre 2B Whit Merrifield 1B Hanley Ramirez SS Javier Báez",NA,"","",NA
667,774208599,"arfw",0,67.75,"P Jake Odorizzi P Brandon McCarthy 1B Paul Goldschmidt 2B José Altuve SS Carlos Correa OF Nelson Cruz 3B Justin Turner OF Jake Marisnick C Jonathan Lucroy OF Magneuris Sierra",NA,"","",NA
668,774321211,"lineman13",0,67.6,"P Mike Leake P Tanner Roark OF Charlie Blackmon OF Mookie Betts SS Chris Owings OF Brett Gardner 1B Matt Adams C Buster Posey 3B Evan Longoria 2B Chris Taylor",NA,"","",NA
669,774260035,"p00ch2005",0,67.55,"P Randall Delgado OF Aaron Judge SS Trea Turner 3B Nolan Arenado 2B José Altuve OF Mookie Betts OF J.D. Martinez 1B Matt Adams C Kurt Suzuki P Francis Martes",NA,"","",NA
670,774360471,"afairbanks002",0,67.5,"P Julio Teheran P Brandon McCarthy OF Aaron Judge 2B Daniel Murphy C Gary Sánchez 3B Justin Turner OF Kole Calhoun 1B Hanley Ramirez OF Max Kepler SS Franklin Barreto",NA,"","",NA
671,774164334,"jtortona (3/3)",0,67.45,"P Brandon McCarthy P Mike Montgomery 2B Daniel Murphy SS Trea Turner 1B Logan Morrison OF Brett Gardner OF Steven Souza Jr. 3B Evan Longoria OF Mallex Smith C Jesús Sucre",NA,"","",NA
672,774239150,"drheidisousa",0,67.3,"P Jake Odorizzi P Mike Leake 3B José Ramírez OF Mookie Betts 1B José Abreu SS Elvis Andrus OF Mitch Haniger OF Marcell Ozuna C Mike Zunino 2B José Pirela",NA,"","",NA
673,774330651,"crazyjake5 (1/2)",0,67.2,"P Matt Moore 1B Paul Goldschmidt OF Bryce Harper SS Trea Turner C Gary Sánchez OF Mookie Betts OF Khris Davis 2B Alen Hanson 3B Ryon Healy P Tyler Anderson",NA,"","",NA
673,774339481,"crazyjake5 (2/2)",0,67.2,"P Matt Moore 1B Paul Goldschmidt OF Bryce Harper SS Trea Turner C Gary Sánchez OF Mookie Betts OF Khris Davis 2B Alen Hanson 3B Ryon Healy P Tyler Anderson",NA,"","",NA
675,774401792,"bling31king (3/3)",0,67.05,"P Jordan Zimmermann P Jason Hammel OF Aaron Judge 1B Logan Morrison OF Corey Dickerson OF Brett Gardner 3B Josh Harrison C Salvador Perez SS Franklin Barreto 2B Taylor Featherston",NA,"","",NA
676,774323736,"asjm0544",0,66.95,"P Jason Hammel P Doug Fister 3B José Ramírez 2B Brian Dozier 1B Logan Morrison OF Corey Dickerson SS Francisco Lindor OF Steven Souza Jr. OF Scott Schebler C J.T. Realmuto",NA,"","",NA
677,774280075,"tommy94 (3/3)",0,66.9,"P Michael Pineda P Ervin Santana OF Ian Happ OF Andrew Benintendi OF Cameron Maybin 1B Hanley Ramirez 3B Ryon Healy SS Troy Tulowitzki 2B Daniel Robertson C Juan Graterol",NA,"","",NA
678,774213566,"99FoolsandProphets99 (1/2)",0,66.85,"P Brandon McCarthy P Mike Leake OF Aaron Judge OF Bryce Harper SS Trea Turner 2B José Altuve 1B Miguel Cabrera OF Brandon Belt 3B Ryon Healy C Jesús Sucre",NA,"","",NA
678,774223068,"99FoolsandProphets99 (2/2)",0,66.85,"P Brandon McCarthy P Mike Leake OF Aaron Judge OF Bryce Harper SS Trea Turner 2B José Altuve 1B Miguel Cabrera OF Brandon Belt 3B Ryon Healy C Jesús Sucre",NA,"","",NA
678,774291997,"wordsandwich",0,66.85,"P Brandon McCarthy P Mike Leake 1B Paul Goldschmidt OF Bryce Harper C Gary Sánchez OF Mookie Betts 3B Kris Bryant 2B Dustin Pedroia OF Rajai Davis SS Franklin Barreto",NA,"","",NA
681,774396355,"NiceArrowShot (15/20)",0,66.8,"P Jason Hammel P Julio Teheran OF Aaron Judge 1B Edwin Encarnacion SS Carlos Correa OF Matt Kemp OF Brian Goodwin 2B Dustin Pedroia 3B Chase Headley C Jesús Sucre",NA,"","",NA
682,774392913,"ablaha",0,66.5,"P Jake Odorizzi P Derek Holland 2B Daniel Murphy OF Charlie Blackmon 1B Logan Morrison OF Corey Dickerson SS Didi Gregorius 3B Jedd Gyorko C J.T. Realmuto OF Hunter Renfroe",NA,"","",NA
683,774163262,"swilson2006 (5/5)",0,66.4,"P Michael Pineda P Jordan Zimmermann 1B Anthony Rizzo SS Asdrúbal Cabrera OF Lorenzo Cain OF Jay Bruce C Salvador Perez OF Christian Yelich 3B Martín Prado 2B Rougned Odor",NA,"","",NA
683,774278803,"JohnnyGamble",0,66.4,"P Brandon McCarthy P Randall Delgado OF Aaron Judge OF Bryce Harper 2B José Altuve OF Mookie Betts 3B Kris Bryant 1B Hanley Ramirez C Martín Maldonado SS Jorge Polanco",NA,"","",NA
683,774358770,"pd1956",0,66.4,"P Michael Pineda P Jordan Zimmermann 3B Anthony Rendon OF Domingo Santana OF Cameron Maybin OF Giancarlo Stanton 2B Jonathan Schoop 1B Albert Pujols C José Lobatón SS Franklin Barreto",NA,"","",NA
