"Rank","EntryId","EntryName","TimeRemaining","Points","Lineup","X","Player","X.Drafted","FPTS"
450,774214203,"lundy22",0,81.65,"P Julio Teheran P Francisco Liriano OF Aaron Judge 2B Brian Dozier SS Carlos Correa OF Nelson Cruz 3B Kris Bryant OF José Bautista 1B Miguel Cabrera C Christian Vázquez",NA,"","",NA
450,774403322,"namviet",0,81.65,"P Julio Teheran P Mike Montgomery 2B Daniel Murphy C Gary Sánchez OF Andrew Benintendi 1B José Abreu OF Aaron Hicks 3B Evan Longoria OF Kole Calhoun SS Andrelton Simmons",NA,"","",NA
452,774378952,"r.turney",0,81.60001,"P Rafael Montero OF Aaron Judge OF Bryce Harper SS Trea Turner C Gary Sánchez OF Mookie Betts 3B Miguel Sanó 1B Miguel Cabrera 2B Rougned Odor P Tyler Anderson",NA,"","",NA
453,774193840,"washubeek (2/3)",0,81.5,"P Julio Teheran P Matt Moore 1B Paul Goldschmidt 3B Nolan Arenado C Gary Sánchez OF Chris Owings OF Giancarlo Stanton OF Khris Davis SS Nick Ahmed 2B Alen Hanson",NA,"","",NA
453,774354953,"jawjr",0,81.5,"P Jake Odorizzi P Tanner Roark 1B Paul Goldschmidt OF Bryce Harper C Gary Sánchez 3B Anthony Rendon OF Giancarlo Stanton 2B Jason Kipnis SS Tim Anderson OF Ichiro Suzuki",NA,"","",NA
455,774396351,"NiceArrowShot (11/20)",0,81.45,"P Brandon McCarthy P Mike Montgomery OF Aaron Judge 3B José Ramírez SS Xander Bogaerts OF Mookie Betts OF Andrew Benintendi 2B Dustin Pedroia 1B Mitch Moreland C Jesús Sucre",NA,"","",NA
456,774261211,"moswanski",0,81.4,"P Matt Moore P Randall Delgado OF Aaron Judge OF Bryce Harper SS Trea Turner C Gary Sánchez OF Mookie Betts 3B Miguel Sanó 1B Miguel Cabrera 2B Rougned Odor",NA,"","",NA
457,774394081,"Cole_Maz",0,81.3,"P Jake Odorizzi P Mike Leake OF Aaron Judge SS Trea Turner OF Corey Dickerson 3B Justin Turner 1B Joey Votto OF Marcell Ozuna C Salvador Perez 2B Taylor Featherston",NA,"","",NA
458,774359823,"4AaronD",0,81.15,"P Jordan Zimmermann P Josh Tomlin 2B José Ramírez OF Corey Dickerson SS Francisco Lindor OF Avisaíl García 1B José Abreu OF Domingo Santana 3B Travis Shaw C Salvador Perez",NA,"","",NA
459,774298631,"WACK-A-MOLE",0,81.05,"P Sonny Gray P Mike Montgomery 1B Anthony Rizzo 3B Anthony Rendon OF Ian Happ 2B Robinson Canó C Buster Posey OF Aaron Hicks OF Yasiel Puig SS Javier Báez",NA,"","",NA
460,774226843,"kmsneed",0,81,"P Matt Moore P Chad Kuhl OF Aaron Judge SS Xander Bogaerts 1B Logan Morrison C Gary Sánchez OF Mookie Betts OF Brett Gardner 2B Robinson Canó 3B Evan Longoria",NA,"","",NA
460,774236809,"mje1112",0,81,"P Mike Leake P Francisco Liriano 1B Paul Goldschmidt 2B José Altuve OF Mookie Betts OF Chris Owings OF Tommy Pham 3B Travis Shaw SS Javier Báez C Miguel Montero",NA,"","",NA
462,774257508,"barron9",0,80.95,"P Michael Pineda P Brandon McCarthy OF Bryce Harper 2B Daniel Murphy OF Corey Dickerson OF Giancarlo Stanton 1B Brandon Belt 3B Ryon Healy SS Franklin Barreto C Caleb Joseph",NA,"","",NA
463,774133027,"tmc3737",0,80.9,"P Jordan Zimmermann P Mike Montgomery 1B Logan Morrison OF Mookie Betts OF Corey Dickerson 2B Ian Kinsler C Buster Posey 3B Evan Longoria OF Mallex Smith SS Troy Tulowitzki",NA,"","",NA
464,774163332,"tcyoda (2/2)",0,80.8,"P Jason Hammel P Julio Teheran OF Aaron Judge SS Trea Turner OF George Springer 2B Jonathan Schoop OF Adam Jones 3B Kyle Seager C Mike Zunino 1B Wilmer Flores",NA,"","",NA
465,774196939,"smokincc",0,80.75,"P Jason Hammel P Mike Montgomery 2B Daniel Murphy SS Trea Turner 1B Logan Morrison OF Mookie Betts 3B Evan Longoria OF Michael A. Taylor C Manny Piña OF Tyler Austin",NA,"","",NA
465,774340924,"All_in_Allen",0,80.75,"P Jason Hammel OF Bryce Harper 2B José Altuve SS Carlos Correa 3B Anthony Rendon OF Chris Owings OF Carlos Beltrán C Salvador Perez 1B Yuli Gurriel P Francis Martes",NA,"","",NA
467,774346331,"drexelhayes",0,80.4,"P Michael Pineda P Jordan Zimmermann OF Aaron Judge OF Bryce Harper 1B Albert Pujols OF Jorge Bonifacio C Salvador Perez 3B Ryon Healy SS Franklin Barreto 2B Taylor Featherston",NA,"","",NA
468,774263912,"tommy94 (2/3)",0,80.35,"P Sonny Gray P Jake Odorizzi OF Corey Dickerson 1B Matt Adams SS Addison Russell OF Cameron Maybin 2B Brandon Phillips 3B Evan Longoria C J.T. Realmuto OF Mallex Smith",NA,"","",NA
469,774336545,"Birchman11",0,80.1,"P Mike Leake P Clayton Richard SS Xander Bogaerts 1B Anthony Rizzo OF Corey Dickerson OF Adam Duvall OF Andrew Benintendi 3B Evan Longoria 2B Jonathan Schoop C Salvador Perez",NA,"","",NA
470,774171936,"JBH3",0,80,"P Sonny Gray P Randall Delgado 3B José Ramírez SS Xander Bogaerts 1B Logan Morrison OF Mookie Betts OF Brett Gardner C Salvador Perez 2B Dustin Pedroia OF Trey Mancini",NA,"","",NA
470,774267653,"bills58 (1/4)",0,80,"P Mike Leake P Francisco Liriano 2B Daniel Murphy C Gary Sánchez 1B Edwin Encarnacion OF Corey Dickerson 3B Manny Machado OF Justin Upton OF Kole Calhoun SS Jorge Polanco",NA,"","",NA
472,774314319,"Qdawwwg",0,79.95,"P Jake Odorizzi P Julio Teheran 2B Daniel Murphy 3B Nolan Arenado OF Brett Gardner OF Giancarlo Stanton OF Khris Davis SS Nick Ahmed 1B Mitch Moreland C Evan Gattis",NA,"","",NA
472,774353874,"nicko1982 (1/3)",0,79.95,"P Jake Odorizzi P Julio Teheran 1B Logan Morrison OF Corey Dickerson 3B Manny Machado SS Elvis Andrus OF Giancarlo Stanton 2B Jonathan Schoop C Salvador Perez OF Mallex Smith",NA,"","",NA
472,774394825,"FootNasty",0,79.95,"P Michael Pineda P Brandon McCarthy OF Aaron Judge OF Cody Bellinger 1B Eric Thames 3B Josh Donaldson OF Billy Hamilton SS Brandon Crawford C José Lobatón 2B Taylor Featherston",NA,"","",NA
475,774259010,"Praetorian10 (1/9)",0,79.85,"P Brandon McCarthy P Mike Leake 2B José Ramírez 1B Logan Morrison OF George Springer OF Corey Dickerson OF Steven Souza Jr. 3B Evan Longoria SS Jorge Polanco C Christian Vázquez",NA,"","",NA
475,774391128,"Praetorian10 (2/9)",0,79.85,"P Brandon McCarthy P Mike Leake 2B José Ramírez 1B Logan Morrison OF George Springer OF Corey Dickerson OF Steven Souza Jr. 3B Evan Longoria SS Jorge Polanco C Christian Vázquez",NA,"","",NA
475,774391213,"Praetorian10 (3/9)",0,79.85,"P Brandon McCarthy P Mike Leake 2B José Ramírez 1B Logan Morrison OF George Springer OF Corey Dickerson OF Steven Souza Jr. 3B Evan Longoria SS Jorge Polanco C Christian Vázquez",NA,"","",NA
475,774391221,"Praetorian10 (4/9)",0,79.85,"P Brandon McCarthy P Mike Leake 2B José Ramírez 1B Logan Morrison OF George Springer OF Corey Dickerson OF Steven Souza Jr. 3B Evan Longoria SS Jorge Polanco C Christian Vázquez",NA,"","",NA
475,774391233,"Praetorian10 (5/9)",0,79.85,"P Brandon McCarthy P Mike Leake 2B José Ramírez 1B Logan Morrison OF George Springer OF Corey Dickerson OF Steven Souza Jr. 3B Evan Longoria SS Jorge Polanco C Christian Vázquez",NA,"","",NA
475,774391243,"Praetorian10 (6/9)",0,79.85,"P Brandon McCarthy P Mike Leake 2B José Ramírez 1B Logan Morrison OF George Springer OF Corey Dickerson OF Steven Souza Jr. 3B Evan Longoria SS Jorge Polanco C Christian Vázquez",NA,"","",NA
475,774391253,"Praetorian10 (7/9)",0,79.85,"P Brandon McCarthy P Mike Leake 2B José Ramírez 1B Logan Morrison OF George Springer OF Corey Dickerson OF Steven Souza Jr. 3B Evan Longoria SS Jorge Polanco C Christian Vázquez",NA,"","",NA
475,774391277,"Praetorian10 (8/9)",0,79.85,"P Brandon McCarthy P Mike Leake 2B José Ramírez 1B Logan Morrison OF George Springer OF Corey Dickerson OF Steven Souza Jr. 3B Evan Longoria SS Jorge Polanco C Christian Vázquez",NA,"","",NA
475,774391299,"Praetorian10 (9/9)",0,79.85,"P Brandon McCarthy P Mike Leake 2B José Ramírez 1B Logan Morrison OF George Springer OF Corey Dickerson OF Steven Souza Jr. 3B Evan Longoria SS Jorge Polanco C Christian Vázquez",NA,"","",NA
484,774404808,"markbrubeck",0,79.8,"P Ervin Santana P Mike Leake SS Trea Turner OF Corey Dickerson OF Giancarlo Stanton OF Khris Davis 1B Albert Pujols 2B Whit Merrifield C Salvador Perez 3B Ryon Healy",NA,"","",NA
485,774331049,"nancyland",0,79.6,"P Jason Hammel P Brandon McCarthy OF Aaron Judge OF Bryce Harper 2B Ian Happ SS Elvis Andrus OF Khris Davis 1B Hanley Ramirez 3B Ryon Healy C Manny Piña",NA,"","",NA
486,774211657,"chillinfool",0,79.55,"P Mike Montgomery P Randall Delgado OF Aaron Judge 2B Daniel Murphy SS Trea Turner OF Charlie Blackmon 1B Justin Smoak 3B Justin Turner OF Cameron Maybin C Josh Phegley",NA,"","",NA
487,774304747,"gfay63 (9/20)",0,79.45,"P Mike Leake P Zach Davies OF Bryce Harper OF Mookie Betts SS Carlos Correa 1B Anthony Rizzo 3B Kris Bryant OF Aaron Hicks 2B Dustin Pedroia C Evan Gattis",NA,"","",NA
487,774359731,"vincecic",0,79.45,"P Mike Leake P Zach Davies OF Bryce Harper 3B Jake Lamb C Gary Sánchez OF Mookie Betts OF Corey Dickerson 2B Jason Kipnis 1B Matt Carpenter SS Troy Tulowitzki",NA,"","",NA
487,774396359,"NiceArrowShot (19/20)",0,79.45,"P Brandon McCarthy P Mike Montgomery OF Aaron Judge 2B José Ramírez 1B Logan Morrison SS Francisco Lindor 3B Evan Longoria OF Brian Goodwin OF Austin Jackson C Kurt Suzuki",NA,"","",NA
490,774353323,"Clippens",0,79.4,"P Michael Pineda P Jake Odorizzi 1B Paul Goldschmidt OF Jay Bruce C Brian McCann OF Mallex Smith 2B Dustin Pedroia OF Melky Cabrera SS Jordy Mercer 3B Chase Headley",NA,"","",NA
490,774398659,"j0rdantay10r (5/7)",0,79.4,"P Michael Pineda P Jordan Zimmermann 1B Paul Goldschmidt OF Aaron Judge C Gary Sánchez OF Brian Goodwin 3B Ryon Healy SS Franklin Barreto OF Matt Olson 2B Taylor Featherston",NA,"","",NA
492,774201290,"gbohblue",0,79.35,"P Sonny Gray P Jake Odorizzi 3B Nolan Arenado SS Chris Owings OF Grégor Blanco C Buster Posey 2B Joe Panik OF Denard Span 1B Brandon Belt OF Hunter Pence",NA,"","",NA
492,774394082,"Forneyj67",0,79.35,"P Sonny Gray P Jake Odorizzi OF Aaron Judge OF Mookie Betts 1B Justin Smoak 3B Anthony Rendon 2B Ian Happ OF Khris Davis C José Lobatón SS Franklin Barreto",NA,"","",NA
494,774316070,"skins1212",0,79.25,"P Zach Davies P Doug Fister OF Aaron Judge OF Bryce Harper SS Xander Bogaerts 1B Anthony Rizzo OF Corey Dickerson 2B Ian Happ C Buster Posey 3B Kyle Seager",NA,"","",NA
495,774066959,"zbark2 (1/3)",0,79.1,"P Michael Pineda P Mike Montgomery 1B Paul Goldschmidt OF Aaron Judge OF Corey Dickerson OF Mallex Smith 2B Dustin Pedroia 3B Ryon Healy C Josh Phegley SS Franklin Barreto",NA,"","",NA
495,774307735,"cmahon23 (1/2)",0,79.1,"P Michael Pineda P Mike Montgomery 1B Paul Goldschmidt OF Aaron Judge OF Corey Dickerson OF Mallex Smith 2B Dustin Pedroia 3B Ryon Healy C Josh Phegley SS Franklin Barreto",NA,"","",NA
495,774308896,"cmahon23 (2/2)",0,79.1,"P Michael Pineda P Mike Montgomery 1B Paul Goldschmidt OF Aaron Judge OF Corey Dickerson OF Mallex Smith 2B Dustin Pedroia 3B Ryon Healy C Josh Phegley SS Franklin Barreto",NA,"","",NA
495,774335038,"zbark2 (2/3)",0,79.1,"P Michael Pineda P Mike Montgomery 1B Paul Goldschmidt OF Aaron Judge OF Corey Dickerson OF Mallex Smith 2B Dustin Pedroia 3B Ryon Healy C Josh Phegley SS Franklin Barreto",NA,"","",NA
495,774353997,"dboss99ny",0,79.1,"P Michael Pineda P Mike Montgomery OF Aaron Judge 2B Brian Dozier OF Corey Dickerson SS Eric Sogard 3B Travis Shaw 1B Ryon Healy C José Lobatón OF Matt Olson",NA,"","",NA
500,774353862,"bawilliams1218",0,78.9,"P Jordan Zimmermann OF Bryce Harper 2B José Altuve OF George Springer 1B Joey Votto C Willson Contreras SS Eric Sogard 3B Alex Bregman OF Jake Marisnick P Francis Martes",NA,"","",NA
501,774139574,"biggoldengreek (6/10)",0,78.85,"P Francisco Liriano P Josh Tomlin OF Aaron Judge OF Bryce Harper 1B Anthony Rizzo OF Corey Dickerson 3B Kris Bryant 2B Ian Happ SS Addison Russell C Miguel Montero",NA,"","",NA
501,774190627,"losoway718",0,78.85,"P Jordan Zimmermann P Randall Delgado 1B Paul Goldschmidt OF Bryce Harper 3B Jake Lamb SS Carlos Correa C Buster Posey OF Giancarlo Stanton 2B Starlin Castro OF Dwight Smith Jr.",NA,"","",NA
503,774186749,"jhdw12345 (1/3)",0,78.8,"P Doug Fister OF Aaron Judge 2B Daniel Murphy OF Charlie Blackmon 1B Logan Morrison C Gary Sánchez SS Carlos Correa 3B Anthony Rendon OF Marcell Ozuna P Francis Martes",NA,"","",NA
503,774187030,"jhdw12345 (2/3)",0,78.8,"P Doug Fister OF Aaron Judge 2B Daniel Murphy OF Charlie Blackmon 1B Logan Morrison C Gary Sánchez SS Carlos Correa 3B Anthony Rendon OF Marcell Ozuna P Francis Martes",NA,"","",NA
505,774373558,"jwaltzer",0,78.75,"P Jordan Zimmermann P Brandon McCarthy OF Aaron Judge 1B Logan Morrison C Gary Sánchez SS Didi Gregorius 3B Josh Donaldson OF Hunter Pence 2B Rougned Odor OF Mason Williams",NA,"","",NA
506,774145218,"FilthyHunts",0,78.6,"P Mike Leake P Ariel Miranda 1B Paul Goldschmidt SS Trea Turner OF Mookie Betts 3B Justin Turner 2B Ian Kinsler OF Kole Calhoun OF Michael A. Taylor C Salvador Perez",NA,"","",NA
507,774248492,"baller503 (2/2)",0,78.55,"P Edinson Volquez P Francisco Liriano OF Bryce Harper 2B Daniel Murphy SS Trea Turner C Gary Sánchez 3B Manny Machado OF Adam Jones 1B Adam Lind OF Mark Trumbo",NA,"","",NA
507,774406121,"Turtle2355 (3/3)",0,78.55,"P Michael Pineda P Sonny Gray 3B Kris Bryant C Buster Posey 2B Joe Panik OF Denard Span OF Mallex Smith 1B Brandon Belt OF Trey Mancini SS Brandon Crawford",NA,"","",NA
509,774149157,"Caiman",0,78.45,"P Brandon McCarthy P Mike Montgomery OF Aaron Judge OF Bryce Harper SS Trea Turner OF Yoenis Céspedes C Buster Posey 1B Yonder Alonso 2B José Pirela 3B Ryon Healy",NA,"","",NA
509,774232416,"refvet87",0,78.45,"P Jordan Zimmermann P Chad Kuhl OF Bryce Harper 3B José Ramírez SS Carlos Correa OF Corey Dickerson OF Avisaíl García 1B José Abreu C Salvador Perez 2B Ryan Goins",NA,"","",NA
509,774349476,"Trex99",0,78.45,"P Brandon McCarthy P Mike Montgomery OF Bryce Harper 1B Logan Morrison OF Corey Dickerson SS Francisco Lindor C Buster Posey 3B Evan Longoria 2B Jason Kipnis OF Mallex Smith",NA,"","",NA
509,774356511,"ryanpdowns",0,78.45,"P Brandon McCarthy P Francisco Liriano OF Aaron Judge SS Xander Bogaerts C Gary Sánchez 1B Anthony Rizzo 2B Ian Happ OF Andrew Benintendi 3B Chase Headley OF Jon Jay",NA,"","",NA
513,774184789,"tommy94 (1/3)",0,78.4,"P Ariel Miranda P Doug Fister OF Cody Bellinger 3B José Ramírez SS Trea Turner 2B Brian Dozier OF Charlie Blackmon 1B Logan Morrison OF Mookie Betts C J.T. Realmuto",NA,"","",NA
514,774178481,"Pulloutking187",0,78.35,"P Scott Feldman SS Xander Bogaerts OF Mookie Betts 3B Evan Longoria OF José Bautista 1B Hanley Ramirez 2B Rougned Odor OF Shane Peterson C Juan Centeno P Max Scherzer",NA,"","",NA
514,774275710,"Beanitis",0,78.35,"P Sonny Gray P Jake Odorizzi SS Trea Turner 2B Brian Dozier OF Yoenis Céspedes 3B Josh Donaldson OF Marcell Ozuna 1B Adam Lind OF Mallex Smith C Jonathan Lucroy",NA,"","",NA
516,774307797,"JY10",0,78.3,"P Jake Odorizzi P Mike Leake OF George Springer OF J.D. Martinez OF Andrew Benintendi 1B José Abreu SS Didi Gregorius 3B Josh Donaldson 2B Jason Kipnis C J.T. Realmuto",NA,"","",NA
516,774373379,"justhas33 (1/2)",0,78.3,"P Jordan Zimmermann P Mike Leake OF Bryce Harper 1B Logan Morrison 2B Ian Happ OF Cameron Maybin 3B Evan Longoria OF Jay Bruce C Salvador Perez SS Javier Báez",NA,"","",NA
518,774224393,"Tom723",0,78.15,"P Jason Hammel P Mike Leake 2B Daniel Murphy SS Trea Turner OF Andrew Benintendi OF Yoenis Céspedes C Buster Posey OF Khris Davis 3B Travis Shaw 1B Wilmer Flores",NA,"","",NA
519,774101083,"kj628",0,78.10001,"P Michael Pineda OF Aaron Judge 2B Daniel Murphy OF Charlie Blackmon SS Didi Gregorius OF Aaron Hicks 3B Wilmer Flores 1B T.J. Rivera C René Rivera P Francis Martes",NA,"","",NA
520,774234892,"npr40",0,77.95,"P Michael Pineda P Brandon McCarthy OF Aaron Judge OF Bryce Harper 2B José Altuve 3B Josh Donaldson 1B Wilmer Flores SS Brandon Crawford C James McCann OF Matt Olson",NA,"","",NA
520,774355235,"dwitt23",0,77.95,"P Michael Pineda P Matt Moore OF Aaron Judge C Gary Sánchez SS Didi Gregorius OF Delino DeShields 1B Eric Hosmer 2B Dustin Pedroia OF Melky Cabrera 3B Cheslor Cuthbert",NA,"","",NA
522,774245386,"moose1485",0,77.8,"P Francisco Liriano P Doug Fister OF Aaron Judge 3B Nolan Arenado OF Mookie Betts SS Carlos Correa OF Brett Gardner 1B Joey Votto 2B Ian Happ C Buster Posey",NA,"","",NA
523,774362204,"mlb2382",0,77.65,"P Brandon McCarthy P Doug Fister OF Aaron Judge 1B Logan Morrison C Gary Sánchez OF Corey Dickerson 3B Kris Bryant OF Steven Souza Jr. 2B Ian Happ SS Javier Báez",NA,"","",NA
524,774204457,"washubeek (3/3)",0,77.5,"P Julio Teheran P Matt Moore 1B Paul Goldschmidt OF Aaron Judge 3B Nolan Arenado OF Chris Owings OF Khris Davis SS Nick Ahmed C Evan Gattis 2B Alen Hanson",NA,"","",NA
525,774342370,"cmurphy4",0,77.45,"P Sonny Gray P Mike Leake SS Trea Turner OF Mookie Betts 1B Anthony Rizzo 3B Travis Shaw OF Marcell Ozuna 2B Whit Merrifield C Salvador Perez OF Rajai Davis",NA,"","",NA
525,774380431,"Wumcat",0,77.45,"P Ervin Santana P Julio Teheran SS Trea Turner 2B Brian Dozier OF Khris Davis 3B Evan Longoria OF Lorenzo Cain C Salvador Perez OF Mallex Smith 1B Ryon Healy",NA,"","",NA
527,774196250,"UVA_DraftWiz",0,77.4,"P Michael Pineda P Jake Odorizzi SS Carlos Correa 3B Justin Turner OF Jackie Bradley Jr. 1B Matt Carpenter OF Gregory Polanco OF Mallex Smith 2B Daniel Descalso C Josh Phegley",NA,"","",NA
528,774329856,"jarbush (2/2)",0,77.35,"P Sonny Gray P Jordan Zimmermann OF Aaron Judge OF Corey Dickerson 3B Manny Machado SS Eric Sogard 1B Joe Mauer 2B Whit Merrifield C J.T. Realmuto OF Matt Olson",NA,"","",NA
529,774301105,"riemer1",0,77.2,"P Mike Leake P Doug Fister OF Bryce Harper SS Xander Bogaerts C Gary Sánchez 1B Edwin Encarnacion OF Mookie Betts 3B Justin Turner OF Andrew Benintendi 2B Dustin Pedroia",NA,"","",NA
530,774278794,"ssmith3131",0,77.05,"P Brandon McCarthy P Derek Holland OF Aaron Judge 2B José Altuve 1B Logan Morrison OF Corey Dickerson OF Brett Gardner SS Elvis Andrus 3B Maikel Franco C Christian Vázquez",NA,"","",NA
531,774386785,"Ocho88",0,77,"P Mike Leake P Francisco Liriano OF Aaron Judge OF Bryce Harper 3B Justin Turner OF Brett Gardner SS Jean Segura 2B Brandon Phillips 1B Matt Carpenter C Salvador Perez",NA,"","",NA
532,774239283,"EdoubleU23 (18/20)",0,76.75,"P Jake Odorizzi P Matt Moore 1B Paul Goldschmidt OF Aaron Judge C Gary Sánchez SS Chris Owings OF Grégor Blanco 2B Brandon Drury 3B Chase Headley OF Tyler Austin",NA,"","",NA
532,774239959,"darkhonor1",0,76.75,"P Jordan Zimmermann P Brandon McCarthy 2B Daniel Murphy SS Trea Turner 1B Joey Votto OF Steven Souza Jr. OF Scooter Gennett 3B Evan Longoria C Evan Gattis OF Dwight Smith Jr.",NA,"","",NA
532,774336731,"bigslangy20",0,76.75,"P Randall Delgado P Doug Fister OF Aaron Judge 2B Daniel Murphy OF Charlie Blackmon OF Mookie Betts SS Carlos Correa 1B Justin Smoak 3B Kris Bryant C Buster Posey",NA,"","",NA
532,774404795,"Kennethbetz (2/2)",0,76.75,"P Jason Hammel P Francisco Liriano OF Bryce Harper 2B Daniel Murphy SS Trea Turner 1B Matt Adams OF Eric Thames 3B Travis Shaw OF Brian Goodwin C Manny Piña",NA,"","",NA
536,774360485,"theavondon303",0,76.7,"P Ervin Santana P Jordan Zimmermann 1B Logan Morrison OF Corey Dickerson 2B Brandon Phillips 3B Evan Longoria OF Nick Markakis OF Mallex Smith SS Dansby Swanson C Jesús Sucre",NA,"","",NA
537,774153719,"swilson2006 (2/5)",0,76.60001,"P Mike Montgomery 2B José Altuve SS Carlos Correa 1B Anthony Rizzo OF Nelson Cruz OF Corey Dickerson 3B Kris Bryant C Buster Posey OF Lorenzo Cain P Francis Martes",NA,"","",NA
537,774270967,"coolhand9009",0,76.6,"P Mike Leake P Ariel Miranda 1B Paul Goldschmidt OF Cody Bellinger OF Nelson Cruz 3B Kris Bryant 2B Dee Gordon C Buster Posey SS Eric Sogard OF Jake Marisnick",NA,"","",NA
539,774125097,"jawish1963 (1/3)",0,76.5,"P Jordan Zimmermann P Tanner Roark OF Bryce Harper 2B Daniel Murphy 3B Anthony Rendon C Buster Posey SS Didi Gregorius OF Michael A. Taylor OF Brian Goodwin 1B Mitch Moreland",NA,"","",NA
540,774193295,"davidh34 (1/3)",0,76.45,"P Ervin Santana P Scott Feldman OF Aaron Judge SS Xander Bogaerts 3B Anthony Rendon OF Andrew Benintendi C Buster Posey 1B Josh Bell 2B Dustin Pedroia OF Jake Marisnick",NA,"","",NA
540,774193706,"davidh34 (2/3)",0,76.45,"P Ervin Santana P Scott Feldman OF Aaron Judge SS Xander Bogaerts 3B Anthony Rendon OF Andrew Benintendi C Buster Posey 1B Josh Bell 2B Dustin Pedroia OF Jake Marisnick",NA,"","",NA
540,774193716,"davidh34 (3/3)",0,76.45,"P Ervin Santana P Scott Feldman OF Aaron Judge SS Xander Bogaerts 3B Anthony Rendon OF Andrew Benintendi C Buster Posey 1B Josh Bell 2B Dustin Pedroia OF Jake Marisnick",NA,"","",NA
543,774224838,"adreamking",0,76.25,"P Ervin Santana P Brandon McCarthy 3B Jake Lamb OF Charlie Blackmon C Gary Sánchez 1B Joey Votto OF Mitch Haniger 2B José Pirela OF Derek Fisher SS Franklin Barreto",NA,"","",NA
543,774329858,"chunk338",0,76.25,"P Ervin Santana P Brandon McCarthy SS Trea Turner OF Avisaíl García C Buster Posey OF Khris Davis 1B Matt Carpenter 2B Joe Panik OF Denard Span 3B Nicholas Castellanos",NA,"","",NA
545,774357083,"Vinnie13",0,76.05,"P Sonny Gray P Francisco Liriano 1B Edwin Encarnacion OF Mookie Betts OF Corey Dickerson OF Adam Duvall 3B Manny Machado 2B Ian Happ SS Jorge Polanco C Miguel Montero",NA,"","",NA
546,774211886,"VViIIis (2/3)",0,75.95,"P Jake Odorizzi P Julio Teheran OF Bryce Harper C Gary Sánchez OF Mookie Betts SS Francisco Lindor OF Giancarlo Stanton 2B Dustin Pedroia 1B Mitch Moreland 3B Ryon Healy",NA,"","",NA
546,774267482,"toddthetruth (2/3)",0,75.95,"P Mike Leake P Edinson Volquez 2B José Ramírez OF Corey Dickerson 3B Anthony Rendon 1B Joey Votto OF Scott Schebler OF Carlos Gómez SS Elvis Andrus C Evan Gattis",NA,"","",NA
546,774279449,"blainewiles22",0,75.95,"P Jake Odorizzi P Julio Teheran OF Bryce Harper OF George Springer 3B Kris Bryant 2B Robinson Canó OF Giancarlo Stanton 1B Miguel Cabrera C Salvador Perez SS Freddy Galvis",NA,"","",NA
546,774316787,"gmac0427",0,75.95,"P Jake Odorizzi P Julio Teheran OF Bryce Harper SS Trea Turner OF George Springer OF Giancarlo Stanton 3B Josh Donaldson 1B Miguel Cabrera C Jonathan Lucroy 2B Rougned Odor",NA,"","",NA
550,774211326,"VViIIis (1/3)",0,75.9,"P Julio Teheran P Josh Tomlin 1B Paul Goldschmidt OF Aaron Judge C Gary Sánchez OF Brett Gardner OF Giancarlo Stanton SS Didi Gregorius 2B Dustin Pedroia 3B Ryon Healy",NA,"","",NA
550,774267825,"rlecchino",0,75.9,"P Jake Odorizzi P Francisco Liriano OF Bryce Harper 2B Daniel Murphy SS Trea Turner 1B Logan Morrison OF Corey Dickerson 3B Evan Longoria OF Mallex Smith C José Lobatón",NA,"","",NA
552,774400678,"nate_sc4",0,75.85,"P Brandon McCarthy P Mike Leake 2B José Altuve 3B Jake Lamb SS Carlos Correa OF Shin-soo Choo OF Joc Pederson OF Billy Hamilton 1B Albert Pujols C Brian McCann",NA,"","",NA
553,774306639,"lucybreggia",0,75.65,"P Sonny Gray P Tanner Roark 2B Brian Dozier 3B Anthony Rendon SS Jean Segura OF Cameron Maybin 1B Wil Myers OF Christian Yelich OF Trey Mancini C Christian Vázquez",NA,"","",NA
554,774373524,"nas_pphoa",0,75.6,"P Mike Montgomery P Francisco Liriano OF Aaron Judge OF Bryce Harper SS Trea Turner 3B Anthony Rendon 1B Matt Adams OF Cameron Maybin C Mike Zunino 2B José Pirela",NA,"","",NA
555,774269045,"BirdyDukeFan",0,75.25,"P Ervin Santana P Brandon McCarthy OF Aaron Judge SS Trea Turner 3B Anthony Rendon 2B Josh Harrison OF Michael A. Taylor C Mike Zunino 1B Wilmer Flores OF Matt Olson",NA,"","",NA
556,774153412,"thaAMAZNblue",0,74.95,"P Mike Leake P Edinson Volquez OF Aaron Judge OF Bryce Harper 2B Daniel Murphy OF Corey Dickerson 3B Manny Machado 1B Adam Lind SS Jorge Polanco C José Lobatón",NA,"","",NA
556,774249620,"ejlanger22",0,74.95,"P Clayton Richard P Josh Tomlin 1B Paul Goldschmidt 2B José Ramírez OF Corey Dickerson C Yasmani Grandal SS Elvis Andrus OF Cameron Maybin OF Lonnie Chisenhall 3B Evan Longoria",NA,"","",NA
556,774263924,"dven1970",0,74.95,"P Michael Pineda P Matt Moore OF Bryce Harper 2B José Altuve 1B Anthony Rizzo OF Giancarlo Stanton C Salvador Perez OF Mallex Smith 3B Ryon Healy SS Franklin Barreto",NA,"","",NA
556,774334996,"Michaelmo1712",0,74.95,"P Jason Hammel P Doug Fister OF Bryce Harper 2B Daniel Murphy SS Xander Bogaerts 1B Logan Morrison OF Mookie Betts OF Corey Dickerson 3B Travis Shaw C Josh Phegley",NA,"","",NA
560,774260325,"Lennyr119",0,74.9,"P Jordan Zimmermann P Mike Montgomery 1B Paul Goldschmidt 3B José Ramírez OF Ian Happ OF Carlos Gómez C Yasmani Grandal 2B Brandon Phillips OF Michael A. Taylor SS Franklin Barreto",NA,"","",NA
561,774115166,"Ddog121",0,74.8,"P Jason Hammel P Julio Teheran 1B Edwin Encarnacion OF George Springer 3B Justin Turner OF Justin Upton 2B Brandon Phillips OF Aaron Hicks C Salvador Perez SS Jordy Mercer",NA,"","",NA
562,774239003,"nomorestoreii (4/4)",0,74.75,"P Jake Odorizzi P Brandon McCarthy OF Aaron Judge C Gary Sánchez OF Brett Gardner 1B Buster Posey SS Didi Gregorius OF Aaron Hicks 2B Joe Panik 3B Wilmer Flores",NA,"","",NA
562,774253820,"uknate1",0,74.75,"P Jordan Zimmermann P Brandon McCarthy 2B Daniel Murphy SS Trea Turner 1B Joey Votto 3B Adrián Béltre OF Delino DeShields OF Curtis Granderson OF Brian Goodwin C Andrew Knapp",NA,"","",NA
562,774359007,"arocca (1/2)",0,74.75,"P Jake Odorizzi P Matt Moore 1B Paul Goldschmidt OF Bryce Harper 3B Jake Lamb C Gary Sánchez OF Mookie Betts OF Khris Davis 2B Dustin Pedroia SS Franklin Barreto",NA,"","",NA
562,774359050,"arocca (2/2)",0,74.75,"P Jake Odorizzi P Matt Moore 1B Paul Goldschmidt OF Bryce Harper 3B Jake Lamb C Gary Sánchez OF Mookie Betts OF Khris Davis 2B Dustin Pedroia SS Franklin Barreto",NA,"","",NA
566,774171381,"oz10w",0,74.6,"P Mike Leake P Tanner Roark 1B Cody Bellinger SS Xander Bogaerts OF J.D. Martinez 2B Ian Happ C Buster Posey OF Eric Thames 3B Jedd Gyorko OF Yasiel Puig",NA,"","",NA
567,774176193,"mrussell1982 (1/2)",0,74.45,"P Brandon McCarthy P Francisco Liriano 1B Paul Goldschmidt OF Aaron Judge C Gary Sánchez OF Mookie Betts 3B Kris Bryant OF Aaron Hicks 2B Dustin Pedroia SS Franklin Barreto",NA,"","",NA
