"Rank","EntryId","EntryName","TimeRemaining","Points","Lineup","X","Player","X.Drafted","FPTS"
220,774272183,"nickt34",0,100.35,"P Ervin Santana P Randall Delgado 1B Paul Goldschmidt SS Xander Bogaerts OF Brett Gardner OF Giancarlo Stanton 3B Travis Shaw C J.T. Realmuto 2B Starlin Castro OF Mallex Smith",NA,"Ronald Torreyes","0.57%",14
220,774276133,"sjmfire",0,100.35,"P Sonny Gray P Jake Odorizzi 1B Logan Morrison OF Corey Dickerson OF Steven Souza Jr. 2B Robinson Canó 3B Evan Longoria SS Nick Ahmed OF Mallex Smith C Manny Piña",NA,"Mark Trumbo","0.57%",2
222,774265973,"freshdad",0,100.2,"P Mike Montgomery P Ariel Miranda OF Aaron Judge OF Bryce Harper 3B José Ramírez 1B Justin Smoak OF Adam Duvall SS Jean Segura 2B DJ LeMahieu C Miguel Montero",NA,"Dwight Smith Jr.","0.57%",0
222,774365211,"Mhs7117",0,100.2,"P Sonny Gray P Jason Hammel OF Bryce Harper OF Brett Gardner OF Giancarlo Stanton 3B Evan Longoria 2B Jason Kipnis 1B Albert Pujols SS Andrelton Simmons C Manny Piña",NA,"Keon Broxton","0.57%",31
224,774312319,"JabbyBurns",0,100.15,"P Tanner Roark P Randall Delgado OF Aaron Judge OF Bryce Harper OF Charlie Blackmon SS Carlos Correa 1B Anthony Rizzo 2B Josh Harrison 3B Evan Longoria C Austin Barnes",NA,"Aaron Altherr","0.57%",14
225,774206580,"dong1960",0,100.1,"P Michael Pineda OF Aaron Judge C Gary Sánchez OF George Springer 3B Josh Donaldson OF Odúbel Herrera 1B Ryon Healy 2B Ryan Goins SS Adam Rosales P Francis Martes",NA,"Alex Bregman","0.57%",12
225,774252194,"awsumwmr",0,100.1,"P Michael Pineda P Francisco Liriano OF Adam Duvall 1B Joey Votto OF Carlos Gómez OF Justin Upton 2B Scooter Gennett 3B Josh Harrison SS Jordy Mercer C Caleb Joseph",NA,"Trevor Plouffe","0.57%",5
227,774377457,"robbyair",0,100.05,"P Mike Leake P Scott Feldman OF Aaron Judge OF Bryce Harper 3B Miguel Sanó 1B Joey Votto SS Jean Segura 2B Scooter Gennett OF Marcell Ozuna C J.T. Realmuto",NA,"Joey Rickard","0.57%",9
227,774394595,"matrixs44 (2/2)",0,100.05,"P Sonny Gray P Francisco Liriano SS Xander Bogaerts 1B Logan Morrison C Gary Sánchez OF Mookie Betts OF Corey Dickerson 3B Josh Donaldson OF Mallex Smith 2B Taylor Featherston",NA,"Kevin Pillar","0.45%",17
229,774193343,"FLThunder70 (1/2)",0,99.9,"P Jake Odorizzi P Francisco Liriano OF Aaron Judge C Gary Sánchez 3B Kris Bryant SS Francisco Lindor OF Khris Davis OF Aaron Hicks 2B José Pirela 1B Mitch Moreland",NA,"Ryan Zimmerman","0.45%",0
229,774404779,"AdinioVirus",0,99.9,"P Jake Odorizzi P Mike Montgomery OF Bryce Harper SS Trea Turner 1B Logan Morrison OF Corey Dickerson 3B Evan Longoria 2B Eric Sogard OF Mallex Smith C Jason Castro",NA,"Randal Grichuk","0.45%",19
231,774217189,"dreday7",0,99.75,"P Edinson Volquez P Doug Fister 1B Paul Goldschmidt OF Aaron Judge 2B Daniel Murphy SS Trea Turner 3B Justin Turner OF Giancarlo Stanton OF Marcell Ozuna C J.T. Realmuto",NA,"Martín Prado","0.45%",9
232,774192253,"jdub1012",0,99.65,"P Ervin Santana P Rafael Montero OF Bryce Harper 2B Daniel Murphy 3B Justin Turner C Yasmani Grandal 1B Matt Adams OF Cameron Maybin OF Khris Davis SS Dansby Swanson",NA,"Dexter Fowler","0.45%",0
233,774209563,"Johnrenaurd",0,99.6,"P Ervin Santana P Doug Fister OF Aaron Judge OF Bryce Harper SS Xander Bogaerts 1B Joey Votto OF Steven Souza Jr. 2B Ian Happ 3B Evan Longoria C José Lobatón",NA,"Kiké Hernández","0.45%",18
234,774203507,"FLThunder70 (2/2)",0,99.2,"P Tanner Roark P Francisco Liriano 1B Paul Goldschmidt OF Aaron Judge OF Bryce Harper SS Trea Turner C Gary Sánchez OF Aaron Hicks 3B Ryon Healy 2B Taylor Featherston",NA,"Hunter Pence","0.45%",8
235,774188175,"fifthstreet",0,99.15,"P Jason Hammel P Mike Leake 1B Logan Morrison C Gary Sánchez OF Corey Dickerson OF Steven Souza Jr. 3B Evan Longoria SS Asdrúbal Cabrera 2B Joe Panik OF Mallex Smith",NA,"Ryan Goins","0.45%",5
236,774241426,"DRAT",0,99,"P Sonny Gray P Edinson Volquez 1B Paul Goldschmidt 2B Daniel Murphy 3B José Ramírez OF Carlos Gómez OF Marcell Ozuna OF Michael A. Taylor C Mike Zunino SS Franklin Barreto",NA,"Paul DeJong","0.45%",7
237,774063928,"dgoldy024024",0,98.9,"P Jordan Zimmermann P Mike Montgomery OF Aaron Judge SS Trea Turner 2B Ian Happ 3B Travis Shaw OF Michael A. Taylor 1B Matt Carpenter OF Brian Goodwin C Miguel Montero",NA,"Greg Garcia","0.45%",7
237,774356618,"betmguerra (2/2)",0,98.9,"P Jake Odorizzi OF Aaron Judge 3B Jake Lamb C Gary Sánchez 1B Edwin Encarnacion OF Shin-soo Choo 2B Jonathan Schoop SS Andrelton Simmons OF Byron Buxton P Francis Martes",NA,"Aledmys Díaz","0.45%",7
239,774214345,"rpb1220",0,98.85,"P Jordan Zimmermann P Randall Delgado 1B Paul Goldschmidt 2B José Altuve OF George Springer OF Chris Owings OF Grégor Blanco 3B Evan Longoria SS Nick Ahmed C James McCann",NA,"Eddie Rosario","0.45%",24
240,774070070,"jmc44",0,98.8,"P Jordan Zimmermann P Parker Bridwell OF Cody Bellinger OF Bryce Harper 3B Nolan Arenado OF Charlie Blackmon 2B Robinson Canó SS Addison Russell 1B Buster Posey C Tony Wolters",NA,"Byron Buxton","0.45%",2
241,774396348,"NiceArrowShot (8/20)",0,98.75,"P Jason Hammel P Mike Montgomery OF Aaron Judge 1B Edwin Encarnacion OF Mookie Betts SS Carlos Correa OF Matt Kemp 3B Evan Longoria 2B Logan Forsythe C Josh Phegley",NA,"José Peraza","0.45%",5
242,774196771,"ToonarmyDan",0,98.65,"P Mike Montgomery P Scott Feldman OF Mookie Betts 3B Miguel Sanó OF Corey Dickerson OF Carlos Gómez SS Elvis Andrus 1B Buster Posey 2B Jonathan Schoop C Russell Martin",NA,"Tucker Barnhart","0.45%",12
243,774262590,"packmanmatt",0,98.45,"P Brandon McCarthy P Francisco Liriano 1B Paul Goldschmidt OF Aaron Judge C Gary Sánchez OF Mookie Betts 3B Kris Bryant OF José Bautista 2B Dustin Pedroia SS Franklin Barreto",NA,"Taylor Motter","0.34%",9
243,774304752,"gfay63 (14/20)",0,98.45,"P Mike Leake P Zach Davies OF Bryce Harper OF George Springer SS Carlos Correa 1B Anthony Rizzo 3B Kris Bryant C Russell Martin OF Mallex Smith 2B Dustin Pedroia",NA,"Willson Contreras","0.34%",11
245,774234907,"Rocketx",0,98.4,"P Brandon McCarthy P Randall Delgado 2B Daniel Murphy C Gary Sánchez OF George Springer SS Carlos Correa OF Brett Gardner OF Aaron Hicks 3B Evan Longoria 1B Adam Lind",NA,"T.J. Rivera","0.34%",6
246,774176776,"Denicolacod",0,98.3,"P Brandon McCarthy P Matt Moore OF Cody Bellinger 2B José Altuve OF George Springer SS Chris Owings 3B Justin Turner OF Andrew Benintendi 1B Matt Carpenter C Devin Mesoraco",NA,"René Rivera","0.34%",30
246,774233220,"mlowe129",0,98.3,"P Michael Pineda P Doug Fister OF Aaron Judge OF Steven Souza Jr. OF José Bautista 2B Jonathan Schoop SS Asdrúbal Cabrera 1B Hanley Ramirez C Mike Zunino 3B David Freese",NA,"Mike Moustakas","0.34%",0
248,774270392,"boston_mike83",0,98.25,"P Ervin Santana P Brandon McCarthy 1B Edwin Encarnacion OF George Springer OF Justin Upton OF Aaron Hicks 3B Evan Longoria C Salvador Perez SS Javier Báez 2B Rougned Odor",NA,"Jorge Bonifacio","0.34%",21
248,774379543,"blueshoes",0,98.25,"P Mike Leake P Rafael Montero 1B Paul Goldschmidt SS Trea Turner 2B José Altuve OF George Springer OF Corey Dickerson 3B Justin Turner C Buster Posey OF Austin Slater",NA,"Adam Frazier","0.34%",14
250,774268438,"rwasil44",0,98.1,"P Mike Leake P Clayton Richard OF Aaron Judge OF Bryce Harper 2B José Altuve 3B Jake Lamb 1B Wil Myers OF Mallex Smith C Evan Gattis SS Taylor Motter",NA,"Daniel Robertson","0.34%",10
251,774214570,"Lnichols",0,98,"P Sonny Gray P Edinson Volquez SS Carlos Correa 1B Anthony Rizzo OF Brett Gardner C Buster Posey 3B Todd Frazier OF Adam Frazier 2B Whit Merrifield OF Melky Cabrera",NA,"Cheslor Cuthbert","0.34%",2
251,774285601,"rubes1 (2/2)",0,98,"P Mike Leake P Mike Montgomery C Gary Sánchez OF George Springer 1B Anthony Rizzo OF Brett Gardner OF Carlos Gómez SS Elvis Andrus 3B Evan Longoria 2B Dustin Pedroia",NA,"Nick Martínez","0.34%",9.05
251,774405198,"etramm",0,98,"P Mike Leake OF Aaron Judge 2B José Altuve C Gary Sánchez 3B Manny Machado SS Elvis Andrus OF Khris Davis OF Marcell Ozuna 1B Mark Reynolds P Francis Martes",NA,"Joe Mauer","0.34%",8
254,774208690,"soccerusa20",0,97.9,"P Jordan Zimmermann P Francisco Liriano OF Aaron Judge OF Cody Bellinger OF Andrew Benintendi 1B Matt Adams SS Addison Russell 3B Josh Donaldson C Mike Zunino 2B Rougned Odor",NA,"Jaycob Brugman","0.34%",0
254,774326201,"jarbush (1/2)",0,97.9,"P Sonny Gray P Matt Moore C Gary Sánchez 3B Miguel Sanó OF Corey Dickerson 1B Justin Bour OF Eric Thames 2B Jonathan Schoop SS Eric Sogard OF Brian Goodwin",NA,"Drew Robinson","0.34%",19
256,774349610,"davebla",0,97.85,"P Mike Leake P Matt Moore OF Bryce Harper 2B Daniel Murphy C Gary Sánchez OF George Springer SS Francisco Lindor 3B Evan Longoria 1B Adam Lind OF Mallex Smith",NA,"John Jaso","0.34%",8
257,774396804,"jhdw12345 (3/3)",0,97.8,"P Doug Fister OF Aaron Judge 2B Daniel Murphy OF Charlie Blackmon 1B Logan Morrison C Gary Sánchez OF George Springer SS Carlos Correa 3B Ryon Healy P Francis Martes",NA,"Tim Anderson","0.34%",0
258,774286387,"wprockhead (1/2)",0,97.7,"P Brandon McCarthy P Rafael Montero 1B Paul Goldschmidt SS Trea Turner C Gary Sánchez OF Mookie Betts OF Giancarlo Stanton 3B Evan Longoria OF Marcell Ozuna 2B Jason Kipnis",NA,"Ichiro Suzuki","0.34%",2
259,774152801,"jkosh74 (1/2)",0,97.65,"P Brandon McCarthy P Doug Fister OF Aaron Judge OF Bryce Harper 2B José Altuve SS Carlos Correa 1B Anthony Rizzo C Buster Posey OF Giancarlo Stanton 3B Ryon Healy",NA,"Ben Gamel","0.23%",0
260,774378328,"RadioBren",0,97.6,"P Jason Hammel P Matt Moore OF Aaron Judge 2B José Ramírez C Gary Sánchez 3B Kris Bryant OF Brett Gardner 1B Buster Posey OF Hunter Pence SS Ronald Torreyes",NA,"Yonder Alonso","0.23%",10
261,774342924,"mike4pros",0,97.45,"P Brandon McCarthy 1B Paul Goldschmidt OF Cody Bellinger 2B Daniel Murphy OF George Springer 3B Justin Turner OF Mark Trumbo C Austin Barnes SS Jorge Polanco P Francis Martes",NA,"Christian Yelich","0.23%",0
261,774304750,"gfay63 (12/20)",0,97.45,"P Mike Leake P Zach Davies OF Bryce Harper OF George Springer SS Carlos Correa 1B Anthony Rizzo 3B Kris Bryant OF Aaron Hicks 2B Dustin Pedroia C Evan Gattis",NA,"Chris Iannetta","0.23%",0
261,774304757,"gfay63 (19/20)",0,97.45,"P Mike Leake P Zach Davies OF Bryce Harper OF George Springer SS Carlos Correa 1B Anthony Rizzo C Buster Posey 3B Josh Donaldson OF Mallex Smith 2B Dustin Pedroia",NA,"Juan Centeno","0.23%",0
264,774290735,"wprockhead (2/2)",0,97.35,"P Michael Pineda P Rafael Montero SS Trea Turner OF Mookie Betts OF Giancarlo Stanton 3B Evan Longoria OF Marcell Ozuna 2B Starlin Castro 1B Mitch Moreland C Evan Gattis",NA,"Jeff Mathis","0.23%",5
264,774333129,"gilgarz",0,97.35,"P Michael Pineda P Rafael Montero SS Trea Turner OF Mookie Betts OF Giancarlo Stanton 3B Evan Longoria OF Marcell Ozuna 2B Starlin Castro 1B Mitch Moreland C Evan Gattis",NA,"Welington Castillo","0.23%",0
266,774113306,"broncoron48 (1/2)",0,97.3,"P Edinson Volquez OF Aaron Judge 3B Nolan Arenado OF Charlie Blackmon C Gary Sánchez SS Didi Gregorius 1B Mark Reynolds OF Ian Desmond 2B DJ LeMahieu P Tyler Anderson",NA,"Matt Holliday","0.23%",0
266,774113324,"broncoron48 (2/2)",0,97.3,"P Edinson Volquez OF Aaron Judge 3B Nolan Arenado OF Charlie Blackmon C Gary Sánchez SS Didi Gregorius 1B Mark Reynolds OF Ian Desmond 2B DJ LeMahieu P Tyler Anderson",NA,"Tommy Joseph","0.23%",0
268,774385974,"matrixs44 (1/2)",0,97.1,"P Jordan Zimmermann P Doug Fister OF Aaron Judge OF Bryce Harper C Gary Sánchez 1B Joey Votto SS Francisco Lindor 3B Travis Shaw 2B Jason Kipnis OF Austin Jackson",NA,"Yuli Gurriel","0.23%",16
269,774388980,"RobFTW2014 (2/2)",0,97.05,"P Brandon McCarthy P Tanner Roark 2B José Altuve 1B Logan Morrison OF George Springer SS Carlos Correa OF Carlos Beltrán 3B Evan Longoria OF Mallex Smith C Evan Gattis",NA,"Dee Gordon","0.23%",0
270,774309976,"gset21",0,97,"P Mike Leake P Francisco Liriano 2B José Ramírez C Gary Sánchez 1B Anthony Rizzo OF Yoenis Céspedes OF Justin Upton SS Jean Segura OF Andrew McCutchen 3B Evan Longoria",NA,"Tyler Flowers","0.23%",0
270,774321923,"redman81",0,97,"P Mike Leake P Mike Montgomery 1B Logan Morrison OF Corey Dickerson 3B Justin Turner C Yasmani Grandal 2B Scooter Gennett OF Khris Davis OF Eric Thames SS Eric Sogard",NA,"Juan Graterol","0.23%",5
272,774255430,"redbirdss",0,96.95,"P Mike Leake P Edinson Volquez 2B Daniel Murphy 1B Logan Morrison OF George Springer SS Carlos Correa OF Steven Souza Jr. OF Justin Upton 3B Evan Longoria C Omar Narváez",NA,"Delino DeShields","0.23%",11
272,774402133,"mgmahoney",0,96.95,"P Ervin Santana P Chad Kuhl 1B Paul Goldschmidt OF Cody Bellinger OF Mookie Betts 3B Miguel Sanó SS Jean Segura 2B Dustin Pedroia OF Hunter Renfroe C Jonathan Lucroy",NA,"Andrew Knapp","0.23%",6
274,774383249,"luetz11",0,96.85,"P Jordan Zimmermann P Edinson Volquez 1B Cody Bellinger 2B Daniel Murphy C Yasmani Grandal OF Cameron Maybin OF Giancarlo Stanton OF Andrew McCutchen 3B Evan Longoria SS Freddy Galvis",NA,"Omar Narváez","0.23%",0
275,774272219,"whipple81",0,96.6,"P Mike Montgomery P Francisco Liriano OF Bryce Harper 2B José Ramírez SS Trea Turner 1B Edwin Encarnacion OF Justin Upton 3B Evan Longoria OF Adam Jones C Mike Zunino",NA,"Mike Napoli","0.23%",0
276,774251009,"rexa (1/2)",0,96.5,"P Julio Teheran P Brandon McCarthy OF Aaron Judge OF Cody Bellinger 2B José Ramírez 3B Justin Turner OF Lorenzo Cain C Salvador Perez 1B Eric Hosmer SS Alcides Escobar",NA,"Jarrod Dyson","0.23%",8
277,774074084,"Croooone",0,96.45,"P Sonny Gray P Mike Leake OF Aaron Judge OF Brett Gardner 1B Matt Adams OF Justin Upton C Willson Contreras 3B Kyle Seager 2B DJ LeMahieu SS Javier Báez",NA,"Kendrys Morales","0.23%",2
278,774283517,"Marino420TDs",0,96.2,"P Sonny Gray P Jason Hammel OF Aaron Judge 1B Logan Morrison OF Justin Upton 2B Brandon Phillips OF Lorenzo Cain C Salvador Perez SS Jordy Mercer 3B David Freese",NA,"Jon Jay","0.23%",5
279,774175232,"cd_steelers (1/2)",0,96.1,"P Randall Delgado P Chad Kuhl 1B Paul Goldschmidt OF Aaron Judge OF Bryce Harper 2B Daniel Murphy SS Carlos Correa 3B Anthony Rendon C Salvador Perez OF Mallex Smith",NA,"Ramón Torres","0.23%",3
280,774371080,"richivry",0,96.05,"P Jason Hammel P Jake Odorizzi OF Bryce Harper C Gary Sánchez SS Chris Owings 3B Luis Valbuena OF Jackie Bradley Jr. 1B Joe Mauer OF Odúbel Herrera 2B Dustin Pedroia",NA,"Norichika Aoki","0.23%",0
281,774206947,"myellon19",0,95.9,"P Sonny Gray P Matt Moore OF Bryce Harper 2B Ian Kinsler SS Francisco Lindor 1B Matt Adams OF Stephen Piscotty 3B Adrián Béltre C Russell Martin OF Lorenzo Cain",NA,"John Hicks","0.23%",0
282,774276808,"toddthetruth (3/3)",0,95.85,"P Brandon McCarthy P Mike Leake OF Cody Bellinger C Gary Sánchez 1B Anthony Rizzo OF Aaron Hicks OF Eric Thames 3B Travis Shaw 2B Dustin Pedroia SS Aledmys Díaz",NA,"Dixon Machado","0.11%",0
283,774160002,"LockandLoad26",0,95.60001,"P Rafael Montero OF Aaron Judge SS Trea Turner 3B Nolan Arenado C Gary Sánchez OF Mookie Betts OF Shin-soo Choo 1B Miguel Cabrera 2B Rougned Odor P Tyler Anderson",NA,"Matt den Dekker","0.11%",0
284,774396349,"NiceArrowShot (9/20)",0,95.55,"P Edinson Volquez P Francisco Liriano 1B Paul Goldschmidt 2B José Ramírez OF Mookie Betts SS Carlos Correa OF Steven Souza Jr. OF Grégor Blanco 3B Evan Longoria C Jesús Sucre",NA,"Tony Wolters","0.11%",5
285,774185124,"cd_steelers (2/2)",0,95.5,"P Edinson Volquez P Randall Delgado 2B Daniel Murphy SS Trea Turner 1B Logan Morrison C Gary Sánchez OF Corey Dickerson OF Steven Souza Jr. 3B Evan Longoria OF Mallex Smith",NA,"Travis d'Arnaud","0.11%",0
286,774304754,"gfay63 (16/20)",0,95.45,"P Mike Leake P Zach Davies OF Bryce Harper OF George Springer SS Carlos Correa 1B Anthony Rizzo OF Grégor Blanco 3B Josh Donaldson C Russell Martin 2B Dustin Pedroia",NA,"Jaff Decker","0.11%",0
287,774335933,"bigggblooo",0,95.3,"P Jordan Zimmermann P Mike Leake OF Bryce Harper 2B Daniel Murphy 3B Nolan Arenado C Gary Sánchez OF Brian Goodwin OF Mallex Smith 1B Mitch Moreland SS Franklin Barreto",NA,"Devin Mesoraco","0.11%",0
287,774390034,"mcewenmarc (5/5)",0,95.3,"P Sonny Gray P Josh Tomlin 3B José Ramírez 2B José Altuve SS Francisco Lindor OF Giancarlo Stanton OF Lonnie Chisenhall 1B Carlos Santana OF Marcell Ozuna C J.T. Realmuto",NA,"Shane Peterson","0.11%",0
289,774059574,"CAKSEER",0,95.25,"P Ervin Santana P Brandon McCarthy OF Aaron Judge 1B Logan Morrison C Gary Sánchez OF Corey Dickerson 2B Brandon Phillips 3B Evan Longoria SS Alcides Escobar OF Matt Olson",NA,"Max Scherzer","0.11%",0
290,774123367,"Markcohen77 (2/2)",0,95.2,"P Ariel Miranda OF Aaron Judge OF Cody Bellinger 1B Anthony Rizzo 3B Anthony Rendon 2B Ian Happ C Buster Posey OF Giancarlo Stanton SS Andrelton Simmons P Francis Martes",NA,"Derek Norris","0.11%",0
291,774361704,"stros56 (2/2)",0,95.1,"P Michael Pineda P Mike Montgomery 2B Scooter Gennett OF Eric Thames 3B Travis Shaw OF Kole Calhoun 1B Miguel Cabrera SS Nick Ahmed C Salvador Perez OF Denard Span",NA,"Pat Valaika","0.11%",0
292,774339610,"mwm323",0,94.9,"P Michael Pineda P Ervin Santana C Gary Sánchez OF Jackie Bradley Jr. 2B Whit Merrifield OF Brandon Belt 1B Trey Mancini SS Jorge Polanco 3B Chase Headley OF Mason Williams",NA,"Gregory Polanco","0.11%",0
293,774141018,"kittenfan",0,94.85,"P Brandon McCarthy P Mike Leake OF Cody Bellinger OF Bryce Harper SS Chris Owings OF Cameron Maybin 3B Josh Donaldson 1B Mark Reynolds C Salvador Perez 2B José Pirela",NA,"Jett Bandy","0.11%",0
294,774112388,"Cdaddy1981",0,94.7,"P Jason Hammel P Edinson Volquez OF Aaron Judge OF Bryce Harper 3B Nolan Arenado 1B Joey Votto OF Justin Upton 2B Whit Merrifield C Salvador Perez SS Alcides Escobar",NA,"Elias Díaz","0.11%",12
295,774085149,"PETERFT73",0,94.6,"P Julio Teheran P Randall Delgado SS Xander Bogaerts C Gary Sánchez OF Corey Dickerson OF Stephen Piscotty OF Khris Davis 3B Evan Longoria 2B Chris Taylor 1B Matt Carpenter",NA,"Magneuris Sierra","0.11%",0
296,774263708,"Fat_Man",0,94.45,"P Sonny Gray P Mike Leake OF Bryce Harper 3B José Ramírez OF Corey Dickerson 1B Joey Votto 2B Whit Merrifield C Brian McCann OF Kevin Pillar SS Brandon Crawford",NA,"Derek Fisher","0.11%",0
296,774304746,"gfay63 (8/20)",0,94.45,"P Mike Leake P Zach Davies OF Bryce Harper 2B José Altuve SS Carlos Correa 1B Anthony Rizzo 3B Kris Bryant OF Grégor Blanco OF Mallex Smith C Evan Gattis",NA,"Tim Beckham","0.11%",0
296,774304751,"gfay63 (13/20)",0,94.45,"P Mike Leake P Zach Davies OF Bryce Harper OF George Springer SS Carlos Correa 1B Anthony Rizzo 3B Kris Bryant OF Eric Thames 2B Dustin Pedroia C Evan Gattis",NA,"Alex Avila","0.11%",3
296,774395078,"patrickvshenry",0,94.45,"P Brandon McCarthy P Francisco Liriano OF Aaron Judge OF Cody Bellinger C Gary Sánchez OF Cameron Maybin 2B Brandon Phillips 3B Josh Donaldson 1B Albert Pujols SS Dansby Swanson",NA,"Martín Maldonado","0.11%",0
300,774151734,"zech68",0,94.4,"P Brandon McCarthy P Randall Delgado OF Aaron Judge OF Cody Bellinger 3B Justin Turner OF Brett Gardner C Yasmani Grandal 1B Matt Adams SS Andrelton Simmons 2B Whit Merrifield",NA,"Sandy Leon","0.11%",0
300,774394091,"mikeyjimenez",0,94.4,"P Ervin Santana P Francisco Liriano OF Bryce Harper SS Trea Turner 1B Logan Morrison 3B Miguel Sanó OF Corey Dickerson 2B Eric Sogard OF Ichiro Suzuki C Caleb Joseph",NA,"Howie Kendrick","0.11%",5
302,774298465,"byoungjr",0,94.1,"P Jake Odorizzi P Doug Fister OF Aaron Judge C Gary Sánchez 1B Anthony Rizzo OF Brett Gardner 2B Ian Happ SS Elvis Andrus OF Aaron Hicks 3B Adrián Béltre",NA,"Carlos Asuaje","0.11%",0
302,774324785,"dsa1771",0,94.1,"P Jake Odorizzi P Doug Fister OF Aaron Judge 2B Daniel Murphy SS Xander Bogaerts 1B Logan Morrison OF Carlos Gómez OF Justin Upton 3B Evan Longoria C Evan Gattis",NA,"Danny Santana","0.11%",0
304,774366829,"NYGpete (1/2)",0,93.95,"P Jake Odorizzi P Julio Teheran OF Aaron Judge C Gary Sánchez OF Corey Dickerson 1B Joey Votto SS Jean Segura OF Jay Bruce 2B Rougned Odor 3B Wilmer Flores",NA,"Deven Marrero","0.11%",0
305,774335844,"betmguerra (1/2)",0,93.9,"P Jake Odorizzi SS Trea Turner C Gary Sánchez OF George Springer OF Giancarlo Stanton OF Khris Davis 3B Josh Donaldson 2B Whit Merrifield 1B Ryon Healy P Francis Martes",NA,"Erick Aybar","0.11%",21
306,774195704,"phillythugs",0,93.85,"P Francisco Liriano P Josh Tomlin OF Aaron Judge OF Bryce Harper 2B Daniel Murphy C Gary Sánchez OF Aaron Hicks 1B Eric Thames 3B Evan Longoria SS Dansby Swanson",NA,"Bradley Zimmer","0.11%",3
307,774206179,"jsauburn",0,93.6,"P Mike Montgomery P Francisco Liriano 2B Daniel Murphy 3B José Ramírez SS Carlos Correa OF Michael Conforto 1B Ryan Zimmerman OF J.D. Martinez OF Khris Davis C Austin Barnes",NA,"Corey Seager","0.11%",0
307,774376528,"chancecrowder",0,93.6,"P Mike Montgomery P Francisco Liriano OF Aaron Judge SS Trea Turner C Gary Sánchez OF Brett Gardner OF Aaron Hicks 3B Josh Donaldson 1B Luis Valbuena 2B Jason Kipnis",NA,"Tyler Smith","0.11%",0
309,774173813,"Metro123 (1/2)",0,93.45,"P Randall Delgado P Parker Bridwell OF Aaron Judge 2B José Altuve OF Charlie Blackmon C Gary Sánchez 1B Anthony Rizzo 3B Anthony Rendon OF Brett Gardner SS Elvis Andrus",NA,"JT Riddle","0.11%",0
310,774106438,"billsdrive45",0,93.4,"P Brandon McCarthy P Randall Delgado 1B Paul Goldschmidt OF Bryce Harper SS Trea Turner C Gary Sánchez OF Cameron Maybin OF José Bautista 2B Dustin Pedroia 3B Ryon Healy",NA,"","",NA
311,774373375,"DGILBD",0,93.25,"P Michael Pineda P Jason Hammel OF Cody Bellinger OF Ian Happ OF Aaron Hicks 1B Josh Bell SS Orlando Arcia 2B Dustin Pedroia 3B Ryon Healy C Caleb Joseph",NA,"","",NA
312,774364653,"Turtle2355 (1/3)",0,93.05,"P Michael Pineda P Randall Delgado 2B José Altuve OF George Springer SS Carlos Correa 1B Luis Valbuena OF Jackie Bradley Jr. 3B Cory Spangenberg C Christian Vázquez OF Joey Rickard",NA,"","",NA
313,774396092,"Wade944",0,93,"P Mike Leake OF Cody Bellinger OF Bryce Harper 3B Nolan Arenado OF Michael Conforto 1B Joey Votto SS Asdrúbal Cabrera C Salvador Perez 2B Javier Báez P Francis Martes",NA,"","",NA
314,774334957,"Warhawk25",0,92.9,"P Jake Odorizzi P Francisco Liriano OF Aaron Judge OF Bryce Harper C Gary Sánchez 1B Joey Votto OF Khris Davis 2B Whit Merrifield 3B Maikel Franco SS Dansby Swanson",NA,"","",NA
315,774370075,"CoopPark",0,92.55,"P Mike Montgomery P Randall Delgado OF Aaron Judge 2B José Altuve 3B Kris Bryant OF Brett Gardner 1B Joey Votto OF Carlos Gómez SS Elvis Andrus C Russell Martin",NA,"","",NA
316,774145094,"PTPABS424",0,92.5,"P Sonny Gray P Chris Tillman 1B Paul Goldschmidt OF Aaron Judge 3B Manny Machado OF Ender Inciarte 2B Robinson Canó OF Eric Thames C Salvador Perez SS Orlando Arcia",NA,"","",NA
316,774266411,"Straight-Cash-Homey",0,92.5,"P Julio Teheran P Brandon McCarthy OF Cody Bellinger 2B Daniel Murphy SS Trea Turner 3B Jedd Gyorko OF Michael A. Taylor OF Brian Goodwin 1B Mitch Moreland C Evan Gattis",NA,"","",NA
318,774161398,"Little24",0,92.35,"P Michael Pineda P Josh Tomlin OF Aaron Judge OF Bryce Harper C Gary Sánchez OF Giancarlo Stanton 1B Miguel Cabrera 3B Ryon Healy SS Brandon Crawford 2B Taylor Featherston",NA,"","",NA
318,774328325,"jweinfeld214 (2/2)",0,92.35,"P Sonny Gray P Jordan Zimmermann SS Carlos Correa 1B Joey Votto C Buster Posey OF Cameron Maybin OF Giancarlo Stanton OF Andrew McCutchen 3B Ryon Healy 2B Rougned Odor",NA,"","",NA
320,774291567,"beelz (1/2)",0,92.3,"P Michael Pineda P Doug Fister 2B Daniel Murphy 1B Logan Morrison OF Corey Dickerson SS Chris Owings OF Curtis Granderson OF Brian Goodwin C Evan Gattis 3B Wilmer Flores",NA,"","",NA
321,774194063,"clovisnm58",0,92.25,"P Ervin Santana P Brandon McCarthy 1B Cody Bellinger 2B Daniel Murphy OF Mookie Betts C Yasmani Grandal OF Eric Thames OF Marcell Ozuna 3B Wilmer Flores SS Franklin Barreto",NA,"","",NA
321,774265102,"Tankbomb22",0,92.25,"P Mike Leake P Rafael Montero OF Aaron Judge OF Bryce Harper SS Carlos Correa 1B Anthony Rizzo OF Brett Gardner 3B Manny Machado 2B DJ LeMahieu C Mike Zunino",NA,"","",NA
323,774211959,"Whammy5",0,92.2,"P Jordan Zimmermann P Jake Odorizzi SS Xander Bogaerts OF Tommy Pham OF Andrew Benintendi OF Justin Upton 3B Evan Longoria 1B Lucas Duda 2B DJ LeMahieu C Evan Gattis",NA,"","",NA
324,774352871,"ltcdac",0,92.05,"P Julio Teheran P Jeremy Hellickson OF Bryce Harper 2B Daniel Murphy SS Trea Turner C Gary Sánchez OF Giancarlo Stanton 3B Josh Donaldson 1B Miguel Cabrera OF Mallex Smith",NA,"","",NA
325,774399164,"paulgosh",0,91.95,"P Jason Hammel P Doug Fister 1B Paul Goldschmidt SS Trea Turner 2B José Altuve OF Mookie Betts OF Andrew Benintendi 3B Travis Shaw OF Jackie Bradley Jr. C Salvador Perez",NA,"","",NA
326,774278601,"EDubbs24",0,91.9,"P Jake Odorizzi P Francisco Liriano OF Aaron Judge OF Bryce Harper OF Mookie Betts 1B Anthony Rizzo 3B Travis Shaw C Russell Martin 2B Dustin Pedroia SS Troy Tulowitzki",NA,"","",NA
327,774291051,"bards22",0,91.85,"P Francisco Liriano P Josh Tomlin 1B Paul Goldschmidt OF Aaron Judge SS Xander Bogaerts 2B José Altuve C Gary Sánchez OF Aaron Hicks 3B Ryon Healy OF Rajai Davis",NA,"","",NA
328,774127417,"phedog123",0,91.75,"P Jason Hammel P Mike Montgomery OF Bryce Harper C Gary Sánchez OF Ian Happ OF Avisaíl García 1B José Abreu SS Didi Gregorius 3B Matt Davidson 2B Alen Hanson",NA,"","",NA
328,774239284,"EdoubleU23 (19/20)",0,91.75,"P Jake Odorizzi P Matt Moore 1B Paul Goldschmidt 2B José Altuve OF George Springer SS Chris Owings OF Grégor Blanco 3B Alex Bregman C Evan Gattis OF Daniel Descalso",NA,"","",NA
330,774304756,"gfay63 (18/20)",0,91.45,"P Mike Leake P Zach Davies OF Bryce Harper OF George Springer SS Carlos Correa 1B Anthony Rizzo C Buster Posey OF Aaron Hicks 3B Josh Donaldson 2B Dustin Pedroia",NA,"","",NA
331,774343442,"thumpinfla",0,91.4,"P Brandon McCarthy P Randall Delgado OF Aaron Judge 3B Nolan Arenado C Gary Sánchez OF Andrew Benintendi SS Didi Gregorius 2B Brandon Drury OF Aaron Hicks 1B Mitch Moreland",NA,"","",NA
